Organization Name,Organization Name URL,Categories,Description,Full Description
Forbes Councils,https://www.crunchbase.com/organization/forbes-councils,"Business Development, Business Intelligence, Local Business, Professional Networking, Small and Medium Businesses, Social Entrepreneurship",Invitation-only organizations for senior-level business professionals.,"Forbes Councils are invitation-only communities for senior-level business professionals.  Through our selection process, we recruit and invite members not just on the basis of career success, but on their diversity of perspective and willingness to give as much as they gain. We bring these members together in communities tailored to their industry or region, so that they can connect with others best positioned to help them overcome challenges and create new opportunities. Finally, we provide members with a growing list of support benefits that help them save time and money, and a platform, CommunityVoice on Forbes.com, through which they can amplify their voices and exchange ideas. Forbes Councils are the result of a partnership between Forbes and the team behind YEC, a world-class entrepreneurship organization. Leaning on YEC’s deep understanding of community building and Forbes’ global reach and resources, Forbes Councils are communities where exceptional business owners and leaders come together with the people and resources that can help them thrive. Behind each of the world’s most successful business owners and leaders is a strong community of support. Find yours at forbescouncils.com."
FOMO Pay,https://www.crunchbase.com/organization/fomo-pay,"FinTech, Internet, Payments",FOMO Pay provides QRCode Payment Solution which enables merchants to accept a full suite of new payment methods.,"FOMO Pay is opening up vendors in Southeast Asia to cashless payments. The alternative payment platform is the first of its kind, allowing merchants to accept a full suite of digital payments including NETS Pay, VISA QR, and WeChat Pay. The company is also sitting in central bank SGQR taskforce to jointly develop a common QRCode standard for Singapore. Since 2015, clients have trusted FOMO to provide various digital payment solutions. Its team has served clients from various industries, including SPH, Starhub, TWG, MBS etc. The company is now looking for new blood to join their dynamic team, with friendly working environment and talented cohort. FOMO Pay is providing various payment product for corporate clients, such as web payment, mobile payment, payment terminal, payment link, marketplace etc. It is filling the gaps to help overseas merchants to reach out to Chinese market."
Foldaway,https://www.crunchbase.com/organization/foldaway,"Hardware, Manufacturing, Software",Foldaway aims to develop ultra-portable and low cost origami haptic interfaces.,"FOLDAWAY, aims to develop ultra-portable and low cost origami haptic interfaces. Such devices allow the user to experience an advanced level of interaction that is based on the sense of touch. The first prototype has three degrees of freedom and can interact with human fingers by tracking their motion and providing force, stiffness and texture perception. Through its unique origami manufacturing, it is the first haptic interface that folds-away when not in use. Its palm size, and thin design, makes it the ideal user interface for any portable device."
Fountain Greetings,https://www.crunchbase.com/organization/fountain-greetings-2,"E-Commerce, Fashion, Gift Card",The Best Greetings & Gifting Experience,"Fountain is on a mission to create the world’s best greeting and gifting experience and bring back the lost art of the handwritten-card. Fountain allows our customers to send a handwritten card along with a gift in under 2 minutes. We’re modernizing the greeting and gifting industry through technology and creating a service that helps make human connections more personal. Whether you want to wish your friend a happy birthday, thank Mom for being awesome, or just touch base with a client, Fountain makes it easily happen."
Fourerr,https://www.crunchbase.com/organization/fourerr,E-Commerce,Fourerr is a place where one can sell or buy microjobs online and earn rewards.,
food.de,https://www.crunchbase.com/organization/food-de,"E-Commerce, Hospitality",food.de is an online supermarket that delivers goods directly to its customers.,"food.de is an online supermarket that delivers goods directly to its customers. It was launched in 2011 and is based in Berlin, Germany."
Forebrain,https://www.crunchbase.com/organization/forebrain-2,"Consulting, Health Diagnostics, Market Research, Medical Device, Neuroscience",Forebrain is a neuromarketing research company that offers solutions on consumption neurosciences.,"Forebrain is a neuromarketing research company that offers solutions on consumption neurosciences. Created by researchers at the Neurobiology Program of the Institute Carlos Chagas Filho of the Federal University of Rio de Janeiro, Forebrain was founded in order to bring the knowledge and neuroscientific methods to market."
Fourdeg,https://www.crunchbase.com/organization/fourdeg,"Energy, Energy Storage, Information Technology, Manufacturing, Oil and Gas, Renewable Energy",Fourdeg develops a product that ensures energy savings and temperature control for water radiators heated buildings.,"Fourdeg develops a product that ensures energy savings and temperature control for water radiators heated buildings. Its team has cumulative 90 years of global consumer and infrastructure business background covering business development and management; product management, marketing, and sales; industrial, graphic, service, interaction, and user interface design; product development related to electronics, mechanics, software, wireless, internet, servers, and more; and energy and control technology collaboration with Aalto University. With its systems solution it has the ability to reduce the carbon foot print from one room, to building to town and all the way to city level. Its algorithms can secure high level of performance to the overall system with advanced diagnostic capabilities and predictive service solutions. Fourdeg was founded in 2013 and is based in Esbo, Finland."
Food.com,https://www.crunchbase.com/organization/food-com,"Communities, Cooking, E-Commerce, Food and Beverage, Food Delivery, Hospitality, Internet, News","Food.com, the third largest food site on the web, is an active social network of home cooks.","Food.com, the third largest food site on the web, is an active social network of home cooks who connect and share recipes, photos, cooking tips and food trends in real time.   Formerly known as Recipezaar, and originally as Cookpoint briefly before that, Food.com was created in 1999 outside of Seattle, Washington by two ex-Microsoft technologists. What started as an idea to connect home cooks from all over the world has grown into a daily cooking community, featuring 500,000+ user-generated recipes, 125,000+ photos and millions of reviews."
FoodBuzz,https://www.crunchbase.com/organization/foodbuzz-com,"Communities, Hospitality, Marketing, Media and Entertainment",Foodbuzz is a community of food bloggers that provides sponsored content and display advertising on social networks.,"Foodbuzz is the largest online food community and the fastest growing food property on the web, partnering exclusively with over 4,000 vetted food bloggers. Foodbuzz curates high quality blog content and offers brands a 3-fold marketing platform using blogger outreach, sponsored content and display advertising to engage with and reach their audience."
Foundation Quietroom label,https://www.crunchbase.com/organization/quietroom-label-2,"Advice, Architecture, Building Material, Business Travel, Construction, Health Care, Hospitality, Hotel, Real Estate, Real Estate Investment, Travel, Travel Accommodations","The Quiet Room® label, provides guidelines and an objective standard for the (absence of) noise pollution in hotel rooms.","The Quiet Room® label, developed in 2104 by the Dutch Knowledge Centre Sound Insulation (KGI), provides guidelines and an objective standard for the (absence of) noise pollution in hotel rooms.  The independent Quietroom Foundation grants the QR certificates and monitors the quality of the QR label and products adherence to its standards. At present, over 155 hotels in Europe have been certified and there is growing interest from the US market. Also, there is huge interest among travellers who can find out about certified hotels through the foundation's website, www.quiethotelroom.org/en The product is the Quiet Room® label and a certification service for hotels that wish to acquire the label. However, in our marketing we do no solely target hotels, we also target travellers who are looking for quiet hotel rooms. Through our website www.quiethotelroom.org, which has a rapidly growing audience, we promote the QR-label and provide information on the QR-certified hotels and related topics. It is through this online channel that we believe we can establish a link between your and our services. We don't need to tell you how important traveller's reviews have become to the success of hotels; it is also a well-known fact that noisy hotel rooms top the list of hotel guest's complaints. Now that a substantial number of hotels have acquired the label and more will do so in the course of 2017, we want to extend our online services by providing a dedicated search and booking engine for QR-certified hotels on our website."
FoodStantly,https://www.crunchbase.com/organization/food-stantly,"Consumer, E-Commerce, Food and Beverage, Food Delivery, Grocery, Logistics, Marketplace",Foodstantly is a mobile-web marketplace for food and Farm Produce.,Foodstantly is a mobile-web marketplace for food and Farm Produce .It enables Farmers and Food Traders to connect and sell online directly to Consumers and Businesses .As well as support them with last mile Hyperlocal delivery
Formetrix,https://www.crunchbase.com/organization/formetrix,Information Technology,Formetrix is a provider of technology services.,Formetrix is a provider of technology services.
Four Eyes Club,https://www.crunchbase.com/organization/four-eyes-club,"Customer Service, E-Commerce, Eyewear",Revolutionary Optical and Sunglass Online Store,Four Eyes Club is India's first and only vertically integrated eyewear store.  They design and work with manufacturers to produce top design and quality eyewear all at a very reasonable price point. Their customers loves them because they bring quality and style to their face without breaking their wallets.
FollowUp,https://www.crunchbase.com/organization/followup-cc-2,"SaaS, Sales",FollowUp for email is a lightweight productivity suite.,"FollowUp for email is a lightweight productivity suite that keeps your conversations and tasks from slipping through the cracks. Set perfectly timed reminders that arrive at the top of your inbox, right when you need them."
FortePhest,https://www.crunchbase.com/organization/fortephest,"AgTech, Biotechnology",FortePhest is a biotech start-up exploring the groundbreaking potential of H‐Forte technology to combat herbicide‐resistant weeds.,"Founded in 2017, FortePhest is a biotechnology company focusing on crop protection. The Company develops innovative products to control both regular weeds and weeds which are resistant to herbicides. They do this mainly by exploring novel Mechanisms of Action (MOA) discovered in plants. Inspired by natural plant protectors, our products are intended to provide potent, environmentally friendly, and sustainable solutions that may eventually improve crop productivity. Our technology is based on research of world-class teams of scientists from Cornell University, The Weizmann Institute of Science and the Hebrew University of Jerusalem."
Football Ventures,https://www.crunchbase.com/organization/football-ventures,Sports,Football Ventures was founded by Michael Douglas Smith and is wholly owned by midosm. ,"Football Ventures was founded by Michael Douglas Smith and is wholly owned by midosm. The assets of Football Ventures were sold at the end of 2012. Today, Football Ventures still has an active bond in the market and will be a placeholder until that bond expires in 2015."
Food & Wine,https://www.crunchbase.com/organization/food-wine,"Tourism, Travel, Wine And Spirits","Food and Wine Magazine is a print and online publication that specializes in food, travel, and entertainment.",
Folium Optics,https://www.crunchbase.com/organization/folium-optics,"Hardware, Manufacturing, Robotics, Software",​Folium Optics was founded in November 2013 by Steve Kitson and John Rudin.,"Folium Optics was founded in November 2013 by Steve Kitson and John Rudin, beginning life from offices within an incubator space in Bristol Robotics Lab, at the University of the West of England. After just two years, they’d outgrown their initial facilities and moved to their own industrial unit in Thornbury, Bristol, where they continue to grow and thrive. They now have their own advanced cleanroom for developing their display technology and making prototype devices, with an evolving team of scientists, engineers, project and commercial managers."
Foloosi,https://www.crunchbase.com/organization/foloosi,FinTech,Foloosi facilitating consumer-to-business card payments by enabling the business to display QR code to scan & pay.,"Foloosi (https://www.foloosi.com) is a UAE Fintech startup facilitating consumer-to-business card payments by enabling the business to display QR code, Payment Link and API integrations for the customer to scan & pay. Foloosi offers a complete technically advanced digital solution, which seamlessly connect consumers with businesses to provide actionable flow of events resulting in a fast and secure way of making payments based on QR codes and card networks. Foloosi enables businesses in the UAE to get paid using QR code technology without the need of POS machine or any additional hardware. While the payment is deducted instantly, the merchant can also receive instant payment notifications. Our Product :  QR Code Technology – QR code to accept payment anywhere Payment Link – Create, share and send links to collect payment Payment Gateway – Accept payment on your website/apps Subscription – Collect recurring subscription payments"
Foodzie,https://www.crunchbase.com/organization/foodzie,"E-Commerce, Handmade, Local, Organic Food",Foodzie is an online marketplace that allows individuals to discover and buy food directly from artisan producers.,"Foodzie is an online marketplace where consumers can discover and buy food directly from small artisan producers. The Foodzie technology makes it simple for small producers to sell their products online and aggregate all these products within a marketplace that makes it easy for ""foodies"" to discover the very best food. They focus on gourmet foods and organic health foods."
Forest Chemical Group,https://www.crunchbase.com/organization/forest-chemical-group,"Biotechnology, Chemical, Manufacturing, Nanotechnology",Forest Chemical Group is a manufacturer and distributor of hot melt adhesives for the industrial adhesives sector.,"FOREST CHEMICAL GROUP is a leader in the field of hot melt adhesives, air defined by its innovative, dynamic and enterprising that offers clear and simple solutions to most complicated aspects of industrial adhesives sector."
FormFactor,https://www.crunchbase.com/organization/formfactor,"Manufacturing, Mobile, Semiconductor","FormFactor is a global leader in advanced wafer probe card technology and design, FormFactor is a mission critical supplier to top","FormFactor is a global leader in advanced wafer probe card technology and design, FormFactor is a mission critical supplier to top chipmakers, enabling them to bring next-generation devices to market. Its aggressive investment in 3D MEMS development and production puts FormFactor among the top 10 global MEMS manufacturers, where the company is further distinguished by innovation that is transforming and reducing the overall cost of semiconductor test."
Fotoshkola,https://www.crunchbase.com/organization/fotoshkola,"Education, Information Technology, Photography",Fotoshkola is a privately-held company that operates in the Photography & Photo Services industry.,"Fotoshkola is a privately-held company that operates in the Photography & Photo Services industry. Fotoshkola headquarters are located in Moscow, Russian Federation."
Fontself,https://www.crunchbase.com/organization/fontself,"Apps, Education, Internet, Software",Fontself is a platform to create fonts in minutes right from illustrator CC.,Fontself is a platform to create fonts in minutes right from illustrator CC.
fone.do,https://www.crunchbase.com/organization/fone-do,"Business Intelligence, Communications Infrastructure, Telecommunications",fone.do is a cloud-based phone system for small businesses to manage their communications.,fone.do is a cloud-based phone system for communication within small businesses. It was launched by Moshe Maeir.
Focal Point Energy,https://www.crunchbase.com/organization/focal-point-energy,"Energy, Manufacturing, Solar",Focal Point Energy is the leading manufacturer of solar boilers for commercial and industrial customers in the United States.,Focal Point Energy manufactures a light-weight solar hot water and steam generator for industrial process heating applications.
FoodyDirect,https://www.crunchbase.com/organization/foodydirect,"Consumer, Delivery, Marketplace",FoodyDirect is an online marketplace that enables users to find and get food delivered to their home or office.,FoodyDirect is an online marketplace bringing the most delicious food in the country right to the doorstep of your home or office.
for[MD],https://www.crunchbase.com/organization/for-md,"Health Care, Medical",for[MD] offers private communities for medical alumni associations and professional societies to increase physician engagement.,"for[MD] provides private communities to medical alumni associations and professional societies to increase physician engagement.  In turn, their physician members can access experts and colleagues by subspecialty to crowdsource solutions to patient care, research, and practice management challenges. for[MD] is in use by over 90 organizations at some of the top medical schools in the country."
FoxNext,https://www.crunchbase.com/organization/foxnext,"Gaming, Location Based Services",FoxNext is the new gaming and VR division of 21st Century Fox.,"FoxNext is the new gaming and VR division of 21st Century Fox. FoxNext is driving immersive, next generation entertainment experiences in the areas of virtual and augmented reality, mobile, console/pc games and location-based entertainment across Twentieth Century Fox Film and Fox Networks Group."
Forus Bank,https://www.crunchbase.com/organization/forus-bank,"Banking, Business Development, Financial Services",Forus Bank is a financial services provider that owns and operates a micro and small businesses lending bank.,"Forus Bank is a financial services provider that owns and operates a micro and small businesses lending bank. It provides financial services for private entrepreneurs and small businesses in the Russian Federation. Forus Bank is headquartered in Nizhni Novgorod, Nizhegorod."
FounderNest,https://www.crunchbase.com/organization/foundernest,Internet,FounderNest is an investor matchmaking platform designed to assist in raising funds for companies.,"Currently on stealth mode, FounderNest’s mission is to leverage artificial intelligence to connect investors and founders in an efficient, transparent and democratic way."
FolioMetrix,https://www.crunchbase.com/organization/foliometrix,"Finance, Market Research",FolioMetrix is an investment management research company,"FolioMetrix is an investment management research company and the creator of a diverse line of tactical asset management products and distribution programs for Portfolio Managers, Financial Advisors and Institutions across the United States. Over the past two decades, FolioMetrix’s executives have worked with a diverse network of industry thought leaders to evolve how portfolios are diversified and delivered. FolioMetrix was founded in 2009. In 2013, after dedicating more than four years of research and development, the Company launched RiskX one of the industry’s first liquid ’40 Act mutual fund platforms totally dedicated to tactical asset management."
ForceNock,https://www.crunchbase.com/organization/forcenock,"Cyber Security, Information Technology",Zero Configuration Web Application Security Solution ,"ForceNock developed a fully autonomous web application security solution that replaces existing WAF, API & bot mitigation solutions. The system frees the security teams from managing endless configurations and rules while continuing to maintain the highest level of security. In addition to the fully autonomous negative-security, fully automated or semi-automated positive security is provided in tandem with OWASP top 10, API logic abuse, layer 7 DoS, and protection from a variety other attacks. The ForceNock solution offered as a virtual appliance, AMI or Docker for private cloud deployment as a reverse proxy or plug-in to Nginx / Apache."
Foxize School,https://www.crunchbase.com/organization/foxize-school,"Education, Professional Services",Foxize School is the first school of advanced business that provides customized training through a refined selection of teachers.,"Foxize School is the first school of advanced business that provides customized training through a refined selection of teachers at an affordable price. We offer high quality concrete and people who want to upgrade professionally, but in a flexible manner appropriate to their needs, schedule and budget knowledge. To achieve this, we use the advantages provided by technology adapting the training to the interests of our students offer, putting them in touch with working professionals who can learn practically in contact classes in their city."
Forkyoo,https://www.crunchbase.com/organization/forkyoo,"Cooking, E-Commerce, Restaurants","Forkyoo is an online marketplace that brings you chef-prepped, ready-to-cook meal kits from your favorite local restaurants.","Forkyoo acts as a business-to-consumer marketplace (or “venue”) that allows users who comply with Forkyoo's policies to offer, sell and buy recipe kits within a fixed-price format. Forkyoo is not directly involved in the transaction between buyers and sellers.  As a result, Forkyoo has no control over the quality, safety, morality or legality of any aspect of the items listed, the truth or accuracy of the listings, the ability of sellers to sell items or the ability of buyers to pay for items. Forkyoo does not pre-screen users or the content or information provided by users. Forkyoo cannot ensure that a buyer or seller will actually complete a transaction."
Foodie,https://www.crunchbase.com/organization/foodie,Hospitality,"Foodie is an online platform that allows its users to browse, sort, and search over a million hand-selected recipes and restaurants.","Foodie is an online platform that allows its users to browse, sort, and search over a million hand-selected recipes and restaurants. It works seamlessly across portable devices, so its users’ collections are with them when they need those collections. Users have the ability to obtain shopping lists for the grocery store and restaurant addresses for a night out through this platform. The foodie recipes app for iPad and iPhone brings users a new cookbook of 40 seasonal favorites each month. This app is free in the iTunes store. Foodie was launched in 2011."
FoxyTasks,https://www.crunchbase.com/organization/offiserv,"B2B, Cloud Computing, Project Management, SaaS, Software","FoxyTasks engages your team and customers, smoothing the way for get your projects done.","For Marketing Managers having troubles with deadlines and freelancers,  FoxyTasks is the SaaS platform for forming and managing creative projects."
Fongwell,https://www.crunchbase.com/organization/fongwell,"Analytics, Internet, Retail, Software",Fongwell is a retail analytics tool company.,Fongwell is a retail analytics tool startup based in Guangzhou China.
Forsway,https://www.crunchbase.com/organization/forsway,"Mobile, Satellite Communication",Forsway is a satellite systems designer that creates end user low cost hybrid satellite/terrestrial telecommunication terminals.,"Forsway is a satellite systems designer focused on the creation of end-user low-cost hybrid satellite / terrestrial telecommunication terminals. Forsway's leadership in innovation responds to one key requirement: cost efficiency in the provision of broadband services to end users. Forsway coordinates the development of new products with the key players in the satellite and wireless industries (including the European Space Agency, some of the major Satellite Service Providers and Telco operators worldwide), applying the state of the art in technology to enable the generation of high tech / low cost end user terminals that can maximize the use of both satellite and terrestrial networks capacity: support for DVB-S2 waveforms (including VCM and ACM outbound modes, up to 16APSK demods), support for 3G WCDMA/HSPA (also GPRS/EDGE). Forsway’s mission remains to contribute in the bridging of the digital divide by applying maximum efficiency in the operation of hybrid terrestrial/satellite telecommunication networks."
Foreign Autoworks,https://www.crunchbase.com/organization/foreign-autoworks,Automotive,Foreign Autoworks is a company provides automobile and light truck repairs services .,
Food Lion,https://www.crunchbase.com/organization/food-lion,Retail,"Food Lion is a easy, fresh and affordable grocery store for you can count on Food Lion every day.",
