Organization Name,Organization Name URL,Categories,Description,Full Description
Novihum Technologies,https://www.crunchbase.com/organization/novihum-technologies,"Agriculture, AgTech, Environmental Engineering, Renewable Energy","Novihum Technologies is the developer of fertile humus, a fertilizer for rich soils to encourage plant growth.","In the 2000's, scientists at the TU Dresden in Germany invented a revolutionary natural soil enhancer based on lignite. In 2012 Novihum Technologies was founded to bring this great product to the market. With the help of venture capital partners, the European Union, and an international team  of soil, plant, and production experts, Novihum Technologies built its first production plant in Dortmund, Germany to produce NOVIHUM on an industrial scale in 2016. Novihum Technologies has about 30 employees and is still growing. They successfully serve customers in Europe, North America and elsewhere."
North Carolina Biotechnology Center,https://www.crunchbase.com/organization/north-carolina-biotechnology-center,"Biotechnology, Life Science, Non Profit",North Carolina Biotechnology Center is a private company that works with university researchers in the field of biotechnology.,"The North Carolina Biotechnology Center is a private, non-profit corporation funded by the N.C. General Assembly to strengthen biotechnology research, business and education statewide. The Center is not a site for laboratory research; it works to support job creation in the biotechnology industry."
Novopyxis,https://www.crunchbase.com/organization/novopyxis,"Biotechnology, Health Care, Medical, Therapeutics",Novopyxis is a biotechnology company dedicated to the development of therapeutics and medical devices.,"Novopyxis is an award-winning biotechnology company dedicated to the development of therapeutics and medical devices. Novopyxis’ flagship drug was developed using in-house proprietary mathematical algorithms and has been validated across several different in vitro, ex vivo and in vivo models. It activates a key anti-inflammatory receptor called the AT2R and is both cardioprotective and neuroprotective. Their therapeutic was recently awarded an orphan designation for ""Pediatric Cardiomyopathy"" from the FDA.  Droplette was recently spun out from Novopyxis (www.droplette.io) and is focused on development of a patented medical device for delivery of large molecules, DNA/RNA, and proteins deep through skin, tissue, and cells. They are currently partnered with Leo Pharma for development of their device for medical dermatology applications and have won several awards:"
"Nota, Inc.",https://www.crunchbase.com/organization/nota,"Collaboration, Developer Tools, Mobile, Mobile Apps","Makers of Gyazo, an app for seriously easy sharing of screen caps and GIFs and Scrapbox, a new style of note-taking for teams.","Nota, Inc., is the company behind Gyazo, the highly popular and rapidly growing cloud-based screen capture and sharing application. Gyazo allows users to instantly share full and partial screenshot with a custom URL from a PC/Mac desktop app. Gyazo has grown rapidly to a worldwide user base of more than 8 million through viral user acquisition. The company’s aim is to become a truly global company yet with uniquely Japanese roots."
Nordic API Gateway,https://www.crunchbase.com/organization/nordic-api-gateway,"Banking, Information Technology",Nordic banks to create simple solutions for the future. Explore Nordic API Gateway today.,"Nordic API Gateway the infrastructure of the future. they are building the foundation on which every company can innovate quickly and safely without having to worry about whether the grounds will hold. It's an API that connects to any Nordic Bank -incredibly simple, fast and developer friendly."
NovaDigm Therapeutics,https://www.crunchbase.com/organization/novadigm-therapeutics,"Biotechnology, Medical Device, Therapeutics",NovaDigm Therapeutics develops vaccines that protect patients from contracting fungal and bacterial infections.,"NovaDigm Therapeutics, Inc. develops vaccines to protect patients from fungal and bacterial infections. Its products include NDV-3, a vaccine to demonstrate preclinical efficacy in reducing the severity of disease caused by fungal and bacterial pathogens; and Als3, an antigen vaccine, which provides protection against systemic and mucosal candidal infections. NovaDigm Therapeutics, Inc. was founded in 2005 and is based in Grand Forks, North Dakota."
Novast Laboratories,https://www.crunchbase.com/organization/novast-laboratories,"Biotechnology, Pharmaceutical, Therapeutics","Novast Laboratories is a specialty pharmaceutical company developing, manufacturing and commercializing therapeutic products.","Novast Laboratories is a specialty pharmaceutical company based in both the United States and China, and focused on the development, manufacturing and commercialization of high quality products for global markets. It is led by a management team with extensive scientific and managerial experience, and successful track record of development of NDA and ANDA products at the U.S. -based global pharmaceutical companies. Novast has established, implemented, and maintained all its scientific and quality standards and systems according to the requirements of the US and EU. More importantly, it has built a diligent and dependable work culture with intellectual property protection, financial accounting, environmental, safety standards, and highest integrity and ethics."
Noble Biomaterials,https://www.crunchbase.com/organization/noble-biomaterials-inc,"Biotechnology, Fitness, Health Care, Wellness","Noble Biomaterials develops, manufactures, sells and markets advanced antimicrobial technologies designed to manage bacterial contamination.","Noble Biomaterials, Inc. is a global leader in bacterial management solutions. Noble develops, manufactures, sells and markets advanced antimicrobial technologies designed to manage all forms of bacterial contamination for medical, defense, industrial and consumer markets.  Noble's core technology, X-STATIC, is a proprietary silver-based antimicrobial solution used for mission critical applications, including advanced woundcare, infection control and odor elimination. Noble has more than 200 world-class licensees, including Johnson & Johnson, NASA, 3M, US Special Operations Command, adidas and others."
noplag.com,https://www.crunchbase.com/organization/noplag-com,"EdTech, Education, Higher Education",Online plagiarism checker with AI engine!,"Noplag@Solo (solo.noplag.com) - its version of Noplag for individual use, all the professional tools, that before were available only to higher education establishments plagiarism checking software is now available to everyone with Noplag.com Noplag@Edu (edu.noplag.com) - Learning Management System for schools, colleges and universities. Create classes & Assignments, Add Instructors & Students, Check papers online for plagiarism, comment & grade them online. Safely upload your database to your Noplag account or connect via API and check against your own database.  Noplag@Web (web.noplag.com) - protect your website content & check if anyone using your content elsewhere. Auto monitoring, similarity detection auto alerts, noplag protection badges and certificate of the content ownership. Complete solution for website owners!  - Noplag@Co (co.noplag.com) - writing task management system for teams and business. Create your company account, add users, assign writing tasks and check them for plagiarism online within Noplag account. Checking writing tasks made easy by Noplag!"
Nova Satra Dx,https://www.crunchbase.com/organization/nova-satra-dx,"Genetics, Health Diagnostics, Medical",Nova Satra Dx is a molecular diagnostics company.,"Nova Satra Dx is a molecular diagnostics company headquartered in Singapore. The company is committed to empowering patients and physicians through the research, development and commercialisation of novel blood based diagnostic tests.  These tests provide rapid and accurate detection of cancer using Asian-specific epigenetic biomarkers. Based on its clinically validated NovoTect™ technology developed by the University of Oxford, Nova Satra’s diagnostic tests can detect and identify changes in gene expression which are linked to cancer.  The company is developing a pipeline of tests for breast, colon, prostate, stomach and lung cancers. For more information, please visit www.novasatra.com"
North Technologies,https://www.crunchbase.com/organization/north-technologies,"File Sharing, Internet, Service Industry",A startup in the consumer internet space,"North is a startup building other startups. First, the company rolled out Tiiny, a photo-sharing app. Its second project, Watchville, helps people discover luxury watches."
Novocare,https://www.crunchbase.com/organization/novocare,"Medical, Mobile",Novocare is a medical equipment research and development company,"Shenzhen Nuokang Medical Equipment Co., Ltd. is a high-tech innovative enterprise engaged in R&D and manufacturing of intelligent medical equipment such as telemedicine, mobile and non-disruptive equipment, and wearable equipment (digital medical and mobile health). Nuokang Medical core team members have rich experience in medical product development and sales; they have the modern management experience of international companies, have insight into the cutting-edge technology of the industry, and have a deep understanding of the local market."
Norvergence,https://www.crunchbase.com/organization/norvergence,"Education, Environmental Consulting, Pollution Control, Social Impact, Sustainability","Norvergence is team of environmentalists. Norvergence is a voice against environmental issues. We at Norvergence, making people aware about.","Norvergence is a non-profit organization that works to bring attention to pressing environmental issues. Norvergence is playing a crucial role in developing a society where every individual should know his/her responsibility towards nature. With creative programs and more online resources, the team Norvergence is trying very hard to aware the people about how to adopt a nature-friendly life cycle. Further, Norvergence promotes tactics or solutions that will help to create a sustainable society. The members of the team empower indigenous people by equipping them with education and training."
Novosol,https://www.crunchbase.com/organization/novosol,Telecommunications,Novosol is a Mobile Media Company.,"To create and market globally a personalized, superior (i.e. video, audio-visual), convenient (i.e. mobile, interactive), safe (permissioned, secure, PDPA compliant) customer engagement platform for merchants/brands that scales across marketing/business uses, and geographies so as to transform not only the customer/consumer communications but also brand/merchant operations while enhancing customer experience."
NONO,https://www.crunchbase.com/organization/nono,"Biotechnology, Health Diagnostics, Medical",NoNO is engaged in the development of pharmaceuticals for the treatment of common health disorders.,"NoNO Inc. is a private, clinical-stage biotherapeutics company dedicated to the research, development and commercialization of pharmaceuticals for the treatment of common health disorders with unmet needs, including stroke, traumatic brain injury, and pain."
Nobel Hygiene,https://www.crunchbase.com/organization/nobel-hygiene,"Baby, Consumer Goods, E-Commerce, Health Care, Retail, Shopping","Nobel Hygiene is a one-stop-shop for personal hygiene products, including diapers and pads meant for babies, mothers and adults.","""NOBEL HYGIENE PVT. LTD."" is a One-Stop-Shop for Personal Hygiene Products meant for the entire family. There product range includes Diapers & Pads meant for Babies, Mothers and Adults in a family. They have a good presence and market share in the Personal Care Market in India, with brand names FRIENDS & TEDDYY which are synonymous to Quality and Reliability. They are based in Mumbai, INDIA and have a presence all over the country through our Network of Stockists, Dealers & Retailers."
Nordkap,https://www.crunchbase.com/organization/nordkap,"Finance, Financial Services, FinTech",Nordkap is a cloud-based treasury platform.,"Nordkap is a cloud-based treasury platform. Nordkap doesn't require local installation and in combination with its user-friendly interface, this creates a cost and time efficient process for handling debt management. In the near future, Nordkap clients will be able to benchmark their financials and key ratios with comparable organizations."
Nodality,https://www.crunchbase.com/organization/nodality,"Biotechnology, Clinical Trials, Health Diagnostics",Nodality develops biologically-informed clinical treatments for patients with cancer and autoimmune diseases.,"Nodality, Inc., a biotechnology company, discovers and develops personal diagnostics characterizing cell signaling pathways in defined cellular sub-populations of malignant and normal cells from individual patients. The company focuses on hematological malignancies and autoimmune disorders. Nodality, Inc. was incorporated in 2003 and is based in San Francisco, California with an additional office in Franklin, Tennessee."
Nourish,https://www.crunchbase.com/organization/nourish,"Email Marketing, Information Technology, Internet",Nourish offers a service that allows its users to convert RSS feeds into automated email newsletters.,Nourish is a next generation newsletter service which allows you to convert RSS feeds into an automated email newsletter you can e-mail to anyone! You can create multiple campaigns and easily manage your subscribers. Nourish can provide custom designed templates just for you.
Nora Therapeutics,https://www.crunchbase.com/organization/nora-therapeutics,"Biotechnology, Health Care, Medical Device",Nora Therapeutics is a specialty biopharmaceutical company developing therapeutics to address clinical unmet needs in reproductive medicine.,"Nora Therapeutics is a specialty biopharmaceutical company focused on developing therapeutics to address clinical unmet needs in reproductive medicine. Nora’s lead compound, NT100, is a novel treatment being studied to improve pregnancy success rates and outcomes for women who have undergone multiple unsuccessful in vitro fertilization (IVF) procedures. NT100 is a novel biologic agent similar to a naturally occurring protein in the female reproductive tract. NT100’s mechanism of action may better enable embryo implantation and pregnancy maintenance by optimizing maternal-fetal immune tolerance."
Nouri Life,https://www.crunchbase.com/organization/nouri-life,"Biotechnology, Fashion, Fitness, Health Care, Non Profit",Nouri is for men and women around the world who believe in increasing their mental and physical health.,Nouri is for men and women around the world who believe in increasing their mental and physical health.
North Carolina School of Science & Mathematics,https://www.crunchbase.com/organization/north-carolina-school-of-science-mathematics,Education,"North Carolina School of Science & Mathematics is a two-year, public residential high school.","North Carolina School of Science and Mathematics is the nation’s first public residential high school focused on science, technology, engineering, and math. they challenge and inspire talented students from across North Carolina through a residential campus, online offerings, and summer STEM enrichment programs."
Nom,https://www.crunchbase.com/organization/nom-live,"Cooking, Food and Beverage, Video, Video Streaming","Nom is a community for food lovers to create, share and watch their favorite stories in real-time.","Nom lets anyone host professional cooking, creative and DIY shows, and tap in to our network of makers, creators and chefs. Join in the action on https://nom.com - watch shows and share your inspiration in photos, videos and GIFs. When you go live, your subscribers will be notified, and they can be invited to stream alongside you with the click of a button. You can even collaborate with a team of creators in building your live experience."
NovoRoll,https://www.crunchbase.com/organization/novoroll,"Ad Network, Advertising, Marketing, Video Advertising","NovoRoll helps publishers, SSPs, and ad networks better monetize their traffic by introducing high paying out-stream video formats.","NovoRoll is a leading advertising technology company, specializing in delivering cross-platform video monetization and advertising solutions. The company empowers hundreds of the world's leading publishers, SSPs, and ad networks to easily distribute video ads to any device and ad format. NovoRoll is headquartered in San Francisco, CA with offices in Seattle, Tel-Aviv and eastern Europe."
Novel Therapeutic Technologies,https://www.crunchbase.com/organization/novel-therapeutic-technologies,"Biotechnology, Pharmaceutical, Therapeutics",Novel Therapeutic Technology develops practical drug delivery systems.,"Novel Therapeutic Technology Inc. (NTT) is a leading pioneer in the development of sophisticated and practical drug delivery systems. NTT’s Ethosome technology provides the means to significantly enhance drug penetration of topical delivery applications, exponentially increasing therapeutic efficiency. With worldwide recognized drugs combined with NTT know-how, Pharmaceutical companies are able to introduce new and better drugs to the market, thus greatly reducing side effects, improving patient compliance, and increasing the patient's quality of life."
Nordic Automation Systems,https://www.crunchbase.com/organization/nordic-automation-systems,"Industrial Automation, Internet of Things",Nordic Automation Systems (NAS) is an industrial automation development company.,"Nordic Automation Systems (NAS) is an industrial automation company. We believe in the world with precise data and less tedious repetitive manual tasks. We create sensor technologies, data analysis and monitoring solutions. LoRa® technology enables us to provide end-to-end LoRaWAN™ - smart metering, smart monitoring, smart city and industrial IoT applications. NAS has about 25 employees in it's Norwegian and Estonian offices and customers in every continent."
Novatek,https://www.crunchbase.com/organization/novatek,"Infrastructure, Manufacturing, Product Search",Novatek has focused on finding innovative solutions to the world’s biggest challenges.,"From its inception, Novatek has focused on finding innovative solutions to the world’s biggest challenges. Dr. H. Tracy Hall founded the company in 1955, a year after his invention of man-made diamonds.  Over the last five decades, the company has grown into a modern Edison labs. It has created, refined, patented, and licensed hundreds of groundbreaking innovations leading to billions of dollars in revenue."
NorthPage,https://www.crunchbase.com/organization/northpage,"Enterprise Software, SEM",NorthPage provides a cloud-based digital marketing optimization platform for enterprise marketing organizations.,"NorthPage Inc. provides a cloud-based digital marketing optimization platform that enables frictionless performance benchmarking, competitive analysis, and best-practice guidance for enterprise marketing organizations. Its solutions enable optimization of Websites, e-commerce sites, mobile marketing, social media, search engine marketing, content marketing, and e-retail programs. The company serves retail, financial services, consumer product, pharmaceutical, and technology companies. NorthPage Inc. was founded in 2007 and is based in Southbury, Connecticut."
Novostia,https://www.crunchbase.com/organization/novostia,Medical Device,Novostia is a privately held medical device company.,"Novostia is a privately held medical device company incorporated in 2017 in Microcity Neuchâtel, Switzerland, developing an innovative artificial heart valve, designed for patients of any age, including children."
Noteleaf,https://www.crunchbase.com/organization/noteleaf,"Events, Meeting Software, Mobile",Noteleaf designs and develops a mobile application that acts as a contact information aggregator for Gmail and Google Calendar.,"Noteleaf helps you be prepared for any meeting. By integrating with your Google Calendar and recognizing the names of the people you're going to be meeting with, Noteleaf is able to push information about who you're going to meet, right before you meet them."
NoviSign,https://www.crunchbase.com/organization/novisign,"Advertising, Android, Broadcasting, Digital Signage, Mobile, SaaS, Software",NoviSign provides social interactive digital signage.,"NoviSign is a cloud-based software platform that enables users to create, manage and broadcast rich, engaging digital content – as easy as drag and drop— at affordable prices. Our vision is to be the gold standard broadcast platform enabling SMBs’ to broadcast their message in their own businesses, creating an open-exchange and local business networks around the world."
Noho,https://www.crunchbase.com/organization/noho,"Cloud Computing, Internet of Things, mHealth",Noho allows people suffering from lymphedema to reduce dynamically their lymphedema whenever and at any time.,"Change life of people suffering from lymphedema.   Up to now patients have to rely for their entire life on a weekly treatment based on multi-layer compression bandage applied by specialized practitioner. The efficiency of the application is highly dependent on the level of experience of the practitioner.   Noho allows people suffering from lymphedema to reduce dynamically their lymphedema without the need of a third party allowing them to be free from others, manage social stigma and save money. Our product allows the self-treatment of lymphedema everywhere and anytime while the practitioner keeps an eye.   The efficiency of our product has been clinically tested on various patients.   The product is the result of a close collaboration between the Ecole Polytechnique de Bruxelles and the Clinique de Lymphologie de Bruxelles (CHU Saint-Pierre, University Hospital, Brussels). The Clinique is treating more than 1 000 lymphedema per month. Innoviris, the Brussels Institute for Research and Innovation, has financially supported the development of the product.   Let people enjoy life again."
Nongfenqi,https://www.crunchbase.com/organization/nongfenqi,"Agriculture, Farming, Financial Services",Nongfenqi is a rural internet finance services platform,"Nongfenqi, a rural internet finance services platform.Run by Nanjing Nongfenqi E-Commerce Co. Ltd., provides installment payment services to large farming groups and collaborative communes on their agricultural equipment purchases. The company has provided services to 20,000 clients so far, the report added."
Novate Medical,https://www.crunchbase.com/organization/novate-medical,"Biotechnology, Health Care, Hospital, Manufacturing, Medical, Medical Device","Novate Medical is a development stage medical device company in Galway, Ireland.","NOvate Medical Technologies is a New Orleans-based medical device development company, focused on commercializing high-quality, low-cost, and sustainable medical products while addressing critical global health needs. NOvate’s first product offering, InfaClip, previously known as SafeSnip, is a patented disposable plastic obstetric device that simultaneously cuts, clamps, and shields the infant, mother, and birthing attendant from infection, aimed at reducing maternal and neonatal mortality in developing countries."
Nomadesk,https://www.crunchbase.com/organization/nomadesk,"Cloud Computing, Enterprise Software, File Sharing, SaaS",Business File Sharing and Synchronization,"Nomadesk is a European SaaS company, founded in 2004 and focused on Business File Sharing & Synchronization technology.  We are leading developers of cloud software for sharing and synchronizing digital documents, allowing foremost business users to edit, share, synchronize and secure files from anywhere – online and offline! Our company maintains datacenter facilities in Europe (Frankfurt, Amsterdam) and USA (Asheville – NC) for our European and American customers, respectively. ​ Nomadesk mainly targets resellers, service providers and system integrators, who offer the Nomadesk solutions to their clients – usually under a proprietary name, or brand. ​ Nomadesk is part of UnifiedPost, an international BPaaS provider of integrated business process optimisation solutions including complete document delivery and processing solutions, complemented by payment, financial supply chain, credit management and secure e-identity solutions."
NOW Bike Taxi,https://www.crunchbase.com/organization/now-bike-taxi,"Apps, Delivery",Bike taxi and Delivery App (Food/B2B ) delivery app,"NOW is a mobile application that enables its users to obtain on-demand transportation services. The application provides on-demand bike and taxi delivery services to its users. It allows them to select the ride, pickup location, and drop-off location. In addition, it provides its users with e-receipts after the delivery has been completed. NOW was launched in 2015 and is based in Uttar Pradesh."
