Organization Name,Organization Name URL,Categories,Description,Full Description
Zycus,https://www.crunchbase.com/organization/zycus,"Analytics, Enterprise Software, Procurement, SaaS",Zycus offers a full suite of procurement performance software that delivers spend management solutions.,"Zycus has evolved its portfolio to a full suite of Procurement Performance Solutions and continues to deliver spend management solutions that are world renowned for delivering an accelerated return on investment through superior user adoption creating maximized savings. Zycus' procurement solution suite is built from the ground up combining cutting-edge technology and domain expertise, enabling higher performance and sustainable value to organizations worldwide. Zycus provides procurement solutions globally to more than 150 leading Fortune 1000 customers that consider procurement management software, processes and technology strategic to their competitive advantage. Zycus' procurement solutions automate and streamline the processes of Spend Analysis, eSourcing, Contract Management, Supplier Management, Financial Savings Management, and Procure-to-Pay. Login to www.zycus.com for more details."
Zylun Staffing,https://www.crunchbase.com/organization/zylun-staffing,"Digital Marketing, Software, Staffing Agency",Zylun helps companies compete in the global marketplace by connecting them to overseas talent.,"Zylun’s mission is to help small- and medium-sized enterprises take advantage of a highly skilled global workforce in a simple and cost effective way. We help companies flexibly hire a staff overseas comprised of developers, designers, Internet marketers, managers, and customer service representatives. Zylun takes pride in not only providing simple and effective services, but also ensuring dedicated employees to fit our clients’ exact needs. Our company allows you to maintain your focus on your business’ core competencies by providing you with an experienced offshore staff to handle your company’s administrative IT, design, SEO, data entry, and other needs. Unlike many offshore staffing firms, Zylun is an American owned and operated company headquartered at 210 North 1200 East, Suite 101, Lehi, Utah 84043, with American management heading its offshore operations. Zylun is your long-term partner in outsourcing."
Zyncro,https://www.crunchbase.com/organization/zyncro,"Blogging Platforms, Cloud Computing, Enterprise Software, Private Social Networking","Zyncro is a social business platform facilitating communication, collaboration and file management of businesses.","Zyncro is your Enterprise Social Network A space for internal collaboration and communication, file management, tasks, contacts... all in a single platform. Integrated with all the company's corporate management systems, with complete personalization and customization options, including commercialization as a white label product, available as a cloud-hosted (public or private) or on-premises solution. ***  Zyncro is an Enterprise Social Network, a private work environment for sharing information confidentially and securely, containing a social microblogging system, a document repository, a task manager, and a professional contact agenda.  Zyncro integrates with the leading business management tools:   *SharePoint   *ERPs, such as SAP   *BI systems (Pentaho, Google Analytics) and CRMs   *Project management tools, like Doolphy   *Google Apps: Gmail, Calendar and Drive   *Social Networks: LinkedIn, Twitter, Facebook, RSS and YouTube   *Other corporate web applications: Evernote, SurveyMonkey   *With any web content generator... Zyncro uses social technology to enable organizations to:   *optimize and reduce email use   *improve internal knowledge retainment and management   *make teamwork more efficient   *motivate and involve employees in the corporate mission   *provide access to corporate information and documents. As well as being an enterprise social network, Zyncro can act as a Private Social Network, a space for collaboration and communication, perfect for any organization looking to build private social relationship with its customers, suppliers or partners... where contents and information generated do not belong to third parties (unlike Facebook, Twitter, LinkedIn) but to the users. Zyncro also has a multi-organization structure, making it a ideal solution not only for single enterprises, but for groups and business communities looking for a common space to share information, news, files, contacts and applications. The original Zyncro idea back in 2008 in the Grupo Inspirit technology laboratory consisted in creating a files synchronizer that would allow and individual to access all of their professional and personal documents ""in the cloud"".  Nonetheless, upon seeing the potential that this tool could have within a company, a more corporate approach was given to it each time.  At the same time, the ""surname"" social and the 2.0 style was inundating the Internet and it was then that the decision was taken to add collaborative and communicative functionalities to it that later converted it to what it is today: an intranet 2.0 or company social network.  This part of Zyncro‘s trajectory is what Didac Lee, founder of Grupo Inspirit, considers the a ""Journey accross the desert"", which all startups must endure.  Thanks to the appointment of Luis Font as Zyncro CEO in November 2010, the business strategy and product definition became polished and sales and marketing departments were consolidated until we became what we are today.  And still on the uprise!"
Zyght,https://www.crunchbase.com/organization/sme---zyght,"Computer, Social Network, Software","Zyght improves the management of workplace safety in the company, through a virtual community that informs workers of active risks.","ZYGHT improves the management of workplace safety in the company, through a virtual community that informs workers of active risks, via on-line alerts carried out by them. It incorporates georeferenced visualization in on-line risk map"
Zyfro,https://www.crunchbase.com/organization/quipu,"Accounting, FinTech, SaaS, Software","Zyfro provides invoicing software for enterprises, freelances and bookkeepers.","Zyfro provides invoicing software for enterprises, freelances and bookkeepers. Centralize your invoices, quotes, expenses, bank account and your bookkeeper in real time. Create invoices, upload expenses and connect your bank account. Have information about what is happening on your business, taxes autocomplete and reports with real time data to be always aware."
Zymvol Biomodeling,https://www.crunchbase.com/organization/zymvol-biomodeling,"Artificial Intelligence, Biotechnology",Zymvol accelerates the discovery & development of new industrial enzymes through computer simulations,
Zyl,https://www.crunchbase.com/organization/zyl,"Apps, Artificial Intelligence, Mobile, Photography","Zyl is a smart photo assistant that manages your photos on iPhone and Android, with a privacy-by-design approach.","No more space on your phone? You friends never send you their photos after a moment together? You never re-watch your old photos ? Wouldn’t it be ideal that this thankless task of photo management could finally be done by an AI? At Zyl, we are convinced that smartphones photo galleries have become the nerve center of our memories and their associated emotions. We work everyday to simplify the access, the organization, and the safety of life’s memories to help people relive their experiences."
ZYD ENERGY,https://www.crunchbase.com/organization/zyd-energy,,"ZYD Energy Inc., Davis-based building efficiency company.",
Zyncd,https://www.crunchbase.com/organization/zyncd,"Crowdsourcing, Customer Service, Freelance, Knowledge Management, Skill Assessment",Zyncd is the smart CV for the gig economy. Helping freelancers and professionals to show better their skills online.,Zyncd is the smart CV for the gig economy. Helping freelancers and professionals to show better their skills online.
ZY Therapeutics,https://www.crunchbase.com/organization/zy-therapeutics,"Biotechnology, Pharmaceutical, Therapeutics",ZY Therapeutics develops a drug delivery platform for cancer therapeutics using nanotechnology.,ZY Therapeutics develops a drug delivery platform for cancer therapeutics using nanotechnology.
Zymetech,https://www.crunchbase.com/organization/zymetech,"Clinical Trials, Health Care, Manufacturing, Therapeutics","A globally leading company in research, development, production and sales of marine-derived enzymes for therapeutic application","Zymetech is a globally leading company in research, development, production and sales of marine-derived enzymes for therapeutic application. The company's technology of developing and manufacturing formulations containing marine-derived enzymes is called the Penzyme® technology and is at the core of its intellectual property. Zymetech's use of cod enzymes (called Penzyme®) for therapeutic application is patented-protected in 27 countries. Core and clinical research has demonstrated effectiveness of Penzyme® against a variety of skin conditions, wound healing and viral and bacterial infections."
Zyyx 3D Printer,https://www.crunchbase.com/organization/zyyx-3d-printer,"3D Printing, Consumer Electronics, Manufacturing",The Chinese 3D printer manufacturer.,"The ZYYX 3D Printer introduces a number of novel design features that will take 3D printing to a new level: fume free, adjustments free and hassle-free. Focus on your ideas instead of on your printer. Up until now, 3D printers have been quite unpleasant devices to have in the home, office or workspace due to the strong smell of heated plastic. The ZYYX 3D Printer tackles this problem by enclosing the print space and creating a slight pressure difference, with the outgoing air passing through an active carbon filter to remove the plastic smell. The ZYYX 3D Printer eliminates the need for tedious adjustments of the mechanics before every print, instead, the print head includes a probe that probes the build plate at three positions before every print and electronically adjusts the print plane to keep your models safely on the plate. The ZYYX 3D printer comes with the Simplify3D Integrated 3D Printing Software, an all-in-one software suite with fully customised profiles for the ZYYX 3D printer and ZYYX Premium filaments."
Zywave,https://www.crunchbase.com/organization/zywave,"Insurance, Software",Zywave leads the insurance tech industry with the most expansive portfolio of sales mgmt and client delivery solutions,Zywave leads the insurance tech industry with the most expansive portfolio of sales mgmt and client delivery solutions
Zypho,https://www.crunchbase.com/organization/zypho,"Industrial Engineering, Mechanical Engineering, Productivity Tools",ZYPHO is one of the most cost efficient energy upgrades.,"ZYPHO is an innovative drain water heat recovery. Installed just under the shower, reduces any heat lost saving you energy and money. "
Zyraz Technology,https://www.crunchbase.com/organization/zyraz-technology,"Biotechnology, Cyber Security, FinTech, Food and Beverage, Pharmaceutical",Zyraz Technology is a merger between a chocolate manufacturing company and a franchise of internet Media.,"The New Age of Technology. Combine Finance, Technology, Manufacturing, Retail and Banking and what do you get? A Venture Active entity who does almost about everything.  With operations in London, Scotland, Singapore, Malaysia, Indonesia and various entities within the US, Zyraz Technology is more of a boutique investment banking with huge high risk returns compared to traditional FinTech as they are in the real know."
ZYXR.com,https://www.crunchbase.com/organization/zyxr-com,FinTech,ZYXR.com is a Fintech company.,
Zyntern,https://www.crunchbase.com/organization/zynther-com-kft,,Zynther.com Kft,
Zyken - NightCove,https://www.crunchbase.com/organization/zyken-nightcove,"Hardware, Health Care, Software","Zyken develops innovative premium wellness products for hotel guestrooms, spas, and homes.","Zyken is a growing company developing innovative premium wellness products for hotel guestrooms, spas and homes. Zyken products deliver a unique combination of scientific research, cutting-edge technology and exclusive design. Zyken products allow hotel and spa operators to provide guests with an exceptional sensory experience conducive to wellness and restful sleep. NightCove by Zyken is an innovative wellness, sleep and wake-up device developed in partnership with Paris-based designer Patrick Jouin, and Professor Damien Leger, a scientific expert with a worldwide reputation in the field of sleep research. NightCove combines scientifically-validated high-powered LED technologies with advanced acoustics to provide hotel guests with a high quality 'wellness and sleep experience'. Since launch, NightCove has been deployed by more than forty luxury hotels including Four Seasons Paris, Plaza Athénée Paris, W Hotel Koh Samui, Trianon Palace Versailles, Riverton Göteborg, Westin Paris..."
Zymo Research,https://www.crunchbase.com/organization/zymo-research,Biotechnology,Zymo Research is historically recognized for its innovation of high quality nucleic acid purification technologies.,"Zymo Research's core beliefs are based on innovation, quality, and customer service. These three paradigms are ingrained in their company culture. They believe their products are the most reliable and uphold to the highest standards of quality in the industry as evidenced by their ISO 9001 certification. They have also received Frost & Sullivan's Best Practices Award for Leadership in Epigenetics Product Quality."
Zymetis,https://www.crunchbase.com/organization/zymetis,"Biotechnology, Chemical, Developer Platform, Transportation",Zymetis is a biotechnology company producing affordable transportation fuels.,"Zymetis recently announced that it was named to the 2009 GoingGreen East 50 Top Company List.  The GoingGreen East 50 Award is given to private, emerging companies creating new green technology businesses. Zymetis, founded in 2006 by Dr. Steve Hutcheson of University of Maryland, is a biotechnology company working to produce affordable ""next-generation transportation fuels."" Currently the Zymetis products are developed from novel enzymes that hope to achieve lower costs and improve yields and efficiencies."
ZygoFix,https://www.crunchbase.com/organization/zygofix,Medical Device,The ZygoFix is a medical device company.,The ZygoFix is a medical device company.
Zytoprotec,https://www.crunchbase.com/organization/zytoprotec,"Biopharma, Biotechnology, Medical",Zytoprotec is an Austrian biotechnology company developing new treatment options for major disease areas.,"Zytoprotec is an Austrian biotechnology company, founded in 2007 to apply ground-breaking findings in the area of cytoprotection to the development of new treatment options for major disease areas. The Company was founded by a team of professionals that combine extensive experience in business administration, clinical research, pharmaceutical product development, as well as company and patent law."
ZyseMe,https://www.crunchbase.com/organization/zyseme,"Artificial Intelligence, E-Commerce, Fashion, Industrial Automation, Machine Learning, Manufacturing, Retail, Supply Chain Management, Sustainability","ZyseMe is the fit-to-finish mass customization solution for fashion brands, retailers and producers.","ZyseMe empowers fashion brands to make and sell clothing to each customer’s unique size and style – at scale and on demand. It began with a small tailoring business that aspired to solve fashion’s biggest problem. The rising cost of waste, returns and excess inventory have made the overproduction of standard sizes unsustainable – both economically and ecologically. Our mass customization solution integrates seamlessly with existing production chains and orders are Zysed with no measuring necessary. Customers simply answer a few lifestyle and body shape questions. Our AI then calculates their measurements. Individual sewing patterns and other pre-production files are created automatically and sent straight to the production facility. ZyseMe makes fashion on demand an accessible, affordable and sustainable choice. And it works by putting customers first. Learn more at www.zyse.me."
Zyla Health,https://www.crunchbase.com/organization/zyla-health,"Health Care, Hospitality",Zyla is transforming the way healthcare is delivered in India with specific focus on high-risk chronic patients.,Zyla's premium panel of doctors delivers structured programs to correct your Heart Disease and Diabetes. Zyla's health programs are personalized based on your complete health history/ genetic history and delivered via the phone right where you are.
ZyXEL,https://www.crunchbase.com/organization/zyxel,"Cloud Computing, Mobile, Network Hardware","ZyXEL Communications Corp., founded in 1989, is the world-class networking company providing innovative and reliable Internet solutions.","ZyXEL Technology India Pvt. Ltd. was established in India in 2006. Growing fast, they have gained loyal support amongst their reseller partners, service providers and end users in India. Their aim is to become a leading force in India within two years. They have established a number specialist distributors in India to supply their range of solutions to Value Added Resellers (VARs), computer equipment dealers and Service Providers. ZyXEL India closely works with leading Telecom and Service providers offering unparalleled support and cutting edge technologies.  Their growing presence in India through their direct offices and representations in leading cities such as New Delhi, Mumbai, Bangalore, Chennai and Hyderabad further boosts the confidence of their customers. They have been building constructive partnerships with VARs, Systems Integrators and computer dealers, via their ZyDisti, and ZyXEL Certified ZyPartner programs for VARs and Resellers. This scheme delivers real benefits to resellers, asking for few commitments in return. Their customer service is second to none - for example all of their technical and product support is done internally with ZyXEL trained and employed engineers. They have the capability to deliver customisable, tailor-made solutions for service providers and resellers. ZyXEL India is going from strength to strength through partnership, through technical innovation and though their partners."
Zylie the Bear,https://www.crunchbase.com/organization/zylie-the-bear,"E-Commerce, Family, Social Network, Tourism, Travel",Zylie the Bear & Friends is a collection of plush dolls designed for storytelling and adventure.,"Zylie was created by Mary Beth Minton as a doll alternative for teddy bear and stuffed animal lovers. Together with her son Matt McCarty, the two have created an entire world of adventure revolving around Zylie, an adorable little bear from Manhattan who, together with her littler brother Theo, travels the globe meeting new friends along the way!"
Zylo Media,https://www.crunchbase.com/organization/zylo-media,"Advertising, Gaming, Marketing",Zylo Media has developed a new display advertising technology that combines promotional marketing with casual gaming to transform our,Zylo Media has developed a new display advertising technology that combines promotional marketing with casual gaming to transform our advertisers' products and services into the content that our web visitors interact with.
Zyfra,https://www.crunchbase.com/organization/zyfra,"Artificial Intelligence, Information Technology, Internet of Things",Zyfra is an international company developing products on the basis of the Industrial Internet of Things and Artificial Intelligence.,"Zyfra develops industrial digitalization technologies, invests in such products and improves the Industrial Internet of Things and Artificial Intelligence environment. Company's key fields of industry are machinery, metallurgy, mining, oil & gas and chemical enterprises. They promote readymade industry solutions in predictive analytics and data analysis, tech processes optimization, machinery and floor staff monitoring."
Zyp,https://www.crunchbase.com/organization/zyp,"Computer, Software",Zyp is a home cleaning solution for roommates and just about everyone else.,"Zyp views its mission as redefining the cleaning industry to give the masses access to a convenient, flexible and cost-effective way of having their places cleaned. They leverage the power of technology to create a platform that gives both customers and cleaners an unparalleled experience."
Zynx Health,https://www.crunchbase.com/organization/zynx-health,"Clinical Trials, Electronic Health Record (EHR), Health Care, Software","Zynx Health, a subsidiary of Hearst Corporation, is the market leader in providing evidence-based and experience-based clinical decision","Zynx Health, a subsidiary of Hearst Corporation, is the market leader in providing evidence-based and experience-based clinical decision support solutions proven to measurably improve the quality, safety, and efficiency of patient care. Thousands of hospital organizations and providers trust Zynx Health clinical evidence, order sets, plans of care, clinical decision rules, quality forecasters, and practice guidelines to drive clinical improvements at the point of care and deploy the clinical decision support solutions required to demonstrate meaningful use of electronic health record systems. Collectively clients have customized and deployed more than 100,000 order sets and plans of care within Zynx Health's online solutions"
"Zya, Inc.",https://www.crunchbase.com/organization/zya-inc,"Artificial Intelligence, Audio, Digital Entertainment, Mobile Apps, Music, Social Network",Zya was founded to democratize music creation and expression through imaginative games and apps.,"Zya is building next-gen musical artificial intelligence for everyone. Zya’s music experts, innovative engineers and award-winning product developers are based in Los Angeles. Zya was founded by CEO Matt Serletic. Matt is a former Chairman and CEO of Virgin Records as well as a Grammy-award winning producer, songwriter, record label owner, and entrepreneur. He founded Zya to change the way people interact with music."
Zyudly Labs,https://www.crunchbase.com/organization/zyudly-labs,"Cyber Security, Internet, Software",Zyudly Labs provides deep learning powered fraud and cybersecurity solutions for the financial services industry.,"Rather than simply providing a technology platform, they wanted to work collaboratively with companies to solve their cybersecurity and fraud challenges  end-to-end, using best-in-class data science. They truly believe in the power of deep learning + AI and it’s ability to be a force multiplier in combating fraud and cybersecurity incidents. They know that it can be a game changer but also a complex beast. They know the daunting struggles of figuring out where to start and also the scariness of scaling up. Most companies provide one piece of the analytics puzzle, be it the infrastructure, technology, people, or data science models - they focus on bundling all of the above into a cohesive solution to solve fraud and cybersecurity challenges effectively, efficiently and economically."
Zymewire,https://www.crunchbase.com/organization/zymewire,"Biotechnology, Pharmaceutical, SaaS, Sales, Sales Automation",The digital sales research assistant,"Zymewire is the digital sales research assistant, helping BD teams to uncover new opportunities for growth, without consulting a database built by analysts. From 3 person teams, to multi-billion dollar enterprises, over 180 pharmaceutical & biotechnology service providers around the world trust Zymewire for their sales research every day."
Zynex,https://www.crunchbase.com/organization/zynex,"Biotechnology, Electronics, Health Care, Manufacturing, Medical, Medical Device","Zynex (founded in 1996) engineers, manufactures, markets and sells its own design of medical devices in three subsidiaries.","Zynex (founded in 1996) engineers, manufactures, markets and sells its own design of medical devices in three subsidiaries. Zynex Medical is a provider of electrotherapy products for home use, Zynex Monitoring Solutions develops products for cardiac monitoring for use in hospitals and Zynex NeuroDiagnostics develops devices for EMG and EEG diagnostic purposes in the neurology clinic markets. Zynex Medical's product line is fully developed, FDA-cleared, commercially sold, and has been developed to uphold the Company's mission of improving the quality of life for patients suffering from impaired mobility due to stroke, spinal cord injury, or debilitating and chronic pain."
Zymo Entertainment + Development,https://www.crunchbase.com/organization/zymo-entertainment,"Apps, Mobile, Web Design, Web Development","Zymo designs and develops distinctive engaging products for web, mobile, and gaming development in Wisconsin.",
ZyLAB,https://www.crunchbase.com/organization/zylab,"Ediscovery, Information Technology, SaaS, Software",ZyLAB offers eDiscovery and Intelligent Information Governance software and services.,"ZyLAB's industry-leading modular eDiscovery and enterprise information management technology puts you in command of boundless enterprise data in order to mitigate risk, reduce costs, investigate matters, and elicit business productivity and intelligence."
