Organization Name,Organization Name URL,Categories,Description,Full Description
Nokia,https://www.crunchbase.com/organization/nokia,"Electronics, Enterprise Software, Infrastructure, Internet of Things, Mobile, Mobile Devices, Telecommunications, Wireless","Nokia is a Finnish multinational communications corporation engaged in the manufacturing of mobile devices, and network infrastructure.","Nokia is a Finnish multinational communications corporation engaged in the manufacturing of mobile devices, network infrastructure, location-based technologies, and advanced technologies businesses worldwide. The corporation is also engaged in converging internet and communications industries. It manufactures a wide range of mobile devices with services and software that enable people to experience music, navigation, video, television, imaging, games, business mobility, and more. Nokia also operates through four segments, including mobile broadband, global services, HERE, and technologies. Its mobile broadband segment provides consumers with hardware and core network software required to deliver mobile voice and data services. The corporation’s technology segment is involved in the development and sale of intellectual property rights and technology licensing activities. Its global services segment provides network implementation, care, managed services, and network planning and optimization. Finally, the HERE segment provides the development of local commerce, location-based services, and more. Nokia is also the owner of Symbian operation system and partially owns MeeGo operating system. It was founded in 1865 and is headquartered in Helsinki, Finland."
Novartis,https://www.crunchbase.com/organization/novartis,"Biotechnology, Health Care, Pharmaceutical",Novartis is a healthcare company that provides solutions to address the evolving needs of patients worldwide.,Novartis is a global healthcare company based in Switzerland that provides solutions to address the evolving needs of patients worldwide. Their mission is to discover new ways to improve and extend people's lives. They apply their expertise in science and innovation to society’s biggest health challenges. Responsibility is a core part of their business strategy.
Node,https://www.crunchbase.com/organization/node,"Artificial Intelligence, Information Technology, Intelligent Systems, Machine Learning, Software",Node provides online information about finding the right people and understanding the relationship between people and companies.,"Node enables users of business applications to see into the future. Powered by Artificial Intuition™ technology, Node is the first turnkey AI-as-a-service platform focused on powering predictable business outcomes, which enterprises can use to quickly and seamlessly build advanced AI into both customer-facing and internal applications without investing years and millions of dollars on risky AI experiments. Applications powered by Node can deliver predictions that enable users to make smarter connections and decisions about how to engage with customers, employees, investors, and partners. Node was founded by Google's youngest employee, Falon Fatemi, and it's renowned technology team includes the Godfather of Search, Louis Monier who created Alta Vista, and Michael Radovancevich former CTO of Taleo and OpenX. Node is backed by Mark Cuban, NEA, Avalon Ventures, and JetBlue Technology Ventures. Learn more at www.node.io."
Noom,https://www.crunchbase.com/organization/noom,"Consulting, Health Care, Mobile, Nutrition, Wellness","Noom provides mobile health coaching, focused on combating chronic and pre-chronic conditions such as obesity, diabetes, and hypertension.","Noom provides mobile health coaching, focused on combating chronic and pre-chronic conditions such as obesity, diabetes, and hypertension. It combines the power of technology with the empathy of real human coaches to deliver successful behavior change at scale. Noom's direct-to-consumer weight loss and exercise tracking mobile applications have reached more than 47 million users worldwide. Leveraging the success of their ground-breaking health and fitness programs, Noom developed a behavior change platform to treat chronic and pre-chronic conditions, beginning with the CDC's Diabetes Prevention Program (DPP). On the first day, the CDC began recognizing mobile and online DPP providers, Noom was there. Since then, Noom has expanded its curricula across the acuity spectrum and now features programs for pre-hypertension, hypertension, and diabetes management in addition to its flagship weight loss and diabetes prevention programs. Noom was founded in 2008 and has offices in New York City, Seoul, and Tokyo."
Novo Nordisk,https://www.crunchbase.com/organization/novonordisk,"Biotechnology, Construction, Health Care, Manufacturing",Novo Nordisk is a global healthcare company with more than 90 years of innovation and leadership in diabetes care.,"Novo Nordisk is a global healthcare company with more than 90 years of innovation and leadership in diabetes care. This heritage has given us experience and capabilities that also enable us to help people defeat other serious chronic conditions: haemophilia, growth disorders and obesity."
Notable Labs,https://www.crunchbase.com/organization/notable-labs-2,"Biotechnology, Health Care, Test and Measurement",Notable Labs provides personalized drug combination testing service for cancer patients.,Notable Labs is a personalized testing service for cancer patients that prioritizes combinations of FDA-approved treatments that can be immediately prescribed by a doctor without a clinical trial.
"Noodle Analytics, Inc. (Noodle.ai)",https://www.crunchbase.com/organization/noodle-analytics-inc-noodle-ai,"Artificial Intelligence, Big Data, Machine Learning, Supply Chain Management",Noodle.ai offers pioneering business solutions in Enterprise Artificial Intelligence.,"Noodle.ai offers pioneering business solutions in Enterprise Artificial Intelligence, a unique collaboration among business executives, process experts, and artificial intelligence technologies (e.g., machine learning, predictive data analytics, data science).  The company creates and implements these solutions to solve complex business challenges and drive dramatic improvements in customer, product, and enterprise operations."
Norwegian Air Shuttle,https://www.crunchbase.com/organization/norwegian-air-shuttle,"Aerospace, Air Transportation, Travel, Travel Agency","Norwegian Air Shuttle ASA, trading as Norwegian, is the third largest low-cost carrier in Europe and the second-largest airline.","Norwegian is Europe's third low-cost airline and the sixth largest low-cost airline in the world. Founded in 1993, we are one of the world's fastest growing airlines, operating around 500 routes to more than 150 destinations worldwide. In 2017, we carried more than 33 million passengers across Europe, the U.S, and Asia."
NoBroker,https://www.crunchbase.com/organization/nobroker,"Commercial Real Estate, Property Management, Real Estate","NoBroker is a real estate platform that makes it possible to buy, sell, and rent houses without paying any brokerage fees.","Nobroker is a new home rental platform that makes it easier to find your new home without paying any brokerage. Using its verified listing, people can find their dream home by contacting the owners directly. It allows them to save time and effort by using the accurate information about the property and neighborhood including schools, banks, restaurants, etc that makes it easier for them to shortlist the property without actually visiting it. The company also provides all paperwork and documentation processing relating to lease agreement registration, bank franking, police verification, and society approvals. It has a network of real-estate executives who will assist you in completing a hassle-free transaction at the cost of a small service fee.  Nobroker was founded in 2014 and is based in Bengaluru, India."
NovoCure,https://www.crunchbase.com/organization/novocure,"Health Care, Medical Device, Therapeutics",An Oncology Company Pioneering a Novel Therapy for Solid Tumors,"Novocure™ is dedicated to the development of tumor treating fields therapy (NovoTTF™ Therapy), a new weapon for patients and physicians in the battle against cancer.  NovoTTF Therapy is a novel anti-mitotic treatment that has been shown to slow or reverse tumor progression by inducing cell death in certain solid tumors. The company pioneered the concept that the electric properties of cells can be used as an effective target for an anti-neoplastic therapy."
Northvolt,https://www.crunchbase.com/organization/northvolt-ab,"Battery, Electronics, Energy, Manufacturing",Enabling the future of energy.,"Electrification and renewable energy storage are the keys to a carbon neutral society. Batteries will enable the transition. The auto industry alone will need batteries in huge numbers to replace fossil fuels with electricity. The ability to store energy is also crucial to free the world’s energy generation and distribution from coal, oil and natural gas. Northvolt accelerates this transition by building Europe’s largest battery factory. "
Nowait,https://www.crunchbase.com/organization/nowait,"Information Technology, Internet, Mobile, Restaurants",NoWait is a mobile network of casual dining restaurants serving millions of consumers and thousands of restaurants across the US.,"Nowait is the shortcut to amazing dining experiences.  For restaurants, Nowait integrates, streamlines, and optimizes the entire front of house—from waitlists to table turnover to analytics and more—so that they efficiently provide amazing service.  Guests can the most valuable asset of their life back, their time, by accessing Nowait's network of restaurants from its consumer application and get in line thousands of restaurants across the US.   Nowait provides the ideal restaurant experience for both sides of the table."
North,https://www.crunchbase.com/organization/north-8daa,"Consumer Electronics, Consumer Goods, Eyewear, Google Glass, Health Care, Manufacturing, Robotics, Wearables","North, formerly Thalmic Labs, builds a technology that is human centric and believes that people and technology goes hand and hand.","North, formerly Thalmic Labs, builds a technology that is human centric and believes that people and technology goes hand and hand. The company thus is building technologies discreetly built into fundamental parts of our lives that already exist. With over 400 people spanning four offices across North America, we’re a world-class crew of futurists, engineers, and designers and are always looking to add more innovators to the team."
Notarize,https://www.crunchbase.com/organization/notarize,"Apps, Legal, Legal Tech, Mobile, Software",Notarize enables users to connect with a commissioned Virginia eNotary public by live video call in the United States.,"Notarize operates an online notary public service that enables users to connect with a commissioned Virginia eNotary public by live video call in the United States. It offers Notarize, a software service that allows clients to complete the notarization process remotely and entirely online; and Notarize for Mortgage, a platform that digitizes the closing process with technology to coordinate lenders, title companies, and borrowers online.  Notarize's electronic notary public service offered to customers via an iOS application built for Apple devices. Pat Kinsel founded the company as 16 Pins in May 2015.  Notarize has its headquarters in Boston in Massachusetts. It operates as a subsidiary of Lennar."
Notion,https://www.crunchbase.com/organization/notion-2,"Apps, Home Improvement, Internet of Things, Security, Smart Home, Software, Wireless",Notion offers peace of mind for your whole home through a single sensor. ,"Notion is a complete home awareness solution that’s reinventing what your home is capable of to make your everyday life safer, smarter and better. Through an easy-to-use app and a multi-purpose sensor, Notion alerts you immediately when something happens in your home, even if you’re not there. Notion is more than home security. It’s peace of mind. Use Notion to monitor: - Doors, garages, windows, mail boxes and liquor cabinets opening and closing  - Water leaks - Smoke or CO alarms going off - Changes in temperature "
Novo,https://www.crunchbase.com/organization/novo,"Artificial Intelligence, Banking, Financial Services",Novo is a modern banking platform that gives startups and small business owners the technology they need to focus on their businesses.,"Novo is a modern banking platform that gives business owners the technology they need while getting partner banks the customers they want. Backed by a network of FDIC-insured community banks, Novo extends its banking products directly to consumers with a focus on transparency and user experience. Initially, Novo-branded banking products will be launching in the depository space and expanding to more profitable segments in 2018."
NowRx,https://www.crunchbase.com/organization/nowrx,"Health Care, Pharmaceutical, Retail",NowRx is a pharmaceutical company that is On-Demand and offers prescription delivery to patients within an hour.,"NowRx is a mobile and logistics-enabled, on-demand pharmacy that delivers prescriptions directly to the customer, either same-day for free or within one-hour for a $5 service fee.  Rather than just another “Uber for X”, NowRx is a vertically integrated, full-stack solution that provides superior customer experience while generating positive unit economics.  NowRx is a full-service pharmacy operation, replacing costly retail pharmacy locations with efficient, centralized dispensing locations, a mobile app, and a fleet of employed drivers.   In addition to better convenience for customers, benefits include increased likelihood of timely prescription fills, reminders throughout the day to encourage medication compliance, fewer missed refills, and ultimately better health outcomes.  For employers, NowRx can improve worker productivity by eliminating time employees spend off-campus having prescriptions filled and reduce overall health plan costs through better medication compliance. Since launching in December 2015, NowRx has been growing prescription volume by 15% month-over-month, consistently receiving 5-star ratings from its customers and is recommended by local area physicians, hospitals, and surgery centers."
Notable,https://www.crunchbase.com/organization/notable,"Artificial Intelligence, Health Care, Health Diagnostics, Information Services, Information Technology, Medical, Medical Device",Notable is a new AI powered health start up that automates and digitizes every physician-patient interaction.,Notable is a new AI powered health start up that automates and digitizes every physician-patient interaction. It automates recording of doctor’s visits and updating of electronic health records. The company has developed a technology that uses natural language processing and voice recognition to automatically record doctor-patient interactions and structure the data for inclusion in a patient’s medical records.
NomNomNow Inc.,https://www.crunchbase.com/organization/nomnomnow-inc,"Food Delivery, Health Care, Information Technology, Pet","NomNomNow crafts and delivers fresh, human-grade, personalized meals for dogs and cats that help them live happier and healthier lives.","Founded in 2015 by a team of animal lovers, NomNomNow crafts and delivers fresh, human-grade, personalized home-cooked meals for dogs and cats that help them live happier and healthier lives. Created by board-certified veterinary nutritionist, Dr. Justin Shmalberg, NomNomNow’s meals are made with restaurant-quality ingredients — no artificial preservatives or fillers — and portions are optimized to provide pets with the ideal balance for their weight, age, activity level, and more. Meals are cooked weekly in the company’s local kitchen, individually portioned, and arrive fresh not frozen, at your door ready to serve. "
Noodle,https://www.crunchbase.com/organization/noodle-education,"Advice, Education, Search Engine, Tutoring",Noodle is a U.S.-based organization that helps students and families make better education decisions.,"Noodle is a U.S.-based organization that helps students make decisions about education.    Through unbiased data and real-world advice, Noodle connects students with schools, programs, resources, experts and more.    Noodle Education was founded in 2010 by John Katzman, the Founder of The Princeton Review and 2U."
Nomad Health,https://www.crunchbase.com/organization/nomad-health,"Health Care, Hospital, Marketplace, Recruiting",Nomad is the first full-service marketplace for healthcare jobs.,"Nomad is the first online marketplace for clinical work. Medical facilities post shifts they need filled. Doctors and nurses search for work by price, location, and more. Both groups message and contract with each other directly - without the involvement of third-party recruiters.  Nomad eliminates the chaotic healthcare staffing system of yesterday and replaces it with a simple, modern technology platform that just works."
Noken,https://www.crunchbase.com/organization/noken,"Leisure, Tourism, Travel","Noken is a tech-travel company for planning, booking, and guiding trips and makes traveling accessible and more fulfilling.","Noken curates trips to introduce people to a new country. Travelers adapt a Noken Travel Blueprint based on their budgets and timelines and book their accommodations, experiences and transportation. These Travel Blueprints balance helpful guidance with the ability to create your own adventure, introducing travelers to the country’s iconic landmarks as well as local gems. Once on the trip, travelers can find everything they need in the App Guide and chat with the Experience Team for real-time support. Noken gives travelers the best of both worlds: the liberation from countless hours of planning and the guidance on the ground to meet a new country."
Nowports,https://www.crunchbase.com/organization/nowports,"Air Transportation, Logistics, Transportation, Water Transportation",Nowports is a digital freight forwarder that helps companies improve import process.,"Nowports is a digital freight forwarder that helps companies improve the import process. It serves as a platform through which companies and individuals can manage their imports and exports in real time. The company uses AI to make the import process easy, secure, and transparent. The platform allows to request a quote, register the products and providers that the company mostly uses, and book shipments from any port."
Nosto,https://www.crunchbase.com/organization/nosto,"Analytics, Big Data, E-Commerce, Internet, Marketing Automation, Personalization, SEO, Software",Nosto is an e-commerce platform providing product recommendations based on individual behavioral data.,"Nosto brings solutions for online marketing automation for	the	global e-commerce industry.	 The company’s platform-independent SaaS solution enhances	customers’	online shopping experience by enabling	personalized product recommendations in real time. Its	 plug and play solution makes the technology easily accessible	 to online stores of all size, automating marketing activities	 and	 increasing conversion, customer retention and store revenues	 as a result.  Nosto’s  first customers include leading brands like Angry	 Birds,	 Intersport,	 JOY,	Reima, Outnorth and Sanoma’s	Huuto."
NowSecure,https://www.crunchbase.com/organization/nowsecure,"Apps, Cyber Security, Mobile, Penetration Testing, Security, Software",NowSecure provides automated mobile app security testing software that can be integrated into the development (CI/CD) process.,"NowSecure is a mobile app security software company delivering fully automated mobile app security testing with the speed, accuracy, and efficiency necessary for Agile and DevSecOps environments. It can identify the broadest array of security threats, compliance gaps, and privacy issues in custom-developed, commercial, and business-critical mobile apps.  These offerings are also provided as a managed service or independent 3rd party app verification.  NowSecure was founded in 2009 and is headquartered in Chicago, IL and has offices in Washington, DC and Seattle, WA."
Novosteo,https://www.crunchbase.com/organization/novosteo,Pharmaceutical,"Novosteo, test the efficacy of a new drug to help reduce complications from a broken bone due to a fall.",
NoTraffic,https://www.crunchbase.com/organization/notraffic,"Artificial Intelligence, Autonomous Vehicles, Internet, Public Safety, Railroad, Sensor, Smart Cities, Transportation",Traffic management platform based on smart sensors which prepares the road infrastructure for the connected and autonomous era.,"NoTraffic is a traffic management platform that optimizes traffic lights in real-time based on smart sensors and prepares the road infrastructure for the connected and autonomous era.  The platform is powered by an integration of data from proprietary computer vision algorithms and data collected through vehicle-to-infrastructure communication (V2I). Advanced artificial intelligence (AI) algorithms identify and track all road users, including pedestrians, and optimize the traffic signals while considering nearby intersection traffic. The system enables cities to implement their traffic policy in a seamless way and operates autonomously in order to maximize traffic flow, reduce congestion, prioritize different types of vehicles, and prevent accidents. "
Nok Nok Labs,https://www.crunchbase.com/organization/nok-nok-labs,"Computer, Network Security, Security",Nok Nok Labs is a security platform providing online authentication solutions for organizations.,"Nok Nok Labs, Inc., based in Palo Alto, CA, was funded in November 2011 to transform online authentication for modern computing. The company is backed by a team of security industry veterans from PGP, Netscape, PayPal & Phoenix, and have a deep experience in building Internet scale security protocols and products.  The company’s ambition is to fundamentally transform authentication by enabling end-to-end trust across the web using authentication methods that are natural to end-users and provide strong proof of identity.  Their solutions will remediate and unify the authentication silos that exist today, and provide organizations with greater flexibility to utilize strong authentication solutions in adaptable ways.   Nok Nok Labs' technology solutions will allow companies to scale their authentication systems to meet the challenges posed by the rapid growth of users utilizing different Internet-connected devices, performing a wide range of online transactions. Learn more in this analyst interview with Phillip Dunkelberger, President and CEO: https://vimeo.com/129322341"
Nova,https://www.crunchbase.com/organization/nova,"Business Development, Computer, Software",Nova is a personalized selling platform.,"Nova's Content Intelligence Engine enhances your existing email messaging to engage customers and prospects. With Nova, you can send drip campaigns, save your templates for re-use, and track opens, clicks, and replies all within the product."
NoPaperForms Solutions Pvt. Ltd.,https://www.crunchbase.com/organization/nopaperforms,"EdTech, Education, Information Services, SaaS","NoPaperForms is a marketing automation, lead nurture and enrolment management platform for educational institutions","NoPaperForms provides enrolment solutions which are easily adaptable to your admission process - We are easy to customize, extend, and deploy. Regardless of the admission process requirement and complexity, we strive to provide our clients with great technology, differentiated products, and unmatched engineering services delivered within a flexible and cost-effective business model. Designed in close cooperation with admission directors at top academic institutions, we help institutions to increase their outreach capabilities, enhance recruitment efforts, expand customer service offerings, and improve end results. NoPaperForms makes the entire admission process 100% transparent."
Novatel Wireless,https://www.crunchbase.com/organization/novatel-wireless,"Mobile, SaaS, Telecommunications","Novatel Wireless, Inc. is a provider of wireless broadband access solutions for the worldwide mobile communications market. Our","Novatel Wireless, Inc. is a provider of wireless broadband access solutions for the worldwide mobile communications market. Our solutions enable the mobile workforce to increase productivity, improve operational efficiencies and maintain a competitive edge.  Novatel Wireless delivers a broad range of high-quality, 3G wireless PC cards, ExpressCards, USB modems, embedded modules, fixed and mobile terminal solutions and communication software to wireless network operators, distributors, original equipment manufacturers (OEMs), and vertical markets worldwide. Our solutions provide mobile marketplace with secure and convenient high-speed access to corporate, public and personal information through the Internet and enterprise networks. We also offer our extensive technical expertise to our customers to facilitate the use and integration of our products. Headquartered in San Diego, California, Novatel Wireless has been issued 30 technology patents and has established partnerships with leading telecom operators, infrastructure providers and device manufacturers around the world. Novatel Wireless is listed on NASDAQ: NVTL."
