Organization Name,Organization Name URL,Categories,Description,Full Description
Aphea.Bio,https://www.crunchbase.com/organization/aphea-bio,"Agriculture, Chemical",APPLIED NATURE FOR BETTER AGRICULTURE,"Aphea.Bio will develop next generation ‘biopesticides’ based on natural microorganisms. These products will provide an alternative for chemical pesticides, which are currently under serious pressure. In addition, the company will develop novel ‘biostimulants’, i.e. microorganisms that stimulate crop growth, for example through promoting the uptake of nutrients from the soil."
Applied Proteomics,https://www.crunchbase.com/organization/applied-proteomics,"Biotechnology, Health Care, Health Diagnostics",Applied Proteomics offers a protein biomarker discovery platform to advance the application of proteomics.,"API was co-founded by Dr. Danny Hillis, a leader in computer science and systems engineering and Dr. David Agus, a leading oncologist and trailblazer in molecular medicine applications. Dr. Agus saw protein measurement as the best diagnostic tool, but protein-based diagnostics were failing to fulfill the potential."
App.io,https://www.crunchbase.com/organization/app-io,"Android, Customer Service, Enterprise Software, Internet, Mobile, SaaS",App.io streams your mobile apps from the cloud to any device.,"App.io streams your mobile apps from the cloud to any device. Nothing to download. Device agnostic. No custom code.  The fastest, easiest way to give people access to your apps. - Customer Support Your support team needs to see what your customers see. App.io provides on-demand, economical access to your apps without needing to buy devices. - Sales & Marketing Stop asking potential customers to jump through hoops. App.io instantly puts potential customers in your app with no download, setup or hassle. Give them the full app experience or fast-forward right to the “aha moment”. - Testing & Quality Assurance Forget about device provisioning, version control or UDIDs. Regardless of platform, quickly and securely share apps with internal and external teams using App.io."
Appuri,https://www.crunchbase.com/organization/appuri,"Analytics, Big Data, Computer, Software",Appuri was acquired by DocuSign in December 2017.,"Appuri helps online and mobile businesses keep their users longer.   Appuri Backstop uses machine learning to predict which users are likely to leave and the reasons why -- so product and marketing teams can take action to stop churn before it starts. Appuri provides a full Data Platform as a Service that delivers data ingest, processing and output integrated into their existing business processes.  We also deliver all data into a petabyte-scale data warehouse giving them secure, direct SQL access to their user segmentation data. Our main competitor is companies expending internal resources to build an ad-hoc solution themselves."
AppsBuilder,https://www.crunchbase.com/organization/appsbuilder,"Android, Apps, Developer Tools, iOS, Mobile, Web Development",AppsBuilder is a self-service app creator for smartphones that allows its users to create apps with no technical knowledge required.,"AppsBuilder: Powering your mobile business with apps AppsBuilder (www.apps-builder.com) is the innovative mobile publishing and distribution platform that empowers SMEs and large enterprises to build a solid mobile presence, reach new customers and improve client retention through powerful mobile apps. Thanks to its powerful, yet easy-to-use platform, AppsBuilder represents companies’ best partner to expand business reach, while locking in existing clients with its effective app-based technology. AppsBuilder’s services include all the state-of-the-art tools to create, manage and distribute mobile apps and reach a broader audience through a wide range of promotional channels, including QR codes, landing pages, social networks integration and app store submission. To support SMEs in their marketing and client retention operations, AppsBuilder has developed a whole set of CRM tools to allow brands to engage with customers in long-lasting relationships and geolocalize their communications to maximize reach. AppsBuilder’s technological core comes with a cutting-edge business toolkit that includes push notifications to communicate more efficiently with users; geolocalized couponing to market sales and promotions on the go; in-app forms to gather users' feedback and generate new leads for your business; and loyalty cards to boost client retention. Advanced analytics is also provided to monitor applications’ rates and trends and assess the performance of mobile campaigns. Thanks to AppsBuilder’s cloud-based system, users can add new content and refresh layout anytime they want, then preview changes in real time. In just a few clicks, they can synchronize their website content with their app, so to offer their users a satisfying up-to-date mobile experience. In a nutshell, AppsBuilder is the ultimate solution to take your business to new heights through the most innovative mobile technologies of our times."
AppsCo Inc,https://www.crunchbase.com/organization/appsco,"Blockchain, Cloud Computing, Cyber Security, Identity Management, Internet of Things, SaaS, Security, Software",Appsco helps you manage access to your company applications and gives you meaningful insights over sensitive data flow.,"With AppsCo you can have connected, integrated and secured access all in one place. AppsCo enables users to access company applications through secure, centrally managed portal while providing better visibility.  Benefit for Employee: Through AppsCo’s user dashboard employees get centralized access to company published application with SSO integration Benefit for an Enterprise: Centralized control and management over user access to published company applications and decreased operational burden"
Apartama,https://www.crunchbase.com/organization/apartama,"Consumer Goods, DIY, E-Commerce, Home Decor, Internet, Lifestyle","Apartama is online showcase of wide range of products in furniture, home accessories and DIY goods.",Apartama owns and operates an online interior design and e-commerce platform. Apartama is based in the Russian Federation.
Apricot Forest,https://www.crunchbase.com/organization/apricot-forest,"Apps, Health Care, mHealth, Mobile",Apricot Forest's mobile app provides doctors with patient records,"Apricot Forest's mobile app provides doctors with patient records, medical journals, as well as discussion boards."
Apiphany,https://www.crunchbase.com/organization/apiphany,"Cloud Computing, Consumer Electronics, Developer APIs, Internet, SaaS, Software","Apiphany provides API management and delivery solutions that enable organizations to leverage the mobile, social and app economy.","Apiphany is a leading provider of API management and delivery solutions enabling organizations to successfully leverage the roaring mobile, social and app economy. With its flexible cloud-based architecture, Apiphany empowers companies to securely develop new revenue channels, gain insight in their business, and spur innovation at a fast pace while keeping cost and usage under control.  How Apiphany Can Help? Apiphany offers a comprehensive, flexible, cloud-based API management solution that can help you:  •	Share data internally, with your partners, or with the developer community. •	Secure and monitor access to your API environment. •	Gain insight into your API ecosystem. •	Remain flexible and agile. •	Grow and scale as you need. •	Software as a Service offering with monthly billing. Some of our customers are: The Washington Post, NFLData, Random House, FlightLookup."
Apptest.ai,https://www.crunchbase.com/organization/apptest-ai,"Artificial Intelligence, Developer Tools, Mobile, SaaS, Usability Testing",Fully automated mobile app QA at your fingertips,"AI-powered automated mobile QA/testing solution. We envision a future free of mobile app crashes for mobile app users, and no more scripting or workflow design required for developers and testers. The company develops a bot AI engine for a high performing, reliable exploratory testing experience. Offices are located in the US and Seoul."
Apply Financial,https://www.crunchbase.com/organization/apply-financial,"Developer APIs, FinTech, Payments",Validate API   ( for single realtime payment validation) and Validate Data Manager API (for bulk payment file validation ),"Apply Financial is a payments validation company that offers a variety of solutions to confirm, check, fix, and change single and bulk payment information. It helps its customers stay updated about future payment standards. The company offers three products: Validate Browser, Validate API, and Validate Data Manager. Its collection of products help users submit payment details correctly first time, allowing them to save time and money as well as reduce the risk related to non-payments, manage compliance, and improve customer relationships. Apply Financial follows a pay-as-you-go pricing structure to charge fees from its customers."
APPrise Mobile,https://www.crunchbase.com/organization/apprise-mobile,"Apps, Enterprise Applications, Information Technology, iOS, Mobile, SaaS, Software",Mobile SaaS Employee Communications Platform serving the Enterprise,"The native app platform for mobile communications. APPrise Mobile is a B2B native technology platform that enables organizations to create native apps for iPhones, iPads and Android devices quickly and cost effectively. The Company's core product, theEMPLOYEEapp, allows organizations of all sizes, especially the enterprise, to have their own branded app through which to communicate and engage with their employees."
Appscho,https://www.crunchbase.com/organization/appscho,"Apps, Education, Internet",AppScho is the mobile solution for the education sector.,"AppScho is a mobile plug-and-play mobile technology dedicated to Higher Education, which help institutions to improve student engagement with an efficacy-driven app.  The app centralises relevant student information into one seamless experience that reduces complexity and eases communication and content management."
Apollo Voice Assistant,https://www.crunchbase.com/organization/apollo-voice,"Artificial Intelligence, Automotive, Autonomous Vehicles, Consumer Electronics","An untethered, independent voice assistant.        Customers: Jaguar, Land Rover","Apollo Voice is an independent AI voice assistant. Voice assistant performs as well as Google Assistant (due to collaboration), and better in certain domains.  Currently working with the auto industry."
Aptamer Group,https://www.crunchbase.com/organization/aptamer-group,"Biotechnology, Health Care, Health Diagnostics","Aptamer Group develop DNA and RNA nucleic acid aptamers for use in R&D, biomarker discovery, diagnostics or therapeutic developments.","The Aptamer group of companies focuses on the development of aptamer technologies. We develop nucleic acid aptamers for use in research & development, biomarker discovery, diagnostics or therapeutic developments. Aptamers are short DNA or RNA sequences that offer high-affinity and specificity to virtually all types of targets. They can therefore be thought of as synthetic nucleic acid equivalents of antibodies. Aptamers are versatile, cost effective and offer a complementary or alternative solution to antibodies. We have over 20 years combined expertise in the development of nucleic acid aptamers to peptides, proteins, cells, tissue samples, micro-organisms and small molecules. The Aptamer Group of companies has cutting edge platforms for the selection of aptamers. These include semi-automated selection platforms which ensure accurate replication of selection conditions to ensure the best quality aptamers result. We can use a wide range of targets: peptide, proteins, whole cells, viruses, small molecules etc. The typical aptamer selection process can be completed in a matter of weeks. Monoclonal antibodies usually take several months to generate. Our custom service can be focussed on a particular application so that the resultant aptamers are pre-optimized for use with a given detection platform, sample type and assay buffer.  Aptamers themselves are increasingly being perceived as the state of the art reagent of choice for a wide range of applications including: Imaging experiments: fluorescence, bright field and phase contrast, IHC, ICC Quantification: ELISA (or ELONA), homogeneous assays etc. Rapid diagnostics: Lateral flow devices, biosensors, electrochemical detection, nano-wires  Binding studies: label free detection, SPR, Biolayer Interferometry Purification: affinity chromatography  We also offer an aptamer based assay development service.  Our solution can be used to identify aptamers for virtually any application and against almost any target in almost any condition. Our applications are more diverse than those for which antibodies have been used. These include therapeutics, in biomarker discover, in drug target discovery, as diagnostics, in biosensors as components of biochemical tests such as Lateral flow devices, enzyme linked oligonucleotide assays (ELONA: the aptamer based equivalent of ELISA), in affinity chromatography and as research reagents. For more information visit: www.aptamergroup.co.uk and www.aptamersolutions.co.uk"
AppGuard,https://www.crunchbase.com/organization/appguard,"Computer, Cyber Security, Information Technology, Network Security, Software",AppGuard is a revolutionary new approach to prevent breaches from threats that traditional anti-virus software.,"AppGuard is a revolutionary new approach to prevent breaches from threats that traditional anti-virus software is not equipped to face, including fileless malware, botnets, polymorphic malware, weaponized documents, targeted attacks, in-memory attacks, ransomware, phishing, watering-holes, drive-by-downloads, and other undetectable advanced threats.   It automatically and dynamically stops an attack at its initial stages and beyond without requiring detection of the attack, disrupting the user experience, or degrading system performance. It generates valuable Indicators of Attack (IOA) alerts without a compromise occurring. AppGuard is compatible with all Windows versions from XP to 10, standard and custom applications, and typical system maintenance tools, and supports Windows Server 2008 R2 and above."
AppInstitute,https://www.crunchbase.com/organization/appinstitute,"Developer Tools, Information Technology, iOS, Messaging, Mobile, Mobile Apps, Software",AppInstitute is a software developer of a digital framework for small businesses to create their own mobile applications.,"AppInstitute provides a simple way for small businesses and individuals to create and manage iPhone and Android Apps, without any programming skills. With the AppInstitute cloud based CMS anyone can create an App for their business, select from over 20 business type templates, or create an App from scratch. Apps can be created based around core modules such as: + Food Ordering (takeaway restaurants) + m-Commerce (Selling anything In-App) + GEO Listings (Find your nearest) + Customer Loyalty (Check-ins and QR scans) + Event Bookings (Select date and time-slots)  + Messaging (App-to-Admin Message Centre) + Rich Content (HTML, images and Video)"
apceth Biopharma,https://www.crunchbase.com/organization/apceth-biopharma,"Biotechnology, Genetics",apceth Biopharma dedicated to the development and clinical implementation of innovative cell and gene therapeutics.,"Apceth is a biopharmaceutical company (foundation 11/2007) dedicated to the development and clinical implementation of innovative cell and gene therapeutics based on stem cells for the treatment of malignant and nonmalignant diseases. Apceth aspires to set up the highest standards for manufacturing, quality and safety of Advanced Therapy Medicinal Products (ATMPs). The company operates within unique state-of-the-art GMP/S2 facilities comprising separate Cleanroom suites class C and class B/A, Quality Control Units and R&D laboratories. After obtaining the Manufacturing License (§13 of AMG) for production of somatic cell therapeutics in 10/2010, Apceth commenced its first clinical trial Phase I/II for the treatment of critical limb ischemia in 03/2011. As of 2011 Apceth offers contract GMP-manufacturing and associated services for cell-based products."
AppMakr,https://www.crunchbase.com/organization/appmakr,"Android, iOS, Mobile",Sold to ShareThis in 2013 ================= AppMakr is the largest Do It Yourself app creation platform for non developers.,"Sold to ShareThis in 2013 ================= AppMakr is the largest Do It Yourself app creation platform for non developers.  Over 1% of all iPhone, Android and WindowsPhone apps have been made using AppMakr. AppMakr has been featured USA Today, The Washington Post, FastCompany, CBS, Mashable, WSJ, Entrepreneur, TechCrunch and many others. AppMakr is a division of Socialize, Inc.  Every app built by AppMakr includes the Socialize drop-in social platform.  More details at www.Angel.co/socialize"
AppEnsure,https://www.crunchbase.com/organization/appensure,"Cloud Management, Enterprise Software, Virtualization",AppEnsure perfects application performance for all applications (custom or purchased) irrespective of how it is deployed,"AppEnsure Ensures  business critical Applications Performance  AppEnsure delivers an Application Performance Management (APM) solution that works for every Windows or Linux application, irrespective of its source; custom developed or purchased, and irrespective of how it is deployed; physical, virtual, private cloud, or public cloud. We are agnostic to what an App is or does. AppEnsure automatically identifies the applications, maps their topologies, monitors end-to-end response time and throughput across the entire distributed topology of the application and its supporting infrastructure.  The solution delivers automated root cause analysis when application service level degrades, with resolution instructions provided in clear English to Operations. AppEnsure is offered as both an on-premise basis for enterprise, and on a SaaS basis for cloud deployments."
Appmobi,https://www.crunchbase.com/organization/appmobi,"Android, iOS, Mobile, Security","Appmobi is the secure mobile platform that adds end-to-end encryption and security to any mobile app in minutes, not months.","Appmobi is the secure mobile services platform that makes hybrid HTML5 and Cordova-based enterprise apps secure in minutes, not months. It is the first company of its kind to provide enterprise-grade security to hybrid HTML5 Cordova mobile apps with such astonishingly fast deployment. The Appmobi Secure Mobile Platform consists of five core services: Appmobi Security Kit, Secure Push Messaging, Secure Live Update, Secure Analytics and Secure Data Store. The platform easily integrates and works with a developer’s existing development tools, providing the mobile services required to build truly secure hybrid apps in an easy-to-install package – all hosted on an enterprise’s private cloud or on premise.  Originally founded in April 2006, the Appmobi Software Development Kit (SDK) was acquired by Intel® in February 2013. The transferred technology now forms the basis of the Intel® XDK, which allows developers to build optimized HTML5 applications for mobile platforms. Appmobi maintains a partnership with Intel® that makes the Appmobi Secure Mobile Platform available to Intel® XDK developers, enabling the development of secure mobile apps via Intel’s best-in-class HTML development environment.  Based in San Francisco and Poughkeepsie, NY, Appmobi is a privately held company backed by Aspire Ventures.  Appmobi History: In 2007 Appmobi was the developer of the most popular streaming media web app on the iPhone - FlyTunes.fm. In the following years, Appmobi was also a leading provider of streaming media technology, including cross-platform apps, to the largest US radio broadcasters. In August 2011, Appmobi made available the Appmobi XDK (cross platform development kit) which allowed developers to use HTML5 technology to create fully functional mobile apps that run across different hardware platforms, including Android and iOs. Additionally, the XDK  rendered the exact same code as a 'web app' or an 'enhanced' web app that performs exactly the same as a native app.    In December, 2011, Appmobi released its directCanvas technology as open source. directCanvas speeds HTML5 game screen rendering by as much as 18x, delivering ""native"" game performance to games written with HTML5. Also in December, ReadWrite named Appmobi as the ""Most Promising Company for 2012"".  March 12, 2012, Appmobi released version 1.0 of jqMobi, an open source,  jQuery-like JavaScript framework that is highly optimized for delivering an identical user experience on Android and iOS HTML5 mobile apps.  On Feb 21, 2013, Appmobi announced to its developers that all of its HTML5 development tools had been acquired by Intel, leaving appMobi as a ""pure play"" mobile cloud services provider. In late 2013, Appmobi joined Aspire Ventures and continued with a set of cloud services for SMEs. In January 2015, Appmobi pivoted and began development of an enterprise product - the Appmobi Secure Mobile Platform - which launched in early November 2015."
Appoxee,https://www.crunchbase.com/organization/appoxee,"Enterprise Software, Mobile, Mobile Apps, Publishing",Appoxee is a cloud-based mobile app engagement platform providing app publishers with services to improve app engagement and retention.,"Appoxee is a Push Marketing platform for marketers who want to increase app engagement, retention and in-app purchases. Appoxee offers a broad set of tools to create, target, analyze and automate push and in-app messaging campaigns. In addition, Appoxee provides multi-app messaging and targeting capabilities for publishers with multiple apps. With deep roots in the social gaming and media industries, Appoxee was designed to handle the distribution of millions of messages in seconds. Appoxee currently sends over half a billion monthly push and in-app messages to iOS and Android users. Appoxee also offers a variety of in-app plugins, giving publishers additional ways to interact with their users. These include a Message Inbox, Customer Feedback form, and an Offer Wall."
AppThwack,https://www.crunchbase.com/organization/appthwack,"Android, Cyber Security, iOS, Mobile, SaaS, Test and Measurement","AppThwack is a company based in Portland, Oregon, focused on building automation tools and services.","AppThwack automatically tests Android, iOS, and web apps on 100s of real, non-emulated phones and tablets, providing reports in minutes so issues are caught well before deployment to customers. Developers and QA teams upload apps via the web client or through the API (Continuous integration, IDEs, etc) and AppThwack tests them on the desired devices. The built-in test suite require no code or instrumentation, and includes install, launch, AppExplorer - an intelligent crawler that dynamically navigates and interacts with the app, and stress. In addition to the built-in tests, AppThwack supports custom tests via all popular automation platforms (Robotium, Calabash, UI Automation, etc), making it possible to take full control of devices and exercise specific flows and behaviors in a given app. Focused reports generate in real time and contain high-level trends, low-level details, performance profiles, and high-resolution screenshots."
Apnex Medical,https://www.crunchbase.com/organization/apnex-medical,"Health Care, Manufacturing, Medical Device",Apnex Medical manufactures and markets active implantable medical devices for the treatment of obstructive sleep apnea.,"Apnex Medical, Inc. manufactures and markets medical devices such as implants for the treatment of obstructive sleep apnea. Apnex Medical, Inc. was incorporated in 2006 and is based in Saint Paul, Minnesota."
