Organization Name,Organization Name URL,Categories,Description,Full Description
Yethi Consulting,https://www.crunchbase.com/organization/yethi-consulting,"Consulting, Information Technology, Software",Making testing simpler and more exciting,"Yethi is a niche IT Solution provider operating essentially in area of helping enterprises improve the quality of their COTS software solutions. We are currently focusing on serving the banking industry and are looking at expanding across industries in the coming years. We are practitioners who wish to leverage our experiences and our innovative new product for software quality assurance / test automation. Founded by seasoned senior Fintech professionals, we bring decades of global expertise in large technology transformation to play. Our solutions are contemporary, future proof and simplify complicated challenges. The founders collectively represent over 100 years of experience across financial services, business advisory and technology consulting industries.  Our goal is to become the world’s leading, specialized, IT solutions provider for automated test-execution. Ever since our inception, we’ve been guided by three principles: customer focus, domain expertise and global reach. These principles have guided our every new initiative. At the heart of our ideology is our customers’ success. The insights we derive from each success story encourages us to innovate and create cutting-edge solutions. Our vision for the future will continue to be influenced by our sharp and exclusive focus on the financial services industry. We continue to invest in the requisite domain expertise and intellectual property, leveraging this business understanding to add value to our customers’ businesses Our success is because of the long-term relationship we have been able to establish with our customers through trust and by ensuring our services aligned to the needs of our clients. This helps us in being treated as a partner in growth of our clients."
Yellow Pages Group,https://www.crunchbase.com/organization/yellow-pages-group,"Advertising, Lead Generation, Publishing",Yellow Pages Group (YPG) is Canada's leading performance media and marketing solutions company.,"Yellow Pages Group (YPG) is Canada's leading performance media and marketing solutions company. The Company brings consumers and businesses together locally through its network of print, digital and mobile properties. YPG enables consumers to make smarter decisions, helping people find what they need wherever and whenever. The Company partners with businesses to build successful marketing and lead generation programs, helping them grow their business."
yellowHEAD,https://www.crunchbase.com/organization/yellowhead,"App Marketing, Digital Marketing, Digital Media, Google, Marketing, Mobile Apps, SEO, Social Media Advertising, Social Media Marketing",yellowHEAD is a performance marketing company that provides paid and organic User Acquisition solutions,"yellowHEAD is a performance marketing company that provides holistic digital marketing solutions, implementing top User Acquisition, App Store Optimization & Search Engine Optimization methodologies. We believe these ﬁelds go hand in hand as part of an overarching strategy. By implementing cross-ﬁeld insights, we improve results on all spectrums. Our clients operate in the most competitive search markets in the world, including Gaming, eCommerce, Retail and more. Using our vast experience across digital marketing channels, we provide clients with a distinct and effective presence on all platforms. Our team is dedicated to maximizing performance and reducing wasted ad spend."
Yespark,https://www.crunchbase.com/organization/yespark,"Information Technology, Parking, Rental",Yespark is the specialist in the monthly rental of parking spaces.,"Yespark is the specialist in the monthly rental of parking spaces. Far from a restrictive administrative procedure, Yespark has been designed to simplify life. Take a parking space at Yespark: it's without a deposit or notice, but with the possibility to change parking or cancel your subscription at any time! In just a few clicks, once the contract is validated electronically, you have access to parking through your smartphone. No more beeps lost or looking in your car, the parking door opens, even without internet connection and from several phones. "
yellowpop,https://www.crunchbase.com/organization/yellowpop,"E-Commerce, Internet",Yellowpop specialise in wall art with a focus on handcrafted neon signs,"Yellowpop operate from London with offices in Paris, Hong Kong and New York. They specialise in wall art with a focus on handcrafted neon signs. Yellowpop offer their own collection of signs and an online builder for fully customised neon designs. There’s worldwide delivery so every nation can make their walls pop with neon colour!  The Yellowpop moto is a fear of empty walls #FOEW. The company mission is to fight against this phenomenon, one neon at a time."
Yellowwood,https://www.crunchbase.com/organization/yellowwoods,"Advertising, Consulting","Yellowwood build valuable, engaging brands that drive business growth.","Founded in 1997,  Yellowwoods is the first independent brand strategy consultancy in South Africa. Today they are acknowledged leaders in marketing and brand strategy, serving clients across the region and internationally."
YES DBS Satellite Services,https://www.crunchbase.com/organization/dbs-satellite-services,Telecommunications,YES DBS Satellite Services offers a range of multichannel and interactive television subscriber services to consumers in Israel.,"Since its establishment, yes has utilized the most advanced relevant technologies even in comparison to the largest companies in the market worldwide. Basing its technological systems on fulldigitalization, yes was the first in Israel in 2005 to market a personal video recorder yesMax, which enables easy recording of programs and series, with options to pause the program while viewing with rewind and fast forward capabilities. In December 2007, yes was the first in Israel to launch HDTV broadcasts based on the most advanced technologies according to DVB-S2 and MPEG4 H.264 standards. In April 2009 yes launched the MaxHD- the first HDPVR recorder, which represents a revolution in the viewing experience."
Yeldo,https://www.crunchbase.com/organization/yeldo,Real Estate,Yeldo provides real estate investments.,Yeldo provides real estate investments.
"YesPlz, Inc.",https://www.crunchbase.com/organization/yesplz-9777,"Machine Learning, Retail Technology",AI for fashion search! We find you the exact fit and style you are looking for across online shopping sites.,We are AI for fashion search! Our smart visual filter paired with proprietary machine learning algorithm finds you the exact fit and style you are looking for across online shopping sites. No more wasting your time browsing irrelevant styles and clothes. We find you the cloth you actually want to wear.
Yellowstone Compact & Commodities Corp,https://www.crunchbase.com/organization/yellowstone-compact-commodities,"Animal Feed, Golf, Landscaping, Waste Management",We build and Sell the BioPac'r and then Broker the livestock feed between our BioPac'r users and small farmers.,"The BioPac'r diverts grass clippings away from landfills.  It's the world's first portable, packaging, & ensiling system that creates a fermented pesticide-free livestock feed.  Our ""Grass2Cash"" system saves turf managers time and resources while making small farmers & ranchers more sustainable & profitable. "
Yegomoto,https://www.crunchbase.com/organization/yegomoto,"Internet, Ride Sharing, Transportation",Yegomoto is a Singapore-based motorcycle ride-hail company.,"Yegomoto is a motorcycle ride-hail company based in Rwanda. It aims to make Rwanda’s motos more efficient while bringing transparency and fairness to the fares, for both, the driver and passenger. Yegomoto equips the motos with a Yegomoto Meter, which calculates the fare (based on distance travelled and time taken) and helps drivers navigate in real-time.  Yego is also set to introduce prepaid “Tap & Pay” contactless cards, which means that passengers no longer have to worry about carrying exact change to pay their fare. Yego’s Tap & Pay cards work over USSD and utilize NFC technology, allowing passengers to pay fares from their linked mobile wallet by simply tapping their cards onto the Yegomoto Meter. The platform will become the logistics basis for e-commerce in Kigali, and later in the rest of the country. Since only 30% of the phones in Rwanda are smartphones, Yego is aware that their services need to be accessible to feature phone users, as well Yego is currently in the process of creating a Butler Service whereby users could order goods and services to their doorstep! Yego will use the very same logistics network it has created to deliver the goods and services to the caller via a Yegomoto, while providing drivers and businesses additional revenue opportunities. "
YesMom Pte. Ltd.,https://www.crunchbase.com/organization/yesmom-pte-ltd,"Artificial Intelligence, Health Care, Machine Learning, mHealth, Women's",YesMom uses machine learning to deliver personalised health insights to women and families.,"YesMom creates mobile apps for women and families that use machine learning to deliver personalized, and clinically validated healthcare insights. YesMom's first application – YesMom Fertility & Ovulation – is women’s menstrual and sexual health tracker to either help women conceive naturally or simply track their menstrual cycle. It aims to educate women about their body and track symptoms to identify abnormal patterns that could be an early indication of health concerns. YesMom will soon be able to offer necessary context to either its users' regular physician or to a doctor who can advise them directly via the app’s Expert Chat functionality."
YesChef,https://www.crunchbase.com/organization/yeschef,"E-Learning, Education, Media and Entertainment","Online classes taught by the world's best chefs, so that anyone can learn how to be a chef at home.","YesChef is an online e-learning platform for home gastronomy, offering exclusive video classes from world-renowned chefs, with immersive storytelling, hands-on teachings and rich interactivity, to create a brand-new type of learning experience for home cooking. Each class is a journey with the chef, who shares, imparts and teaches the techniques and food personal to them, letting you cook alongside in real-time, when you want and on any device. YesChef is in development with some of the world’s best chefs and building our technology.  Launching in 2019."
Yellow Mobile,https://www.crunchbase.com/organization/yellow-mobile,,Yellow Mobile,
Yellow Pages India,https://www.crunchbase.com/organization/yellow-pages-india,"E-Commerce, Local Advertising, Local Business, Online Portals, Web Design","Indian Yellow Pages directory invites all B2B manufacturers suppliers to add free listing with contact, website, phone & address.","Search within 1,00,000+ registered business companies profiles of manufacturers, suppliers and service providers with their products and services from India. The B2B portal and yellow pages directory give opportunity to Contact buyers & sellers and they can post their inquiries and product requirements. The one of the most searchable classified Ads directory to add the local business for free of cost."
Yen,https://www.crunchbase.com/organization/yen,"Blockchain, Cryptocurrency",A Cryptocurrency Social Exchange,A Cryptocurrency Social Exchange
YesPlz!,https://www.crunchbase.com/organization/yesplz,"Information Technology, Internet, Location Based Services, Marketplace, Mobile, Social Media",YesPlz! helps users find service providers based on location and the type of service they require.,"YesPlz is a location-based, service provider powered, barter marketplace.  A hub where service providers can connect on a hyper local level to discuss an exchange of services."
yes.com,https://www.crunchbase.com/organization/yes-com,"Banking, E-Commerce, Internet, Mobile Payments, Venture Capital",yes® is the trust network for banks and their customers.,"yes.com is the trust network for banks and their customers. Without having to create a new account, users can use yes® to log in to third-party providers or pay for contracts based on their online banking login. yes® works out-of-the-box with every bank. An integration is not necessary, but more fun. In the active bank model , yes® helps participating banks to consolidate rather than lose the customer interface and also establishes a new market for value-added products."
Yes Communities,https://www.crunchbase.com/organization/yes-communities,Residential,"Yes Communities is manufactured home communities that were customer-driven, innovative.","YES! Communities was established in 2007 by a team of industry veterans that had a vision to operate manufactured home communities that were customer-driven, innovative and where the resident was truly hearing YES! to building a community all their own. This vision has manifested into a company that is providing customers with an affordable place to live and a culture that continues to say YES! to their residents.  At YES! Communities our staff is committed to helping you enjoy the conveniences of an affordable, attractive home that fits your needs. Our innovative financing model looks at the whole individual and not just the score from a credit report. As a result, our lending partners can provide our customers opportunities for low hassle payment solutions whether they choose to rent or buy a home. We offer multiple approaches to financing, including:"
Yeda Research and Development Co. Ltd,https://www.crunchbase.com/organization/yeda-research-and-development-co-ltd,"Association, Biotechnology, Real Estate",Yeda Research and Development Company is protecting the intellectual property of the institute and its scientists.,
Yellowbrix,https://www.crunchbase.com/organization/yellowbrix,"B2B, Consulting, Infrastructure",Yellowbrix is the Business-to-business infrastructure provider.,"YellowBrix got its start in late 1997 as NewsReal when a few key executives decided to spin off the Corporate Information Division of InfoSeek. But that’s only part of the story – Co-founders David Hoppmann and Jeff Massa met in 1993 and brought to the relationship two great assets — Jeff had extensive experience working with artificial intelligence and neural networking for the White House and David had leadership experience. Together, they saw that, while the Internet was becoming the world’s largest content provider, not everyone had the resources to create their own content. Together, their vision was to develop the potential of smart technology to provide news content and business information to Web sites and their users. The result was the creation of a content infrastructure services company with a top-notch executive team, powerhouse investors like CNNfn and the Walt Disney Company, and top-of-the-line technology. As the company grew and developed more applications for their Intelligence Engine, they outgrew the name NewsReal. In February of 2000, the name was changed to YellowBrix to reflect the optimism and possibilities of the Internet."
"Yegii, inc.",https://www.crunchbase.com/organization/yegii-inc,"Analytics, Market Research, Predictive Analytics, SaaS, Search Engine, Service Industry, Software","Yegii, the insight network, is building the preferred man/machine interface for tomorrow’s professional.","Yegii, the insight network, is a search engine for industry professionals."
Yeelight,https://www.crunchbase.com/organization/yeelight,"Drones, Electronics, Internet of Things, Manufacturing",Yeelight offers a series of smart and wireless LED lightning products.,
Yerra Solutions,https://www.crunchbase.com/organization/yerra-solutions,"Legal, Software","Yerra Solutions offers Consulting, Technology-led managed services to enable legal & eDiscovery functions reach their full potential.","Yerra Solutions, a company is headquartered in Switzerland, with registered offices in Switzerland, UK, US, Polnd & Singapore. Yerra Solutions offers three fundamental service offerings to its Fortune 500 clients: (i) strategic and operational consulting to legal and IP departments; (ii) managed services for eDiscovery and law firm Panel Management; and (iii) software applications to support its consulting and managed services offerings. Yerra Solutions focuses on Europe and APAC, although many of its clients are leading global organisations."
Yeke Network Radio,https://www.crunchbase.com/organization/yeke-network-radio,"Photography, Video","Yeke Network Radio offers Quick Yeke, an app that enables listeners to savor urban life in rhythms.","Yeke Network Radio (椰壳网络电台) is a network broadcasting application that focuses on sounds and cities, with the subordinate APP """"Quick Yeke"""" of China Mobile. Yekefm.com was officially launched on November 11, 2013. With the theme """"sounds and cities”, it enables the listeners to savor urban life in rhythms, and listen to their inner voice in the hustle and bustle of cities. The presenters in Yeke come from Hon Kong, Taiwan, Beijing, and Shanghai. Yeke has built a series of five-minute programs such as """"Yeke Quick Listening"""", which offer audiences the latest fashion information, a medley of popular songs, a bunch of jokes, and even home-style dishes that are shared for foodies by """"top chef."
Yello Co. Ltd,https://www.crunchbase.com/organization/yello-2,Marketing,"Yello’s first platform, the YelloPad, is a smart point of sale and integrated marketing.","Yello’s first platform, the YelloPad, is a smart point of sale and integrated marketing and payment terminal that allows merchants to enrich the consumer experience, and provide value-added services. It defines the new generation of payment terminals: secure, simple, powerful, and open, with universal payment acceptance and at an affordable price. With its game-changing architecture and business applications, it is perfect for both fixed and mobile use. YelloPad is designed for a wide range of industries including retail, hospitality, healthcare, and loyalty, benefitting acquirers, merchants, and consumers. The YelloPad brings face-to-face marketing and payments together for the first time."
Yep Ads,https://www.crunchbase.com/organization/yep-ads,"Advertising, Affiliate Marketing, Marketing","Yep Ads is a premiere performance online network, specializing in the full spectrum of mobile offers.","Yep Ads is the leader of performance digital marketing, and have extensive experience with advertising and product development. Specializing in the full spectrum of mobile offers: Cost-Per-Acquisition, App Installs, Mobile Lead Gen, Trial campaigns Their artistry with consistency, creativity, innovation has allowed us to grow globally.  Yep is committed to their global partners by interfacing with 3rd party technology seamlessly, this allows us to provide the top converting offers to their affiliate partners, and optimize the highest ROI profitability for their advertising clients."
Yealink,https://www.crunchbase.com/organization/yealink,"CRM, Information Technology, Software, Telecommunications",Yealink is a provider of VoIP Phone and IP communication solutions.,"Founded in 2001, Yealink, the global leading UC terminal solution provider, is dedicated to communication telephony innovations. Customers from more than 100 countries and areas worldwide enjoy Yealink’s reliable UC terminal solutions to enhance communication and collaboration."
Yeo Hiap Seng,https://www.crunchbase.com/organization/yeo-hiap-seng,Food and Beverage,Yeo Hiap Seng is an investment holding company as well as a drink manufacturer.,"With more than a hundred years of history & rich heritage, YEO’S has successfully established itself as a well-loved household brand not only in Singapore, but also in many countries around the world.  Yeo Hiap Seng strives to pursue continuous excellence in its innovation and given its intimate knowledge and understanding of consumers’ needs and trends, it has developed a diversified range of food and beverage products that have made strong footprints in many parts of the world. Given its firm belief in producing products of the highest quality, YEO’S has successfully expanded beyond Asian horizons and is making its mark as a well-known international brand.  Yeo Hiap Seng is a public listed arm of Far East Organization, which is affiliated to the Sino Land Group. For more information, please visit www.fareast.com.sg."
Yellowstone Landscape Group,https://www.crunchbase.com/organization/yellowstone-landscape-group,Environmental Consulting,"Provides commercial landscape maintenance and installation services to over 1,500 homeowners' associations","Formed in 2008, Yellowstone’s mission remains to identify successful, regional landscape companies and support them as they grow to their full potential.  Over the past 6 years, we have worked strategically to implement each company’s best practices across our organization.  In that time we have also become one of the country’s largest full service landscape service firms and most importantly - one of our industry’s most respected.  Our companies offer their clients the stability of one of the nation’s largest providers, paired with service excellence delivered by dedicated local teams."
Yesbit Technology LTD.,https://www.crunchbase.com/organization/yesbit-technology-ltd,"Bitcoin, Blockchain, Ethereum, Financial Exchanges","Blockchain, Fintech",1. Focus on Fintech using blockchain technology 2. Crypto investment 3. Decentralized software development. 4. Linkcoin.pro OTC Crypto platform
Yenlo,https://www.crunchbase.com/organization/yenlo,"Consulting, Open Source, Software","Expert in integration, focus on WSO2 open source middleware technology","Yenlo is Dutch-based software development and consulting company focused on middleware and business process management. The company was founded in 2007, the founders still acting as members of the team have an accumulated experience of over 35 years in the IT and gained in-depth architectural knowledge in the area of service-oriented computing, business process management and cloud computing. With a team of senior professionals they deliver solutions for current and future business challenges globally."
Yeigo,https://www.crunchbase.com/organization/yeigo,Mobile,Yeigo offers VoIP services that allow mobile phone users to make free calls.,"Yeigo is an exclusively Mobile VOIP service that enables free mobile calling between Yeigo users.  It requires a download, but is currently available through WiFi, GPRS, EDGE or 3G services on Windows Mobile 5 and 6 phones and Symbian operated mobile phones. In addition to calling other Yeigo users for free you can use such platforms as Facebook, Skype, GoogleTalk, MSN Messenger, ICQ, AIM and Jabber to message or call for free.  Calls to non-Yeigo users are not free but are similar in cost to other mobile VOIP services.  Yeigo has a real time contact availability feature which allows users to set their status, thus giving the user presence and the abilty to see who is online before you calling or messaging. Yeigo also allows users to make SimCard-less free calls. Yeigo prides itself on call quality and claims it has minimal latency.  Yeigo is an independent mVOIP application that is free of existing VOIP networks and services such as [Sykpe](http://crunchbase.com/organization/skype).  Competitors include [JaJah](http://crunchbase.com/organization/jajah), [Skype](http://crunchbase.com.company/skype), [ConnectMeAnywhere](http://crunchbase.com/organization/ConnectMeAnywhere), [GizmoProject](http://crunchbase.com/organization/gizmoproject), [barablu](http://crunchbase.com/organization/barablu) and others."
Yesil Science,https://www.crunchbase.com/organization/yesil-science,"Fitness, Health Care, Information Technology, Software",Digital Health Technologies,"Yesil Science, developing products that will bring together the medicine, technology and art. Designing creative software with the AI and AR / VR / XR technologies."
Yesky,https://www.crunchbase.com/organization/yesky,"E-Commerce, Internet, News, Software","Yesky.com is an IT consumption portal providing information and interactive platforms such as market quotations, shopping guides, and more.","Yesky.com is an IT consumption portal that provides information and interactive platforms such as market quotations, shopping guides, applications, evaluation, testing, and software downloads of IT products. Its aim is to build a large IT-based network media. Established in 1997 as Computer news, the company was later renamed as www.yesky.com."
YepLike!,https://www.crunchbase.com/organization/yeplike,"Apps, iOS, Location Based Services, Photo Sharing, Social Media","YepLike! is an iOS application that enables users to snap pictures, rate them, and share them with others.","YepLike is a fun & quirky way to share your like with friends through a series of pictures. Snap a photo with your iPhone, then choose if you Like or Dislike, Win or Fail, Love or Hate, and than more badge. We're building the platform to allow you to share preference in your friends' lives through pictures as they happen. Simple... Photo, rates... share!"
