Organization Name,Organization Name URL,Categories,Description,Full Description
Year Later,https://www.crunchbase.com/organization/year-later,"Artificial Intelligence, Automotive, Autonomous Vehicles, Electric Vehicle, Information Technology, Robotics",It is not about refining cars. It is about refining life.,"Turning the car into the next-generation smart device requires combined forces right from the start. One driver of change are the automotive engineers, who are constantly opening up innovative forms of mobility with new technologies. Similarly important are the computing experts who are pushing the boundaries of mobility through digital transformation. Never before have both these drivers of change been so effectively united in a single company. At Year Later automobiles and digital literacy are equally at home with each other."
"Yes Man Enterprises, Inc",https://www.crunchbase.com/organization/yes-man-enterprises-inc,"Blockchain, Internet, Social Media, Software","Development & Launch of Apps, Cryptocurrencies & ICOs",
Yemp.co,https://www.crunchbase.com/organization/yemp-co,"Event Management, Internet",Yemp.co for great value and impressive business events thanks to machine learning!,"Yemp.co| Your Event Market Place is NOT an online Agency. It is NOT another online directory trying to be innovative. It is a real step-by-step tech tool that allows efficient set-up, booking, management of events AND measurement of their success. A tool that uses machine learning to get to know customers behaviors and specific needs. A tool that figures out market trends and provides guidance and advice for both customers and providers.  Yemp.co disrupts the event industry bringing transparency, structure and creating win-win relationships between clients, providers and agencies. For great value and impressive events in a few clicks!"
Yellgar,https://www.crunchbase.com/organization/yellgar,Dating,"Sweet, Safe and Secret / Mutually Beneficial Arrangements / Sugar Daddy Dating",
YellowPagesunited.com,https://www.crunchbase.com/organization/united-directories-yellowpagesunited-com,Internet,National business directory service that contains yellow pages and white pages.,National business directory service that contains yellow pages and white pages.
Yeoman Shield,https://www.crunchbase.com/organization/yeoman-shield,"Health Care, Manufacturing, Security","Yeoman Shield manufactures and distributes wall, bump rail, bollard and door protection products to its clients.","Yeoman Shield specialise in increasing the durability of your buildings interiors. From corridors and stairwells through to fire doors, warehousing and high traffic areas, our range of wall protection, door jamb protection, fire doors, bump rails, corner protectors and bollard solutions deliver everything you need to preserve the structural integrity and visual appeal of your property."
YesAdvertising,https://www.crunchbase.com/organization/yesadvertising,Advertising,Yes Advertising is an advertising company focused on digital media.,YesAdvertising.com is an affiliate network that serves as a platform for affiliates and merchants.
Yes I'm a Designer,https://www.crunchbase.com/organization/yes-i-m-a-designer,"Advertising, Education, Graphic Design, Internet, Training, Tutoring, Web Design",Yes I'm a Designer is a creative agency that specialises in creating engaging online learning courses and tutorials.,"Yes I'm a Designer is a creative agency that specialises in creating engaging online learning courses and tutorials. Their mission is to inspire, educate and help others to become professional and successful designers."
Yerba Buena Center for the Arts,https://www.crunchbase.com/organization/yerba-buena-center-for-the-arts,Health Care,Yerba Buena Center for the Arts (YBCA) is  the nation's innovative contemporary arts centers.,
Yena,https://www.crunchbase.com/organization/yena,"Association, Communities, Incubators, Social Network, Subscription Service","A global membership community for rebels. A accessible subscription, helping anyone, anywhere to start & grow a remarkable business. ",
Yella,https://www.crunchbase.com/organization/yella-rewards,"CRM, Information Technology, Internet of Things, Loyalty Programs, Retail, Sensor",The Smart Rewards Program,Yella rewards consumers for telling businesses how to deliver better in-store experiences. Their restaurant and retail customers use their sensor technology to drive foot traffic and understand the customer once she's inside of their store.
Yellowbus Solutions,https://www.crunchbase.com/organization/yellowbus-solutions,"Information Services, Web Development, Web Hosting","Yellowbus Solutions is a team that offers fully managed IT support that combines a suite of services into a single, fixed-fee package.",Yellowbus Solutions provide IT Support and Web/Software Development to the North-West of England. We are based at birchwood park in Warrington and have established a strong client base within the nuclear industry.
Yellow Brick Systems,https://www.crunchbase.com/organization/yellow-brick-systems,"Consulting, CRM, Publishing",A salesforce.com consulting partner firm,"Yellow Brick Systems is a salesforce.com partner firm with expertise in designing, developing and implementing custom business solutions on the Salesforce platform.  Yellow Brick works extensively with Higher Education and Publishing and Media organizations primarily on the East Coast. Yellow Brick's services include custom CRM implementations, custom application development, process design and custom training."
Yes Crew,https://www.crunchbase.com/organization/yes-crew,"Digital Marketing, Marketing","Yes Crew is an online platform that provides its users with risk free, online marketing services.","Yes Crew is an online platform that provides its users with risk free, online marketing services. It also allows its users to make extra money by referring off business. By using its network users have the ability to offer more services to increase the ways they make money. Yes Crew was launched in 2014 and is based in Los Angeles, California."
Yedap.com,https://www.crunchbase.com/organization/yedapmedia,"Ad Network, Advertising Platforms",The 21st Centuries Global Rich Media Ad-Network.,"Yedap.com is digital advertising company which serve quality digital ads on various platforms, all around the world with targeting right peoples. Established in 2012, Yedap is the leader in targeted display & mobile advertising network. Reaching two million mobile users and ten million display users worldwide, Yedap connects advertisers, marketers and agencies to our exclusive properties. The advertising and data platform powering the online economy. We have access to set of web-based, easy-to-use, solutions and services to manage, market & serve their products."
Yellow Tie Hospitality,https://www.crunchbase.com/organization/yellow-tie-hospitality,Hospitality,Yellow Tie Hospitality is India's first and only professional F & B Franchise Management Company.,"Yellow Tie Hospitality is India's first and only professional F & B Franchise Management Company. Yellow tie focus on building capabilities to grow brands in a sustainable approach and help franchise entrepreneurs with adequate tools and support, enabling them to focus on delivering last mile guest experience."
Yet5.com,https://www.crunchbase.com/organization/yet5-com,"Corporate Training, EdTech, Education",Yet5.com is an exclusive platform for training providers to reach training seekers. Yet5.,"Yet5.com is an exclusive platform for training providers to reach training seekers. Yet5.com Provides Training Leads, Branding, Training Market, Training classifieds, Training Jobs to training providers."
YepOffers,https://www.crunchbase.com/organization/yepoffers,Internet,YepOffers is an International Discount Provider offering its visitors with all kinds of discount codes,"YepOffers is an International Discount Provider offering its visitors with all kinds of discount codes and vouchers for several categories of products and services.  YepOffers Austria is a specific platform for Austria based visitors who are keen interested in saving money on Online Shopping. YepOffers Austria focuses on offering several kinds of discount coupons and offers for various range of products and stores like Asos, H&M, Expedia, Puma, Sarenza along with several others."
yeParking,https://www.crunchbase.com/organization/yeparking,"Apps, Parking",yeParking is an app for park-sharing in Romania.,"yeParking is an app for park-sharing in Romania. Here you can find a parking space when you need it. yeParking is the application that comes to your aid whether you are the owner of a parking lot, or you are just a driver who wants to park safely and carefree. In the yeParking community, people help each other by providing their parking spaces with subscription while they are unoccupied. If you own a parking space with a subscription, you can distribute it in the yeParking platform for the period you do not use it."
Yellow Market,https://www.crunchbase.com/organization/yellow-market,"E-Commerce, E-Commerce Platforms",Yellow Market is a e-commerce cum local e-shop portal for indore people where indore people can buy anything.,Yellowmarket is a e-commerce cum local e-shop portal for indore people where indore people can buy anything from local indore vendors throught Yellowmarket.
Yego,https://www.crunchbase.com/organization/yego,"Apps, Mobile Payments, Ride Sharing, Smart Cities, Transportation",Empowering Taxi Drivers for a Sustainable Future,"Yego is a technology company which has designed a complete Mobility Solution to make transportation services in Africa efficient, safe and secure. Though taxis are a major avenue of youth employment, the prospects for drivers are uncertain and inadequate. Yego aims to redeem the work of drivers by bringing transparency, accountability and fairness to an informal industry."
YE DIGITAL,https://www.crunchbase.com/organization/ye-digital,Internet of Things,YE DIGITAL offers innovative IoT solutions.,"YE DIGITAL, Inc. is a global strategic base of YASKAWA INFORMATION SYSTEMS. They can offer innovative IoT solution. It combines technical services cultivated in Japan with innovative products in SV. They are supporting startups."
YETI Group,https://www.crunchbase.com/organization/yeti-group,"Information Services, Mobile, Search Engine",YETI Group is a marketing and advertising company.,"YETI Group Ltd. owns and operates www.easou.com, a mobile search engine that offers information services to mobile phone users. The company provides marketing and advertising services to small and medium sized enterprises."
YellowFish Software,https://www.crunchbase.com/organization/yellowfish-software,"Computer, Software",YellowFish Software was founded in 2001 out of pure frustration with the current state of help desk software.,"YellowFish Software was founded in 2001 out of pure frustration with the current state of help desk software. Available applications were too expensive, too limiting and were so inefficient that, in many cases, it took longer for a technician to log a ticket than to fix the issue. Since that time they have continued to work with their customers to evolve Revelation helpdesk into the premiere help desk application it is today. "
Yellow Mouse Studios,https://www.crunchbase.com/organization/yellow-mouse-studios,"3D Technology, Animation, Art, Graphic Design, Media and Entertainment, Motion Capture",We create content using techniques ranging from Stop-Motion to 3D,"Yellow Mouse Studios Ltd, is a creative independent animation studio, that works in techniques ranging from Stop-Motion to 3D   Our ethos is to find creative solutions that provide our clients with a visual product that engages and excites. Whether for advertising, idents, corporate communications or explainer videos, we have the expertise and passion to help. Our creative team have been educated to the highest level, and this can be seen in the knowledge and skill set which they have. Our senior creatives have worked as professional animators in Film, TV and advertising, and this professionalism is evident regardless of the size of the production. Our motto is always - When you are animated, people listen!"
Yeti Trail Adventure,https://www.crunchbase.com/organization/yeti-trail-adventure,"Adventure Travel, Tourism, Travel","Yeti Trail Adventure specializes Himalayan outdoor activities, hiking, tours, trekking, climbing, expedition in Nepal, Bhutan and Tibet.","You are welcome to Yeti Trail Adventure that specializes the Himalayan outdoor activities, hiking, tours, trekking, climbing, mountain biking,  rafting, bungee jump, paragliding, canyoning, skydiving, vehicle renting, domestic and international flight tickets, hotel booking, guide and porter service. We design a better holiday trip in Nepal, Bhutan, Tibet and India from Kathmandu. Welcome to the best Nepal Tour & Trekking Company that is an authorized by the Nepal government, based in Kathmandu. An experienced trekking and tour guide runs the agency who has explored the tourism field since 1992. We trust on responsible tourism. All our staffs are professional who response visitor’s suggestion and advice on time. We have been successful business by our former guest recommendation. Visit us at : http://www.yetitrailadventure.com"
YellowBridge,https://www.crunchbase.com/organization/yellowbridge,Education,YellowBridge is the premier guide to Chinese language and culture for English speakers.,"YellowBridge is the premier guide to Chinese language and culture for English speakers.  Their goal is to provide a cultural bridge to anyone interested in getting an insider's view of Chinese civilization and language. Their comprehensive tools for learning the Chinese language have been very popular with students from around the world. Although there are many China-related websites, ours is unique because They  emphasize strong, original content, simple design, and ease of use via the innovative use of web technologies."
Yellowbag,https://www.crunchbase.com/organization/yellowbag-com,"Developer Platform, E-Commerce, Internet, Web Apps",Yellowbag is an online discount platform.,"Yellowbag is an online discount platform. Yellowbag allows its users to search for product, brand, web shop, and category discounts."
Yellow Box,https://www.crunchbase.com/organization/yellow-box,,Growth Agency,
Yeezey,https://www.crunchbase.com/organization/yeezey,"E-Commerce, Events, Location Based Services, Mobile Apps, Travel",Explore local select shops at private club prices.,Yeezey connects local members and boutiques from selected cities around limited-time private sales events all through the yeezey mobile app.
Yemek Motoru,https://www.crunchbase.com/organization/online-yemek-siparişi,"E-Commerce, Food Processing, Hospitality, Organic Food",Online yemek siparişi yemekmotoru ile artık çok daha kolay.istanbulda yüzlerce restoran ile yemek siparişinin yeni adresi,Online yemek siparişi yemekmotoru ile artık çok daha kolay.istanbulda yüzlerce restoran ile yemek siparişinin yeni adresi
Yellowball,https://www.crunchbase.com/organization/yellowball,"Advertising, Marketing","Yellowball are a design & digital marketing agency based in London specialising in web design, graphic design, SEO and Social Media",
Yeah1,https://www.crunchbase.com/organization/yeah1,"Biotechnology, E-Commerce, Food and Beverage, Manufacturing",Yen Viet Joint Stock Company is the first company to successfully apply Yen bird model in Vietnam.,"Currently, Yen Viet is a leading company in the market of high quality Bird's Nest, products from Yen and natural nutritional products with over 80 stores nationwide and a nationwide distribution system. . The factory Processing Yen Viet's Nest Nest is located in Phan Rang, with a large scale and the most modern processing technology, meeting the ISO 22000: 2005 & HACCP standards for the products of Bird's Nest, products made from Nest and high quality natural nutrition products for consumers. In 2013, Yen Viet cooperated strategically with the Institute of Biotechnology and Environment, Nha Trang University to research and sustainably develop Vietnam's Natural Swallow's Nest, bringing high quality products from Bird's Nest. to consumers."
YEI Corporation,https://www.crunchbase.com/organization/yei-corporation,,"The YEI Corporation was founded in 1999 in Portsmouth, Ohio and serves clients across the United States and internationally.",
Yeager Marketing,https://www.crunchbase.com/organization/yeager-marketing,"Advertising, Content Marketing, Marketing","Yeager Marketing creates marketing strategy, content, communications and campaigns that deliver.","Yeager Marketing works with leading technology organizations to produce innovative marketing strategies, cutting-edge content, and award-winning campaigns that streamline customer acquisition and accelerate growth. By helping define relevant issues and market needs for buyers, the company offers the unique ability to articulate an organization’s value to their market in a way that resonates and enables organizations to break away from competitors. Founded in 2008, Yeager has produced award-winning marketing programs for more than one-third of the technology companies in the Fortune 500."
YesWeShare,https://www.crunchbase.com/organization/yesweshare,"Communities, Internet","YesWeShare is the sharing platform that allows you to find a simple, fast and secure answer to your daily needs with your community-company.","YesWeShare is the web app that allows coworkers to find a fast, easy and secure answer to their daily needs within their company community : informations & skills, goods & services, affinities & activities. YesWeShare is the 360° sharing platform contributing to social link and individual well-being at work, fostering belonging and engagement between employees."
Yeyeye.com,https://www.crunchbase.com/organization/yeyeye-com,Music,"Yeyeye.com, a music music and entertainment portal in Latin America and the U.S. Latin market.",
Yeppon,https://www.crunchbase.com/organization/yeppon,"Customer Service, E-Commerce, Retail",Yeppon is a company that provides internet technology branding.,Yepponis an Italian electrical e-tailer operating. Yeppon has been growing its market positions in Italya as an Indepent player in the Retail World. Yeppon now serves more than 500K customers over Italy with a wide range of product categories. http://www.yeppon.it/chisiamo/ You can find more
YesGnome,https://www.crunchbase.com/organization/yesgnome,Virtual Goods,YesGnome is an establishment that specializes in mobile gaming with an emphasis in free games.,
Yellowshape,https://www.crunchbase.com/organization/yellowshape,"Digital Marketing, Local Advertising, Mobile Apps, SEO, Software, Web Apps, Web Design, Web Development","Yellowshape is an Antwerpen based digital agency offering web designing, web development, SEO, SEM and other online marketing solutions.","Yellowshape from Antwerp makes and optimizes websites and does online marketing for small to medium-sized businesses. Our motto? Think first, then spend. During the Yes-workshop we will get to know your business, customers, story, and vision. You also develop insight into your possibilities on the internet. Together with our marketing and web experts, you work out an internet strategy based on know-how, facts, and proven results."
Yerkir real estate agency,https://www.crunchbase.com/organization/yerkir-real-estate-agency,Real Estate,"We provide realty services, legal support, draw documents for purchase, sale, rent of housing and commercial real estate in Yerevan.",
YesOrNoLive,https://www.crunchbase.com/organization/yesornolive,"Fitness, Gaming, Internet, News, Sports",Predict outcomes of News Stories and Earn some Extra Income,"At YesOrNoLive, Nigerians can earn cash by predicting outcomes of news stories on Entertainment & Lifestyle; Politics; Business  & Economy; Sports  and General topics A predictor stakes any amount of money s/he desires (minimum is 200 Naira), in order to predict on a particular position (YES or NO). If, eventually they win, they get their stake plus winnings. On the other hand, if they lose, they get nothing. All games on YESorNoLive.Com are winner-takes-all games. All winners share from the ‘pot’, which consists of the stakes of all participants (on both winning and losing sides), relative to their stakes. Monies are paid into wallets in each player’s account."
YesData,https://www.crunchbase.com/organization/yesdata,"B2B, CRM, Database",YesData connects Salesforce.com to the best curated database of B2B buyers in the world,"YesData’s world class, and carefully curated CRM business database delivers leads directly into Salesforce.com. With more than five million phone verified company profiles and 17 million contacts, YesData makes it simple to search for targeted leads and ensures that the most up-to-date contact information is available. Both YesData Clean and YesData Lead allow businesses to automate operations, streamline processes and access real-time business quickly and easily, helping them to make an impact on their bottom-lines."
Yes Web Design Studio,https://www.crunchbase.com/organization/yes-web-design-studio,"Digital Marketing, Graphic Design, Web Design, Web Development","A Web Design Company in Bangkok, Thailand","A Web Design Company in Bangkok, Thailand, providing Web Development, Website Design, Graphic Design, Online Marketing, Presentation Design and Copywriting."
Yearstream Multimedia,https://www.crunchbase.com/organization/yearstream-multimedia,"Media and Entertainment, Publishing",Yearstream Multimedia is a start-up education based media company.,
YepDoc,https://www.crunchbase.com/organization/yepdoc,"Health Care, Information Services, Scheduling",YepDoc is a platform that enables users to schedule appointments with doctors online.,YepDoc is a platform that enables users to schedule appointments with doctors online. It was founded in 2012 by Guilherme Pizzini.
YeuDongVat Foundation,https://www.crunchbase.com/organization/yeudongvat-foundation,"Association, Communities, Internet, Non Profit","YeuDongVat Foundation is an online platform, community, and forum for the discussion of animal welfare.","YeuDongVat Foundation is an online platform, community, and forum for the discussion of animal welfare. It is focused on building a community of animal lovers in Vietnam. It organizes community events such as YDV relief operations, vegetarian-friendly campaigns, sterilization programs, and more. It also offers pet adoption. Its forum offers a discussion platform for members and animal experts to discuss about various issues and topics related to pets and animal care. YeuDongVat Foundation is affiliated to Animals Asia, Humane Society International, and Kairos Coalition. It is a non-profit organization that functions on the contributions that it receives. It was established in August 2010, based in Ho Chi Minh City, Vietnam."
Yestock,https://www.crunchbase.com/organization/yestock,Car Sharing,Car rental service provider based in Shenzhen.,
Yea Networks,https://www.crunchbase.com/organization/yea-networks,Health Care,Yea Networks has been a creator of iOS applications for a while now. There application Kiddnation has had more than 50000 downloads in the,Yea Networks has been a creator of iOS applications for a while now. There application Kiddnation has had more than 50000 downloads in the recent past. One could watch and listen to television by using this application.
Yellowstone,https://www.crunchbase.com/organization/yellowstone,"Apps, Communities, Mobile",Mobile applications for communities,Mobile applications for communities
Yes We Code,https://www.crunchbase.com/organization/yes-we-code,"SaaS, Software",Décuplez votre potentiel d’innovation ! Applications - Big Data - IA Chatbot,"Applications : Des outils développés sur-mesure avec les meilleures technologies du marché. Big Data : Collecter, structurer, analyser, visualiser : définissons vos leviers de performance grâce à l’exploitation des données. Bot & IA : Une nouvelle expérience pour la relation avec vos clients ou vos collaborateurs."
YetGo,https://www.crunchbase.com/organization/yetgo,"Computer, Information Technology, Internet, Software, Travel","YetGo works tirelessly to assist you any time, day or night, and provide the best experience, making each race an unforgettable adventure.","Yet GO works tirelessly to assist you any time, day or night, and provide the best experience, making each race an unforgettable adventure. Your feedback directs our improvements, evaluate your driver, and give feedback on the trip with us. Your contribution helps us always improve, always seeking to be a 5 star company and provide the best experience possible."
Yesharvest,https://www.crunchbase.com/organization/yesharvest,"Retail, Retail Technology",Yesharvest is an online/offline retailer of animal proteins in Nigeria.,"Yesharvest is an online/offline retailer of animal proteins in Nigeria. Our mission is to make beef hygienic enough for the middle/high income earners, and affordable enough for the low  income earners in Nigeria. We are doing this by aggregating demand for beef directly from consumers and aggregating supply for bulls directly from cattle farmer, thereby eliminating middlemen and collapsing the supply chain. To ensure an all-inclusive retail approach, we distribute both online, via our website and in our offline walk-store."
