Organization Name,Organization Name URL,Categories,Description,Full Description
easyBacklog,https://www.crunchbase.com/organization/easybacklog,"Project Management, Software",Agile backlog management for agencies,"easyBacklog is an agile backlog management tool design for agencies or companies working on fixed cost or fixed scope projects.  The focus of this product is to reduce time spent managing backlogs, control project overrages, provide real time reporting and simplify sprint management.  This product is not another project management or project collaboration tool, it is meant for scrum masters and project managers, and it does not attempt to replace the real world interactions that are still required to make agile projects effective, it simply enhances them."
EAM Advertising,https://www.crunchbase.com/organization/eam-advertising,"Advertising, Marketing, Social Media Advertising, Travel",EAM Advertising is specializes for Airport and Inflight Media Advertising.,"EAM Advertising is the Smart Choice for Airport and Inflight Media Advertising. Their team has executed airport and inflight campaigns in over 65 airports, onboard 25+ airline carriers and on 4 continents from our office in Los Angeles."
EastCoast Entertainment dba ECE,https://www.crunchbase.com/organization/eastcoast-entertainment-dba-ece,Media and Entertainment,"EastCoast Entertainment (ECE) is the largest, full-service entertainment agency in the United States.","EastCoast Entertainment (ECE) is the largest, full-service entertainment agency in the country, arranging unforgettable entertainment and producing custom events from coast-to-coast and around the world. From weddings and social galas to college concerts and business entertainment, we make your event a once-in-a-lifetime experience!"
EasyCount.io,https://www.crunchbase.com/organization/easycount-io,"Food and Beverage, Restaurants, Software",Count your stock/inventory 68% faster using EasyCount. Eliminate the need for pen & paper counting and double entry.,"EasyCount is free on mobile, tablet and computer. Count your stock wherever you are. Count your stock/inventory 68% faster using EasyCount. Eliminate the need for pen & paper counting and double entry. With EasyCount, you're able to count your inventory in the palm of your hand with your own mobile device. You don't even need an internet connection to conduct your count, you only need it for the setting up and saving of your stocktake. You can create products, count in any location & view an audit trail. On the EasyCount Web Platform you'll get access to; viewing reports, creating suppliers, generating gross profits and much more. Free Features • Count your stock • View reports • Create locations, departments & suppliers • Export to Excel • Product file uploads Paid Features • Unlimited products • Gross Profit reporting & generation • Input sales, waste, purchases & labour costs • Full support Contact us below • Website Livechat: https://easycount.io/ • Email: Info@easycount.io • Phone: (+353) 01 9696509"
East Payment Solution,https://www.crunchbase.com/organization/east-payment-solution,"Financial Services, Service Industry",East Payment Solution is a services provider that helps businesses with their credit card processing needs.,"East Payment Solution is a full-service merchant services provider that helps businesses with their credit card processing needs. The companies offer merchant accounts, state of the art technology and secure processing at budget-friendly rates to meet the individual requirements of clients. The company was based in Rockville, Maryland."
Eastman Auto & Power Limited,https://www.crunchbase.com/organization/eastman-auto-power-limited,"Automotive, Battery, Solar",Eastman is a conglomerate of highly motivated individuals with technical prowess par excellence. ,"Built on infallible foundations of technology and racing through the industry with bountiful innovation, Eastman is a conglomerate of highly motivated individuals with technical prowess par excellence. We aim to enrich lives and take the economy with us as we reach new pinnacles of success with every step we take."
EarPeace,https://www.crunchbase.com/organization/earpeace,"Music, Nightlife, Social Media",High-fidelity hearing protection,"EarPeace high-fidelity hearing protection improves live music or nightlife experiences. You'll hear clearly, feel better, and play longer."
Ease2Pay,https://www.crunchbase.com/organization/ease2pay,"E-Commerce, Mobile Payments, Payments",Ease2pay is a payment & loyalty transaction platform with which you can make a cash register and a pinterminal of every smartphone.,Ease2pay is a payment & loyalty transaction platform with which you can make a cash register and a pinterminal of every smartphone. This ground-breaking solution disrupts the market for payments. The free payment app is a smart alternative for expensive retailers for expensive cash registers and pin terminals.
Eagle Window & Door Inc,https://www.crunchbase.com/organization/eagle-window-door-inc,"Manufacturing, Product Design, Real Estate","Eagle Window & Door Manufacturing, Inc., a subsidiary of Andersen Corporation, manufactures a complete line of high-quality aluminum-clad.","Eagle Window & Door Manufacturing, Inc., a subsidiary of Andersen Corporation, manufactures a complete line of high-quality aluminum-clad windows and doors. E-Series/Eagle® windows and doors are a part of the new Andersen® Architectural Collection - an industry-leading, innovative approach to windows and doors that's based not on the type of window or door, but rather on the style of home you want to create.  Create projects using their 50 exterior colors, 11 interior finishes and 9 wood species—plus divided lights, between-glass blinds and shades, trim and finishing details and beautiful glass selections. The design freedom is unmatched in the industry. They have been handcrafting premium windows and doors for over 30 years and are a proud member of the WDMA and many other fenestration associations."
Earl of Sandwich,https://www.crunchbase.com/organization/earl-of-sandwich,Food and Beverage,"Restaurants, Sandwiches, Sandwich Shop","Hungry diners who love hand-crafted sandwiches can count on the experienced staff at The Earl of Sandwich restaurant in Tempe to create something delicious and satisfying from their extensive menu. The casual restaurant specializes in hot sandwiches served on artisan breads for breakfast, lunch and dinner."
Eatsee,https://www.crunchbase.com/organization/eatsee,Lifestyle,EATSEE.DO is a website where users can share their travel experiences.,"eatseedo is platform that helps cultivate personal recommendations, curation, story telling, and discovery. eatseedo lets people create dynamic data-driven lists that can be as easily simple as they are intricate. Social network integration lets users search & discover their friends lists and publish them publicly."
"EAC Consulting, Inc.",https://www.crunchbase.com/organization/eac-consulting-inc,Consulting,"EAC Consulting, Inc. is a civil engineering consultancy firm based in Florida.",
East Kilbride Engineering Services,https://www.crunchbase.com/organization/east-kilbride-engineering-services,"Automotive, Consulting, Energy, Information Technology, Legal, Logistics, Manufacturing",A Germany-based engineering consultancy founded in 1996 by former Rolls-Royce aero engineers.,"East Kilbride Engineering Services (EKES) was formed in 1996 by a core team of highly skilled, professional, Rolls-Royce aero engineers. From this core team, EKES has grown to become a world leading engineering consultancy across a variety of disciplines and sectors. They employ over 300 high-calibre engineers at our UK and Germany offices as well as within a variety of our client's facilities in the UK and Europe. EKES prides itself on its desire and ability to understand the wider engineering issues: providing optimised solutions and recommendations which fulfil our customers' requirements. Today, EKES is recognised throughout the UK and Europe for its engineering expertise providing specialist services to a wide range of industries including Aerospace, Automotive, Marine, Renewables and Oil & Gas."
Easy Chute LLC,https://www.crunchbase.com/organization/easy-chute-llc,"Building Material, Construction, Home Improvement, Home Renovation, Home Services","Construction Trash Chute, Construction Chute,Construction Debris Chute, Roofing Chute","Easy Chute is the creators of the revolutionary new construction trash chute. The Easy Chute is available in 10ft sections, weighing on 3lbs per interlocking section. Designed to be durable to hold up to any construction project and more.  Easy Chute is the Simple, Affordable Construction Trash Removal Chute That Is Changing The Construction Industry. Check Out EasyChute.com Today To Learn More."
EasyMatch,https://www.crunchbase.com/organization/easymatch,Software,EasyMatch is a internet based service.,"Easymatch can add value to your business. How? Through automatching, we can generate more enquiries, more viewings, leading to you selling homes faster and costing you less time and money. To provide the best and most reliable technology to UK based estate agents to achieve growth through superior customer service, innovation, quality and commitment."
EarthSky,https://www.crunchbase.com/organization/earthsky,"Internet, News, Photography, Social Media, Web Browsers",Updated On Your Cosmos And World.,
EasyMail,https://www.crunchbase.com/organization/easymail,Information Technology,"EasyMail Is an integrating company that provides Value Added Services for Companies in Argentina, Chile and Uruguay.",
Easbit,https://www.crunchbase.com/organization/easbit,"Android, Bitcoin, Cryptocurrency, Developer Tools, Mobile, Mobile Payments",Software developer cryptocurrency specialized in Mobile Bitcoin Wallet Technology,"We are a software developer in cryptocurrency and specialized in Bitcoin wallet mobile Android technology. Bitcoin wallets nowadays still have the image of being not user friendly. We want to get rid of this image for Bitcoin.  What distinguished ourselves from the competition is we found a very user friendly way to handle the user unfriendly Bitcoin address. Therefore we developed a wallet which meets 100% the needs for all kind of users.  Feature list: - 100% Granny proof user interface for Android smartphone   - No central storage of your Bitcoins  - All critical data is encrypted  - Uses SSL   - Developed according CMMI level 5 standards  - No complicated Bitcoin address  - Easy backup and restore features  - Sending and receiving of Bitcoins via contacts directly out of your phonebook, QR-codes or Bitcoin URLs   - Conversion to national currency  - We use 100% renewable energy at the server park The app can be downloaded here: https://play.google.com/store/apps/details?id=com.easbit"
Earth Exploration,https://www.crunchbase.com/organization/earth-exploration,Environmental Consulting,Earth Exploration is an engineering and scientific consulting firm dedicated to helping our clients solve their technical needs.,"Earth Exploration, Inc. (EEI) is an engineering and scientific consulting firm dedicated to helping our clients solve their technical needs. EEI is an established organization of consulting engineers and scientists providing a wide range of comprehensive services."
EasyChange,https://www.crunchbase.com/organization/easychange-fca0,"Banking, Payments, Small and Medium Businesses",EasyChange is a quick online money transfers to favourable rates without fees,"EasyChange offer payment transfers in foreign currencies to the entire world (except for countries excluded by valid Czech and EU legislation). They guarantee very favourable conditions specifically for payment within the Eurozone, payment to Asia and USA. Conversion can be also made between your own different currency accounts with Czech banks. Their services are available to corporations, private individuals or associations. "
Ease,https://www.crunchbase.com/organization/ease,"Apps, Financial Services",Ease is a mobile app that puts a personalised financial tool in the pockets of those who need it most.,"Ease is a mobile app that puts a personalised  financial tool in the pockets of those who need it most.  They provide saving and budgeting tools, spending optimisation insights and interest free loans to improve the financial wellbeing of your employees."
eApps,https://www.crunchbase.com/organization/eapps,Information Technology,eApps® Hosting has evolved into a premier provider of application hosting services.,"Apps® Hosting has evolved into a premier provider of application hosting services. The company's staff are experts on some of the most widely used applications, which are delivered and managed using a powerful web based administration interface. Their technical expertise initially focused on Java Application Servers (Tomcat, GlassFish, JBoss, Liferay Portal) for web applications, and relational databases (MySQL, PostgreSQL). Over the years our technical skills have expanded to cover other leading programming technologies and frameworks including PHP with Zend Framework"
Easypurl,https://www.crunchbase.com/organization/easypurl-experiture,"Email Marketing, Enterprise Software, Web Design",Easypurl.com is a cross-channel marketing software and services.,"Easypurl is an online platform that enables its users to create personalized URLs. The platform’s range of services include personalized URLs, variable QR codes, dynamic landing pages, email marketing, reporting, analytics, SMS marketing, and postal tracking. It features one-to-one links, content, communications, targeting, and reporting. Easypurl is based in New York."
Earnest & Associates,https://www.crunchbase.com/organization/earnest-associates,"Computer, Software",Earnest & Associates is a computer software company offering warehouse management systems software.,"Earnest & Associates are profitability improvement specialists supporting mid-market companies in the wholesale distribution and manufacturing industries. E&A's proven technology solutions, industry thought leadership and strategic advice empowers business to improve performance, thrive on change, and capitalize on new opportunities."
Easy Verification,https://www.crunchbase.com/organization/easy-verification,"Financial Services, Machine Learning","4506-T | Tax & Income Verification, IVES direct","Easy Verification provides 4506-T fulfillment to help lenders meet risk & compliance requirements by verifying  borrower provided financial information on a loan application.  Founded in 2006 and relaunched in 2014, Easy Verification is now a fast, accurate and web-based direct to IRS IVES vendor authorized to retrieve IRS tax return data and documents through secured electronic delivery.  Easy Verification believes that speed, convenience, privacy & security should be baked into a simple light-weight system for easy verification."
EasyShiksha,https://www.crunchbase.com/organization/easyshiksha,Education,"EasyShiksha is Jaipur, India based e learning company initiated in 2012. EasyShiksha is an endeavour of HawksCode Softwares Pvt. Ltd.","The aim of EasyShiksha to provide a single platform to educational entities like students, teachers and Institutes where they can get and share information and thier ideas with each other. EasyShiksha is trying to reach and serve every student and institute. For this we continueosly connecting educational institutes with Easyshiksha. We are filtering information regular basis. We are publishing educational news on our news portal and keep updating students and Institues. We helping more and more students to with our career helper programe. If we talk about our mission, we think that every student has right to get quality education. EasyShiksha will try to help in this, we will provide quality information to students righ guidence. To keep education more affordable for everybody we will provide quality online courses. EasyShiksha will help students to get information about Institutes and their courses. Will add more and more colleges and universities with EasyShiksha so students can get all information on a single platform. With EasyShiksha we will try to produce future leaders, managers and entrepreneurs for India.  Team EasyShiksha is working many services for now like career helper, campus ambassador, college & courses information, online courses, magazine, test series, advertise institutes and press release. With these services we are trying to help students and institutes.  With the Campus Ambassador program EasyShiksha provides platform to students on that students can represent their college. The program help students to maximize thier learning. With campus ambassador program students from all over India can share their ideas. Students have some responsibility like  be anchor between the EasyShiksha and their college.  With the Career Helper program EasyShiksha help students to know their strength, interest, talents. With career helper program you can know occupations they can suit you. Basically career helper program based on 4 types of test IQ test, basic test, advance test and pshychometric test.  You can search & explore institutes, colleges, universities and schools. With Easyshiksha one can exlpore thousands of institutes with their courses, faculty, facilities, placement details and more. It will helpful for students and their parents to choose right institute for them.  EasyShiksha provides more than 50 free online courses for students. Students can learn and practise educational videos. From basic computer knowledge to digital photography and art courses to programming language courses are available for students.  With the EasyShiksha free online test series students can practise for government exams like SSC, railway and bank. Students can improve their knowledge and skills with test series. With computer science test series one can improve programming langauge knowledge."
Eatmore,https://www.crunchbase.com/organization/eatmore,"Food Delivery, Online Portals",Eatmore.dk is an online food order and delivery service.,"Eatmore.dk is an online food order and delivery service. They are intermediary between take out food outlets & customers. Eatmore platform enables customers to search for local take-out restaurants, place orders and pay online, and to choose from pick-up or delivery options across Denmark."
EasyChef,https://www.crunchbase.com/organization/epyg,"E-Commerce, Food and Beverage, Internet","Simplify your grocery shopping: choose recipes, modify ingredients, order online.","For home cookers who want to simplify grocery shopping, EasyChef is a digital meal planning app that provides shoppable recipes. Unlike HelloFresh, Epyg creates personalized plans and provides online grocery shopping."
eAdhere Solutions,https://www.crunchbase.com/organization/eadhere-solutions,"Health Care, Information Technology, Medical",eAdhere Solutions connects healthcare providers and behavioral health professionals to improve SaaS,"SIMPLIFY ACCESS TO CARE Patients are looking for convenient, quality care they can trust. eAdhere gives providers the flexibility to deliver high-quality care to their patients anytime, anywhere."
EatLocal,https://www.crunchbase.com/organization/eatlocal,"Apps, Food Delivery, Internet",Eat Local the app that shows you restaurants friends love.,"Find places where the locals eat and your friends recommend in one mobile app! No more fake reviews, only real, honest, advice from your favorite food aficionados!"
Eagle Industries,https://www.crunchbase.com/organization/eagle-industries,Manufacturing,Eagle Industries is a maker of the high quality tactical gear.,"Eagle Industries is a manufacturer of operational nylon gear and equipment for tactical operations. It makes more than 5,000 products including tactical assault vests, load-bearing equipment, weapon transport gear, holsters, and personal gear carriers. Main customers are the military and law enforcement agencies in the U.S. and internationally. The company has approximately 2,300 employees."
Eastern Platinum Ltd.,https://www.crunchbase.com/organization/eastern,Precious Metals,Eastern Platinum Limited is a Canadian platinum group metals producer.,"Canadian-based Eastplats was formed in 2003 with the objective of becoming a major producer of platinum group metals. In less than four years the Company has met its objectives by acquiring a portfolio of high-grade platinum and rhodium-rich deposits in South Africa's Bushveld Complex with resources containing over 85 million ounces of platinum group metals. In 2006, Eastplats became Canada's largest platinum group metals producer when it acquired a 69% indirect interest in Barplats Investments Limited. This acquisition was accompanied by a successful Cdn $150 million capital raising campaign, much of which has been invested in the Crocodile River Mine operations. Eastplats is now an established platinum group metals mining company with assets on both the western and eastern limb of the Bushveld Complex"
EASA,https://www.crunchbase.com/organization/easa,"iOS, Mobile Apps",EASA is a web and mobile app that aims to simplify the visa application process,
Eagle Cap Software,https://www.crunchbase.com/organization/eagle-cap-software,"Information Technology, Software","Software engineering, app development & integration services for airlines, aviation, aerospace & defense organizations.",
EAD Plataforma,https://www.crunchbase.com/organization/ead-plataforma,"Education, Internet, SaaS, Software, Training",EAD Plataforma is a trading system for distance learning that offers an online environment for students to join and access courses.,EAD Plataforma is a trading system for distance learning that offers an online environment for students to join and access courses from anywhere in the world. EAD Plataforma offers an online environment for students to purchase and access courses. It provide the tools users need to focus on creating content. Sell ​​courses online or offer training for teams. The company was founded on 2014.
Easy2lend,https://www.crunchbase.com/organization/easy2lend,"Financial Services, Internet",Easy2Lend is an online lending platform.,"Easy2Lend is an online lending platform, built to create a better financial experience without intermediaries. They are phygital, synergising the online technology with the offline loan market, to give our customers a safe, quick, and profitable lending & borrowing experience. They are here to change the way India lends and borrows."
EAPC Architects Engineers,https://www.crunchbase.com/organization/eapc-architects-engineers,Real Estate,"EAPC Architects Engineers offers architectural, engineering and construction management services in North Dakota.",
eAutolease,https://www.crunchbase.com/organization/eautolease,"Automotive, Leasing, Rental",Car Leasing Service,"You actually have limitless options when you’re in the market for a new car in New York, New Jersey, Connecticut or Pennsylvania. You could lease a vehicle from virtually any dealership. They’d be happy to help you — but the fact is, dealerships can’t begin to offer you the same benefits as eAutoLease.com.  That’s because eAutoLease.com is second-to-none when it comes to variety and customer service. Car leasing has quickly become one of the most popular ways to get a high quality vehicle at a price that you can more easily afford. Forget the hassle and frustration of running around to different dealerships in the Tri-State area with limited stock and inventory. You deserve to drive exactly what you want. With eAutoLease.com, you can see every make and model available on the market today, including all of the top brand-name automobiles: Audi lease, BMW lease, Buick, Cadillac, Dodge, Ford lease, GMC, Lexus  SERVICES:  -Car Lease Finance,  -Lease Transfer,  -Lease Return,  -Exit Your Lease,  -Wheel & Tire Protection,  -Sell Your Car,  -Trade In Appraisal,  -Wear & Tear. Working Hours: Mon - Thu: 9:00am – 9:00pm ,  Fri: 9:00am – 7:00pm ,  Sat: 9:00am – 9:00pm ,  Sun: 10:00am – 7:00pm.   Payment: cash, check, credit cards.  CONTACT US:  Autolease,  3820 Nostrand Ave, #107 ,  Brooklyn, NY 11235 ,  +1 718-871-2277 "
EasyBourse,https://www.crunchbase.com/organization/easybourse,Internet,EasyBourse is the online broker of La Banque Postale that enables its users to access a wide range of investment products and more.,"EasyBourse is the online broker of La Banque Postale that enables its users to access a wide range of investment products and more. It offers 4 different tariffs for each client to find the formula that meets their expectations. EasyBourse is based in Paris, France."
Earlyone,https://www.crunchbase.com/organization/earlyone,"Apps, Information Technology, Internet, iOS, Mobile Apps, Software, Telecommunications",Earlyone is a mobile platform and software which enables service providers save customers' time and reach customer service excellence.,
Easirent Car Rentals,https://www.crunchbase.com/organization/easirent-car-rentals,"Automotive, Tourism, Travel",We are a nationwide Car Hire and Van hire company with a history of over 25 years in budget rental car services.,"We are a nationwide Car Hire and Van hire company with a history of over 25 years in budget rental car services. As a family-run business we know how important it is to book with a company you can trust, without costing you too much. If you are looking for cheap car hire we have an impressive fleet consisting of: Minis Coupes Business models Luxury cars, Audis, BMWs, Mercedes, etc. Family cars 4x4s Mini SUVs Car-vans Transit Vans We have everything you need to cover your Car and Van Hire needs with locations at all the major UK airports and cities including, Heathrow Airport, Gatwick Airport, Manchester Airport and Birmingham Airport."
