Organization Name,Organization Name URL,Categories,Description,Full Description
UbizWeb,https://www.crunchbase.com/organization/ubizweb,"B2B, E-Commerce, Finance, Professional Networking, Social Media, Web Hosting",UbizWeb is an online social network for small and medium entprises and corporations to interact with one another.,"UbizWeb is an online global social business network for small, medium sized business and corporations. Ubizweb is the serious facebook for business. But more than a social network, it is a real multi-side business platform UbizWeb is a dedicated Multi-side platform that allows users to create a business page, containing all their contact details and allowing them to market their products and services to other users on a direct basis – the system essentially allows businesses to have greater control and reach than sites created by web designers with no marketing experience."
UBH Denton,https://www.crunchbase.com/organization/ubh-denton,Health Care,UBH Denton is a hospital & health care company that offers mental health and chemical dependency care services.,
Ublo,https://www.crunchbase.com/organization/ublo,"E-Commerce, Robotics, Software",Ublo is a SaaS e-commerce solution for professional photographers,
Ubooster,https://www.crunchbase.com/organization/ubooster,"Education, Sports",UBooster is an athletics platform.,"UBooster’s model is simple. We raise money for future college athletes to use after the completion of their NCAA eligibility after graduation. This money helps athletes jump-start their careers, further their education, or relocate in pursuit of their lifelong goals. UBooster is the world’s premier platform for supporting college athletes. Through UBooster, fans Boost funds to demonstrate their support of the choices made by high school athletes. All the funds go to a trust fund (known as a UFund) for the athletes, which they can access at the end of their NCAA eligibility. Fans have the opportunity to participate for free by using the UBooster Points they receive at signup. These points directly correlate with the athletes’ Heat Index. To keep raising an athlete’s Heat Index, fans can Boost a player while simultaneously contributing money to their UFund, which also helps their favorite athlete’s Heat Index score climb. Additionally, when fans Boost an athlete they can select which school they support and each athlete’s profile will display the leading Boosters. For example, if a fan of School U boosts Joe Football for $10, Joe Football will receive 100 UBooster Points towards his Heat Index and his profile will display School U as the leading fan-driven institution. On National Letter of Intent (“Signing”) Day, the opportunity to Boost an athlete closes. All the funds donated to these athletes will be held in escrow until his or her NCAA eligibility expires. Athletes have six years to collect their funds, starting form the time they begin their college careers."
Ubi-k,https://www.crunchbase.com/organization/ubi-k,"Construction, Internet, Logistics, Manufacturing, Marketplace, SaaS",P2P platform for renting industrial equipment,Revolutionising the renting of industrial equipment through a digital P2P platform in Mexico.
Ubirator,https://www.crunchbase.com/organization/ubirator,"Recycling, Waste Management",Ubirator is a waste management service for reasonable business.,Ubirator is a waste management service for reasonable business.
UBM Asia,https://www.crunchbase.com/organization/ubm-asia,"Association, Social Media",UBM Asia - UBM Asia is the trade show organizer company.,
UBENINC TECHNOLOGIES,https://www.crunchbase.com/organization/ubeninc-technologies-d860,Software,Vzita visitor management system is ideal to keep track of your visitors data and helps in a better vigilance.,"Securing the office premises is one of the main concern for which a manual staff at reception is not enough to ensure office's security. For this, an organization needs a visitor management system which notifies the user once the visitor enters the office premises. Visitor Management System developed by Ubeninc Technologies notifies about the check-in and check-out timings of the visitor and also traces the reason and the contact person."
UBERGOLF,https://www.crunchbase.com/organization/ubergolf,Sports,The Best Unbiased Golf Reviews & Instruction,"At Ubergolf, we will do everything to make sure that the next shot counts. Be it with our buying advice for the best golf GPS watches and handhelds devices, clip-on, voice GPS, laser golf rangefinder to best golf hybrid, putter, driver, fairway wood golf clubs for beginners, mid and high handicappers, or swing techniques or even useful golf tips, we strive to make you a better golfer with every shot. The beauty of golf lies in its nuances. We have worked hard to find the little things that matter and we will help you straighten your game-play with them. Like you trusty old partner, we will stick with you through the ups and downs of your golf journey. In golf, there’s always scope for improvement. With us, you can exploit and turn that scope to your advantage. Whatever your goal in golf is, we have the path carved right up to it."
uberproduct,https://www.crunchbase.com/organization/überproduct,"Product Management, Product Research",We provide the Team and the Methods to make your Innovation fast and reliable.,"The innovation and product lab for hire: Product innovation, radical user centricity, speed up through prototyping, consultancy, doing and training."
UBXX,https://www.crunchbase.com/organization/ubxx,Advertising,Audience Management and Targeting,"UBXX is a real-time advertising technology company helping brands and advertisers find, target and acquire multi-channel audiences. Our platform is engineered to deliver scalable audience management, transparent insight into advertising campaigns, and real-time actionable data.  Our business has been built upon a core principle of committing our people and ideas to serve our clients' interests first."
UBuildIt,https://www.crunchbase.com/organization/ubuildit,"Consulting, Real Estate",UBuildIt is a construction and remodel consultation firm for homebuilding.,
UBISTART,https://www.crunchbase.com/organization/ubistart,"Consulting, Information Technology, Mobile Apps, Online Portals, Personal Branding",UBISTART is a digital company that offers customized software solutions.,"UBISTART is a digital company that offers customized software solutions. It combines intense business analysis, usability design, and mastery of technologies, providing the company with a broad industry segment in the market. UBISTART implements systems for process automation, automation of repetitive tasks and give management a complete view of your company. It also develops mobile solutions that allow companies to be close to their customers wherever they are. The company was founded in 2014 and is based in Caxias do Sul in Brazil."
UbiEst,https://www.crunchbase.com/organization/ubiest,"Fleet Management, Internet, Location Based Services, Mobile, Navigation, Software",UbiEst focuses on the development and supply of technology solutions and location-based applications.,"UbiEst S.p.A. provides location solutions: interactive maps, navigation, location based services and geodemographic market analysis (geomarketing) on Internet and mobile connections for Business and Consumer markets. UbiEst mapping services help leading companies meet informative and marketing requirements in terms of location, routing and proximity of geographic assets, road navigation market and positioning benchmarking. UbiEst offers ready-to-use products for web mapping, CRM/Call Center applications, fleet management, off-board navigation, geomarketing and  other front-end applications.  Our business solutions deliver geographic support onto corporate processes and functions like Strategic Planning, Marketing, Sales, CRM, Logistics and Communication.   Success Cases for leading italian Industry and Services organizations place UbiEst as a preffered technology partner for the development of vertical industry solutions tailored on specific challenges and needs."
Ubiguard,https://www.crunchbase.com/organization/ubiguard,"Apps, Real Time",Ubiguard is the easiest way to configure and use an IP camera. Our provisioning engine is able to install almost any camera in 3 clicks.,"Ubiguard easily installs any camera, connects it to their platform, securely records videos in the cloud and allows viewing them from any smartphone, tablet, computer or TV. Ubiguard allows you to install almost any camera in the market. If you need to buy a cheap camera with simple capabilities or an expensive one is up to you. The services they offer are the same for everybody. You can save money reusing an already-bought standard camera. Ubiguard automatically detects and installs an IP camera plugged to your network.  No technical expertise required. You can also manually install remote cameras following Ubiguard's guidelines. Access cameras in real-time or your recorded videos everywhere, from your smartphone, tablet, computer or TV. Ubiguard provides an easy to use web page from where you can view your cameras or recordings, from a computer or mobile device. Additionally, Ubiguard provides smartphone and tablet apps to make access simpler and easier."
UBEECO Packaging Solutions,https://www.crunchbase.com/organization/ubeeco-packaging-solutions,Packaging Services,UBEECO manufactures and distributes a variety of wood packaging and alternative material products.,"UBEECO manufactures and distributes a variety of wood packaging and alternative material products, including boxes, crates, pallets, skids, protection packaging, packaging accessories and loose lumber. It also offers on-site packing services for many customers"
uBlend Nutrition,https://www.crunchbase.com/organization/ublend-nutrition,"Dietary Supplements, Fitness, Nutrition",Diet & Bodybuilding Instant Shakes,uBlend Nutrition is  ready to activate shake technology which provides all in one complete package: filtered water in the bottle and the active formula in the closure.
Uberall Corporation,https://www.crunchbase.com/organization/uberall-corporation,Information Technology,UberallCorp is a software company that develops standarized mobile apps.,"Uberall is a company focused on mobile applications. They provide solutions for the optimization of the business processes that take place outside the office, providing data transmission solutions in real time. Their solutions are  totally focused on companies where mobile work is a key point of success in their business. All of their products are made entirely by us thinking of you. They develop them to help simplify your work processes, which is why they are developed in a SAAS cloud environment in order to access them everywhere."
Uber den Tellerrand,https://www.crunchbase.com/organization/uber-den-tellerrand,Communities,Über den Tellerrand kochen is a Berlin-based project that uses cooking to promote refugee integration into our community.,
Ubirimi,https://www.crunchbase.com/organization/ubirimi,"Enterprise Software, Software","Fast, most affordable productivity tools","Ubirimi is a startup developing versatile project management product suites. One of its major products is Yongo, a project tracker for team planning, building and launching products. Another is Agile, a project management tool that implements the Agile methodology.  Ubirimi is also the developer of Documentator, which connects teams with the content, knowledge, and co-workers they need to get work done faster.  Another product, Events, is a calendar application that helps companies plan and keep track of people, projects and events. Ubirimi also provides SVN hosting and takes care of setup and maintenance procedures while providing unlimited number of projects with unlimited number of users. Ubirimi was founded by Flavius Nopcea and Francisc Nopcea in Dumbravita, Romania."
UBanks.com.ua,https://www.crunchbase.com/organization/ubanks-com-ua,"Financial Services, Internet, Online Portals",Online database of addresses of Ukrainian banks. Branches and ATMs,Банки України. Banks of Ukraine - relevant online database.
Uber 3D,https://www.crunchbase.com/organization/uber-3d,"3D Technology, Architecture, Automotive, Film, Video",Uber 3D is a multi-disciplinary design agency that provides architectural visualisations and post production effects for architects.,"Uber 3D is a multi-disciplinary design agency based in Mumbai, India that provides architectural visualisations and post productions effects for architects, advertising agencies and real estate developers."
Uber Motif,https://www.crunchbase.com/organization/uber-motif,Advertising,"Ubermotif, your complete web design and search marketing solution for your business.",
UBNT.ca,https://www.crunchbase.com/organization/ubnt-ca,"Internet, Marketplace, Wireless","UBNT.ca provide low cost, effective wireless and networking products for the WISP (Wireless ISP) reseller & systems integrator marketplace.",
Ubiquity PR,https://www.crunchbase.com/organization/ubiquity-pr,"B2B, Cloud Computing, Information Technology, Public Relations, SaaS","Ubiquity PR represent funded, high-growth B2B companies in marketing technology, cloud and SaaS solutions, and IT.","Ubiquity PR represents funded, high-growth B2B tech companies in marketing technology, vertical cloud and SaaS solutions, and IT. Our team members are all B2B tech veterans from large PR firms, Fortune 100 tech giants, or successful startups. Recent successes have included:   - Infusionsoft. SMB sales automation; $71M raised to date.  - Firehost. Cloud security; $34M raised to date.  - Flypaper. Digital signage; acquired by Trivantis."
UBEREX,https://www.crunchbase.com/organization/uberex,"Cyber Security, Information Technology, Network Security","A cyber security agency specialising in cyber security, forensics, development and support",
Ubiklabs,https://www.crunchbase.com/organization/ubiklabs,"Education, iOS, Mobile Apps, Software",Ubiklabs is a company dedicated to the development of mobile applications and social application software.,UbikLabs is a mobil
Uberphones,https://www.crunchbase.com/organization/uberphones,Mobile,Uberphones is a weblog dedicated to mobile phones and tablets.,"Uberphones is a weblog dedicated to mobile phones and tablets. The website features articles under categories such as Apple, Android, Verizon, AT&T, Sprint, TMobile, and more. Uberphones was launched by Eliane Fiolet and Hubert Nguyen."
UberHund,https://www.crunchbase.com/organization/uberhund,"Human Resources, Internet, Mobile, Mobile Apps, Small and Medium Businesses",On-Demand App for hiring trusted dog walkers,
UB Composites,https://www.crunchbase.com/organization/ub-composites,"Aerospace, Air Transportation, Service Industry",UB Composites is an aerospace sector providing carbon fiber components.,
Ubertas Consulting,https://www.crunchbase.com/organization/ubertas-consulting,"Cloud Computing, Consulting, Information Technology",Ubertas is a cloud consultancy with extensive experience in the migration of enterprise applications to AWS.,"Ubertas is a Cloud consultancy with extensive experience in the migration of enterprise applications to AWS. Their expertise, built over many years, includes deploying, enhancing, re-platforming, tuning and supporting bespoke enterprise applications on a broad range of technologies. As an established and experienced AWS Consulting Partner they help organisations understand, adopt and drive benefit from the adoption of Cloud solutions. It doesn’t matter whether it’s your first step into the Cloud, or you already have Cloud infrastructure in place, Ubertas can support you on the journey of AWS adoption. They are an outcome-driven Cloud consulting business that helps companies solve business problems and build for the future. The world is changing, fast. To keep pace, companies need to find new ways to disrupt the status quo, get to market faster, create experiences their customers love, and build operational muscle for sustainable results. Rising to those challenges demands a fresh approach to problem solving. That’s where Ubertas Consulting comes in. They are a purpose-driven consulting firm that helps companies solve business problems and build for the future, with services and solutions spanning Cloud consulting, Cloud solution delivery, and Cloud managed services."
Ubiqam,https://www.crunchbase.com/organization/ubiqam,"B2B, Mobile, Telecommunications",Helping mobile operators to extract the most out-of their spectrum,"Ubiqam focuses on innovation in smart antenna and interference cancellation technologies enabling wireless service providers to extract the most out-of their spectrum and upgrade their mobile broadband network to unprecedented capacity and spectral efficiency. Ubiqam's UbiFiX™ products enable cellular base-stations to maintain high quality operation and capacity in the presence of strong foreign interference generated by narrow and wide-band signals and perform acquisition and tracking automatically. The company's patent pending TRiC™ and CLiC™ technologies combine smart RF and DSP to enable extreme wireless spectrum utilization in 3G and 4G Relay, Repeater and Small-cell Backhaul applications."
Ubilogix,https://www.crunchbase.com/organization/ubilogix,"Computer, Software",Ubilogix provides software tools and R&D services for wireless sensor networks.,"Ubilogix provides software tools and R&D services for wireless sensor networks. Ubilogix has been working closely with leading companies in the industry to meet the demands of these fast paced emerging technologies and facilitate its customers a rapid and efficient testing and debugging of highly complex wireless networks. Their leading product, Ubiqua, provides a comprehensive toolbox for testing, debugging, monitoring and controlling wireless sensor networks."
UBR.ua,https://www.crunchbase.com/organization/ubr-ua,"Financial Services, Information Technology, Insurance, News",UBR.ua Current information from the world of business and finance.,
Ubiquitous Studio,https://www.crunchbase.com/organization/ubiquitous-studio,"Apps, iOS",Startup for iOS and Android Apps.,"Ubicuo Studio is an startup dedicated to develop, produce and publish iOS and Android Apps."
UberHint,https://www.crunchbase.com/organization/uberhint,"Accounting, Consulting, Education, Legal",UberHint mission is to eliminate a numerous bureaucratic steps and make the law understandable for those who do not have legal education.,UberHint mission is to eliminate a numerous bureaucratic steps and make the law understandable for those who do not have legal education.
Ubipix,https://www.crunchbase.com/organization/ubipix,Video,"Ubipix is an app and platform that enables GPS-tagged video and images to be recorded, uploaded, published, analyzed, and shared online.","Ubipix is an app and platform that enables GPS-tagged video and images to be recorded, uploaded, published, analyzed, and shared online. Users can capture tracks, trails, infrastructure, and other places of interest; and use Ubipix to share them online. Ubipix is operated from Dublin, Ireland."
UBER MEN,https://www.crunchbase.com/organization/uber-men,"Fashion, Lifestyle, Retail","UBERMEN began in 2010 as a menswear label focusing on floral, smart casual and formal attires.",
UBIK,https://www.crunchbase.com/organization/ubik-3,"Hardware, Information Technology, Internet, Internet of Things, Messaging, Software, Telecommunications","UBIK offers a high-quality smart phone system for businesses, created entirely in Quebec.","UBIK offers a high-quality smart phone system for businesses, created entirely in Quebec. Forget about old-fashioned communication systems: UBIK is the modern telephone for the contemporary company. Manage all your phones by yourself with our web platform. Give your company a credibility boost with a bilingual virtual receptionist. Access your voice messages through your email inbox. Take important calls wherever you are with easy call forwarding to cell phones. In addition to a ton of features, UBIK offers a billing system based on users, rather than lines, which means unlimited phone lines. With UBIK, you're making a good call."
Ubicle,https://www.crunchbase.com/organization/ubicle,Software,UBICLE is a Korean-based app development company focused on providing mobile coupons solutions and smartphone applications to its customers.,"UBICLE (유비클) is a Korean-based app development company focused on providing mobile coupons solutions and smartphone applications to its customers.  UBICLE was established in 2009, and specializes in developing SNS-bases community apps suitable for corporate clients. "
Ubercart,https://www.crunchbase.com/organization/ubercart,"E-Commerce, Payments",Ubercart - the leading open source content management system.,"Ubercart is an open source e-commerce solution fully integrated with the leading open source content management system, Drupal, winner in two categories of the Packt Publishing 2008 Open Source CMS Awards. This is a killer combination for anyone looking to build a community around a product, sell access to premium content, offer paid file downloads, and much more, all while maintaining a seamless connection to your users. Ubercart leverages the advantages of Drupal's major core and contributed systems, providing your users with shopping cart functionality that integrates with other parts of your company or community website. To learn more about the benefits of using Drupal, check out their article which answers the question, ""Why use Drupal for e-commerce?"" Developers can add to or alter Ubercart features to accommodate virtually any e-commerce need. This means you'll never have to change the source code to add new features, so you'll have an easy upgrade path as Ubercart continues to evolve to meet the demands of a growing community. To learn more, consider the following information pages: -Screenshots (including store and administration pages) -Currently integrated payment systems -Current methods of calculating shipping -More about testing"
Ubiquitous Legal Technology,https://www.crunchbase.com/organization/ubiquitous-legal-technology,"Android, Information Services, Legal, mHealth, Professional Services",Our mission is to make quality legal representation fast and easy in a legal emergency.,"Our mission is to make quality legal representation fast and easy in a legal emergency. LawyerUp gets a top-notch, pre-screened lawyer working within 15 minutes. Guaranteed.  Users who sign-up are prepared for that “one call” they hope they never get, or have to make. Users immediately get important legal protections, advice, and connection to friends and family who can help.  LawyerUp is entirely user-supported. No lawyer pays us to join or get a case."
UbiQ,https://www.crunchbase.com/organization/ubiq-db33,Biotechnology,Develop and commercialize ubiquitin research tools.,
Ubiquity Consumer Technologies,https://www.crunchbase.com/organization/ubiquity-consumer-technologies,"E-Commerce, Gift Card",Ubiquity Consumer Technologies develops e-commerce platforms for consumer retail companies in India.,"The Giftopia is an aggregator, distributor & seller of Gift Cards & Gift Vouchers of >60 of the ""Best Brands"" in India.  www.thegiftopia.com is a one-stop-shop for Gift Cards of all these ""Best Brands"" We believe that though the Gift Cards industry is slowly taking root in India, with almost every major Brand launching a Gift Card program, their distribution is highly un-optimized. Barring a handful of major Brands, most other Brands face challenges in getting their Gift Cards to the right 'pockets of demand'. This is the major bottleneck in taking this industry to its next level of growth. We have launched several channels of sale targeting specific 'pockets of demand' for Gifts & Incentives - at an individual as well as corporate level. Effectively, we act as a single-point solution for Gift Voucher (pre-paid cards) based Gifting & Incentive needs. Our target customers range from upwardly mobile Indians & NRIs gifting to India to companies incentivizing their employees, sales channel, customers & business associates. Some of our channels of sale include  1) E-commerce website www.thegiftopia.com 2) Hosted Corporate Incentive Program (HCIP) - a Gift Voucher based hosted, extremely scalable, customizable, pan-India tool for employee incentives (www.thegiftopia.com/HCIP) etc.... We've launched in Sept-end 2011 & are a small but highly efficient team. About me: I am the founder & CEO of Ubiquity Consumer Technologies Pvt Ltd, that has launched The Giftopia platform. Before founding the company in 2011, I've worked with Intel Corp in Phoenix, US, for 5.5 years. I completed my MS at Univ of Southern California, Los Angeles."
uBungee,https://www.crunchbase.com/organization/ubungee,E-Commerce,"Set to beta launch in early 2013, uBungee creates a way to ""Make the Deal Find U"" for both buyers and sellers.","Set to beta launch in early 2013, uBungee creates a way to ""Make the Deal Find U"" for both buyers and sellers.  Structuring (and trusting) product descriptions within various selling marketplaces has been the primary commerce/trust challenge within auction and standard marketplace environments -- even when describing ""standard items"" (whether new or used).  uBungee focuses on the subset of uniquely identifiable items to eliminate both the ""deal searching"" and the ""communication overhead"" in completing first and second hand online transactions (no endless ""classified ad"" questions, no manual bidding, no listing descriptions needed, etc.)"
