Organization Name,Organization Name URL,Categories,Description,Full Description
"Yes/No, Inc.",https://www.crunchbase.com/organization/yes-no-messenger,Messaging,Yes/No is the ultimate polling and messaging app - just ask simple questions and receive YES or NO answers!,
Yervoy,https://www.crunchbase.com/organization/yervoy,Health Care,"The most prescribed medication for metastatic melanoma.1 It's thought to work through your immune system, your body's natural defense.",
Yellow Beauty Box,https://www.crunchbase.com/organization/yellow-beauty-box,"Beauty, Brand Marketing, E-Commerce",Yellow Box Beauty is a makeup club that uncovers new beauty brands and delivers their products to subscribers every month.,
Yesmywish.com - Divine Blessings Private Limited,https://www.crunchbase.com/organization/yesmywish-com-divine-blessings-private-limited,Internet,Do you have a wish and want to make it true? Yesmywish can help you to make it come alive.,
Yes!Net,https://www.crunchbase.com/organization/yes-net,"Advertising, Internet","Yes!Net's web sites, unique advertising server, traffic system, URLs, payment gateway and systems.",
Yellow Lab,https://www.crunchbase.com/organization/yellow-lab,"Beauty, Health Care, Internet","Yellow Lab is an online platform allowing professionals and institutions related to beauty, health, and wellness to offer information.","Yellow Lab is an online platform that allows professionals and institutions related to beauty, health, and wellness to publish their agendas, services, and products. Its service portfolio includes online scheduling, assessments of services and products, and the exchange of experiences and references among customers."
YesBroadway Productions,https://www.crunchbase.com/organization/yesbroadway-productions,"Media and Entertainment, Music",YesBroadway Productions champions fresh and exciting musicals and plays developed for casual theater fans.,"YesBroadway Productions champions fresh and exciting musicals and plays developed for casual theater fans, a demographic that is often overlooked by Broadway and NYC theater."
Yetlin,https://www.crunchbase.com/organization/yetlin,"Digital Marketing, Marketing, SaaS",Yetlin specializes in digital marketing services and tools that connect talented entrepreneurs and professionals.,"Yetlin specializes in digital marketing services and tools that connect talented entrepreneurs and professionals. With its system you can program posts for instagram, automate interactions and increase your followers in a segmented way, attracting only real users. The company's services have been developed keeping in mind the daily challenges of the small and medium entrepreneur, be it the owner of a company or a liberal professional. Yetlin is based in Ipatinga, Brazil."
Yelloworking,https://www.crunchbase.com/organization/yelloworking,"Commercial Real Estate, Coworking",Yelloworking Is A Space Coworking In Aix-En-Provence.,
Yeeyan,https://www.crunchbase.com/organization/yeeyan,Communities,Yeeyan is the largest community site translator.,
YesMan.Agency,https://www.crunchbase.com/organization/yesman-agency,Advertising,Influencer Marketing & Casting Agency,YesMan.Agency is a creative agency and content production studio. We are a team of brand strategists and talent managers who conceptualize digital campaigns based on a brand’s goals and distribute messaging helping reach today’s consumers and ultimately driving an intent to purchase.
YellWiFi,https://www.crunchbase.com/organization/yellwifi,"Apps, Mobile, Wireless",Free WiFi everywhere on Your Mobile,YellWifi is a wifi community where people can share their wifis so you can surf the web or use your favourite apps at wifi speed and 0 cost.
Yemexpress,https://www.crunchbase.com/organization/yemexpress,"Apps, Food and Beverage, Internet",Allows you to eat fast.,
Yemeni Mama,https://www.crunchbase.com/organization/yemeni-mama,Food and Beverage,"Yemeni Mama was created to share flavours from our hometown of Aden, in the hope of shedding light on the beauty of our heritage.","They're aiming to bring you a wide range of condiments, marinades and food products based on our family recipes that span generations. All our products will be made in the UK using some of the finest organic materials available. They hope you enjoy."
Yelo,https://www.crunchbase.com/organization/yelo-7bb2,Artificial Intelligence,"Need help? Don’t worry, find on-demand services all in a platform powered by AI. With Yelo, your local superhero is on their way.",
Yellow and Black,https://www.crunchbase.com/organization/yellow-and-black,"Advertising, Software","The best restaurant, spa, hair & activity deals in all major U.K. cities","The best restaurant, spa, hair & activity deals in all major U.K. cities"
Yeembo,https://www.crunchbase.com/organization/yeembo,"Communities, Gaming, Mobile, Sports",The Social Discovery Network,"Yeembo is a Location-Based Social Discovery Network. Yeembo helps people get in touch with other people who share their interests and preferences. Yeembo facilitates common friends interaction but also enables interesting people get to know each other (discovery) in a relevant and safe way. It makes intelligent use of contexts to address specialized communications needs: meeting people, sports, business, and leisure/games. Yeembo combines multiuser online and role play game experiences to provide an informal and engaging scenario."
Yempl,https://www.crunchbase.com/organization/yempl,"Health Care, Medical",Find prices for medical services and procedures in NY.,They list the prices that doctors charge per procedure and service. They do not know how many services or procedures you may need during your visit; therefore they encourage you to direct all of your questions about the total cost directly to the office of your choice. They provide contact information in the provider’s listings for you convenience.
Yellowlink,https://www.crunchbase.com/organization/yellowlink,"Apps, Mobile",Yellowlink is a mobile solutions company provides solutions to connect their customer on mobile a new way.,
Yerrand,https://www.crunchbase.com/organization/yerrand,Mobile Apps,Yerrand is the app of the messages.,Yerrand is the app of the messages. It allows you to order anything at home or order messages from others. Ask for what you want or need in Yerrand and a messenger will make your wishes come true. The limit is set by your imagination!
Yes Brands Foods and Beverages Plc,https://www.crunchbase.com/organization/yes-brands-foods-and-beverages-plc,Manufacturing,Yes Brands Food & Beverages PLC manufactures bottled mineral water.,Yes Brands Food & Beverages PLC manufactures bottled mineral water.
YeteSoft,https://www.crunchbase.com/organization/1and1soft,"Email, Email Marketing, Software",YeteSoft is a company that focuses on exploring new email marketing technology.,"Established in 2005, YeteSoft is a company that focuses on exploring new email marketing technology. Our pioneer product 1and1Mail gives every small and medium business the ability to easily create, schedule and send personalized mass emails, manage email contacts and design email newsletters. In 2005, YeteSoft developed the first version of 1and1Mail email marketing software for our own business need of communicating with our loyal customers. Later we decided to commercialize 1and1Mail, so we offered it as a free tool online and received hundreds of positive feedbacks in a very short time. 1and1Mail now has three editions. For Free Edition, we have been offering the most powerful functions compared to all other email marketing software in the market. We, like you, hate to see a pop-up window asking for money every time you accidentally touch some advanced features. Instead, we simply set a limit on the number of emails you can send per batch. We firmly believe 1and1Mail can help you achieve more sales and acquire a much larger customer base. When your business excels with 1and1Mail, we would be quite happy if you purchase our Personal Edition or Business Edition to support your continuously growing business. Internet has made the competition a lot fairer around the world. Small and medium business has the chance to outperform big giants through well-planned Internet marketing. ""I check my Facebook account only 3 times a day, but I check my email inbox every 15 minutes!"" said one of YeteSoft's employees. We believe many of you have same feeling in life. Having grown with 1and1Mail for years, we YeteSofters have a faith in email marketing and the benefits 1and1Mail can bring to all small and medium business worldwide. 1and1Mail is not just a piece of software, but we hope to offer a platform to share our years of experience with you, get connected with you, and grow with you."
YER Hosting,https://www.crunchbase.com/organization/yer-hosting,"IaaS, Web Hosting",Dedicated and Shared Hosting services located in Azerbaijan,
YemekNET AS,https://www.crunchbase.com/organization/yemeknet-as,"Financial Services, Payments, Restaurants",FoodTech Company,"YemekNET is a FoodTech company based in Istanbul,Turkey, who is the owner of the ''gustokart'' and ''Ahikart'' brands. YemekNET, with the partnership of Turkey Restaurants and Pastry Federation, aims to create more benefit and profit for restaurants, by lowering the food card commissions, also giving benefits to gustokart users on their shopping and giving discount on their every meal."
Yellowdine Ventures GmbH,https://www.crunchbase.com/organization/yellowdine-ventures-gmbh,,Yellowdine Ventures GmbH is a company that provides an arts and crafts outlet.,
Yellow May,https://www.crunchbase.com/organization/yellow-may,Insurance,Insurance Revolution!,
Yetzer's Home Furnishings,https://www.crunchbase.com/organization/yetzer-s-home-furnishings,Furniture,Yetzer’s Home Furnishings and Floor Coverings is the premiere home furnishings store as our customers define it.,"Yetzer's has been serving the west metro since 1941. It is a 3rd generation family owned and operated full furniture store, providing bedding, upholstery, accessories, area rugs, and a complete line of all flooring products. Services include: -Interior in-home design consultation service in your home and at our location. -Friendly knowledgable sales associates that will help to make your house into your home. -Complete delivery and installation on all products. - Deal with people that care about what you want!"
Yesblogs,https://www.crunchbase.com/organization/yesblogs,"Blogging Platforms, Domain Registrar, Online Portals",Yesblogs delivers blogs with domain names.,Yesblogs deliver blogs with private domain names .com Designs (about 150 differents) were created by artists to be sure thet each is original and never seen before.
YesOption,https://www.crunchbase.com/organization/yesoption,,YesOption,
Yellow Parachute,https://www.crunchbase.com/organization/yellow-parachute,Communities,"Yellow Parachute creates free websites that help people connect, share, and interact in exciting new ways.","Yellow Parachute creates free websites that help people connect, share, and interact in exciting new ways."
Yeo & Yeo CPAs & Business Consultants,https://www.crunchbase.com/organization/yeo-yeo-cpas-business-consultants,"Consulting, Crowdfunding, Small and Medium Businesses",Yeo & Yeo CPAs & Business Consultants is a Michigan-based accounting firm.,
Yeoman & Company,https://www.crunchbase.com/organization/yeoman-company,"Industrial, Manufacturing",Yeoman & Company manufacters hand and edge tools products.,"Yeoman & Company was founded by William F. Yeoman of Monticello, Iowa. The company's products were known as ""YO-HO Tools"" reflecting the Yeoman name and that of two local brothers named Hoag who had invested in the early business. Yeoman tools were designed and built to meet the needs of the agricultural and manufacturing industries of the upper Midwest. During World War II, Yeoman & Company was designated an essential industry and produced tools for Victory Gardens and snow tools to clear the decks of U.S. Navy aircraft carriers."
Yeti Frozen Custard,https://www.crunchbase.com/organization/yeti-frozen-custard,"Food and Beverage, Retail",Makers of the best frozen custard on Earth.,Yeti Frozen Custard delivers happiness. Their product combines new flavors with classic decadent frozen custard to create innovative flavors like Blueberry Pancake and Lemon Lavender.
Yeahp!,https://www.crunchbase.com/organization/yeahp,"B2B, Human Resources, Recruiting, Software, Staffing Agency",Yeahp! provides a platform for human resources solutions.,"Yeahp! provides a platform for human resources solutions. Kelly Franco founded it in January 2015, with its headquarters in Rio de Janeiro in Brazil."
Yell Band,https://www.crunchbase.com/organization/yell-band,"Electronics, Hardware, Music, Sports",Yell Band is a sound projection cone that fans can wear on their arm to identify with and support their teams.,Yell Band is a sound projection cone that fans can wear on their arm to identify with and support their teams. Fans wear it and take it off to yell and cheer their favorite team on. It allows fans to support their team verbally more efficiently during crucial times of the game; allow users to easily carry and store the product away when participating in other aspects of the in stadium experience; and more.
Yeu Tre Tho,https://www.crunchbase.com/organization/yeu-tre-tho,"Health Care, Lifestyle","Yeutretho.com provides information and news related to Vietnamese lifestyles, world entertainment, technology, healthcare, and more.","Yeutretho.com is an online platform that provides information and news related to Vietnamese lifestyles, world entertainment, technology, healthcare, and more. It also offers its users with a forum. It provides users with video clips based on entertainment and health and wellness tips. It also provides articles related to beauty care, cuisines, world news, family, love, marriage, cooking, fashion, interior designing, and more. Yeutretho.com was launched on April 30, 2012, based in Hanoi, Vietnam."
Yesbets,https://www.crunchbase.com/organization/yesbets,Gambling,A UK based betting website collating all the latest offers and strategie.,A UK based betting website that collates all the latest betting offers into one place. We combine the latest betting strategies that help to give our users the edge when betting on sports and casino.
YES-secure.com,https://www.crunchbase.com/organization/yes-secure-com,Personal Finance,Social Lending Borrowing Web Marketplace,"YES-secure is an online peer-to-peer lending and borrowing marketplace which has recently entered the UK unsecured consumer loan space and facilitates relevant financial transacting activities for its registered members. It offers its users a blend of various markets and a borrowing community based on authentic credit scoring, well-researched individual financial background and strict underwriting processes to facilitate a safe and legally formatted transacting environment.  The YES-secure registered members can borrow or lend up to £25,000 for a loan term of 1 to 5 years on a fixed interest rate mutually decided between them. Based on the credit score of the applicant, YES-secure slots the credit applications into six markets (A*, A, B, C, D, E). In addition to borrowers credit scores, lenders can consider various factors such as affordability, stability and Reliability Score TM among others to decide on a suitable interest rate. The risk to lenders is diversified by spreading a loan amount across borrowers with different credit grades and limiting each bid to a miniscule percentage of the loan amount for a non-connection.  YES-secure actively incorporates social networking in its business model by encouraging its members to find, share and evaluate lending opportunities with each other. It uses its Connections feature (friends, family and colleagues) much like other social networking websites to add a viral dimension to the borrowing and lending activity on the platform. Various YES-secure features like peer endorsements and peer groups can go a long way in enhancing the chances of a low cost loan to high-risk borrowers. For lenders, the appeal of the YES-secure community aspect lies in the fact that they can interact with the prospective borrowers as well as in the implied lower default rates. As a responsible social lending platform, YES-secure ensure that the people who form part of its community undergo a strict screening and underwriting process. The senior management team of YES-secure.com Limited brings together a wealth of entrepreneurial, financial IT services and online social media marketing expertise. The senior team has over 60 years of combined experience in implementing and operating advanced secure consumer financial transactional services running in secure data centers."
Yeelion,https://www.crunchbase.com/organization/yeelion,Software,Yeelion is a Chinese entertainment site providing digital music software and services for customers in China.,"Yeelion Inc. provides software and online digital music services for internet users in China. The company focuses on improving usersâ€™ online entertainment experience with integrated service and advanced technology. It integrates services based on usersâ€™ needs such as integrating music with lyric and star news. Yeelion Inc. was founded in 2005 and is based in Beijing, China."
Yenpape Technologies,https://www.crunchbase.com/organization/yenpape-technologies,"Information Technology, Internet, Internet of Things, Software",Yenpape Technologies is an India-based company that offers web development and hosting services for enterprises.,
YemenVista,https://www.crunchbase.com/organization/yemenvista,"Advertising, Internet","Yemen Vista is a web design, web hosting, Internet marketing and graphic design service provider.",
Yeetup,https://www.crunchbase.com/organization/yeetup,Apps,"Yeetup is a App for speakers, to connect with attendees.",
YESSAT,https://www.crunchbase.com/organization/yessat,Education,YESSAT is an educational consulting company for students aspiring to study abroad.,
Yellowboxza,https://www.crunchbase.com/organization/yellowboxza,E-Commerce,Welcome to YellowBox. We are offering you to buy the most innovative,
Yellowrays Solutions (P) Ltd.,https://www.crunchbase.com/organization/yellowrays-solutions-p-ltd,"Industrial Automation, Professional Networking",Advanced  Office Security & Automation Solutions,"Yellowrays Solutions is a full-service Advanced Office Security & Automation Solutions based in Cochin, India. The Company was started in 2010 with a mission to create modern Advanced Office Security & Automation applications that create value for the customers as well as their users."
Yeezan,https://www.crunchbase.com/organization/yeezan,,Yeezan,
Yellow Medya,https://www.crunchbase.com/organization/yellow-medya-2,"Local, Search Engine","Yellow Medya is a subsidiary of the global Yellow Pages brand, a business directory, listing advertisements under various categories.","Yellow Medya is a subsidiary of the global Yellow Pages brand, a telephone business directory listing advertisements under various categories. The company provides location-based marketing, content syndication, and location-based engagement solutions for brand owners as well as small- and medium-sized businesses in Turkey. Yellow Medya has compiled Turkey’s most comprehensive database of businesses located throughout the country and it currently comprises of over 830,000 unique business listings categorized into 670 different business verticals. Yellow Medya’s popular local search web and mobile site, Yellow.com.tr, currently enjoys over 3 million visits a month. Over 350,000 unique Turkish businesses are found by 2.5 million unique visitors on Yellow.com.tr properties each month."
Yeşil Naturel,https://www.crunchbase.com/organization/yeşil-naturel,"Natural Resources, Organic, Organic Food","Doğanın mucizevi bitkilerini etken maddesini ayrıştırıp vücudumuzun emilimine uygun hale getirerek ""Ekstrakt"" olarak sizlere sunmaktadır.","Yeşil Naturel 1990 yılında girmiş olduğu bitkisel ürün sektöründe tecrübesi ile üretmekte olduğu doğal ürünleri sizlerin hizmetine sunmaktadır. Üretmekte olduğumuz ekstraktlar, yağlar, bitki suları, macunlar, pekmezler, sirkeler ve zeytin yağları ile doğanın mucizelerini tamamen doğal olarak sizlere sunmaktayız. Ürünlerimiz ilaç değildir, kimyasal ürünlerden uzak durarak daha kaliteli ve sağlıklı bir yaşam sürmenizi sağlayacak ürünlerimiz aynı zamanda bakanlık onaylı ve yasal yöntemler kullanılarak hazırlanmaktadır."
YEA-NAY Marketing,https://www.crunchbase.com/organization/yea-nay-marketing,"Advertising, Brand Marketing, Consulting, Customer Service, Internet",YEA-NAY Marketing provides integrated marketing services.,"YEA-NAY Marketing provides integrated marketing services.  Integrated marketing is the coordination and integration of all marketing communication tools, avenues, functions and sources within an organization into a seamless program which maximizes the impact on consumers and other end users at a minimal cost. YEA-NAY was founded in September 2008 and merged with Imperious Design and Visual Dreams Productions in August 2010.  An office and studio is currently being developed in Salt Lake City which will serve as a base of operations. Many services are provided in-house, and many additional marketing services are provided by third-party vendors.  Some of these services include web development, video production, search engine optimization, pay-per-click advertising management, text message marketing, social media management, branding, consulting, and other services. YEA-NAY has consulted businesses in many sectors, from high-technology to real estate and construction."
YES for Europe,https://www.crunchbase.com/organization/yes-for-europe,Non Profit,YES for Europe – The European Confederation of Young Entrepreneurs – is the main association of young entrepreneurs in Europe.,"YES actively contributes to the promotion of the entrepreneurial spirit in Europe and outside. It stimulates exchanges and network activity between young entrepreneurs, fosters cooperation and sharing of best practices among their national associations, particularly in the fields of education and training."
yeeldr,https://www.crunchbase.com/organization/yeeldr,"Employment, Recruiting, Staffing Agency",Consultative Hiring Solution for Hyper Growth Companies,Consultative Hiring Solution for Hyper Growth Companies
Yeske Buie,https://www.crunchbase.com/organization/yeske-buie,Financial Services,Yeske Buie is avidly committed to growing the financial planning profession,"Yeske Buie is avidly committed to growing the financial planning profession. Out of this commitment comes the fact that they would like to see everyone who seeks advice find a competent, ethical financial planner. Thus, they’re happy to talk to ANYONE who is referred to us and if, for whatever reason, they find that they're not a good fit, they will work to match them up with an experienced financial planner who is. If you know someone who may be interested in talking with us, please ask them to contact their team or send us the individual’s name and contact information so they may connect with them to set-up an initial meeting. They thank you for the continued trust you show in us by referring your friends, family, and colleagues so that they can help them to harness their financial resources to pursue exquisite, fulfilling lives."
yellow ball,https://www.crunchbase.com/organization/yellow-ball,Consulting,Consulting,"Strategic and creative studio for innovation and design active in the public and private sector.  Mission: Leverage diversity, creativity and innovation to create economic, environmental and social growth."
Yelli,https://www.crunchbase.com/organization/yelli,"Food and Beverage, Tourism, Travel","Yelli is a collection of great dishes , which brought together the best of the national cuisines of the world.",
YesYouLearn,https://www.crunchbase.com/organization/yesyoulearn,E-Learning,YesYouLearn is a privately held company that provide online courses developed by experts in their domains.,YesYouLearn is a privately held company that provide online courses developed by experts in their domains.
Yesbooks,https://www.crunchbase.com/organization/yesbooks,"Accounting, SaaS, Software",Yesbooks.in is an easy and powerful SaaS web application.,Yesbooks.in is an easy and powerful SaaS web application instead of complex accounting software to maintain financial records of the SHG's. YESBOOKS is a product of Yesteam Solution Private Limited developed to help the Self Help Groups(SHG) to maintain their financial records and day books electronically. Right now all the data are managed manually in physical book format by the SHG president which has to be produced for audit once in 3 months to SHG Federation/NGO’s. By implementing Yesbooks all the data will be immediately updated on the server. The reports can be viewed by the NGO’s whenever necessary and audit can take place without the consent of the SHG and banks can keep track of the funds circulated among the group members. The Yesbooks come with a profile feature which keeps track of the personal details of the group members along with the photographs. Instant SMS feature is available which is sent to to all the group members when group president makes any logs on the application. Thus every member would be aware of every transaction taking place in the group and can manually verify the transaction by getting a copy of the report from the NGO’s once in a month.
