Organization Name,Organization Name URL,Categories,Description,Full Description
Forbes Technology Council,https://www.crunchbase.com/organization/forbes-technology-council,"Association, Professional Networking, Social Entrepreneurship",Forbes Technology Council is an invitation-only community for senior-level tech executives. ,"Forbes Technology Council is an invitation-only community for senior-level tech executives.  Members are selected based on their depth and diversity of experience, then invited to enjoy an array of benefits including a private forum for discussion and collaboration, the opportunity to share insights via CommunityVoice on Forbes.com, exclusive product and service partnerships and concierge-level support.  Learn more and apply for Forbes Technology Council at forbestechcouncil.com. Read our members’ insights at forbes.com/sites/forbestechcouncil."
Forcive,https://www.crunchbase.com/organization/forcive,"Analytics, Artificial Intelligence, Big Data, Cloud Computing, Cloud Data Services, Machine Learning, Predictive Analytics, Real Time, Text Analytics",Forcive a software platform with an ideal combination of features that make the vision of an AI-driven company real.,"Forcive platform embeds all the foundations to capture data from anywhere and to process, store and aggregate using a real-time streaming approach. Captured data can be prepared, cleansed, blended, normalized, and aggregated in real time, to feed AI algorithms that can output valuable insights for innovative data-driven services into analytics, predictive and cognitive applications."""
Foodtoeat,https://www.crunchbase.com/organization/foodtoeat,"E-Commerce, Hospitality, Restaurants","Foodtoeat caters company meals using the best local food trucks, restaurants and caterers. We help our clients build better work cultures.","Foodtoeat is the first online food ordering service in which customers can order from restaurants as well as food trucks.  Based out of New York City, Foodtoeat works to make food trucks a permanent fixture in the eating scene, making them more visible and accessible for any potential customer. Utilizing innovative GPRS printers, Foodtoeat offers food trucks and carts the opportunity to expedite the food ordering process and reach an entirely new customer base. Founded by veterans of the restaurant industry, Foodtoeat differentiates itself from its competitors by charging restaurants next to nothing per order, far below the rates of its competitors. With low fees, and less wait for food around busy hours, Foodtoeat has proven to be an efficient and sustainable service, with an appeal to anyone who eats food. With specialized services for businesses, as well as a soon to be released app, Foodtoeat aims to be an integral component in the daily life of any New Yorker."
Food Lover's Market,https://www.crunchbase.com/organization/food-lover-s-market,"Food and Beverage, Grocery, Retail",A South Africa-based independent food retail group,"Fruit and Veg City was started in 1993 by brothers Brian and Mike Coppin. Since those humble beginnings the Group has grown exponentially with over 130 stores across South Africa and beyond. We have always endeavoured to bring our customers a wide variety of fresh produce at the best possible price, and in recent years we’ve expanded our offering to include groceries. The Food Lover’s Markets, the latest store-concept evolution in the Fruit and Veg journey, have already made their mark on the South African food retail landscape with the incredible shopping experience they provide. We have also taken an inevitable step in the direction of service station forecourt retail by partnering with Caltex to bring you Freshstop, the fresher take on convenience."
Forcen,https://www.crunchbase.com/organization/sensor-medical,"Artificial Intelligence, Computer, Health Care, Medical, Medical Device",Forcen  improves surgical safety through force-sensing technology.,
Forgital Group S.p.A.,https://www.crunchbase.com/organization/forgital-group-s-p-a,"Information Services, Mining, Precious Metals, Supply Chain Management","Forgital Group S.p.A. manufactures forged and laminated rolled rings made of carbon steels, alloy steels, stainless steels, aluminum alloys.","Forgital Group S.p.A. manufactures forged and laminated rolled rings made of carbon steels, alloy steels, stainless steels, aluminum alloys, nickel alloys, cobalt alloys, and copper and titanium alloys."
Footfalls & Heartbeats,https://www.crunchbase.com/organization/footfalls-heartbeats,"Artificial Intelligence, Manufacturing, Textiles",Footfalls & Heartbeats is a New Zealand-based company founded by award winning chemist Simon McMaster.,"Footfalls & Heartbeats is a New Zealand-based company founded by award winning chemist Simon McMaster who brings many years’ experience researching intelligent textiles. It is positioned to become a leader in the provision of smart textiles for a diverse range of applications in a global market that is increasingly demanding intelligent fabrics. The company’s technology can be exclusively customised to meet the exact needs of its commercial partners in multiple healthcare areas and athletic and performance disciplines. This includes advanced wound care, compression garment systems, infant monitoring, athlete monitoring and remote monitoring of health and physiological symptoms for those in high risk environments, such as first responders and defence personnel. Footfalls & Heartbeats technology also has the potential to measure mechanical stress in composite structures to allow real time structural composite monitoring for satellites, aircraft wings, wind turbine blades, yacht hulls and foils and high performance car chassis. The technology currently measures tensile and compressive forces and temperature. Additional functionality being explored is the ability to track movement, bio-electrical outputs such as heart rate, active and passive skeletal muscle signals, as well as blood oxygen saturation, all of which will enable new applications. Footfalls & Heartbeats technology provides new opportunities for remote intervention to support individual monitoring with the potential to significantly reduce escalating healthcare costs for ageing populations and those with chronic illness and disease. Footfalls & Heartbeats technology can create uniquely durable, safe and comfortable fabrics that are comfortable and natural to wear, making them ideal for people with health conditions. Information from Footfalls & Heartbeats sensing textiles has the potential to deliver a wealth of data to improve health and other outcomes. The company is managed by Brent Ogilvie, who has extensive experience in early stage venture development, international business development and corporate partnering. This capability is supported by a group of high quality directors and active investors including Sparkbox Chairman Andrew Duff, entrepreneur Jeremy Collins, expat New Zealander David Bell who is Marketing Professor at Wharton Business School, and David Henry, its Chairman and former CFO of Fisher & Paykel. Footfalls & Heartbeats is actively seeking resources and commercial partners in its market application areas including health, sports, rehabilitation, aged care, aerospace and automobile industries"
Fortuna.ai,https://www.crunchbase.com/organization/fortuna-ai,"Artificial Intelligence, Business Development, Information Technology, SaaS, Sales Automation, Small and Medium Businesses, Software",AI platform simplifying your client experience,"Fortuna is an AI-powered customer creation platform helping businesses grow by simplifying their clients' experience to get more online reviews and ultimately boost revenue.  Customer Experience is a brand new category, most local small businesses today rely on word of mouth referrals.  We've figured out a way to amplify your word of mouth sales attracting new + retaining existing clients - leveraging the power of text messaging.  Our mission is to turn your current customers into your biggest advocates: a true sales army. We are confident we can help you grow your business. Talk to us today!"
Fotawa,https://www.crunchbase.com/organization/fotawa,"Food and Beverage, Food Delivery, Food Processing",Fotawa is a food delivery service company based in Spain.,Fotawa is a food delivery service company based in Spain. It provides an app that lets users order nutritious and healthy food to be delivered to their offices.
FoodLogiQ,https://www.crunchbase.com/organization/foodlogiq,"Food and Beverage, Software, Supply Chain Management","FoodLogiQ is transforming how we analyze our entire supply chain, helping us find areas ripe for efficiency and improvement.","FoodLogiQ® provides traceability, food safety compliance and supply chain transparency software solutions. We help restaurant operators, food retailers, consumer packaged goods companies and other food companies achieve end-to-end traceability while supporting safe and high quality food products across the supply chain.  With FoodLogiQ’s platform, food companies can build an online supplier community, onboard suppliers all at once and stay on top of supplier audits and assessments. Manage quality incidents, report them directly to suppliers and recoup the costs of stock withdrawals. And with lot-level traceability, see exactly where your product is at all times, especially when it matters most during an investigation.  FoodLogiQ customers include Whole Foods, Chipotle, Subway, Dave & Buster's, Tropical Smoothie Cafe, Cava Grill, Robinson Fresh, Durst Organic Farms, Bailey Farms, the National Potato Council, Salandinos, and Golden State Foods among others. The FoodLogiQ Connect platform includes over 2000 registered businesses in over 35 countries with 18,000 locations."
Forcite Helmet,https://www.crunchbase.com/organization/forcite-helmet,Product Design,Forcite Helmet  is a integration of smart helmet products.,"Forcite camera are uniquely designed for use within the eon system, with a large inventory of ultra wide angle hd cameras that are the most compact in this category."
Formisimo,https://www.crunchbase.com/organization/formisimo,"Analytics, Cloud Management, SaaS, Software",Formisimo is a cloud-based analytics solution that improves online checkouts and online forms.,"Formisimo is a cloud-based analytics solution that improves online checkouts and online forms. From the 2 billion data points that Formisimo has captured, an average of 67% of people who start typing in an online checkout don't complete the process. The many technical, informational and design related issues in online checkouts lead to motivated and interested consumers leaving, and transacting with a different retailer.  Described as the ""Google Analytics for forms"", the light-touch code can be installed in seconds. The technology then tracks and analyses what website visitors do in the checkout process, turning data in to insight that companies can use to improve their process. Our powerful, but easy to use, back-end shows the pain points of consumers in interactive reports.  Formisimo was part of the Seedcamp accelerator in 2014."
Foriba,https://www.crunchbase.com/organization/fit-solutions,"Cloud Computing, E-Commerce, Enterprise Software, FinTech, Information Technology, SaaS, Software",Leading eTransformation solutions provider for companies in Turkey,"- FIT Solutions is an IT company that develops electronic transformation solutions such as e-books, e-invoices, e-waybills, e-archives, e-tickets, and e-signatures. - Strong government push to digitization of accounting of all companies – expect 50k businesses required to migrate to eInvoices by 2015, 200k by 2018 - FIT Solutions is currently handling 60% of e-invoicing traffic of Turkey. FIT Solutions serves  2k+ customers which consists of top 50+ Multinationals, top 10+ Conglomerates. - FIT Solutions is recommended e-transformation solutions partner by SAP.  - E-invoicing solutions of FIT is currently integrated with 30+ leading ERP systems"
Forte Biosciences,https://www.crunchbase.com/organization/forte-biosciences,"Biotechnology, Life Science, Pharmaceutical",Forte Biosciences is a biotechnology company.,Forte Biosciences is a biotechnology company.
For Good Causes,https://www.crunchbase.com/organization/for-good-causes,"Financial Services, FinTech",For Good Causes is creating new ways to give by tapping into the £7 billion of unused loyalty points and enabling cashless giving,"Many individuals, charities and companies across the world do amazing things for people, communities and the environment. At FOR GOOD CAUSES they want to help everyone, everyday, support the things they care about. They do this by working with the Loyalty Industry to help charities generate more donations and funding. So, more of the dis-advantaged can take advantage. More of the time-poor but ‘intent rich’ can make a difference. And more of the causes they value the most, can access the resources they need to achieve amazing things. They are a start-up, with profit for purpose Social Enterprise and their aim is to raise £100M for charities."
"Forest City Trading Group, LLC",https://www.crunchbase.com/organization/forest-city-trading-group-llc,"Consulting, Logistics, Marketing, Transportation",Forest City Trading Group is a wholesale company offering forest products marketing and services.,"Forest City Trading Group is comprised of 13 companies which each have a unique set of expertise that they provide nationwide. They work with the timber and building industries to forge strategic connections between customers and sellers. This includes marketing, sourcing, price discovery, inventory consulting, risk management, market strategies, logistics, and supply chain consulting."
Fortr3ss,https://www.crunchbase.com/organization/fortr3ss,"Apps, Security","Fortr3ss is an intelligent voice biometrics platform for server, mobile, web, and blockchain","Fortr3ss is an intelligent voice biometrics platform for server, mobile, web, and blockchain. Fortr3ss provides a secure voice biometric solution for identification and transactional approval in fintech, healthcare, and enterprise markets. Voice biometrics is a simple, intuitive way to authenticate your users during a customer support call; a mobile login or transactional approval; a telemedicine interview with your doctor; or an e-commerce transaction. Fortr3ssSDK, our Software Development Kit, is a mobile or web based API that allows your internal development teams to add an intuitive voice driven identification.    Fortr3ssAD, for the enterprise, is an integration to Microsoft Active Directory that allows users to access corporate computers with their voice and reduce IT Help Desk costs by allowing password reset through their mobile devices.    Fortr3ssPM, for the consumer, is a mobile and web browser password manager that store passwords, credit cards, Id’s, and Notes. Use our browser plugins for Chrome and IOS to login to website on your PC or mac as well for a fully connected but intuitive password manager.   It has become apparent that the world is moving to a voice integrated society as seen with intelligent assistants from Amazon, Google, and Apple. These devices allow people to speak freely and will soon be the standard for customer support, ecommerce, home automation, automotive, and other industries, as people become more accustomed to speaking with chat bots along with humans to streamline interactions. Fortr3ss secures these interactions of our new digital world. "
FoodAdvisor,https://www.crunchbase.com/organization/foodadvisor,"Food and Beverage, Media and Entertainment, Restaurants",F&B Media / Content Provider ,"FoodAdvisor.my helps people who know what they want to eat. We guide them to the best restaurant or cafe to visit at their preferred area. Another reason which makes us unique is our listings are curated via a rating system by local food lovers who visit our domain. In doing so, we also believe that we can help businesses promote their best dishes towards potential customers speciﬁcally looking for a particular dish. This is as we believe restaurants and cafés deserve to have the opportunity to highlight their best, and foodies deserve to have the opportunity to savour nothing short of the best."
Fortuna Fix,https://www.crunchbase.com/organization/fortuna-fix,"Biotechnology, Medical, Medical Device, Pharmaceutical", Clinical-stage biotech company .," Fortuna Fix is a private, clinical-stage Regenerative Medicine company.the treatment of neurodegenerative diseases and neurotrauma. The company is focused on its lead programs in Spinal Cord Injury and Parkinson's disease with further development efforts in Stroke, Traumatic Brain Injury, Hearing Loss and ALS."
Foodscovery,https://www.crunchbase.com/organization/foodscovery,"E-Commerce, Food and Beverage, Food Delivery, Online Portals",Foodscovery is an online market which allows you to order regional gastronomic products.,"Foodscovery is an online market which allows you to order regional gastronomic products directly from the farmers, fisherman, small producers which are more representative of the local tradition."
Fotobom Media Inc.,https://www.crunchbase.com/organization/fotobom,"Advertising Platforms, Media and Entertainment, Messaging, Mobile, Mobile Advertising, Social Media, Software",Fotobom Media is a cutting-edge mobile platform that powers meaningful customer connections through messaging,"Fotobom Media, Inc. is a cutting-edge mobile platform that powers meaningful customer connections through messaging. Messaging is the fastest growing sector of social media. It's also the most challenging area for digital marketers to engage mobile audiences and measure results. The vast majority of social sharing occurs in the ""Dark Social""​ space, yet the majority of marketing budgets still remain dedicated to traditional social media marketing outlets. As a result, consumers on traditional social platforms are over-marketed to, and look-alike modeling targeting tactics continually fall short of intended results. Fotobom Media enables marketers to reach mobile messaging users with a 1:1 ""Direct Social""​ methodology - the most compelling form of mobile marketing. Fotobom's platform currently generates over 1 billion impressions, allowing marketers to significantly reach new mobile audiences, drive meaningful customer interactions, execute on action-based campaigns, and gain critical insight into campaign performance. The company was founded by Stanford University graduates and leaders from the ad tech, media, and wireless industries. Fotobom Media is headquartered in San Francisco, CA."
FODY Food,https://www.crunchbase.com/organization/fody-food,"Food and Beverage, Food Processing, Organic Food",Montréal-based food company ," Fodyland! With our delicious Low FODMAP products, provide people a much needed relief from their IBS symptoms."
FortunePay,https://www.crunchbase.com/organization/fortunepay,"Electronics, Financial Services, Payments",FortunePay offers comprehensive end-to-end electronic payment platform and services to acquiring banks and merchants.,"The India market is ready for a team that can offer robust internet payment services which can be easily integrated to provide a seamless user experience.FortunePay is a venture started by seasoned payments professional with a track record in delivering innovative solutions for both emerging and developed markets. Having worked in the India payments market delivering proven products for internet & mobile payments, and for financial inclusion, the team's experience will translate to shorter Time-to-Market (TTM), a higher Return-on-Investment (ROI) and the ability to scale your business rapidly.While our corporate offices are in Bangalore, we are in the process of opening our office in Mumbai."
Foreseeti,https://www.crunchbase.com/organization/foreseeti,"Banking, Cyber Security",Empowering companies to manage cyber security in a proactive and business minded way.,"foreseeti was founded in 2014 and consists of a dynamic, dedicated team of highly qualified academics, seasoned security experts, experienced business professionals and skilled developers. Their solutions are used by multinational companies in the banking and energy sectors, and their clients value our practical, hands-on approach."
foodgroot.com,https://www.crunchbase.com/organization/foodgroot-com,"Food and Beverage, Nutrition, Personal Health",Disrupt Food. Improve Health. Globally.,"According to the World Health Organization (WHO), 7 out of 10 people die prematurely because of the epidemic of chronic diseases. Bad diet is named a major risk factor. This can change. Foodgroot is a food rating & tailor-made shopping which makes food production more transparent, empowers the role of consumers and improves their health. We examine, analyze and parameterize a large amount of data on the origin of food, its processing, quality, impact on human health, production transparency and environmental sustainability. The main criteria for food rating are origin, health and credibility."
Foodie Shares,https://www.crunchbase.com/organization/foodie-shares,"Communities, Food and Beverage, Marketplace",Private Community Marketplace for Gourmet Homemade Food,Foodie Shares is a private community marketplace for gourmet homemade food. People who like to cook can share their dishes with our members for free or for a fee whenever they feel the urge to make great food. People who like to eat can become members and discover great food made by our cooks and even be notified of these food sharing opportunities as they arise.
Fortem Technologies,https://www.crunchbase.com/organization/fortem-technologies,"Aerospace, Air Transportation, Autonomous Vehicles, Drone Management, Mechanical Engineering","Fortem Technologies is a privately held, venture backed company that delivers ultra small C-SWAP radar to enable the autonomous revolution.","Fortem Technologies is an innovative leader in AI-enabled airspace security and safety. The company provides real-time intrusion detection and detect-and-avoid solutions. Fortem delivers a military-tested, commercially available solution that alerts, identifies and classifies drones and other unmanned aircraft vehicles (UAVs). A Silicon Valley venture funded company that delivers innovative technologies to enable safe autonomous airborne operations, Fortem Technologies’ proven solutions allow organizations to transition their unmanned aircraft operations beyond visual line of sight (BVLOS). The company is privately held and backed by multiple investors."
Forus,https://www.crunchbase.com/organization/forus-9185,"Beauty, Fitness, Health Care, Sports, Wellness",Forus is dedicated to the construction or rehabilitation of municipal sports centers and their subsequent management.,Forus is dedicated to the construction or rehabilitation of municipal sports centers and their subsequent management.
Forcura,https://www.crunchbase.com/organization/forcura,"Enterprise Software, SaaS","Forcura offers a web-based solution for generating, approving, and archiving post-acute orders and forms.","Forcura, LLC develops software solutions for the healthcare industry. The company offers Forcura, a Web-based solution for generating, approving, and archiving post-acute orders and forms; and Forcuracore, a Software as a Service application that manages hosting application, servers, and data back-up. It also provides integration services, including single sign-on, EMR integration, and payer integration; and customization services, such as custom reports and forms, executive and role-based dashboards, and custom workflows. The company provides solutions for home health, home medical equipment, hospice, hospitals, infusion, and physicians. Forcura, LLC was incorporated in 2010 and is based in Jacksonville, Florida."
Food Market Hub,https://www.crunchbase.com/organization/food-market-hub,"E-Commerce, Enterprise Resource Planning (ERP), Food and Beverage, Information Technology, Mobile Apps, Procurement, Restaurants, Supply Chain Management","Supply Chain Platform For Horeca (Restaurants, Central Kitchen, Hotel, Marine Supply, Canteen, Cafe).","We use Big Data and AI to improve restaurant procurement and food cost then we consolidate restaurants required ingredients through supply chain service to lower food cost. Our solution cover restaurant outlet, central kitchen, warehouse until supplier. Food cost, recipe, barcode, procurement, sales, wastage, inventory, variance, tracking, sourcing, supply chain, every aspect you need for restaurant chain backend control, we have it. Service currently available for Malaysia, Hong Kong, Taiwan, Thailand and Singapore."
Forecast Health,https://www.crunchbase.com/organization/forecast-health,"Analytics, Health Care, Predictive Analytics",Forecast Health provides health systems with predictive analytics that enable their membership growth and clinical strategies.,"Forecast Health, an advanced analytics and predictive modeling company.  Forecast Health’s proven predictive models integrate the industry’s vast store of disaggregated financial, clinical and social determinant data to produce powerful insights and care plans that drive better healthcare outcomes."
