Organization Name,Organization Name URL,Categories,Description,Full Description
Forecast,https://www.crunchbase.com/organization/forecasthq,"Artificial Intelligence, Developer Tools, Human Resources, Machine Learning, Natural Language Processing, Professional Services, Project Management, Scheduling, Software, Task Management","Forecast helps project-driven companies automate operations, empower people and leverage insights to drive business performance","Forecast is a business management platform that helps project-based companies automate operations, empower people and leverage insights to drive business performance and client success. At Forecast, we believe your every day should be filled with less ad-hoc and administrative work. That freedom creates more room to focus on evolving, improving and empowering your people to think innovatively. Whether it is designing, structuring, acting or simply steering the company in the right direction, Forecast has your back. Increase agility with a platform that embraces a radically new approach of continuous improvement and learning by leveraging Artificial Intelligence (AI). Instead of spending time collecting data, we think you should be spending time acting from data. That will enable you to move from the old world projects first to a new world of clients first, which in turn will help you deliver better results."
Ford Motor Company,https://www.crunchbase.com/organization/ford,"Apps, Automotive, Manufacturing, Transportation","Ford Motor Company, an automotive company, develops, manufactures, and distributes vehicles, parts, and accessories worldwide.","Ford Motor Company manufactures or distributes automobiles in addition to offering financial services. The company sells to dealerships for retail sale, and for sale to fleet customers, including commercial fleet customers, daily rental car companies, and governments. Ford’s vehicle portfolio includes automobiles, buses, tractors, and trucks. As a result of these financing activities, Ford Motor Credit Company LLC has a portfolio of finance receivables and operating leases which it classifies into two portfolios— ‘consumer’ and ‘non-consumer’. Finance receivables and operating leases in the consumer portfolio include products offered to individuals and businesses that finance the acquisition of its vehicles from dealers for personal and commercial use. Retail financing includes retail installment sale contracts for new and used vehicles, and direct financing leases for new vehicles to retail customers, government entities, daily rental car companies, and fleet customers. Finance receivables in the non-consumer portfolio include products offered to automotive dealers. Ford’s environmental initiatives include compressed natural gas, flexible fuel vehicles, electric drive vehicles, Hydrogen, and PC power management, and so on. Ford Motor Company was founded by Henry Ford in 1903 and is headquartered in Dearborn, Michigan."
Foodpanda,https://www.crunchbase.com/organization/foodpanda,"Delivery, E-Commerce, Food Delivery",foodpanda is a online food delivery marketplace that enables users to place orders at local restaurants via its website or mobile app.,"Foodpanda is a global online food delivery marketplace that enables users to place orders at local restaurants via its website or mobile application. Customers enter their postcodes on the site, browse for food from a list of restaurants, and place the order; foodpanda processes the order details, sends out an SMS to customers to confirm orders and their estimated delivery time, and passes the details to partner restaurants; and the restaurants deliver the food to customers. It is called foodpanda in Asia and Europe and hellofood in Africa, Latin America, and the Middle East. Foodpanda has partnered with more than 60, 000 restaurants globally, including Pizza Hut, Subway, KFC, McDonalds, and Jollibee. Foodpanda was launched by Ralf Wenzel and Benjamin Bauer in 2012 and is operated from Berlin, Germany with presence in over 40 countries and 500 cities across 5 continents."
FourKites,https://www.crunchbase.com/organization/fourkites,"Enterprise Software, Logistics, Supply Chain Management",FourKites is an end-to-end supply chain visibility platform that major global companies use to track and manage their freight.,"FourKites is the real-time supply chain visibility platform that Fortune 500 companies and 3PLs trust to track shipment location and temperature and proactively manage exceptions. Using a proprietary predictive algorithm to calculate shipment arrival times, FourKites enables customers to lower their operating costs, improve on-time performance, and strengthen their end-customer relationships. Using FourKites, blue-chip shippers and 3PLs share the same, real-time shipping location and status information from more than four million GPS/ELD devices.  FourKites tracks and consolidates data across modes – including ocean, rail, parcel, and over-the-road, with both truckload and less-than-truckload – into a unified platform built for global enterprise companies. The platform is optimized for mobile and equipped with market-leading end-to-end security. To learn more, visit www.fourkites.com. FourKites was founded by Mathew Elenjickal in 2014."
ForgeRock,https://www.crunchbase.com/organization/forgerock,"Cyber Security, Enterprise Software, Identity Management, Information Technology, Internet of Things, Privacy","ForgeRock digital identity management solutions transform how organizations securely interact with customers, employees, devices, and things","ForgeRock® is the digital identity management company transforming the way organizations interact securely with customers, employees, devices, and things. Organizations adopt the ForgeRock Identity Platform™ as their digital identity system of record to monetize customer relationships, address stringent regulations for privacy and consent (GDPR, HIPAA, FCC privacy, etc.), and leverage the internet of things. ForgeRock serves hundreds of brands, including Morningstar, Vodafone, GEICO, Toyota, TomTom, and Pearson, as well as governments like Norway, Canada, and Belgium, securing billions of identities worldwide. ForgeRock has offices across Europe, the USA, and Asia. Visit www.forgerock.com for free downloads and follow us on Twitter @forgerock."
Forty Seven,https://www.crunchbase.com/organization/forty-seven,"Biotechnology, Clinical Trials, Health Care",Forty Seven is a clinical-stage immuno-oncology company that is developing therapies targeting cancer immune evasion pathways.,"Forty Seven, Inc. is a clinical-stage immuno-oncology company that is developing therapies targeting cancer immune evasion pathways based on technology licensed from Stanford University. Forty Seven's lead program, 5F9, is a monoclonal antibody against the CD47 receptor, a ""don't eat me"" signal that cancer cells commandeer to avoid being ingested by macrophages. This antibody is currently being evaluated in six clinical studies in patients with solid tumors, acute myeloid leukemia, non-Hodgkin's lymphoma and colorectal carcinoma."
Foundation Medicine,https://www.crunchbase.com/organization/foundation-medicine,"Biotechnology, Genetics, Health Care, Medical",Foundation medicine is a molecular information company developing clinical diagnostic tests that facilitates personalized cancer therapies.,Foundation Medicine plans to create clinical diagnostic tests that can use the latest in genetic sequencing technology to identify personalized cancer therapies for patients.
ForeScout Technologies,https://www.crunchbase.com/organization/forescout,"Cloud Security, Cyber Security, Internet of Things, Network Security",ForeScout Technologies provides enterprises and government agencies with agentless visibility and control of devices.,"ForeScout is transforming security through visibility.  We help make the invisible visible by providing Global 2000 enterprises and government agencies with agentless visibility and control of traditional and IoT devices the instant they connect to the network. Our technology integrates with disparate security tools to help organizations accelerate incident response, break down silos, automate workflows and optimize existing investments."
Folio,https://www.crunchbase.com/organization/folio-4,"Financial Services, FinTech, Stock Exchanges",Folio develops next generation on-line trading platform for both passive and active stock traders.,"Folio Investing is the brokerage designed specifically to help you maximize returns by providing you with the ability to create customized, well-diversified portfolios and manage them at a low cost.  It’s the one place where you can create an unlimited number of diversified investment portfolios, called folios, to combine the benefits of direct stock ownership with one-click control over your portfolio strategy. You can customize each folio with up to 100 stocks, ETFs, and mutual funds or choose from over 160 free, pre‐made Ready-to‐Go folios that you can use as-is or customize. Diversification is easy and accessible at Folio because with fractional share investing, you can trade securities at any dollar amount—even less than a full share. Folio is the only brokerage to offer flat‐fee pricing that includes 2,000 commission-free window trades each month for $29 so you can trade freely regardless of the number of securities in your folios (nominal fee for IRAs). Folio also provides patented tax management tools as well as access to private investment opportunities. Financial professionals can leverage these benefits for their clients using the Folio Institutional platform."
Fortify,https://www.crunchbase.com/organization/3dfortify,"3D Printing, Industrial Engineering, Manufacturing, Mechanical Engineering",Fortify is an advanced manufacturing startup that aims to disrupt additive manufacturing.,"3DFortify is an advanced manufacturing startup that aims to disrupt additive manufacturing, ushering in a new generation of custom, high performance products. We have developed a patented process that combines 3D printing and magnetics to create aligned reinforced carbon fiber composites."
Forter,https://www.crunchbase.com/organization/forter,"Analytics, E-Commerce, FinTech, Fraud Detection, SaaS","Forter offers a fraud solution that helps retailers grow sales, lower costs, and improve customer experience via its Decision as Service.","Forter is a NYC-based company that delivers real-time, completely automated, fraud prevention solutions for online merchants. It creates a completely fraud-free environment for the retailers through which they have the ability to make decisions which are solely based on what is good for their business. The company’s system is designed to be consumer-centric, blocking fraud with accuracy, and at the same time enabling growth by increasing approvals and ensuring a better customer experience."
Forge,https://www.crunchbase.com/organization/equidate,"Finance, Financial Services, FinTech, Marketplace","Forge (formerly Equidate) is a marketplace for private equity, giving private and institutional investors access to top pre-IPO companies.","Forge (formerly Equidate) is a marketplace for private equity, giving private and institutional investors access to top pre-IPO companies. It allows employees and early investors of growing startups to liquidate a portion of their shares without having to wait years to take advantage of their company’s growth and success."
Foursquare,https://www.crunchbase.com/organization/foursquare,"Advertising Platforms, Apps, Big Data, Developer APIs, Developer Tools, Guides, Location Based Services, Mobile, Mobile Advertising, Private Social Networking","Foursquare is a location technology platform, powering business solutions and consumer products through a deep understanding of location.","Foursquare is the leading independent location technology platform, powering business solutions and consumer products through a deep understanding of location. Over 1,000 clients—including more than 50% of the Fortune 100—choose Foursquare. Foursquare’s toolkit includes Foursquare Analytics; Placed powered by Foursquare; Pinpoint audiences; and Pilgrim SDK and Places API, our developer tools. Together, these products empower brands to analyze trends; measure foot traffic lift via multi-touch attribution; optimize advertising campaigns across hundreds of audiences; and drive deeper engagement via Foursquare’s industry-leading developer tools, which have been selected by 150,000 developers including AccuWeather, Apple, Samsung, Microsoft, Snapchat, Tinder, TripAdvisor, Twitter and Uber. Foursquare consumer apps and R&D team, called Foursquare Labs, round out our portfolio. Over 13 billion verified signals from people around the world inform our map and models. Foursquare has more than 350 employees based in New York headquarters and offices in Seattle, San Francisco, Chicago, Los Angeles, and Singapore. Foursquare is proud to be funded by The Raine Group, Simon Ventures, Naver, Union Square Ventures, Andreessen Horowitz, DFJ Growth, Morgan Stanley Alternative Investment Partners and more."
Formant,https://www.crunchbase.com/organization/formant,"Information Services, Information Technology, Robotics",Formant is a monitoring and operations infrastructure for anyone who works with robots.,"Formant is a monitoring and operations infrastructure for anyone who works with robots. Founded by a team of former Google, Savioke, and Redwood Robotics software engineers, roboticists, and product managers—Formant believes that more efficient cloud infrastructure can help unlock the shared potential of humans and robots. The company was established in 2017 and is based in San Francisco, California."
Formlabs,https://www.crunchbase.com/organization/formlabs,"3D Printing, Consumer Electronics, Hardware",Formlabs develops powerful and accessible 3D printing systems designed for printing intricate figures.,"Formlabs is developing an affordable high-resolution 3D printer to enable designers, engineers, and makers to easily realize their dreams in beautiful physical form. It manufactures 3D printing systems for various industries such as education, dentistry, health care, jewelry, and research. The company was founded in 2011 as a Kickstarter project. It was in August 2018 when Formlabs officially became a unicorn company after it was valued $1 billion. Formlabs is headquartered in Somerville, Massachusetts. "
Foodspring,https://www.crunchbase.com/organization/foodspring,"Fitness, Food and Beverage, Health Care, Wellness",Foodspring is a premium fitness food & sports nutrition company.,"Foodspring is a premium fitness food & sports nutrition company. Their goal is to bring sports nutrition to the next level. Their protein powder has caused a stir in the industry with its organic certification. With milk from pasture cattle, they have shaken old-established structures. And fitness-enthusiastic people encouraged to think. There are many foods. But it's about more. To the real benefit. That's why goji berries contain seven times more vitamin C than oranges. That coconut oil has a much higher heat resistance than olive oil. And that the vacuum drying allows them , in contrast to classic dried fruit, to get 80% of the vitamins in their Crunchy Fruits."
Four Sigmatic,https://www.crunchbase.com/organization/four-sigmatic,"Fitness, Food and Beverage, Health Care, Nutrition, Wellness","Four Sigmatic is make drinking mushrooms easy with their mushroom coffees, elixirs, and superfood blends.","Four Sigmatic make drinking mushrooms easy with our mushroom coffees, elixirs, and superfood blends."
Form Energy,https://www.crunchbase.com/organization/form-energy,"Environmental Engineering, Renewable Energy","Form Energy is developing a brand new class of ultra-low cost, long duration energy storage systems.","Form Energy is a small team of passionate people committed to helping the world transition to renewable energy with technology. They are developing a new class of ultra low cost, long duration energy storage systems to make renewable energy available even when the sun sets, or the wind stops blowing.   Form’s technology has the potential to transform the electric grid by making renewable energy dispatchable year-round. The company’s core technology was invented at MIT and is supported by category leading investors including Breakthrough Energy Ventures, MIT’s The Engine, and Prelude Ventures. Their team members are active learners who like working on tough technology problems that can only be solved with a combination of scientific innovation and hard work."
Fooda,https://www.crunchbase.com/organization/fooda,"Consumer, Consumer Software, Enterprise Software, Food and Beverage, Restaurants",Fooda is a food technology platform that connects restaurants to people while at work.,"Founded in 2011 and headquartered in Chicago, Fooda is a startup built around food. We’re powered by technology and are changing the way people think about corporate lunch. We’re a tight knit group of people with a vision to bring great food from local restaurants to employees while at work. We’re well funded and growing quickly."
Forethought,https://www.crunchbase.com/organization/forethought-7dc2,"Artificial Intelligence, Customer Service, Knowledge Management, Machine Learning, Natural Language Processing, SaaS",Forethought builds AI systems that boost customer support productivity by embedding information retrieval into existing workflows.,"Forethought empowers people to be a genius at their job with AI powered products that proactively embed relevant information into employees' daily workflows. The company's customer support product, Agatha Answers, embeds on-top of existing Helpdesks, boosting support agent ticket throughput by reducing the time spent searching for information. The company was founded in 2017 and is headquartered in Palo Alto, California."
Fond,https://www.crunchbase.com/organization/fond,"Employee Benefits, Human Resources, SaaS, Subscription Service",Fond is a SaaS platform that makes it easy to manage rewards and recognition programs.,"Fond is a SaaS platform that seamlessly consolidates employee rewards and recognition processes into one easy-to-use solution. With Fond, employees and managers can recognize each other, redeem rewards, access exclusive corporate discounts, and measure success so HR departments spend less time managing programs and more time driving results. Fond is headquartered in San Francisco, California. Learn more at https://www.fond.co."
Forward Networks,https://www.crunchbase.com/organization/forward-networks,"Computer, Information Technology, Software","Forward Networks delivers an innovative platform that provides network visibility, policy verification, and change modeling.","Forward Networks delivers an innovative platform that provides network visibility, policy verification, and change modeling. Designed to help network teams eliminate costly network outages, the Forward Networks platform enables engineers and operators to easily visualize and search complex networks, quickly debug problems, verify network-wide policy correctness, and predict network behavior prior to making changes to production equipment — for legacy, SDN, or hybrid environments. Fortune 100 financial institutions, telcos, and IT service providers use Forward Networks to de-risk business operations and drive operational efficiency.  Founded by a team of PhDs who helped pioneer SDN at Stanford, Forward Networks is headquartered in Palo Alto, CA and funded by Andreessen Horowitz, SV Angel, A Capital and several luminaries in the networking and systems space. See more at www.forwardnetworks.com"
Foodsby,https://www.crunchbase.com/organization/foodsby,"Delivery, Hospitality, Restaurants",Foodsby is an office lunch catering and delivery company.,"Foodsby is an online marketplace connecting employees in office buildings with local restaurants to provide hard-working professionals with a variety of easy lunch options. Individuals place orders online, orders are aggregated via Foodsby.com, and the restaurants make one simple delivery with all orders. We're giving hardworking professionals the freedom to eat well and remain productive in their work-life.  Contact info@foodsby.com or sign-up your office on www.foodsby.com today."
Formation,https://www.crunchbase.com/organization/formationai,"Business Intelligence, Communications Infrastructure, Machine Learning, Personalization",Formation distills customer data into uniquely tailored experiences; we orchestrate physical & digital exchanges into one seamless journey.,"Formation distills complex customer data into uniquely tailored experiences; we orchestrate physical and digital exchanges into one seamless journey. Our business is building lasting, trusted relationships between people and brands—and making it look easy. We’re already reaching millions of people a day, and we’re just getting started. Backed by corporate venture capital and led by a world-class team, we have the relationships, passion, and resources to apply cutting edge technology at unprecedented scale."
Food52,https://www.crunchbase.com/organization/food52,"Content, Cooking, E-Commerce, Hospitality, Publishing","Food52 is the premier destination for kitchen & home enthusiasts offering a curated shop, industry-leading content and a vibrant community.","Food52 is a ground-breaking, award-winning destination for a growing community of 13M cooks and home enthusiasts — a one-stop shop where they can be inspired by great ideas and find the tools and tips to bring them to life. From the beginning, co-founders Amanda Hesser and Merrill Stubbs have disrupted the status quo, building a 360-degree hub combining content, commerce, and community. Food52 is proud to work with more than 500 makers around the world to bring high-quality and hard-to-find goods to its Food52 Shop. In 2018, the brand launched Five Two, its first-ever direct-to-consumer line of products for kitchen, home and life created exclusively with the Food52 community. With Five Two, Food52 is on a mission to reimagine every room in the house — and remake everything in it. For more information, visit www.food52.com."
FortressIQ,https://www.crunchbase.com/organization/fortressiq,"Artificial Intelligence, Business Intelligence, Data Center Automation, Information Technology, Software","FortressIQ defines security, insights, and governance in enterprise business automation and AI.","FortressIQ defines security, insights, and governance in enterprise business automation and AI. It is on a mission to unlock the limitless potential of the global workforce by accelerating the responsible and ethical use of AI in the enterprise. FortressIQ is a meta-learning company, focused on techniques that allow deep neural networks to scalably acquire training data by observing the world around us. The company was founded by Pankaj Chowdhry in 2017, with its headquarters in San Francisco in California."
Form3,https://www.crunchbase.com/organization/form3-financial-cloud,"Banking, Financial Services, Mobile Payments, Payments, SaaS","Form3 is delivers cloud-based connectivity, payment processing, clearing and settlement services.","Form3 delivers cloud-based connectivity, payment processing, clearing and settlement services. It is a fully managed payment technology service combining a powerful AWS cloud processing platform, multiple-scheme payment gateways and a fully managed 24x7 service model. Form3's powerful micro-services architecture and API's provide a single point of simple access to the full universe of payment schemes. Its clients include a wide range of regulated financial institutions, including leading banks, non-bank financial institutions, and fintech companies (payment institutions, e-money providers, and pre-paid card providers).  Form3 was founded in 2016 and is based in London, England."
Fortis Healthcare,https://www.crunchbase.com/organization/fortis-healthcare,"Biotechnology, Health Care, Health Diagnostics","Fortis Healthcare is a leading, pan Asia-Pacific, integrated healthcare delivery provider.","Fortis Healthcare Limited is a leading, pan Asia-Pacific, integrated healthcare delivery provider. The healthcare verticals of the company span diagnostics, primary care, day care specialty and hospitals, with an asset base in 11 countries, many of which represent the fastest-growing healthcare delivery markets in the world. Currently, the company operates its healthcare delivery network in Australia, Canada, Dubai, Hong Kong, India, Mauritius, New Zealand, Singapore, Sri Lanka, Nepal and Vietnam with 76 hospitals, over 12,000 beds, over 600 primary care centres, 191 day care specialty centres, over 230 diagnostic centres and a talent pool of over 23,000 people. Fortis Healthcare is driven by the vision of becoming a global leader in the integrated healthcare delivery space and the larger purpose of saving and enriching lives through clinical excellence."
