Organization Name,Organization Name URL,Categories,Description,Full Description
Sony,https://www.crunchbase.com/organization/sony,"Consumer Electronics, Digital Entertainment, Hardware, Software, Video on Demand","Sony Corporation is a Japanese multinational conglomerate corporation headquartered in Kōnan, Minato, Tokyo.","Sony Australia is the Australian arm of Sony, a multinational conglomerate corporation that designs and develops electronic equipment, instruments, and devices. The company offers LCD televisions, audio systems, Blu-ray disc players, memory-based audio devices, personal computers, interchangeable single-lens cameras, PlayStations, batteries, audio/video/data recording media, storage media, optical pickups, chemical products, optical disk drives, and more."
Sol Voltaics,https://www.crunchbase.com/organization/sol-voltaics,"Clean Energy, Energy, Nanotechnology, Solar","Sol Voltaics is a nanotechnology company focused on improving the efficiency of energy capture, generation and storage using nanomaterials.","Founded in 2007, Sol Voltaics AB is a venture-backed, development-stage nanotechnology company focused on development and commercialization of highly efficient, third-generation photovoltaic concentrator solar cells based on its proprietary heterostructured nanowire epitaxial growth and process technologies."
Sofdesk,https://www.crunchbase.com/organization/sofdesk-inc,"Energy, Home Renovation, Insurance, Sales Automation, Software, Solar, Web Apps","Sofdesk offers web application solutions for solar installation, roofing, and insurance companies.","Sofdesk offers web application solutions for solar installation, roofing, and insurance companies. It is a software company that develops intuitive, easy-to-use sales acceleration products for the solar and roofing industries. Sofdesk enables small to medium-sized companies to scale and improve infrastructure through centralized and powerful solutions by delivering an end-to-end solution. Its products are Solargraf, for solar installation companies and Roofgraf, for roofing companies. Sofdesk was founded on 2013 and is headquartered in Montréal, Quebec, Canada."
Soul,https://www.crunchbase.com/organization/soul-bd43,"Internet, Social Network",SOUL is a social network that uses AI to help users find their soul mates.,SOUL is a social network that uses AI to help users find their soul mates.
SOFIE,https://www.crunchbase.com/organization/sofie-biosciences,"Biotechnology, Life Science, Medical Device",SOFIE is a molecular imaging company focused on empowering people with new PET technologies.,"SOFIE brings that vision to life by increasing the adoption and application diversity of theranostics by removing the cost and complexity traditionally associated with the technology. With a full line of imaging and radiochemistry systems and a premier radiopharmacy network and contract manufacturing organization to supply novel agents for diagnosis and therapy, SOFIE is dedicated to improving patient health."
Soltec Trackers,https://www.crunchbase.com/organization/soltec,"Industrial Manufacturing, Manufacturing","Soltec manufactures, supplies, and installs single-axis solar tracker equipment.","Soltec, the Third Largest Tracker Supplier Worldwide in 2017, manufactures and supplies cost-effective horizontal single-axis solar trackers and related services. Soltec enjoys top-tier customers repeating business thanks to their history in solar tracking and to their amazing team dedicated to customer experience and innovation.  Highly dedicated to innovative research and product enhancement to offer the industry’s premier technology, the company reached annual shipments of 1,097 GW worldwide. Its facilities are in Argentina, Australia, Brazil, Chile, China, Denmark, India, Israel, Italy, Mexico, Peru, Spain and the United States. Soltec enjoys repeating customers thanks to its high-tolerance installation and reliability to meet project criteria of schedule, cost and quality. "
SORABITO,https://www.crunchbase.com/organization/sorabito-inc,"Construction, Information Technology, Internet, Marketplace, Trading Platform",SORABITO is Japan’s heavy machinery e-marketplace operator,
Soundbrenner,https://www.crunchbase.com/organization/soundbrenner,"Art, Education, Music, Music Education, SaaS, Wearables","Combining wearables with great software, to create an addictive music-practice experience that allows anyone to learn any instrument.","Soundbrenner - to make everyone a great musician: Over 1 billion people have tried learning an instrument and failed. More than 90% of people who start playing music give up in less than a year. Enter Soundbrenner. By combining wearables with great software, Soundbrenner creates an addictive music-practice experience that allows anyone to learn and master any instrument. To date we shipped over 80,000 wearables and are in music stores in over 40 countries. Our mobile apps are used by over 500,000 musicians every month. We're headquartered in Hong Kong and operate an additional office in Berlin. While we are proud of the progress we made so far, we still consider ourselves to be at the very beginning of what is to come."
Sonitor Technologies,https://www.crunchbase.com/organization/sonitor-technologies,"Asset Management, Information Technology, Real Time",Sonitor Technologies is a leading provider of Real Time Location System,"Sonitor Technologies is the only Real Time Locating System (RTLS) vendor to offer a truly tiered resolution RTLS solution that combines area, room and sub-room accuracy in one platform. A wireless, battery powered infrastructure gives the lowest Total Cost of Ownership (TCO) and at the same time offers the fastest return on investment. This, combined with unparalleled robustness and reliability, makes Sonitor the obvious choice for organizations looking for an RTLS technology partner for equipment tracking, nurse call, workflow and more."
Solar Analytics,https://www.crunchbase.com/organization/solar-analytics,"Environmental Engineering, Renewable Energy, Solar",Solar monitoring company that maximises the value home owners get from their solar power system,Solar Analytics is an innovative greentech company based in Australia that develops solar PV monitoring to help customers get their solar energy systems working to capacity.
SolarWindow Technologies,https://www.crunchbase.com/organization/solarwindow-technologies,"Clean Energy, Renewable Energy, Solar","SolarWindow Technologies, Inc. is a developer of next generation, transparent electricity-generating SolarWindow™ coatings.","SolarWindow™ Technologies, Inc. (OTCQB: WNDW) is developing first-of-their-kind electricity-generating see-through windows and products for America’s 85 million detached homes and commercial buildings. Our mission has been to create SolarWindow™ products which produce extraordinary amounts of clean electricity, financially reward our customers, and benefit the environment. A bold undertaking."
Solix Algredients,https://www.crunchbase.com/organization/solix-algredients,"B2B, Biotechnology, Dietary Supplements, Food and Beverage, Health Care, Manufacturing, Nutraceutical","Solix Algredients is a B2B supplier of algae-based, natural ingredients that benefit health-conscious consumers","For nearly 10 years, a focus on understanding algae, and applying that expertise commercially, has been the focal point for Solix. Founded in 2006, and most recently operating as Solix BioSystems, the company’s origins were in algae-based biofuels. The company developed and successfully deployed a robust algal growth system (AGS®) based on its patented, extended-surface area closed photobioreactor panels. AGS® is a proven system for the production of algal biomass, and is applicable to a broad range of microalgal species.  Solix operated a demonstration facility in southwestern Colorado for multiple years, confirming the technology’s reliability, industry leading volumetric productivity and scalability. In 2015, Solix strategically repositioned as a B2B supplier of high-quality, natural ingredients derived from algae for the nutrition and personal care markets. Operating as Solix Algredients, the company is helping manufacturers and brands bring the benefits of algae-based natural ingredients to health-conscious consumers."
Soundbite Medical Solutions,https://www.crunchbase.com/organization/soundbite-medical-solutions,"Health Care, Manufacturing, Medical Device", A medical device company ,"SoundBite Medical is a medical devices company that began operations in May 2015, with its R&D facilities in Sherbrooke and commercialization headquarters in Montreal, Quebec. The Company is developing and commercializing proprietary wire-based device and generator console that delivers safe shockwave energy within the cardiovascular system to treat chronic total occlusions (CTO's)."
Solyndra,https://www.crunchbase.com/organization/solyndra,"Manufacturing, Renewable Energy, Solar",Solyndra manufactures cylindrical panels of CIGS thin-film solar cells.,"Solyndra is a manufacturer of cylindrical panels of CIGS thin-film solar cells based in Fremont, California. Solyndra designs and manufactures photovoltaic systems, comprised of panels and mounting hardware, for the commercial rooftop market. Solyndra employs high volume manufacturing based on proven technologies and processes to meet the needs of the global solar market. Using proprietary cylindrical modules and thin-film technology, Solyndra systems are designed to provide the lowest installed cost per system and the highest solar electrical energy output for typical low slope commercial rooftops. Founded in 2005 and headquartered in Fremont, California, Solyndra operates a state-of-the-art 300,000 square foot fully-automated manufacturing complex."
SolarBridge Technologies,https://www.crunchbase.com/organization/solarbridge-technologies,"Electronics, Manufacturing, Solar",SolarBridge Technologies commercializes power electronics technologies created at the University of Illinois.,"SolarBridge Technologies, formerly SmartSpark Energy Systems, was founded in 2004 to commercialize power electronics technologies created at the University of Illinois. In early 2009, they launched a new corporate strategy to focus exclusively on the solar industry with microinverter and monitoring solutions. SolarBridge Technologies has a major research and development site in Champaign, Illinois and has recently expanded to include a new corporate headquarters in Austin, Texas. Led by industry veterans and academic professionals, their mission is to reduce the Levelized Cost of Energy (LCOE) for solar installations by dramatically improving reliability, increasing energy production, and simplifying installation."
Solera Networks,https://www.crunchbase.com/organization/solera-networks,"Analytics, Enterprise Software, Network Security",Solera Networks develops high-speed network forensics solutions for physical and virtual networks.,"Solera Networks develops high-speed network forensics solutions for both physical and virtual networks. These solutions focus on speed and scalability â€“ capturing, indexing, searching, and replaying all network traffic, even in 10Gb environments. The Solera Networks architecture provides open platform interoperability, extensible storage, and portability. These capabilities enable security professionals to quickly identify the source of any attack, remediate, and fortify against further risk.  Think of this as a black box for the network recording all information for full fidelity replay after an incident."
Soundrop,https://www.crunchbase.com/organization/soundrop,"Apps, Mobile, Music","Soundrop is a social music application that enables users to listen, vote, and interact about songs with their friends.","Soundrop is a social music application that enables users to listen, vote, and interact about songs with their friends. It allows Spotify users to create listening rooms with their existing Spotify playlists. They can also share these listening rooms with their friends, and let their friends help curate the rooms by adding songs or voting up tracks. Everyone can chat about the music as they listen. Additionally, Soundrop has many public rooms dedicated to various music genres such Dubstep, Indie Rock, and Hip hop. Users can chat, add new tracks and vote up tracks they want to listen to next. Soundrop was founded by Inge Andrè Sandvik, Johann Prieur, Ali Sabil, and Ole Andrè Vadla Ravnås in 2011. It launched as a social jukebox app inside Spotify’s App Finder in November 2011."
SOM Biotech,https://www.crunchbase.com/organization/som-biotech,"Biotechnology, Health Care, Medical, Pharmaceutical",Drug Repurposing Company focused on neurological rare diseases.,"SOM Biotech is a drug repositioning company engaged in discovering, confirming, patenting, and licensing the application of already known drugs for their development and commercial use in unknown indications. It offers services in drug discovery, pre-clinical validation, patenting, clinical proof of concept, and licensing of already known drugs. SOM Biotech was founded in 2009 and is based in Barcelona, Spain."
Sohonet,https://www.crunchbase.com/organization/sohonet,"Information Technology, Internet, Media and Entertainment, Software Engineering, Technical Support","Sohonet operates the largest private network for Media & Entertainment in the world, linking over 400 leading studios and creatives.","Sohonet provides technical services for the film and media industry, including secure high-speed networking, Internet connectivity, storage, hosting, data management and digital negative management for file-based productions. We employ a core team of experts who have worked within production and post-production at all levels – from technicians to consultancy and senior management.  Sohonet has a thorough understanding of the workflows, requirements and challenges of the industry which is unmatched by standard telecommunications providers. We specialise in solutions that are flexible, dynamic and tailored specifically to the requirements of the client."
Songxiaocai,https://www.crunchbase.com/organization/songxiaocai,"Agriculture, B2B, Wholesale",Songxiaocai is a B2B platform that provides agricultural wholesale services.,Songxiaocai operates a mobile Internet platform that provides vegetable picking and distribution and after-sales service business to business services for small and medium size retailer.
Soya Garden,https://www.crunchbase.com/organization/soya-garden,"Food and Beverage, Food Processing, Organic Food",The First organic Soya Chain.,
Socialtext,https://www.crunchbase.com/organization/socialtext,"Collaboration, Developer Tools, Enterprise Software",Socialtext is a company that produces enterprise social software via its integrated suite of web-based social apps.,"Socialtext is a Bedford Funding portfolio company, was the first company to deliver social software to businesses. By unlocking knowledge, expertise, ideas and data, Socialtext eliminates information silos across the enterprise to drive superior business performance. Socialtext's enterprise social networking products — including microblogging, blogs, wikis, profiles and social spreadsheets — provide simpler ways for employees to share vital information and work together in real-time. Delivered in a variety of hosted cloud services, as well as on-site appliances, enterprise customers are provided with flexible deployment options that meet their security requirements. Built on a flexible, web-oriented architecture, Socialtext integrates with virtually any traditional system of record, such as CRM and ERP, enabling companies to discuss, collaborate, and take action on key business processes. More than 6,500 businesses worldwide have accelerated their business performance with Socialtext, including Getty Images, Symantec, Meredith Corporation, NYU Stern, OSIsoft, and Epitaph Records."
Songo Media,https://www.crunchbase.com/organization/say-media-group,"Advertising, Digital Media, Marketing, Mobile, Publishing","Songo imagines and launches great ideas, and then grows them into successful businesses. Focusing our capital and expertise on digital media","Recognized by Deloitte as one of the 50 fastest growing technology companies in 2015 and again in 2016, Songo imagines and launches great ideas, and then grows them into successful businesses. We focus our capital and expertise exclusively on digital media — an ecosystem we’ve innovated and flourished in for more than two decades. We support our portfolio of companies with relevant tech modules, backbone services, robust financial backing and a proven network that stretches the globe — all freeing management to focus on nurturing the core business. Entrepreneurs love us because we accelerate their growth and turn their ideas into long-term solid businesses. Investors value us because we know the market inside and out, diversify their digital media portfolio and increase their chances for faster, greater returns. We love the challenge of building new things into powerhouse entities. And, good news is, we have the track record to prove it."
SoMoLend,https://www.crunchbase.com/organization/somolend,"Finance, FinTech","SoMoLend, a web-based tech platform, allows small businesses to raise debt financing from individuals, banks, and business associations.","SoMoLend is a web-based technology that allows small businesses to raise debt financing from friends, family, customers, neighors and local banks. SoMoLend is the first of its kind in many ways as a fully transparent portal that allows investors to look into the eyes of business borrowers in their own neighborhood before making any lending decisions. With SoMo, individuals, banks, local governments, business associations, chambers of commerce and municipalities can invest in small businesses by use of a safe, secure, easy-to-use platform. SoMo is designed with the capability of allowing and promoting peer-to-peer lending, by which business borrowers can get loans from friends and family, customers, Twitter followers, Facebook friends and LinkedIn connections. SoMo will launch peer-to-peer lending nationwide in 2013. In 2010 the founder of SoMoLend, Candace Klein, began a micro-lending program matched with a women’s only, training-based program for participants to earn funding for their start-up companies. There were start-ups that were not able to attain funding through this specific program, and it became apparent that small businesses everywhere needed an advocate. The idea for SoMoLend came from this realization and the desire to assist start-ups that were not able to gain funding through the program. SoMoLend was founded in 2011 to serve small businesses that are not being served by traditional funding. SoMoLend was created on the principal of communities and people helping each other out: people investing in people. We strive as a company to assist local businesses, help entrepreneurs to grow, and allow lenders to invest in the companies and ideas they believe in most. Small businesses create jobs and support local communities, but are struggling to get the support they need; this is where SoMoLend steps in!"
Solvoyo,https://www.crunchbase.com/organization/solvoyo,"Computer, Software","Solvoyo provides distribution optimization, production planning, inventory, and support mechanisms.","Solvoyo is service-based software that provides distribution optimization, production planning, inventory, and support mechanisms. It operates in three segments: strategic planning, tactical planning, and operational planning. Its strategic planning segment provides its clients with network strategy services and inventory deployment. Its tactical planning segment provides demand forecasting, multi-echelon inventory optimization, vendor frequency optimization, sales and operational planning, and concurrent planning.  Finally, its operational planning segment is engaged in delivering services such as demand forecasting, inventory optimization, production planning, replenishment planning, allocation and supply planning, transportation planning, and omni-channel fulfillment. The company serves a renowned clientele such as HP, English Home, Applied Materials, SISECAM, and more. Solvoyo is based in Istanbul, Turkey."
Social Interest Solutions,https://www.crunchbase.com/organization/social-interest-solutions,"Health Care, Information Technology, Non Profit, Software",A national nonprofit dedicated to improving connections to health and social resources through policy and technology solutions.,"Social Interest Solutions is a national nonprofit dedicated to improving access to quality health and social services through policy and technology solutions. We work with federal, state, and local agencies, service providers, community-based organizations, and researchers to better connect millions of low-income Americans to health care, nutrition, and other programs."
Soffos,https://www.crunchbase.com/organization/soffos,"Artificial Intelligence, EdTech, Education",AI-Powered TutorBot.  Hyper-personalized teaching delivery. Democratizing and Personalizing Learning.,"Currently (H2, 2019) raising a seed round of 2 million Euro.  Pitch deck available to qualified investors, subject to t&c's in pitch deck. An AI-powered TutorBot we are creating that will provide 1:1 personalized tutoring to anyone, anytime and anywhere It gathers knowledge from various reputable sources (on thousands of subjects and usable skills) It prepares personalized lessons and lesson paths for each learner, making each lesson unique Check out video: https://vimeo.com/336561476"
SocialWellth,https://www.crunchbase.com/organization/socialwellth,"Big Data, Fitness, Health Care, mHealth",SocialWellth™ is a digital health enablement company delivering Experience as a Service to healthcare stakeholders.,"SocialWellth™ is a digital health optimization company, offering a curation gateway to enable Sponsors (health plans and self-insured employers) to connect and deliver best in breed healthcare and balanced living digital interventions.  Sponsors and third party health and wellness application providers can leverage the HIPAA-compliant, SocialWellth profile-driven marketplace gateway to swiftly deploy and scale their programs and health apps via the web or mobile network, creating trusted and engaging connections with consumers.  As Healthcare Sponsors continue with their efforts to prepare for a marketplace wherein consumers demand and expect tailored offerings and more choices, the SocialWellth digital health curation gateway provides Sponsors with a tremendous opportunity to harness the power of technology and social media to cocreate value and meet the needs of their members. Building on the strengths and experiences of healthcare, technology, and the gaming industry, SocialWellth has demonstrated the power of harnessing consumer profile data into captivating relationships.  SocialWellth’s profile-driven, hyper-personalized Consumer Health Connection Network leverages social and health data, localized community resources, social media tools, and gamification to create a trusted connection between consumers and their healthcare sponsors."
Sophos,https://www.crunchbase.com/organization/sophos,Software,Sophos develops network security and threat management products to protect organizations against malicious acts.,"Sophos is a leader in IT security and data protection. They offer organizations complete protection and control — defending against known and unknown malware, spyware, intrusions, unwanted applications, spam, policy abuse and data leakage, and providing comprehensive network access control (NAC). Their reliably engineered, easy-to-operate products protect over 100 million users in more than 150 countries. Their vision, commitment to research and development, and rigorous attention to quality have enabled them to maintain strong year-on-year growth and the highest levels of customer satisfaction in the industry."
Southern California Gas,https://www.crunchbase.com/organization/southern-california-gas-company,"Natural Resources, Oil and Gas","Southern California Gas Company (SoCalGas) has been delivering clean, safe and reliable natural gas to its customers for more than 140","Southern California Gas Company (SoCalGas) has been delivering clean, safe and reliable natural gas to its customers for more than 140 years. It is the nation's largest natural gas distribution utility, providing safe and reliable energy to 20.7 million consumers through 5.8 million meters in more than 500 communities. The company's service territory encompasses approximately 20,000 square miles in diverse terrain throughout Central and Southern California, from Visalia to the Mexican border."
Sophie's Kitchen,https://www.crunchbase.com/organization/sophie-s-kitchen,"Food and Beverage, Seafood",Sophie’s Kitchen® produces a line of delicious plant-based vegan seafood alternatives.,Sophie’s Kitchen® produces a line of delicious plant-based vegan seafood alternatives.
Socialeads,https://www.crunchbase.com/organization/socialeads,"Apps, Social Media, Software",Socialeads is a software platform .,"Socialeads combines social science, data science and advanced technologies to see and know your personal and professional networks and deliver actionable insights right to your phone."
