Organization Name,Organization Name URL,Categories,Description,Full Description
Socogame,https://www.crunchbase.com/organization/socogame,"Gaming, Mobile Apps, Video",Socogame is a company focused on the development and distribution of mobile games.,"Socogame (上海索乐游戏) is a company focused on the development and distribution of mobile games. It is a game group that owns six holdings and equity affiliates which are engaged in the development and operation of stand-alone or online mobile games, web games, and intelligent video games respectively. Its popular casual game which is called """"Grow Away"""" has more than 80 million users , and has won more than 20 awards in the game industry. With more than 100 game software copyrights and quality standard certificate of ISO9000, it is a high-tech enterprise which sets the corporate governance and R&D with high standards. Socogame was established in 2005. It is an officially authorized mobile phone games development company of Shanghai World Expo and was authorized for the Guangzhou Asian Games in 2010."
Sortd,https://www.crunchbase.com/organization/sortd,"Business Development, Email Marketing, Enterprise Software",Sortd is the world's first email-organizing “Smart-Skin” for Gmail.,"Sortd transforms the email Inbox into a set of organized To-Do lists.  It brings conversations, tasks and priorities together into one intuitive, visually-organized workspace, that's really easy to use and works right inside Gmail. People live in their Inbox but using it to stay on top of things is a chaotic way to work. Most of us have developed less than desirable workarounds in our efforts to stay on top of email (flagging, marking emails as unread, even emailing ourselves to remember important stuff).  The inbox wasn’t meant to be a To-Do list, but it's clear that email is not going away any time soon. Sortd is an 'Email 2.0' venture that re-thinks email and brings a new approach to the way people work."
Sonic Drive-In,https://www.crunchbase.com/organization/sonic-corp,"Food and Beverage, Food Delivery, Food Trucks, Restaurants, Snack Food, Tourism, Travel",Sonic Drive-In is an American drive-in fast-food restaurant chain based in Oklahoma City in Oklahoma.,"Sonic Drive-In operates and franchises a chain of quick-service drive-in restaurants in the United States. It operated 3,593 Sonic Drive-Ins in 45 states as of August 31, 2017, of which 228 the company owns and operates and 3,365 franchisees own and operate.  Sonic Drive-In also owns and leases 135 properties and sublease 53 properties to franchisees and other parties. Troy Smith founded it as Top Hat Drive-In on June 18, 1953 that became Sonic in 1959, with its headquarters in Oklahoma City in Oklahoma."
SomaLife Consulting,https://www.crunchbase.com/organization/somalife-consulting,Personal Health,SomaLife Consulting produces various health and wellness products.,"SomaLife Consulting LLC produces various health and wellness products. Its products include gHP Sport, a combination of free-form crystalline amino acids taken orally, which allows the pituitary gland to produce agents that assist in cell regeneration and repair; and Youth Formula, a crystalline free-form amino acid stack to encourage the pituitary to release its growth hormone in quantities similar to that of people in their mid-twenties. The company’s products also include ProVit Xcell+, an antioxidant, multivitamin, and Omega-3 fish oil supplement for peak performance and protection; IQ150, a product that provides antioxidants and phytonutrients for brain health to offer memory, clarity, and retention; and SomaPet, an amino acid stack for pets over three years old to help slow, stop, and reverse the signs of aging."
SO1.ai - Segment of One,https://www.crunchbase.com/organization/so1-gmbh,"Artificial Intelligence, Grocery, Machine Learning, Personalization, Point of Sale, Retail, Retail Technology",SO1 brings artificial intelligence to grocery retail and allows retailers to create personalized offers to their customers.,"The founders of So1, Raimund Bau and Sebastian Gabel, established the company in 2012, after their work together as consultants supporting numerous consumer goods manufacturers with mathematical models in pricing and budget allocation projects. The So1 Team includes leading marketing scientists, IT experts as well as former executives from the consumer goods industry."
Solid Innovations,https://www.crunchbase.com/organization/solid-innovations,"Manufacturing, Medical, Medical Device","Solid Innovations is the creator of PerceptEngine, the Additive Industry's first truly proactive monitoring platform","Solid Innovations LLC is focused on building technology solutions that provide real time perception and reaction to the subtle changes that happen in the manufacturing environment. We are focused on building solutions that make real world outcomes consistently better. Our platforms are designed to provide accurate and timely data based corrections while informing critical elements of enterprise systems. Our premier product, PerceptEngine is the industry's first Proactive Monitoring and Management solution for Additive devices."
Somru Bioscience,https://www.crunchbase.com/organization/somru-bioscience,"Biopharma, Biotechnology, Health Diagnostics, Life Science, Therapeutics",Somru Bioscience is an emerging biotechnology company dedicated to developing breakthrough antibody technology for research.,"Somru Bioscience is an emerging biotechnology company dedicated to developing breakthrough antibody technology for research, diagnostic and therapeutic applications"
SociAbility,https://www.crunchbase.com/organization/sociability,Apps,SociAbility is Empowering social inclusion through better access information,
Social Me,https://www.crunchbase.com/organization/social-me-2,"E-Learning, Education, Marketing, Social Media","Social Me is the real time platform that allow to professionals find, schedule and pay easily for world class expert advice","Social Me is the real time platform that allow to professionals and entrepreneurs find, schedule and pay easily for world class expert advice to grow their businesses. We connect them, over the phone, for advice on their business challenges. Customers also can access to the range of courses that experts oered as part of the Social Me learning experience. Our Mission is to make Social Media and Digital Marketing advisors available every time and everywhere for entrepreneurs, professionals and business managers who want to empower themselves with the best digital skills to improve their competitiveness in the labor market. Problem 1- Time is a scarce commodity. We nd it hard to concentrate. We live stressed by the amount of information we have to process. 2- The speed of change threatens our competitiveness and requires us to inform and to form steadily. 3- New digital Professions arise every day for business innovation, creating a growing gap between what we know and what we need to know to remain competitive. 4- We do not know where to nd quality experts to help us understand the new paradigms of the digital economy. The University can not follow the speed with which the changes occur. Value proposition Social Me oer a monthly-based advisory services including access to the advisors network, online courses and workshops, real-time consultation, upgrade talks and tips, in a social an collaborative environment. Our business is based on providing people the opportunity to develop their digital inuence, and thus can competitively bind to the new digital economy way. Without this knowledge, the competitiveness of their companies is compromised allowing new competitors to gain market share in the new economy, digital, and with millions of new consumers who live hyper connected and expressing new commercial consumption habits. In a world where every time we have less time and less able to concentrate, we connects professionals and entrepreneurs with top advisors & industry experts through a marketplace of most Latin- Americans world class experts ever. Bussiness Model Social Me generates revenue by charging: Twenty percent in commissions of calls to experts. Fifty dollars in each training program that each expert oers to customers. (video training). 400 dollars for each each expert certication program oers to customers. (live classes that give in three months). Free access to webinars, tips and forums. Potential Market The online training market is projected at $ 2.2 billion for 2016 only in Latin America according to the report introduced by Docebo this year. Target Professionals between 35 and 45 years working in areas of communication, marketing, and sales that feel the need to reinvent itself and regain competitiveness they have lost in this new digital economy. They are seeking to become digital generalists and gain knowledge that allows them to think of new digital business strategies and be able to relate to the new young specialists. Millennians and empowered entrepreneurs who are naturally digital and looking to specialize in new platforms and communication technologies, social networks and digital marketing. Diferentiation Real time training platform that makes Social Media and Digital Marketing advisors available at any time, 24 hours a day. We oer our customers personalized service and mentoring to help to quickly learn to solve their problems and increase sales with new digital communication tools. Experience unique and emotional learning. Easy, fast, anytime, anywhere. Communities of practice and collaboration with professionals from over 15 countries. Achievements Billing UD $ 200,000 p/year in the first stage. Over 1500 professionals certified payments that means 22,000 solved courses. Over 50,000 users tested our courses as Free. More than 60,000 professionals talk with us on our social networks. The largest network of expert teachers on digital issues in Latin America. First Online training model based on collaborative and smart Learning Communities. Investments Incubator at the Catholic University of Chile: 120K StartUp Mexico: 60K"
Solle Naturals,https://www.crunchbase.com/organization/solle-naturals,"Dietary Supplements, Fitness, Health Care","Solle Naturals develops supplements for physical, intellectual and emotional issues that people commonly face in society.","We are committed to developing products that inclusively target the physical, intellectual and emotional issues that people commonly face in our society. In other words, our objective is to do more than just help people shore up their physical weaknesses; it is to help them thrive through a new generation of supplements -- products that dually strengthen the body and the mind."
Soil Culture Solutions,https://www.crunchbase.com/organization/soilcea,"Agriculture, AgTech, Farming",Soil Culture Solutions is a Agriculture Company.,
Sonic Boom Wellness,https://www.crunchbase.com/organization/sonic-boom-wellness,"Personal Health, Software, Wellness",Sonic Boom Wellness is a wellness-engagement company committed to improving members’ daily health habits.,"With the widest variety of energetic activities, Sonic Boom is the first and only wellness-engagement company committed to improving members’ daily health habits. Boasting the most high-tech (and proprietary!) activity-tracking software on the planet, our program is fun and socially contagious – driving massive, sustained participation among even the most hard-to-reach employee populations.  Disrupting the “traditional” concept of wellness since 2007, we’re the innovative market leader in challenge variety, customization, incentive-management flexibility, and Total Client Happiness™ – all in support of our mission to drive small yet meaningful health-habit improvements for life. Sonic Boom Wellness is one of the only pure-play health optimization companies out there. We aren't a health plan trying desperately to prove that we can do wellness, too.  We’re not a disease management company in disguise, nor are we a multi-billion dollar conglomerate from overseas trying to put our hands in the American pie. We are pure-bred lovers of health-habit improvement – it’s in our DNA. We won’t compromise, and we won’t ever pretend to be something we’re not."
Southtree,https://www.crunchbase.com/organization/southtree,"Digital Media, Photo Sharing, Photography",Preserve your recorded moments digitally,"Your favorite family moments are aging & nearly impossible to enjoy. At Southtree.com we take your home movies & photos & preserve them on DVDs, Thumb drives or editable digital files. We make protecting & enjoying memories easy. Southtree.com is a leader in helping families preserve and enjoy their favorite captured moments, digitally.  Southtree preserves old analog media, like videotapes, film and photos through their safe mail-in service."
Solo Capital,https://www.crunchbase.com/organization/solo-capital,Financial Services,Solo Capital is a boutique financial services house based in London authorised and regulated in the United Kingdom.,Solo Capital Partners LLP was founded on 13 Sep 2011 and has its registered office in London.  The company's first directors were Solo Capital Limited. 20-49 people are employed at this company. Solo Capital Partners LLP does not have any subsidiaries. Solo Capital Partners LLP is in the process of an orderly wind-down and will not be taking on new business. If you are an existing client and you have any questions please contact either of cs@solo.com or compliance@solo.com.
Solergy Italia,https://www.crunchbase.com/organization/solergy-italia,"Energy, Renewable Energy, Solar","Solergy develops, manufactures, and distributes efficient and reliable solar energy systems that generate the most energy at lowest cost.","Solergy develops, manufactures, and distributes highly efficient and reliable solar energy systems that generate the most energy at lowest cost.  It has developed the world’s first upgradeable, 40+ year lifetime High Concentrating Photovoltaic (HCPV) system that actually increases its power output over time rather than degrade. Solergy seeks to lead the next generation of solar energy deployment in sunny regions around the world with its breakthrough technology. In addition to being cost effective, Solergy CPV operates reliably in tough environmental conditions, minimizes ecological and visual impact, features an aesthetic Italian design, and provides a sustainable pathway to solar deployment at terawatts scale. Solergy, Inc., established in 2007, is a US incorporated company with an R&D subsidiary, Solergy Italia Srl, in Rome, Italy."
Socialease,https://www.crunchbase.com/organization/socialease,"Artificial Intelligence, Marketing, Social Network",Socialease is AI software that turns SMEs social & digital media communication challenge into a simple and efficient marketing opportunity.,Socialease is AI software that turns SMEs social & digital media communication challenge into a simple and efficient marketing opportunity. Socialease your personnal assistant to manage all your social networks.
SouthGobi Resources,https://www.crunchbase.com/organization/southgobi-resources-ltd,"Developer Platform, Manufacturing, Product Design","SouthGobi Resources Ltd. (""SouthGobi"") is an integrated coal mining, development and exploration company,","SouthGobi Resources Ltd. (""SouthGobi"") is an integrated coal mining, development and exploration company, with strategically located coal assets - closest coal to China - focused on exploration and development of its Permian-age metallurgical and thermal coal deposits in Mongolia's South Gobi Region to supply a wide range of coal products to markets in Asia. SouthGobi is listed on the Toronto and Hong Kong stock exchanges, in which Turquoise Hill Resources Ltd. (formerly Ivanhoe Mines Ltd.) (""Turquoise Hill""), also publicly listed in Toronto and New York, has a 56% shareholding. Turquoise Hill took management control of SouthGobi in September 2012 and made changes to the board and senior management. Rio Tinto has a majority shareholding in Turquoise Hill."
Solinftec,https://www.crunchbase.com/organization/solinftec,"Agriculture, Communication Hardware, Enterprise Software, Industrial Automation, Mobile, Mobile Apps, Software","Solinftec develops and produces equipment, technology and systems for the automation of mobile assets and logistics processes.","Solinftec develops and produces equipment, technology and systems for the automation of mobile assets and logistics processes. The company offers solutions for real-time monitoring, optimization and traceability of agricultural operations are present in the largest global players in food production and biofuels. They develops solutions for digital agriculture and is a leader in the development of solutions for the sugar, ethanol, grain and cotton markets."
Solace Technologies,https://www.crunchbase.com/organization/solace-technologies,"Computer, Information Technology, Mobile",Solace Technologies focuses on the development of nicotine based solutions for electronic vape devices,Solace Technologies focuses on the development of nicotine based solutions for electronic vape devices.
Soicos,https://www.crunchbase.com/organization/soicos,"Accounting, Advertising, Affiliate Marketing, Internet, Lead Generation",Soicos is a Spanish affiliate marketing and monetization platform.,"The first affiliate marketing network in Argentina. Opening offices in Chile, Brazil, Colombia and Mexico."
Sothic Bioscience Limited,https://www.crunchbase.com/organization/sothic-bioscience-limited,"Bioinformatics, Biotechnology, Medical",Sothic Bioscience is biotechnology startup producing biosynthetic LAL for the global pyrogen/endotoxin testing market.,"At Sothic Bioscience, they are replacing unsustainable animal sourcing of high value products with scalable production of identical high quality biomolecules. A highly specific pyrogen contamination testing reagent is currently in lab bench production phase. They are currently raising seed capital in order to scale up production and bring their product to market."
Southwest Gas,https://www.crunchbase.com/organization/southwest-gas,Oil and Gas,"Southwest Gas promotes a culture of giving, employee engagement and integrity on a daily basis.","Their communities, and the more than 1.9 million customers we serve, are the reasons why we've been heating things up for decades. So, whether you’re enjoying a backyard barbeque with friends, getting cozy indoors during the winter, or preparing an epicurean delight in your new restaurant, Southwest Gas is here to support your comfort  and your lifestyle."
SOLUtion Medical,https://www.crunchbase.com/organization/solution-medical,Medical Device,SOLUtion Medical is a developing an autoinjector device aimed at adrenal insufficiency patients.,SOLUtion Medical is a developing an autoinjector device aimed at adrenal insufficiency patients. SOLUtion Medical's twist-to-mix reconstituting syringe and autoinjector afford users efficient and reliable life-saving care and reclaimed confidence in times of adrenal crises through intuitive design.
Solvemate,https://www.crunchbase.com/organization/solvemate,"Artificial Intelligence, Customer Service, Messaging, Software",Solvemate is a SaaS platform for customer service automation.,"Solvemate is a SaaS platform for customer service automation. Solvemate's virtual agents instantly resolve the vast majority of requests by actively guiding the customer to the right answer. If a human agent is needed, the customer is efficiently routed to the right person.  Training a virtual agent is easy: through machine learning, the performance continuously improves, and further training is automatically suggested when needed. Going-live is quick and easy and can be done in just a few days. Solvemate integrates with existing service workflows to automate repetitive tasks. This enables 24/7 support, while getting better insights, and saving costs."
Social Network,https://www.crunchbase.com/organization/social-network,Social Network,"Social Network, a specialist platform servicing Korean trends.",
Solar Flow-Through,https://www.crunchbase.com/organization/solar-flow-through,"Energy, Energy Management, Solar","Solar Flow-Through develops and operates solar PV power generation projects in Ontario, Canada.","Solar Flow-Through, a Canadian-based partnership with offices in Vancouver and Toronto, was formed to develop and operate solar PV power generation projects in the Province of Ontario. Solar Flow-Through's investment objective is to provide investors with favourable income tax benefits during the development phases of solar PV projects, followed by steady and attractive income once commercial operations begin."
Sonus Networks,https://www.crunchbase.com/organization/sonus-networks,"Communications Infrastructure, Telecommunications, VoIP",Sonus Networks is a cloud-based communications distributor that offers mobile network operation and Microsoft solutions.,"Sonus delivers SIP based communications and SBC solutions to enterprises and service providers across the globe enabling Unified Communications in the Cloud. ""Name change to Ribbon Communications"". "
Solho,https://www.crunchbase.com/organization/solho,Renewable Energy,Solho develops an innovative and fully off-grid energy system called sprhout.,"Boosting the transitions towards sustainable food provision In 30 years from now, there will be 2 B more people living in the so-called sun belt region. Agriculture will have to double food production to sustain the global population, with fewer resources and lower environmental impact. No technology exists to achieve this target. They founded SOLHO to bridge this gap. They developed an innovative system called SPRHOUT (Solar-PoweRed Horticultural Off-grid UniT). The SPRHOUT uses Sun and available water sources (e.g., sea or sewage) to generate all the streams required to operate a greenhouse facility: electricity, heating/cooling, fresh water, and CO2."
SolarMarine Energy,https://www.crunchbase.com/organization/solarmarine-energy,"Energy, Solar","SolarMarine Energy is the first company to design, engineer and manufacture cost competitive floating solar energy products",
Social Beverage,https://www.crunchbase.com/organization/social-beverage,"Food and Beverage, Wine And Spirits","Social Beverage Company is a Raleigh, North Carolina-based company that specializes in alcoholic beverages.","Social Beverage Company is a Raleigh, North Carolina-based company that specializes in alcoholic beverages."
Soul id,https://www.crunchbase.com/organization/soul-id,"Apps, Sports",The athlete network - Soul id is the social network for action sports. The world of action sports live here!,"Soul id is the network dedicated to action and adventure sports. Unlike traditional social networks, Soul id is unique in that it hosts an individual community for every sport that the company supports. Every community provides the top news, photo and video content delivered from across the world of action sports. Soul id gives athletes the ability to share their lifestyle and talents with world through photo, video, stories, link, and statistic posting features. The system has an integrated “id filter”, delivering only the content for the sports that the user is apart of. This gives users the ability to interact with only the content and community that they love. Soul id is dedicated to providing tools to the sports industry creating a central hub for action and adventure sports. The world of action sports lives here."
SoshiGames,https://www.crunchbase.com/organization/soshigames,"Gaming, Mobile, Music, Online Games, Video Games",SoshiGames is a developer of social network games as platforms that deliver advanced player experience and sustained engagement with brands.,"SoshiGames build social network games as platforms which deliver deep player experiences and sustained engagement with brands. They strive to develop novel game concepts whilst applying disruptive approaches to user acquisition and revenue generation. They build unique value between players and brands that benefit all in a fun, engaging way. Play with a purpose."
