Organization Name,Organization Name URL,Categories,Description,Full Description
WISeCoin,https://www.crunchbase.com/organization/wisecoin,Information Technology,WISeCoin is a Trusted Distributed Ledger Technology of Identity to store objects and people's identity,"WISeCoin is a Trusted Distributed Ledger Technology of Identity to store objects and people's identity. It offers connected objects the ability to identify, authenticate and verify each other with a digital certificate. For each interaction, the Blockchain of Identity will verify the validity of each digital certificate to secure the interaction. To compensate the use of the platform, a micro service fee is charged through a utility token, called the WISeCoin token."
WILEX,https://www.crunchbase.com/organization/wilex,"Biopharma, Biotechnology, Health Diagnostics",WILEX is a biopharmaceutical company developing drugs and diagnostic agents to detect and treat malignant tumors and cancers.,"WILEX AG, a biopharmaceutical company, develops drugs and diagnostic agents to detect cancer, treat malignant tumours, and prevent metastases. Its product line includes RENCAREX, a phase III substance for the treatment of non-metastatic renal cell cancer; REDECTANE, a phase III substance for the treatment of renal mass; and MESUPRON, a phase II substance for the treatment of pancreatic and breast cancer. The company's products also comprise the MEK inhibitor WX-554, which is under Phase I clinical trial; and the other oncology projects, including PI3K inhibitor WX-037 and three antibody programmes under preclinical development. It has a strategic alliance with UCB Pharma S.A. to develop preclinical oncology portfolio. The company was founded in 1997 and is headquartered in Munich, Germany."
Winebuyers,https://www.crunchbase.com/organization/winebuyers,"Food and Beverage, Food Processing, Wine And Spirits",Winebuyers is an exclusive online wine club with a simple mission.,"Winebuyers is an exclusive online wine club with a simple mission: to bring wine into the 21st century. They do this by connecting wine suppliers directly to the wine consumer and they would like to invite you to join their club, on the house. As a member, you have access to some of the world’s finest and hard-to-find wines, from rare Bordeaux to Plavac Mali matured at the bottom of the Adriatic Sea, with a zero mark up and a commission-free price tag."
WISE Power,https://www.crunchbase.com/organization/wise-power,"Electrical Distribution, Electronics, Energy, Information Technology, Manufacturing",WISE is a lifestyle management system that allows users to store the energy to power their homes and businesses,
Winters Bros. Waste Systems,https://www.crunchbase.com/organization/winters-bros-waste-systems,"CleanTech, Recycling, Renewable Energy","Winters Bros Waste Systems facilitates collection of waste, recycle and transfer stations in Florida, Vermont, Long Island and Connecticut.","Founded in the 1950′s, Winters Bros. is a family owned and operated business, with a history of serving Florida, Vermont, Long Island and Connecticut market areas for their solid waste collection, recycling and transfer station needs. Through the years we’ve gained the knowledge and experience needed to provide dependable courteous service, in a regulatory compliant manner. Our management team has a combined 100+ years of experience in the waste and recycling industry."
Wity,https://www.crunchbase.com/organization/wity,"Accounting, Consumer, Legal",A platform geared toward entrepreneurs to help with public accounting .,"At wity, we believe in creatives, in those who imagine the world of tomorrow and innovate, in those who shake up the codes and question the status quo, those who take risks, those for whom the words ""freedom of undertake, """" effort ""and"" success ""are linked, We believe in all these entrepreneurs. wity accompanies your SUCCESS by simplifying entrepreneurship."
WinWinner,https://www.crunchbase.com/organization/winwinner,"Crowdfunding, Financial Services, FinTech, Internet",WinWinner IS a matchmaking platform .,"WinWinner, a matchmaking platform that brings entrepreneurs with growth ambitions into contact with potential investors."
Wishdates,https://www.crunchbase.com/organization/wishdates,"Communities, Location Based Services",Wishdates is a social discovery network that enables users to build new relationships based on their geolocation and interests.,"Wishdates is your personal dating organizer. At WishDates we let users to invite close friends, form a dating group and meet similar group of opposite sex: our algorithms helps select a mutually acceptable popular local venue we pull from geolocation APIs. When users are ready we automatically schedule time and place of future dates in the real life using Yelp and 4square APIs. We launched our service in July 2012, today it has grown to 1,500,000 monthly active users."
WiMi5,https://www.crunchbase.com/organization/wimi5,"Casual Games, Developer Tools, MMO Games, Mobile","WiMi5 is the WordPress of video games, a web tool to create, publish and monetize HTML5 games.","WiMi5 is the WordPress of video games, a web platform to create, publish and monetize games and interactive content for the web. Games are quickly developed using a visual scripting editor. All games are built using HTML5, CSS3 and Javascript and can be automatically published on several game portals as well as on native marketplaces, by means of hybrid apps. It is a great alternative to Flash taking into account that in January 2017 all web pages using Flash will be blocked."
Wizme,https://www.crunchbase.com/organization/wizme,"Business Travel, Enterprise Software, Procurement",Wizme makes meetings and events management magical through superior ease of use and smart technologies.,Wizme  makes meetings and events management magical through superior ease of use and smart technologies - increasing productivity and creating value by finally getting everyone on the same page.
willagirl,https://www.crunchbase.com/organization/willagirl,"Beauty, Direct Sales, E-Commerce, Health Care, Lifestyle, Retail","WillaGirl, Inc. develops natural skincare products for girls.","WillaGirl, Inc. develops natural skincare products for girls. It offers foaming face washes, clear moisturizers, SPF tinted protection solutions, face towlettes, acne spot treatment click pens, cucumber face masks, cucumber masks, and daily routine kits with pouches. It also offers natural body lotions as well as watermelon lip glosses, mint lip glosses, mandarin lip glosses, strawberry lip balms, vanilla lip balms, mango lip balms, and lip shimmers. The company offers its products online in the United States and internationally. WillaGirl, Inc. was co-founded by Christy Prunier and Willa Doss in 2008 and is based in Riverside, Connecticut."
Windrose Energy,https://www.crunchbase.com/organization/windrose-energy,"Electronics, Energy, Renewable Energy, Retail, Solar",Windrose Energy is a retail electricity provider.,
WiseStamp,https://www.crunchbase.com/organization/wisestamp,"Brand Marketing, Browser Extensions, Email, Messaging, Social Media Advertising, Web Browsers",WiseStamp is the marketing solution platform of choice to help Micro Businesses and self employed professionals grow their businesses.,"WiseStamp is the marketing solution platform of choice for Micro Businesses and self employed professionals. They help their clients grow their businesses using simple to use yet highly effective products.  WiseStamp’s popular signature solution helps over 700,000 businesses and professionals to promote their businesses daily, become more visible and demonstrate their professionalism. With dozens of thousands of paying users, WiseStamp is profitable and growing fast. WiseIntro, is a WebPage creator conceived and created from the feedback and interactions with their users. The solution enables professionals to establish their online presence and was built with self employed professionals in mind. While still in a 3 month beta, WiseIntro had over 1,000 paying customers and a double digit conversion and publish rate.  WiseStamp corporate is built for larger companies and allows central management of the company’s emails and the ability to push company’s content in employees’ signatures. A set of additional products aimed at micro-business is to be launched in the following quarters to further enhance users’ ability to rapidly grow their business.  WiseStamp is a Premier Google Partner, winner of Mashable’s Web Awards and was featured in all leading tech blog.  WiseStamp in numbers: » +700,000 active business users  » dozens of thousands of paying customers » + 1,000,000,000,000 emails sent using WiseStamp » + 40 Apps  » Users from 194 countries More: ☛ www.wisestamp.com/about"
Wizata,https://www.crunchbase.com/organization/wizata,"Energy, Health Care, Manufacturing",Wizata is make sense of your data and discover unique solutions and unexploited opportunities.,"Wizata is make sense of your data and discover unique solutions and unexploited opportunities. Wizata proposes vertical solutions answering to your specific sector challenges. As main domains of expertize, Wizata counts today the Manufacturing (Industry 4.0), Insurance, Energy, Healthcare sectors and e-commerce for predictive management and process optimization. By embedding themselves in your business and synergising with your teams, WIZATA’s data scientists uncover hidden gems within your data, whether internal or external to your organisation. Every profile is an exception, that’s why WIZATA offers an advanced collaboration model with people who are real experts in data science. Unique profiles for unique services."
Wizaplace,https://www.crunchbase.com/organization/wizaplace,"E-Commerce, Marketplace, Software",Wizaplace is an e-commerce start-up dedicated to the development of a complete marketplace creation and management solution.,"Created in 2012, Wizaplace is an e-commerce start-up dedicated to the development of a complete marketplace creation and management solution. The Wizaplace platform was launched in September 2015. In one single environment, it integrates some 70 modules enabling the creation of any type of marketplace: BtoC, BtoB, CtoC or service marketplace. On the 1st of January 2017, Wizaplace counted among it some 20 employees. It was created and is managed by Eric and Cécile Alessandri."
Wild Alaskan,https://www.crunchbase.com/organization/wild-alaskan,"E-Commerce, Food and Beverage, Internet",Wild Alaskan offers an online direct-to-consumer membership service .,
WINKO Games,https://www.crunchbase.com/organization/winko-games,"Gaming, iOS, Mobile, Mobile Apps, Online Games, PC Games",Our passion and our goal is to create top quality mobile games for core players,"At WINKO we love core games! We have brought together a bad@ss squad of artists, developers and game designer. This team of lifelong gamers have one unique goal: to create the BEST core games for your MOBILE devices."
WikQik,https://www.crunchbase.com/organization/wikqik,"Payments, Shopping Mall, Social Network",Advancing AI for Everyone,WikQik connects you with people and content around your passions and let you earn. Get in-the-moment updates on the things that interest you.
WISER Systems,https://www.crunchbase.com/organization/wiser-systems,"Asset Management, Location Based Services, Wireless","WISER Systems provides real-time asset tracking in any environment, instantaneously finding and reporting the locations of key materials.","Revolutionary WISER Systems Redundant Radio Localization & Tracking (RRLT™) technology provides inexpensive, accurate, and reliable real-time location of material or people within a defined space – indoors or outdoors."
Winerist,https://www.crunchbase.com/organization/winerist,"Internet, Travel, Wine And Spirits","Winerist an award winning travel website with the world's largest online wine, food & travel community.","Winerist an award winning travel website with the world's largest online wine, food & travel community. With Winerist you can find & book over 1,000 authentic experiences, wine tours, cooking classes, winery visits and boutique hotels in over 85 destinations. Winerist is the TripAdvisor / Booking.com of the wine & food travel sector.  We have been selected as one of the few startups to be part of Wayra, Telefonica / O2's accelerator. We work with many strategic partners such as Vivino, Laithwaite's, BBR, 28-50, The Perfect Cellar and Vivat Bacchus. Our blogger network includes over 500 prominent names. Winerist is also a B2B technological solution for wineries, hotel and tour guides offering them digital marketing solutions to increase their online exposure an accept online bookings."
wikicious,https://www.crunchbase.com/organization/wikicious,"Advertising, E-Commerce, Financial Services, Information Technology, Internet, Software",we're trying to connect every business and people around the planet,"wikicious - we're trying to connect every business and people around the planet. for people fun & creative way to take pictures and share photos, videos & stay connected with friends & family. For business can explore and grow their business with billions of peoples on our network, manage orders, bookings, shipping, and payments anywhere you go. We work in small teams and move fast to develop new products, constantly iterating. Together, we can help people build stronger communities — we're just getting started."
Wizdee,https://www.crunchbase.com/organization/wizdee,"Analytics, Artificial Intelligence, Big Data, Business Intelligence, Information Technology, Software",Natural Language Self-Service Data Search and Discovery,"Wizdee is a leading company in natural language processing, machine learning and semantic search. Our mission is to empower everyone with easy access to data.  We developed a technology that allows users to freely explore data by themselves just by dictating or typing queries in a search box using everyday language. Our search engine interprets queries, analyses information from data assets and returns answers in seconds. Users can easily access information anytime, anywhere and from any device, increasing companies speed and productivity."
Wink Health,https://www.crunchbase.com/organization/wink-health,"Fitness, Health Care, Wellness","Wink Health app analyzes snoring and highlights events such as peaks in loudness, pauses, chokes, and gasps.","Sleep is one third of our lives. If it is not working well the other two thirds are likely to suffer. Around 50% of adults have a sleep disorder, and these disorders are extremely underdiagnosed and undertreated. This is where Wink comes in. Founded in 2014 in San Francisco, they are a team of technologists, and clinicians translating clinical research and expertise into simple, effective web and mobile services. They envision a future where anyone can have instant and affordable access to world-class sleep medicine."
Winloot.com,https://www.crunchbase.com/organization/winloot-com,"Gaming, Internet, Playstation","Sweepstakes site with prizes ranging from $10 to $1,000,000. $100 winner every day.","WinLoot is a lotto style sweepstakes that provides members with the opportunity to enter to win giveaways ranging from $100 to $1,000,000 every day. WinLoot offers one guaranteed cash prize every day."
Wildlife Partners LLC,https://www.crunchbase.com/organization/wildlife-partners-llc,Agriculture,Wildlife Partners engages in the preservation and protection of wild life animals.,"Wildlife Partners is the lead in Wildlife Ranching in Texas. The company offers investment services, ranch consultation and revenuce creation through nontraditional ranching. Through is transportation division, the company provides transportation services to zoos throughout America. Wildlife Parnters is also a majority owner of Microtraks, a technology company pioneering ADT (animal disese traceabiltiy) technologies for the domestic livestock industry."
WinApp Inc,https://www.crunchbase.com/organization/winapp-inc,"Mobile, Payments, Social Media","Chat like never before, instant messaging, payment solution, cross platform and free.",
Witty Health Inc,https://www.crunchbase.com/organization/witty-health-inc,"Biotechnology, Cryptocurrency, Health Care",Witty Health is a digital health -blockchain technology company focused on the Oncology market. ,Witty Health is a blockchain based digital health company focused on the Oncology market. The company is developing two products; Smart Cancer Treatment Platform (SmartCTP) to address the prescription pharmaceutical and payer markets and OncoPower- a blockchain based ecosystem for the global oncology community.
Wilder & Harrier,https://www.crunchbase.com/organization/hexa-foods,"Animal Feed, Food Processing, Pet","Wilder & Harrier provides Healthy, tasty and sustainable foods made with insects.","Healthy, tasty and sustainable foods made with insects. Our first product is BugBites, dog treats made with cricket flour, fresh bananas and peanuts."
Wireless Glue Networks,https://www.crunchbase.com/organization/wireless-glue-networks,"Internet of Things, Software",A Rosetta Stone for the Internet-of-Things,Wireless Glue is a United States-based company with offices in Japan that delivers software and hardware solutions that capture and deliver energy data in real-time for the Commercial and Industrial market.
Wittlebee,https://www.crunchbase.com/organization/wittlebee,"E-Commerce, Fashion, Parenting","Wittlebee is a kids' clothing company offering custom packages based on a child’s age, color preferences, and geographic location.","Wittlebee is the kids clothing club. We aim to keep parents well stocked with amazing kids clothes. We create custom packages for our members based on their child's age, color preferences, geographic location and more."
Wiserstate (Motivio),https://www.crunchbase.com/organization/motivio,"Human Resources, SaaS","Automated business coaching platform. Like Peloton, but for business coaching.","Coaching helps to solve challenges and to grow. But junior managers usually don't get access to coaching as costs are high (from $150/h).  However, they need it the most. Wiserstate is an automated coaching platform for junior managers in video form. It's like Peloton, but for business coaching. And it's affordable.  It works similar to the movies where the scenario changes based on your choices: - Certified business coaches have recorded and configured video coaching scenarios; - Users watch coach's video and reply to the questions; - Based on the replies, the coaching session content and further questions change."
Wisran,https://www.crunchbase.com/organization/wisran,"Analytics, Artificial Intelligence, Electronics, Energy Management, Enterprise Software, Information Technology, Water",Wisran measures water for you to manage !,"Wisran provides smart data and process management technology to measure and manage water in real-time. They collect data in real-time from equipment such as pumps to our cloud-enabled software (SaaS) to generate operations and business intelligence for smart cities, equipment manufacturers, utilities and regulators for improving efficiency, generating new revenue opportunities and reducing costs."
WisR,https://www.crunchbase.com/organization/wisr-be70,Human Resources,WisR is an Online Job Matching Platform .,"The company would like to have found a solution to the global labor shortage due to the aging population. In addition, lack of know-how and the desire for flexibility of the boys are current reasons why it will be increasingly important to integrate older people in the world of work, so Klaudia Bachinger, CEO of WisR."
WiBASE,https://www.crunchbase.com/organization/wibase,Information Technology,WiBASE is a piloting solution explorer in IIoT application headquartered in Taiwan.,"WiBASE is a pioneering provider of IIoT with artificial intelligence, we’ve delivered many successful projects to major IIoT adopters of competitive and demanding fields such as retail, law enforcement and logistics industry."
"WinSanTor, Inc.",https://www.crunchbase.com/organization/winsantor-inc,Biotechnology,WinSanTor Inc. is a clinical-stage biotechnology company focused on the discovery and development of treatments for peripheral neuropathies.,WinSanTor Inc. is a clinical-stage biotechnology company focused on the discovery and development of treatments for peripheral neuropathies.
wineOwine,https://www.crunchbase.com/organization/wineowine,"E-Commerce, Small and Medium Businesses, Wine And Spirits","wineOwine is an online, private wine club that provides its members with a wide collection of wines from small Italian wineries.","wineOwine is an online, private wine club that provides its members with a wide collection of wines from small Italian wineries. It was launched on December 13, 2013, and is based in Rome, Italy."
Wild Beer Co.,https://www.crunchbase.com/organization/wild-beer-co,"Craft Beer, Food and Beverage","The Wild Beer Co was born out of a love of fermentation, barrel-ageing and most importantly, flavour.","An exciting brewery specialising in beers with unusual yeast strains, different ingredients and barrel ageing to produce beers with a refined complexity and intrigue. A wide range of tantalising sour beers, barrel-aged beasts and weird and wonderful flavours."
Wizards of the Coast,https://www.crunchbase.com/organization/wizards-of-the-coast,"Digital Entertainment, Gaming, TV",Wizards of the Coast develops and publishes game-based and other entertainment products.,"Wizards of the Coast develops and publishes game-based and other entertainment products. The company offers miniature, trading card, and tabletop role-playing games. It also provides fantasy series fiction books, novels, animated TV series, movies, video games, board games, and apparel. Wizards of the Coast was founded in 1990 and is headquartered in Renton, Washington. As of September 30, 1999, Wizards of the Coast operates as a subsidiary of [Hasbro, Inc](http://www.crunchbase.com/organization/hasbro-inc)."
Wikimedia Endowment,https://www.crunchbase.com/organization/wikimedia-endowment,"Association, Financial Services, Non Profit",Wikimedia Endowment is a fund supporting Wikipedia.,
Wittybee Technologies,https://www.crunchbase.com/organization/wittybee-technologies,"Education, Information Technology",Cloud based collaboration and storage app,"SaaS based software startup called Wittybee Technologies Ltd., which has developed a ground-breaking product “Wittybee”. Wittybee is a fast, powerful, easy-to-use, cloud based collaboration and storage app that is intuitively designed to help people connect and collaborate in teams while improving transparency, efficiency, productivity and quality of work in a morale boosting social environment."
WikiBrains,https://www.crunchbase.com/organization/wikibrainstorm,"Data Visualization, Digital Media, Social",WikiBrains turns information into beautiful visuals.,"Founded in 2011, WikiBrains is a promising start-up company utilizing smart data structure to provide a growing database of semantically linked information and knowledge. Their mission is to transform the way students collect, organize and explore what they are curious about. You may call it 'Engineered serendipity': Quality Content With Quality Context."
Wispero,https://www.crunchbase.com/organization/wispero,"Big Data, Cyber Security, Information Technology, Security",Wispero is transforming wireless IoT safety for enterprises.,"Wispero is transforming wireless IoT safety for enterprises.  Through the innovative SaaS based security analytic platform, Wispero helps automate vulnerability tracking and threat inspection in unlicensed enterprise wireless networks like Bluetooth, ZigBee, and LORA. "
WineNice,https://www.crunchbase.com/organization/winenice,"E-Commerce, Retail, Shopping",WineNice is an e-commerce website offering imported wines.,WineNice (酒美网) is an e-commerce website offering imported wines. It initiates direct purchase platform mode of imported wines. Winenice adopts an innovated direct-selling model aiming to combine the healthy lifestyle and heritage of wine culture. Its portfolio includes various brands of wine products.
Wikiwand,https://www.crunchbase.com/organization/wikiwand,"Education, Internet, Mobile",The world's leading Wikipedia reader for web and mobile,"In the past decade, web and mobile applications have made huge leaps forward in terms of functionality and user experience - they want to bring those same benefits to your Wikipedia experience.  Wikiwand is a modern reader for web and mobile, that optimizes Wikipedia's amazing content for a significantly improved reading experience."
Wirewatt,https://www.crunchbase.com/organization/wirewatt,"Energy, Environmental Consulting, Renewable Energy, Solar",Solar lending platform for emerging markets.,"Wirewatt provides solar leases to residential customers with capital from institutional funds. Wirewatt is a fast growing startup in Mexico where sun is abundant, installation costs low and energy prices are high. Also, through Wirewatt's software platform, local installers can design, verify and sell more solar systems."
Wikipad,https://www.crunchbase.com/organization/wikipad,"Consumer Electronics, Gaming, Video Games",The Wikipad is an Android-powered gaming tablet. The device has all the features of a high quality tablet and is tough enough to take all,Wikipad has developed devices for high-level mobile gaming. www.wikipad.com - The Tablet Made for Games. With its interchangeable games controller the Wikipad makes for a great mobile gaming experience while also having all the powerful features of a leading tablet. www.gamevice.com - Wikipad's Gamevice turns the iPhone and iPad into powerful gaming machines is available in the Apple Store.
