Organization Name,Organization Name URL,Categories,Description,Full Description
SocialGO,https://www.crunchbase.com/organization/socialgo,"Internet, Social Media",SocialGO is a developer and provider of software and services for the online social media market.,"SocialGO is a UK-based provider of online community and social networking software.  It allows both existing communities and aspiring social network creators to create a flexible, customizable social networking website.  SocialGO offers two products: - SocialGO for communities, focusing on providing existing communities with a flexible tool to create an integrated web presence (www.socialgo.com). With powerful website building tools and a core host of community features (membership, private messaging, events), it is the best choice for existing communities who need a beautiful, scalable online home. - SocialGO Network Maker, focusing on providing software to allow anyone to create a social network for a niche interest, customers, staff etc. With classic social networking features (friending, poking, customizable profiles), this is the best choice for aspiring social network creators and businesses seeking to engage with their employees or customers.  Both products are browser-based and hosted in dedicated servers. This means that as long as you've got a browser and an internet connection, you can get started straight away - without having to download or install any software."
SourcingBot,https://www.crunchbase.com/organization/sourcingbot,"Database, Electronics, Manufacturing, Risk Management",SourcingBot strives to be the leading platform for sourcing engineers to meet up.,"SourcingBot wants to be a data provider in the manufacturing industry to support the undergoing digital transformation of Industrie 4.0. Our vision is to bridge the isolated islands of data today and make this market a perfect one, similar to a stock market."
Sorsdata,https://www.crunchbase.com/organization/sorsdata,"Advertising, Analytics, Consumer, Marketing, Media and Entertainment",Sorsdata offers consumer marketing and analytics. ,"Sorsdata OOO offers consumer marketing and analytics. It combines proprietary data with analytics capabilities to work with Russian merchants to improve their customer communication, loyalty, and store performance. "
Solu,https://www.crunchbase.com/organization/solu,"Cloud Computing, Electronics",Solu is aiming to change a complete industry with a unique approach and unique technology.,"Solu is aiming to change a complete industry with a unique approach and unique technology. The founders, advisors and shareholders are some of the most well known and respected figures in the industry, having built some of the most successful companies in Finland."
Social360 Ltd,https://www.crunchbase.com/organization/social360-ltd,"Internet, Market Research, Social Media",Social360 Ltd operates a social media monitoring and analysis platform for corporate communications and public affairs.,Social360 Ltd operates a social media monitoring and analysis platform for corporate communications and public affairs.
SOMOS,https://www.crunchbase.com/organization/somos,"EdTech, Education, Marketplace","Marketplace for offline, one-hour group learning sessions.","SOMOS is a marketplace that helps people search, find, and enroll in all sorts of offline, one-hour group learning sessions on a wide range of topics. Whether you're looking to expand your career with new skills, pick up a new hobby, or simply learn something new, SOMOS makes sure you never miss out on an opportunity to learn from a local expert near you."
Sochat,https://www.crunchbase.com/organization/sochat,"Apps, Messaging, Software",Sochat is a new messaging app and connection platform,"Sochat is an iOS and Android mobile messaging application and connection platform. It allows its users to publish groups nearby with a PIN to quickly gather up and share GIFs, photos, videos, disappearing messages, and drawings among its users. It also allows sending songs and YouTube videos, play rock paper scissors game, and poll friends and groups. Sochat is a U.S.-based company that was founded in 2014 by Lukens Orthwein."
Socialpay,https://www.crunchbase.com/organization/socialpay,"Blockchain, Marketplace, Payments, Web Design",Socialpay is a pioneer startup .,"Socialpay is a pioneer startup in the design of a payment solution using the escrow system , which has clients such as Vibbo (Grupo Schibsted), Truecalia, Capital Cell, Orain, and more than 30 online intermediaries. It is a tool that adapts to any type of business: on demand, crowdfunding, crowdlending, travel and events, purchases in marketplaces ... It is also adapted to the new European regulation on payments, PSD2 and is postulated as one of the few experts in Spain in Blockchain engineering , developing several DApps such as Watafan or Visualeo."
Softspace,https://www.crunchbase.com/organization/softspace,"Collaboration, Productivity Tools, Software, Virtual Reality",Softspace is a spatial thinking and collaboration tool for creative people.,Softspace is a spatial thinking and collaboration tool for creative people.
Southern Illinois University Edwardsville School of Nursing,https://www.crunchbase.com/organization/southern-illinois-university-edwardsville-school-of-nursing,Education,Southern Illinois University Edwardsville School of Nursing is an academic unit of Southern Illinois University Edwardsville.,"The SIUE School of Nursing is an academic unit of Southern Illinois University Edwardsville (SIUE) located in Edwardsville, Illinois, United States.[1] The school has nearly nine hundred (900) students enrolled in its undergraduate, graduate and postgraduate programs.[2]"
SourceNinja,https://www.crunchbase.com/organization/source-ninja,"Open Source, Security, Software","SourceNinja notifies license changes, security vulnerabilities, and performance problems to software developers.","SourceNinja prevents problems in applications that use open source.  SourceNinja notifies developers when updates are released or problems occur. Issues we prevent include license changes, security vulnerabilities, and performance problems. SourceNinja offers a product for individual developers and large enterprises. SourceNinja was part of **[AngelPad](http://angelpad.org) #3** in 2011."
Soar,https://www.crunchbase.com/organization/cu-soar,"Financial Services, FinTech",Soar is a Glasgow-based fintech focused on building a better financial society.,"Soar, which is developing a cloud-based banking platform to be used by credit unions and other not-for-profit banking organisations"
Sorted,https://www.crunchbase.com/organization/sorted,"E-Commerce, Marketplace, Mobile","Sorted is a community marketplace in the UK helping users find and book local help, such as cleaners, handymen, delivery drivers, and more.","Sorted is a community marketplace that helps you book local people to help with tasks. Sorted has a database of more than 12,000 Sorters across the UK who can be booked safely and securely whenever you need them. If you want to earn extra money you can also sign up to become a Sorter yourself. The app builds on the success of websites such as Gumtree, allowing users a faster, more localised service. The team is made up of James and Jade, who saw a niche in the UK market after researching how students with no expertise could make money. Sorted are also winners of Tech Entrepreneurs’ Week 2012 and have been featured in TechCrunch."
SourceThought,https://www.crunchbase.com/organization/sourcethought,"Automotive, Big Data, Computer, Software",Provides Big Data ETL and data processing solutions that run natively on Hadoop.,"SourceThought provides Big Data ETL and data processing solutions that run natively on Hadoop. We help enterprises source inspiration from their information by consuming large amounts of data in any form and processing it on commodity hardware for an incredibly low cost. Hadoop is a scalable open source platform used by Yahoo, Facebook and Twitter and is emerging as the platform of choice for Big Data. But Hadoop is just the starting point. Data must be discovered, extracted, profiled, cleansed, integrated, enhanced, managed and tracked. That is ETL/ELT/ELTL on Hadoop, and that is where SourceThought comes in. SourceThought’s team of ETL and data warehouse experts use SourceThought tools and Hadoop to deliver turn-key ETL solutions to the enterprise. Current ETL (Extract Transform Load) tools are not architected for Hadoop so projects require expensive custom coding. SourceThought provides an intuitive browser based visual workspace that has full access to Hadoop capabilities supporting parallel processing of unstructured data. Transitioning from current ETL and EDW environments to SourceThought creates substantial ROI by avoiding licensing and maintenance costs and lowering hardware costs. As enterprises strive to utilize their web logs, Twitter, Facebook, mobile, messaging, sensor and other data, SourceThought easily and economically onboards these new big data sources. SourceThought is backed by Frost Venture Partners, an incubator and investment fund focused on big data innovation."
SOS Online Backup,https://www.crunchbase.com/organization/sos-online-backup-2,"Cloud Data Services, Information Technology",SOS Online Backup provides online backup solutions for homes and businesses.,"SOS Online Backup provides online backup solutions. It offers data protection systems; online data backup solutions; and software solutions with various backup features, including remote data access, unlimited versioning and data archiving, and data recovery as well as protects personal and business data. The company also provides SOS ServerSave, a cloud-based data protection system that combines backup for BareMetal, Exchange, SQL servers, SharePoint servers, and granular recovery; and SOS Collaborate Private Cloud for enterprise-wide document syncing and collaboration for data-centric businesses. In addition, it offers iOS-, Android-, and Facebook-based backup applications. The company sells its products through resellers to consumers, small- and medium-sized businesses, VARs, resellers and MSPs, enterprises, and IT or managed service providers worldwide. SOS Online Backup was formerly known as SOS Technologies, Inc. It was founded in 2001 and is headquartered in El Segundo, California with additional offices in South Yarra, Australia; Chennai, India; and Kiev, Ukraine."
Social Media Broadcasts (SMB) Limited,https://www.crunchbase.com/organization/social-media-broadcasts-smb-limited,"Analytics, Big Data, Business Intelligence, SaaS, Social Media Management",Social Big Data Analytics SaaS Solutions,"Social Media Broadcasts (SMB) Limited (""SMB"") is a Hong Kong-based big data analytics company focused on developing innovative and sophisticated software-as-a-service (""SaaS"") technologies to transform social big data into reliable and actionable intelligence for marketers and professionals. Big data analytics enables organisations to analyse a mix of structured, semi-structured and unstructured data to provide valuable business information and insights. SMB's unique positioning is a combination of 1) extensive experience with online and mobile social architectures and technologies, 2) deep understanding of Asian and Western social behaviours and 3) innovative integration of analytical methodologies. The company's leading solution is Klarity - a cloud-based, online dashboard-styled tool that provides social monitoring and listening analytics for enterprises, advertising agencies and governments to measure performance, benchmark against competition, identify trends and gain insights into behaviour. Klarity enables marketers, professionals and analysts to leverage social big data in an efficient and effective manner.  The proprietary engine crawls social platforms, mobile channels and influencer networks to track, collect, store and manage granular data.  Sophisticated algorithms then segments, refines and interprets the information in a quantitative and qualitative manner to automatically present metrics and analyses through a user-friendly dashboard.   SMB successfully launched the first generation of Klarity in mid-2013, which quickly gained positive feedback from both enterprises and advertising agencies.  Since then, it has evolved from simply monitoring analytics from social profiles to a complex monitoring and listening tool, drawing on big data from social platforms (from Facebook to Sina Weibo), mobile channels (such as LINE and WeChat) and influencer networks (such as news sites, forums and blogs).  Today, Klarity v2.4 has gained recognition and validation from major global brands and multinational clients. Beyond Klarity 2.4, SMB's corporate objective is to broaden Klarity's analytical capabilities to provide an even more advanced and holistic SaaS solution for a wider spectrum of verticals to significantly improve insights - applicable not only towards marketing strategies but also financial analysis, healthcare monitoring, crisis management and predictive forecasting. SMB has a core staff of 12 full-time employees comprising of management, technical and marketing professionals.  The team is complimented by notable strategic partners such as Hootsuite, Softbank C&S and HP Hong Kong.  Management is further supported by seasoned consultants and advisors with financial, technical and marketing expertise."
Sounday,https://www.crunchbase.com/organization/sounday,"Digital Media, Music",Sounday Music is a web and mobile platform offering advanced solutions such as distribution and promotion for the music industry.,"SOUNDAY DIGITAL MUSIC ECOSYSTEM Sounday is a Digital Music Ecosystem. We are a web-mobile platform offering advanced solutions and services to people active in the music world. Our platform is easily accessible and usable, all within a single online destination. STORY Established in 2008 by Founder and CEO Giuseppe Ravello, Sounday Music’s platform is unique worldwide, boasting over 30.000 registered users. The portal enables artists, record labels and other music professionals to manage their own music projects, buy and sell goods and services and create and share contents. Sounday Music has offices in Cagliari, Turin, Milan and Rome, with a team of 22 people. A step forward In September 2013, Sounday acquired Kiver Digital S.r.L. becoming the 100% sole shareholder. The acquisition has pooled together the experience, skills and services provided by both companies, positioning the two partners as a single, integrated business able to meet the needs and requests of the entire chain of players working in the music industry today. A step forward 2 In July 2015, Sounday acquired SOUNDTRACKER’s Brand & Technology. This operation expands the Sounday ecosystem, bolstering the start-up’s role on the international market through the integration of technological assets that enable all those who operate in the sector to analyze music consumption. In particular the acquisition of Soundtracker will enable Sounday to have a proprietary mobile technology that will form part of its current development strategy for services for latest-generation devices, expanding already existing solutions like Spotlight and Time Radio and supporting the birth of new mobile products with the aim of contributing to the success of emerging labels and artists. In addition, geolocation and proximity marketing, which represent the heart of Soundtracker, will introduce a new business line, leading Sounday to play an important role in the world of big data and of IoT, that is, that form of widespread Internet (Internet of Things), that represents the near future of operators in the music sector who want to continue to be competitive and effective on the market. Being present in these new areas allows Sounday to offer value added to customers – brands, labels and artists – by leveraging tools for the analysis of music consumption, on innovative music solutions applied to sectors like automotive, telecommunications and entertainment and new methods of monetization in order to ensure important experiences to music lovers all over the world while still safeguarding their digital identity. NUMBERS: + 30.000 REGISTERED USERS + 150 PARTNERING LABELS + 500.000 SONGS LISTED IN CATALOG + 50 TOP ARTIST YOUTUBE CHANNELS MANAGED"
Soundways,https://www.crunchbase.com/organization/soundways,"Audio, Manufacturing, Music",Innovative Software Solutions for Sound Engineers and Audio Device Manufacturers,"Soundways is a sound technology company. The company is engaged in the production and supply of software-based mastering tools for use by sound engineers. Soundways was founded in 2016 and is headquartered in Memphis, Tennessee."
Solis Tek,https://www.crunchbase.com/organization/solis-tek,"Hydroponics, Lighting","Hydroponics, Lighting, gardening",Solis Tek is the leading provider in the hydroponic industry for digital lighting. All gardens need light and Solis Tek is one company that keeps setting new standards for product quality and customer convenience. The Solis Tek product line features digital ballast with innovative features and lamps exclusively developed by a highly accredited NASA advisor along with reflectors and other accessories to complete every garden's ideal lighting system. Solis Tek has also recently formed a strategic partnership with a local china factory to obtain the lowest costs out of any current competitor for digital ballasts. Solis Tek is striving to take over majority market share for the hydroponics industry while begin to penetrate more into the commercial market as well as the European hydroponics market.
SourceMaven,https://www.crunchbase.com/organization/sourcemaven,"Computer, Information Technology, Software",Serving the Talent Acquisition industry with tools to increase the efficiency and quality of hiring.,"At SourceMaven, we believe that everyone thrives when working together. It is upon that foundation that we are motivated to serve the recruiting industry. By transforming the way we interact, we can greatly increase the efficiency of the system as a whole."
Sonetel,https://www.crunchbase.com/organization/sonetel,"Information Technology, Internet, SaaS",Sonetel provides a software-As-A-service for business communication to small businesses worldwide.,Sonetel provides a Software-As-A-Service for business communication to small businesses worldwide. It believes that globalizations and entrepreneurship are the key drivers for making this planet a better place. During the past 20 years these drivers have actually removed half of the world’s extreme poverty. Sonetel's Research & Development team in India develops and manages the Sonetel Phone System which is installed in high security data centers in California and Amsterdam. Sonetel's customer support team is located in India.
sotoasobi,https://www.crunchbase.com/organization/sotoasobi,"Leisure, Tourism, Travel",sotoasobi is an online platform that enables children and their families to book leisure activities.,"Yamamoto, such that was the experience that harbor the feelings, his is the first time overseas, Grand Teton National Park in Jackson Hole that even in some American Wyoming for the first time visited location.The location that you stay in the senior of the wedding, such as wolves and American bison (Buffalo) is inhabited, it was the land that nature is now still remains.So Yamamoto goose bumps the whole body has to remember the feeling like standing is, together and apart from the members who had come from Japan, or spend time in one nature, return to experience a variety of outdoor local. And, ""the moment when the mind is impressed"" obtained in this earth, will lead to that produce the ""play outside"" after."
Source Energy Services,https://www.crunchbase.com/organization/source-energy-services,"Energy, Logistics, Oil and Gas",Source Energy Services is an integrated supplier and distributor of high quality proppants in Western Canada and the United States,Source Energy Services is an employer of choice with over a decade of proppant supply and oilfield logistics experience.
SocialSci,https://www.crunchbase.com/organization/socialsci,"Finance, Internet, Market Research, Robotics, Software",SocialSci connects academic researchers with the online community to help them collect data for surveys and experiments.,"SocialSci is an online survey platform designed to meet all the requirements of scientific researchers. SocialSci lets researchers design surveys using a simple drag-and-drop interface, and comes with a built-in recruiting system that uses a point system to reward users for participating while screening out repeat visitors."
Sokolin,https://www.crunchbase.com/organization/sokolin,"Delivery, Hospitality, Wine And Spirits",Sokolin was founded in 1934 by David Sokolin upon receiving one of the first liquor licenses issued by New York State after the repeal of,"Sokolin was founded in 1934 by David Sokolin upon receiving one of the first liquor licenses issued by New York State after the repeal of Prohibition. Today, Sokolin is run by Dave Sokolin, grandson of David, and is an internationally renowned luxury retailer specializing in fine wine from long-established wine-producing regions as well as emerging viticultural areas."
Socialtyze,https://www.crunchbase.com/organization/socialtyze,"Advertising, Analytics, Apps, Mobile, SaaS, Social Media, Social Media Marketing",Socialtyze is a marketing and technology company connecting brands with their customers within social media.,"Socialtyze is a leading marketing and technology company that connects brands with their customers within Social Media.  Its proprietary Social SaaS platform, Qu, provides deep insight into fan demographics, psychographics and behavioral patterns and provides an actionable social publishing and recommendation engine and toolset. The company’s connection to the Facebook API allows it to pull data from client’s fan pages to assess the quality levels of individual fans with the purpose of determining the make-up and core drivers of a brand’s biggest evangelists. Qu is a unique technology platform that is perfectly timed to help brands to adjust to Facebook’s recent changes to its algorithm, which rewards relevant messages and penalizes less targeted and thoughtful communication.   Qu aggregates and interprets data not only to identify “Super Fans”, but also to segment them by gender, age, geography, likes, interests, actions, check-ins, and numerous other categories.  Armed with a deep understanding of fan bases, Socialtyze is in a unique and enviable position to execute specific social media marketing campaigns that build awareness, increase loyalty, and drive purchase decisions."
Solar Roadways,https://www.crunchbase.com/organization/solar-roadways,"Infrastructure, Power Grid",The Solar Roadway is a series of structurally engineered solar panels that are driven upon.,"The Solar Roadway is a series of structurally engineered solar panels that are driven upon. These Solar Road Panels replace petroleum-based asphalt surfaces: roads, parking lots, and driveways.  The Solar Roadway becomes an intelligent highway infrastructure that pays for itself through the generation of electricity and by doubling as the nation's power grid: an intelligent, self-healing, decentralized power grid."
Society of Cable Telecommunications Engineers (SCTE),https://www.crunchbase.com/organization/society-of-cable-telecommunications-engineers-scte,"Hardware, Software",SCTE is a technical and applied science provider for the cable telecommunications industry.,"SCTE is proud to serve as the technical and applied science leader for the cable telecommunications industry. Focused on providing technical solutions, SCTE has programs and benefits for every level professional in the industry. The Society’s ""Boots to Suits"" philosophy is designed to not only enhance the careers of technical employees throughout the network, but also provide operators with a well-trained workforce that, ultimately, means a more efficient system, economic benefits and improved customer experience"
SOMMA Food,https://www.crunchbase.com/organization/somma-food,"Consumer Goods, E-Commerce, Food and Beverage, Food Processing, Restaurants",Better food for all.,"At SOMMA Foods, they believe in better food for all. And that natural tastes better. They've watched consumer trends carefully, paying attention to customer feedback and requests for innovation. They've learned that now more than ever, the people we serve desire high quality, clean label products without having to compromise on taste. That’s why all SOMMA products are made with real ingredients and are designed to make breakfast, lunch, and dinner delicious, convenient, and wholesome."
Solar Site Design,https://www.crunchbase.com/organization/solar-site-design,"Blockchain, Clean Energy, Digital Media, Energy, Energy Storage, Enterprise Software, Renewable Energy, Solar",Its mission is to offer the Solar Site Design information technology platform to solar professionals worldwide.,"Solar Site Design is a collaborative, cloud-based content management platform that offers a complete project development solution for solar professionals. Its mission is to offer the Solar Site Design information technology platform to solar professionals worldwide."
