Organization Name,Organization Name URL,Categories,Description,Full Description
Gebeya Inc.,https://www.crunchbase.com/organization/gebeya-inc,"EdTech, Information Technology, Marketplace, Software Engineering, Training","Gebeya is building a profitable and self-sustainable ecosystem that trains, hires, and nurtures the best of African talent.","Gebeya is building a-self-sustainable ecosystem that trains, hires, and nurtures the best of African talent. Our mission is to be the premier software engineering and IT training academy in Africa, while becoming the number one global IT services workplace that matches African IT talent with clients across Africa and the rest of the world."
GENIAC,https://www.crunchbase.com/organization/geniac,"Accounting, Human Resources, Legal, Small and Medium Businesses","GENIAC provides essential business services for SMEs, all in one place, and all managed on their behalf.","GENIAC provides essential business services for SMEs, all in one place, and all managed on their behalf. We have created a single services platform to deliver integrated HR, Legal, Accounting and Insurance services for Startups and SMEs. These services are complex and fragmented so we have developed GENIAC to focus on end-to-end customer intents as opposed to individual products. First off, we provide a named GENIAC manager which gives Startup/SME directors the ability to hand over work to be managed on their behalf, providing significant time back to them to grow their business. Next, rather than just providing a single product like a directors agreement, we deliver a “hire a new director” journey, which encompasses background checks, Companies House registration, a directors agreement, payroll, auto-enrollment pension and key man insurance. These integrated services go across our offering - so, for example, although we have online accounting software and an expenses app, we don’t just stop there, we also deliver the book keeping and tax return services. We achieve this through an intuitive intent driven portal, integrated data services that don’t require our intervention, and managed services delivered through our shared service centre."
GeoPredict,https://www.crunchbase.com/organization/geopredict,"Analytics, Energy Efficiency, Enterprise Software, Information Technology, Machine Learning, Manufacturing",The Oil and Gas Real Estate Marketplace,
Geo Renewables,https://www.crunchbase.com/organization/geo-renewables,"Energy, Energy Efficiency, Renewable Energy","GEO Renewables focuses on renewable energy by developing, constructing and operating wind parks.","GEO Renewables S.A. is a company focused on renewable energy. Our team manage projects on developing, constructing and operating wind parks in Poland. Presently, we construct wind parks in dolnośląskie voivodship."
General Compression,https://www.crunchbase.com/organization/general-compression,"CleanTech, Energy, Energy Storage","General Compression develops advanced compressed air energy storage technology that produces low-cost, dispatchable clean power.","Recognizing that the key to expanding clean power is stabilizing power output from wind and other variable sources, we are developing the General Compression Advanced Energy Storage (GCAESTM) system to store large quantities of energy from wind farms and make it available on demand. General Compression plans to commence construction of its first commercial project in autumn 2011, and is working in partnership with major utilities, independent power producers (IPPs), and gas storage operators to evaluate several sites in North America where GCAESâ„¢ can firm intermittent power and shape grid power capacity."
GetMuv,https://www.crunchbase.com/organization/getmuv,Sports,GetMuv is a most popular sports application in the Kingdom.,"The most popular sports application in the Kingdom, many sports activities and fun, without participation and in the nearest and best place, you and your children. With the support of the Commission."
Genius Brands International,https://www.crunchbase.com/organization/genius-brands-international,"Broadcasting, Media and Entertainment, Video Streaming",Genius Brands International is a publicly traded global brand management company,"Genius Brands International, Inc. “GBI” (OTCQB: GNUS) is a publicly traded global brand management company that creates and licenses multimedia content for toddlers to tweens. Led by award-winning creators and producers, GBI creates “content and products with a purpose,” providing enrichment as well as entertainment.  The Company distributes its content worldwide in all formats, as well as a broad range of consumer products based on its characters.  GBI’s portfolio includes award-winning Baby Genius, recently re-launched with new entertainment and over 40 new products; adventure comedy Thomas Edison's Secret Lab, available on Netflix, public broadcast stations and GBI’s Kid Genius channel on Comcast’s Xfinity on Demand reaching 21 million households; animated movie Stan Lee’s Mighty 7, the first project from Stan Lee Comics, a joint venture with Stan Lee’s POW! Entertainment and featuring an all-star voice cast led by legendary Stan Lee; and Warren Buffett’s Secret Millionaires Club, created with and starring iconic investor Warren Buffett.  The Company is also producing a new animated preschool series based on Llama Llama, the NY Times bestselling children’s book franchise; and a tween music-based adventure series SpacePOP."
Genometry,https://www.crunchbase.com/organization/genometry,"Biotechnology, Genetics, Pharmaceutical","Genometry commercializes a genome-wide, high-throughput, gene-expression profiling method for pharmaceutical discovery applications.","GENOMETRY, INC is a platform-technology company founded by a multidisciplinary team of genome scientists to commercialize a revolutionary genome-wide high-throughput low-cost gene-expression profiling method (L1000) for next-generation pharmaceutical discovery applications."
Generation Transfer,https://www.crunchbase.com/organization/generation-transfer,"Apps, Archiving Service, Children, Communities, Education, Family, Mobile Apps, Parenting, Social Media, Social Network",Inspiring families to capture and share meaningful life experiences,"For parents who want to share their life experience with their kids, Generation Transfer is a guided journaling and media sharing platform that captures, organises and shares your life's most important insights privately with the ones you love. Unlike social networks that increase rates of anxiety, depression, insecurity and fear of missing out in children, Generation Transfer helps parents share meaningful content that instills confidence, emotional stability, and strengthens family bonds."
Gemmyo,https://www.crunchbase.com/organization/gemmyo,"Fashion, Jewelry",Jewelry should be sublime and affordable.,"Jewelry should be both sublime and affordable. French people know: since 2015, Gemmyo has entered the top 3 of jewelry brand searches on Google in France, next to Cartier and Tiffany. Sales are booked online and made-to-order. We work with the best haute joaillerie workshops in France."
Getit InfoServices,https://www.crunchbase.com/organization/getit-infoservices,"Internet, Mobile, Search Engine","Getit InfoServices is a directional media company connecting buyers and sellers via print directories, and web and mobile media.","Getit InfoServices is a directional media company connecting buyers and sellers via print directories, and web and mobile media. Getit is a product, service, company and brand search engine."
Gemphire Therapeutics,https://www.crunchbase.com/organization/gemphire-therapeutics,"Biotechnology, Manufacturing, Therapeutics","Gemphire Therapeutics Inc. manufactures and markets Gemcabene, a LDL cholesterol-lowering medication.","Gemphire Therapeutics Inc. manufactures and markets Gemcabene, a LDL cholesterol-lowering medication. The company was founded in 2014 and is based in Northville, Michigan."
GenoLogics,https://www.crunchbase.com/organization/genologics,"Biotechnology, Health Care, Software","GenoLogics provides biomedical solutions and data management software, advancing the early detection, prevention, and treatment of diseases.","GenoLogics provides discovery and biomedical solutions that can be implemented across multiple labs and support translational medicine and systems biology initiatives. Their vision is to catalyze life sciences research with a collaborative data management software platform, advancing the early detection, prevention, and treatment of disease."
geoSilica,https://www.crunchbase.com/organization/geosilica,"Commercial, Renewable Energy, Water",geoSilica is the leading Icelandic company in the research and development of extracting minerals from geothermal water.,"The company was founded in 2012  by Fida Abu Libdeh, Burkni Pálsson, and Agnir ehf, as a result of Fida and Burkni’s thesis in energy and environmental engineering technology at the University of Iceland.   In the autumn of 2012 geoSilica received a project grant from the Icelandic Technology Development Fund in order to begin the product development of its first product. One year later the company started operations at the Hellisheidi Power Plant in order to utilize the mineral rich geothermal water used by the plant. This has been done in cooperation with ON Energy, the operator of the power plant.   geoSilica has developed a two-step production process. In the first step, the silica concentration in the separated geothermal water is increased many tenfold without changing the chemical composition of the water. In the second step, the geothermal water is gradually replaced by clean ground water from the area while keeping the silica concentration constant. The end product is highly pure silica in the form of extremely small silica particles in clean ground water. Absolutely no chemicals of any kind are used in the production.   geoSilica’s first product was released late 2014, a liquid silica supplement made from 100% natural silica. As of now, geoSilica has already started developing a new product in order to increase its product range."
Getabed Suite,https://www.crunchbase.com/organization/getabed,"B2B, Hospitality, Hotel, Property Management, SaaS, Travel",The ultimate booking engine and operating system for independent hotels,"Getabed Suite is a set of e-commerce tools + hotel booking engine + payment gateways mixed with the knowledge and expertise of a team of hotel e-commerce experts that drives and increases direct bookings without charging any commissions. Our backend also works as a property management system where small and boutique hotels can have full control of their clients info and bookings plus their full inventory, rates and promotions. Our platform connects with third-party software or specialized solutions for better results."
Geniee,https://www.crunchbase.com/organization/geniee,"Ad Network, Internet",Geniee helps to Maximize Your Ad Revenue with High-end Technology.,"Geniee helps to Maximize Your Ad Revenue with High-end Technology. Geniee Supply Side Platfrom is a platform designed for web publishers to maximize their revenues. It enables users to deliver ads to earn maximum revenue from pure advertisements, Demand Side Platform, Real Time Bidding through Ad Exchange, multiple ad networks, and affiliate ads."
GeoTix,https://www.crunchbase.com/organization/geotix,"Events, SaaS, Social Media, Software, Ticketing",GeoTix is a  provider of SaaS event Ticketing solutions.,"GeoTix is a provider of software-as-a-service (SaaS) solutions that generate new, non-advertising revenue streams for media companies through local event discovery to ticket purchase. Removing the national ticket seller from the sales process, GeoTix empowers media companies to more strongly connect with their audience, reflect their commitment to community, and leverage existing content to create new revenue streams. In return, they gain the benefits of increased income, greater brand building, higher levels of web site traffic, and the ability to foster community relationships."
Geenio,https://www.crunchbase.com/organization/geenio,"Education, Knowledge Management, SaaS",Geenio is a SaaS tool for small and medium companies that want to build e-learning processes from the scratch.,"Geenio is a cloud learning management system with built-in course authoring tool that helps you to quickly build professional-looking e-learning with multimedia lessons, tests, homework assignments, surveys and other learning activities."
Genebox,https://www.crunchbase.com/organization/genebox,Health Care,Genebox  is a leading consumer genetics company.,
Geneius,https://www.crunchbase.com/organization/geneius,"Biotechnology, Health Care, Medical",Geneius is a Biotechnology company.,Geneius Biotechnology is a T cell immunotherapy company focused on therapies for cancer. There is growing evidence for the potential of T cell immunotherapy for successful treatment of cancer patients. Our proprietary approach is distinct and unique from other T cell immunotherapy approaches and promotes the surveillance and destruction of cancer cells by the immune system. Through a transformative academic collaboration we are rapidly translating products from bench to bedside. We are currently developing products for both hematologic and solid cancers through our academic collaboration and expect to start clinical trials by the end of the year.
Gear Up Sports,https://www.crunchbase.com/organization/gear-up-sports,"Retail, Sporting Goods, Textiles","Gear Up Sports is managing youth sports organizations, particularly uniforms and apparel.","Gear Up Sports is founded on the idea that managing youth sports organizations, particularly uniforms and apparel, didn't need to be so difficult or expensive. Their founders are parents, coaches and youth non-profit board members. Everything theydo at Gear Up Sports is designed to ease the burden on youth non-profit boards in dealing with uniforms and apparel."
GenomePrecision,https://www.crunchbase.com/organization/genomeprecision,"Biotechnology, Health Diagnostics",GenomePrecision is a national economic and technological development zone.,"Genomeprecision is a molecular diagnostic enterprise integrating R&D, production and sales. It has established “real-time fluorescent quantitative PCR”, “first-generation Sanger sequencing”, “second-generation high-throughput NGS sequencing” and “capillary electrophoresis”. ""Fragment Analysis"" and ""Chemiluminescence CLIA"" five molecular diagnostic technology platforms, we will be based on clinical diagnosis and treatment needs to develop molecular diagnostic products based on the above technology platform."
Genext Students Limited,https://www.crunchbase.com/organization/genext-students-limited,"E-Learning, Education, Training","Smart tutoring platform for school students (classes 1-12). Study, Assess, Analyze and Connect with Tutors.","GenextStudents.com is a Smart Tutoring Platform for school students with a combination of online, mobile and physical tutoring to assist them in enhancing their knowledge and thus improving their performance"
Genoimmune Therapeutics,https://www.crunchbase.com/organization/genoimmune-therapeutics,Therapeutics,Genoimmune Therapeutics is a high-tech biotechnology enterprise dedicated to the treatment of tumor immune cells.,"Genoimmune Therapeutics is a holding subsidiary of Shenzhen Huada Gene Technology Co., Ltd. It is a high-tech biotechnology enterprise dedicated to the treatment of tumor immune cells. Through the use of advanced life digital technology, the human immune system can be fully stimulated against the tumor, and new advanced prevention and treatment programs targeting tumor-specific antigens can be developed to benefit patients. Since 2011, he has focused on the development of tumor genomes, bioinformatics and tumor immunity."
Genesis,https://www.crunchbase.com/organization/genesis-healthcare,"Health Care, Medical","Genesis HealthCare provides long term care services, traditional care and rehabilitation therapy.","Genesis HealthCare offers a variety of compassionate care services to patients and residents in our Centers, and their families. Genesis HealthCare includes: Skilled Nursing Centers, Assisted/Senior living Communities, and our Genesis Rehab Services division, which provides contract therapy to healthcare providers throughout the United States as well as select international locations."
GenZum Life Sciences,https://www.crunchbase.com/organization/genzum-life-sciences,"Biotechnology, Clinical Trials, Pharmaceutical","Genzum Life Sciences is a globally integrated Generic Pharmaceutical Product Development and Out-licensing company, based in Los Angeles","Genzum Life Sciences is a globally integrated Generic Pharmaceutical Product Development and Out-licensing company, based in Los Angeles, CA; with offices in New York, Chicago and India. Led by a team of industry experts and specialists, we focus on developing niche pharmaceutical products for our partners and end consumers around the world."
Gemnote,https://www.crunchbase.com/organization/gemnote,"Gift, Product Design, Software",Gemnote sends handwritten cards and premium custom gifts for companies.,"Gemnote, which just launched from Y Combinator, gives companies an alternative with items carefully selected to make sure they don’t end up in a junk drawer or snuck into Secret Santa gift exchanges."
GeniusU,https://www.crunchbase.com/organization/geniusu,"Events, News, Social Entrepreneurship",The world's no.1 entrepreneur education platform,"GeniusU is an assessment-based mobile app that gives entrepreneurs personalized learning missions based on their purpose, passions, talents location and other personal preferences. The app links entrepreneurs to missions, connections, circles, news, events, opportunities and resources through a personalized Genius Stream. It uses forward A.I. - based on where you want to go - instead of backward A.I. - based on where you've been, to deliver the best next steps at every stage of enterprise growth. In the 16 months since launch, over 450,000 entrepreneurs from 180 countries have joined the platform. We are on track to exceed 1.2 million members by the end of 2016."
GeoGif,https://www.crunchbase.com/organization/geogif,Internet,Transform your everyday adventures into animated memories!,
Genius Pack,https://www.crunchbase.com/organization/genius-pack,"E-Commerce, Travel","Genius Pack offers innovative luggage, suitcases, and travel products.","Genius Pack offers innovative luggage, suitcases, and travel products. The company offers The Genius Pack 22"", a suitcase designed for the habitually absent-minded travelers. It has designated compartments for socks, underpants, and dirty laundry as well as a built-in packing list. The company’s product portfolio includes 29’’ Hardside Spinner Upright, 30’’ Extensive Wheeled Upright, 22"" Carry On W/ Integrated Suiter, Intelligent Travel Backpack, Genius Tri-Fold Carry On Garment Bag, Overnight True Sport Duffle, Weekender True Sport Duffle, City Commuter Laptop Bag, 22"" Carry On W/ Integrated Suiter, 29’’ Hardside Spinner Upright, 30’’ Extensive Wheeled Upright, Luxe Leather Portfolio Bag, Luxe Leather iPad Sleeve, Luxe Leather Entrepreneur, Luxe Leather iPad Mini Sleeve, Brilliant Toiletry Kit, Tie Case, Super-Slim Garment Sleeve, Travel Shoe Bag, Essential Shave Kit, Compression Packing Cubes, Loud Sound Mini Speaker, Luggage Tracking Device, Micro Travel Umbrella, Universal Travel Adaptor, TSA Cable Lock, TSA Luggage Lock, Leak-Free Travel Proof Bottles, Squeezable Travel Containers, Travel Refillable Fragrance Spray, and more."
GeneTx Biotherapeutics,https://www.crunchbase.com/organization/genetx-biotherapeutics,"Biotechnology, Life Science, Pharmaceutical",GeneTx Biotherapeutics is a biotechnology company dedicated to developing and effective therapeutics for the treatment of Angelman syndrome.,GeneTx Biotherapeutics LLC is a startup biotechnology company dedicated to developing and commercializing safe and effective therapeutics for the treatment of Angelman syndrome.
GenomeUp,https://www.crunchbase.com/organization/genomeup,"Artificial Intelligence, Biotechnology, Health Care, Medical",A.I. for precision medicine,GenomeUp is an AI platform (SaaS) to enabling doctors and clinical institutions to diagnose and treat rare genetic diseases in less than 24h. GenomeUp is involved in international research project and clinical trial in partnership with universities and research centers.
Gel-E,https://www.crunchbase.com/organization/gel-e-inc,"Health Care, Life Science, Medical",developed an advanced wound care platform designed to be used across a broad spectrum of clinical.,"gel-e Life Sciences has developed an advanced wound care platform that can be used across a broad spectrum of clinical and non-clinical settings. By making molecular modifications to natural biopolymers, gel-e’s patented approach provides rapid hemostasis in a clean, safe healing environment. Using non-dilutive grant funding, the company has achieved milestones such as 1 FDA Clearance, 5 issued patents, and 6 peer-reviewed publications."
gestigon,https://www.crunchbase.com/organization/gestigon,Software,"gestigon develops body tracking and gesture recognition software for body, hand, and finger gestures.","gestigon develops body tracking- and gesture recognition software for body, hand and finger gestures. The company offers a software packages for recognition of hand, finger and body gestures, poses and biometrical identification. Its proven and patented solutions make use of 3D image data that is analyzed in real-time. The action triggered by a gesture can be configured individually, depending on the application. There is no need to rely on the gesture database provided by the OEM. The key features of our software are: - recognition of hand and body gestures, poses and biometrics - sensor- and  platform independent - intuitive user interface - low latency - generic gesture dictionary included Their solution addresses Automotive, AR/VR control, Consumer Electronics and other segments. Due to its architecture as an embedded system it requests significantly less resources and consumes less power. Therefore it is perfectly suitable for any mobile device, where energy and size are relevant factors."
Generation NEXT Franchise Brands,https://www.crunchbase.com/organization/generation-next-franchise-brands,"Food and Beverage, Food Delivery, Robotics",Generation NEXT Franchise Brands is a publicly traded company on the OTC Markets trading under the symbol: VEND.,
GetSocial,https://www.crunchbase.com/organization/gramble-world,"Android, iOS, Mobile",A breakthrough white label technology platform for mobile developers.,"GetSocial is a cloud-based mobile acquisition and engagement platform that empowers any mobile app developer with tools to maximize user acquisition, engagement, and retention."
Generex Biotechnology,https://www.crunchbase.com/organization/generex-biotechnology,"Biopharma, Biotechnology, Medical Device, Pharmaceutical",Generex Biotechnology develops and commercializes drug delivery systems and technologies for metabolic and immunological diseases.,"Generex Biotechnology Corporation, a development stage company, engages in the research, development, and commercialization of drug delivery systems and technologies for metabolic and immunological diseases. It develops a proprietary platform technology for the oral administration of large molecule drugs, including proteins, peptides, monoclonal antibodies, hormones, and vaccines. The company's products include Generex Oral-lyn, an insulin spray formulation used for the treatment of Type-1 and Type-2 diabetes; Glucose RapidSpray, which provides an alternative for people who require additional glucose in their diet, as well as delivers glucose formulation directly into the mouth; BaBOOM! Energy Spray, an instant energy spray designed to increase energy levels for sports, work, study, travel, and overall fatigue; and Crave-NX, a fat-free glucose spray that is used as an aid for dieters. Generex Biotechnology Corporation's under development products include medicinal chewing gum for the treatment of Type-2 diabetes mellitus and obesity; morphine and fentanyl products for breakthrough and postoperative pain; and AE37, an immunotherapeutic vaccine that is in Phase II clinical trials for patients with HER-2/neu positive breast cancer. The company markets its products through distributors and retail chains in Ecuador, Canada, and the United States. It has collaboration with Fertin Pharma A/S for the development of a metformin medicinal chewing gum. The company was founded in 1983 and is based in Toronto, Canada."
