Organization Name,Organization Name URL,Categories,Description,Full Description
EARTH AI,https://www.crunchbase.com/organization/earth-ai,"Analytics, Artificial Intelligence, Information Technology, Software",EARTH AI is discovering mineral deposits for the future of humanity in an efficient way with low environmental impact.,"EARTH AI is the world’s most efficient mineral explorer, finding new deposits of metals worth $10-100M, 12X faster and 35X cheaper than the competition, through AI mineral targeting system (field-proven to be 50x more successful at finding mineralized prospects), and 5X cheaper field operations achieved through hardware automation and streamlined in house operations."
Eargo,https://www.crunchbase.com/organization/aria-innovations,"Audio, Medical Device, Wearables","Wearable, audio-enhancement technology","Eargo. A company made up of ENT surgeons, tech geeks and dreamers, united in our belief that people should be able to hear life to the fullest. Because the world is full of great things to hear. And because, well, we really like people. It's because we like people that we do what we do. We want the best for them, and this is our way to make sure they get it (we also like pina coladas, cuddly puppies and long walks on the beach, in case you’re wondering)."
EASME - EU Executive Agency for SMEs,https://www.crunchbase.com/organization/easme,"Financial Services, Government, Small and Medium Businesses","EASME  is the European Union executive agency for SMEs in charge of Enterprise Europe Network, COSME, and other programs.","The Executive Agency for Small and Medium-sized Enterprises (EASME) has been set up by the European Commission to manage on its behalf several EU programs.   EASME is in charge of managing SME, environment, energy and maritime projects funded under COSME, Horizon 2020, LIFE, and EMFF.    EASME also organizes the European Sustainable Energy Week (EUSEW)."
Eagle Alpha,https://www.crunchbase.com/organization/eagle-alpha,"Analytics, Big Data, FinTech",Eagle Alpha is the leading provider of insights from the Web to Wall Street.,"Eagle Alpha is the leading provider of insights from the Web to Wall Street. These insights are delivered through Research Reports, Online Tools and a Data Platform. Eagle Alpha's Research, Tools and Data are used by some of the world's leading investment managers and investment banks to leverage non-traditional insights from the Web. Clients also include family offices, corporates, online brokers and central banks. The company was founded in September 2012 by a former Morgan Stanley investment banker, Emmett Kilduff."
Eaze,https://www.crunchbase.com/organization/eaze-2,"Cannabis, E-Commerce, Health Care, Marketplace, Mobile",Eaze is an online marketplace and technology platform that helps provide legal access to cannabis through safe and convenient delivery. ,"Eaze is an online marketplace and technology platform that helps provide legal access to cannabis through safe and convenient delivery. In doing so, Eaze works with and assists local cannabis entrepreneurs in expanding their businesses sustainably and responsibly."
EazyDiner,https://www.crunchbase.com/organization/eazydiner,"Customer Service, E-Commerce, Food and Beverage, Hospitality, Lifestyle, Restaurants, Service Industry","EazyDiner is your reliable guide to eating out that offers insider tips, exclusive and expert reviews by top critics.","With exclusive and expert reviews by top critics like Vir Sanghvi, EazyDiner is your reliable guide to eating out. Get insider tips as well as hundreds of users’ dining experiences to get a complete picture before you choose.Every booking through EazyDiner comes with a special deal such as a complimentary dessert or beverage or even a discount on your entire bill."
Earnest,https://www.crunchbase.com/organization/earnest,"Banking, Consumer Lending, Credit, Financial Services, FinTech",Earnest is a technology-lender that brings low-interest loans to high-potential people.,"Earnest was built on the principle that getting a loan shouldn’t be difficult for financially responsible people. Earnest offers student loan refinancing and personal loan. It uses its unrivaled technology to consider more than just a credit score; it looks at thousands of data points such as education, saving patterns, investments, and career trajectory. Customers apply online and can manage their account payment preferences with the online dashboard and mobile app. Earnest was founded in 2013, by Louis Beryl and Ben Hutchinson, and had its official launch in early 2014. Earnest raised several rounds of funding from investors including Andreessen Horowitz, Maveron, Battery Ventures, Atlas Ventures, and several others. In 2017, Earnest was acquired by Navient Corp. Navient maintains Earnest as a separate brand while allowing Earnest to be backed by a larger company. Earnest has grown from distributing $8M loans in its first year of business to distributing nearly $2B in student loans and having a roughly $500M loan portfolio in 2017. Earnest has been included in Fast Company’s World’s 50 Most Innovative Companies list. The company lends across the United States in 45 states and the District of Columbia. In August 2017, it was announced that Earnest would open a second office in Salt Lake City, Utah."
EAT Club,https://www.crunchbase.com/organization/eat-club,"E-Commerce, Hospitality, Restaurants",EAT Club is a food technology company allowing offices to order and get food delivered from local restaurants via the web or mobile devices.,"EAT Club is a food technology company that's democratizing good food.  Office workers can order lunch from great local restaurants via mobile or web and get it delivered by 12:30pm. EAT Club is based in Redwood City, CA and currently serves the San Francisco Bay Area and Greater Los Angeles."
EasyKnock,https://www.crunchbase.com/organization/easyknock,"Financial Services, FinTech, Real Estate",EasyKnock helps homeowners achieve financial freedom through an innovative and modern equity release program.,"EasyKnock is a real estate technology company on a mission to change the way homeownership is approached. Our latest product, MoveAbility, is a sale-leaseback program designed specifically for homeowners who need cash to buy their next home, need extra time to sell, or want to take a bit longer to find their forever home. We move fast so homeowners don't have to. Listing a home on the market can take months, depending on the time of year. With MoveAbility homeowners no longer have to be at the mercy and whims of the market."
Easyship,https://www.crunchbase.com/organization/easyship-fulfillment-services,"Courier Service, E-Commerce, Internet, Logistics, Shipping",Easyship empowers eCommerce sellers with worldwide shipping.,"Easyship is a technology company that provides eCommerce sellers with a one-stop solution to ship their orders worldwide. It allows eCommerce merchants and marketplaces to integrate a seamless shipping gateway to their shopping cart. Easyship integrates with more than 100 different shipping services including major couriers such as DHL, FedEx, USPS and UPS, at prices discounted up to 70%. For each order, Easyship compares all shipping couriers and gives transparency to the buyer on delivery time and shipping costs. Easyship guarantees taxes & duties for shipments based on the type of item and its customs value - making sure that eCommerce sellers never experience unexpected costs or delays while shipping worldwide.  Because all of this is integrated within a single, efficient, free software, sellers only need their Easyship account to sync their stores and streamline their logistics from checkout to delivery. Easyship also provides e-fulfillment services to eCommerce sellers that are willing to have their products stored, packed, and shipped from one of Easyship’s warehouses."
Eatigo,https://www.crunchbase.com/organization/eatigo,"Apps, E-Commerce, Food and Beverage, Reservations, Restaurants",Eatigo designs an online platform that offers an application for online restaurant reservations in Southeast Asia.,"Eatigo owns and operates a dining deals and restaurant reservation portal for customers in Thailand and Singapore. It helps users search restaurants, reserve online, and enjoy deals with a special discount.  Judy Tan, Michael Cluzel, Pumin Yuvacharuskul, and Siddhanta Kothari founded Eatigo in 2013, with its headquarters in Bangkok in Thailand and an additional office in Singapore. "
EarlySense,https://www.crunchbase.com/organization/earlysense,"Biotechnology, Health Care, Medical Device","EarlySense develops signal-processing technology, offers EverOn, a contact-free and early detection patient supervision system.","EarlySense develops signal-processing technology. The company's lead product, EverOn, a contact-free early detection patient supervision system that measures, records, displays, and alerts heart and respiration rates, as well as bed entries and exits, patient motion, and quality of sleep from under the mattress. EarlySense Ltd. was founded in 2004 and is based in Ramat Gan, Israel with a research and development facility in Israel; and marketing offices in Boston, Massachusetts."
EasyPost,https://www.crunchbase.com/organization/easypost,"Delivery, Logistics, Shipping",EasyPost provides a simple postage API that allows developers to quickly and painlessly integrate shipping into any e-commerce application.,"EasyPost is the simple shipping API that allows users to buy postage labels, check rates, verify an address, track your shipments, and more with all of the major shipping companies, including USPS, UPS, and FedEx."
Easy Taxi,https://www.crunchbase.com/organization/easy-taxi,"Apps, Automotive, Mobile, Public Transportation, SaaS, Taxi Service, Transportation",Easy Taxi is an urban transport application that allows passengers to book and track a taxi.,"Easy Taxi is a taxi application that allows people to easily book a taxi and track it in real time. It connects passengers and taxi drivers through Android, iOS, Windows Phone, and BlackBerry devices. It also serves businesses and corporate users through Easy Taxi PRO and Easy Taxi Corporate applications. The company's mission is to convince a new generation of taxi drivers and passengers that using the platform will help reduce traffic and improve mobility. It was founded in 2011 and is based in São Paulo, Brazil."
Eave,https://www.crunchbase.com/organization/eave-c75a,"Accounting, Billing, Finance, Financial Services",A Technology Company.,"Eave is a mortgage loan origination company. They make ethical mortgages easy. By positioning our borrowers to be treated like cash buyers, they provide them the best possible mortgage experience. They’re able to do this because of our team of customer-centric engineers working alongside creative industry experts.  They’ve built our own full-stack platform, which automates 80% of the mortgage origination, underwriting & funding processes. As a result,their operations team can focus all their time on providing red carpet customer support. Further, they’ve reimagined the industry’s order of operations. At Eave, they fully underwrite their borrowers before they start shopping. This means they know how much they can afford and what rates they qualify for from the very beginning.  Eave has built a diverse team and an inclusive culture for their community. They will always have more work to do, but they are deeply committed to building a company where everyone's voice is heard, that offers equal pay for equal work, and that supports people from all walks of life.  Eave has a social vision as well. They believe that every human deserves a safe home. For every mortgage we originate, they build a home for a family in India. They also regularly volunteer to support their local homeless communities.  "
Earn.com,https://www.crunchbase.com/organization/earn-com,"Bitcoin, Email, FinTech, Internet, Social Network, Virtual Currency",Earn money for replying to emails and completing tasks.,"We're building a token-based social network, where senders pay users in digital currency to complete tasks and reply to emails. If we're successful, it will be one of the first major applications of digital currency for the regular user."
EatClub,https://www.crunchbase.com/organization/eatclub,"Food and Beverage, Software, Travel","EatClub develops an app that shows its users restaurants nearby with spare tables, offering last minute deals.","EatClub is a world first customer engagement platform that gives restaurants the control to manage demand for their tables and improve their profit margins through the use of dynamic pricing. Founded by esteemed chef Marco Pierre White, EatClub was designed by restaurateurs to help restaurants fill their tables at off-peak times by offering diners last-minute deals via the app. Our partner portfolio of over 1500 restaurants includes Sake, Rockpool Dining Group, The Meatball and Wine Bar, Bills, Ormeggio at the Spit, and many more. EatClub is operational in Sydney and Melbourne, with expansion plans to get the whole of Australia to eat out, more often."
EasyMile,https://www.crunchbase.com/organization/easymile,"Automotive, Autonomous Vehicles, Electric Vehicle, Image Recognition, Public Transportation, Robotics, Transportation",EasyMile is a high-tech startup specialized in providing both software powering autonomous vehicles and smart mobility solutions.,"EasyMile is a high-tech startup specialized in providing both software powering autonomous vehicles and the last mile smart mobility solutions. The company is headquartered in Toulouse (France) with offices in Singapore and Denver (USA). It also operates through value added resellers notably in Japan and the Middle East. EasyMile, with its workforce of 70 passionate employees, is a privately held company that is currently growing organically at a sustained pace."
EATON,https://www.crunchbase.com/organization/eaton,"Automotive, Electrical Distribution, Hardware, Software","EATON is a diversified power management company for electrical, hydraulic, and mechanical applications.","Eaton Corporation is a diversified power management company with 2009 sales of $11.9 billion. Eaton is a global technology leader in electrical components and systems for power quality, distribution and control; hydraulics components, systems and services for industrial and mobile equipment; aerospace fuel, hydraulics and pneumatic systems for commercial and military use; and truck and automotive drivetrain and powertrain systems for performance, fuel economy and safety. Eaton has approximately 70,000 employees and sells products to customers in more than 150 countries."
EatStreet,https://www.crunchbase.com/organization/eatstreet,"Delivery, E-Commerce, Mobile, Restaurants","EatStreet is an online and mobile food ordering service that streamlines commerce between 15,000 restaurants and hungry diners nationwide.","EatStreet is a burgeoning online and mobile food ordering service that streamlines commerce between restaurants and diners. To college students and young professionals, EatStreet is the smart, simple, and affordable way to order delivery and takeout from their favorite restaurants. To restaurant owners, EatStreet is a one-stop-shop for online ordering and marketing. By providing web, mobile, and social products for online ordering, EatStreet brings in new business for restaurants. Diners enjoy the upside of fast, simple ordering while restaurants see their sales soar. Founded in 2010, the company is headquartered in Madison, Wisconsin, United States."
Ease (formerly EaseCentral),https://www.crunchbase.com/organization/ease-central,"Human Resources, Information Technology, SaaS","Online benefits and HR software trusted by 60,000+ SMBs","Ease's mission is to modernize and personalize the employee experience. Working with industry experts to provide one simple solution for benefits, hr, and payroll. Ease is an online benefits enrollment system built for insurance brokers and employers. Ease makes it simple to set up and manage benefits, onboard new hires, stay compliant and offer employees one destination for all their human resources information. Ease is used by more than 60,000 small and medium-sized businesses in the United States."
Eat,https://www.crunchbase.com/organization/eat,"Apps, Food and Beverage, Mobile, Reservations, Restaurants",Restaurant Management Software and Online Restaurant Reservations,"Headquartered in Dubai, Eat App is the Middle East’s #1 reservation platform and online booking engine for restaurants. The platform powers reservations at the most renowned restaurants and hospitality brands. To date, Eat App has seated 10+ million diners in 1000+ restaurants across the Middle East. Eat App has raised USD $4.2m from prominent investors like 500 startups and MEVP.  Eat has products for both restaurants and diners. For restaurants, eat supplies an iPad application that manages table reservations with simple floor planning features, records customer history and preferences, and provides a tool to publish targeted promotions and discounts. For diners, eat supplies an iPhone application that allows users to discover restaurants around them, find available tables, and confirm reservations instantly. The iPhone is linked with the iPad, and reservations are communicated with the restaurant in real-time."
Easyhome,https://www.crunchbase.com/organization/beijing-easyhome-furnishing,"Furniture, Home Renovation, Retail",Easyhome is a home improvement and furniture chain operator in China.,"Beijing Easyhome Furnishing is a home improvement and furniture chain operator in China. It operates 223 physical home furnishing and DIY-style stores across 29 provinces in China, which it claims makes it the country’s second largest in its field."
Earnix,https://www.crunchbase.com/organization/earnix,"Analytics, Banking, Finance, Financial Services, Insurance, Price Comparison",Earnix is a software platform for pricing analytics and optimization used by insurance and retail banking organizations.,"Earnix Integrated Pricing and Customer Analytics software empowers financial services companies to predict customer risk and demand and their impact on business performance, enabling the alignment of product offerings with changing market dynamics. Earnix combines predictive modeling and optimization with real-time connectivity to core operational systems, bringing the power of analytic-driven decisions to every customer interaction. Banks and insurers rely on Earnix solutions to improve deposit, loan, and insurance policy offerings."
Earlens Corporation,https://www.crunchbase.com/organization/earlens,"Manufacturing, Medical, Medical Device",Earlens is a privately held medical technology company transforming the hearing experience with the only direct sound delivery system.,"EarLens Corporation is a privately held medical device company committed to providing hearing impaired patients a hearing solution that is designed to change the current standard of care for sound performance.  The EarLens System's unique mechanism of direct sound delivery potentially opens the door to a level of sound performance achieved by no hearing aid on the market today.  Unlike traditional hearing aids, which are in effect tiny speakers that simply turn up the volume on air conducted sound, the EarLens Contact Hearing Device™ is the world’s first to use light to transmit sound."
Earthport Plc,https://www.crunchbase.com/organization/earthport-plc,"Banking, Transaction Processing",Earthport Plc is a global financial services organisation.,Earthport plc is a global financial services company providing a cross border payments service in over 50 countries and territories worldwide.
EasyParcel,https://www.crunchbase.com/organization/easyparcel,"Delivery Service, E-Commerce, Internet, Shipping",EasyParcel is an Online Booking Platform for Parcel Delivery.,
"Eagle Eye Networks, Inc.",https://www.crunchbase.com/organization/eagle-eye-networks,"Cloud Computing, Cyber Security, Internet, Physical Security, SaaS, Security, Video",Eagle Eye Networks is an online provider of cloud video surveillance incorporating both cloud and on-premise recording.,"Eagle Eye Networks is the worldwide leader in cloud video surveillance.  The Eagle Eye video management system provides both cloud and on-premise recording.  Eagle Eye provides AI Analytics, Big Data analytics, and Business Operations Optimization and other more standard analytics in its platform for video surveillance.  Eagle Eye provides a fully open, robust, and restful API for access to video and integration of analytics and other business processes with video.  Eagle Eye operates over 12 data centers worldwide to provide necessary data sovereignty. Eagle Eye Networks was founded by Dean Drako who was the founder of Barracuda Networks.   Eagle Eye is headquartered in Austin, TX and Amsterdam The Netherlands, with a major office in Tokyo Japan."
Eagle Genomics,https://www.crunchbase.com/organization/eagle-genomics,"Biotechnology, Cloud Computing, Genetics, Open Source, Software","Eagle Genomics is a enterprise software solutions company to enable the management, orchestration and exploitation of life sciences data.","Eagle Genomics is a enterprise software solutions company whose products enable the management, orchestration and exploitation of genomics and other life sciences data. They help Life Science companies get the maximum value from their R&D data and they are delivering the information architecture for the genomics era. Their suite of software products radically reduces cost and time to complete research, enabling drastic productivity improvements. Their architecture translates data sets into data assets, redefining the current paradigm in the industry, enabling the objective measurement of the value of digital assets and providing clarity on “return on information”. Their mix of expertise in biology, bioinformatics, data science and enterprise-class software engineering is unique in the field and has been applied over the last decade to solve their customers’ challenges in areas as diverse as drug development, personal hygiene and plant breeding. With global customers in the pharmaceuticals, fast moving consumer goods and agri-tech industries they understand the common challenges facing these industries in the handling of ever growing of data and information resources.  Eagle Genomics is at the forefront in addressing the challenges, risks, and opportunities in delivering the enterprise information architecture for the genomics era."
Earnest Research,https://www.crunchbase.com/organization/the-earnest-research-company,"Analytics, Big Data, Consumer Research, Data Mining, Information Services, Market Research, Predictive Analytics",Earnest Research transforms raw data into a source for business and investment professionals to make better decisions.,"Earnest Research is a data innovation company driven to change the way professionals understand consumer and business behavior. Working with world-class data partners, we transform raw data into a source for business and investment professionals to ask better questions so they can make better decisions."
EatTasty,https://www.crunchbase.com/organization/eattasty,"Communities, E-Commerce, Food and Beverage, Food Delivery, Marketplace",EatTasty uses under-utilized kitchen space for outsourcing the production of its daily lunch menus for hyperlocal delivery.,"Producing every-day tasty food through a decentralized model, aiming to deliver the best food through the biggest community of producers."
EasyMovie,https://www.crunchbase.com/organization/easymovie,"Digital Marketing, SaaS, Video",EasyMovie is a video creation platform that allows the creation of quality videos for businesses.,"EasyMovie is a video creation platform that allows the creation of quality videos for businesses. Through the platform, businesses could make a large quantity of homogenous quality videos via their employees, within time and budget constraints. It gives them extremely powerful tools (mobile apps, SaaS platform) that their agencies or EasyMovie experts can personalize and implement within each business. EasyMovie was established in 2013 and is based in Paris, France."
Easy Transfer,https://www.crunchbase.com/organization/easytransfer,"Customer Service, Financial Services, FinTech, Higher Education, Payments",Beijing based student financial services platform.,"Easy Transfer makes it easy for you. Easy Transfer is China's largest online financial service platform for overseas students, on which students are able to pay tuition fees and dormitory rent to thousands of renowned colleges and universities worldwide. By forming close partnerships with payment processors like UnionPay, Visa and Mastercard, as well as major Chinese banks like China Guangfa Bank, Industrial Bank and China Merchants Bank, Easy Transfer provides Chinese students, their families and higher education institutions worldwide with the go-to service for international education payments. So far, Easy Transfer has received funding from ZhenFund, IDG Capital, Taiyou Fund, Manzi Fund and CY Zone."
