Organization Name,Organization Name URL,Categories,Description,Full Description
Yext,https://www.crunchbase.com/organization/yext,"Advertising, Software",Perfect Answers Everywhere.,"The customer journey starts with a question. And consumers expect answers. Yext puts businesses in control of their facts online with brand-verified answers in search. By serving accurate, consistent, brand-verified answers to consumer questions, Yext delivers authoritative information straight from the source — the business itself — no matter where or how customers are searching. Taco Bell, Marriott, Jaguar Land Rover, and businesses around the globe use the Yext platform to capture consumer intent and drive digital discovery, engagement, and revenue — all from a single source of truth. Yext’s mission is to provide perfect answers everywhere."
Yes Bank,https://www.crunchbase.com/organization/yes-bank,"Banking, Finance, Financial Services, Venture Capital, Wealth Management",YES BANK is a large private sector bank that offers comprehensive banking and financial solution to all its valued customers.,"YES BANK, India's fourth largest private sector Bank, is an outcome of the professional entrepreneurship of its Founder, Rana Kapoor and his highly competent top management team, to establish a high quality, customer centric, service driven bank catering to the “Future Businesses of India”. YES BANK is the only Greenfield Bank license awarded by the RBI in the last two decades, associated with the finest pedigree investors. YES BANK a “Full Service Commercial Bank” has steadily built a Corporate, Retail & SME Banking franchise, with a comprehensive product suite of Financial Markets, Investment Banking, Corporate Finance, Branch Banking, Business and Transaction Banking, and Wealth Management business lines across the country."
Yesware,https://www.crunchbase.com/organization/yesware,"CRM, Email, Enterprise Software, Internet","Yesware is an all-in-one sales acceleration platform that helps salespeople connect with prospects, track engagement, and close more deals.","Yesware helps salespeople sell smarter.  Yesware’s Email Tracking notifies salespeople when prospects open their messages and click their links. Custom Templates streamline responses to prospects and customers. CRM Syncing connects sales email to solutions from Salesforce.com, Microsoft Dynamics, and many others to save time and improve the quality of enterprise data. Yesware’s Reports and Analytics give salespeople unprecedented feedback about how their messages are being received.  This is not new technology. They are focused on optimizing proven technology to meet the needs of power users - people who get and send 100 or more emails a day, people who want computers to take on more data-entry and more automation, so that users can focus on building relationships and closing more business. The company's initial target market for B2B salespeople. For these people, a productivity tool that can help them reach their sales goals is extremely valuable. Yesware offers 100 free tracking emails per month to start and you can earn up to 100 additional emails for referring friends, or upgrade to a Plus account with unlimited email tracking. The company also offers Team, Enterprise, and Custom product plans. Learn more at www.yesware.com/plans-and-pricing.  Sales managers who deploy Yesware to their teams see activity-based reports that reveal a new level of performance detail without relying on additional data entry. Yesware’s collaboration features enable salespeople and sales managers to share the most effective templates with their colleagues.  The market for Yesware is huge, and so is the competition. Companies like Salesforce, Microsoft and Oracle sell billions of dollars of enterprise software annually to corporate IT departments. Their software, however, is almost exclusively aimed at sales management and oversight instead of helping salespeople sell more. Yesware sells its services directly to salespeople, and has to prove its worth to them, instead of to an IT or marketing department interested in sales pipeline visibility."
Yellowbrick Data,https://www.crunchbase.com/organization/yellowbrick-data,"Analytics, Database, Information Technology",Yellowbrick Data empowers companies to make faster decisions with all of their data.,"Yellowbrick Data was founded in 2014 by experts in database and flash memory technologies to simplify data warehousing. They wanted to solve the challenges of high availability, running complex mixed workloads, support for ad-hoc SQL, computing correct answers on any schema, massive scalability and supporting large numbers of concurrent users. Yellowbrick Data empowers companies to make faster decisions with all of their data. Built for enterprises and the hybrid cloud, the Yellowbrick Data Warehouse deploys powerful analytics anywhere, with best-in-class economics."
Yellow Messenger,https://www.crunchbase.com/organization/yellow-messenger,"Artificial Intelligence, Customer Service, Enterprise Software, Messaging",Conversational AI Platform for Enterprises,"Leading Enterprises globally are deploying Yellow Messenger as an Conversational AI Platform for Customer Engagement & Customer Experience to drive higher Sales, Revenue, NPS and much more in addition to superior Customer Service. Yellow messenger is backed by Microsoft , Accenture, SAP , TCS."
yello,https://www.crunchbase.com/organization/yello,"CRM, Mobile, Recruiting, SaaS, Software",Yello's leading talent acquisition software is used by Fortune 500 companies and high-growth businesses to attract and nurture top talent,"Yello enables companies to humanize the candidate experience. Yello's talent acquisition platform empowers recruiting departments to provide unprecedented speed and transparency throughout the candidate journey. Founded in 2008, Yello supports hundreds of organizations globally by serving as a key strategic partner in optimizing their recruiting operations and talent relationship management."
Yewno,https://www.crunchbase.com/organization/yewno,"Computer, Software",Leverage our knowledge graph to extract knowledge from our vast web of structured and unstructured data.,"Yewno is an emerging high-tech company based in Silicon Valley, focused on an innovative knowledge graph platform that transforms billions of data points into high quality insights as an answer to the complexity of ever-growing information. They have products in education, publishing, biotech, and finance."
YellowPepper,https://www.crunchbase.com/organization/yellowpepper,"Financial Services, Mobile, Mobile Payments",YellowPepper provides mobile banking and payment solutions to financial institutions in the Latin American region.,"YellowPepper is Latin America’s pioneer in mobile banking and payment solutions. Founded in 2004, the growing company provides services in Mexico, Colombia, Ecuador, Peru, and soon Brazil employing the best and brightest in the tech space with more than 60 team members throughout its regional footprint.  YellowPepper brings innovative payment solutions to dynamic countries across the hemisphere. The company is backed by Visa and is also the recipient of the IFC (World Bank) first equity investment for a Latin America mobile financial company, merging unmatched market knowledge with the latest in payments technology. For more information, please visit www.yellowpepper.com."
YellowDog,https://www.crunchbase.com/organization/yellowdog,"3D Technology, Animation, Cloud Management, Enterprise Software, Financial Services, SaaS, Scheduling, Software",YellowDog is the only predictive and intelligent scheduling & orchestration platform.,"YellowDog enables companies across the globe to accelerate and optimise complex data processes with the only intelligent and predictive scheduling and orchestration platform for hybrid and multi-cloud management. We serve organisations in Financial Services, Aerospace, and CGI amongst others. The technology automates the selection of the best source of compute for every workload, delivering new levels of prediction and efficiency in cost and performance optimisation."
Yelp,https://www.crunchbase.com/organization/yelp,"Apps, Internet, Mobile, Search Engine",Yelp operates an online platform that connects people with local businesses.,"Yelp operates an online platform that connects people with local businesses. Its platform covers various local business categories, including restaurants, shopping, beauty and fitness, arts, entertainment and events, home and local services, health, nightlife, travel and hotel, auto, and others categories.  Yelp was launched in 2004 and is headquartered in San Francisco, California."
Yerdle Recommerce,https://www.crunchbase.com/organization/yerdle,"Collaborative Consumption, E-Commerce, Marketing, Retail",The world’s most innovative brands trust Yerdle to run their resale platforms.,"The resale market is growing 24X faster than retail as a whole and is expected to reach $51B in 2023. The growing market is evidence of a seismic shift in retail with 33% of Millennials and GenZ now shopping resale. Yerdle’s end-to-end technology and logistics platform provides a white label solution for brands ready to take back their secondary market from emerging online competitors.  Yerdle empowers brands to reach new customers and deepen existing relationships —while developing more sustainable, circular business practices. Based in the San Francisco Bay Area, Yerdle is the leader in branded resale managing programs for innovative brands including Patagonia, Eileen Fisher, and REI."
Yeahmobi,https://www.crunchbase.com/organization/yeahmobi,"Ad Network, Apps, Mobile, Mobile Advertising",Yeahmobi is an intelligent mobile advertising platform.,"Yeahmobi is an intelligent mobile advertising platform designed to help mobile technology companies reach global growth, acquire active users and monetize inventory. Headquartered in China, Yeahmobi has offices in the US, Germany, Japan and Korea. Yeahmobi operates in the field of consumer apps, mobile games, cross-border e-Commerce, internet finance, lifestyle, travel and numerous other industries, covering over 200 countries and regions, and delivering global coverage at large scale."
Year & Day,https://www.crunchbase.com/organization/year-day,"Home Decor, Retail, Retail Technology","Simplified shopping for table settings made for the years, days & dishwasher loads of life.",
Yemeksepeti,https://www.crunchbase.com/organization/yemeksepeti,"E-Commerce, Food Delivery, Restaurants",Yemeksepeti is Turkey's first online food ordering site enabling users to order food from their favorite restaurant through the internet.,"Yemeksepeti is Turkey's first and biggest online food ordering site enabling users to order food from their favorite restaurant through the internet. The company operates in 58 provinces and has partnered with nearly 8,000 restaurants in providing its services. The portal provides customers direct access to their favorite restaurant and have their food delivered to their door step within 30-45 minutes.  The company later on expanded to the Middle East with their global brand Foodonclick.com and currently serves in the UAE, Oman, Qatar, Saudi Arabia, Lebanon and Greece."
Year Up,https://www.crunchbase.com/organization/year-up,"Education, Non Profit, Training","Year Up is an organisation that provides urban young adults with the skills, experience, and support to reach their potential.","Year Up's mission is to close the Opportunity Divide by providing urban young adults with the skills, experience, and support that will empower them to reach their potential through professional careers and higher education."
Yellowbrick,https://www.crunchbase.com/organization/qubed,"Career Planning, EdTech, Higher Education, Media and Entertainment, Universities",Empowering the next generation of talent to achieve their calling by tapping into passion points,"Yellowbrick's mission is to empower the next generation of talent to achieve their calling by tapping into passion points that spark success, fuel personal advancement, and unlock doors to fulfilling careers. With integrated partnerships across top-tier educational institutions and brands, our courses and experiences put learners on a path toward doing what they love. Find out more at www.yellowbrick.co."
"Yes To, Inc.",https://www.crunchbase.com/organization/yes-to-inc,"Beauty, Product Search","YES TO is a supplier of natural beauty products, formulas, and unique collections across the world.","YES TO is a supplier of natural beauty products, formulas, and unique collections across the world."
YellowHeart,https://www.crunchbase.com/organization/yellowheart,"Blockchain, Media and Entertainment, Software",Ticketing Blockchain,Ticketing Software Built by Artists for Fans
YEAY,https://www.crunchbase.com/organization/yeay-gmbh,"E-Commerce, Mobile Apps, Video",YEAY provides product reviews and recommendations.,"YEAY is a quickly-growing new video e-commerce experience that is redefining what it means to buy and sell on a mobile device. They make shopping fun and entertaining, allowing everyone to buy with a swipe. With this app in hand, anyone with a smartphone can buy and sell products while at the same time consuming entertaining full-screen vertical videos. YEAY is a pioneering addition to the digital space. Founded by entrepreneur Melanie Mohr in 2016 and backed by an international team of investors, YEAY has become one of the fastest growing start-ups in Berlin."
YEGO,https://www.crunchbase.com/organization/yugo,"Last Mile Transportation, Mobile Apps, Transportation","Self-driven vehicle-sharing platform. Launched in Barcelona, Valencia, Bordeaux. Download the YEGO App!",
Yepstr,https://www.crunchbase.com/organization/yepstr,"Apps, Insurance, Payments",Yepstr connects private individuals and companies that are in need of extra help with Sweden's most driven youth.,"Yepstr connects private individuals and companies that are in need of extra help with Sweden's most driven youth. Yepstr helps with everything from payment, insurance, and taxes so you get more time for other things."
Yeti,https://www.crunchbase.com/organization/netbeast,"Mobile Apps, Smart Home",Yeti connects all your smart devices to simplify the control of your home.,"Yeti connects all your smart devices to simplify the control of your home. Yeti lets you control, automate and monitor all your smart devices from anywhere, anytime. It supports a wide range of smart home devices from lights and wireless speakers to heating and security solutions, offering you comfort, security and convenience. Home automation with Yeti equals the best connected-living experience.  "
Yellow Door Energy,https://www.crunchbase.com/organization/yellow-door-energy,Renewable Energy,Yellow Door Energy is a UAE-based leading solar developer.,A performance-based long-term contract which does not expose you to any technical or performance risk on your solar plant.Yellow Door Energy manages all stages of the solar plant and you pay a monthly solar bill once the solar plant starts producing electricity
Yellow,https://www.crunchbase.com/organization/yellow,"Bitcoin, Internet, Software",Aims to solve the Middle East’s payment challenges using Bitcoin.,"Yellow is a startup founded between the Middle East and San Francisco, working to solve two hard, but related, problems: Payments & Bitcoin adoption. The Middle East is notorious for its poor payment and money transfer options (it's still a cash-based society); and Bitcoin is taking the world by storm, and starting up in the region. Yellow is combining both to provide game-changing payment solutions in a region in desperate need of innovation. Yellow's first product is a Bitcoin payment processor. Simply, Yellow enables businesses to accept Bitcoin for payment from anywhere in the world, while eliminating the risk and complexity in doing so."
Yebhi,https://www.crunchbase.com/organization/yebhi,"E-Commerce, Fashion, Gift Card, Jewelry, Mobile, Shoes, Shopping, Sports","India’s leading Online Shopping site for Shoes, Apparels, Accessories, Home, Mobiles & More.","Yebhi.com went live in 2010 and is the fastest growing company in the lifestyle category in India. It powered the sale of multi brand Footwear online. Enormous success in the footwear category inspired us to expand into other categories like Apparels, Accessories, Bags, Jewelry and Mobiles. Yebhi continue to power ahead with your support! Our Mission is: To provide best value for money to yebhi customers To provide fastest shipping for our customer orders To provide widest range of choices for our customers To enable our brand partners to reach the widest audience To enable us meet our mission, we undertake some unique tasks in the industry yebhi source all our products from Brands directly or authorized agent of the brand. Yebhi don't buy products without brand authorization Yebhi run our own warehousing operations to enable us to fulfill your orders completely and achieve fastest shipping in the industry"
Yellowdig,https://www.crunchbase.com/organization/yellowdig,"E-Learning, EdTech, Education, Higher Education, Knowledge Management, SaaS","Education Technology platform, SaaS.  An online learning experience driven by peer collaboration, gamification, and data science.","Yellowdig's software platform creates a social layer on top of existing enterprise learning systems used by colleges, universities, and organizations. Unlike pre-existing social technology, Yellowdig is designed for higher education institutions. The platform provides instructors and learners with a private and secure experience, controlled and protected within the institution's designated environment.   Why Yellowdig? Students live online. Meet them where they already are. Genuine. Organic. Student-driven. A better approach to online learning."
YesGraph,https://www.crunchbase.com/organization/yesgraph,"Analytics, Developer APIs, Enterprise Software, Software",YesGraph can boost your company's growth with high-performance invite and referral flows.,YesGraph can boost your company's growth with high-performance invite and referral flows that leverage social graph analysis and an optimal user interface to acquire the best new users.
Yeahka,https://www.crunchbase.com/organization/yeahka,"Finance, FinTech, Mobile Payments",Yeahka is a Chinese company providing mobile payment solutions and related operational services for mobile e-businesses.,"Yeahka is a Chinese mobile payment service provider. Yeahka is committed to providing mobile payment solutions and related operational services for mobile e-businesses. It has developed a merchant-oriented mobile payment product named Leshua Business Version, which provides small businesses with convenient mobile payment services. Yeahka’s team is composed of senior personnel from famous internet and communications companies in China. With profound experience in the payment industry, Yeahka made huge progress in key technologies in mobile payment such as QR code payment technology, NFC payment technology, and independently developed JCVM technology."
Yeehoo Group,https://www.crunchbase.com/organization/yeehoo-group,"Baby, Manufacturing, Product Design","YEEHOO GROUP.INC is a company focused on the design, manufacturing, and sales of high quality infant clothing and more.","YEEHOO GROUP.INC (广州英爱贸易有限公司) is a company focused on the design, manufacturing, and sales of high quality infant clothing, as well as distributing well know maternal and infant products. Its private brands are YEEHOO and Bukangfu, in which YEEHOO is the well-recognized brand in the domestic infant and child clothing industry. It owns more than 10 series and 3000 kinds of products from infant's wear, clothes, bedding, lathe, bath&skin care products, feeding supplies, toys, household & bedding products, maternity supplies, and more. YEEHOO GROUP.INC was founded in 1995."
Yeecall,https://www.crunchbase.com/organization/yeecall,"Developer Platform, Enterprise Software, Service Industry",Yeecall is a software company that has developed Yeecall messenger app for video & voice calling.,Yeecall is a software company that has developed Yeecall messenger app for video & voice calling.
YesWeHack,https://www.crunchbase.com/organization/yeswehack,"Cyber Security, Information Technology, Security",Creating different services for projects and organizations to find security experts to improve their security perimeter,
YellowKorner,https://www.crunchbase.com/organization/yellowkorner,"Art, E-Commerce, Photography, Social Network",YellowKorner is the global leader in distribution of art photographs.,"YellowKorner was created in 2006 by two friends, Alexandre de Metz and Paul-Antoine Briat, both lovers of photography from a young age. The YellowKorner concept is very simple: to introduce the greatest photographers from all over the world and to increase the number of copies of their work to make it accessible to as many collectors as possible. So, instead of offering 10 prints at 5,000 euros, YellowKorner chooses to publish 500 at 100 euros."
YesVideo,https://www.crunchbase.com/organization/yesvideo,"Cloud Storage, Photo Sharing, Video",The world’s leading service provider in personal video and photo digitization,"YesVideo, the world’s leading service provider in video and photo digitization, has served over 10 million families since 1999. Our services are available through major retailers, such as Costco, Sam’s Club, Walmart, CVS, Bartell Drugs, and online at YesVideo.com and LegacyRepublic.com. All media transfer orders are processed in the USA. YesVideo is headquartered in Santa Clara, CA, with our production factory in Norcross, GA. YesVideo also licenses our technology internationally, with operations in Canada, Germany, India, Japan, Portugal and the Netherlands."
"Yet Analytics, Inc.",https://www.crunchbase.com/organization/yet-analytics-inc-,"Analytics, Big Data, Internet, Machine Learning",Tools and solutions used to improve learning and talent development.,"Yet Analytics provides tools and solutions used to improve learning and talent development. Yet’s products are used by organizations in Education, Corporate L&D, and Defense to assess engagement and to provide visibility into the learning experience. Yet’s products enable insight across learning ecosystems, including visibility into role readiness and career pathing. Yet’s products provide a way to engage with curated learning experiences that align with performance outcomes. From learning analytics to data logistics, Yet Analytics helps transform learning experience into business intelligence."
Yellowsack,https://www.crunchbase.com/organization/yellowsack,Transportation,Yellowsack provides a flexible and portable waste removal alternative and a pickup service for users to save time and money.,
Yepzon,https://www.crunchbase.com/organization/yepzon,"Child Care, Local, Location Based Services, Mobile, Parenting",Yepzon is a safety technology company that develops mobile location solutions for customers in the European Union and United States.,"Yepzon™ is a leading location device manufacturer and service provider. Providing consumers and the enterprise market with an unparalleled system incorporating three integrated location capturing technologies. Yepzon has used $3.7 million in funding since 2013 to become a market leader.  Yepzon™ provides the simplest positioning devices and services on the market. Yepzon™ devices have the capability to utilize all three location capturing technologies: GPS, WiFi and 3G, the  biggest advantage over the competition. Indoor positioning and Google database utilization advance Yepzon™ to the forefront of the location technology device market.  Yepzon was incorporated in 2013 and is based in Tampere, Finland."
Yeeply Mobile,https://www.crunchbase.com/organization/yeeply-mobile,"App Marketing, B2B, Crowdfunding, Mobile, Mobile Apps, Outsourcing, UX Design, Web Development",A marketplace to find the best mobile & web talent,"Yeeply is a worldwide network of top software engineering, design, and marketing talent - available to help companies adapt, develop, and expand. With hundreds of certified teams and 1,000+ successfully completed projects, Yeeply has established itself as a strong market leader in the web, app, and software development industry. Thanks to Yeeply's AI algorithm, the technological needs of hundreds of companies are analysed every month and matched with the most suitable certified professionals. The majority of Yeeply's clients are SMEs who are looking for advice in order to prevent making poor technological decisions. The Yeeply network includes freelancers, development teams and agencies in more than 40 countries. To be accepted into the network, all talent must pass a screening process to verify professional,  technical and communication skills. References are validated and after completing one of the smaller projects, to prove their skills and abilities, they get officially certified."
