Organization Name,Organization Name URL,Categories,Description,Full Description
General Electric (GE),https://www.crunchbase.com/organization/general-electric,"Electronics, Energy, Energy Management, Finance, FinTech, Manufacturing",General Electric Company offers infrastructure and financial services worldwide.,"General Electric Company offers infrastructure and financial services worldwide. It operates in various segments, including power and water, oil and gas, energy management, aviation, healthcare, transportation, appliances and lighting, GE capital, and more. Its power and water segment offers gas, steam and aeroderivative turbines, nuclear reactors, generators, combined cycle systems, controls, and related services; wind turbines; and water treatment services and equipment. Its oil and gas segment provides surface and subsea drilling and production systems, equipment for floating production platforms, compressors, turbines, turboexpanders, reactors, industrial power generation, and auxiliary equipment. The company’s energy management segments offers plant automation hardware, software, and embedded computing systems. Its aviation segment offers jet engines; aerospace systems and equipment; and replacement parts and repair and maintenance services. The healthcare segment provides medical imaging, software and information technology (IT), patient monitoring and diagnostics, drug discovery, biopharmaceutical manufacturing technologies, and performance improvement solutions. Its transportation segment offers freight and passenger locomotives, and diesel engines for rail, marine, and stationary power applications; railway signaling and communications systems; underground mining equipment; motorized drive systems; IT solutions; and replacement parts and value added services. The appliances and lighting segment manufactures home appliances; and lighting products for commercial and industrial applications. Its capital segment offers commercial loans and leases, fleet management, financial programs, credit cards, personal loans, and other financial services. General Electric Company was founded in 1892 and is headquartered in Fairfield, Connecticut."
Genesys,https://www.crunchbase.com/organization/genesys,"Business Intelligence, Call Center, Cloud Infrastructure, Contact Management, CRM, Customer Service, Enterprise Software, SaaS, Software, Text Analytics",Genesys is a global leader in providing omnichannel customer experience (CX) and contact center solutions in the cloud and on-premises.,"Genesys® powers more than 25 billion of the world’s best customer experiences each year. Their success comes from connecting employee and customer conversations on any channel. Every day, 11,000 companies in more than 100 countries trust the industry’s #1 customer experience platform to drive great business outcomes and create lasting relationships. Combining the best of technology and human ingenuity, Genesys builds solutions that mirror natural communication and work the way you think. Their industry-leading solutions foster true omnichannel engagement because they perform equally well across channels, on-premise and in the cloud. Experience communication as it should be: fluid, instinctive and profoundly empowering."
GetYourGuide,https://www.crunchbase.com/organization/getyourguide,"Internet, Tourism, Travel","GetYourGuide operates an online platform for booking tours, attractions and activities worldwide.","GetYourGuide operates an online platform for booking tours, attractions, and activities worldwide. It offers tourist services online via the Internet and mobile applications.  Jochen Mattes, Johannes Reck, Martin Sieber, Pascal Mathis, Tao Tao, and Tobias Rein founded GetYourGuide on June 1, 2009. It has its headquarters in Berlin in Germany with additional offices in North America and Europe."
Getaround,https://www.crunchbase.com/organization/getaround,"Car Sharing, Collaborative Consumption, Mobile, Peer to Peer, Transportation",Getaround empowers people to instantly rent and drive great cars shared by people in their city.,"Getaround empowers users to instantly rent and drive great cars shared by people in their city. Cars can be rented by the hour, or the day, with a $1M insurance policy and 24/7 roadside assistance included. By using the Getaround app, people skip the lines and paperwork at traditional rental car counters, and the hassle of buying and maintaining a car. Powered by Getaround ConnectTM, the patented connected car technology, Getaround creates a fun and safe carsharing experience is without the need to meet the car owner, carry an access card, or coordinate picking up a car key. People share everything from a Prius to a Tesla and earn thousands in extra income each year, offsetting the high cost of car ownership while also making a positive impact on the environment.   Headquartered in San Francisco, Getaround has thousands of cars available throughout major metropolitan areas across the United States. Existing investors in Getaround include Menlo Ventures, Braemar Energy Ventures, Asset Plus, Triangle Peak Partners, SPARX Group, Toyota Motor Corporation, Cox Automotive Inc., and SAIC Capital."
Getaway,https://www.crunchbase.com/organization/getaway-2,"Hospitality, Rental, Rental Property, Travel",Getaway is a wellness hospitality company that offers cabin rentals in natural landscapes.,"Getaway is a wellness hospitality company that offers cabin rentals in natural landscapes. The company's experiences are more than the beautiful tiny house nestled in the woods—it’s about disconnecting and living in the present moment. It’s about learning to live without your cell phone (pack it away in our phone lockboxes) and rediscovering the art of a good conversation. It’s about tuning out the endless noise of society today and listening to the great outdoors.  Getaway's mission is to offer an experience worth coming straight back to: deep and simple enough to help you find yourself, revel in nature, and rekindle the connections most important to you. We’ll provide the basics; the rest is up to you. Outposts are located within about a two-hour drive of major metro cities—far enough to disconnect but close enough for a spontaneous escape. Getaway currently operates three outposts outside New York, Boston and Washington, DC."
GetAccept,https://www.crunchbase.com/organization/getaccept,"Artificial Intelligence, Document Management, E-Signature, Machine Learning, SaaS, Sales Automation",GetAccept is an AI-based eSignature & document tracking platform.,"GetAccept is the solution you need to reach the full potential of sales process. They are reinventing the Document and eSigning Workflow through intelligent automation, personalized recipient engagement, and the easiest digital signature on the market. GetAccept helps you create and send documents that stand out against  competition. GetAccept is an electronic signature and document tracking platform, but for the closing stages of sales cycle. Combine document tracking with eSigning and use machine learning to predict the next action needed to get the document signed. Enterprise features include video-introduction, automated live-chat, connected calls, and deal based display remarketing."
General Dynamics,https://www.crunchbase.com/organization/general-dynamics,"Aerospace, National Security, Public Transportation","General Dynamics is a defense industry contractor for shipbuilding, marine, combat and defense systems and, munitions.","General Dynamics is involved in business aviation; land and expeditionary combat vehicles and systems, armaments, and munitions; shipbuilding and marine systems; and mission-critical information systems and technologies.  General Dynamics has four main business segments.  Aerospace designs, develops, manufacturers and services a comprehensive offering of advanced business-jet aircraft.  Combat Systems specializes in producing, supporting and sustaining land and expeditionary combat systems for the U.S. military and its allies.  Marine Systems designs, builds and supports submarines and a variety of surface ships for the U.S. Navy and commercial customers.  The Information Systems and Technology group offers a breadth and depth of technology and service capabilities that support a wide range of government and commercial needs, including systems integration expertise; hardware and software products; and engineering, management and support services."
genneve,https://www.crunchbase.com/organization/genneve,"Communities, Consumer, Fitness, Health Care, Information Technology, Marketplace",genneve is a digital health platform for women in midlife,"genneve, a digital health company for women in midlife & menopause. genneve increases accessibility to information, health providers and community for women seeking relief for hormone-driven symptoms like hot flashes, insomnia, anxiety and loss of libido.   Every woman will experience menopause which lasts 4-10 years, costing her on average $20k through trial-and-error spending on prescriptions, doctor visits, treatments, devices and products.    As a cloud-based health concierge and community, genneve uses data and behaviors to help women find relief and answers-all within a trusted network. "
Gett,https://www.crunchbase.com/organization/get-taxi,"Apps, Delivery, Logistics, Ride Sharing, Transportation",Gett is an on-demand transportation and delivery company that offers a ride hailing app.,"Gett was built on a simple idea – “if you treat drivers better, they will treat riders better”. Fueled by the very best drivers, Gett sets the standard for quality. Available in more than 120 cities worldwide, including London, Moscow and New York, Gett is Europe's largest on-demand car service company by revenues. Gett is the global leader in the corporate on-demand transportation market. Gett business' solutions is the only global corporate transport solution, enabling companies and riders to book rides and track expenses worldwide through a single platform.  It is already used by more than 20,000 companies worldwide who book and track transportation services in over 1,000 cities and 56 countries. Gett sells $1bn+ of mobility services per year, half of which is generated in NYC and London. Due to its lucrative B2B services, Gett is already contribution-margin profitable across all of its markets, and is on track to become operationally profitable globally in Q1, 2019. Gett raised more than $700M in total funding, with $300M+ coming from the world’s #1 carmaker, The Volkswagen Group. In 2018, Gett officially became a ""Unicorn"", valued at $1.4 billion."
Getty Images,https://www.crunchbase.com/organization/gettyimages,"Digital Media, Image Recognition, Photography","Getty Images is a creator and distributor of award-winning still imagery, video, music, and multimedia products.","Getty Images is a creator and distributor of award-winning still imagery, video, music, and multimedia products, as well as other forms of premium digital content, available through its trusted house of brands, including iStock© and Thinkstock©. With its advanced search and image recognition technology, Getty Images serves business customers in more than 100 countries and is the first place creative and media professionals turn to discover, purchase and manage images and other digital content. Its best-in-class photographers and imagery help customers produce inspiring work which appears every day in the world’s most influential newspapers, magazines, advertising campaigns, films, television programs, books and online media. Mark Getty and Jonathan Klein founded Getty Images in 1995 with the goal of turning a disjointed and fragmented stock photography market into a thriving, modernized industry able to meet the changing needs of visual communicators. It was the first company to license imagery via the web, moving the entire industry online – and have continued to drive the industry forward with breakthrough licensing models, digital media management tools and a comprehensive offering of creative and editorial imagery, microstock, footage and music."
Genie AI,https://www.crunchbase.com/organization/ginie-ai,"Artificial Intelligence, Information Technology, Knowledge Management, Legal, Machine Learning, Software",Automatic legal contract drafting platform for anyone.,"Genie AI has developed an artificial intelligence platform called SuperDrafter® that empowers lawyers to draft contracts using the entire knowledge of the firm. Its AI semantically understands legal contracts, enabling us to become the bridge towards smart contracts on the blockchain. The company also provides educational talks and practical training on smart contracts through the use of artificial intelligence."
GetFeedback,https://www.crunchbase.com/organization/getfeedback,"Customer Service, Enterprise Software, Market Research, Software","GetFeedback helps companies understand and improve customer experience by making it easy to create beautiful, branded surveys.","GetFeedback's mission is simple: to help companies understand and improve their customer experience with beautiful, easy-to-use software. Salesforce executives [Kraig Swensrud](/person/kraig-swensrud) and [Sean Whiteley](/person/sean-whiteley-2) founded GetFeedback in 2013, and today it’s the trusted survey provider of some of the world's most innovative brands.  GetFeedback has grown to become the leader in customer experience surveys for the Salesforce ecosystem. GetFeedback is now the top-rated customer feedback solution on the Salesforce AppExchange, and was recently recognized as a leader in survey software by G2Crowd."
Geek+,https://www.crunchbase.com/organization/geek,"Industrial Automation, Logistics, Robotics, Warehousing",Geek+ is a logistics and warehousing robotics developer.,"Geek+ has delivered the largest numbers of logistics robots among its peers in China.  The company's customers include e-commerce platforms, third-party logistics providers, express delivery companies, offline retailers and manufacturers of apparels, pharmaceuticals, automobiles and electronics products. Geek+ has also established strategic partnerships with a number of key customers to co-develop customized AI and robotic solutions across different industries and applications."
Genies,https://www.crunchbase.com/organization/blend-systems,"Media and Entertainment, Mobile, Mobile Apps",Genies is a mobile app company that allows users to clone themselves.,Genies is a mobile app company that allows users to clone themselves. Genies is considered emerging as the top competitor to Snapchat’s wildly popular Bitmoji.
Generate Capital,https://www.crunchbase.com/organization/generate-capital,"Financial Services, IaaS, Renewable Energy, Solar, Sustainability","Generate Capital is a finance company based in San Francisco, California.","Generate Capital is a finance company based in San Francisco, California. Its partners with project developers and technology manufacturers globally to finance sectors in renewable energy, technology, finance, and sustainability sectors."
GenWorth,https://www.crunchbase.com/organization/genworth,"Finance, Financial Services, FinTech","Genworth is an insurance company that is dedicated to help people secure their financial lives, families, and futures.","Genworth Financial, Inc. (NYSE: GNW) is a Fortune 500 insurance holding company dedicated to helping people secure their financial lives, families, and futures. Genworth has leadership positions in offerings that assist consumers in protecting themselves, investing for the future, and planning for retirement. In addition, the company is a global leader in managing mortgage default risk. Genworth’s Global Mortgage Insurance Division works with lender partners, regulators, and policy leaders to help more people responsibly achieve and maintain the dream of homeownership. In doing so, it promotes stronger and more sustainable communities around the world. By combining its global experience in mortgage guarantees with technology and service leadership, Genworth delivers innovation to the housing marketplace."
Genmab,https://www.crunchbase.com/organization/genmab,"Biotechnology, Health Care, Medical",Genmab is a biotechnology company focused on developing fully human antibody therapeutics for the potential treatment of cancer.,"Genmab is an international biotechnology company focused on developing fully human antibody therapeutics for the potential treatment of cancer. Genmab's discovery, development, and manufacturing teams are using cutting-edge technology to create and develop products to address unmet medical needs. Its primary goal is to improve the lives of patients who are in urgent need of new treatment options."
Genapsys Inc.,https://www.crunchbase.com/organization/genapsys,"Biotechnology, Genetics, Health Diagnostics, Information Technology, Medical",GenapSys has developed a novel DNA sequencing technology and detection system for applied genomic testing and medical sequencing.,"Although generations of DNA sequencers have been introduced since the late 1980s, significant limitations still exist in present day DNA sequencing technology. The customer dilemma is that they must choose among expensive sequencers that require high levels of samples to be run at once or systems that offer much lower error rates. Genapsys Inc. is ushering a new era of applied genomic testing with the introduction of its GENIUS™ DNA Sequencing systems.   At the intersection of biology and technology, Genapsys has developed an innovative system to democratize access to genetic testing for everyone.  As we enter a multi-decade era based on the use of genomics, many industries will be revolutionized such as drug discovery and diagnostics.  To achieve this goal, an enabling tool is needed, as what happened in the computer industry with the introduction of the PC, which accelerated the transition from mainframe to mobile.   Genapsys products enable this revolution by dramatically addressing the high cost of product acquisition, run cost, turnaround time and the operational tediousness that constrains the utility of DNA sequencing today. We have developed a cost-effective, affordable, easy-to-use genetic testing system based on a proprietary technology. Our goal is simple: Impact. We believe the tool that can read the code of DNA easily, inexpensively and accessible to anyone, is one of the most meaningful devices of the 21st century and this technology will dramatically shape the lives of both current and future generations.  Join us to change the world of healthcare and diagnostics through accessible genomic information. "
Getsafe,https://www.crunchbase.com/organization/safe,"Insurance, InsurTech, Mobile Apps",Getsafe is a mobile first insurance company for the digital age.,"Founded in 2015, Getsafe is one of the pioneers in the European InsurTech scene. Having started with a mobile insurance manager for over 20´000 customers, Getsafe is now evolving to an insurance company. Following a multi-line insurance approach, Getsafe offers combinable modules to protect all important areas of a person’s life. Customers can adapt their coverage to new life situations within seconds, as well as file claims via app."
Geru,https://www.crunchbase.com/organization/geru,"Consumer Lending, Credit, Finance, FinTech, Internet, Personal Finance","Geru is a simple, fast, fair, and cost-effective online loan platform that connects borrowers and investors.","Geru is a Brazilian lending marketplace created in 2013 offering personal unsecured term loans for prime and near prime borrowerers through a fast, simple, and transparent online experience. Lending operations started in 2015. Developed and started Brazil’s fully digital payroll loan product in 2018. Geru developed its own credit score model using unstructured data. Rates are lower than market and vary from 25% to 80% p.a., depending on the applicant’s score. The company is based in São Paulo, Brazil."
GetSwift,https://www.crunchbase.com/organization/getswift,"Analytics, Delivery, iOS, Mobile, Productivity Tools, Real Time, Task Management, Transportation",GetSwift is a smart delivery platform.,"GetSwift is a smart delivery platform that allows you to manage drivers, dispatch tasks, and track goods delivery all in real-time."
Gem,https://www.crunchbase.com/organization/gem-software,"Internet, Recruiting, Software","Gem is an all-in-one recruiting platform that integrates with LinkedIn, Gmail, and Outlook, and your ATS.","Gem (previously ZenSourcer) is an all-in-one recruiting platform that integrates with LinkedIn, Gmail & Outlook, and your ATS. It enables world-class recruiting teams to find, engage, and nurture top talent. Recruiters use Gem to build lists of people to reach out to, find an email, and automate follow-ups. Gem saves time, doubles response rate, and gives visibility into what’s working. Teams use Gem to collaborate on candidates, discover best practices, and never reach out to the same person twice. Managers unlock visibility into their team’s pipeline because every touchpoint is automatically tracked. And everything syncs to your applicant tracking system with best-in-class data integrity."
Get Spiffy,https://www.crunchbase.com/organization/get-spiffy,"Consumer, Internet, Mobile Apps",On-demand car wash and detailing service.,"A team of experienced Triangle, NC entrepreneurs are building the World's first on-demand smartphone-powered technology-enabled mobile car wash and detailing service. Schedule your wash in under a minute using our app or website and we come to you! All payment and communication is handled via the app so that it is super-convenient. Also at Spiffy we care deeply about the environment and all of our washes are 100% eco-friendly. We recycle 100% of the water and leave zero run-off."
Genome Medical,https://www.crunchbase.com/organization/genome-medical,"Genetics, Health Care, Life Science",Genome Medical is an early-stage company using telemedicine to integrate genomic medicine into everyday health care.,"Genome Medical is a network of genomics services experts using telemedicine to integrate genomic insights into everyday health care. As genetic information becomes increasingly important in medicine, there are too few experts to meet the growing demand for interpretation. Genome Medical's mission is to bridge the gap between genomic technology and medical practice by creating a scalable, efficient model for lifelong genome-centered health care."
General Atomics,https://www.crunchbase.com/organization/general-atomics,"Energy, Energy Efficiency, Wireless","General Atomics develops technology solutions for defense, energy, and transportation applications worldwide.","General Atomics develops technology solutions for defense, energy, and transportation applications worldwide. The company’s defense solutions comprise aircraft launch and recovery systems; energy solutions include nuclear energy, nuclear fuel, and alternative energy; transportation solutions comprise magnetic levitation (maglev) systems, including urban maglev systems, electromagnetic cargo conveyors, and high-speed maglev systems as well as linear motor systems for civil transportation applications. General Atomics also offers unmanned aircraft systems and sensors as well as training and support services. In addition, the company offers various commercial products, including capacitors, terminal automation products, radiation monitoring systems, deicing products, diagnostic enzymes, electrostatic oil separator systems, nirvana storage products, fusion technology products, research reactor control systems, products for cleanroom services, and algae for aquaculture as well as integrated drive systems, power inverters, and permanent magnet motors. Further, it offers education outreach programs, which include elements that support fusion energy research and development as well as general science education. General Atomics was founded in 1955 and is headquartered in San Diego, California with additional offices in Newport News, Virginia; Lakehurst, New Jersey; and Washington, D.C. It also has operations in Berlin and Dresden, Germany; Adelaide, Australia; Denver, Colorado; Los Alamos, New Mexico; Oklahoma City, Oklahoma; Tupelo, Mississippi; Ogden, Utah; and Washington, District of Columbia."
Genomatica,https://www.crunchbase.com/organization/genomatica,"Chemical Engineering, CleanTech, Renewable Energy",Genomatica manufactures sustainable chemicals from renewable feedstocks.,"Genomatica is a widely-recognized leader in bioengineering and aims to lead a transition to more sustainable materials. It develops bio-based process technologies that enable a better way to produce widely-used chemicals, from alternative feedstocks, with better economics, sustainability and performance. Genomatica has earned widespread acclaim for its technology; has commercialized processes for the chemical butanediol (for biodegradable plastics and apparel) and for butylene glycol (cosmetics and personal care); and is working on bio-nylon. Awards include the Kirkpatrick Award, for “the most noteworthy chemical engineering technology commercialized in the world” and the ICIS Innovation Award for its Brontide(TM) butylene glycol."
