Organization Name,Organization Name URL,Categories,Description,Full Description
Zygo Communications,https://www.crunchbase.com/organization/zygo,"Mobile, SMS","Zygo is a mobile service for groups of people in the real world, and a mobile media platform for the brands that want to reach them.","[Zygo](http://www.zygohubs.com) is a mobile service for groups of people in the real world, and a mobile media platform for the brands that want to reach them.  Zygo's   patented service assigns a unique new number to any group of people through which anyone in that group can contact the whole group on their mobiles instantly."
Zyman Group,https://www.crunchbase.com/organization/zyman-group,"Advertising, Marketing",Zyman Group is a marketing and communications strategy firm for helping companies win and to grow profitably.,Zyman Group is a marketing and communications strategy firm for helping companies win and to grow profitably.
Zykis,https://www.crunchbase.com/organization/zykis,"Automotive, Cyber Security, Education, Public Relations","Zykis focuses on providing a safe environment for children to communicate, learn, play, and express their ideas on the internet.","Zykis was founded in October 2006. The company's main area of focus is to provide children a safe environment for them to communicate, learn, play, and express their ideas on the Internet.   Zykis also provides a publishing platform for users that wish to discuss a range of child topics dealing with safety, education, family, growing up, personal stories, in the news, and fashion."
Zybo Tracking Solutions,https://www.crunchbase.com/organization/zybo-tracking-solutions,"Enterprise Software, Incubators, Publishing",Zybo Tracking Solutions,"Zybo Tracking Solutions, a start-up incubated in KSIDC’s business incubation centre KSIDC has started its second incubation centre named Startup Zone at Inkel Tower II, Angamaly. There are plans to open a third incubator at UL Cyberpark at Kozhikode, she said, adding that the company is assisting various colleges to set up incubation centres in their campuses to promote the entrepreneurial culture among the students."
Zypt,https://www.crunchbase.com/organization/zypt,"Fitness, Health Care, mHealth",Mobile Health and Fitness Devices,"Zypt was founded by an interdisciplinary group of people that has united to make our vision for the medical world a reality. From product designers, engineers, doctors, patients, and business leaders, we are all collaborating to bring our vision to life because health care is a global problem and we want to make sure everyone can obtain better health through technology. Our vision is to revolutionize the entire health and fitness industry by eliminating the barriers between you, your health, and your doctor from virtually anywhere in the world."
Zytoservice,https://www.crunchbase.com/organization/zytoservice,Health Care,Zytoservice is a manufacturer of patient-specific parenteral infusion fluids.,"Zytoservice is a manufacturer of patient-specific parenteral infusion fluids. Zytoservice mainly supplies infusion solutions to pharmacies, hospitals and oncology departments for outpatient treatment."
Zyber Secure Mobile Solutions Inc.,https://www.crunchbase.com/organization/zyber-secure-mobile-solutions-inc,"Cyber Security, Information Services, Information Technology",Zyber is a technology agnostic solution for seamless data sharing with uncompromised data security,
Zynk Mobile,https://www.crunchbase.com/organization/zynk-mobile,"Content, Content Delivery Network, Information Technology",Zynk is a multimedia content delivery platform for mobile devices.,"Zynk is a multimedia content delivery platform for mobile devices, enabling companies to share information in a variety of formats. The company was acquired by Zenvia in 2013."
Zympi,https://www.crunchbase.com/organization/zympi,"Advertising, Apps, Internet of Things, Location Based Services, Mobile, Web Hosting",Zympi is a Southern California based Corporation provides Patent pending white label marketing solution.,"Zympi enables marketers to collect and view big mobile data that delivers actionable intelligence. Our API enabled Hyper Local advertising solution offers publishers advanced ad monetization models, and allows marketers to build and target the most relevant user for their ad campaigns while protecting consumers’ privacy. By identifying favorable consumer behavior for a product or services via location specific user data for ads/promotions, we enable publishers to gain ad monetization and allow advertisers the opportunity to target their audience more intelligently.  Solution  * Real time Location based Marketing – Patent pending smart algorithms delivers insights on relevance gap in Hyper Local mobile marketing. Publishers and Location Based Mobile App developers gain access to our platform through integration of Zympi Engine with their existing ad platforms. Hyper Local targeting is based on passive consumer data profiling through analysis of their anonymous behavior and demographic data.  * Insight Reporting & Analytics – Enables partners & publishers to target most relevant demographics for specific product and services and reduce cost by proactively controlling their ad campaigns as a result of in depth reporting. * Market Segment Differentiators – Empower rich passive mobile device user data to target advertising on the mobile space, focusing on individual granularity, value-based audience reports, real-time engagement and precision."
Zytronic,https://www.crunchbase.com/organization/zytronic,"Electrical Distribution, Electronics",Zytronic are developers and manufacturers of projected capacitive technology (PCT™ & MPCT™).,"Zytronic Group are developers and manufacturers of projected capacitive technology (PCT™ & MPCT™) interactive touch sensors for applications specific to industrial, public access and self-service equipment."
Zylight,https://www.crunchbase.com/organization/zylight,"Manufacturing, Video",Zylight LLC is the leading manufacturer of intelligent LED lighting instruments for film and video production.,"Zylight was founded in 2003 with a simple mission: Bring the best and most intelligent lighting solutions to the production industry. Their products have been rigorously designed by a team of professionals with over 100 years of combined experience to make your job easier, and to get you the best results possible. From run-and-gun ENG, to Hollywood sound stages, to the frigid summit of Mt. Everest, their team and their products have been there to back you up – with tested and proven results."
Zyentia,https://www.crunchbase.com/organization/zyentia,Biotechnology,"Zyentia is a biotech company, focuses on protein folding, conformation, and aggregation at a molecular level.","Zyentia is a biotech company, focuses on protein folding, conformation, and aggregation at a molecular level. Zyentia Ltd is a leading expert in understanding the molecular determinants underlying protein misfolding, aggregation and deposition in the tissue. We apply our proprietary technologies and expertise to the development of innovative therapies for a variety of protein misfolding disorders such as Type 2 Diabetes, Alzheimer’s disease and Parkinson disease. Mortgage calculator Zyentia is actively seeking parties interested in licensing and progressing its drug discovery programmes,"
Zyantus,https://www.crunchbase.com/organization/zyantus,"Information Services, Information Technology","Provide solutions for electronic claims processing and revenue cycle optimization for medical, chiropractic and dental .","Zyantus, Inc. provides office management, claims processing, and revenue cycle optimization solutions for medical, dental, and orthodontic clinics. Its solutions include EClaims OS, an electronic insurance claims processing service; Zyantus OS Practice that assists with patient flow, scheduling appointments, capturing charges, managing accounts receivable, and electronic health records; and Zyantus OS Recrods, which assists with patient flow, appointment scheduling, charge capture, laboratory ordering, meaningful use attestation, and sharing of patient information across health information exchanges."
Zymphonies Technologies,https://www.crunchbase.com/organization/zymphonies-technologies,"Information Technology, Mobile Apps, Software, Web Design, Web Development","Zymphonies offers strategic consulting, creative design, and technical implementation services across domains of expertise web and mobile. ","Zymphonies is a leading web and mobile development firm. We offers strategic consulting, creative design, and technical implementation services across domains of expertise web and mobile. We are working with clients across the globe providing services in web and mobile application development and trusted by clients for its technical expertise and delivery excellence. We work across different industry segments however we are more inclined towards IT, Retail, Hospitality, Health care, Consumer and Manufacturing."
Zymed,https://www.crunchbase.com/organization/zymed,"Health Care, Software","Zymed develops and markets inpatient telemetry systems, cardiac analysis software algorithms, and outpatient holter.","Zymed, Inc. develops and markets inpatient telemetry systems, cardiac analysis software algorithms, and outpatient holter and cardiac event monitoring systems. It serves diagnostic monitoring markets, which include holter, telemetry, event recorder, home cardiac monitoring, intensive/coronary care units, prevention analysis, interventional cardiology, and arrhythmia and ischemia disease management."
Zynchros,https://www.crunchbase.com/organization/zynchros,Software,Zynchros is a Software company.,"Developer of pharmacy quality management software. The company offers software that automates the tasks required for Medicare Part D participation, CMS proxy list updates, USP classifications, HPMS formulary submission file and other related services to health insurers, pharmacy benefit managers and healthcare information technology vendors."
Zyng Advertising Networks,https://www.crunchbase.com/organization/zyng-advertising-networks,"Information Services, Real Estate, Software",Zyng Advertising Networks is a Developer of a proprietary software.,"Developer of a proprietary software. The company's proprietary software offers interactive advertising and information services, enabling the hospitality and entertainment industries to provide information to the public through HD LCD screens in the lobby and leisure areas."
ZypPages,https://www.crunchbase.com/organization/zyppages,"Content, Online Portals, Web Browsers",ZypPages is the world’s simplest internet posting system.,"ZypPages is the world’s simplest internet posting system. It instantly uploads any document directly from any computer and establishes the user's mobile number as the online identifier. It provides an instant and valuable online presence without any tech support.  The document can be a business or personal profile, a data sheet, a daily recipe, event details, a party plan, travel itinerary or just general information.  This simple process provides an instant and valuable online presence without any expense or tech support enabling the large under-served market of solo entrepreneurs, home busnesses and free lancers an online presence."
Zytran,https://www.crunchbase.com/organization/zytran,"Online Portals, Publishing, Web Browsers","Toronto-based Zytran Corporation's main product is Alertle, a web based feed reader.","Toronto-based Zytran Corporation's main product is Alertle, a web based feed reader."
ZyraWorks,https://www.crunchbase.com/organization/zyraworks,"Information Technology, Web Development",Web & Mobile Application Development Company,#inTechnologyWeTrust We are an independent group of tech enthusiasts with an awful lot of experience. We operate from the heart of Europe and make life easier with technology for our clients from all around the world.
Zynar,https://www.crunchbase.com/organization/zynar,Information Technology,Crowdsource Testing Covering the whole of Africa,
Zylone IT Pty Ltd,https://www.crunchbase.com/organization/zylone-it-pty-ltd,"E-Commerce, Internet, Software, Web Development","Zylone IT Pty Ltd is aprovider services of web solutions, including content management system and e-commerce.","In business since 2005, we are a Sydney based company specializing in web design and development. We provide fully customized and unique web design that suit your website best by studying your business nature, target audience, as well as your competitors.. We are a one-stop web design & development centre providing services that include graphic design, web design, web development, web hosting and internet marketing services. We pride ourselves for our dedication and attention to details on every single project presented to us. When engaging business with us, you are also signing on to these benefits:  - Customised and unique design, NO design templates, NO design reuse.  - Personalised one to one consultation (Travel limited to Sydney area, please enquire for details)  - Professional team with years of experiences and skills.  - Designers and developers from Sydney, ensuring quick response time on all changes.  - Easily contactable through Phone, Email and Live Help at our website  - Quick response within one business days (normally within hours)  - Fixed fee so you know what you expect for your money."
zymer,https://www.crunchbase.com/organization/zymer,"Information Technology, Mobile, Security, Telecommunications",ZYMER develops integrated security and mobile solutions for enterprises.,"ZYMER (자이머) develops integrated security and mobile solutions for enterprises. It is the provider of zSuite, a platform that provides security services for mobile phones. Zsuite provides a flexible and scalable platform that enables security-in-transist data. It operates on a host-client management system. ZYMER was established on May 1, 2014, and its headquarters are based in San Jose, United States.   ZYMER operates its research and development department in Seoul, Korea."
Zyagnum AG,https://www.crunchbase.com/organization/zyagnum-ag,"Biotechnology, Information Technology, Software","Biological Biopsy, Technology Company",
ZymeTx,https://www.crunchbase.com/organization/zymetx,"Biotechnology, Health Diagnostics",A development stage biotechnology company.,"ZymeTx is a development stage biotechnology company engaged in the discovery and development of unique products for the diagnosis and treatment of viruses. The scientific foundation for the Company's plan of operations is based upon the role of enzymes in the process of viral infection. The Company's strategy is:  (i) to develop therapeutic and diagnostic products for a broad range of viral diseases; and  (ii) to earn revenues from marketing ""ZstatFlu,"" The Company's first diagnostic product, to sustain a comprehensive viral therapeutic research and development program and to continue the Company's viral diagnostic research and development program."
ZYOTISH: Your Personal Astrologer,https://www.crunchbase.com/organization/zyotish-your-personal-astrologer,,Decoding Destiny Serving Humanity,
Zyrodrone Korea,https://www.crunchbase.com/organization/zyrodrone-korea,Automotive,Zyrodrone is a high-tech mobility device based on a concept of gyroscope and accelerometer.,"Zyrodrone Korea is a high-tech mobility device based on a concept of gyroscope and accelerometer, which keep balame through detecting and monitoring the center of body's wooly. This enables is to move fonvani, backward and stop comforWitly."
Zycad Corp.,https://www.crunchbase.com/organization/zycad-corp,Machinery Manufacturing,Zycad Corp. is an Industrial Machinery & Manufacturing company.,Zycad Corp. is an Industrial Machinery & Manufacturing company. It manufactures Electrical Products. Computer Software
Zynom Technologies Pvt. Ltd.,https://www.crunchbase.com/organization/zynom-technologies-pvt-ltd,"Internet, Internet of Things, Software",Zynom provides turnkey Web Solutions to various kinds of businesses operating worldwide.,
zygella,https://www.crunchbase.com/organization/zygella,"Advertising, E-Commerce, Internet, Search Engine",Zygella allows advertisers to achieve a professional and effective presence on the web and has grown into a real-time short ads service.,"Zygella allows advertisers to achieve a professional and effective presence on the web and has grown into a real-time short ads service. In case you are looking for the latest offers, deals, promotions or bargains you can find on the net zygella.com might be just the right place.  Zygella.com has been especially created with the intention of giving you the possibility to find latest information in a very simple way. In case you are looking for a totally new experience in order to make use of a highly effective deals engine, you should stop by this site. This deals engine is not only about latest products or services you can buy but also the latest trends in business. You will be able to get more info about whatever interesting products, service and website are out there at Zygella.com The site itself has a list of categories that includes ""Clothing & Fashion,"" ""Health & Beauty"" and ""Kids & Toys"" along with ""Home & Garden"", ""Holiday & Travel"" and ""Sport & Leisure."" Users have a centralised spot where they know they can procure a never-ending array of new updates or improved services and they can also explore new shops or business and find new items better then originally anticipated."
Zygote Quarterly,https://www.crunchbase.com/organization/zygote-quarterly,Product Design,Zygote Quarterly showcases the relation of science and design in the field of biologically inspired design.,
ZymiausiFotografai.Lt,https://www.crunchbase.com/organization/ymiausifotografai-lt,"Art, Content Discovery, Fashion, Photography",Find a photographer/videographer in 10 minutes. Most popular photographers and videographers of Lithuania in one place.,"ŽymiausiFotografai.Lt is an online platform that enables users to locate and receive the services of photographers. It is headquartered in Vilnius, Lithuania."
ZynosureConsulting,https://www.crunchbase.com/organization/zynosureconsulting,"Advertising, Brand Marketing, Consulting, Event Management, Lead Generation, Public Relations, SEO, Social Media","ZynosureConsulting is a marketing & technology consultancy Specialised in Branding, lead generation and business process engineering.","Marketing & Technology Consultancy offering fully integrated marketing services Specialised in Branding, lead generation and business process engineering. Services include - Digital Marketing - Social Media Management - Search Engine Optimization - Augmented Reality Activation Campaigns - Creative Services - Explainer videos - Animations and 3D modelling - Advertising - PR - Event Management - Thought leadership campaigns - Marketing partner of UNVEYL, Realtime User-Engagement platform & Market place"
ZYNK.,https://www.crunchbase.com/organization/marketing-your-app,"Advertising, Android, App Marketing, Apps, iOS, Mobile",Zynk is an exciting new social app that connects people with the same interests.,"Marketing Your App is a mobile app marketing agency with services for iPhone, iPad and Android apps including App Store optimization, social media marketing and writing press releases. The company offers marketing solutions to app developers to help them get more exposure, new customers, and increased sales for their apps. In addition, developers can discover ways to drive iPhone app sales with the site's free articles, including tips for picking an app idea, selling it in the App Store, and boosting profits."
Zyex,https://www.crunchbase.com/organization/zyex,Manufacturing,"Zyex providing monofilament, multifilament and staple PEEK products to meet a wide range of demanding requirements.","Zyex is a specialist fibre manufacturer working in close partnership with market leaders in the aerospace, automotive, industrial, medical and leisure segments."
Zyboorg Tech,https://www.crunchbase.com/organization/zyboorg-tech,"Analytics, B2B, Big Data, Predictive Analytics",They are working with Artificial Intelligence in order to make life easy and faster.,"Prelaunch help you to validate your idea about a mobile application by providing some predicted information regarding the ratings, downloads,etc.And also help you to analyse your apps with your compitators.Prelaunch can be helpful for startups , developers as well as large organisations who are currently own and running a plenty of application online."
Zygosys Technologies,https://www.crunchbase.com/organization/zygosys-technologies-2,"B2B, Consulting, CRM, Information Technology, Small and Medium Businesses",Web technologies consulting company for small and medium size businesses,
Zydeca Media Group,https://www.crunchbase.com/organization/zydeca-media-group,Advertising,Advertising Company.,Advertising Company.
Zyked,https://www.crunchbase.com/organization/zyked,"Health Care, Internet, iOS, Mobile, Social Media, Sports, Training",Zyked aims to make sports and exercising more fun by adding gameplay and community features.,Zyked aims to make sports and exercising more fun by adding gameplay and community features. The first Zyked product is an innovative web and mobile service. Zyked is a privately owned company founded by Tom Söderlund.
ZymeQuest Inc,https://www.crunchbase.com/organization/zymequest-inc,"Business Intelligence, Product Search",ZymeQuest Inc is a Business Intelligence company.,
Zymmetrical,https://www.crunchbase.com/organization/zymmetrical,"Content, Data Visualization, Photography, Video",Zymmetrical is an exchange platform that caters to artists and buyers focused on creative content.,Zymmetrical is an exchange platform for artists and buyers at the forefront of creative design. They feature a constantly updated selection of digital stock submitted by people from all over the world.
Zyncs,https://www.crunchbase.com/organization/zyncs,Manufacturing,A Zyncs Corporation,
Zync,https://www.crunchbase.com/organization/zync-2,Software,Stop looking for parking and find your spot,
Zynergy room,https://www.crunchbase.com/organization/zynergy-room,Information Services,Zynergy room is a discussion and cooperation forum for driven entrepreneurs.,
ZYG Pharma,https://www.crunchbase.com/organization/zyg-pharma,"Manufacturing, Pharmaceutical","ZYG Pharma engaged in manufacturing various dermatological formulations like creams, ointments, gels, lotions, solutions.","ZYG Pharma engaged in manufacturing various dermatological formulations like creams, ointments, gels, lotions, solutions."
zyntroPICS,https://www.crunchbase.com/organization/zyntropics,Advertising,Interactive Transmedia Story Production,Interactive Transmedia Story Producers and Distributors.
Zynetix,https://www.crunchbase.com/organization/zynetix,Communications Infrastructure,Zynetix designs and develops GSM softswitches.,"Zynetix Limited designs and develops GSM softswitches. The company provides ip-MSC systems, which provides mobile connections. It also offers maritime GSM, secure GSM communications, fixed-mobile convergence, and GSM rural networks solutions. In addition, the company provides Managed Core Services that manages and runs the GSM core infrastructure for maritime service provider partners."
ZymeDeal,https://www.crunchbase.com/organization/zymedeal,"Consumer Goods, Coupons, Customer Service",Coating that extends the shelf life of packaged goods,The synthesis of a modified polymer that can preserve milk and other beverages. Early experiments show an increased shelf-life for milk of 2-3 days at room temperature.
Zytalis,https://www.crunchbase.com/organization/zytalis,Telecommunications,Zytalis is a Provider of SAP consulting services.,Provider of SAP consulting services. The company mainly focuses on the implementation and support of SAP to a range of industries in the United States.
Zynaptic,https://www.crunchbase.com/organization/zynaptic,"Information Technology, Internet, Software","At Zynaptic™, we're experts at making dumb things smarter, putting code where you least expect it and letting the information flow.",
Zybarol,https://www.crunchbase.com/organization/zybarol,"Software, Web Design","Zybarol is a web design and development company and software development company in kerala, India based on UK, USA, and Dubai.",
Zymlogic,https://www.crunchbase.com/organization/zymlogic,"Analytics, Enterprise Software, SaaS",Human Capital Analytics SaaS that monitors the pulse of the workforce and applies proprietary analytics to increase employee engagement and,"Human Capital Analytics SaaS that monitors the pulse of the workforce and applies proprietary analytics to increase employee engagement and predict business performance impact for large enterprise employers. Compliments enterprise social platforms such as Jive, Yammer, TIBBR, Podio, SocialCast by noting trends and analyzing them against company KPI's."
Zynga Eugene,https://www.crunchbase.com/organization/zynga-eugene,"Gaming, Video Games",Zynga Eugene is a Developer and publisher of video games.,Developer and publisher of video games. The company offers console and handheld games such as several Tomb Raider and Tony Hawk games.
ZYCH,https://www.crunchbase.com/organization/zych,Lifestyle,Covet-worthy handbags at a surprising value,"ZYCH is a start-up venture that is imbued with the history & heritage of the covet-worthy Edie bag that has been featured in fashion and lifestyle magazines around the globe and has adorned the arms of many of Hollywood's most stylish celebrities including Sienna Miller, Rachel Bilson, Hayden Panettiere and Selena Gomez to name a few."
