Organization Name,Organization Name URL,Categories,Description,Full Description
AggregateIQ,https://www.crunchbase.com/organization/aggregateiq,"Data Center Automation, Data Integration, Data Storage, Software","AggregateIQ is a digital advertising, web and software development company based in Canada.","AggregateIQ is a digital advertising, web and software development company based in Canada. The company delivers proven technologies and data driven strategies that help clients make timely decisions, reach new audiences and ultimately achieve goals. Some of its services includes; audience outreach, data management, message testing, software development, public opinion polling, audience analysis, online engagement and intervention and clear reporting. AggregateIQ works in full compliance within all legal and regulatory requirements in all jurisdictions where it operates.  "
"Agilera, Inc.",https://www.crunchbase.com/organization/agilera-inc,"Enterprise Applications, Enterprise Software","Agilera, Inc. is a full-service, enterprise Application Service Provider (ASP) that delivers high quality, value-priced application.","Agilera, Inc. is a full-service, enterprise Application Service Provider (ASP) that delivers high quality, value-priced application management and technology services to businesses in a variety of industries, including manufacturing, healthcare, financial services, retail, business services and telecommunications. Agilera's economies of skill, scale and speed provide businesses the freedom to concentrate on their core capabilities while achieving quicker time-to-benefit with new application functionality and new releases, faster return on investment, reduced costs, and a lower overall Total Cost of Ownership (TCO)."
Agrobook,https://www.crunchbase.com/organization/agrobook,"Communities, Internet, Leisure, Lifestyle",Agrobook offers online content for farming communities. The company is based in Russia.,
Agility Applications Ltd.,https://www.crunchbase.com/organization/agility-applications-ltd,"Consulting, CRM, Financial Services, Information Technology, Software",Agility Applications Ltd. is a specialist provider of application and technology products and services to the capital markets.,"Agility Applications provides consulting, business analysis, software development and cyber resilience services that enables organisations to enhance, streamline and automate their existing work practices with the aim of improving the overall appeal of their core products and enhancing their performance. Our purpose is to assist our clients to maximise the return on their IT investment while enhancing their overall value proposition in the market-place through the development of intelligent software solutions that streamline business processes and reduce cost. Agility Applications is an IT Services company created to provide organisations with a viable, realistic alternative for the development of applications."
Agency.com,https://www.crunchbase.com/organization/agency-com,"Advertising, Analytics, Email Marketing, SEM","Agency.com is an interactive marketing agency providing marketing strategy, advertising, analytics, and optimization services.","Agency.com is a full-service interactive marketing agency. Its interactive marketing services include marketing strategy, interactive advertising, media planning and buying, search engine marketing, e-mail marketing, viral campaigns and promotion, and analytics and optimization services. The company’s web development services comprise of strategic planning, analytics and customer research, information architecture, web design and development, content management and technology solutions, intranets and portals, and quality assurance services. Agency.com serves the automotive, consumer-packaged goods and retail, energy and utilities, financial services, healthcare, manufacturing, non-profit, professional services, publishing and media, technology, telecommunications, travel, and entertainment sectors. Agency.com has additional offices in San Francisco, California; Chicago, Illinois; Dublin, Ireland; London, United Kingdom; Amsterdam, the Netherlands; Shanghai, China; Rome and Milan, Italy; and Brussels, Belgium."
AgenaTrader,https://www.crunchbase.com/organization/agenatrader,"Education, Finance, Software","AgenaTrader, a multi asset, multi broker, multi datafeed trading platform.","The AgenaTrader team is a group of diverse, highly educated professionals. Within this group are professional retail and institutional traders, finance experts and highly specialized software developers with many years of experience in developing finance technology. About seven years ago, a trader who had been trading the markets for many years using standard trading technology dedicated all his efforts toward finding all the software tools necessary to become a successful trader. The results of extensive research in the trading technology market were devastating. While big institutions work with highly professional software applications, these were lacking in the retail market. And so he began to research the customers of these software technology markets. Many of his research results highlighted the fact that private traders were struggling in their trading due to a lack of functionality in their software application, and even worse, due to simply being unaware of what tools are needed."
AgriTrustChain,https://www.crunchbase.com/organization/agritrustchain,Agriculture,"AgriTrust Chain is the solution for Agricultural Contract Management at Blockchain, bringing management capabilities for all farmers sizes.","Agribusiness Contract Management at Blockchain Agricultural Trading Contracts are essential tools for the commercialization and disposal of agricultural crops and their monitoring, control and management represents a challenge for all the participants involved. Several computer systems were, and continue to be, developed to implement this monitoring and control, allowing those involved to manage these contracts. However, these systems always act from the perspective of one of the participants of the transaction, not corresponding to the perspective of the counterpart. Even if you use mediators for your firmament, especially those legally required, such as the Record Book Offices, it is not in the interest of either party the litigation that this difference of perspective may generate. In this scenario, the technologies coming from crypto currencies, in particular the blockchain mechanism and the implementation of computational protocols for the representation of contracts, the so-called Smart Contracts, serves as a monitoring and control tool that allows , automatically, the management of Agricultural Trading Contracts."
Agilebiotics,https://www.crunchbase.com/organization/agilebiotics,Therapeutics,early-stage pharmaceutical company focusing on the development of novel antibiotics.,
Agil Technologies,https://www.crunchbase.com/organization/agil-technologies,"Advertising, Brand Marketing, Collaboration, Enterprise Software, Information Technology, Marketing, Marketing Automation, SaaS, Software","Simplify, accelerate, optimise, control your marketing with agility","Agil Technologies is an innovative MarTech startup based in Paris and London that helps brands and their ecosystem better collaborate and address the evolving challenges they are facing. The company was founded in 2014 by recognised and experienced marketing, advertising and digital technologies professionals. The company objective is to provide brands with open innovation and best user experience through simplification, acceleration, optimisation and control. For more information, visit www.agil.com"
Agricam AB,https://www.crunchbase.com/organization/agricam-ab,"Agriculture, Farming","Agricam AB provides accurate, proximity-free and cost-effective measurement and monitoring systems for modern agriculture.","Agricam AB provides accurate, proximity-free and cost-effective measurement and monitoring systems for modern agriculture."
Agora Technologies,https://www.crunchbase.com/organization/agora-technologies,"Collaboration, Video Conferencing",Agora Technologies works to encourage entrepreneurs and entrepreneurship among high school students.,
Agile Ventures,https://www.crunchbase.com/organization/agile-ventures,"Human Resources, Internet, Small and Medium Businesses","A Venture Builder/Startup Studio based in Jeddah, Saudi Arabia. We are targeting the B2B marketspace in the GCC and Red Sea economies.","We are focused on developing disruptive digital businesses in B2B space in the GCC, as well as the Red Sea economies."
Agitare Technologies,https://www.crunchbase.com/organization/agitare-technologies,"Big Data, Consulting, Information Technology, Legal",A boutique consulting company that specializes in helping enterprises get the most value from the cloud and the data they collect.,
Agonyapp,https://www.crunchbase.com/organization/agonyapp,"Advice, Beauty, Fashion, Messaging, Psychology, Social Media","Anonymous relationship advice app Agonyapp is a social yet discrete way for you to ask relationship questions, offer advice and get real a","Anonymous relationship advice app  Agonyapp is a social yet discrete way for you to ask relationship questions, offer advice and get real answers from real people on everything that matters to you.  Whether you need relationship advice, health and beauty tips, support through a tough time or just a therapeutic rant, Agonyapp is just a few taps away. Start or join the conversation as yourself or your alter-ego across a range of areas including: Relationships, Family, Friends, Sex, Marriage, Health & Beauty, LGBT, Teen, Parenting, Life.  Share Joy. Share Woes. Share Life."
Agenci Ltd.,https://www.crunchbase.com/organization/agenci-ltd,"Information Services, Information Technology","Agenci Ltd. is a consultancy that specialises in IT security, particularly ISO 27001 and GDPR.","Agenci Ltd. is a consultancy that specialises in IT security, particularly ISO 27001 and GDPR. Agenci Ltd. works with a range of clients across the UK to help them meet legal and regulatory requirements. "
Agile Alliance,https://www.crunchbase.com/organization/agile-alliance,"Association, Communities, Non Profit",Agile Alliance is a non-profit organization committed to advancing Agile development principles and practices.,"Agile Alliance is a non-profit organization committed to advancing Agile development principles and practices. It supports those who explore and apply Agile principles and practices in order to make the software profession more productive, humane, and sustainable. In addition to its annual international conference on Agile software development, Agile Alliance provides grant funding for academic research, Agile user-group speakers, and programs to support the community. Individual and corporate memberships, along with the profits from the annual conference fund these programs like a community foundation. Agile Alliance was founded in February 2001 and is based in the Dundee, Oregon."
Agrodrone,https://www.crunchbase.com/organization/agrodrone,"Agriculture, Drones","Agrodrone specialized in services based on precision agriculture, through the use of remote and nearby sensors for the analysis.","Agrodrone is a company in full expansion created in 2014 and specialized in services based on precision agriculture, through the use of remote and nearby sensors for the analysis of vegetative development and water status of crops, as well as the agricultural potential of soils . Precision Agriculture is an agronomic concept of management of agricultural parcels whose objective is to carry out the right tasks at the right times and places. This type of agriculture is a tool to be used in production systems in order to achieve the optimization of inputs, the reduction of environmental impacts and the improvement of crop production and quality, as well as the possibility of managing traceability of the entire agricultural production process. "
AgencyRoot,https://www.crunchbase.com/organization/agencyroot,"Agriculture, Information Technology, Insurance, Software",SaaS for SMB in Agriculture,"AgencyRoot's primary service is a web-based tool that helps crop insurance agents manage and grow their business. AgencyRoot is the only CRM platform that can read policy data from all 16 USDA Approved Insurance Providers in the United States. AgencyRoot also offers technology consulting and development services to agriculture-related small businesses, primarily in Crop Insurance."
Agile Soft Systems,https://www.crunchbase.com/organization/agile-soft-systems,"Consulting, Information Technology, Software",Agile Soft Systems is an IT company that provides business strategies and IT solutions.,
AGEN TOGEL TERPERCAYA,https://www.crunchbase.com/organization/situs-togel-online-terbaik-terbaru-terpercaya,"Casino, Gaming",AGEN TOGEL TERPERCAYA provides betting information and a betting platform.,AGEN BETTING TERPERCAYA provides betting information and a betting platform.
AGRITEL,https://www.crunchbase.com/organization/agritel,Agriculture,Agritel is a Paris based expert in agricultural and agro-industrial market strategies.,
Agthia Group,https://www.crunchbase.com/organization/agthia-group,"Business Development, Food and Beverage",Agthia Group is a food and beverage company.,"Agthia Group is a leading Abu Dhabi based food and beverage company.   Established in 2004, the Company is listed on the Abu Dhabi Securities Exchange (ADX) and has the symbol “AGTHIA”. 51 percent of the Company’s shares are held by Senaat (General Holding Corporation), an Abu Dhabi Government entity, with the balance held by retail and institutional investors.  The Company’s assets are located in the UAE, Oman, Egypt and Turkey. Agthia offers a world class portfolio of integrated businesses providing high quality and trusted food and beverage products for customers and consumers across the UAE, GCC, Turkey and the wider Middle East. More than 3,000 employees are engaged in manufacturing, distribution and marketing various food and beverage products: Water (Al Ain Water, Al Bayan, Alpin Natural Spring Water); Flour (Grand Mills); Animal Feed (Agrivita); Juices (Al Ain Fresh, Capri Sun); Dairy (Yoplait). An Emerging Businesses unit includes tomato paste, frozen vegetables, fruit puree and baked goods."
AgroFly SA,https://www.crunchbase.com/organization/agrofly-sa,"Agriculture, Drones, Manufacturing, Virtual Reality",Agricultural UAV manufacturer (SpUAV),
Agitar,https://www.crunchbase.com/organization/agitar,"Computer, Enterprise Software, Information Technology, Software",Agitar provides commercial services to help users automate and manage the process of developer testing for Java.,"Agitar Technologies enables the enterprise to more efficiently release Java applications, reduce the cost of bugs, and change both new and legacy applications to meet changing business needs. The AgitarOne product family enables software teams to create, use, and manage a set of unit tests to keep their software above par."
Agent,https://www.crunchbase.com/organization/agent,"Advertising, Marketing",Agent is a marketing and advertising company that offers branding and advertising services.,
Agency Mobile,https://www.crunchbase.com/organization/agencymobile,"Apps, Delivery, Enterprise Applications, Mobile, Mobile Apps, Product Design, Software, UX Design",We help leading companies and ambitious startups create industry-leading digital products and services.,"We advise our global clients on effective and successful use of mobile as part of their product and marketing communications and have created mobile applications and connected experiences for BBC Worldwide, Deutsche Bank, The Football Association and many more. Our services include end to end mobile strategy , application design and build and industry-leading mobile web and web application capability and knowledge."
Aggios,https://www.crunchbase.com/organization/aggios,Software,"Users of the newest mobile and embedded devices, like smartphones or TVs, demand smaller, sleeker and cooler devices with more exciting,","Users of the newest mobile and embedded devices, like smartphones or TVs, demand smaller, sleeker and cooler devices with more exciting, energy hungry features. At the same time, they expect longer battery life and higher energy efficiency at lower costs. Device manufacturers and their component suppliers see energy as the dominant competitive differentiator as less heat dissipation allows them to build smaller devices with smaller batteries and lower overall energy consumption to meet national regulations to save energy. Stay tuned ..."
Agrimaster,https://www.crunchbase.com/organization/agrimaster,"Agriculture, Consumer Goods, Machinery Manufacturing, Manufacturing","Agrimaster is designs, manufactures, and constructs farming machinery for the agriculture industry. ","Agrimaster SpA designs, manufactures, and constructs farming machinery for the agriculture industry. The company offers shredders, bush-cutter arms, sprayers, fork lifts, and hydraulic heads."
Agency Computer Systems,https://www.crunchbase.com/organization/agency-computer-systems,InsurTech,"Agency Computer Systems, Inc. is an independent software vendor providing innovative software.","Agency Computer Systems, Inc. is an independent software vendor providing innovative software solutions for independent insurance agencies and insurance carriers."
AgileSource,https://www.crunchbase.com/organization/agilesource,"Mobile, Open Source",We dedicated to delivering next generation smart mobile device as a service that create a competitive edge in the marketplace.,We dedicated to delivering next generation smart mobile device as a service that create a competitive edge in the marketplace.  We help our customers benefit from smart mobile device based products and solutions through a unique community collaborative network.
AGIS,https://www.crunchbase.com/organization/agis,"Health Care, Information Technology",AGIS is an information technology company that develops environmental and health solutions for the corporate market.,AGIS is an information technology company that develops environmental and health solutions for the corporate market.
AgCrowd,https://www.crunchbase.com/organization/agcrowd,"Agriculture, Crowdfunding, Energy, Renewable Energy, Venture Capital",AgCrowd is an investment platform for agricultural and energy companies.,"AgCrowd is an investment platform for agricultural and energy companies. We assist companies with efficient capital raising and aid them to connect better with investors, customers and partners via our investment platform. For investors, we provide a new avenue for impact investing in growth companies and alternative assets. AgCrowd is licenced by the Australian Securities and Investments Commission (AFSL 511673)."
Agrimoney,https://www.crunchbase.com/organization/agrimoney,"Agriculture, News",Agrimoney is the global site for news and analysis of what's happening in agricultural commodities and agribusiness.,"Agrimoney is the global site for news and analysis of what's happening in agricultural commodities and agribusiness. Whether it is what's happening in the commodities markets or in the top agribusiness companies, you will read about it quickly, in depth and with accurate context on Agrimoney."
Agilitech,https://www.crunchbase.com/organization/agilitech,Photography,Agilitech LLC is a mobile apps developer company based in the United States and builds utility based applications.,Agilitech LLC is a mobile apps developer company based in the United States and builds utility based applications. One of its recent launch is the most popular app named Spy Calc 2.0.
AgroPro Monitor,https://www.crunchbase.com/organization/agropro-monitor,Farming,"AgroPro Monitor is a system that helps agricultural professionals identifying, monitoring and finding the solution.","AgroPro Monitor is a system that helps agricultural professionals identifying, monitoring and finding the solution of phytosanitary problems."
Agmis,https://www.crunchbase.com/organization/agmis,Software,"Agmis provides internet software development services for businesses in the telecommunications, banking and e-commerce industries.","Agmis provides  internet software development services for the telecommunications, banking and e-commerce industries.  Agmis, UAB was founded in 2007 by the executive team of one of the Baltic's largest IT companies."
Agridata,https://www.crunchbase.com/organization/agridata,"Agriculture, Information Technology, Software",Agridata is continuous innovation and was created to lead new technologies and processes applied to agriculture.,
Agri Beef,https://www.crunchbase.com/organization/agri-beef,"Agriculture, Food and Beverage",Agri Beef is a food production company providing meat products.,
agroNET SOLUTIONS,https://www.crunchbase.com/organization/agronet-solutions,Agriculture,"agroNET a digital agriculture toolset,one stop shop for developmentand provision of smart agriculture services",agroNET is a set of modular components and ready to use cloud services designed to provide extensive agriculture expertise in an easily accessible and usable format.
agnion Energy,https://www.crunchbase.com/organization/agnion-energy,"Energy, Natural Resources, Renewable Energy",agnion Energy is a Germany-based company that focuses on the decentralized generation of substitute natural gases.,"agnion Technologies GmbH, based in Pfaffenhofen a.d. Ilm, Germany, began business operations in 2007. With the support of German and American investors, a company is being built that focuses primarily on decentral generation of Substitute Natural Gas (SNG), which is sometimes also called Synthetic Natural Gas."
AGY Therapeutics,https://www.crunchbase.com/organization/agy-therapeutics,"Biopharma, Genetics, Medical, Therapeutics","A South San Francisco, Calif .-based biopharmaceutical company","AGY Therapeutics has one focus: the discovery, development and commercialization of breakthrough treatments for diseases of the central nervous system AGY has a pipeline of novel CNS therapeutic programs in the clinic and in preclinical development to meet major unmet medical needs. AGY built its pipeline using its unique, proprietary platform for functional gene discovery and mapping out specific pathways underlying central nervous system diseases. By harnessing these capabilities, AGY identified potential target proteins that can be modulated to block the progression of the disease process. This is paving the way for novel CNS therapeutics and future growth for AGY."
Agile Interoperable Solutions,https://www.crunchbase.com/organization/agile-interoperable-solutions,Public Relations,Agile Interoperable Solutions is a communications company.,"AIS and our flagship product CORE were born out of our own real-world need to rapidly re-establish critical business communications in the aftermath of a hurricane which crippled local infrastructure. With a deep understanding of communications technology, extensive operational experience, and a passionate commitment to supporting our customers, AIS is able to deliver best-in-class interoperable solutions."
AG5,https://www.crunchbase.com/organization/ag5,"Skill Assessment, Software",Skills Management Software,"AG5 Skills lets you easily track your team's safety skills. Keep a record of who needs to be trained and what skills need to be learned. If someone needs re-training, we send a reminder so you can respond in a timely manner. In short, we simplify compliance."
Agree Realty,https://www.crunchbase.com/organization/agree-realty,Real Estate,Agree Realty Corporation is a self-administered and self-managed real estate investment trust (REIT).,"Agree Realty Corporation is a self-administered and self-managed real estate investment trust (REIT). The Company’s operations are conducted through, directly or indirectly, Agree Limited Partnership (Operating Partnership), of which the Company is the sole general partner, and in which it 96.59% interest as of December 31, 2011. The Company is focused primarily on the ownership, development, acquisition and management of retail properties net leased to national tenants. It specializes in acquiring and developing single tenant net leased retail properties for industry retail tenants. In January 2014, the Company acquired Cannon Station in Fort Oglethorpe, Georgia. In February 2014, the Company announced the acquisition of two net lease properties and sale of Ironwood Commons shopping center. In March 2014, Agree Realty Corp closed on the acquisition of parcel of land located on US Highway 17 in East Palatka FLorida."
Agile Tech Computer W.L.L,https://www.crunchbase.com/organization/agile-tech-computer-w-l-l,"Information Technology, Software",Website and Software development company in Qatar - Provides end to end IT web solutions to Middle east market,"Agile Tech is a full-service ICT company headquartered in Doha, Qatar providing website design, web development services, software development, ERP development, Mobile apps development and provides end to end IT hardware related services across the middle-East market. Established in 2014, Agile Tech entered into the Qatar market by providing Infrastructure Solutions and maintenance trusted by leading brands. With good clientele, we served customers from Qatar, Saudi Arabia, Bahrain, UAE and other GCC countries as well. Our comprehensive knowledge in extensive business and technology help us to understand every industry’s requirement and fulfill our client’s expectations."
Agrocorp Landbase (P) Limited,https://www.crunchbase.com/organization/agrocorp-landbase-p-limited,Agriculture,We are first ever agro-realty company in India providing lucrative opportunities for investment in agricultural land in Southern region.,
