Organization Name,Organization Name URL,Categories,Description,Full Description
Apica Cardiovascular,https://www.crunchbase.com/organization/apica-cardiovascular,"Health Care, Information Technology, Medical Device",Cardiovascular medical devices,"Apica is a pre revenue medical device company commercialising a technology for access and closure of the heart’s apex and the peripheral vascular system. The underlying technology has applications in a number of medical procedures such as Transcatheter Heart Valves (TAVI), AAA, and LVAD implantation. The technology standardizes access and closure for large bore therapeutic devices without loss of blood via minimally invasive surgical or percutaneous access on the beating heart. The technology has progressed to the point where it has proven the initial concept in animal and cadaver models and is now moving toward initial clinical trials."
AppleInsider,https://www.crunchbase.com/organization/appleinsider,"Application Performance Management, Computer, Consumer Applications, Customer Service, News, Technical Support","Apple Insider give in-depth Apple news, analysis, reviews, how-tos and more since 1997.","Apple Insider give in-depth Apple news, analysis, reviews, how-tos and more since 1997."
App Academy,https://www.crunchbase.com/organization/app-academy,"Career Planning, EdTech, Education, Employment, Software, Training",App Academy is a web development school where 98% of graduates are placed in developer roles earning an avg. of $105K in SF and $89 in NYC.,"App Academy is a software development school that seeks to change what people expect from education. App Academy offers a variety of training programs, including a 12-week immersive coding and job placement program, where 98% of graduates have been placed in software development roles at an average salary of $105,000 in San Francisco and $89,000 in New York City."
AptEdge,https://www.crunchbase.com/organization/aptedge,"Analytics, CRM, SaaS",AptEdge helps businesses understand customer challenges to build a better product experience.,ML-powered product to help companies build a better product experience.
Apoia.Org,https://www.crunchbase.com/organization/apoia-org,"Digital Entertainment, Financial Services, FinTech, Information Services, Internet, Internet of Things","Apoia.Org supports is an independent platform, to connect voters to candidates.","Apoia.Org supports is an independent platform, to connect voters to candidates. The company verifies and validates the CPF of all donations made via site or machine. ."
Apollo Med Innovations,https://www.crunchbase.com/organization/apollo-med-innovations,Cosmetics,Apollo Med Innovations support physicians in choosing the right aesthetic devices to meet their parent needs and add new revenue streams.,Apollo Med Innovations support physicians in choosing the right aesthetic devices to meet their parent needs and add new revenue streams.
AppSurfer,https://www.crunchbase.com/organization/appsurfer,"Advertising, Mobile, Virtualization",AppSurfer is an app which allows you to instantly access any app from the Android world without the need to Download or Install it.,"AppSurfer runs Android on the cloud and makes it accessible from any device or platform. AppSurfer provides tools for developers to demo their apps from the web itself, without installing. These demos can be embedded on blogs, product pages, press releases etc. AppSurfer demos help developers generate a continuous stream of downloads from the web. These apps are playable inside facebook as well. Hence developers can promote their apps right inside facebook by providing a live interactive demo of their app which users can play with. In addition, AppSurfer provides an API which can be used for custom use cases and applications. This can be used by third party AppStores, online IDEs, app building/porting tools etc."
AppCow,https://www.crunchbase.com/organization/appcow,"App Discovery, Apps, CRM, E-Commerce, Mobile",Turning first time buyers into repeat customer throughout the smart-phone supply chain.,"AppCows is an intuitive and easy to use CRM solution designed for the smartphone supply chain, helping the mobile industry explore uncharted channels to smartphone users, creating recurring revenue and repeat customers through a mobile first experience."
Applied Power Systems,https://www.crunchbase.com/organization/applied-power-systems,"Energy Management, Semiconductor","Applied Power Systems The Driving Force in Power Electronics... High Power Inverters, AC-DC Converters, Power Semiconductors.","Applied Power Systems, Inc. has been a power electronics engineering and manufacturing company specializing in power conversion systems and thermal management of high power semiconductors since 1996. APS applies unique, high technology solutions in the design and manufacture of a broad array of power control systems, ranging from high power AC and DC Power Supplies to Driver Circuits for IGBT, SCR, MOSFET devices and power blocks. Their products include board level products such as drivers for IGBTs, MOSFETs and SCRs as well as fiber-optic interfaces, high voltage drivers for IGBTs and SCRs, etc. Their Power Stage products include Solid State Switches for AC and DC applications, IGBT, SCR, rectifier assemblies, bridges, Power Converters, Inverters. Their System Level products include power supplies and Uninterruptible Power Supplies for on-board Rail Applications, for Hi-temperature and Low-temperature Cryogenic magnets, Hi-voltage Modulators, Frequency Changers, Motor Drives and a host of specialized supplies and inverter systems."
Appticles,https://www.crunchbase.com/organization/appticles,"Art, Digital Media, Mobile, Publishing","Creating, distributing and monetizing mobile HTML5 applications.","Appticles is an online platform suited for content creators (bloggers, small and medium publishing houses, but also data-driven enterprises) that enables them to effortlessly reach their mobile audience by packaging their existing content into cross-platform mobile web applications. We bring forth the HTML5 technology, empowering content creators, to better reach and target their mobile audience regardless of the mobile operating system (iOS, Android, Windows Phone/RT, BB10, FirefoxOS & Tizen) or device type (smartphone or tablet) they are using.  The platform has an intuitive workflow with a rich set of features that makes it easier for content creators to personalize their own mobile web applications: ❖ Social reading experience on mobiles & tablets Users can easily share content from within the mobile web applications on their favorite social media channels. This way, their friends & followers can simply tap on a link and immediately have access to the application, without needing to install anything. That’s priceless! ❖ Themes and custom appearance Choosing from multiple themes, customizing the colors & fonts, adding logos and mixing different graphic elements makes the brand consolidate its identity.  ❖ Responsive UI All mobile web applications are sensitive to orientation changes: landscape and portrait. In other words, the look and feel of the mobile web app seamlessly morphs into the screen size of the user’s device. ❖ Offline mode capability Users can still access the mobile web application even if they’re on a tube, on a plane or if their signal is poor. This enhanced reading experience is all possible through this type of mobile web applications. ❖ Monetization Monetizing the mobile web apps can be achieved either through ads, paid subscriptions or social micropayments. Regardless of the chosen monetization model, all the money goes directly in the content creator’s pocket. There’s no shared revenue constraint. Read more about it and start creating your own mobile web application now: http://www.appticles.com/"
App2you,https://www.crunchbase.com/organization/app2you,"Analytics, Business Intelligence, Data Visualization","Founded by the creators of SQL++, App2you provides rapid development platforms for building custom analytics applications.","App2you's flagship product, FORWARD, is a rapid development platform for custom analytics applications. Visualizations are created directly over databases, using only SQL++ queries and JSON markup. SQL++ is backwards-compatible with SQL, fully supports JSON data, and easily integrates data across multiple SQL and NoSQL databases. App2you's licensed, patent-pending technology originates from UCSD's Web and Databases Lab."
Apricots Barcelona,https://www.crunchbase.com/organization/apricots-barcelona,,"Transparency, legality and respect for the girls are the three pillars of Apricots’ philosophy",
Applied BioSciences Corp.,https://www.crunchbase.com/organization/applied-biosciences-corp,"Biotechnology, Health Care, Medical","Applied BioSciences Corp. is a diversified company focused on multiple areas of the medical, bioceutical and pet health industry.",
Appointuit Pty Ltd,https://www.crunchbase.com/organization/appointuit,"Consulting, Health Care, Software",Appointuit is a software company offering appointments and patient relationship management for healthcare providers.,"Book your next healthcare provider's appointment on your mobile or your desktop. Book on the weekend, afterhours, for your kids, anytime, anywhere!"
Apangea Learning,https://www.crunchbase.com/organization/apangea-learning,"E-Learning, Education, Tutoring",Apangea Learning is a distance learning company providing online math tutoring solutions for middle and high schools in the United States.,"Apangea Learning, Inc., a distance learning company, provides online math supplemental tutoring solutions for middle and high schools in the United States. The company offers one-student-to-one-teacher differentiated math instruction programs through the integration of proprietary tutoring technology and online certified teachers. It also provides live online support, professional development and training, consultative support, and continuous assessment and reporting services for teachers and administrators. Apangea Learning, Inc. was founded in 2002 and is based in Pittsburgh, Pennsylvania."
Applixure,https://www.crunchbase.com/organization/applixure,"Enterprise Software, Information Technology, IT Management, SaaS, Security, Small and Medium Businesses, Software",Telemetry for Digital Tools. Monitor all your PC hardware and software for continuous improvements. For increased productivity.,"Applixure gives you real-time visibility to all your computers. Data about your PCs, their operational health and installed software is gathered in the background. You can view the data from a clear, visual dashboard that highlights any need for immediate or pro-active actions. Avoiding costly downtime and unhappy, unproductive users has never been this smart."
Applied Minerals,https://www.crunchbase.com/organization/applied-minerals,"Commercial, Manufacturing, Mineral",Applied Minerals produces halloysite clay with commercially consistent product grades.,"Applied MInerals is the owner of the Dragon Mine, the only known measured resource of Halloysite Clay in the western hemisphere significant enough for large scale commercial production. The Dragon Mine is located in the Tintic District of Utah stretching over 230 acres of land. Applied Minerals retained the world’s leading experts in Halloysite to create a standard for the characterization, quantification, and commercialization of this unique mineral. As a result of these efforts, the Company is able to deliver commercially consistent product grades of the highest quality Halloysite in the world."
Aperto Networks,https://www.crunchbase.com/organization/aperto-networks,"Manufacturing, Mobile, Wireless",Aperto Networks manufacture highly versatile and cost-effective carrier-grade WiMAX forum cerified infrastructure equipment.,"Aperto Networks is a manufacturer of highly versatile and cost-effective carrier-grade WiMAX Forum Certified infrastructure equipment. Through their award-winning PacketMAXÂ technology, they enable service providers and enterprises worldwide to profitably deliver affordable wireless voice and broadband data services to businesses, residential customers, and government organizations of all kinds. No company offers more solutions for Fixed and Mobile WiMAX applications than Aperto. Or more support for more frequencies”both licensed and unlicensed- anywhere in the world."
APEX Clearing Corporation,https://www.crunchbase.com/organization/apex-clearing-corporation,Financial Services,"Apex is an independent, full-service clearing firm helping power the digital revolution in financial services.",
ApaceWave Technologies,https://www.crunchbase.com/organization/apacewave,"Internet, Mobile, Wireless",ApaceWave Technologies develops baseband processors for the WiMAX industry.,"ApaceWave Technologies is a leader in the development of baseband processors for the global WiMAX industry. Based in Silicon Valley, Calif., and founded by industry veterans with extensive experience in transforming technology innovations into market-share leading products, ApaceWave Technologies is developing next-generation mobile broadband solutions based on the IEEE 802.16e / WiMAX standards."
Apricoat,https://www.crunchbase.com/organization/apricoat,"Manufacturing, Textiles, Travel",Apricoat manufactures adventure jackets for travelers.,"Apricoat is an adventure jacket manufacturer for travelers. Apricoat was designed on mountains by a team of international explorers, who banded together with an industry leading material designer to create the ultimate adventure jacket. Their goal was to create a unique, fully featured adventure jacket with everything an explorer would need or want, at a price that undercuts all the major adventure brands. The Apricoat team launched a Kickstarter campaign to utilize their community to crowdsource this amazing coat, enabling an extremely reasonable price for all travelers."
APTARE,https://www.crunchbase.com/organization/aptare,"Infrastructure, IT Infrastructure, Virtualization",Enterprise storage software company.,"APTARE provides Web 2.0 software that helps enterprises cost effectively manage their storage resources. Its products feature a range of out-of-the-box reports that give enterprise data centers better insight into how their storage is being used, including identifying areas of underutilized storage that can be re-allocated.  The companyâ€™s flagship product is called APTARE StorageConsole 7.0, an agent-less, Web-based storage reporting management software platform. The platform includes four products: Backup Manager, Capacity Manager, Virtualization Manager and Replication Manager."
Apposha,https://www.crunchbase.com/organization/apposha,Software,PostgreSQL Extension for Scalable File IO,
App Bugs,https://www.crunchbase.com/organization/app-bugs,"Apps, Computer, Software","AppBugs, Inc. helps developers find security bugs in their apps and mobile app users identify the apps with security bugs on their devices.",App Bugs is a developer of a free android app that spots dangerous apps installed on users' handsets. The company aims to help developers build better mobile experiences and delight their users. AppBugs' platform allows developers to receive instant feedback about the security vulnerabilities of their mobile apps. Appbugs is headquartered in the technology hub of the Greater Seattle Area.
Appbyme,https://www.crunchbase.com/organization/appbyme,"Information Technology, Mobile, Mobile Apps",Appbyme is an online creation platform of DIY mobile applications.,"Beijing Infinite Effect Media Information Technology Co., Ltd. (安米网) is the owner of Appbyme, which is an online creation platform of DIY mobile applications. It aims at helping non-programmer users to DIY their own intelligent cellphone applications.  Appbyme provides mobile applications with a self-built service for individuals and businesses which are self-service, free,and with no-technology development and rich functions. Users only need to register and log on the Appbyme and fill in the basic information. By using the drag and drop, check and other operating modes, users can set all functions, logic and content representation of the product. Through the RSS, open platform binding and self-publishing, and more, users can enrich the content of their applications. Appbyme was established in February 2012."
Appointy,https://www.crunchbase.com/organization/appointy,"SaaS, Scheduling, Small and Medium Businesses, Social Media",Appointy is an advanced web-based scheduling software tool which allows you to manage your clients and market your services by speeding up,Appointy is an advanced web-based scheduling software tool which allows you to manage your clients and market your services by speeding up your word-of-mouth publicity.
AppVested,https://www.crunchbase.com/organization/appvested,"Crowdfunding, Finance, Mobile, Venture Capital","AppVested.com is the premier ""niche"" equity-based crowdfunding platform that connects serious accredited investors.","AppVested.com is the premier """"niche"""" equity-based crowdfunding platform that connects serious accredited investors to carefully vetted, mobile application ideas (""""AppIdeas"""") in need of funding. By carefully selecting only the most opportune AppIdeas brought forth by willing and creative minded entrepreneurs, we look to develop, launch, and market each AppIdea using our proprietary """"AppValuation"""" method; an app-based business opportunity model.    The AppVentors (Creative Entrepreneurs) and AppVestors (Accredited Investors) in cooperation with our creative and skilled management team complete the circle.    Together, AppVested works to create real value for all parties. With qualified investment capital we FIND, FUND, and FACILITATE mobile applications to market.    AppVested - Where Bright Ideas and Smart Money Meet!"
Apertus Pharmaceuticals,https://www.crunchbase.com/organization/apertus-pharmaceuticals,"Biotechnology, Developer APIs, Manufacturing",Apertus Pharmaceuticals is an API manufacturing company that provides controlled and non-controlled substance APIs.,"Apertus Pharmaceuticals is an Active Pharmaceutical Ingredient, or API, manufacturing company targeting dosage form manufacturing companies within the pharmaceutical industry. Apertus Pharmaceuticals provides controlled substance APIs, non controlled substance APIs, and intellectual property to the pharmaceutical market. In addition, Apertus Pharmaceuticals utilizes the philosophies of Green Chemistry as outlined by the FDA and will target higher purity standards than those set by the current standard setting authorities. Apertus is led by CEO Rick Ryan, Ph.D. and CSO David Gindelberger, Ph.D."
Ap2e,https://www.crunchbase.com/organization/ap2e,"Electronics, Industrial, Manufacturing",Ap2e is a developer and manufacturer of industrial gas analysis systems.,Ap2e is a developer and manufacturer of industrial gas analysis systems. Creation of AP2E and development of partnerships with research centres for the transfer of innovative technologies at the service of industrial companies. 
Appest Limited,https://www.crunchbase.com/organization/appest-limited,"Apps, Internet",Appest Limited is the team behind TickTick.,"Appest Limited is an Internet company that created TickTick. Our mission is to help users accomplish more in less time. Core features of TickTick include: flexible recurring reminders, location reminder, create tasks via email, calendar subscription, calendar view, list sharing & comment, checklist, tags, multiple levels of priorities; TickTick works seamlessly across 10+ platforms, including Android, iPhone, Web, etc."
Aport,https://www.crunchbase.com/organization/aport,Search Engine,"Aport, former Russian search engine, is now a catalogue of goods developed by the director of Mamba.ru web-site Andrey Bronetsky","Aport.ru is an advanced commodity aggregator, covering almost the entire territory of the Russian Federation. Price comparison site covering consumer electronics and home appliances (mobile phones, computers, monitors, audio, video, photo, other goods). This platform was one of the first started in 1996 as a search system to index all ru.net. Site was started in 76 main regions, such as moskva.aport.ru, spb.aport.ru, ekaterinburg.aport.ru. More than 75% of traffic is generated in regions, 60% is organic traffic. Now Aport.ru is one of Top-5 product aggregators in ru.net, conceding yandex.market, wikimart and torg.mail.ru.  The platform operates with large data sets, which allows to maximally meet user needs. Catalog of goods includes more than 20 classifications, monthly audience is 2 000 000 unique visitors, number of pages viewed is equal to 15 000 000."
appweevr,https://www.crunchbase.com/organization/appweevr,"Ad Targeting, Analytics, Big Data, Natural Language Processing",Appweevr is a consulting company that helps online content publishers better understand their audience and create more engaging content.,"Appweevr keeps track of what engages your users and why.  Get high value content insights and behavioral segmentation based on participation. Appweevr is an accurate content and behavioral analytics engine that gets input from and provides output to appweevr website plugins or third party tools via an open API in order to engage audiences, provide customer intelligence and  target promoted content to registered users. Customers can opt-in unobstructive post-ads revenue models and provide API access to appweevr partners in order to monetize user participation"
ApexQubit,https://www.crunchbase.com/organization/apexqubit,"B2B, Quantum Computing, Software","Quantum computing software for banking, pharmaceutical, and automotive industries.","ApexQubit is developing quantum computing software for banking, pharmaceutical, and automotive industries using quantum algorithms for optimization, simulation, and machine learning."
Apax Group,https://www.crunchbase.com/organization/apax-group,"Commercial, Event Management, Marketing",Apax Group is a marketing firm that focuses on providing innovate commercial practices.,"Leading Experiential Marketing company in Asia Pacific, focusing on interpreting the brand’s DNA, providing innovative solutions, cross boundaries collaborations, integrating the quality global resources, interpreting the brand DNA through diversified brand interaction along with the best execution capability to achieve ultimate brand experience.  Three Divisions:  APAX EVENTS  APAX LIVE  APAX RECREATION in partnership Axis Mundi and Campaign China. APAX EVENTS Provides immersed “Experiential Marketing” service integrating all aspects of resources. We develop and deliver a wide range of services covering fashion, premium events, art exhibitions, retail design, as well as official fashion organization management. APAX LIVE Unite multicultural entertainment concepts and experiences. As the exclusive licensee of Fashion Rocks Asia, presents you with Asia's first Fashion Rocks in 2016 in Shanghai, followed by an Asia tour. SIFS Shanghai International Fashion Showcase. As the strategic partner of Shanghai Fashion Week, we bring the future of fashion to China and provide an ultimate business solution to new world-class designers and luxury/fashion brands into the Chinese market.  APAX RECREATION The World’s first Discovery Adventures Park officially launched in Moganshan. Discovery Adventures Moganshan Park is a perfect outdoor exploration and extreme sports destination which combines real geographic features, top level outdoor facilities, international safety standard, a complete system of courses & international professional coach team. Axis Mundi Two of Asia’s creative innovators, Film Director Wong Kar Wai and APAX Group have come together with their respective expertise in art, culture, entertainment and fashion to transform the idea of luxury events. Campaign China Campaign China creates intelligent retail solutions that push the boundaries of the consumer experience and transformative personalized brand spaces that define the retail landscape."
AppSecTest,https://www.crunchbase.com/organization/appsectest-asanalyzer,"Developer Platform, Mobile, Security",AppSecTest has developed the ASAnalyzer technology,ASAnalyzer helps gaming publishers detect European Union (EU) General Data Protection Regulation (GDPR) alignment issues in Android and iOS gaming apps.
Apisphere,https://www.crunchbase.com/organization/apisphere,"Ad Network, Advertising, Information Technology, Location Based Services, Mobile Apps","Apisphere, a geo-enabled mobility platform, enables organizations to mobilize business processes with continuous location capabilities.","The Apisphere Geo-Enabled Mobility (GEM) platform enables organizations to mobilize business processes with continuous location capabilitiesâ€¦from field service applications, mobile inspection, and mobile sales and customer relationship management (CRM), to mobile ad networks. The Apisphere GEM platform allows enterprises to integrate, extend and leverage investments in their existing IT infrastructure as they develop and deploy a mobile strategy."
