Organization Name,Organization Name URL,Categories,Description,Full Description
Vedantu,https://www.crunchbase.com/organization/vedantu-innovations,"EdTech, Education, Mobile, Tutoring",Vedantu is an interactive online tutoring platform for students. It offers individual and group classes delivered by experienced teachers,"Vedantu is India's leading Online education company which specializes in providing LIVE Interactive classes for students from some of India's best curated teachers. Vedantu`s USP is its quality of teachers. It has some 500+ teachers who have taught more than 1 Million hours to  40,000+ students spread across 1000+ cities from 30+ countries. Vedantu is founded by IITian friends who have been teachers themselves with over 13 years of teaching experience and having taught over 10,000 students.   Vedantu’s online teaching platform enables LIVE interactive learning between a teacher and a student. It offers individual and group classes. On Vedantu a teacher is able to give personalized teaching using two way audio, video, white boarding, chat and quizzing tools where both teacher and student are able to see, hear, write and interact in real-time. Students/Parents are also able to access content, take assessments and get their learning reports from the platform. Vedantu caters to 6th grade to 12th grade and prepares for school boards, competitive examinations and has co-curricular courses as well.   The name Vedantu is formed by two Sanskrit words  Veda (Knowledge) + Tantu (Network), signifying a 'Knowledge Network' where any student can tap into and learn from a teacher, anytime-anywhere."
VMware,https://www.crunchbase.com/organization/vmware,"Cloud Infrastructure, Cloud Management, Enterprise Software",VMware is a software company providing cloud and virtualization services.,"VMware is a software company providing cloud and virtualization services. The company accelerates digital transformation by enabling unprecedented freedom and flexibility in how their customers build and evolve IT environments. Its software helps business users simply and securely access the apps and data they need, from anywhere, to do their best work. Organizations can embrace innovation at scale for competitive advantage. The company was founded in 1998 and is based in Palo Alto, California."
Via,https://www.crunchbase.com/organization/via-transportation,"Mobile Apps, Real Time, Ride Sharing, Transportation, Travel",Via is on-demand transit on a mass scale.,"Via provides shared rides for an affordable flat rate. Operating in NYC, D.C. and Chicago, Via is changing the way people move around cities. They’ve built revolutionary technology that is changing the way people get around cities. Using Via, a ride booked on your phone costs little more than the bus. Via is on-demand transit on a mass scale; it’s transportation that’s friendly to their planet. Currently live in NYC and Chicago, they’re backed by some of the world’s top investors and aggressively expanding.  They’re looking for entrepreneurs who are excited about getting in on the ground floor of a fast-growing start-up; imaginative thinkers who relish wearing multiple hats and never back down from a challenge. They want people who get things done. They’re unusually selective in their hiring process. If you have a record of exceptional achievement, take intense pride in your work, and want to join a world-class team, they’d love to talk to you."
vCita,https://www.crunchbase.com/organization/vcita,"Billing, Contact Management, CRM, Email Marketing, File Sharing, Meeting Software, Payments, Small and Medium Businesses, Software","Business management app including Lead capturing, CRM, Online Scheduling, billing and file sharing, email marketing etc.","vCita is the #1 business management and client engagement app, designed to help small businesses grow. Tailored specifically for service providers, vCita redefines the way businesses interact with their clients, driving more opportunities from the web, mobile, email and social while empowering clients to self serve. vCita includes an online CRM to manage all client communications together with online scheduling , online payments, email & SMS campaigns, lead generating website widgets, and everything a small business needs to drive more business and provide great client service. Our team is based in Seattle, Washington and Tel-Aviv, Israel."
Varo Money,https://www.crunchbase.com/organization/varo-money,"Apps, Banking, Consumer, FinTech, Service Industry","Varo Money is mobile banking app with no account fees, high-yield savings, early direct deposit. Available iOS and Android.","Varo Money is on a mission to redefine banking so it’s easy for everyone to make smart choices with their money. In one mobile app, Varo offers customers no-cost premium bank accounts and high-interest savings accounts offered through The Bancorp Bank, and tech-first features to help people manage their money more easily. As a fintech leader, Varo has been granted preliminary approval for a de novo national bank charter by the Office of the Comptroller of the Currency (OCC), and is working to become the first mobile-centric national bank in U.S. history."
Vymo,https://www.crunchbase.com/organization/vymo,"Analytics, Apps, Mobile, SaaS, Sales Automation",Vymo is a personal assistant app that automates the activities of enterprise sales/service teams.,"Vymo is a personal assistant app that automates sales force activities, driving sales effectiveness. By capturing rich, contextual data, it generates actionable insights that help managers make need-based interventions to close more deals. The company’s aim is to help its clients achieve an unprecedented degree of sales productivity and effectiveness, and it brings together the combined experience of its team to achieve this. Vymo was founded in 2013 and is based in Bengaluru."
Verizon Communications,https://www.crunchbase.com/organization/verizon,"Communications Infrastructure, Information Technology, Mobile, Telecommunications",Verizon Communications is a broadband and telecommunications company that provides information and entertainment services.,"Verizon Communications is a broadband and telecommunications company that operates 4G LTE and 3G networks as well as provides information and entertainment services. The company serves mass market, business, government, and wholesale customers by delivering broadband and other wireline and wireless communication innovations. Verizon Communications Wireless operates America’s largest wireless network that serves nearly 102 million customers nationwide. Its wireline operations include Verizon Business and Verizon Telecom. Founded in 1983, Verizon Communications is headquartered in New York, United States."
Vice Media,https://www.crunchbase.com/organization/vice,"Media and Entertainment, News, Publishing, Video, Video Streaming",Vice Media is a North American digital media and broadcasting company.,"Vice Media, a global youth media company, engages in print, event, music, online, television (TV), and feature film business activities in the United States and internationally. It specializes in publishing a magazine that covers information in various subjects, such as sex, drugs, music, fashion, photos, travel, sports, technology, food, not safe for work, and conflicts.  Vice Media also produces and licenses its content for mobile, TV, film, and magazine companies and publishes videos across various content categories for the web. Moreover, it offers magazine subscriptions, books, and DVDs through its online store.  Gavin McInnes, Shane Smith and Suroosh Alvi founded Vice Media in 1994. Its headquarters is in Brooklyn in New York."
Velodyne LiDAR,https://www.crunchbase.com/organization/velodyne-lidar,"Machinery Manufacturing, Manufacturing, Robotics, Sensor",Velodyne LiDAR is a technology company that manufactures sensor products and real-time LiDAR sensors.,"Velodyne LiDAR is a technology company that manufactures sensor products and real-time LiDAR sensors.  It offers light detection and ranging scanners.  The company evolved after founder/inventor David Hall developed the HDL-64 Solid-State Hybrid LiDAR sensor in 2005. Since then, Velodyne LiDAR has emerged as the leading developer, manufacturer, and supplier of 3D real-time perception systems used in a variety of commercial applications including autonomous vehicles, vehicle safety systems, 3D mobile mapping, 3D aerial mapping, and security.  David Hall founded Velodyne LiDAR in 2007. Its headquarters is in Morgan Hill in California."
Vox Media,https://www.crunchbase.com/organization/vox-media,"Advertising Platforms, Digital Media, Internet, Journalism, Lifestyle, Sports",Vox Media is an American digital media company.,"Vox Media a media company, creates, publishes, and distributes online content, and connects young adults worldwide. It offers SB Nation, an online sports media brand and network of individual fan-centric sports communities, The Verge, a technology publication, Polygon, a publication for adult gamers, Vox.com, an interest news site, Eater, food and dining publication, Racked, a shopping, beauty, and fashion publication, Curbed, a real estate and home brand publication, and Re/code, a tech business publication.  Vox Media also operates Vox Creative, a division that creates marketing stories for brands. It also offers advertising services via Vox Advertising, and through an advertising solution Concert.  Markos Moulitsas, Joshua Topolsky, Jerome Armstrong, and Tyler Bleszinski founded Sportsblogs on July 14, 2003 that became Vox Media in 2012. Its headquarters is in the District of Columbia with additional offices in New York City."
Vonage,https://www.crunchbase.com/organization/vonage,"Messaging, Mobile, Telecommunications",Vonage offers VoIP services that enable anyone to make and receive calls from a touch tone telephone by using a broadband connection.,"Vonage is a publicly held provider of broadband VoIP services.  Their technology enables anyone to make and receive phone calls with a touch tone telephone almost anywhere a broadband Internet connection is available. Providing a robust suite of feature-rich residential and business communication solutions that offer flexibility, portability and ease-of-use across multiple devices designed to meet the needs of a wide range of customers.  Vonage was founded in 2001 and is headquartered in Holmdel, New Jersey. "
Volvo Cars Group,https://www.crunchbase.com/organization/volvo-car-corporation,"Automotive, Mobile, Transportation",Volvo Car Group is a Swedish automobile manufacturer.,"The first mass-produced Volvo car rolled off the production line in Gothenburg in 1927. Since then, they have delivered a steady stream of cars equipped with world-leading innovations. Today, they are one of the most well-known and respected car brands in the world with sales in about 100 countries. Volvo Car Group (Volvo Cars) is owned by Zhejiang Geely Holding (Geely Holding) of China. Volvo Cars formed part of the Swedish Volvo Group until 1999, when Ford Motor Company bought the company. In 2010, Geely Holding acquired Volvo Cars. They produce premium cars with the following body types: Sedans, Estates/Sportswagons, Cross Country vehicles, SUVs and Convertibles. Their cars are characterised by intuitive, human-focused, functional Scandinavian design and good craftsmanship. Relative to the strength of the brand, Volvo Cars is a small producer with global sales reaching 421,951 cars in 2012. Their largest markets are the United States, Sweden, China, Germany and the UK. Their corporate and brand strategy is ”Designed Around You” and puts people at the heart of everything they do. As a responsible company, they want to contribute to a more sustainable society. To ensure that they are in harmony with customers and society, they do their part by spearheading the development of sustainable mobility - from plug-in hybrids and all electric cars to active cooperation in a partnership project on road trains. They are proud to continuously deliver world-first solutions; innovations that put people first, by saving and simplifying their lives. Volvo Cars was owned by AB Volvo until 1999, when it was acquired by the Ford Motor Company as part of its Premier Automotive Group. Geely Holding Group then acquired Volvo Cars from Ford in 2010."
Veriflow,https://www.crunchbase.com/organization/veriflow-systems,"Cyber Security, Information Technology, Network Security, Predictive Analytics","Veriflow’s mission is to apply continuous verification to networks, preventing outages and vulnerabilities that lead to astronomical losses.","Veriflow brings formal verification to network infrastructure for the first time, continuously ensuring your network operates as intended. Veriflow predicts outages before they impact the business, and vulnerabilities before they are exploited, allowing IT teams to operate secure and resilient networks. Veriflow backed by New Enterprise Associates (NEA), Menlo Ventures, the National Science Foundation, and the U.S. Department of Defense. The company was founded in 2013 and is headquartered in San Jose, California."
Vivint Solar,https://www.crunchbase.com/organization/vivint-solar,"Clean Energy, Energy, Solar","Vivint Solar is a leading provider of simple, affordable solar solutions and one of the fastest growing residential solar power providers","Vivint Solar is a leading provider of simple, affordable solar solutions and one of the fastest growing residential solar power providers in North America. As an early adopter of the power purchase agreement (PPA) model, Vivint Solar designs, installs, and maintains cost-effective solar energy systems, allowing consumers to enjoy the benefits of solar with little to no up-front costs. The company is dedicated to providing superior service and support while helping consumers save money, gain energy independence, and go green"
Vuori,https://www.crunchbase.com/organization/vuori,"Brand Marketing, Fashion, Marketing, Retail, Sales",Vuori offers a collection of apparel brand for men and women.,"Vuori offers a collection of apparel brand for men and women. It sells shorts, pants, tops, graphic T-shirts, gift cards, hats, and clothing for yoga instructors, surfers, cross-fit instructors, personal trainers, and individuals.  Vuori offers its products through dealers in San Diego, Del Mar, and Solana Beach in California. Joseph Kudla founded Vuori on January 1, 2014, with its headquarters in Encinitas in California."
Versatile Natures,https://www.crunchbase.com/organization/versatile-natures,"Artificial Intelligence, Construction, Internet of Things, Machine Learning, Real Estate, Software","Versatile Natures transform every construction site into a truly profitable, smart, and safe work environment.","Versatile Natures's breakthrough technology transforms any site into a smart, data-collecting field, allowing us to provide detailed analysis on the project’s status while drastically improving onsite safety. ​ By delivering crucial, real-time actionable insights, their platform empowers construction managers to make more timely, informed decisions than ever before, ultimately accelerating the completion and increasing the profits of any project."
VeriSIM Life,https://www.crunchbase.com/organization/verisim-life,"Artificial Intelligence, Health Care, Machine Learning, SaaS","Computational Biology, Bioplatform, SaaS, Machine intelligence, personalized healthcare",VeriSIM is building personalized disease models that will change how patients' treatment is administered.
Volanty,https://www.crunchbase.com/organization/volanty,"Automotive, Internet, Marketplace, Peer to Peer",Volanty is a digital used car marketplace that digital second-hand car mall for pre-owned cars.,"Volanty is a digital used car marketplace that digital second-hand car mall for pre-owned cars. For the seller, the company simplifies the entire sales process from inspecting and photographing the car to negotiating with potential buyers while reducing bureaucracy.  For the buyer, Volanty makes buying used cars safe, convenient and more transparent by selecting only the best cars and providing thorough information about the vehicle and seller. They use technology to connect sellers and buyers securely and efficiently, eliminating middlemen such as stores and dealers and thus maximizing the selling value of your car.  The marketplace goal is to create a new era for those looking to sell or buy their car. Volanty was founded in 2017 and is headquartered in Rio de Janeiro."
Verishop,https://www.crunchbase.com/organization/proem-group,"E-Commerce, Internet",Verishop is a stealth company launching an online commerce platform targeting millennials,
Veritone,https://www.crunchbase.com/organization/veritone,"Computer Vision, Facial Recognition, Geospatial, Image Recognition, Information Technology, Machine Learning, Natural Language Processing, Search Engine, Speech Recognition, Visual Search",Veritone has created a future-proof AI platform that comprehends and transforms multiple forms of data to create actionable intelligence.,"Veritone is an artificial intelligence company that has developed aiWARE, an AWS-certified platform offering orchestrated, cognitive computing to transform and analyze structured and unstructured data for clients in a variety of markets, including media and entertainment, legal, compliance, and government. The open platform integrates an ecosystem of cognitive engines, which can be orchestrated together, and a suite of proprietary applications, to reveal unprecedented, multivariate insights from linear files such as radio and TV broadcasts, surveillance footage and public and private content globally. Veritone is the presenting sponsor of the Artificial Intelligence Marketplace at CES and has been recognized by Oracle for Excellence in Application Development. "
"Valimail, Inc.",https://www.crunchbase.com/organization/valimail,"Cyber Security, Email, Internet","Valimail offers comprehensive solution to stop fake email, protecting brands, and helping ensure compliance.","Valimail is an anti-phishing company that has been driving the global trustworthiness of email communications since 2015, with the only comprehensive solution for stopping fake email, protecting brands, and helping ensure compliance.  The company's unique authoritative anti-phishing approach protects customers’ own brand against impersonation globally and also protects them from malicious emails by ensuring that only trusted domains are allowed into the inbox. Valimail has won more than a dozen prestigious cybersecurity technology awards and authenticates billions of messages a month for some of the world's biggest companies, including Uber, Fannie Mae, WeWork, and the U.S. Agency for International Development."
Vena Solutions,https://www.crunchbase.com/organization/vena-solutions,"Enterprise Software, Finance, FinTech, SaaS, Software","Vena provides intuitive budgeting, planning and forecasting software for medium and large sized companies. ","Vena provides intuitive budgeting, planning and revenue forecasting software to medium and large sized companies. With over 400 global customers, Vena is the fastest growing company in its space, and the award-winning industry leader in ease of use and customer satisfaction. "
VentureBeat,https://www.crunchbase.com/organization/venturebeat,"Internet, Mobile, News, Social Media",VentureBeat is an online technology news platform that is engaged in technology publication and events business.,"VentureBeat is an online technology news platform that is engaged in technology publication and events business.    It delivers news, analysis, and events to provide context to help executives, entrepreneurs, and tech enthusiasts in making decisions while covering technology trends ranging from social to mobile, small business to enterprise, health tech, cloud, games, and more.    It is also known for providing news and perspective in various categories, including health, big data, lifestyle, business, marketing, cloud, media, deals, mobile, development, education, reviews, enterprises, science, entrepreneur, security, gadgets, small biz, green, and social fields.    Launched in 2006, VentureBeat is led by founder and CEO [Matt Marshall](http://www.crunchbase.com/person/matt-marshall), Editor-in-Chief [Dylan Tweney](http://www.crunchbase.com/person/dylan-tweney), and a team of experienced journalists. It is headquartered in San Francisco, C.A."
Visa,https://www.crunchbase.com/organization/visa,"Financial Services, Internet, Payments",Visa is an American multinational financial services company that facilitates electronic payment systems throughout the world.,"Visa is an American multinational financial services company that facilitates electronic payment systems throughout the world. The company operates the world’s largest retail electronic payments network through the transfer of value and information among financial institutions, merchants, consumers, businesses, and government entities.   Visa also provides electronic payment, risk management, and payment security solutions to online merchants; digital goods transactions services in online games, digital media, and social networks; and mobile financial services for mobile network operators and financial institutions in developing economies.   Visa’s global payment brands include Visa, Visa Electron, PLUS, and Interlink. Together they provide payment options through credit, debit, prepaid, and commercial programs in 200 countries and territories. Visa's global network, VisaNet, delivers value-added processing services such as fraud and risk management, dispute resolution, rewards, and other business-enhancing applications.    Visa was founded in 1958 and is based in San Francisco, California, United States."
Vlocity,https://www.crunchbase.com/organization/vlocity,"Enterprise Applications, Enterprise Software, Mobile, SaaS, Software","Vlocity is a leader in industry-specific cloud and mobile software, driving digital transformation for the world’s largest companies.","Vlocity is a leader in industry-specific cloud and mobile software, driving digital transformation for the world’s largest companies. A Forbes Cloud 100 company, Vlocity is an “industry cloud” pioneer built in partnership with Salesforce, the global leader in CRM. Vlocity’s cloud and mobile applications transform customer processes and experiences in the Communications & Media, Insurance & Financial Services, Health, Energy & Utilities, and Government & Non-Profit industries. Vlocity is a values-led company committed to customer, partner and employee success."
VTS,https://www.crunchbase.com/organization/vts,"Asset Management, Commercial Real Estate, Enterprise Software, Financial Services, Leasing, Professional Services, Real Estate, SaaS, Software","VTS empowers landlords and brokers to better attract, convert, and retain valuable assets and tenants.","VTS empowers landlords and brokers to better attract, convert, and retain valuable assets and tenants by centralizing all of the critical data and workflows in one place. Founded with a mission to revolutionize commercial real estate through innovation, VTS is a leasing and asset management platform. The company provides an easy-to-use, intuitive platform that empowers commercial real estate professionals to work smarter not harder. It delivers a modern toolset to unlock the full potential of a portfolio. It optimizes performance and revenue with the data needed to make better decisions faster. Over 7 billion square feet is managed on the VTS platform by a user base. The firm's client roster comprises global commercial real estate leaders including Boston Properties, Beacon Capital Partners, Equity Office, LaSalle Investment Management, Hines, JLL, and CBRE. VTS was founded on 2012 and is based in New York."
VeganNation,https://www.crunchbase.com/organization/vegannation,"Cryptocurrency, FinTech, Information Technology, Internet","VeganNation is a global, vegan-friendly, decentralized nation powered by blockchain technology and using VeganCoin to conduct transactions."," VeganNation is the first global vegan-friendly decentralized nation. Based on the blockchain technology, a designated cryptocurrency and a sharing economy platform, VeganNation will create a fully functioning ecosystem, uniting hundreds of millions of vegans from around the world into a single vast global community and providing services (as a nation would do) spanning economy, technology, content, marketplace and more. "
Volocopter,https://www.crunchbase.com/organization/volocopter,"Aerospace, Air Transportation, Robotics, Software",Volocopter are building the world’s first manned fully electric and safe air taxis.,"Volocopter are building the world’s first manned fully electric and safe air taxis. With the Volocopter they will redefine the way people move in cities and make humanity’s dream of personal flight come true. As pioneers in this field, they wrote aviation history in 2011 with the first ever manned flight of a multicopter. This feat was followed by milestones like the first license and the worldwide first autonomous flight in a megacity."
