Organization Name,Organization Name URL,Categories,Description,Full Description
Zynga,https://www.crunchbase.com/organization/zynga,"Gaming, Mobile, PC Games","Zynga develops, markets, and operates social games as live services played on the Internet.","Zynga develops, markets, and operates social games as live services played on the Internet, social networking sites, and mobile platforms in the United States and internationally. It offers its online social games primarily under the Slots, Words With Friends, Zynga Poker, and FarmVille franchises. The company’s games are accessible on mobile platforms, Facebook, and other social networks, as well as Zynga.com. It also provides advertising services to advertising agencies and brokers."
Zymergen,https://www.crunchbase.com/organization/zymergen,"Artificial Intelligence, Big Data, Bioinformatics, Machine Learning, Robotics","Zymergen researches, develops, and manufactures microbes for Fortune 500 companies.","Zymergen researches, develops, and manufactures microbes for Fortune 500 companies. It develops molecules for agriculture, chemicals, materials, pharmaceuticals, electronics, personal care, and more applications.  Zymergen’s platform integrates automation, machine learning, and genomics to navigate the genomic search space. It uses a technology platform to optimize strains in that improves economics; improves the existing production strains within existing manufacturing processes; and improves the correlation between the lab and commercial manufacturing.  Moreover, Zymergen offers new product development, such as engineering any molecules from any microbes that improves the power of biology to develop novel products. Jed Dean, Joshua J. Hoffman, and Zachary Serber founded it in 2013, with its headquarters in Emeryville in California with an additional office in Seattle in Washington."
Zyper,https://www.crunchbase.com/organization/zyper,"Advertising Platforms, Brand Marketing, Computer Vision, Loyalty Programs, Software",Zyper is a machine learning-led community marketing software.,"Zyper wants to re-create social networks for brands by connecting them to their top fans to drive engagement, insights and sales."
Zylo,https://www.crunchbase.com/organization/zylo,"Enterprise Software, SaaS","Zylo is focused on unlocking the full potential of SaaS for buyers, providers, and users alike.","It is the leading SaaS optimization platform that transforms how companies manage and optimize the vast and accelerating number of cloud-based applications organizations rely on today. The platform provides an online command center for all cloud-based software used across a company, giving an organization visibility into what software is used, how much is spent and how to optimize their cloud software investments."
Zylotech,https://www.crunchbase.com/organization/dataxylo,"Analytics, Artificial Intelligence, Big Data, Software",Self-learning customer data platform platform that enables clients to cross-sell / up-sell to their customers.,"Zylotech’s Self-Learning CDP provides B2B organizations with a complete, unified view of all customer data empowering cross-functional teams with greater agility, efficiency, and consistency. This approach is leading to new operational strategies that address each stage of the customer journey to meet evolving requirements. Zylotech has developed its Revenue Operations (RevOps) Framework to provide the necessary guidance for B2B organizations to meet these evolving requirements and to break through marketing, sales and customer operations silos to establish alignment across customer-facing teams."
Zymeworks,https://www.crunchbase.com/organization/zymeworks,"Biotechnology, Medical, Therapeutics",Zymeworks is a computational biotechnology company focused on optimizing therapeutic antibodies and other protein-based therapeutics.,"Zymeworks Inc. is a privately held biotherapeutics company based in Vancouver, British Columbia. Zymeworks is committed to developing best-in-class protein therapeutics for the treatment of cancer, autoimmune and inflammatory diseases. Zymeworks' approach combines proprietary molecular modeling and simulation software with high-performance computing to create an environment for in silico experimentation and predictive protein optimization. Using this approach Zymeworks has developed multiple platform technologies to advance the field of biologics drug discovery and optimization."
ZypMedia,https://www.crunchbase.com/organization/extendtv,"Advertising, Advertising Platforms, Local Advertising",ZypMedia is a programmatic media buying platform for local advertising.,"Zypmedia provides local ad sales executives and their customers an opportunity to grow their business and evolve with a changing media environment. ZypMedia is a full-stack digital advertising technology platform that combines the power of machine learning with the intelligence of human experts to specialize in local-focused advertising. The company's innovative, intelligent tools enable you to bridge the audience gap between traditional and digital worlds, expand your offerings to better reach your local audience, and significantly grow your revenue."
Zycada Networks,https://www.crunchbase.com/organization/zycada-networks,"B2B, Mobile, SaaS",The Zycada Orchestration Network enhances any multi-CDN/Cloud environment to give every device the best possible Quality of Experience,"Powered by AI, the Zycada Orchestration Network fingerprints and optimizes every connection individually and in real-time to deliver the best Quality of Experience. In less than 30 minutes, Zycada enhances any multi-CDN, multi-Cloud or telco environment, requiring no code changes or SDK."
Zype,https://www.crunchbase.com/organization/zype,"Cloud Computing, Digital Media, Mobile Advertising, Video, Video Streaming",Zype is the cloud video distribution service for OTT that makes it easy for content owners to connect with their audiences on every screen.,"Zype is the cloud video distribution service for OTT that makes it easy for content owners to connect directly with their audiences on every screen. Zype provides push button app publishing, monetization, streaming, audience management, and analytics that is integrated into hundreds of OTT apps and engaged by millions of viewers every month.  With Zype, enterprise content owners and brands can own and accelerate all aspects of their video distribution pipeline."
zyBooks,https://www.crunchbase.com/organization/zybooks,"E-Learning, Education, Publishing",zyBooks publishes interactive textbooks that utilizes animations and embedded tools.,"zyBooks was started in 2012 by Smita Bakshi and Frank Vahid. Frank is a Computer Science and Engineering professor at the University of California, Riverside, and Smita, prior to her 10 years in the high-tech industry, and was a UC Davis Electrical Computer Engineering professor.We started zyBooks to help college STEM (Science, Technology, Engineering, and Math) students graduate. More than half of STEM students don't achieve their STEM degrees, and many students are tripped up by their early STEM classes. Part of the problem is the huge mismatch between today's students and traditional (and increasingly expensive and bloated) textbooks, forcing instructors to teach with one hand tied behind their back. Meanwhile, the real power of the web for learning—interactivity—has barely been tapped.  So, we started creating zyBooks—STEM material native for the web—using ""less text, more action."" zyBooks have minimal text, and instead consist of question sets, animations, interactive tools, and embedded homework, so students can learn by doing. We developed a platform to author, deliver, and continually support and improve zyBooks, vowing to always do right by the student and instructor.  We keep prices as low as possible, provide the best support we can, and make the zyBook platform easy to use for students and instructors. zyBooks are collaboratively authored by talented teams of professors, content developers and software engineers.  Professors include Roman Lysecky (University of Arizona), Sandy Irani (UC Irvine), and Andre Knoesen & Raj Amirtharajah (UC Davis). Starting with just a handful of universities in 2012, our computer science and engineering zyBooks are now used at over 200 colleges and universities and a few dozen high schools."
ZYRL,https://www.crunchbase.com/organization/zyrl-ecdd,"Advertising, Emerging Markets, Social Media, Social Media Marketing",Empowering business through customers.,"ZYRL is a technology company that has simplified operations and marketing for quick service businesses. We start with the ZYRL Kiosk, a self-service device that allows customers to seamlessly select, customize, and pay for their order all from a gorgeous touchscreen. User data from the ZYRL Kiosk enables businesses to target new and existing customers with automated social media marketing. Through their dashboard, owners can see sales data and marketing results in real time."
Zyme Solutions,https://www.crunchbase.com/organization/zyme-solutions,"Hardware, Management Information Systems, Software",Zyme Solutions provides channel data integrity and intelligence solutions to the high-tech and consumer electronics industry.,"Zyme Solutions is the leading provider of channel data integrity and channel intelligence solutions to the high-tech and consumer electronics industry. Zyme was founded in 2004 to address the need for technology companies to intelligently manage global indirect channel sales and inventory data and increase channel visibility. Today, industry leaders like Symantec, Xerox, Linksys and Sandisk use Zyme's proven services to manage their sales channels"
ZYUS,https://www.crunchbase.com/organization/zyus,"Biopharma, Health Care, Life Science, Pharmaceutical",ZYUS is a globally focused biopharmaceutical company that offers patients cannabinoid and other phyto-therapeutic medical solutions.,ZYUS is a globally focused biopharmaceutical company that offers patients cannabinoid and other phyto-therapeutic medical solutions.
Zydus Cadila,https://www.crunchbase.com/organization/zydus-cadila,Health Care,"Zydus Cadila is a fully integrated, global healthcare provider, with strengths all along the pharmaceutical value chain.","Zydus Cadila is a fully integrated, global healthcare provider, with strengths all along the pharmaceutical value chain. With a core competence in the field of healthcare, Zydus Cadila provides total healthcare solutions ranging from formulations, active pharmaceutical ingredients and animal healthcare products to wellness products."
Zyllem,https://www.crunchbase.com/organization/zyllem,"Delivery, E-Commerce, Information Technology, Internet, Local, Logistics, Supply Chain Management, Transportation","Zyllem is the leading provider of fast, cost-effective, and reliable on demand delivery service in Singapore and Malaysia.","Zyllem entered the Singapore logistics market in 2014 as an innovative local startup aiming to transform logistics. Today, Zyllem is an established frontrunner in last-mile deliveries, as well as the developer of one of the region’s most advanced and accessible logistics technology platforms for ecommerce players. We provide a cutting-edge platform that seamlessly connects and gives access to multiple courier networks. Entirely accessible online and on mobile, we connect the market’s network of logistics suppliers to businesses and individuals, offering a variety of services including fast, cost-effective and reliable on demand delivery services. In 2015, Zyllem expanded its Singapore operations to Malaysia. With a ‘think big’ attitude, we changed our name to Zyllem in 2016 with a promise to ‘Open Your World’. Inspired by the botanical word ‘Xylem’, a tissue found in a plant that transports nutrients to the furthest reaches of the plant, Zyllem aspires to transport your goods to the furthest reaches of the globe, supporting and connecting individuals and businesses alike. Our customers are at the heart of every move we make and we aspire to grow with you, whether you’re an MNC, startup or one-time user."
Zynstra,https://www.crunchbase.com/organization/zynstra,"Information Technology, Retail Technology, Small and Medium Businesses, Software",Zynstra is transforming edge computing at the retail edge.,"Zynstra is transforming edge computing at the retail edge.  Its Intelligent Infrastructure is specifically designed and built for the retail edge, not the datacenter.  It leverages intelligent automation to transform the way thousands of distributed sites are managed. By choosing Zynstra, the retail edge becomes the source of your competitive advantage in an era where superior customer experience is not only a great-to-have, but a must-have.  You establish a lasting platform where new innovative apps and services are tested and launched to delight consumers at the retail edge, all while driving down operational costs and better managing risk. With its DNA deeply rooted in edge software products, Zynstra provides purpose-built edge infrastructure for the world’s largest, most distributed, innovation-driven enterprises.  Zynstra is a strategic partner of HPE in delivering intelligence infrastructure – under the HPE Proliant Easy Connect brand – and is based in the United Kingdom."
Zynerba Pharmaceuticals,https://www.crunchbase.com/organization/zynerba-pharmaceuticals,"Developer Tools, Pharmaceutical, Product Design","Zynerba Pharmaceuticals, Inc. develops pharmaceutical products via dermal solutions to treat a various neuroscience disorders","Zynerba Pharmaceuticals is dedicated to the development of innovative transdermal cannabinoid treatments for patients with high unmet medical needs using modern drug delivery technology and appropriate regulatory pathways. Zynerba is developing two therapeutic candidates based on proprietary transdermal technologies that, if successfully developed, may allow sustained, consistent and controlled delivery of therapeutic levels of cannabinoids. Transdermal delivery reduces adverse effects associated with oral dosing. ZYN001 will be studied in fibromyalgia, neuropathic pain and chronic cancer pain utilizing a synthetically manufactured prodrug of THC in a transdermal patch to deliver THC through the skin and into the bloodstream. Zynerba expects to initiate ZYN001 Phase 1 clinical studies in 2Q 2015. ZYN002 will be studied in epilepsy and rheumatoid arthritis, utilizing a proprietary gel to deliver synthetically manufactured cannabidiol (CBD), a non-psychotropic cannabinoid, through the skin and into the bloodstream. Zynerba expects to initiate ZYN002 Phase 1 clinical studies in 3Q 2015. Learn more at www.zynerba.com and follow the company on Twitter at @ZynerbaPharma."
Zynapp,https://www.crunchbase.com/organization/zynapp,"Digital Entertainment, Digital Media, Enterprise Software","Your digital life, your way","Zynapp experience life, we make footprints and we collect memories. They believe that finding, viewing and organizing your digital information can be done in a smarter way, more like we humans naturally think."
ZynBit,https://www.crunchbase.com/organization/zynbit,"Analytics, Marketing Automation, Sales Automation, Software",ZynBit is one of the fastest growing Salesforce integration apps for Outlook,"a mission to change the way sales, marketing, and customer support happens. No more data-entry, reporting, cold calling, chasing, or any other monotonous non-sense. Turn Outlook into your personal secretary, your website into customer insights, and your CRM into a money making mint. ZynBit frees you up to do what you do best when you're at work, so you can do more of what you love when you're not."
"Zymr, Inc.",https://www.crunchbase.com/organization/zymr-inc-,"Android, Apps, Big Data, Cloud Computing, Enterprise Software, iOS, Mobile, SaaS, Software","Cloud software product engineering services in domains of Apps, Mobility, Security, Orchestration and Infrastructure.","Zymr offers cloud computing solutions to a global roster of technology companies. From our headquarters in Silicon Valley we curate the latest technologies to offer cloud applications, cloud mobility, cloud orchestration, cloud infrastructure, and cloud security services to our customers. With integrated cloud, mobility and UI design competencies, we operate as a one-stop technology partner for modern enterprises seeking to develop and leverage their existing core IP. We also offer several technology accelerators to increase cost-effectiveness and reduce time-to-market."
Zyston,https://www.crunchbase.com/organization/zyston,"Cyber Security, Network Security, Security","Zyston, a new company providing strategic information security advisory services","Founded in 2016, Zyston is a strategic information security advisory firm offering tailored solutions that allow corporations across the globe to make informed, intelligent decisions when it comes to their organization's most mission-critical assets. Zyston exists to help business leaders navigate a complex market of software vendors and instead focus on the alignment of security to tangible business needs. Zyston believes the DNA of an effective information security program is wrapped around knowing your business, understanding the threat landscape and developing sustainable programs that combat potential attacks.  Zyston also delivers the human capital expertise required to implement and execute strong and sustainable information security programs. Simply put, the team at Zyston – which includes former CISOs of Fortune 250 organizations and leading industry authorities – provides clarity around complexity, equipping clients with the knowledge and skills needed to confidently and effectively protect their organizations."
Zygo Corporation,https://www.crunchbase.com/organization/zygo-corporation,"3D Technology, Manufacturing, Optical Communication",Zygo Corporation develops high end optical systems and components for metrology and end-user applications.,"ZYGO designs, manufactures, and distributes high-end optical systems and components for metrology and end-user applications. ZYGO has two divisions: Metrology Solutions Division and Optical Systems Division. The Metrology Solutions Division is comprised of three business units: Precision Positioning Systems, Vision Systems, and Instruments. This division's products employ various optical phase analysis techniques for measuring displacement, surface shape and texture, and film thickness."
Zyga Technology,https://www.crunchbase.com/organization/zyga-technology,"Health Care, Medical, Medical Device",Zyga Technology is a surgical solutions provider developing & commercializing medical devices for treating spine problems.,"Zyga Technology is a surgical solutions provider developing & commercializing medical devices for treating spine problems. In addition to the SImmetry Sacroiliac Joint Fusion System, the company is also developing the Glyder Facet Restoration Device. Zyga has put together a team of engineers, marketing personnel, and management with significant experience developing medical devices for the spine industry. Zyga Technology was founded in 2008 and is headquartered in Minnesota, USA."
Zygo,https://www.crunchbase.com/organization/zygo-8b2e,"Fitness, Hardware, Sports, Swimming, Wearables, Wellness",Fitness tech,"Zygo is transforming the way we swim through underwater streaming audio and live coaching, and - like Peloton - guided workout content to instruct and inspire."
ZYOMYX,https://www.crunchbase.com/organization/zyomyx-inc,"Biotechnology, Health Diagnostics, Pharmaceutical","Zyomyx develops and commercializes diagnostic platforms, including a point-of-care test for HIV/AIDS.","Zyomyx has a unique expertise in and passion for tackling difficult “outside-the-box” problems. Highly user-friendly, instrument-free point-of-care tests need to be designed with an advanced level of cartridge engineering and reagent stability, and aligned with aggressive cost targets. Zyomyx specializes in exactly these demanding product requirements.  Our immediate focus is an advanced, but simple to use and inexpensive CD4 T-cell point-of-care test that will be launched globally and configured to especially meet the demanding specifications for use in low and middle income countries."
Zylö Therapeutics,https://www.crunchbase.com/organization/zylö-therapeutics,"Pharmaceutical, Therapeutics",Zylö Therapeutics has an innovative sustained-release drug-delivery system.,"Zylö Therapeutics has an innovative sustained-release drug-delivery system that was developed by Joel Friedman MD PhD, Adam Friedman MD FAAD, and Andrew Draganski PhD. The delivery system uses patented hydrogel-derived nanoparticles, called Nanopods™, to deliver—in a sustained and controlled manner—notoriously hard-to-deliver therapeutic agents through topical administration."
Zymochem,https://www.crunchbase.com/organization/zymochem,"Biotechnology, Chemical, Industrial",Zymochem develop microbes & bioprocesses that enable profitable & eco-friendly production of chemicals from renewable sources such as sugar.,"The world they live in is built from petroleum. The paints on their walls, the carpets in their homes, the tires on their cars, the plastics for everyday consumer goods – these and many more products are made from chemicals that are mostly made from petroleum, creating a $3 trillion/yr industry. To fulfill their dependency on petroleum, they do crazy things like setting up oil rigs in the middle of the ocean and drilling several miles into the ocean floor! They’ve done these things because they have had no alternative to meet their needs. Not anymore! Over the past decade, advances in engineering microorganisms have afforded us the opportunity to make the same chemicals that are traditionally made from petroleum. Instead of requiring raw materials buried deep within the earth, microbes can use abundant and renewable sources of carbon such as sugars during processes akin to brewing beer. Despite the numerous advantages, making chemicals this way at the industrial level is still rare. This is because it’s still more expensive than using petroleum for producing the chemicals.  Although a few challenges need to be solved to usher in the era of renewable chemicals, a fundamental constraint that limits the economic competitiveness of using microbes is the loss of at least 33% of the carbon as carbon dioxide waste during the fermentation – think of this as the head on your beer. Because of this carbon loss, potential product is simply not made. In technical terms, the maximum achievable yields are 67%. As sugars are the most expensive component of a bioprocess, making the carbon dioxide waste translates to as much as 20% of total costs, which severely hampers the economics of the bioprocess and its competitiveness with petroleum-based production methods. At ZymoChem, they are re-imagining the microbe, one that is designed to eliminate (or substantially reduce) carbon loss during the production of chemicals. To do this, they had to design a completely new biosynthetic pathway – one that doesn’t exist in nature – to make the chemicals. Each individual step of this pathway is designed to not lose carbon as carbon dioxide, enabling their biosynthetic pathway to retain all of the sugar’s carbon into the final chemical product. This carbon conservation allows their approach to have superior theoretical yields, up to 50% better than existing state-of-the-art technology! In turn, their technology has the potential to substantially lower production costs and drastically improve cost-competitiveness for making a variety of chemicals from renewable sources, even at today's oil prices."
Zyptonite,https://www.crunchbase.com/organization/zyptonite,"Information Technology, Software, Telecommunications, Video Chat","Zyptonite provides secure and private, decentralized (peer-to-peer) enterprise communication and collaboration software.","Zyptonite provides high quality mobile and desktop video and audio communication through pure peer-to-peer architecture. It works more robustly than Skype and other applications relying on traffic passed through servers. Unlike our competition, our calls won't disconnect even at 0kbps making it ideal for mobile users on spotty networks. As there are no servers, all communication remains strictly between the participants - third party marketing and other data collection is not possible."
Zylox-Tongqiao Medical,https://www.crunchbase.com/organization/zylox-tongqiao-medical,Health Care,Zylox-Tongqiao Medical is an interventional and implantable peripheral vascular device developer.,
Zyngenia,https://www.crunchbase.com/organization/zyngenia,"Biotechnology, Health Care, Medical",Zyngenia is a biotherapeutics company focused on the development of the next-generation of antibody-derived drugs.,"Founded in 2008, Zyngenia, Inc. is a privately held biotherapeutics company focused on the development of the next-generation of antibody-derived  drugs. The company uses proprietary technology to enable the development of singular molecular entities that address two or more targets, by combining the activity of two or more biologic therapies into one protein (known as a Zybodyâ„¢). In addition, the technology will also be applied to drug targets that previously have not been reachable through the use of traditional, single specificity, monoclonal antibodies."
