Organization Name,Organization Name URL,Categories,Description,Full Description
Agari,https://www.crunchbase.com/organization/agari-data,"Cyber Security, Fraud Detection, Network Security, SaaS, Security",Agari provides email threat prevention and protection service leverages AI cybersecurity to protect organization.,"Agari is transforming the legacy Secure Email Gateway with its next-generation Secure Email Cloud™ powered by predictive AI. Leveraging data science and real-time intelligence from trillions of emails, the Agari Identity Graph™ detects, defends, and deters costly advanced email attacks including business email compromise, spear phishing and account takeover."
Agrosmart,https://www.crunchbase.com/organization/agrosmart,"Agriculture, AgTech, Farming, Internet of Things",Agrosmart offers smart farming software that allows remote monitoring of agroeconomic data for managerial automation.,"Agrosmart offers smart farming software that allows remote monitoring of agroeconomic data for managerial automation. They are the Latin America leader in agricultural digital platform and their mission is to make agriculture more productive, sustainable and resilient to climate change. As children and grandchildren of rural producers, they know well the challenges faced by farmers. They believe that data science is the most powerful tool to help them overcome these challenges in food production. Knowing this, they work hard in developing specific solutions to multiple parts of the value chain, from the seed to the table, bringing intelligence in order to make the food chain more resilient, transparent and sustainable."
Agilence,https://www.crunchbase.com/organization/agilence,"Cloud Computing, Computer, Enterprise Software, Food and Beverage, Retail, Software, Video",Agilence is the leader in exception reporting and business intelligence solutions for retail loss prevention and operations.,"Agilence Inc. is the industry leader in Next-Generation Exception-Based Reporting solutions for Retail Loss Prevention and Operations.  Agilence develops Retail 20/20™, an intelligent store-level reporting solution that provides visibility into daily store operations to reduce fraud and increase efficiency.  Retail 20/20 provides users with a complete view of their business, empowering them to make informed decisions faster, to increase efficiency and improve profit margins across the enterprise. Founded in 2006, Agilence, Inc. is headquartered in Mount Laurel, NJ. To learn more about Agilence, Inc. please email sales@agilenceinc.com or call 856-366-1200."
Agrostar,https://www.crunchbase.com/organization/agrostar,"Agriculture, AgTech, E-Commerce, Internet, Software",Agrostar manufactures and distributes organic fertilizers.,"Agrostar manufactures and distributes organic fertilizers. It offers a range of products that include organic manures, micronutrients, and growth promoters to meet the specific requirements of basal, drip, and foliar applications of farmers.  Agrostar's products include PowerGrow organic soil nutrition, an organic fertilizer made from plant extracts; PowerGrow organic liquid fertilizers; and SuperSero, a bio-organic plant nutrient made from a mixture of botanical extracts and natural minerals. It also sells various agro commodities comprising oil seeds, such as natural sesame, soybean, ground nuts, mustard seeds, and sunflower seeds; fennel, cumin, chili, black and white pepper, ginger, and other spices; feeds, including soyabean meal and corn; and chick pea, wheat, castor cake meal, and other commodities. It serves farmers and other buyers in India and internationally.  Sitanshu and Shardul Sheth founded Agrostar in 2008. It has its headquarters in Pune in India."
AgroSavfe,https://www.crunchbase.com/organization/agrosavfe,"Agriculture, AgTech, Biotechnology",AgroSavfe is a green biotech company that employs its proprietary Agrobody™ technology platform to develop crop protection products.,"AgroSavfe, a Gent, Belgium-based green biotech company."
Age of Learning,https://www.crunchbase.com/organization/age-of-learning,"E-Learning, EdTech, Education","Age of Learning provides a comprehensive and engaging online curriculum for pre-k, kindergarten, and early elementary school programs.","Age of Learning is a leading education technology innovator, creating engaging and effective learning resources to help children build a strong foundation for academic success.  Founded in 2007 and based in Los Angeles, the company blends educational expertise, innovative technology, and insightful creativity to bring learning to life. Age of Learning’s flagship product in the U.S., ABCmouse.com® Early Learning Academy, is a research-validated, comprehensive curriculum for preschool through 2nd grade, available on all major digital platforms and used by millions of children in their homes, more than 100,000 classrooms, and thousands of public libraries. "
Agora.io,https://www.crunchbase.com/organization/agora-io,"Broadcasting, Developer APIs, Developer Tools, Mobile, Real Time, Software, Video, Web Development","Agora.io enables developers to add HD interactive broadcast, voice, and video calls into mobile and web apps through SDK.","Founded in 2014, Agora is a high-growth Communications-Platform-as-a-Service (CPaaS) provider delivering mobile-first, real-time communications for developers and businesses globally. Agora's API is the most widely adopted API for real-time communications around the world, installed on more than 500 million devices and rapidly growing. The Agora real-time communication stack includes features like include voice calling, video calling, group conferencing, interactive broadcasting, and much more. Reliable, accessible and scalable, Agoria.io provides communications services to organizations across industries, including telemedicine, education, financial services, customer service, social media applications, and mobile gaming. Agora is headquartered in Santa Clara, CA and backed by venture capital firms Morningside, SIG, GGV Capital, ShunWei, and IDG."
Agolo,https://www.crunchbase.com/organization/agolo,"Apps, Artificial Intelligence, Information Technology, Natural Language Processing, News",Agolo summarizes information faster and with broader coverage than any human.,"Agolo is the world’s most advanced summarization software. Connect to news, documents, cloud storage to create summaries in real-time. Agolo’s team is led by a Columbia PhD natural language processing expert and a Columbia MBA Rakuten engineer who worked directly with its CEO, Hiroshi Mikitani, an Agolo investor."
Agrivida,https://www.crunchbase.com/organization/agrivida,"Biofuel, Biomass Energy, Biotechnology","Agrivida is an agricultural biotechnology company that creates renewable, biomass-based alternative fuels and raw materials.","Agrivida, Inc., an agricultural biotechnology company, creates renewable, biomass-based alternative fuels and raw materials. It develops corn varieties that are optimized for producing ethanol from corn stover. Ethanol is a clean-burning, renewable fuel that can be used as a gasoline additive or a gasoline replacement. The company was founded in 2002 and is based in Cambridge, Massachusetts."
AgilOne,https://www.crunchbase.com/organization/agilone,"Advertising, Analytics, Big Data, Business Intelligence, Marketing, SaaS","AgilOne is a predictive marketing platform that offers better customer profiles, predictive analytics and integrated marketing campaigns.","AgilOne is a cloud-based predictive marketing platform. The AgilOne platform combines advanced database management, predictive customer analytics, and integrated campaign management. This combined functionality enables marketers to fully understand each customer and to send the most effective marketing messages. AgilOne creates more enjoyable customer experiences and higher revenues by offering more accurate customer profiles and better predictive targeting. The platform optimizes customer engagement, increases repeat purchases and creates more profitable relationships by growing customer lifetime value across channels."
Agenus,https://www.crunchbase.com/organization/agenus,"Biotechnology, Medical Device, Therapeutics",Agenus develops and commercializes immunotherapies and vaccines for cancer and infectious diseases.,"Agenusbio's scientists, researchers, biotechnologists, physicians, and businesspeople working to bring new medicines to market. Faster. Because they know this isn't about them. It's about the millions of patients waiting to benefit from their discoveries. Co-founded in 1994 by Garo Armen and Pramod Srivastava as Antigenics, their company has outgrown its name but never its raison d'être: to develop and commercialize breakthrough immunotherapies for cancer and infectious diseases. Today they’re reaching far beyond antigens and discovering new ways to speed our their progress. Because they know the patient is waiting. At today’s Agenus (Nasdaq: AGEN), now more than ever before, they are inspired by the power of ideas, by the application of science, and by the deep convictions and commitment they share with their growing circle of partners and collaborators."
AgeX Therapeutics,https://www.crunchbase.com/organization/agex-therapeutics,"Biotechnology, Health Care, Therapeutics",AgeX is a biotechnology company focused on the development of novel therapeutics for age-related degenerative disease.,"AgeX is a biotechnology company focused on the development of novel therapeutics for age-related degenerative disease. AgeX’s mission is to apply the proprietary technology platform related to telomerase-mediated cell immortality and regenerative biology to address a broad range of diseases of aging. The current preclinical development efforts include two cell-based therapies derived from telomerase-positive pluripotent stem cells and two product candidates derived from the company’s proprietary induced Tissue Regeneration (iTR™) technology. AGEX-BAT1 and AGEX-VASC1 are cell-based approaches in the preclinical stage of development comprised of young regenerative cells modified using AgeX’s UniverCyte™ technology facilitating immune tolerance, formulated in HyStem® matrix, designed to correct metabolic imbalances in aging and to restore vascular support in ischemic tissues respectively. AGEX-iTR1547 is a drug-based formulation in preclinical development intended to restore regenerative potential in a wide array of aged tissues afflicted with degenerative disease using the company’s proprietary iTR technology."
AgBiome,https://www.crunchbase.com/organization/agbiome,"Agriculture, Biotechnology, Service Industry",AgBiome discovers and develops innovative biological and trait products for crop protection.,"AgBiome is a biotechnology company using new knowledge of the plant-associated microbiome to create innovative products for agriculture. Partnerships with leading agricultural companies to accelerate our discovery process and allow us to deliver solutions for global markets. We employ 85 full-time and 2 part-time employees and occupy a state-of-the-art 30,000 square foot laboratory and greenhouse facility in the Research Triangle Park in Durham, North Carolina. AgBiome’s products will help farmers combat many of the most important unsolved problems in agriculture, including insects, nematodes, and diseases."
AgaMatrix,https://www.crunchbase.com/organization/agamatrix-inc,"Health Care, Medical Device, Mobile Apps",AgaMatrix develops and manufactures a line of diabetes products designed to improve the quality of diabetes care.,"AgaMatrix develops and manufactures a line of diabetes products designed to improve the quality of diabetes care. The company’s products feature WaveSense, a new technology that personalizes each test to provide world class accuracy. It detects and corrects for many errors caused by differences in blood samples and environmental conditions. Zero-Click™, the WaveSense diabetes data management system, was designed to simplify data download. WaveSense and Zero-Click consist of six FDA-cleared products and are protected by a suite of more than 160 patents worldwide."
AGERpoint,https://www.crunchbase.com/organization/agerpoint,"Agriculture, Farming, Information Services, Robotics",AGERPoint-- Defining a new technological space for the growers' industry with cutting-edge information solutions and expertise.,"AGERPoint-- Defining a new technological space for the growers' industry with cutting-edge information solutions and expertise. We’ve developed a series of industry-leading technologies that are redefining data acquisition, analysis, and translation for growers, giving personnel at all levels access to mission critical data they need to drive a business forward."
Agrevolution,https://www.crunchbase.com/organization/dehaat,"Agriculture, E-Commerce, Internet",Agrevolution is an online marketplace for farm products and services.,"DeHaat™ is a technology-led platform to offer end to end agriculture services to Indian farmers with an aim to improve the efficiencies of agriculture value chain. DeHaat™ connects small farmers to their various needs – Seeds, fertilizers, equipment, crop advisory, and market linkage through a wide network of trained micro entrepreneurs. Registered farmers get access to a wide range of agricultural inputs (Seed, Fertilizer and Crop protection) directly from competitive sources. Subsequently, they get customized crop reminder call in the local language as well as crop monitoring support from same DeHaat™ micro-entrepreneur. Lastly, they sell the farm produce directly to institutional buyers. Farmers place their various demand related agri input, field visit or agri output either through the toll-free number or mobile application and get last mile services through assigned micro-entrepreneur."
Agora,https://www.crunchbase.com/organization/agora-systems,"Artificial Intelligence, Construction, Logistics, SaaS, Supply Chain Management",The materials management platform for modern construction companies,
AgDevCo,https://www.crunchbase.com/organization/agdevco,,"AgDevCo is a social impact investor and agribusiness project developer, incorporated as a non-for-profit distribution, limited companyin.",
AgileCraft,https://www.crunchbase.com/organization/agilecraft,"Information Technology, Service Industry, Software",AgileCraft is an all-in-one agile management suite built from the ground up to support scaled agile software development,"AgileCraft is an all-in-one agile management suite built from the ground up to support scaled agile software development. From small teams to large distributed enterprises, AgileCraft can help companies scale agile faster, easier and with better results."
Agorize,https://www.crunchbase.com/organization/agorize,"Apps, Crowdsourcing, Innovation Management, Internet, Recruiting",Agorize helps businesses to innovate and identify the best talent.,"Agorize designs online communities that help organizations create, host, broadcast, and manage innovation challenges. It offers Studyka, a student challenges platform that allows organizations to access a community of international students, communicate their initiatives, and identify innovative ideas.  Agorize also offers Hackateam, a platform for online hackathons that enables organizations to connect with IT profiles; and access its network of partners, associate their companies with innovative startups, and meet the talented people. Moreover, the company offers UpWeStart platform that allows organizations to identify and select startups through business challenges; communicate their initiatives to startups; and build up their corporate communication strategies.  Agorize has been collaborating with well-known companies such as Google, Microsoft, Bank of America, Uber, Paypal, Great Place to Work, HP, Orange, Philips, Allianz, AXA, Publicis, Unibail-Rodamco, Vinci, Engie, and Ericsson. It relies on open innovation and crowdsourcing to help companies connect with over 5 million innovators.  Further, it offers Agorize platform that helps organizations launch customized challenges and engage employees, customers, partners, and key communities for the development of their businesses. Charles Thou and Mathieu Toulemonde founded Agorize in 2011, with its headquarters in Paris in France and branches in San Francisco in the United States, Stuttgart in Germany, Quarry Bay in Hong Kong, and Montreal in Canada."
Agoric,https://www.crunchbase.com/organization/agoric,"Blockchain, Cryptocurrency, Developer Platform, E-Commerce Platforms, Software","Agoric provides a framework for programming smart contracts securely and with ease, beyond anything available today.","Agoric is a framework that provides security and ease in programming smart contracts, beyond anything available today. Agoric’s mission is to provide a secure smart contracts framework to the entire blockchain ecosystem. With Agoric, which makes it easier to build and deploy smart contracts in JavaScript, millions of programmers worldwide will have safer, simpler tools to build smart contracts and applications. In addition, composability enables rapid development and competitive advantage. With secure smart contracts, we envision unprecedented, widespread forms of global cooperation, and entrepreneurs creating fundamentally new businesses enabled by digital assets. Agoric is here to make that opportunity a reality. The Agoric team includes world-class technologists, economists, business leaders and community builders on a quest to bring smart contracts into the future. Members of the Agoric team have been professional collaborators in smart contracts technology for over 30 years, and have now reunited to enact this mission. Agoric has collaborated with Cosmos and other well-known projects, and is backed by Outlier Ventures, Kilowatt Capital, gumi Cryptos Capital, MetaStable Capital, Lemniscap, Xpring, Rockaway Blockchain and the Interchain Foundation, as well as additional funding from Naval Ravikant and Polychain."
Agios Pharmaceuticals,https://www.crunchbase.com/organization/agios-pharmaceuticals,"Biotechnology, Health Care, Pharmaceutical",Agios Pharmaceuticals is a biopharmaceutical company discovering and developing therapeutics for cancer metabolism.,"Agios Pharmaceuticals, Inc., a biopharmaceutical company, discovers and develops therapeutics in the field of cancer metabolism. It also develops drugs that focus on glycolysis, fatty acid metabolism, and autophagy. The company's therapeutics are used in the areas of autoimmune, inflammatory, and neurological diseases. Agios Pharmaceuticals, Inc. was formerly known as CANCER METABOLISM THERAPEUTICS, INC. and changed its name to Agios Pharmaceuticals, Inc. in April 2008. The company is based in Cambridge, Massachusetts."
Agara Labs,https://www.crunchbase.com/organization/agara-labs,"Artificial Intelligence, Customer Service, Enterprise Software, Machine Learning",Deep learning powered predictive customer support solution,Deep learning powered predictive customer support solution
Agile Stacks,https://www.crunchbase.com/organization/agile-stacks-inc,"Artificial Intelligence, Cloud Computing, Cloud Infrastructure, Data Center Automation, Infrastructure, Machine Learning, Open Source",DevOps for Machine Learning,"Agile Stacks provides DevOps automation platform for cloud infrastructure and machine learning. We help companies to accelerate software delivery and data science with composable, automated stacks.  Agile Stacks Machine Learning Stack allows to automate the entire data science workflow, from data ingestion and preparation to deployment and ongoing operations."
Agendia,https://www.crunchbase.com/organization/agendia,"Biotechnology, Genetics, Health Diagnostics, Life Science, Medical",Agendia provides molecular diagnostics and personalized treatment plans for cancer patients.,"Agendia's molecular diagnostic technology provides cancer patients and their physicians with a glimpse into their genome, answers to the most pressing questions and enables personalized treatment plans. Agendia’s breast cancer tests were developed using an unbiased gene selection by analyzing the complete human genome.  Agendia’s tests can help physicians assess a patient’s individual risk for metastasis, which patients may benefit from chemo, hormonal or combination therapy, and which patients may not require these treatments and can instead be treated with other, less arduous and less costly methods."
AgNext,https://www.crunchbase.com/organization/agnext-technologies,"Agriculture, Analytics, Big Data, Farming",AgNext is an agricultural sensing and solutions company.,AgNext is an agricultural sensing and solutions company. AgNext provides unique platform for analytics-as-a-service using Agriculture Imagery & IOT devices. AgNext would be keen to hear and work with various agricultural stakeholders who would like to implement data-driven solutions in agriculture
Aggregate Knowledge,https://www.crunchbase.com/organization/aggregateknowledge,"Advertising, Big Data, Predictive Analytics, Risk Management",Aggregate Knowledge is a media intelligence company that enables advertisers to reach the highest performing customers on a single platform.,"Aggregate Knowledge (AK) is the only media intelligence company that offers advertisers and agencies an exact science to pinpoint where to reach highest performing customers in a single platform. AK’s patented media intelligence platform (MIP) is the only data management solution that combines both media and audience data, enabling marketers to most effectively allocate media dollars, resulting in increased reach, higher sales and dramatically improved media spend efficiency."
AgriWebb,https://www.crunchbase.com/organization/agriwebb,"E-Commerce, Enterprise Software, Livestock, SaaS","AgriWebb leverages technology to intuitively solve time, management, and cost drains for livestock production.","Designed after months of consultation with farmers, AgriWebb leverages technology to intuitively solve time, management and cost drains for livestock production. AgriWebb coordinates a tablet application, an online sales platform, and custom sensors designed to give time back to managers and improve profits. The tablet application is a multi-purpose, simple to use tool that records all management information in real-time and with instant back-up. No longer will users have to transfer information from a pocket notebook to a computer. The AgriWebb Auction site replaces the traditional antiquated stockyard auction process with a streamlined online marketplace. The site is integrated with the tablet, automatically updating life-cycle information, increasing transparency and trust for buyers while returning margins to sellers. With customers signed up to the beta trial and a round of funding in place, AgriWebb is poised to disrupt the $1.4 trillion livestock agriculture industry."
Aginity,https://www.crunchbase.com/organization/aginity,"Analytics, CRM, Marketing Automation, Predictive Analytics",Aginity transforms the way companies compete on analytics. Build Your Analytics Once - Use Everywhere.,"Founded in 2005, Aginity transforms the way companies compete on analytics. Aginity Amp software enables companies to create, catalog and manage analytics as assets which can be reused consistently everywhere in the enterprise. Customers have seen significant operational cost savings and achieved improvements in business outcomes by applying the governed, reusable analytics that Amp enables. Amp software is deployed globally with the support of partners including IBM, Cloudera and Hortonworks. Aginity is a privately held software company headquartered in the Chicago area."
Agilyx,https://www.crunchbase.com/organization/agilyx,"Recycling, Renewable Energy, Sustainability",Agilyx is an alternative energy company that converts waste plastics into synthetic crude oil through an environmentally positive process.,"Agilyx is an alternative energy company that uses patented, proven and commercially viable technology to convert difficult-to-recycle waste plastics into synthetic crude oil through a process that is scalable, versatile and environmentally positive."
AgriTask,https://www.crunchbase.com/organization/scantask,"Agriculture, AgTech, Analytics",AgriTask provides a holistic data-driven agronomic management platform that improves the productivity of farmers worldwide,"AgriTask provides a holistic agronomic management platform that improves the productivity of agriculture via extensive use of ag-data, AI products and advanced technologies. AgriTask’s geographic platform and proprietary ‘operating system for agriculture’, facilitate integration with many software and hardware data sources, and the support of a huge variety of agricultural clients worldwide (Growers of any crop, Multi-farm corporates, Ag-buyers, Ag-Insurance / Finance, Government regional projects, etc.) indifferent of their own specialized work methods and needs."
agrilution,https://www.crunchbase.com/organization/agrilution,"Agriculture, AgTech, Artificial Intelligence, Farming, Internet of Things, Personal Health, Smart Home","agrilution is developing smart devices to grow fresh, healthy food in your home.","agrilution is developing smart devices to grow fresh, healthy food in your home."
