Organization Name,Organization Name URL,Categories,Description,Full Description
Vobi,https://www.crunchbase.com/organization/vobi,"Collaboration, File Sharing, Mobile, SMS, Video Conferencing","From mobile to desktop, Vobi connects teams and content in context to work - anywhere, anytime, any device in one seamless conversation.","Vobi provides instant collaboration video/voice/messaging/document and screen sharing across iOS/Android/Web/Windows/Mac. Vobi leverages the power of the network to deliver rich content based on the context of the conversation (who is calling whom, their location, their communication history). Network and call events can automatically trigger collaboration sessions pre- populated with content relevant for the conversation. Based in Austin, Texas, Vobi is backed by VC investor Trailblazer Capital."
VODECLIC,https://www.crunchbase.com/organization/vodeclic,"E-Learning, Education, Software, Training","Vodeclic is a cloud-based training company for software programs, web apps and cloud services.","Vodeclic is a cloud-based training company for desktop software, web apps and cloud services. With over 16,000 how-to videos in six languages (English, German, French, Spanish, Portuguese and Mandarin Chinese) – and 1000+ new additions each month – Vodeclic.com is an all-in-one solution designed to help users enhance their digital, internet and collaborative skills. The solution features exclusive courses and learning tools for all users, as well as business analytics and SCORM Compliance tools such as APIs for enterprise customers, from SMB to Fortune 500. Vodeclic is trusted by 1,1 million Cloud subscribers, 4,500+ customers in 12 countries with 6 different languages packs."
VoxPop Clothing,https://www.crunchbase.com/organization/voxpop-clothing,"E-Commerce, Fashion, Wearables",Vox Pop Clothing is not just an apparel company; we are a whole new culture that’s ready to emerge.,"Vox Pop Clothing is not just an apparel company; we are a whole new culture that’s ready to emerge. They believe that at the core of fashion lies expression. That’s the very reason behind our brand name: VOX POP, which means 'voice of the people'. True to its name, they are a collage of unique expressions, designed for people who can speak their mind and wear their attitude. And every time someone chooses a Vox Pop tee, they become a part of a community of believers for the same cause. It’s an iconic tribute to all the symbols and images that the world admires."
Voxel Worlds,https://www.crunchbase.com/organization/voxel-worlds,Real Estate,Voxel Worlds is a U.S. technology company that aims to revolutionize the way real estate is bought and sold through virtual reality.,
Vocinity,https://www.crunchbase.com/organization/vocinity,"Artificial Intelligence, Machine Learning, Natural Language Processing",Voice based conversational IVR and customer support solutions,
Voddler,https://www.crunchbase.com/organization/voddler,"Broadcasting, Internet, Media and Entertainment, Video, Virtual Reality",Voddler offers VoddlerNet technology which is a virtual cable TV system facilitating online video streaming and content consumption.,"Voddler, Inc. provides virtual cable television system. It offers VoddlerNet technology, which enables viewers to watch television programs, movies, and various video contents. The company primarily operates in the United States and Europe. It serves media producers, aggregators, and distributors.  Voddler was founded in 2005 and is based in Stockholm, Sweden."
Voter Gravity,https://www.crunchbase.com/organization/voter-gravity,"Data Center, Enterprise Software, Management Consulting",Voter Gravity is a voter data management system with an integrated map-based canvassing tool and virtual phone bank.,"Voter Gravity empowers campaigns to unleash their voter contact efforts, making your strategy bigger, faster, and more targeted than ever before."
Volumina Medical,https://www.crunchbase.com/organization/volumina-medical,"Biotechnology, Life Science, Manufacturing, Medical",Volumina is active in field of tissue engineering and develops injectable 3D scaffolds for the reconstruction of volumes of soft tissues.,"Volumina is active in the field of tissue engineering and develops injectable 3D scaffolds for the reconstruction of volumes of soft tissues (fat, muscles, glandular tissues, supporting and connective tissues) that have been lost after tumor ablation, disease, trauma, or for purely esthetically purposes."
VONZU,https://www.crunchbase.com/organization/vonzu-tech,"Delivery, Last Mile Transportation, Logistics, SaaS, Software",Last Mile Logistics Management Platform (B2B SaaS),
Volunteer World,https://www.crunchbase.com/organization/volunteer-world,"Adventure Travel, Non Profit, Tourism, Travel",Volunteer World is the leading comparison platform that connects international volunteers and NGOs on a global scale.,"Volunteer World, the first independent platform that connects volunteers and social projects on a global scale. The comparison platform for international volunteer opporunities provides a community marketplace for people to list, discover, and apply to international volunteer opportunities. Volunteer World’s mission is to have lasting positive impact on the volunteer market by providing cost and service transparency of volunteer programs as well as significantly simplifying the search and application process."
Voiceable,https://www.crunchbase.com/organization/voiceable-8556,"Customer Service, Internet, Mobile, Productivity Tools, Software","Voiceable is voice-activating the internet, to make customer experiences faster, easier and more fun","Voiceable develops solutions to enhance customer experience through voice. With improved capabilities, voice features have become second nature to consumers, from smartphones to smart speakers, voice has proven to be the effective way to communicate with users. The company's team are experienced entrepreneurs, engineers, and creative thinkers with a background in voice UI and machine learning. ​Voiceable is based in Tel-Aviv, Israel."
Volumatik,https://www.crunchbase.com/organization/volumatik,"3D Printing, 3D Technology, Automotive, CAD, Industrial Design, Jewelry, Manufacturing, Product Design","Design, 3D-modeling, 3D-printing services.","Have a great idea for a product but not sure how to bring it to life? Volumatik is a platform that lets anyone become an innovator by simply sharing their creative ideas and product concepts. We help you transform your ideas into real products by providing you with affordable design, 3D modeling, and 3D printing services. We find solutions for any project and budget and guide you through the entire implementation process online. The 3D printing technology is now innovating the design process. Volumatik makes this technology more accessible enabling you to take charge of your ideas and make them into real products. We believe that design skills are no longer necessary for starting up a successful product.  Spark the idea with your creative mind, and Volumatik will take on the technological part of the process. Once you bring us the idea of your project, we will take you through the entire process of product development: design, 3D modelling, 3D printing, packaging, and manufacturing. As the result, you get a tangible product ready to go on the market. Share your ideas on the Volumarket and get visibility, inspirations, and business connections by joining the global community of designers, entrepreneurs, and creative professionals. Your Volumatik profile lets you follow other Volumatik users, make connections, and link your social media profiles - all to get more visibility for your skills and projects. Whether you need assistance with your project or want to prove your design skills, the Volumatik network will help you connect with the right people."
Vonvo,https://www.crunchbase.com/organization/vonvo,"Crowdfunding, News, Non Profit, Video Chat",Vonvo is a video events platform and donation tool for NonProfits. Think Google Hangouts meets KickStarter,"Short for video convo, Vonvo is a real-time video events platform and online donation tool.  It was designed specifically to help non-profits increase awareness and raise funds to fuel their programs.  Vonvo brings non-profit marketing and fundraising efforts to a new level with technology that makes learning about social issues and donating more engaging and cost-effective than in-person events. Mission:  To connect non-profit’s with donors in a way that drives advocacy, donations, and results."
Vognition,https://www.crunchbase.com/organization/vognition,"Manufacturing, Natural Language Processing, Smart Home",Vognition's smart home voice portal solution.,"People want to use voice to control their smart home… And they want to use any mobile phone, wearable, smart home controller and voice portal to give voice commands. We have the solution.​"
Voya Financial,https://www.crunchbase.com/organization/voya-financial-2,Financial Services,"Voya Financial is an American financial, retirement, investment and insurance company based in New York, New York.",
VoipSwitch,https://www.crunchbase.com/organization/voipswitch,"Information Technology, Mobile, Public Relations, Telecommunications, VoIP",VoipSwitch focuses on developing softswitch platform solutions for global telecommunications service providers.,"VoipSwitch Inc. a subsidiary of Voiceserve Inc. is an applications development company that is focused on developing high quality, scalable, and cost efficient VoIP softswitch platform solutions for global telecommunications service providers. The company is utilizing its proprietary solutions to enable operators to deliver secure, reliable VoIP-based services which are fully interoperable with other established VoIP standards and systems. The VoipSwitch platform is the key competitive differentiator for the company. All key elements necessary for successful VoIP implementations are included in its infrastructure solutions including Class 4 and 5 capabilities as well as session border controllers. This integrated softswitch and billing solution provides competitive advantage and makes the platform exceptionally easy to implement and manage."
Voice of America,https://www.crunchbase.com/organization/voice-of-america,News,"Voice of America is an external broadcast institution that offers the latest news from the U.S., Africa, Asia, and the Mideast.","Voice of America is an external broadcast institution that offers the latest news from the U.S., Africa, Asia, and the Mideast. It also covers sections such as science and technology, health, entertainment, economy, and more. Voice of America provides its news through broadcast on radio and television in over 43 languages. Voice of America was founded in 1942 and is based in Washington, D.C, United States."
Vollar,https://www.crunchbase.com/organization/vollar,"Blockchain, Financial Services, FinTech, Information Technology",Vollar is a digital currency earned by doing good alongside local nonprofit organisations.,
VocaSee,https://www.crunchbase.com/organization/vocasee,"Big Data, Software",VocaSee develops technological systems for automatic transcription of video and audio clips.,
VoteBash,https://www.crunchbase.com/organization/votebash,"Advertising, Brand Marketing, Digital Media, Market Research, Real Time, Social Media Marketing",VoteBash is a visual real-time research tool with brand amplification and personalization.,"VoteBash gives brands real-time feedback, the ability to create brand ambassadors and a new way to retarget for future advertising. The way it works is that brands ask questions and people are incentivized to vote, which creates viral sharing. It is always free for consumers to vote. You can ask timely questions, create incentives for people to vote, create brand ambassadors with a viral VoteBash pin-button, get real-time feedback and re-target your voters with a personalized message. VoteBash was launched in 2014 by <a href=""/person/martijn-atell"" rel=""nofollow"">Martijn Atell</a>. It is based in Raleigh, N.C. The application is available for Mac, PC, iOS, and Android."
Voucher Code White Label,https://www.crunchbase.com/organization/voucher-code-white-label,"Advertising, Internet, Publishing, Social Media",Traditional media companies have a reputation for slow adaptation to current trends in media.,"As technology continues to advance, industries such as traditional media need to seek other revenue options to stay afloat in today's market. Online ads were the answer to adapting to modernization in the past, but funding is drying out. Advertising revenue in the United States has drastically fallen from $65 billion to $19 billion between 2000 to 2016. Traditional media publishers are obligated to look into Voucher Code White Label partnerships to keep up with today's changing industry. It is common for many traditional media companies to adapt slowly to new digital media advantages. The slower companies adapt to modern technological advances, the more outdated their advertising strategies become, and the more gradual their market moves. To increase their advertising speed, as well as their revenue stream, publishers have to continue to find creative new ways to utilize what options prove potentially as more profitable. Voucher Code White Label partnerships are the modern answer. Publishers can diversify their revenue with little risk through partnering with Voucher websites. Another benefit publishers experience, when working with Voucher Companies and White Label Coupon sites, is the opportunity they provide for their company to receive full sales funnel optimization. The companies who want to survive and thrive in the dying traditional media industry must decide to adopt the modern trend of publishers partnering with Voucher Code White Label solutions."
Vootabs Unboxed,https://www.crunchbase.com/organization/vootabs-unboxed,Shopping,"hop for Certified Unboxed electronics online in India- Browse latest Certified Unboxed mobiles, desktops, laptops, tablets with minimum...",
Voxel Healthcare,https://www.crunchbase.com/organization/voxel-healthcare,"Health Care, Medical",Clinical Decision Support for Pediatric Radiology,"Voxel Healthcare, a medical imaging cloud-based AI startup, aims to revolutionize medical imaging diagnostics by bringing in 3D quantitative measures of images."
Volvo Trucks,https://www.crunchbase.com/organization/volvo-trucks,Automotive,"A global truck manufacturer based in Gothenburg, Sweden.","Volvo was founded in 1927 and in 1928 they produced our first truck. Much has happened since then, but some things have not changed at all. They still think that everything can be done better. The desire to solve problems that they often are the first in the world with many innovations and technological achievements. Therefore, Volvo Trucks has become the vehicle manufacturer that promote development. The ability to improve in combination with our three core values ​​- quality , safety and environmental care - characterizes everything they did, everything they do and everything they will do in the future. Find a dealer near you"
Voliro Airborne Robotics,https://www.crunchbase.com/organization/voliro-airborne-robotics,"Drones, Software",Voliro aims to provide innovative UAVs with unique capabilities.,"Voliro aims to provide innovative UAVs with unique capabilities. They promote the concept of omnidirectional aerial vehicles, where position and orientation of the flying platform are completely independent. This ability is crucial to achieve robust and reliable interaction with the environment.  Voliro offers solutions where aerial physical interaction is needed. They are targeting applications such as contact-based inspection of infrastructure, painting and cleaning."
VoiceLab,https://www.crunchbase.com/organization/voicelab,"E-Commerce Platforms, FinTech, Internet of Things, Mobile, Social Impact, Telecommunications","We enable communication through speech recognition and voice biometrics. It can be used for IVR, mobile applications, Internet of Things.",The company has developed  a speech to text technology-based solutions applicable for call centers and mobile applications. The technology has been developed by Jacek Kawalec – CTO Wirtualna Polska for many years and by Tomasz Szwelnik – a scientist with his academic roots linked with Gdańsk University of Technology. The idea derives from the need of entities operating in the financial market that have multiple problems with security systems. The solution is also commercialised by the Polish Justice System where the solution is to read biometry and verify data correctness.
Vortex IoT,https://www.crunchbase.com/organization/vortex-iot,"Information Technology, Software",Information Technology and Services ,
VoxEra,https://www.crunchbase.com/organization/voxera,"Mobile, Telecommunications, Tourism, Travel",VoxEra is a roaming-free device for travellers.,"VoxEra has solved the major problem that affected everyone,It is time to wave bye to roaming bills. It is the time you can travel freely with no restrictions with your family and friends without incurring any roaming fee with the new VoxEra."
VOCA AS,https://www.crunchbase.com/organization/voca-as,"Artificial Intelligence, Internet, Machine Learning, Robotics",VOCA AS is an innovative robot vision and artificial intelligence technology platform has been developed for offshore industry applications.,"VOCA AS is an innovative robot vision and artificial intelligence technology platform has been developed for offshore industry applications. The VOCA EngineTM is continously being further developed with new features, algorithms and support for new sensor technologies and hardware. The company has gained extensive experience with research and development of robot vision/computer vision/machine vision software and algorithms for use in harsh, uncontrolled environments. This includes object detection and identification, navigation and mapping (SLAM), 3D reconstruction, pattern recognition and motion estimation. "
Voice Assist,https://www.crunchbase.com/organization/voice-assist,"Cloud Data Services, Information Technology, Messaging, Mobile, Software, Speech Recognition, Telecommunications",Voice Assist is a hosted speech applications company enabling access to any information through any device using speech technology.,"Voice Assist is a hosted speech applications company focused on enabling access to any information through any device using speech technology. There award-winning technology allows consumers and business clients to use simple voice commands to dial, email, text or post to social networks. The company offers private labeled versions to wireless and wireline carriers, as well as marketing companies. Voice Assist functionality powers many new service offerings, including a safe driving application that enables drivers to keep their eyes on the road rather than on the phone. Maximizing driving safety and improving personal productivity are just a few of its many benefits."
Vodafone Germany,https://www.crunchbase.com/organization/vodafone-germany,"Information Technology, Mobile, Telecommunications","Vodafone Germany is a telephone company that offers data plans for mobile, DSL, and landline services.","Vodafone Germany is a telephone company that offers data plans for mobile, DSL, and landline services. It provides mobile networks in 26 countries (including joint ventures and associates) and fixed services in 17 of these. There are 49 countries where the company holds no equity interest but have partnership agreements with local mobile operators for them to use its products and services and in some cases its brand. It has a significant presence in Europe, the Middle East, Africa and Asia Pacific through the company's subsidiary undertakings, joint ventures, associated undertakings, and investments."
Vodis Pharmaceuticals,https://www.crunchbase.com/organization/vodis-pharmaceuticals,"Cannabis, Health Care, Medical, Pharmaceutical",Vodis Pharmaceutics offers medical and recreational marijuana business for consumers in the U.S. and Canada.,"Vodis Pharmaceutics Inc.Vodis is one of North Americas foremost brand names in the medical and recreational (where legal) marijuana business with operations in both the US and Canada. Its master grow teams have consistently won or placed at each competition they have entered with their “VIP” brand.  The Company, with facilities in BC and Washington State, is also actively looking into expansion opportunities in other countries and US states."
VOKLE,https://www.crunchbase.com/organization/vokle,"Broadcasting, Software, Video Streaming",VOKLE is a live town hall platform enabling speakers to broadcast their live videos and audios to a virtual auditorium of viewers.,"Vokle is a live town hall platform that allows speakers to broadcast their live video and audio to a virtual auditorium of viewers and take live video calls and text questions from the audience. Hosts can assign roles to any attendee in the audience.  Whether it be co-host(s) for the event, screener(s) to screen callers privately behind the scenes, or an editor to cut between video streams live. The entire application is a microsite, allowing it to be embedded anywhere as easily as a youtube video, giving each event the potential for endless access points without ever redirecting the audience from the site they're on."
VOICEPLATE.COM,https://www.crunchbase.com/organization/voiceplate-com,"Advertising, Advertising Platforms, Apps, Internet, Social Network, Software",VoicePlate allows users to create websites using modern design and user-friendly editing tools on a networking platform.,"Having a professional web presence is vital to the success of every business and individual. As advertising and marketing budgets exceed billions of dollars per year, VoicePlate aims to provide the best methods to advertise, network and communicate for the lowest cost.  VoicePlate allows users to create websites using modern design and user-friendly editing tools on an advanced networking platform. VoicePlate empowers professionals with numerous business applications from video streaming and photo galleries to social apps.  VoicePlate uses an open-ended design that encourages creativity and innovative expansion. Ultimately, VoicePlate seeks to enable every business, employee, entrepreneur and unemployed individual by forging purposeful, mutually beneficial and professional relationships."
VON FLOERKE,https://www.crunchbase.com/organization/von-floerke,"E-Commerce, Fashion, Lifestyle, Retail","VON FLOERKE is specialised in handmade accessories such as ties, bow ties and coloured socks but also hand finished shirts.","VON FLOERKE is founded in 2014 by David Schirrmacher, then 21, in Bonn, Germany and is specialised in handmade accessories such as ties, bow ties and coloured socks but also hand finished shirts. After its participation in 2015 in the ""Die Höhle der Löwen""​ show (Germany version of Shark Tank) it reached nation-wide attention and is since then represented in over 250+ wholesale stores in the D-A-CH area and opened three gentlemen boutiques (Köln, Düsseldorf, Münster) and a showroom for private buying events in Bonn. In 2017 it acquired Germany's oldest textile manufacturing highly specialised in handmade accessories as bespoke suits and shirts. Currently the company employs 50 people."
Voilà Learning,https://www.crunchbase.com/organization/voila-learning-2,"Education, Language Learning, Non Profit",Voilà Learning is a Tech-Ed organization that specializes in the language learning using Virtual Reality.,"Voilà is an Ed-Tech organization mandated by multiple school boards to create designed solutions for students and school boards Voilà uses Virtual Reality, apps, gamification and online homework help. Today, our organization is proud to use a human-centered design approach to answer the need of thousands of teachers, students, and parents. Our common goals: - to encourage students to do better, - to help parents meet the needs of their children, - and to help school boards offer after-school programs on-site and online."
Voo,https://www.crunchbase.com/organization/voo-2,"Apps, Internet, Software, Video Chat",Voo builds chat platform apps that help users better interact with their city.,Voo builds chat platform apps that help users better interact with their city.
