Organization Name,Organization Name URL,Categories,Description,Full Description
Geolab-IT,https://www.crunchbase.com/organization/geolab-it,"Oil and Gas, Software",Geolab develops software and provides services in the field of data processing for prospecting and exploration of oil and gas.,"Service company “GEOLAB” renders a full complex of services on interpretation processing of seismic data. The key interests of the company is a constant development of algorithms and techniques for building time and depth-velocity models and images of the environment.   The company's team consists of graduates of leading Russian Universities (Moscow state University named M.V. Lomonosov, Moscow physical-technical Institute, Moscow Institute of physics and Informatics, Russian state University of oil and gas named I. M. Gubkin), having extensive experience in handling land, sea and borehole seismic data from various regions of the world.   Leading specialists of the Department of new technologies of the company are the disciples and followers of Vladimir Markovich Gluhovskogo, the outstanding Russian Geophysics and mathematics, the author of the concept of interpretation of seismic data processing.   The simultaneous conduct of research work, confirmed by a large number of scientific publications in the leading specialized editions, together with the practical implementation of major projects on processing of geophysical data in the interests of customers creates all necessary conditions for work on complex and non-standard tasks in the field of seismic prospecting of mineral resources.   Currently, our subsidiary company ""GEOLAB-IT"", a resident of the SKOLKOVO Foundation implements the project on creation of a fundamentally new software system for high-precision construction depth-velocity models and deep images of the environment in seismic survey, which will be multiplied reduce the risks related to prospecting, exploration and development of mineral resources."
GE Plastics,https://www.crunchbase.com/organization/ge-plastics,"Logistics, Manufacturing","GE Plastics was the branch of General Electric who manufactured plastics, and was part of the GE Industrial division.","GE Plastics was the branch of General Electric who manufactured plastics, and was part of the GE Industrial division. GE Plastics in 1971 a branch in Bergen op Zoom established. Initially this was a joint venture with Akzo , and later this joint venture was dissolved and the company continued as GE Plastics. There were eleven factories located on the site and the number of employees grew to 1500. Here were include Lexan pellets produced. This relates to polycarbonate , which is used among other things as replacement for break-resistant glass window and in CD's. In addition, Noryl ( polyphenylene oxide , a so-called 'engineering plastic') and BPA (bisphenol-A, a raw material for epoxy resins and polycarbonate ) produced. As a raw material is, inter alia, chlorine is used, that at the location is obtained by membrane electrolysis of common salt . Since salt water as a waste product released is the location on a salt surface is required. Annual production in 1990 was about 46 kt and 51 kt chlorine caustic soda . The complex is in 2007 taken over by the Saudi company SABIC , after General Electric found that it was too little profit. It also includes the headquarters of the division: Sabic Innovative Plastics , as well as a distribution center."
GenLife,https://www.crunchbase.com/organization/genlife,"Health Insurance, Information Technology, InsurTech, Life Insurance",GenLife is an intelligent Insurance platform.,"GenLife is making the future of insurance intelligent, inclusive and dynamic. They are building a platform from applying machine learning to their insurance partners' life and health insurance primary data sets to drive down transaction costs, increase automation and improve risk-pricing in underwriting, claims and fraud management.  The platform is being built to be hardware/device agnostic and integrate with future forward-looking data sources such as genomics, geo-location, social, and healthtech. Their insurance partners win when they remove friction, costs and inefficiencies from their operations and their customers' experience.  People win when they transform their insurance from an annual cost to a personalized asset which proactively protects their life and health."
gemkit,https://www.crunchbase.com/organization/gemkit,"3D Printing, 3D Technology",gemkit focuses on 3D Visualization and 3D Printing in vertical markets.,gemkit focuses on 3D Visualization and 3D Printing in vertical markets.
Genoptix,https://www.crunchbase.com/organization/genoptix,"Communities, Health Care, Health Diagnostics, Hospital",Genoptix provides specialized oncology diagnostics services.,"As a pioneering force in oncology, Genoptix regularly participates in industry conferences to share their findings, discuss emerging solutions, and create meaningful connections to advance the community."
Geosys,https://www.crunchbase.com/organization/geosys,Satellite Communication,GEOSYS is the first digital agriculture partner founded by agronomists and acting on a global scale.,"They supply real-time, satellite- and weather-based actionable insights to clients across the agriculture supply chain and around the globe.  They give you the solutions you need to make informed decisions and to take action quickly. GEOSYS is the first digital agriculture partner founded by agronomists and acting on a global scale. Their dual expertise — in agriculture and the high-tech world — is at the core of their identity and their commitment to their clients. It has given us a clear vision of the high stakes and rapidly changing landscape of the entire agriculture industry. That is why they created a suite of products to give growers, retailers, manufacturers, lenders and insurers the data, analysis and insights they need. They also work with partners to create branded, customized, scalable, Integrated Solutions to give them a unique competitive advantage in their markets and to help improve their business processes. The challenges this industry will face in the next 25 years and beyond will be transformative. With best-in-class digital agriculture solutions based on the most accurate data and expert analysis, GEOSYS will help you lead the new agricultural revolution."
Gents Co.,https://www.crunchbase.com/organization/gents-co,"E-Commerce, Fashion","Gents Co. is a men's lifestyle brand, offering consumers the quality products with a fashionable and sophisticated design aesthetic.","Gents Co. is a men's lifestyle brand, offering consumers the quality products with a fashionable and sophisticated design aesthetic. It designs custom fitted caps to fit its users’ style. Its product portfolio includes men's luxury baseball caps, apparel, and accessories and it delivers an e-commerce custom-build experience for its customers. Gents Co. was launched in 2012 and is based in New York, N.Y. It was founded by [Josh Reed](https://www.crunchbase.com/person/josh-reed)."
Genestack,https://www.crunchbase.com/organization/genestack,"Analytics, Communications Infrastructure, Infrastructure","Genestack provides a consistent infrastructure for managing and analysing bioinformatics data, on and off the cloud.","Genestack is a universal platform for bioinformatics. The company provides a consistent infrastructure for managing and analysing bioinformatics data that can be used in a variety of industries across a range of sectors, on and off the cloud."
Geodesic dome Houston,https://www.crunchbase.com/organization/geodesic-dome-houston,"Farming, Local Business","Geodesic dome Houston will be Houston, TX's first greenhouse that will offer more then just vegetables.","Geodesic dome Houston will be Houston, TX's first greenhouse that will offer more then just vegetables. They will make it an outdoor entertaining area as well. When completed it will provide fish, vegetables and entertaining area for all. They will reach out to local schools to promote healthy living. As well as local businesses to provide them with local fresh vegetables and fresh fish. They will schedule classes for the public to come and visit and how they can make their own space and urban farming landscape. Even hold events for parties. They want to provide a little of nature back into the city. There is nothing like this in the city or surrounding areas. The whole idea is to provide and educate."
GenQual Corporation,https://www.crunchbase.com/organization/genqual-corporation,"Biotechnology, Health Diagnostics","Genqual Corporation develops companion diagnostics for autoimmune, inflammatory and cancer therapies.","GenQual Corporation develops biomarker diagnostics for disease detection and diagnosis applications. The company was incorporated in 2009 and is based in Des Moines, Washington."
GenSpring Family Offices,https://www.crunchbase.com/organization/genspring-family-offices,Financial Services,"GenSpring Family Offices, LLC is a privately owned multi-family office with approximately $5.88 billion in assets under management.","GenSpring offers a unique service model that enables us to provide comprehensive personal advice and service through Their exclusive family offices backed by the scale of a shared Resource Center. GenSpring has created a community of wealth management professionals who share similar values and together put unprecedented control, power, knowledge and opportunity squarely on a family's side of the table."
Genesis,https://www.crunchbase.com/organization/genesis,"Commercial Real Estate, Consulting, Geospatial, Professional Services","Genesis provides civil engineering, landscape architecture, planning, GIS, CEI, and urban design services.","Genesis is a team of professionals providing outstanding service in the disciplines of engineering, planning, landscape architecture, urban design, GIS, and construction engineering & inspection. Since 1987, Genesis has served public and private sector clients throughout Florida, the Southeastern U.S., and internationally. Our work spans every project type -- from planning, civil engineering, and landscape design for urban parks and commercial centers to designing intelligent transportation systems (ITS), leading regional planning initiatives and delivering CEI services for interstate highways.  At Genesis, our goal is to consistently meet client objectives and produce high quality work that creatively balances function and aesthetics, meets schedule and budget requirements and respects the environment."
Generous Deals,https://www.crunchbase.com/organization/generous-deals,"E-Commerce, Retail",Jildy is a social networking site that offers a mobile application for cutting social newsfeed clutter.,Generous Deals is a daily deal online fundraising platform. We partner up with charity and non-profit organizations to help them with their fundraising efforts. We use the daily deal model to provide charities and non-profits with a fundraising vehicle while providing consumers with deeply discounted goods and services. We help merchants reach new customers and grow their business while giving back to the community.
Geospin,https://www.crunchbase.com/organization/geospin-eae1,"Information Services, Information Technology",Germany-based machine learning software startup .,"Geospin is a spin-off of the University of Freiburg, Germany. Over several years, they have developed and validated geo-analytics methods for various Smart City topics, such as mobility, energy, and crime. Their  research, which has been published in some of the best journals and conference proceedings of the field and received various international awards, serves as the basis of Geospin’s service portfolio."
GenRocket,https://www.crunchbase.com/organization/genrocket,"Big Data, Enterprise Software, Machine Learning, SaaS",GenRocket is the Technology leader in Data Generation for Software Testing and Machine Learning,"GenRocket offers a disruptive test data generation platform that allows software developers and quality assurance engineers to test and release software up to 1000% faster and with much higher quality. The software is patented (2017) and has been adopted by global corporations in more than 10 vertical markets including financial services, healthcare and insurance. GenRocket has partnered with some of the world's largest systems integrators including Cognizant, Wipro, HCL, Virtusa, Hexaware and UST Global to bring GenRocket test data solutions to their customers. New use cases emerged in 2018 for GenRocket data generation capabilities for Artificial Intelligence / Machine Learning applications."
Gearbox Records,https://www.crunchbase.com/organization/gearbox-records,"Internet, Music, Online Portals","Vinyl led record label and cutting studio, producing previously unreleased archive & new recordings.","Founded in 2009, Gearbox has already established a catalogue of over 25 releases including limited editions and deluxe box sets, which are sold around the world through a network of specialist record stores and through its own online music store."
GE Lighting,https://www.crunchbase.com/organization/ge-lighting,Lighting,GE Lighting provides lighting products for commercial and residential purposes.,"GE Lighting provides lighting products for commercial and residential purposes. The company offers light bulbs for general, decorative, track and recessed, fluorescent, outdoor, and automotive applications. It also provides home and security products such as lanterns, touch lights, lighting fixtures, under cabinet fixtures, nightlights, switch plates, timers and cords, computer and electronic accessories, remote control lighting, security devices, wireless convenience products, time and temperature products, and LED luminaires for office, retail, and commercial building spaces. Founded in 1911, GE Lighting is based in Cleveland, Ohio."
Gescaser,https://www.crunchbase.com/organization/gescaser,"Electronics, Industrial Automation, Logistics",Gescaser offers industrial automation controls.,"Gescaser offers industrial automation controls. The company provides monitoring and controlling the temperature of the cereals, monitoring components, automatic ventilation, control centers, and grain logistic services. Gescaser serves customers in Spain."
Gentex Corporation,https://www.crunchbase.com/organization/gentex-corporation,"Electronics, Hardware, Software",Gentex corp. is a supplier of automatic-dimming rearview mirrors and electronics to the automotive industry.,"Gentex is a global, high technology electronics company that is managed by engineers and others who understand the freedom and discipline that's required to run an entrepreneurial company. We are a unique, profitable company that is vertically integrated in highly automated electronics, CMOS camera development and manufacturing, vacuum coatings, and glass bending and fabrication. We specialize in a broad spectrum of technologies and processes to deliver high quality products to the automotive, aerospace and fire protection industries."
GE Money Bank,https://www.crunchbase.com/organization/ge-money-bank,"Banking, Finance, Financial Exchanges, Financial Services",GE Money Bank is a French consumer credit business.,"GE Money Bank, and its operations in the French Overseas Territories (the DOMs). GE Money Bank offers personal loans, vehicle finance, credit cards, savings products and insurance."
GetOutdoors,https://www.crunchbase.com/organization/getoutdoors,Communities,"GetOutdoors is an interactive, community-driven platform where you can find and share great tracks suited to you. ","GetOutdoors is an interactive, community-driven platform where you can find and share great tracks suited to you. Helping everyone feel well by connecting with nature and inspiring people to “GetOutdoors” (NSW). "
Generation Partners,https://www.crunchbase.com/organization/generation-partners,"Finance, Financial Services, Venture Capital","Founded in 1996, Generation Partners is a private equity firm that specializes in growth investments in technology enabled businesses.","Founded in 1996, Generation Partners is a private equity firm that provides equity capital to growth companies through buyout and growth equity investments. Over the past 20 years, the firm's principals have invested in over 50 companies. Generation was founded to create a more forward looking investment firm by combining extensive experience in growth-oriented private equity investments with information technology expertise. This remains the foundation of our firm as we seek out businesses that are using technology to lead change in their industries.  They target equity investments of $10 to $50 million and pursue both majority and minority equity positions in growth companies at various stages of development. They are long-term investors and have been involved in some of their companies for more than 10 years."
Geeknet,https://www.crunchbase.com/organization/geeknet,Advertising,"Geeknet owns ThinkGeek, an online retailer that sells geek-themed retail products to technology enthusiasts and general consumers.","Geeknet is the online network for the global geek community.  Their sites include SourceForge, Slashdot, ThinkGeek, Ohloh and freshmeat. Geeknet serves an audience of more than 40 million users each month and provide the tech-obsessed with content, culture, connections, commerce, and all the things that geeks crave."
Get Model,https://www.crunchbase.com/organization/get-model,"Fashion, Lifestyle",All-in-one service for fashion industry,
Geoswift,https://www.crunchbase.com/organization/geoswift,"Financial Services, Payments",Geoswift is a payment technology company focused on connecting China with the rest of the world.,"Geoswift is a regulated, specialist provider of two-way cross-border payments with China and founded to take advantage of opportunities between China and the rest of the world. Geoswift provides payment settlement, payment collection, remittances, pre-paid card and foreign exchange services to meet the needs of consumers for tuition payments, eCommerce and travel. Geoswift is headquartered in Hong Kong with worldwide offices in Shanghai, London, Vancouver, San Francisco and Seattle. Each location has a strategic function to service the needs of partners, technical development and regulatory bodies. "
Gelmart International,https://www.crunchbase.com/organization/gelmart-international,"Retail, Women's",Changing the face of intimate apperel.,"Gelmart International has designed, developed, and produced over 1.25 billion units in underwear, bras, and shapewear for the world's biggest retailers and brands."
Genesis Digital,https://www.crunchbase.com/organization/genesis-digital,"B2B, E-Commerce, Enterprise Software, Information Technology, Internet, Marketing, SaaS, Software",Genesis Digital provides SaaS eCommerce solutions to an ever growing market of innovators.,"Genesis Digital provides SaaS eCommerce solutions to an ever growing market of innovators. Its product, Karta, is an online business platform that offers marketing and sales tools that helps grow businesses. Founded in 2013, Genesis Digital is based out of La Jolla, California."
Geneius Laboratories,https://www.crunchbase.com/organization/geneius-laboratories,"Analytics, Biotechnology, Pharmaceutical",Geneius Laboratories,
General Lasertronics Corporation,https://www.crunchbase.com/organization/general-lasertronics-corporation,"Industrial, Manufacturing, Product Design","General Lasertronics designs and manufactures semi-custom, laser-based coatings removal, surface treatment, and cleaning systems.","General Lasertronics Corporation designs and manufactures semi-custom laser-based coatings removal, surface treatment, and cleaning systems in the United States and internationally.  General Lasertronics Corporation was founded in 1996 and is based in San Jose, California."
Gerald Group,https://www.crunchbase.com/organization/gerald-group,"Logistics, Mining, Precious Metals, Shipping, Supply Chain Management",Gerald Group provides metal products and raw materials through its subsidiaries.,"Gerald Group provides metal products and raw materials through its subsidiaries. It offers nonferrous and precious metals such as copper, aluminum, bauxite, zinc, lead, magnesium, gold, silver, platinum, palladium, and rhodium.  Additionally, Gerald Group provides commodity trading and production development services. It also offers merchant banking services, including project financing, lending, metal leasing and consigning, and marketing strategy and inventory management advisory.  Gerald Group caters to metal producing, refining, smelting, and fabrication and banking sectors. It has a strategic partnership with Pengxin International Mining Company.  Gerald Group began operation in 1962, with its headquarters in Stamford in Connecticut. It has additional offices in Morges in Switzerland and Shanghai in China."
GeoSafe,https://www.crunchbase.com/organization/geosafe,Software,"GeoSafe provides easy-to-use GPS tracking and CAD integration for police, fire, and EMS. Works on iPhone, iPad, and PC","GeoSafe offers GPS tracking and CAD integration services for police, fire, and EMSs. The application works on iPhones, iPads, and PCs. The application offers its users with critical intel through viewing dispatch notes, unit statuses, pre-incident plans, fire hydrant locations, reduced daily overhead and dependencies with integrated timestamps, traffic stops, and crime center query features, and increased collaboration and awareness with instant messaging and agency alert feeds. The Query service provides law enforcement officers with instant, secure access to federal, state, and local databases and allows them to search multiple databases and offers authentications and compliance services. GeoSafe is a U.S.-based company that was founded in 2008."
Gentle Reader,https://www.crunchbase.com/organization/gentle-reader,"Apps, Desktop Apps, Mobile Apps, Reading Apps, Web Apps",Gentle Reader is a no frills/ no advertising spam reading app for those who are serious about reading,"Gentle Reader gives you the freshest content in an easy-to-read format with no clutter and no ads. Add your favourite websites and Twitter accounts or discover new articles by exploring what other readers are bookmarking based on your interests. That way you can save time and hassle by efficiently combining RSS feeds, Twitter feeds, bookmarking and read-later services all in one app. What's more you have complete control over if, when, and how you discover new information with our unique matching function."
GenerationStation,https://www.crunchbase.com/organization/generationstation,"Collaboration, Family, Photography","GenerationStation enables users to collaborate, create profiles, upload photos, and preserve their family history.","GenerationStation is a free site that enables you to collaborate, create and preserve your family history.  By sharing photos, videos and other memories of someone's life, the tapestry of your ancestors' stories are preserved for current and future generations to discover and enjoy."
Gentry Wilson Partners,https://www.crunchbase.com/organization/gentry-wilson-partners,Financial Services,"Gentry Wilson Partners is an independent investment boutique based in Taipei, Taiwan.","Besides generating market-beating returns for our clients, one of our objectives at Gentry Wilson Partners is to continue to develop what we call an “excellence culture”. We seek to create and maintain the conditions in which our people are able to perform at their very best. We pay attention to several key areas including vocational qualifications for our professionals so that our practice and, of course, the returns our clients enjoy, continue to improve. Each member of our team holds themselves accountable and assumes complete responsibility for the impact their role has upon the overall performance of the practice and, where applicable, the performance of clients’ portfolios. The fostering of an environment in which trust, respect, pride and loyalty are held in the highest regard leads to a superior level of engagement between personnel that can only result in positive benefits for clients. Exceeding Expectations - As a company, we insist that our personnel strive to demonstrate creativity, flair, intuition and an entrepreneurial approach."
