Organization Name,Organization Name URL,Categories,Description,Full Description
Zyrobotics,https://www.crunchbase.com/organization/zyrobotics,Robotics,"Zyrobotics, LLC is an assistive technology company.","Zyrobotics, LLC is an assistive technology company that was conceived in the summer of 2012 and officially incorporated in 2013 as a Georgia Tech Venturelab spin-off company. They have continued expanding their product line to offer technologies targeted toward accessible Science, Technology, Engineering and Math (STEM) education. Their first offerings include OctoPlus and OctoMinus, switch-accessible math apps that create an interactive gaming environment to reinforce common core math skills while enhancing fine motor skills and visual perception. Their STEM apps combine education and therapy to fully help in achieving developmental milestones for children of all abilities."
ZymoGenetics,https://www.crunchbase.com/organization/zymogenetics,Therapeutics,ZymoGenetics’ early focus on the development of production systems for recombinant proteins,"ZymoGenetics is focused on the discovery, development, and early manufacture of therapeutic proteins. ZymoGenetics is a fully-integrated research and development organization with a broad range of skills and technologies, including scientific computing, molecular and cellular biology, protein chemistry, antibody generation and engineering, clinical development and operations, regulatory affairs, quality, drug formulation, process development and protein manufacturing."
Zybra Private Limited,https://www.crunchbase.com/organization/zybra-private-limited,"Accounting, Finance, Financial Services, FinTech, Information Technology, Internet, Software",Zybra is an automated accounting software for businesses.,"Zybra is an automated accounting application for businesses.  The company's  mission is to help business owners save time in their business finance & accounts by providing powerful, automated & integrated platform and to create a thriving ecosystem connecting all stakeholders."
Zync Render,https://www.crunchbase.com/organization/zync-render,"Digital Media, Flash Storage, Social Media",ZYNC Render is a cloud-based visual effects storage and rendering platform.,"ZYNC is the visual effects industry’s first completely integrated cloud-based storage and rendering solution. This pay as you go service provides encrypted, instant and affordable access to high volume computing resources. Currently supported platforms include Maya/VRay/Mental Ray/Arnold and Nuke."
Zyprr,https://www.crunchbase.com/organization/zyprr,"CRM, SaaS, Software",Zyprr is a modern cloud based CRM and business process software to manage complete lifecycle of the customer from lead nurturing to revenue.,"Zyprr is a highly customizable mid-market business process platform which is SaaS based and fully integrates all customer touch-points, thus giving you 360 degree view of your customers. Using Zyprr businesses can manage the entire lifecycle of their customers including marketing, lead nurturing, customer relationship management (CRM), communication and team activities, progress tracking, analytics, document collaboration, service and helpdesk, and order management. Zyprr’s solution solves the data fragmentation and business productivity problems with highly customizable and collaborative business process software where you manage all your business activities with a single login. This helps you to enhance your data accuracy, process efficiency and business profitability."
ZYPPAH,https://www.crunchbase.com/organization/zyppah,Medical Device,ZYPPAH  the only solution with the Snoring Eliminator .,"ZYPPAH is the only oral appliance with the patent-pending Snore Eliminator, an elastic band that holds the tongue in place to prevent it from relaxing and closing the airway during sleep.ZYPPAH is a revolutionary way to effectively treat snoring."
Zyoin,https://www.crunchbase.com/organization/zyoin,"Recruiting, Social Recruiting, Staffing Agency","Zyoin is an Indian firm that offers end-to-end IT recruitment solutions, human resource staffing services, and consultancy to its clients.","Zyoin is an Indian firm that offers end-to-end IT recruitment solutions, human resource staffing services, and consultancy to help its clients with their hiring challenges. The company provides customized recruitment solutions that cover permanent staffing, contract staffing, RPO, executive search, technical assessments, background verifications, and more. The company is promoted by alumni of IITs, NITs, and IIMs. It has partnerships with over 300 IT companies. Zyoin was founded in 2005 by Anuj Agrawal and is based in Bangalore, Karnataka."
Zynk Software Limited,https://www.crunchbase.com/organization/zynk-software-limited,"Business Intelligence, CRM, Developer Platform, Developer Tools, E-Commerce, Enterprise Software, FinTech, PaaS, SaaS, Sales Automation","Business Automation, Data Integration and Business Intelligence software","Zynk is a Business Process Automation & Data Integration platform with connectors for over 45 different cloud and desktop applications including Sage, Salesforce, SugarCRM, ZohoCRM,  Xero, GoCardless, Magento, Ebay, Amazon and many more.  Zynk customers include include Flybe, Buff Headwear,  Scottish FA, London Symphony Orchestra, Penhaligons and Laterooms.com, Zynk aspires to be at the forefront of software integration development in the UK."
Zymbit,https://www.crunchbase.com/organization/zymbit,"Internet of Things, Physical Security, Security",Zymbit is work with IoT developers and OEMs to build trust into devices and data streams.,"At Zymbit they work with IoT developers and OEMs to build trust into devices and data streams. They make embedded security modules that are easy to integrate, scale and deploy. Zymbit is a Security Design Partner for MicroChip Inc."
Zymtronix,https://www.crunchbase.com/organization/zymtronix,"Analytics, Biotechnology, Genetics, Life Science, Product Research",Zymtronix develops a technology for enzyme immobilization.,"Zymtronix develops a technology for enzyme immobilization. It provides a platform to immobilize enzymes and screen for immobilized enzyme performance, the unlocked potential of oxidative enzymes for biocatalysis, and new materials and customer-oriented processes for small molecule conversion.  Stéphane Corgié founded Zymtronix in 2013. It has its headquarters in Ithaca in New York."
Zylog Systems Limited,https://www.crunchbase.com/organization/zylog-systems-limited,Mobile,ZSL Mobile offers mobile apps and mobile,"ZSL Inc, is an ISO 9001 certified provider of Onshore, Offshore & Near shore technology solutions and services to enterprises & technology companies across the globe."
Zygote Media Group Inc.,https://www.crunchbase.com/organization/zygote-media-group-inc,Medical,Zygote Media Group Inc. is a provider of 3D visualization services for the medical industry.,
Zyfin,https://www.crunchbase.com/organization/zyfin,Finance,"ZyFin is a financial information company that offers unique economic and financial indices, products.",Transforming investments in emerging markets by offering a combination of original and uniquely integrated research and analytics-based platforms and asset management products.
Zymo Cosmetics,https://www.crunchbase.com/organization/zymo-cosmetics,Cosmetics,"We are India based leading Manufacturer and Exporter of Cosmeceutical, Skin Care, Hair Care, Toothpaste, Herbal, Baby Care Products.","Zymo Cosmetics – since 1999, we are majorly in Private Label Manufacturing or Contract Manufacturing of various kind of Cosmetics, Toiletry, Personal Care, Herbal, Baby Care and Derma products. We have the FDA approved state of the art manufacturing facility for manufacturing of various Skin Moisturizer, Anti Acne, Anti-Ageing, Sun Screen, Skin Whitening, Face Wash, Body Wash, Face Scrub, Hair Conditioner, Shampoo, Hair Cream, Hair Gel, Hair Serum, Hair Oil, Deodorant, Baby Lotion, Baby Shampoo, Baby Oil and many others."
Zydii,https://www.crunchbase.com/organization/zydii-ltd,"E-Learning, EdTech, Training",Zydii is a learning marketplace tailor-made for the African market,"Zydii is a learning marketplace tailor-made for the African market. We provide practical and relatable digital courses. We make it affordable for African Youth to access critical skills faster from African experts and trainers. We cover ﬁve key course categories: LifeSkills, Entrepreneurship, Technology, Career, and Creative Arts. These are the key areas on demand in the African market, with no relevant content available for people interested in quickly learning these skills. Zydii for business (B2B component) offers an online training solution which enables businesses to efficiently train their team on critical skills that will help business owners and SME’s to grow their business."
Zystor,https://www.crunchbase.com/organization/zystor,"Biotechnology, Therapeutics","ZyStor Therapeutics, Inc. is a privately-held biotechnology company developing enzyme replacement therapies for the treatment of lysosomal","ZyStor Therapeutics, Inc. is a privately-held biotechnology company developing enzyme replacement therapies for the treatment of lysosomal storage diseases."
ZYB,https://www.crunchbase.com/organization/zyb,"Events, Mobile, Social Network",ZYB is a mobile phone utility and social networking site providing back-up services for phone data such as messages and calendar events.,"ZYB is a mobile phone utility and social networking site. ZYB started in 2005 as a european service to provide easy back-up services for mobile phones. Using this information, they have built a social networking platform based upon this data set. Given the importance of mobile phones in Europe, ZYB has built in Twitter like location based functions into the service.  For more information please see this [MobileCrunch](http://mobilecrunch.com/2006/06/06/mobilecrunch-exclusive-first-look-at-zyb-the-free-data-backup-and-contact-and-calendar-synchronizer-for-your-mobile/) article from when ZYB launched."
Zyloon,https://www.crunchbase.com/organization/zyloon,"Beauty, Fashion, Lifestyle, Professional Services",Zyloon is a chain of branded salons that offers high quality standard services at budget cost in India.,
Zywee.com,https://www.crunchbase.com/organization/buzzhospitals-com,Health Care,"Zywee is an India-based online healthcare discovery platform for hospitals, diagnostic centers, and clinics.","The idea behind  Zywee.com is to offer a single platform to all the major participants of this vast healthcare industry. Apart from helping common people in finding out a best suitable hospital for their critical healthcare needs, Zywee.com is also looking forward to serve as an unified platform to connect every stakeholder in the healthcare ecosystem like diagnostics,clinics and other healthcare service providers."
Zyvo,https://www.crunchbase.com/organization/zyvo,Human Resources,Zyvo streamlines HR processes and predicts human behavior that is related to work.,Zyvo streamlines HR processes and predicts human behavior that is related to work.
zynamics,https://www.crunchbase.com/organization/zynamics,"Information Technology, Security",Zynamics is a security analytics software company providing software analysis tools to help with malware analysis.,"zynamics builds reverse engineering tools for both offensive and defensive security. zynamics tools are used to:  - help understand security updates, identify FOSS code in binaries (BinDiff)  - identify flaws in closed-source software and build input to trigger them (BinNavi)  - automatically cluster malicious software & generate signatures (VxClass)  - share information amongst groups of geographically dispersed reverse engineers (BinCrowd)  - analyze malicious documents (PDFDissector)"
Zyber,https://www.crunchbase.com/organization/website-designer-nz-ltd,"Advertising, Consulting, Information Technology, Software, Web Design",Zyber is a leading New Zealand website design and digital marketing company that creates websites with a difference.,"Zyber was formed in 2009 by directors James Sampson and James Monk. They had identified a need in the New Zealand market for websites that were cost-effective yet still produced great results. After countless hours of research and development, and numerous energy drinks, they came up with a revolutionary system that would ultimately change NZ businesses. After successfully assisting hundreds of customers, Zyber has perfected robust processes and systems which create a seamless experience in providing website solutions. Their team are experts in understanding business requirements and delivering high quality business web solutions and website services. This allows their customers to focus on their core business activities with the peace of mind that their online requirements are in the capable hands of professionals. Specialising in small to medium-sized enterprises, they fully appreciate that in a highly competitive market, a well-designed website needs to act as a strong and effective marketing tool. Therefore, they work closely with their clients to turn simple ideas into powerful, business-generating websites. Zyber is committed to making sure your website is not only visually appealing, but most importantly, that it produces results!"
Zyxware Technologies,https://www.crunchbase.com/organization/zyxware-technologies,"Digital Marketing, Enterprise Resource Planning (ERP), Internet, SaaS, Web Design, Web Development, Web Hosting",Zyxware is one of the largest exclusive Drupal companies based out of India,"Zyxware Technologies, since ​2006, has been an exclusive Drupal service provider and has completed over 170 Drupal projects for clients across the globe. Zyxware offers enterprise application development services, application maintenance and support services, custom module development, performance and security audit and is a one stop shop for all Drupal requirements. Their Drupal development practices ensures that you can leverage on the full power of Drupal. Their delivery process helps you take your idea to the market in quick time. Zyxware can take care of your concerns of scalability, adaptability and security. Being a customer centric organization, Zyxware maintains transparency in development process and establishes fair and honest relationship with clients. Zyxware partners with Acquia, New Relic and Volacci."
ZYTO,https://www.crunchbase.com/organization/zyto,"Biotechnology, Computer, Fitness, Health Care, Information Technology, Software",A global technology company which develop and produce software and integrated hardware products .,"ZYTO is a global technology company.They develop and produce software and integrated hardware products that have been specifically designed to provide insight into personal health and wellness decisions. ZYTO products accomplish this goal by using ZYTO scan technology.The innovative ZYTO scan technology facilitates an interface between a computer and the human body. The resulting dynamic data exchange, known as a biosurvey, involves computer-generated signatures called “Virtual Items” and recording the body’s galvanic skin response, a well-developed method of monitoring stress responses that is commonly used in applications like polygraph tests and biofeedback."
Zyppos,https://www.crunchbase.com/organization/zyppos,"Crowdsourcing, Internet, Leisure, Travel",Zyppos is a crowd sourcing platform of travel experts which users can find the best flights and lowest fares.,"Zyppos is a crowdsourcing platform of travel experts which users can hire for a fee to make sure they have an amazing trip and find the best flights and lowest fares. Zyppos looks to remove the stress of looking for flights in conventional search engines. It uses its registered experts and travel consultants to help users get amazing savings on all trips and flights. Zyppos aims at helping users focus on the joy of travels and encourages everyone to start travelling more. Firstly, users submit a contest by entering their trip details and providing a reward fee. Secondly, registered and approved experts compete to find the best flights and lowest fares. Thirdly, users select a winner by choosing the best expert that matches all their needs, receiving booking instructions. Users then go off to have unforgettable trips while enjoying huge savings. Zyppos aims at trying to reduce the stress in searching for flights and making life a little more awesome."
Zyme,https://www.crunchbase.com/organization/zyme-809f,Software,Healthcare Software,
Zynergy Projects & Services,https://www.crunchbase.com/organization/zynergy-projects-services,"Energy, Energy Efficiency, Service Industry, Solar",Zynergy Projects & Services is a Singapore based company,"Zynergy is a Singapore headquartered group offering end-to-end solar solutions; it currently operates across the emerging markets with a particular focus on India and Africa and has participated in various public-private partnership (PPP) initiatives. Zynergy has a high calibre engineering team, offering Engineering, Procurement and Construction (EPC) turnkey solutions and an exceptional Research & Development division specializing in creating innovative and affordable energy solutions. Its significant intellectual property has the ability to disrupt prohibitive cost barriers and democratise solar energy by making the products more affordable to the mass market. Compared to standard water pumps, Zynergy Solar Water Pumps cost significantly less, solving a big problem for farmers throughout the emerging markets and beyond. Zynergy has an innovative line of products not only in solar lighting but also in water filtration, water pumps, and refrigeration, at a fraction of the cost."
Zytek Automotive,https://www.crunchbase.com/organization/zytek-automotive,"Automotive, Mechanical Engineering","Zytek Automotive is designs, develops, and manufactures automotive control systems.","Zytek is a specialist powertrain and vehicle engineering company dedicated to delivering exceptional value to its clients with innovative engineering solutions.  Originally developing engine management systems for the motorsport and automotive industry, Zytek’s focus has progressed to include Electric / Hybrid vehicles, and racing systems which encompass, chassis, engines, electronics and electrically-assisted gearshift systems."
Zylom,https://www.crunchbase.com/organization/zylom,"Gaming, PC Games, Video Games","Zylom is a distributor of casual games for PC and Mac computers, as well as for devices like mobile phones and tablets.","Zylom Media Group provides online games. It offers card, word, action, board, Mahjong, and hidden object games, as well as puzzles. The company was founded in 2001 and is based in Eindhoven, the Netherlands. It has operations in Argentina, Belgium, Brazil, Canada, Chile, Germany, Spain, France, Ireland, Italy, MÃ©xico, the Netherlands, Austria, Portugal, Switzerland, Sweden, the United Kingdom, and the United States. As of February 7, 2006, Zylom Media Group B.V. operates as a subsidiary of RealNetworks Inc."
Zybek Sports,https://www.crunchbase.com/organization/zybek-sports,Sports,Zybek Sports covers all athletes and sport testing.,"Zybek Sports was founded in Boulder, Colorado in 2008. Since its inception into the sports performance market Zybek has secured its place among the elite providers of talent identification and performance analysis equipment. Products have been developed in cooperation with members of the NSCA as well as numerous local high school and University athletic programs around the state of Colorado. Working with the Olympic Training center along with other institutions around the country has enabled the company to grasp a feel for what you, the consumer, need regarding high-performance analysis equipment."
Zycomp Systems,https://www.crunchbase.com/organization/zycomp-systems,"Insurance, Software",Zycomp Systems is a privately held company the provides broker software.,"Zycomp Systems Limited was originally founded in 1987 with an aim to develop modern, cost effective software for the Canadian Insurance Industry."
ZyGEM,https://www.crunchbase.com/organization/zygem,Biotechnology,ZyGEM Corporation Ltd (NZ). DNA and RNA extraction products for the lifesciences and forensic markets.,
Zync Music,https://www.crunchbase.com/organization/zync-music,"Advertising, Events, Music, Sports, Video, Video Games","Zync Music is a music licensing and publishing company,","Zync Music is a music licensing and publishing company that specializes in music synchronization placements in film, advertising, television, trailers, sports, and video games."
Zycko,https://www.crunchbase.com/organization/zycko,"Consulting, Information Technology, Telecommunications","Zycko is a specialist distributor of innovative IT solutions including data networking, data storage, network monitoring.","Zycko is an international, specialist distributor of innovative IT solutions including data networking, data storage, network monitoring and management, voice and video communications, virtualisation, cloud, and data centre infrastructure. The company has 14 offices in 12 countries."
Zylia,https://www.crunchbase.com/organization/zylia,"3D Technology, Audio, Digital Media, Hardware, Music, Outsourcing","Zylia company develops revolutionary tools and technologies for recording and post-processing of music, 3D audio, and Virtual Reality.","ZYLIA was founded in 2012 by Piotr Szczechowiak (COO) and Tomasz Zernicki (CTO) - both remarkable PhDs with extensive experience in academia and the industry. ZYLIA is determined to develop innovative world-class technologies and turn them into products capable of improving the lives of musicians and audio creatives. Today, the ZYLIA team consists of more than 20+ dedicated and passionate team players with a great combination of expertise in audio research, software, business and product development. For the past 2 years ZYLIA has been fully focused on crafting, prototyping, testing and refining a new product which we believe has the potential to redefine and revolutionize the way sound and musical performances are being recorded - all In close collaboration with the music and audio communities around the world. ​ Our mission is clear!  — Record audio like never before Our product - ZYLIA ZM-1 is the first multi-track 360 microphone that in combination with a laptop acts as a complete recording studio. By intelligently extracting multi-source recordings into individual audio tracks from a single source one-microphone recording it enables musicians, bands and sound recordist to capture performances in a new ground-breaking way."
ZY.com,https://www.crunchbase.com/organization/zy-com,Wireless,ZY.com is a internet application service provider.,
ZYFFY,https://www.crunchbase.com/organization/zyffy,"E-Commerce, Human Resources, Internet",Zyffy is AI-based marketplace for business and consumer services.,Zyffy is online platform what helps people and companies hire local professionals and businesses
Zymphony Technology Solutions,https://www.crunchbase.com/organization/zymphony-technology-solutions,"Information Technology, Security",Zymphony Technology Solutions is an IT company that offers network management and security services.,
Zymolo Inc.,https://www.crunchbase.com/organization/zymolo-inc,"Biotechnology, Health Care, Life Science","Microbiome Innovation Startup, concentrates on the identify the probiotics,their selective fermentation carbon sources for skin diseases",
ZyroFisher,https://www.crunchbase.com/organization/zyro-limited,"Advertising, Marketing",ZyroFisher  is a privately-owned parts and accessories distributor in the UK cycling industry.,ZYRO Limited is a privately-owned parts and accessories distributor in the UK cycling industry.
Zyxio,https://www.crunchbase.com/organization/zyxio,"Hardware, Software",Human/Machine Interaction,"Zyxio designs and markets Microelectromechanical systems (MEMS)-based products for organic Human Media Interaction. Zyxioâ€™s founders and engineering team have pioneered innovations in next-generation personal interaction with digital environments. Zyxio has developed in stealth mode, a breakthrough technology called SensaWaftâ„¢, patented worldwide. The SensaWaftâ„¢ intelligent sensor (MEMS) turns gentle puffs into input signals sent to platforms like PC, game console and smartphone. SensaWaftâ„¢ is an alternative hardware-based ""touchless"" interaction method with interaction effect libraries and application-specific performance programmability that provides customizable variable control over any User Interface and applications, with low computational specifications. Zyxio's goal is to help â€œGeneration Contentâ€ accomplish more, and  developed a technology that transforms HMI, and combines seamlessly with other current and emerging HMI techniques such as touch-screens, accelerometers, IR and camera 3D sensing or speech recognition."
Zycron,https://www.crunchbase.com/organization/zycron,Information Technology,Zycron is a provider of IT temporary staffing talent to companies throughout the southeastern U.S. region.,Zycron is a regional provider of IT temporary staffing talent to companies throughout the southeastern U.S. region and selected markets across the country both with Fortune 500 companies and governmental entities.
