Organization Name,Organization Name URL,Categories,Description,Full Description
Nomad List,https://www.crunchbase.com/organization/nomad-list,Travel,"Nomad List finds the best places to live and work remotely for digital nomads, based on cost of living, internet speed and other data.","Nomad List finds the best places in the world for digital nomads to live and work remotely. It collects over 1,00,000 data points about 2,000+ cities around the world, from cost of living, to temperature, to safety. With that data, the site tries to make a good estimate of where you, as a digital nomad, should go next. For paid users, it also offers an entire community and social network of travelers with over 10,000+ people actively signed up."
Noyo,https://www.crunchbase.com/organization/noyo,"Health Care, Information Technology, Medical","Noyo is building the modern health insurance infrastructure, providing best in class technology to connect online insurance platforms.","Noyo’s mission is to make healthcare easy to access and easy to understand, empowering people with the tools and knowledge they need to make the best choice for their own care.  They envision a health insurance system that is transparent, accurate, and trustworthy. One that is constantly innovating for the benefit of its consumers while also reducing bloated costs. One where faster, more reliable communication between health insurance companies, brokers, and employers ultimately leads to a less stressful experience for consumers.  Noyo's centralized hub of carefully crafted APIs serve as the building blocks for modern insurance distribution."
Northcoders,https://www.crunchbase.com/organization/northcoders,"Professional Services, Training",Northcoders is a coding bootcamp in manchester for those seeking a career in software engineering.,Northcoders is a coding bootcamp in manchester for those seeking a career in software engineering.
Nordstrom Rack,https://www.crunchbase.com/organization/nordstrom-rack,Retail,Nordstrom Rack is an American fashion retailer which is owned by Nordstrom. Shop online or in store for great brand items up to 70% off.,"Nordstrom Rack is where style meets savings. They're your destination for brands you love at up to 70% off. Now together with HauteLook, a premier flash sale site featuring top brands at incredible savings, you've got even more ways to shop. Whether in store, online or on the go with Their mobile apps, shopping your way is now easier—and better—than ever!"
North American Palladium,https://www.crunchbase.com/organization/north-american-palladium,Natural Resources,"NAP is an established precious metals producer that has been operating its flagship Lac des Iles mine (LDI) located in Ontario, Canada","NAP is an established precious metals producer that has been operating its flagship Lac des Iles mine (LDI) located in Ontario, Canada since 1993. LDI is one of only two primary producers of palladium in the world, and is currently undergoing a major expansion to increase production and reduce cash costs per ounce. NAP operates with the vision of becoming a low cost mid-tier precious metals producer. The Company's shares trade on the NYSE MKT under the symbol PAL and on the TSX under the symbol PDL. Be part of NAP’s growing, dynamic team by visiting www.nap.com/careers to explore current job opportunities."
North American Bancard,https://www.crunchbase.com/organization/north-american-bancard,"Accounting, Credit Cards, Financial Services, FinTech, Mobile Payments, Payments","North American Bancard provides payment processing solutions such as credit, debit, check conversion, guarantee and loyalty card solutions.","North American Bancard, LLC provides payment processing solutions. It offers credit, debit, check conversion and guarantee, and gift and loyalty card solutions.  Additionally, the company provides electronic processing and check verification services, electronic commerce, and credit card equipment. North American Bancard, LLC, was founded by CEO/President Marc Gardner in 1992 and is based in Troy, Michigan. From humble beginnings with one employee in a shared office, to over 600 employees in their 100,000+ sq. ft. corporate office, North American Bancard is a true American success story. North American Bancard’s growth into an industry leader in credit card processing is the result of an unwavering dedication to helping the American entrepreneur succeed. Combining dedication with strategic investments, focus on industry-leading training and a commitment to their hundreds of employees means they are well-positioned to continue helping American businesses thrive. North American Bancard helps clients succeed in all facets of merchant payment processing, including solutions for Credit, Debit, EBT, Check Conversion and Guarantee, Gift & Loyalty Cards and much more. They are committed to offering superior credit card processing to businesses of all sizes, big and small. And, with around-the-clock technical support and the industry’s largest selection of free equipment, they offer everything businesses need to process payments efficiently, inexpensively and safely. North American Bancard is always on the forefront of modern business thinking, consistently offering highly-competitive pricing, and 24/7 customer service second to none. That’s why over 180,000 businesses trust North American Bancard with their more than $13 billion-worth of payment transactions every year. North American Bancard is committed to helping American business prosper. Every day, every decision they make is based on fulfilling that commitment. Contact us today to learn how NAB can help your business prosper."
"Nootropedia, LLC",https://www.crunchbase.com/organization/nootropedia-llc,"Analytics, Developer Platform, Medical",Nootropedia creates tools to track and analyze cognitive enhancement through nootropics and smart drugs,"Nootropedia is an online source for information regarding nootropics supplement A.K.A smart drugs. It consults the scientific data, but not at the risk of making it impossible for normal people to understand. It is more interested in digestible, easy to read information. Aside from informational resources, Nootropedia also created a web application called NooTracker to allow new or experienced users an opportunity to track their usage and dosage to find which nootropics were making an impact on them specifically."
Noblr,https://www.crunchbase.com/organization/noblr,"Auto Insurance, Insurance",Noblr is a new kind of car insurance helping responsible drivers safely get where they need to go.,"NOBLR is a new kind of car insurance, helping responsible drivers safely get where they need to go -- wherever, whenever, and however they get around. NOBLR leverages telematics data and actuarial insight to give drivers real-time rates based on their actual driving."
Nortek Security & Control,https://www.crunchbase.com/organization/nortek-security-control,"Electronics, Manufacturing","Nortek Security & Control world leader in smart connected devices & systems for residential, security, access control digital health market.","Nortek Security & Control is a leader in wireless Security, Home Automation and Personal Safety systems and devices. NSC has more than 4 million commercial, residential, and personal systems deployed and more than 20 million connected wireless devices. NSC’s service provider and dealer partners – as well as end-customers – trust NSC countless times a day to protect what matters most and to make their lives easier.  NSC is transforming the Security, Smart Home, Personal Health and Wellness markets with its trusted brands:  2GIG®, Linear®, Numera® and GoControl®. "
NOBULL PROJECT,https://www.crunchbase.com/organization/nobull-project,"Lifestyle, Sporting Goods",NOBULL PROJECT operates as an outdoor and sporting goods company.,"NOBULL PROJECT operates as an outdoor and sporting goods company. Founded in 2014, the company is headquartered in Boston, Massachusetts."
Nodeflux,https://www.crunchbase.com/organization/nodeflux,"Analytics, Artificial Intelligence, Computer Vision, Information Technology, Machine Learning","Nodeflux is a start-up technology company, creating a distributed computation platform","Nodeflux is a startup company based in Jakarta, Indonesia. They develop a distributed computation platform to deliver a scalable brain for various computation models including both traditional and cognitive computing. Please see their product, solution and showcases page section to understand more about nodeflux."
NorthWorx,https://www.crunchbase.com/organization/northworx,"Advertising, Video, Web Design",NorthWorks is a production company in advertising and media with the roots in Norrland.,"NorthWorks is a production company in advertising and media with the roots in Norrland. We have offices in Bollnäs and Boden, with headquarters in Kangos, Norbotten. Our work areas are graphic design, illustration, photo, aerial photo and film and we help you to market and profile your company. NorthWorks consists of photographer Michael Törnkvist and graphic designer / illustrator Oskar Belin. For us, no assignments are too big or small - we are with you all the way from idea to finished product in both printed and digital media. We fix everything from logos, graphic profiles, illustrations, printed matter and advertisements to photography, filming and web design. NorthWorks also has a broad network of printers and suppliers and can offer competitive prices that can be compared. For design and photo jobs we charge per hour, day or according to agreement. Contact us and tell us how we can help you!"
Novus,https://www.crunchbase.com/organization/novus,"Analytics, Finance, Financial Services","Novus offers a portfolio analytics platform that helps institutional investors manage and analyze their risk, performance and exposures.","Novus collects data from dozens of administrators, prime brokers, custodians and accounting systems and enriches that data with market, fundamental and economic information to make it infinitely more powerful. If a manager is willing to permission you with position-level transparency or you have a managed account, you're covered with Novus."
NovaSmart Bank,https://www.crunchbase.com/organization/novasmart-bank,"Banking, Financial Services, FinTech",Digital bank,"An application that (i) provides access to traditional banking services (accounts, currency exchange, cards, payments, money transfers) for retail customers and SME (ii) with extremely low fees (iii) on emerging markets with low penetration of banking services based (iv) on technological platform that acts as a transaction core and (v) allows to easily implement any local (cultural, traditional) financial services."
Norrhydro,https://www.crunchbase.com/organization/norrhydro,"Industrial Engineering, Mechanical Engineering",Norrhydro has made hydraulic cylinders for more than 30 years.,
Nobo,https://www.crunchbase.com/organization/nobo-inc,"Sports, Wearables","Nobo develops technologies that help clinicians, athletic trainers and motivated consumers understand the human body in entirely new ways.","Nobo is developing innovative new ways for trainers to understand their athletes, clinicians to understand their patients, and people to understand themselves."
Nova Leap Health Corp.,https://www.crunchbase.com/organization/nova-leap-health-corp,"Health Care, Hospital",Nova Leap Health Corp. is an international provider of personal home care and support services.  ,"Nova Leap Health Corp. is an international provider of personal home care and support services.  They acquire, manage and build home care services companies that provide wonderful support to our clients and their families at home. Nova Leap went public in 2016 through the TSX Venture Exchange Capital Pool Corporation (“CPC”) program.  Our Company was created to assemble a portfolio of Home and Home Health Care companies that have the potential to be leaders in their particular market. "
NoxMob,https://www.crunchbase.com/organization/noxmob,"Casual Games, Gaming, Mobile",Nox Mobile is a global mobile game publisher.,"NoxMob is focused on the design, development, and marketing of mobile games, including Alice VS wonderland, Epic Heroes, and Spartan Wars: God of Olympus. It markets its games in North America and Europe. NoxMob was founded by Harry Liu in November 2013."
Northern Bloc,https://www.crunchbase.com/organization/northern-bloc,Food and Beverage,Northern Bloc is an ice cream brand.,
NovoPayment,https://www.crunchbase.com/organization/novopayment,"FinTech, PaaS, Payments",NovoPayment enables digital financial and transactional services across the Americas via an open Banking as a Service (BaaS) platform.,"NovoPayment is a leading FinTech company that enables digital financial and transactional services across the Americas via an open Banking as a Service (BaaS) platform that supports varied mass payout and collections services. Founded in 2007 and Based in Miami, Florida, the company’s bank-grade offerings and custom solutions use APIs and other flexible delivery models to help banks, financial institutions and others leverage their existing systems, generate new deposits, transaction streams and customer experiences. Today, the company is present in eight countries and has more than 72 deployments touching more than 10,000 corporate platform users across the Americas serving more than 2.5 million end users. In 2018, it’s track record in enabling digital transformation was recognized by the Banking Administration Institute (BAI) with the Global Innovation Award for Innovation in Customer Experience and “Best of the U.S.” for Outstanding Achievement in the Disruptive Innovation in Financial Services."
Noble Roman's,https://www.crunchbase.com/organization/noble-roman-s,"Food and Beverage, Food Processing, Restaurants",The Indianapolis based franchisor and licensor of Noble Roman's Pizza and Tuscano's Italian Style Subs.,"Noble Roman's As the head chef here at Noble Roman’s Pizza, I have a lot to say about pizza.  First off, I think a perfect world would have everyone eating pizza every day.  Pizza, pizza, pizza – why eat anything else?  Pizza tastes great – or at least it should if the person making the pizza takes enough care to make it right with top notch ingredients (and we do!) – and there are endless topping combinations, so pizza never gets boring.  Yes, in the world as I would have it, there would be pizza for breakfast, pizza for lunch and pizza for dinner.  Pizza for that late-night snack, too! In my view, the only acceptable pizza substitute might be a good sub.  Not the get-it-on-every-corner sub where you happen to get a little meat and cheese with your mouthful of bread, but mouth-watering, whole-muscle meats and fresh veggies that happen to be blanketed with delicious, fresh bread – that kind of sub.  Yes, I might possibly allow a good sub to sub for pizza! Now when we at Noble Roman’s think about pizza, which we tend to do all day every day, we not only think about making pizza good, we think about making pizza a convenience.  That’s why we make our delicious pizza available in convenience stores – convenience stores are convenient.  Good convenience store owners take care of their customers and serve delicious Noble Roman’s pizza as a convenience to you.  We make our pizza available in bowling centers, too, because everyone wants to eat pizza when they bowl.  And not just when you are bowling, but when you are working, hanging out at college, travelling through the airport, going to the zoo, visiting a friend at the hospital, enjoying a day at the amusement park - - well, you get the idea, we try to make our pizza available wherever you happen to be.  Great pizza, conveniently – that’s Noble Roman’s Pizza!"
Nob Hill Therapeutics,https://www.crunchbase.com/organization/nob-hill-therapeutics,"Biotechnology, Life Science, Pharmaceutical",Nob Hill Therapeutics is established to commercialize the first dry-powder nebulizer to treat severe respiratory diseases.,"Nob Hill Therapeutics is a Delaware Corporation, founded to develop and market DryNeb, a first-in-kind dry powder nebulizer to address large pulmonary drug delivery market opportunities. The company has exclusively licensed the technology from the University of New Mexico. DryNeb™ vs. Aerosol Mist Nebulizers Compact, handheld, portable DryNeb will replace cumbersome aerosol mist nebulizers. The pulmonary route of drug delivery has been gaining much importance in the present day, as it enables targeted drug delivery directly to the lungs for both local and systemic treatment. Pulmonary drug delivery, as a noninvasive drug administration method, is characterized by its high bioavailability and fast action. It is increasingly used in modern clinical practice for improved treatment of local as well as systemic diseases."
Nominum,https://www.crunchbase.com/organization/nominum,"Analytics, Internet, Network Security","Nominum provides DNS software & applications for top telecom providers to deliver superior performance, security, controls & communications.","Nominum™ is the world’s DNS innovation leader and the first company to create an integrated suite of DNS-based, subscriber-centric applications that digitally transform service providers, while personalizing the online experience for subscribers. More than 100 providers in over 40 countries trust Nominum software to protect their networks and deliver greater value to subscribers. Nominum is a global organization headquartered in Redwood City, CA."
Nopsec,https://www.crunchbase.com/organization/nopsec,"Enterprise Software, SaaS",NopSec provides precision threat prediction and remediation solutions for businesses to protect their IT environments from security breach.,"NopSec provides precision threat prediction and remediation solutions to help businesses protect their IT environments from security breaches. The company’s flagship product, Unified VRM, is a SaaS solution that provides intelligent context to vulnerability data, enabling security teams to visually forecast threat risk to dramatically reduce the turnaround time between identification and remediation of critical security vulnerabilities across infrastructure and applications.  NopSec has been recognized as one of the 20 Most Promising Enterprise Security Companies by CIO Review, an SC Magazine 2016 Trust Award Finalist,, and an Info Security Product Guide Products Excellence of the Year Finalist. The company also made the Security Innovation of the Year Shortlist by the Cloud Awards and has been named to CRN's list of Emerging Security Vendors for four consecutive years."
Nodal Industries,https://www.crunchbase.com/organization/nodal-industries,"Internet, Network Security, Security",We offer home networks the latest and greatest network security solution available.,"Nodal Industries is a security solutions company. it provides network security solutions to protect home networks and small businesses from online threats. The company offers Numa, a physical device that makes users safer by examining the traffic that moves in or out of their network devices, including laptops, tablets, smartphones, desktops, and home devices; and protects against various attacks, including malware, phishing, and intrusion. It offers its products for high-net-worth individuals, women working from home, remote workers, man signing contracts, legal professionals, women using a smartphone, smart-home owners, and other. The company offers its products to their customers online. Nodal Industries was founded in 2014 and is headquartered in Mountain View, California."
No Wildland Ecology,https://www.crunchbase.com/organization/no-wildland-ecology,Agriculture,No Wildland Ecology is a comprehensive idyllic ecological platform.,"No Wildland Ecology is a comprehensive idyllic ecological platform. It mainly focuses on the integration and development of rural resources in the “beautiful pastoral life”, and carries out market-oriented, brand-oriented and large-scale effective output. It is fast through the joining economy and self-operated mode. The formation of high-quality high-end homestays, agricultural and sideline products, adoption of species, rural travel and other rural products,"
NOA Holdings,https://www.crunchbase.com/organization/noa-holdings,"Finance, Financial Services",NOA is a Holdings company staffed by a small team of experienced leaders working closely.,"NOA Holdings N.V. is a Holdings company staffed by a small team of experienced leaders working closely and hands-on with the local management teams to drive execution, deliver results and support healthy growth. Strong governance is safeguarded by Their Supervisory Board. They are currently present in Poland and Albania and They are actively pursuing further acquisitions in Central and Eastern Europe."
Noosphere Ventures,https://www.crunchbase.com/organization/noosphere-ventures,Asset Management,Noosphere Ventures is an international asset management firm.,"Noosphere Ventures is an international asset management firm, with the strategic vision and capital to transform high-potential companies into definitive market leaders. The company sees its goal in changing the landscape of the current digital economy by saturating it with the highly profitable companies. Founded in 2012 and headquartered in Menlo Park, California, USA, Noosphere primary operates in Western Europe and Asia. The Noosphere portfolio reports over $500 million in revenue and, collectively, has more than 2,000 individuals contributing to the common success. Noosphere believes in the power of the Noosphere: the ability of humans to fundamentally change the world around them through their knowledge and technology. Assets:     - Connected Co     - Circle Medical     - PocketGuard     - Kangaroo Health     - EOSData     - Firefly     - Thync     - Waywire     - AskFm     Max Polyakov - Managing Partner     Mark Watt - Managing Partner     Mark Fagan - Entrepreneur in residence     Dmitry Godylo - VP of business development     Evgeniy Yakovlev -  VP of space business development"
Novarbo Oy,https://www.crunchbase.com/organization/novarbo-oy,"Agriculture, GreenTech, Organic Food",Novarbo specializes in growing plants and greenhouse technology used for professional greenhouse cultivation.,"Novarbo specializes in growing plants and greenhouse technology used for professional greenhouse cultivation. The company is part of the Finnish Biolan Group. The company's vegetable products are suitable for both traditional and organic professional cultivation, and our range includes organic fertilizers. In Greenhouse Technology, we offer Vertical Farming multi-storey solutions and energy-saving and harvest-enhancing greenhouse climate management solutions (Heat Reuse). Novarbo Oy is a specialist in professional farming and greenhouse technology. The Novarbon medium and fertilizer products are suitable for both traditional and organic professional farming. In greenhouse technology, Novarbo offers energy-saving and crop-friendly greenhouse climate management solutions and cultivation methods. "
NoorDx,https://www.crunchbase.com/organization/noordx,"Biotechnology, Health Care",NoorDx offers advanced genetic diagnostic testing laboratory with an aim to provide precision medicine capabilities for the Middle East.,
"Nomly, Inc.",https://www.crunchbase.com/organization/nomly-inc,"Internet, Mobile Apps",Personalized recommendations from locals.,"Nomly is creating the easiest way to discover new and amazing experiences, from your own neighborhood to the other side of the world, by making it fun and rewarding to share local knowledge with others. Real people. Not a search engine."
Novalere FP,https://www.crunchbase.com/organization/novalere-fp,"Business Development, Health Care, Information Services",Novalere FP is a consumer healthcare company developing and commercializing differentiated non-prescription products.,"The evolving healthcare environment has created an expanding need for safe and efficacious product options as consumers take greater control of their own health. Founded in 2012 to fill this need, Novalere is a consumer healthcare company focused on discovering, developing and commercializing differentiated nonprescription products that have a well-documented track record of both efficacy and safety."
Noodles & Company,https://www.crunchbase.com/organization/noodles-company,"Customer Service, Restaurants",Noodles & Company is a Customer Service company.,"Noodles & Company facilitates a restaurant that offers its customers with noodle dishes, sandwiches, salads, and soups. It also offers catering services and gift cards. Noodles & Company facilitates ECLUB, a community of its fans that enables its members to access news, special invitations, offers, and giveaways. Noodles & Company was founded in 1995 and is based in Broomfield, Colorado."
