Organization Name,Organization Name URL,Categories,Description,Full Description
"Votus, Inc.",https://www.crunchbase.com/organization/votus,"Communities, Consulting, Internet, Market Research, Mobile, News, Politics",Votus is a technology platform for civic data and engagement. Organizations use Votus to connect online engagement to offline civic goals.,"Votus is an engagement and data analytics platform for civic representation. We collect public data on civic issues through internal and external inputs. We connect this data to voting districts and elected officials, which allows engagement among district neighbors to find consensus on issues and facilitate solution-oriented discussions with their elected officials."
Voltaic Systems,https://www.crunchbase.com/organization/voltaic-systems,"Electronics, Solar","Portable solar chargers and solar panels for powering phones, cameras, tablets, laptops and lights. Based in Brooklyn, NY","Voltaic Systems is a portable power company based in Brooklyn, New York. A drained phone in the middle of Spain led their founder to design the first solar backpack. Since then, the number and types of electronic devices they use has multiplied and their relationship with them have become more intense. No matter where you or your devices are in the world, their goal is to keep them charged. Here are the three things that are important to us. - See more at: http://www.voltaicsystems.com/about-us#sthash.DnOx7aaa.dpuf"
Voyager,https://www.crunchbase.com/organization/voyager,"Industrial, Industrial Manufacturing",Voyager specializes in high-quality steel fabrication.,"Voyager specializes in high-quality steel fabrication. Voyager provides parts to many sectors, including medical, RV, automotive and furniture while serving clients nationwide. Voyager also has expertise in laser cutting, welding, metal forming, stamping and powder coating."
Vonovia SE,https://www.crunchbase.com/organization/vonovia-se,"Finance, Real Estate","Vonovia SE is a housing association of Germany managing over 370,000 homes.","Vonovia is the first German housing company to be included in the DAX-30 index. Being a leader does not only mean that 400,000 apartments are part of our company throughout Germany. Being a market leader is inextricably linked with responsibility - the responsibility for around one million people who are at home.  Vonovia emerges from the merger of Deutsche Annington and GAGFAH. Both companies have their roots in non-profit housing. This is reflected in the fact that we offer our tenants a good and affordable living space. In the neighborhoods we do not just appear as landlords. Rather, we see ourselves as a service provider, which offers its tenants customer-oriented service around the home.  In this way, our property managers are helpful contacts in the settlements and take care of the different concerns of our customers. They are used every day in ""their"" neighborhood. We want to be close to our customers, not just close to our customers. Small and large handicraft services - from the exchange of a washbasin to the refurbishment of a multi-family house - are provided promptly and from a single source! For manual work our proprietary artisan organization which provides technical service of Vonovia. In addition to maintenance and small repairs, our craftsmen also make energetic modernizations as well as the conversion of our real estate assets which is friendly to the elderly."
Voci,https://www.crunchbase.com/organization/voci,"Application Performance Management, Service Industry, Speech Recognition",VOCI Corporation is the leading speech recognition Application Service Provider.,"VOCI Corporation is the leading speech recognition Application Service Provider. They design, develop, host and maintain leading edge speech recognition solutions that help their customers improve service, contain labor costs and focus on their core business. Using best-of-breed large vocabulary speech recognition technology on carrier-grade hardware, VOCI develops customer-specific applications that automate routine inquiries and transactions. For more complex calls that require agent intervention, VOCI's SERENO platform seamlessly routes the call to call center agents. VOCI's service offering and pricing format allows their customers to incorporate customized speech recognition solutions quickly without incurring large set-up costs nor stressing internal IT resources. VOCI's pricing is based on a Pay-Per-Use model, with customers only paying for calls successfully processed by their automated systems."
Volteo,https://www.crunchbase.com/organization/volteo,"Information Services, Information Technology, Internet of Things","Volteo is a recognized leader in ServiceNow sales, services, training and  Internet of Things (IoT) solutions.","Internet of Things (IoT) solutions. We are ranked in the top-5 for customer satisfaction by ServiceNow worldwide. Our team of consultants, engineers and solution architects span the globe with offices in North America, Latin America, Europe and Asia."
Volantis Systems,https://www.crunchbase.com/organization/volantis,"Android, E-Commerce, Internet, iOS, Mobile, Software",Volantis Systems provides intelligent content adaptation solutions for the mobile internet market.,"Volantis Systems Limited provides intelligent content adaptation solutions for the mobile Internet market. The company offers Content Delivery Platform (CDP), a mobile portal and e-commerce application suite, which allows mobile operators to promote, sell, and deliver content from various source. Its CDP comprises various modules, such as Mobile Development Framework, which provides a device adaptation engine that renders the services managed by other components of the CDP; Mobile Content Storefront for managing storefront sites and content; Buzzcast for integrating multiple content feeds, personalizing those feeds into custom channels, and inserting adverts and event driven push to multiple on-device clients; Mobile Content Transcoder to convert PC-oriented sites into mobile sites; Feed Builder that enables operators to build subscriber loyalty and increase data usage; and Site Builder, which enables service providers to offer their users a way to build their own personal mobile Websites. The company also offers Mobility Server, a Java-based development and runtime platform that allows Web developers to build and run their own mobile Internet applications; Ubik.com, an online service, which allows users to design, build, and host compelling mobile Websites; and Volantis Framework 5.3 that enables operators and developers to build and deploy portals and browser-based applications with customizable out-of-the-box user interface components. It serves mobile carriers, media and entertainment companies, financial services companies, and online businesses. The company was founded in 2000 and is headquartered in Guildford, the United Kingdom with additional offices in Washington; Wanchai, Hong Kong; Krakow, Poland; and Pune, India."
Voyadi,https://www.crunchbase.com/organization/banian-labs,"Apps, Artificial Intelligence, Augmented Reality, Big Data, Internet, Travel",Travel with purpose and passion,"VOYADI is a community-based travel technology startup with the mission to connect people through deeper and richer experience.  Our motto: travel with purpose and passion!  We help our members get the most of their travel and explore one-of-a-kind experiences.   We offer our members access to local knowledge and authentic experiences through our network of insiders. We want to help our members to inspire, to share, and to give.   VOYADI is part of Banian Labs, which was founded by Benny Xian,  Betty Ban and many other awesome people.  It is headquartered in Pasadena, California, with deep roots in Stanford, Hong Kong and China."
Vordel,https://www.crunchbase.com/organization/vordel,"Cloud Security, Developer APIs, Software",Vordel is an API Management vendor which was acquired by Axway in 2012.,"Vordel is an API Management vendor which was acquired by Axway in 2012. Vordel's API Gateway enables businesses to leverage Web APIs and Cloud computing to generate new revenue, interact with customers, and reduce costs. Vordel customers included Allianz, 3 UK, Bell Canada, British American Tobacco, Mazda, and governments worldwide. Vordel's patented API Gateway provides fast and secure connectivity using APIs across enterprise applications, SOA services, Cloud based services, and other  IT assets, so organizations can: * Deploy Enterprise Applications Beyond The Network Perimeter * Consume Cloud Services Without Losing Control or Compromising On Security * Secure All Application Connections Using Enterprise Security Infrastructure"
VolunteerHub,https://www.crunchbase.com/organization/volunteerhub,"Event Management, Software",Nonprofit Volunteer Management Software,"VolunteerHub is a cloud-based software for nonprofits that streamlines volunteer and event management. For two decades, VolunteerHub has been the trusted name for volunteer management software. The system offers a powerful, yet user-friendly platform for managing volunteer information. Save your nonprofit time by using VolunteerHub to dramatically reduce extraneous telephone and email traffic, help organize events, email volunteer groups, track registrations, and report on volunteers’ activities. VolunteerHub offers features such as customizable user forms, group reservations, guest tracking, waitlists, and more."
Voimada,https://www.crunchbase.com/organization/enpse-group-oy,"Artificial Intelligence, Digital Media",AI PaaS transforming blogging and creative writing.," Voimada is an online platform that uses artificial intelligence and augmented data analytics to revolutionise blogging and creative writing. We are creating a new experience for bloggers and writers. With the power of Machine learning, voice recognition, speech to text and machine translation we unleash AI powered bots that can generate specific stories for the different business categories. Voimada is an handy tool in business blogs and article writing.Our solution creates inclusion for persons with disabilities in their upper limb as relates to Qwerty inputs and traditional writing."
Voolsy Networks Pvt. Ltd,https://www.crunchbase.com/organization/voolsy-networks-pvt-ltd,Food Delivery,Quick Food Ordering and Payment Inside Restaurant,
Vochlea Music,https://www.crunchbase.com/organization/vochlea-music,Music,Vochlea Music is a creative technology company specialising in vocally controlled music creation.,Vochlea Music is a creative technology company specialising in vocally controlled music creation.
VOX Network Solutions,https://www.crunchbase.com/organization/vox-network-solutions,"Information Technology, Telecommunications",VOX Network Solutions is a telecommunications company that offers converged voice and data services.,"VOX is a modern technology company that truly wants to make a difference in the world. They embrace innovation and creativity and dare to think about change in terms of monumental paradigm shifts. Yet, it is their approach to creating this change that sets us apart. By infusing a deep-seeded belief in creating committed partnerships, engaging in their communities and empowering individuals to have a stake in the process, they create a collaborative prosperity that positively affects people, businesses and the world."
Voicenter LTD,https://www.crunchbase.com/organization/voicenter,"Information Technology, IT Infrastructure, PaaS, SaaS, Telecommunications, VoIP",Voicenter is an innovative telephony company which develops advanced cloud based communication solutions for the business sector.,"Voicenter is an innovative telephony company Providing Cloud PBX and Contact center as a service with omnichannel solutions for SME and Telcommunication operators. Voicenter services are offered as a public telephony cloud, private cloud or hybrid cloud topology, spread over the U.S., Europe, Far East, Australia and Israel,   allowing its customers to enjoy a wide range of flexible telephony tools, creating an ultimate communication solution for organizations with changing needs.  Voicenter services based on in-house technology that was developed  to improve business communications services while maintaining friendly user experience,   focusing on the needs of business customers to improve business communication worldwide every day."
Voxo,https://www.crunchbase.com/organization/voxo-3,Financial Services,"Voxo enables efficiency, compliance and client insight in financial advisory through voice conversation parsing and analytics.","Voxo enables efficiency, compliance and client insight in financial advisory through voice conversation parsing and analytics."
Voxeljet,https://www.crunchbase.com/organization/voxeljet,"3D Printing, Digital Media, Hardware, Software",Voxeljet is a 3d printer provider and service that allows customers to have 3d printing requests.,"voxeljet is a manufacturer of industrial 3D printing systems and operates, what it believes is one of Europe´s largest service centres for the ""on-demand production"" of moulds and models for metal casting. voxeljet SYSTEMS business division focuses on the development, production and distribution of the market´s fastest and most powerful 3D printing systems. Today, voxeljet has a well-coordinated product range that reaches from smaller entry models to large-format machines, and therefore offers the perfect 3D print system for many application areas. voxeljet SERVICES custom parts service centre creates sand moulds and plastic models based on CAD data on demand. Small-batch and prototype manufacturers appreciate the automatic, patternless manufacture of their casting moulds and 3D models.The company's customer base includes well-known automotive manufacturers and their suppliers, foundries as well as innovative companies from the arts design as well as the movie and entertainment industry."
Vodacom Mozambique,https://www.crunchbase.com/organization/vodacom-mozambique,"Internet, Mobile, Telecommunications, Wired Telecommunications","Vodacom Mozambique is a telecommunications company that aims to bring the best quality calls, SMS and Internet faster.","Vodacom Mozambique is a telecommunications company that aims to bring the best quality calls, SMS and Internet faster to more locations in the country, so that more and more people benefit from our services and are connected anytime, anywhere. "
VoicePIN.com,https://www.crunchbase.com/organization/voicepin-com,"E-Commerce Platforms, FinTech, Internet of Things, Mobile, Social Impact, Telecommunications",VoicePIN - natural voice authentication designed for easy and secure integration with many customer interaction channels.,"VoicePIN is a biometric system for easy and secure user authentication, based on the analysis of his voice. This technology allows you to securely log on to a system without having to remember difficult passwords or pin numbers."
Vodafone Americas Foundation,https://www.crunchbase.com/organization/vodafone-americas-foundation,"Mobile, Software, Wireless",Vodafone Americas Foundation™ is part of Vodafone’s global network of foundations.,"Vodafone Americas Foundation™ is part of Vodafone’s global network of foundations. We are affiliated with Vodafone, one of the world’s leading mobile telecommunications companies, which operates in more than 30 countries with partner networks in over 50 more countries, and has significant presence in Europe, the Middle East, Africa, Asia Pacific and the United States. We are located in California’s Silicon Valley and Denver, Colorado. “Mobile for Good” is a universal theme throughout Vodafone’s foundations worldwide. The Foundations mobilize communities by bringing people together from all sectors: business, nonprofit, government, employees and even our customer base, to resolve shared problems and advance social change."
Voco Networks,https://www.crunchbase.com/organization/voco-networks,"Advertising, Brand Marketing, Digital Marketing, Direct Marketing, Enterprise Software, Lead Generation, Marketing Automation, Mobile Advertising, Sales Automation, Small and Medium Businesses",VOCO drives viral sales with zero effort. Its AI chat bot inspires shoppers to recommend products they like to their close social circles.,Virally drive your sales with your current customers by turning them into micro-influencers. VOCO's AI-Powered chat BOT incentivizes shoppers to recommend products they like to their close social circles. It rewards friends to also recommend and purchase setting viral sales into motion. VOCO tracks friends' purchases from referrals to reward everyone. VOCO easily integrates with your existing software. VOCO is the referral marketing engine that drives viral sales. Please refer to our website to learn more.
Voxter Communications,https://www.crunchbase.com/organization/voxter-communications,"Enterprise Software, Information Technology, Internet, Software, Telecommunications, Video, VoIP","Voxter provides white labelled Voice over IP solutions for businesses and resellers, both as a direct service and as a platform.","Voxter Communications Inc. provides both a platform and a network for delivering Voice over IP to businesses and resellers such as Managed Service Providers (MSPs), Internet Telephony Service Providers (ITSPs), Internet Service Providers (ISPs), and Carriers. With a geographically redundant service network spread across multiple countries including Canada, the United States, and England, Voxter's attention to both network architecture and focus on uptime makes providing an SLA on business VoIP possible. Feature sets include self-administration web interfaces, end-user client applications for extension management, Unified Communications tools (Presence, IM, Audio/Video Calls, File/Desktop Sharing)"
VOIPO,https://www.crunchbase.com/organization/voipo,"Telecommunications, VoIP, Web Hosting","VOIPO provides VoIP, voice, and messaging services to residential and small business users.","VOIPO offers VoIP, voice, and messaging services to residential and small business users. It also offers its users with VoIP phone services, toll-free numbers, local forwarded numbers, business phone systems, hosted PBXs, SMS enabled numbers, and resell VoIP services. The company was founded in 2006 by Timothy Dick. VOIPO is headquartered in the United States."
Voicegem,https://www.crunchbase.com/organization/voicegem,"Messaging, Mobile",Voicegem is a web and iOS based voice messaging platform.,"Voicegem is a web and iOS app offering an easy way to send voice messages to anyone. Users of Voicegem are provided with the facility to record long messages, and send it to anyone through an email or Facebook message. The recipients (friends or family) of the Voicegem messages can listen and reply to voice messages without installing or signing up with any platform."
VOTO Mobile,https://www.crunchbase.com/organization/voto-mobile,Mobile,"Increase participation, transparency and accountability related to services delivered to citizens, and to empower communities to collect.","VOTO Mobile is a Ghana-based social enterprise with staff in Ghana, Canada, and the United States. The company is responsible for developing the technology which FRI uses to conduct voice polls/surveys in Tanzania and Ghana and, soon, in other countries."
Vocareum,https://www.crunchbase.com/organization/vocareum,Education,Cloud Labs for Coding Classes,
Vox Call,https://www.crunchbase.com/organization/voxcall-com,"Mobile, VoIP",Prepaid International Long Distance,Vox Call is a prepaid international calling service you can use with any phone to make international phone calls. Vox Call customers can save up to 95% more on their international phone call costs versus direct dialing from their cell phone and traditional international long distance plans. The company generates revenue by providing service directly to consumers at Voxcall.com; through SAAS for white-label partners using carrier services supplied by Voxcall; and through licensing fees from major prepaid telecom companies using its platform to provide service in the United States and overseas.
Voltas,https://www.crunchbase.com/organization/voltas,Transportation,Voltas Inc is a peer-to-peer ridesharing and transport company.,"Voltas Inc is a peer-to-peer ridesharing and transport company. Originally from the US, it is replicating its success in the UAE. Along with Careem and Uber, Voltas is the one of the only 3 RTA-licensed ridesharing companies in UAE. Voltas helps riders earn more because of its commission/rate difference, as opposed to other existing ridesharing services. Voltas has an official tie-up with Dubai airports and includes luxury and sports cars in its fleet. Voltas aims to provide alternative to modes of transportation with a wide array of vehicle options"
vocalize.ai,https://www.crunchbase.com/organization/vocalize-ai,"Analytics, Artificial Intelligence, Big Data, Consumer Electronics, Information Technology, Software",a test suite for advancing conversations between humans and computers,"vocalize.ai – a test suite for advancing conversations between humans and computers How well do AI powered virtual assistants hear us when exposed to real-world operating conditions? Work has already started and preliminary results are shared in our report. How do we ensure that the next wave of conversational computing is inclusive across gender, race, age, dialect and accent? This work will leverage initial procedures and algorithms, but with diversified datasets and additional procedures. We introduce the concept of an “inclusivity index” for AI platforms. vocalize.ai is developing test suites, software and the associated data sets to perform black-box evaluations of ASR systems. We will help highlight gaps in performance with measurable, repeatable and shared benchmarks. "
Voscreen,https://www.crunchbase.com/organization/voscreen,"E-Learning, EdTech",Education,Voscreen helps you improve your English language skills on your own through short video clips. Learning and improving English is more enjoyable than ever with Voscreen video learning environment.
Vox Markets,https://www.crunchbase.com/organization/vox-markets,"Market Research, Real Time","Online network connecting traders and investors to a dynamic network of information, people, companies and ideas.",
Vostok Ventures,https://www.crunchbase.com/organization/vostok-ventures,"E-Commerce, Internet, Venture Capital",Vostok Ventures makes seed and early stage venture investments in IT projects from Eastern Europe.,"Vostok Ventures makes seed and early stage venture investments in IT projects from Eastern Europe. It focuses on mobile applications, e-commerce, cloud services, and the gaming industry. Vostok Ventures was co-founded by Michael Kharenko and Svyatoslav Pogrebnoy, and is based in Kyiv, Ukraine."
Vouched,https://www.crunchbase.com/organization/vouched,"Apps, iOS, Location Based Services, Small and Medium Businesses, Social Media",Vouched is a dual-platform app that allows users to crowdsource reputation analytics for job hunting and career advancement.,"Vouched is a dual-platform app that allows users to crowdsource reputation analytics for job hunting and career advancement. It enables employers to hire based on character. The application’s deliverables include websites, mobile app user interface designs, mobile app user experiences, graphics, data visualizations, brandings, and social media marketing collaterals. Vouched is free and currently available on the Apple’s App Store and Google Play Store. Based in Mclean, V.A., it was founded by Nicholas F. Fox, Kevin Hawkins, and Keith W. Cooperman."
VoltsUp Technologies Inc. USA,https://www.crunchbase.com/organization/voltsup-technologies-inc,"Consumer Electronics, Electrical Distribution, Electronics, Energy, Energy Efficiency, Hardware, Industrial Automation, Industrial Manufacturing, Internet of Things, Semiconductor","VoltsUp Technologies Inc is a Research & Development, advanced Ai RF Self Wireless Charging Over-Air and Distances","VoltsUp Technologies Inc is a Research & Development, Manufacturing Ai Self-Contained Radio Frequency (RF) Uncoupled Wireless Charging Over- Air and Distances ,Energy Harvesting, Enhancing recover technologies company. Our company focuses on developing, licensing technologies to third parties company and business to business integrated technologies, licensed distributors, joint ventures development, investment opportunities. March 11, 2019 VoltsUp Technologies is now offering Investment opportunities, Licensing, joint ventures development agreements In USA, Mainland China and Hong Kong. The opportunities are limited."
Voyage Care,https://www.crunchbase.com/organization/voyage-care,"Health Care, Hospital",Voyage Care specialises in treatment for adults with learning difficulties.,Voyage Care specialises in treatment for adults with learning difficulties.
Vooban,https://www.crunchbase.com/organization/vooban,Software,"At Vooban, we help YOU make a leap with YOUR next disruptive digital product or service that will inspire YOUR customers",
VocoMD,https://www.crunchbase.com/organization/vocomd,"Health Care, Medical","VocoMD offers answering services, text messaging and video communications solutions for the healthcare industry.","VocoMD is breaking down the barriers between health care providers and patients. The platform makes it easy for patients and doctors to communicate via voice, text, or video anytime, anywhere.  The solution increases patient satisfaction, improves clinical outcomes,  reduces healthcare costs and helps healthcare organizations communicate more efficiently."
