Organization Name,Organization Name URL,Categories,Description,Full Description
GenomSys,https://www.crunchbase.com/organization/genomsys,"Genetics, Health Care","GenomSys is a Swiss company composed by engineers with extensive experience in research, development and project management.","GenomSys is a Swiss company composed by engineers with extensive experience in research, development and project management in high-end domains and industrial segments such as digital signal processing, telecommunications, information security and avionics. Their experience spans from embedded software and firmware for low-power devices to hard real-time programming in safety-critical environments up to the design and integration of desktop and server applications in the digital multimedia and telecommunications market. All the engineers are extensively accustomed to the ISO process of standardization, with experience in development and normative editing of audiovisual coding, systems and conformance testing standards."
getFoodi,https://www.crunchbase.com/organization/getfoodi,"Bakery, Food Delivery, Marketplace",Celebrate Differently,"getFoodi seeks to help millions of aspiring chefs and bakers make a career out of their passion. By creating a network of passionate chefs and food lovers we enable our verified chefs to cook without the need to open a costly shopfront. getFoodi manages their sales, marketing, accounting, distribution and logistics so that they can focus on what they love. Futhermore, getFoodi provides a single location for foodies to discover the most unique and amazing creations."
George Gee Automotive Companies,https://www.crunchbase.com/organization/george-gee-automotive-companies,"Automotive, Service Industry, Transportation","George Gee Automotive began in Spokane, Washington in 1983 as a single point Pontiac dealership.","George Gee Automotive began in Spokane, Washington in 1983 as a single point Pontiac dealership. At the time, George and Theresa Gee had lived in Spokane for 11 years after relocating from Montana. George had been in the automotive business for 6 years and Theresa was a nurse. From the beginning, Gee Automotive grew as George and Theresa focused on their core beliefs: create a business of families serving families, offer unsurpassed customer service, and give back to the community that had given them so much. Since then, the Gee's have built a business that is continually the market leader in sales volume and customer satisfaction. This has resulted in customer retention that is more than double the national average."
Gemini Development,https://www.crunchbase.com/organization/gemini-development,"Developer Tools, Enterprise Software, Service Industry",Gemini Development is a boutique software development agency.,Gemini Development is a boutique software development agency focused on delivering amazing digital product experiences.
Gearbox Express,https://www.crunchbase.com/organization/gearbox-express,"Commercial, Energy, Industrial, Renewable Energy, Wind Energy",Gearbox Express to remanufacture wind energy gearboxes,"Gearbox Express is the only independent company in North America solely focused on providing down-tower, wind gearbox remanufacturing solutions.They focus strictly on gearboxes, and we know how to keep them running.Gearbox Express was founded by gearbox guys who grew up in the industry and have years of experience with both gearing and bearings. Founded in 2011, Gearbox Express has exceeded its own expectations for growth thanks to its unwavering commitment to customer service and to innovative solutions that are better than anyone else in the wind-energy industry."
Genesee & Wyoming,https://www.crunchbase.com/organization/genesee-wyoming,Transportation,Genesee & Wyoming is a railroad company that focuses on the freight industry.,Genesee & Wyoming is a railroad company that focuses on the freight industry.
General Dynamics Information Technology,https://www.crunchbase.com/organization/general-dynamics-information-technology,Information Technology,General Dynamics Information Technology has worked across the full spectrum of government and business for decades.,"Headquartered in Falls Church, Virginia, General Dynamics is led by Phebe Novakovic. The company employs thousands of people, with locations in 43 countries. At the heart of their company are their employees. They rely on their intimate knowledge of customer requirements and a unique blend of skill and innovation to develop and produce the best possible products and services. The driver that makes their company agile, and ensures their continued performance, is their culture of continuous improvement. This culture enforces a shared commitment to consistently look toward the future and to embrace change. It’s a priority at all levels of their company, with every employee engaged in finding new ways to do things faster, better and more cost-effectively, and push the boundaries of their potential."
GEV Wind Power,https://www.crunchbase.com/organization/gev-wind-power,"Clean Energy, Energy, Information Technology, Renewable Energy, Telecommunications, Wind Energy",GEV Wind Power offers wind turbine maintenance service.,"GEV Wind Power has grown from providing blade maintenance service for a single Europe turbine OEM to delivering blade maintenance, inspection, fabric, and tower services to owner-operators, utilities and all major turbine OEMs throughout the globe. GEV Wind Power has become the lead independent service provider for blade maintenance services. We deliver unrivaled competence and technological expertise, offering an unprecedented breadth of services and industry-leading innovative solutions. GEV Wind Power's expanded network of support offices and personnel are ready to meet all your maintenance needs – from every type of wind turbine to substation integrity requirements. We invest heavily each year in technician training to ensure increased capacity is available as the industry grows. As such a comprehensive programme of technician training, which covers industry and client specific requirements are matched to our in-house competency system. This ensures our resource is at the highest level of professionalism within the industry. GEV Wind Power's business is also constantly focused on change and driving industry innovation. Accepting that the wind energy maintenance companies need to find new ways of delivering core services to help reduce the cost of energy going forward, is something that we are firmly aligned with. This is why we commit financial resources to in-house research & development and constantly look to source proven technologies from around the World that fit well for Wind Energy."
GEEN Biotechnology,https://www.crunchbase.com/organization/geen-biotechnology,"Biotechnology, Life Science, Pharmaceutical",GEEN Biotechnology is a synthetic biology company developing master cells & genetic technologies for industrial production of biomolecules.,GEEN Biotechnology is a synthetic biology company developing master cells & genetic technologies for industrial production of biomolecules.  It developing especially genome editing related (e.g. CRISPR/Cas9) genetic technologies and working on mostly various yeast cells and recently putting effort into industrializing minimal cells. GEEN Biotechnology is your high-tech genetic eng. partner through drug and industrial biotech product development.
Geztio,https://www.crunchbase.com/organization/geztio,"Business Intelligence, Hospitality, Tourism",Geztio is a Swedish startup providing business intelligence about the hospitality industry.,Geztio is a Swedish startup providing business intelligence about the hospitality industry. They make it possible for tourist providers make smart decisions and increase their profitability through the real-time access to previously unknown knowledge about their guests.
Genepoint Biological Technology,https://www.crunchbase.com/organization/genepoint-biological-technology,Health Care, Genepoint Biological Technology  is a healthcare Company.,
Geeks for Geeks,https://www.crunchbase.com/organization/geeks-for-geeks,"Education, Human Resources",A computer science portal for geeks,"This portal has been created to provide well written, well thought and well explained solutions for selected computer science problems."
GeckoLife,https://www.crunchbase.com/organization/geckolife,"Cyber Security, Internet, Social, Social Media, Social Media Management, Social Network","Personal & Group Communication, Simplified","GeckoLife is a platform for groups and individuals to safely communicate and collaborate. We make it easy for users to chat, share pics/videos, plan activities and store media. Created with a focus on safe and private online communication, GeckoLife enables users to easily interact on canvases by topics of interest or by a defined audience set. Launched in 2014, GeckoLife is the brainchild of Rajeev Gupta and Ashish Trivedi, both working parents who seek to create a meaningful, private communication platform for their professional and personal lives. The company has a team of 15, with headquarters in Singapore and offices in Australia, India and the United States. GeckoLife is supported by individuals and trusts who are passionate about creating a meaningful and private online platform that acknowledges a safe digital footprint. Its mobile app is available on the App Store and Google Play."
Genzyme,https://www.crunchbase.com/organization/genzyme,"Biopharma, Biotechnology, Genetics",Genzyme Corporation (Genzyme) is a biotechnology company. The Company's product and service portfolio is focused on rare genetic disease,"Genzyme Corporation (Genzyme) is a biotechnology company. The Company's product and service portfolio is focused on rare genetic disease disorders, renal diseases, orthopaedics, cancer, transplant and immune disease. Genzyme operates in four business segments: Genetic Diseases, Cardiometabolic and Renal, Biosurgery and Hematologic Oncology. Genetic Diseases unit develops, manufactures and distributes therapeutic products, with a focus on products to treat patients suffering from genetic diseases, including a family of diseases known as lysosomal storage disorders (LSDs). Cardiometabolic and Renal segment develops, manufactures and distributes products that treat patients suffering from renal diseases, including chronic renal failure and endocrine and cardiovascular diseases. Biosurgery develops, manufactures and distributes biotherapeutics and biomaterial-based products. Hematologic Oncology develops, manufactures and distributes products for the treatment of cancer."
Getonic,https://www.crunchbase.com/organization/getonic,"E-Commerce, Marketing, Social Network",Getonic is a social e-commerce platform that enables sellers to build stores and share them on social networks.,"Getonic uses your fans social marketing efforts to promote and sell your products.  Customers create customizable POPshop in seconds: Include a preview of the product, payment capabilities and a built-in incentives program. You can spotlight your offer on social networks: Share your individual POPshops with your fans and followers on Facebook, Twitter, Pinterest, blogs and email, where they can instantly view and purchase. Your fans and followers become  promoters when they share your POPshops with their own networks, automatically earning commissions for successful sales."
GENERAL MEDICAL MERATE,https://www.crunchbase.com/organization/general-medical-merate,"Manufacturing, Medical, Medical Device","General Medical Merate develops advanced equipment, including remote-controlled, radiographic and specialized x-ray systems.",GENERAL MEDICAL MERATE (GMM) creates each equipment conflating its consolidated know how with an inspired vision on the future. Their equipments are conceived so as to ensure the maximum safety for the patients and the utmost efficiency for the operators: this is why GMNM brand is synonomous of top quality and unmateched reliability.
Geselle Group,https://www.crunchbase.com/organization/geselle-group,"Association, Communities, E-Commerce",Northern Europe's strongest association for hairdressers with a professional certificate or certificate of conscience!,"Geselle - Northern Europe's strongest association for hairdressers with a professional certificate or certificate of conscience! They support and raise salons with professional certification by promoting the strength of our members to all consumers. As a member of Geselle, you are ahead of all other lounges. With our unique concept, they give you the opportunity to work with digital aids in marketing to your customers. One example is that you and your customers are given the opportunity to easily trade quality products through our common e-commerce solution, from the web or the mobile. Another advantage is that your customers can book time for their next visit through your salong digital app. In addition, they can offer several other benefits that make it easier for you to work on your job and give you the opportunity to increase your sales. Participating in Geselle means you are a member of Northern Europe's largest independent and volunteer hairdresser chain. It makes you stronger and better equipped to meet the future! They do not compromise our requirements and they make sure that the community they create together favors your salon."
Genwords,https://www.crunchbase.com/organization/genwords,"Advertising, Content Marketing, Internet, Professional Services, SaaS, SEO",We're the 1st content marketing platform and the largest network of freelance writers of LatAm,We're the largest network of freelance writers & editors in Spanish & Portuguese + the 1st SaaS content marketing platform of LATAM
Get Jamn,https://www.crunchbase.com/organization/miq,"Apps, Music, Software","Jamn develops and distributes innovations that help people discover, learn, play and share music.","WHO THEY ARE Jamn PLAYER is from Johnny Quattro and a Hong Kong-based team. It began after Johnny sold his successful snowboard design consultancy and launched a music business to make music easier and more fun. The first app, Jamn Multi-Tool, featured Johnny’s patent-pending Jamn Wheel and presents complex music theory in a way anyone can understand. Under his leadership the app scored over a million downloads and multiple awards. Together since 2012, the core team’s responsibilities span design and coding. WHY THEY'RE DOING THIS As musicians they understand the challenges people encounter when playing music. They want to make discovering and playing music easier for everyone, so they developed a series of Jamn products to break down those barriers. Their latest app, Jamn PLAYER, launched mid-January 2015, garnered over half a million downloads within the first few weeks. It has also attracted enquiries from leading investment firms from across the world, musicians and labels for partnership opportunities. MOST IMPRESSIVE ACCOMPLISHMENT They bootstrapped and developed a product and business model that generates revenue and can be rapidly scaled. They've also proven themselves as a strong team with more than one successful product. Now they're ready for the next step to make PLAYER bigger and smarter than before! Jamn Multi-Tool - Find chords to any key fast  - over a million downloads  - features a patent-pending Jamn wheel  - Apple iTunes Best of 2013 apps  - Hong Kong ICT Awards 2014  Find out more at http://getjamn.com/more-apps"
GetDoc by Jireh Group,https://www.crunchbase.com/organization/getdoc-enterprise,"Health Care, Medical",GetDoc | Delivering a Better Healthcare Experience!,"GetDoc | Find a Doctor, Make an Appointment, Pay Your Medical Bill! Connected Healthcare"
Genufood Energy Enzymes,https://www.crunchbase.com/organization/genufood-energy-enzymes,"Health Care, Hospitality, Manufacturing","Genufood Energy Enzymes focuses on promoting, marketing, distributing and exporting enzyme products.","Genufood Energy Enzymes Corporation, a development stage company, focuses on the promotion, marketing, distribution, and exporting to enzyme products for human and animal consumption in Taiwan and rest of the Asia. It has contract manufacturing arrangements with OEM manufacturers in Taiwan and the United States. The company provides ProCellax enzyme products for digestive, heart, intestine, immune, and joint health. The company offers a range of enzyme products under its private label, including ProCellax DG1, ProCellax DG2, ProCellax DG1 Sachet, ProCellax FG1, ProCellax VDIHF, ProCellax SNU, ProCellax E, ProCellax E2AF, and ProCellax SP for human consumption,"
General Global Medical (Universal Medici),https://www.crunchbase.com/organization/general-global-medical,"Information Technology, Medical",General Global Medical is a comprehensive medical supply service provider,"Global Medical is a comprehensive medical supply service provider that provides hospital clients with a comprehensive range of integrated medical service solutions, including medical finance, hospital investment-construction-operation, medical technology and medical information, based on their accumulated experience in the medical field."
Geppert,https://www.crunchbase.com/organization/geppert,"Electrical Distribution, Energy, Power Grid",Geppert GmbH manufactures hydroelectric power plant components.,Geppert GmbH manufactures hydroelectric power plant components.
GetLooky,https://www.crunchbase.com/organization/getlooky,Real Estate,GetLooky is a Internet service for searching all commercial real estate,
getQueried,https://www.crunchbase.com/organization/getqueried,"Market Research, Social Media",getQueried ApS is the company entity behind WHAT - a social platform enabling anyone to collect opinions worldwide.,"The global majority is silent, disenfranchised, and with no say in matters important to their lives. To improve living conditions globally, we need to know about each other’s aspirations, attitudes and living conditions. WHAT is the first integrated global and social opinion platform that is fun and easy to use for everyone. On WHAT, users ask and answer questions anonymously. Individuals post their personal dilemmas, and organizations and businesses post quick polls to collect answers and make better policy- or service decisions.  Want to know the best bar nearby? Ask the men in the vicinity, which one they prefer. WHAT is free to use, so try it out and tell us what you think, or write us to say hello. Do you want to make better business decisions? Go to what.qa and ask your business questions to your target group on the WHAT community. Collect the data and make better decisions. It's that simple."
GEOmii,https://www.crunchbase.com/organization/geomii,"Analytics, Information Technology, Logistics, Mobile, Sensor, Service Industry",Mobility as a service data and sensor systems,
GetEat,https://www.crunchbase.com/organization/geteat,"Brand Marketing, Food and Beverage, Mobile Apps",GetEat is a food & resturant marketing platform.,"GetEat is a marketing platform that allows the owners of restaurants and food chains to easily create campaigns directed at a particular user. In addition, chefs and restaurant owners can take a picture of the food they just prepared and share it with users who are interested in purchasing the sale."
Geme.io,https://www.crunchbase.com/organization/geme-io-geme,"App Discovery, App Marketing, Communities, GovTech, Internet, Location Based Services, Mobile Apps, Social Network","Geme.io is a free urban tech, geo-location app platform that makes cities smarter.","Geme.io, a free urban tech, geo-location app platform that makes cities smarter by connecting stakeholders (residents, tourists, businesses, local governments, NGOs etc.) to a range of information in their near vicinity. Users create their own location markers surrounding anything (farmer's markets, bike shares, university campus events, baby playground get-togethers for young parents) and the city becomes accessible in the smartest manner possible. Their focus is on a few critical, and very interconnected areas: Traffic Congestion, Air Pollution, Parking, Rest Rooms, Social Inclusion and Citizen Participation. Geme.io integrates to city clouds, sensors and voice assistants to help bridge the digital tech divide for impaired citizen groups among others. Geme.io uses public (open) crowdsourced and volunteered data to provide relevant information per one's interest."
Geework.cn,https://www.crunchbase.com/organization/geework-cn,"Construction, Real Estate",Geework.cn is a Real Estate & Construction company.,
Geolang,https://www.crunchbase.com/organization/ascema,"Cyber Security, Intellectual Property",GeoLang is a software development company and an Innovation Engine specializing in the cyber security and business resilience market.,"GeoLang is a software development company and an Innovation Engine specializing in the cybersecurity and business resilience market, with an emphasis on providing advanced, content-aware Information Management solutions. Ascema is a new technology for locating, securing and controlling the movement of sensitive data and intellectual property within cloud collaboration environments, email systems and more. By recognizing snippets of sensitive or classified content created, shared and edited by your users, Ascema allows you to take a hands-on approach to active control of your sensitive content and intellectual property. With prescribed interventions and automated classification Ascema offers a simple to use solution to control the flow and copying of content both within your network and external collaboration environments."
Geomerics,https://www.crunchbase.com/organization/geomerics,"Enterprise Software, Gaming, Graphic Design",Geomerics is an innovation-led company specialising in graphics software for the games industry and beyond.,"Geomerics is an innovation-led company specialising in graphics software for the games industry and beyond. It is built on a combination of advanced in-house IP, a world-class research team, and strong management experience. They are based in Cambridge and have built a team that combines many years of management and industry experience with some of the UKs leading researchers."
GetVu,https://www.crunchbase.com/organization/getvu,"Information Technology, Innovation Management, Software",GetVu is a solutions provider on a mission to drive innovation through the rapidly emerging technologies of augmented reality.,"GetVu is a solutions provider on a mission to drive innovation through the rapidly emerging technologies of augmented reality and wearable devices. Our initial solutions focus will streamline supply chain management processes offering more accessibility to real-time data, optimized workflow efficiencies, and improved automation to manual labour processes."
Generac Power Systems,https://www.crunchbase.com/organization/generac-power-systems,"Electrical Distribution, Electronics, Manufacturing",Generac has earned a reputation as the company home and business owners turn to when the power goes out.,"Generac has earned a reputation as the company home and business owners turn to when the power goes out. The first to engineer affordable home standby generators, along with the first engine developed specifically for the rigors of generator use, they now sell more home standby generators than all of their competitors combined. They revolutionized the commercial market with the first cost effective product line meeting the needs of small and mid-sized businesses."
Gemini Data Inc.,https://www.crunchbase.com/organization/gemini-data-inc,"Analytics, Artificial Intelligence, Big Data, Data Integration, Machine Learning",Gemini Data provides Data Availability for AI/ML driven analysis and applications to enable unified enterprise knowledge and access.,"Gemini Data provides cloud-native data infrastructure enabling data availability for AI-driven analysis.  Gemini’s Autonomous Data Cloud provides data availability across enterprise data silos to power AI driven analysis without copying or data movement.  Led by experts from AppDynamics, Cisco, and Splunk - Gemini is dedicated to helping global customers leverage AI for a competitive advantage. Find more information at geminidata.com or follow us on LinkedIn.  Gemini’s Autonomous Data Cloud connects human and machine intelligence for faster, AI-driven analysis. Gemini provides data availability by unifying all silos without data movement. Led by experts from AppDynamics, Cisco, and Splunk - Gemini is dedicated to helping global customers leverage AI for a competitive advantage. Find more information at geminidata.com or follow us on LinkedIn."
GeoMetWatch,https://www.crunchbase.com/organization/geometwatch,"Environmental Engineering, Government",GeoMetWatch develops advanced environmental observation systems.,"GeoMetWatch is a privately-held, commercial company with the mission of developing highly-advanced environmental observation systems. GeoMetWatch was founded to facilitate the collection and delivery of the most advanced atmospheric sounding data to the world at the lowest cost and in the most expedient time frame. The data that GeoMetWatch will collect and deliver to forecasters will enable the most accurate prediction of severe weather ever achieved. The forecasts enabled by GeoMetWatch data will save lives, preserve property and improve the monitoring of our environment."
