Organization Name,Organization Name URL,Categories,Description,Full Description
SoftBank,https://www.crunchbase.com/organization/softbank,"Finance, Internet, Mobile, Telecommunications","SoftBank provides fixed line, mobile telephony, internet, telecommunications, and digital television products.","SoftBank is a multinational telecommunications and internet corporation focused on broadband, fixed-line telecommunications, e-commerce, internet, technology services, finance, media and marketing, and other businesses. The company operates through four major segments. The mobile communications segment provides mobile communications services; produces and distributes online games for smartphones and other devices; offers mobile broadband services; provides supply chain solutions, handset protection, and insurance, buy-back and trade-in services, omni-channel solutions, and financial services; and sells mobile devices such as iPhones, iPads, and SoftBank smartphones. The sprint segment offers mobile and fixed-line voice and data transmission services for individual consumers, businesses, government subscribers, and resellers in Puerto Rico and the U.S., and sells mobile devices and accessories. The fixed-line telecommunications segment offers telecom services such as fixed-line telephone and data communications services to corporate customers; and broadband services to individual customers. The internet segment is engaged in the operation of the Yahoo! JAPAN portal; sale of internet advertising; operation of e-commerce sites; provision of membership services; sale and marketing of data centers; provision of online automobile-related information; and operation of the internet affiliate system.  SoftBank also generates and sells electricity from renewable energy sources; provides payment processing, invoice collections, and computation services for businesses; distributes video, voice, and data content via media; operates IT information site ITmedia; provides solutions and services for online businesses; and operates online games and software downloads. Additionally, it is involved in the ownership of professional baseball team; operation of baseball games; management and maintenance of baseball stadium and other sports facilities; and procurement of funds by issuing preferred securities.  SoftBank was established by Masayoshi Son in September 1981 and is headquartered in Tokyo, Japan."
SolarCity,https://www.crunchbase.com/organization/solarcity,"Construction, Energy Efficiency, Renewable Energy, Solar","SolarCity provides solar energy services to homeowners, businesses, government, and non-profit organizations.",SolarCity is the nation's 1 leading provider of solar energy systems that deliver reliable clean energy to homes and businesses. SolarCity went public on the NASDAQ exchange in 2012 with a market cap of around $600 million.
Sonos,https://www.crunchbase.com/organization/sonos,"Audio, Consumer Electronics, Hardware, Music, Wireless",Sonos is a wireless multi-room music system enabling users to play music anywhere in the house and control it using a smartphone.,"Sonos is a developer of wireless multi-room music systems for the home. The Sonos Multi-Room Music System is the first, wireless multi-room music system that lets you play all the music you want all over your house — and control it all from the palm of your hand. Sonos liberates the music stored on a computer so it can be enjoyed all over the house. In addition, by partnering with audio services like Audible.com, Last.fm, Napster, Pandora, RadioTime, Rhapsody, SIRIUS Internet Radio, and more, Sonos gives music lovers instant, computer-free access to millions of songs, thousands of radio stations, audiobooks, and more."
SoundCloud,https://www.crunchbase.com/organization/soundcloud,"Apps, Independent Music, Music, Software",SoundCloud is a social sound platform where anyone can create and share sounds.,"SoundCloud is a social sound platform where anyone can create and share sounds. It allows people to discover and enjoy the largest selection of music from the world’s most diverse creator community. This is made possible by an open platform that directly connects creators and their fans across the globe. Sound creators can use the platform to instantly record, upload and share sounds across the internet, as well as receive detailed stats and feedback from the SoundCloud community. SoundCloud was launched in 2008 by Alexander Ljung and Eric Wahlforss."
Sonder,https://www.crunchbase.com/organization/sonderstays,"Hospitality, Tourism, Travel",Sonder is a tech-driven hospitality company offering spaces built for travel and life in cities around the world.,"With thousands of beautiful spaces built for travel and life, Sonder is transforming the future of hospitality. Each Sonder is purposefully selected, designed and maintained - customized to reflect the vibe of its neighborhood. Whether your stay is two days, two months or two years, in a studio or a six-bedroom, Sonder ensures a unique, yet consistent experience. And with 24/7 on-demand service, crisp linens, and over 200 other quality standards, we’re taking stay further for guests all around the world. Sonder started a little over four years ago, and now has thousands of spaces in cities across the globe."
Soldo,https://www.crunchbase.com/organization/soldo,"Banking, Financial Services, FinTech, Payments",Soldo is a multi-user expense account helping companies manage their budgets. Test,"Soldo integrates prepaid Mastercard® cards, a web-based administration console and a mobile app into one intuitive future-ready platform. Soldo was founded by a group of tech veterans and payment pioneers who refused to accept the inefficient and fragmented state of business spending in the 21st century. With decades of experience in payment services and transactional system development, the team didn’t just slap a brand on an ‘easy’ solution or quick-fix. Instead, they invested heavily in the creation - from scratch - of a world-class technological, regulatory and operational platform. Soldo’s rock-solid innovation and talented team has attracted in excess of $20 million, in both Seed and Series A funding. Soldo’s Series A round was completed in June 2017 and led by Accel Partners, with participation from Connect Ventures, InReach Ventures, U-Start and R204 Partners. Sonali de Rycker, Partner at Accel, has joined Soldo’s board. "
Sorted Group,https://www.crunchbase.com/organization/mpd-group,"Enterprise Software, Information Technology, Retail, SaaS, Shipping, Warehousing","Sorted Group is a global SaaS company that provides data-driven software for checkouts, warehouses, and shipping.","Sorted Group is a global SaaS company that provides data-driven software for checkouts, warehouses, and shipping. The company aims to provide easier carrier management and delivery tracking experience for its users.  Sorted Group was founded in 2010 and is headquartered in Manchester, England."
SolarEdge,https://www.crunchbase.com/organization/solaredge,"Energy, Renewable Energy, Solar","SolarEdge provides solar power optimization, harvesting and photovoltaic monitoring systems that aim to increase energy output through MPPT.","SolarEdge Technologies, global leader in the DC power optimizer market. provides module-level electronics for solar power harvesting and monitoring systems for residential, commercial and utility-scale solar photovoltaic installers. the SolarEdge portfolio of products includes power optimizers and a web portal for module-level optimization and monitoring as well as PV inverters specialized to work with power optimizers.  SolarEdge envisions that every solar module will be individually managed by DC-DC module-level electronics, accelerating the pace towards grid parity and making clean energy affordable. Founded in 2006, SolarEdge established the DC power optimizer segment and is leading it with over 70% market share. By Q4 2012, SolarEdge has shipped over 1,600,000 power optimizers to more than 40 countries worldwide. With strategic partnerships across the PV value-chain from module manufacturers to integrators, SolarEdge installations can be found in five continents."
Socar,https://www.crunchbase.com/organization/socar,"Car Sharing, Communities, Transportation",Socar is a Korean eco-friendly car sharing community that allows travelers to share cars with others who are traveling the same route.,"Socar is a Korean eco-friendly car sharing community that allows travelers to share cars with others who are traveling the same route. Socar has raised an $18 million round of funding in 2015 which was one of the highest funding deals for a South Korean startup to date. Most notably, it was led by a US investor: Bain Capital, a private investment firm with $80 billion in assets under management. Socar was founded in March 2012, and it has a website and smartphone apps that let users book cars for their own use. Service has over 1,700,000 registered users, 50,000 of whom use the service each month. Around 80,000 transactions per month — that’s more than one car booking each 30 seconds."
Sociolla,https://www.crunchbase.com/organization/sociolla,"Beauty, Cosmetics, E-Commerce, Lifestyle",Sociolla didirikan dengan satu tujuan untuk memberikan suatu kenyamanan kepada wanita di Indonesia untuk berbelanja make up/ kosmetik,"Sociolla didirikan dengan satu tujuan untuk memberikan suatu kenyamanan kepada wanita di Indonesia untuk berbelanja make up/ kosmetik, skin care, hair care, peralatan kecantikan dan parfum. Sociolla hanya bekerja sama dengan authorized distributor dan pemegang merek untuk memastikan keaslian produk. Kami mengerti kualitas menjadi aspek utama; khususnya untuk beauty products yang kita aplikasikan pada kulit."
Sonatype,https://www.crunchbase.com/organization/sonatype,"Enterprise Software, Open Source, Security, Software","Sonatype helps enterprises get precise intelligence about open source components and accelerate software innovation, quality, and security.","Sonatype helps enterprises get precise intelligence about open source components and accelerate software innovation, quality, and security. It has a long history of partnership with the world of open source software development. From being a core contributor to Apache Maven, to supporting the world’s largest repository of open source components (Central), to distributing the world's most popular repository manager (Nexus), Sonatype exists for one simple reason; to help accelerate software innovation. Sonatype  was established in 2008 and is based in Fulton, Maryland with offices in McLean, London, and Sydney."
Solana,https://www.crunchbase.com/organization/solana-io,"Blockchain, Internet, Virtual Currency",Solana specializes in blockchain and serves as an enterprise-grade computing platform.,"Solana is a high-performance blockchain that can scale over 700k transactions per second on stock hardware to deliver on the promise of blockchain. Solana was founded in 2017 and is based in San Francisco, California."
Soylent,https://www.crunchbase.com/organization/soylent-corporation,"Food Processing, Health Care, Nutrition",Soylent is a food supplement that can be personalized for different body types and customized based on the individual's taste.,"Soylent™ was developed from a need for a simpler food source. Creator Robert Rhinehart and team developed Soylent after recognizing the disproportionate amount of time and money they spent creating nutritionally complete meals. Soylent is a food product (classified as a food, not a supplement, by the FDA) designed for use as a staple meal by all adults. Each serving of Soylent provides maximum nutrition with minimum effort."
Socio,https://www.crunchbase.com/organization/socio-labs-ltd,"Events, SaaS","Socio lets event organizers build event apps that optimize event experience and boost ROI for attendees, exhibitors, and sponsors.",Socio provides an event app that surrounds your live events. Create your app in minutes and let your attendees enjoy an unforgettable experience!
Socratic,https://www.crunchbase.com/organization/socratic,"E-Learning, Education, Q&A",Socratic is a Q&A site for academic subjects.,"Socratic is an app for taking photos of your homework questions and it helps with more than just math. It also supports science, history, English and economics. The app says it uses artificial intelligence to help you find answers and detailed explanations. With a focus on high school curriculum, Socratic is equipped with graphs and explainers. It also curates web video from Khan Academy and other educational platforms. It’s free and available for both iPhone and Android."
SOCASH,https://www.crunchbase.com/organization/socash,"Apps, Software","soCash is the digital cash circulation platform connecting  banks , retailers and individuals for cash  & other banking services","SoCash is a digital platform that sits at the intersection of cash and digital payments. Its platform enables cash circulation without the need for ATMs, Cash logistics and branches. SoCash product roadmap covers the spectrum of cash - Withdrawal, Deposits, and conversion.  The company was founded in 2016 and is operational in Singapore, Indonesia and Malaysia."
SomaDetect,https://www.crunchbase.com/organization/somadetect,"AgTech, Analytics, Artificial Intelligence, Internet of Things, Machine Learning",SomaDetect provides dairy farmers with the information they need to produce the best possible milk.,"SomaDetect is the world’s premier machine learning and artificial intelligence company in dairy. SomaDetect provides real-time, automated analysis of milk quality without any addition of chemicals or consumables. The company measures every compound of interest in raw milk, enabling farmers to identify issues early, manage reproduction, reduce unnecessary antibiotic usage, and ensure that only the highest-quality milk makes it into bulk milk supplies. Founded in 2016, SomaDetect provides dairy farmers with information about herd health and milk quality, where and when they need it most."
Sofar Sounds,https://www.crunchbase.com/organization/sofar-sounds,"Communities, Events, Hospitality, Music, Social Media","Sofar Sounds is a global community hosting curated, secret performances in more than 400 cities around the world.","Sofar Sounds is a global community creating space where music matters. Founded in London in 2009, Sofar brings guests and artists together in unique locations, without the distractions that plague other live events. Sofar shows begin as a secret: guests sign on for three unnamed performances at undisclosed locations, hosted by community members in everyday spaces — from living rooms and rooftops, to retail stores. Through the transformation of these spaces into captivating venues, Sofar serves as a platform for artists to connect with engaged audiences in cities around the world. Sofar invites guests to discover new artists, spaces, people, neighborhoods and cities, whether at home or abroad, creating an inclusive and accessible global community where people make genuine connections. To learn more about Sofar Sounds, check us out at www.sofarsounds.com or follow the conversation on social media at @sofarsounds or using #sofarsounds."
Softomotive,https://www.crunchbase.com/organization/softomotive,"Business Information Systems, Industrial Automation, Office Administration, Robotics, Software",Softomotive is a software company that provides Robotic Process Automation technology for organizations's digital workforce development.,"Softomotive is one of the leading worldwide providers of Robotic Process Automation solutions, trusted by more than 7,000 companies worldwide. Both attended and unattended RPA are delivered through powerful, robust RPA technology from desktop installation to server based software which is quick to deploy, easy to use and provides best value for money. ·       WinAutomation is the world’s best Robotic desktop automation (RDA) tool and provides a powerful, robust and easy to use Windows based platform for building software robots. ·       ProcessRobot is a leading enterprise RPA platform, including enterprise grade security and controls, with links to best-of-breed AI technologies. The company offers the most reliable and scalable automation solutions, bridging the gap between best-of-breed technology and continuous innovation to deliver true business transformation. It provides a powerful automation platform that enables organizations to develop, manage and track their own digital workforce"
Solera Health,https://www.crunchbase.com/organization/solera-health-inc,"Health Care, Information Technology, mHealth",Solera allows health plans and employers to securely and efficiently leverage a network of community and digital health solutions.,"Solera is a preventive care benefits manager that connects patients, payers, and physicians with a new class of non-clinical healthcare providers, simply and securely. Our technology integrates a diverse ecosystem of community organizations and digital providers to manage patient identification and referrals, reimbursement and payment, while supporting increased consumer engagement. Solera helps consolidate highly fragmented programs and services into one integrated network allowing health plans and medical providers to increase consumer participation while lowering associated costs. In our role we proactively identify the “best fit” chronic disease prevention program provider based on each individual’s unique needs and preferences which has proven to have a significant impact on improved patient outcomes at a fraction of the cost of traditional medical care. Every individual deserves an opportunity to achieve their full health potential. At Solera, we strive to make that goal a reality."
Socure,https://www.crunchbase.com/organization/socure,"FinTech, Identity Management, Machine Learning, Security",Socure is a predictive analytics platform for digital identity verification of consumers and businesses.,"Socure is a New York-based software company that provides consumers and businesses with a next-generation security SaaS solution to fight against the risk of identity theft and related fraudulent activities. It enables the next-generation of multi-factor authentication by applying machine learning techniques with biometrics and data intelligence from email, phone, IP, social media, and the broader internet. The company capitalizes on alternative data that has proven to provide better fraud prediction capability. Founded in 2012, Socure is recommended for enterprises and financial institutions."
SoundHound Inc.,https://www.crunchbase.com/organization/soundhound,"Artificial Intelligence, Audio, Mobile, Natural Language Processing, Speech Recognition",SoundHound Inc. is the innovator in voice-enabled AI and conversational intelligence technologies.,"SoundHound Inc. is the innovator in voice-enabled AI and conversational intelligence technologies. SoundHound Inc.’s Houndify is the first independent AI platform that enables developers and business owners to deploy it anywhere and retain control of their brand and users while differentiating and innovating. Houndify provides all the technology ingredients necessary for voice and AI integration, including the world’s fastest speech recognition, the most sophisticated natural language understanding, easy to use developer tools, knowledge graphs, and a large and rapidly growing number of domains. Houndify technologies represent 10 years of R&D.  SoundHound's voice search & assistant app, Hound, leverages their Speech-to-Meaning™ and Deep Meaning Understanding™ technologies on a consumer app experience. Their SoundHound music recognition app applies the technology to the listening experience, enabling people to discover, explore, and share the music around them."
Sogou,https://www.crunchbase.com/organization/sogou,"Information Services, Internet, Search Engine","Sogou.com is a Chinese search engine that enables users to search text, images, music, and maps.","Sogou.com is a Chinese search engine that enables users to search text, images, music, and maps.  Sogou's product line is divided into two major domains: web and desktop applications. Web application products are designed to classify online information such as music, pictures, video clips, news, maps, and vertical information. Desktop applications aim to improve the user experience.  Sogou Chinese Input is input software in China that helps users increase their typing speed. Sogou Browser adopts real dual-core techniques to accelerate online surfing speed for internet users and connects them with the cloud to recognize malicious websites and software.  Sogou.com was launched on the 3rd of August in 2004."
Socialbakers,https://www.crunchbase.com/organization/socialbakers,"Analytics, Digital Marketing, Marketing Automation, Social Media, Social Media Management, Social Media Marketing",Socialbakers is the leading AI-powered social media marketing platform.,"Socialbakers is the trusted social media management partner to thousands of enterprise brands and SMBs. Leveraging the largest social media data-set in the industry, Socialbakers’ social media marketing platform helps brands large and small ensure their investment in social media is delivering measurable business outcomes. With over 2,500 clients across 100 countries, Socialbakers is the leading social media management platform, tracking 10 million social profiles across all major social platforms including Facebook, Instagram, Twitter, YouTube, LinkedIn, Pinterest, Google+, and VK.com. Socialbakers has been a Facebook Marketing Partner since 2011, a Pinterest Marketing Partner since 2017 and a LinkedIn Marketing Partner since 2017. For more information, visit www.socialbakers.com."
SOPHiA GENETICS,https://www.crunchbase.com/organization/sophia-genetics,"Artificial Intelligence, Biotechnology, Health Care, Medical",SOPHiA GENETICS combines deep expertise in life sciences and medical disciplines with mathematical capabilities in data computing.,"SOPHiA GENETICS combines deep expertise in life sciences and medical disciplines with mathematical capabilities in data computing. Our mission is to bring data analytics solutions to market, to support healthcare professionals by maximizing the power of Data-Driven Medicine. We achieve this mission through the global adoption of SOPHiA AI, which is built using techniques such as statistical inference, pattern recognition and machine learning. This enables SOPHiA to provide equal benefits to all users, unite experts in a gold standard health tech platform, and motivate expert knowledge sharing for a sustainable impact on future patients. We want to contribute to make the global healthcare system more sustainable. It is our strong belief that digital technologies are the key to unlocking the era of Data-Driven Medicine, where secure data pooling and knowledge sharing will be extremely valuable for patients. By helping healthcare professionals leverage their expertise and work together as a community, patients all over the world can receive equal access to better diagnoses and treatments. Combining the first two pillars of Data-Driven Medicine, Genomics and Radiomics, we can ensure that the data used to help patients today will also benefit the patients of tomorrow."
SodaStream,https://www.crunchbase.com/organization/sodastream,"Consumer Electronics, Hardware, Health Care, Software",SodaStream manufactures home beverage carbonation systems that enable consumers to transform tap water into carbonated soft drinks and more.,"SodaStream manufactures home beverage carbonation systems that enable consumers to transform tap water into carbonated soft drinks and sparkling water. In addition, their products offer convenience by eliminating the need to carry bottles home from the supermarket, to store bottles at home or to regularly dispose of empty bottles. SodaStream’s products are available at more than 40,000 retail stores in 41 countries around the world. SodaStream was founded in 1903 and is based in Lod, Israel."
Sojern,https://www.crunchbase.com/organization/sojern,"Advertising Platforms, Digital Marketing, Marketing, Travel",Sojern is a data-driven performance marketing engine that serves thousands of travel brands.,"Sojern is travel’s marketing demand engine for thousands of brands in the hotel, air, cruise, transportation, and tourism industries.  Specializing in traveler path-to-purchase data for more than a decade, Sojern delivers branding and performance solutions by combining search and booking intent signals with proprietary data science methods to analyze and activate the world’s travelers in real-time.  Recognized as a Deloitte Technology Top 500 Fastest Growing Company for 5 years in a row, Sojern is headquartered in San Francisco and has teams based in Berlin, Dubai, Dublin, Hong Kong, Istanbul, London, Mexico City, New York, Omaha, Paris, Singapore and Sydney."
Soothe,https://www.crunchbase.com/organization/soothe,"Health Care, Personal Health, Wellness",Soothe is a massage-on-demand company.,Soothe is a massage-on-demand company. The company delivers massages to your doorstep in as little as an hour. Booking is easy with their web and mobile app. Soothe allows you to book a variety of massage types in a variety of configurations straight to your home starting at $99.
