Organization Name,Organization Name URL,Categories,Description,Full Description
Apkudo,https://www.crunchbase.com/organization/apkudo,"Android, Mobile, Mobile Devices, Wireless",Apkudo is a smart device test company that helps the world make sense of the billions of experiences smart devices enable.,"Apkudo’s mission is to help the Android ecosystem overcome the major challenge inherent in the open nature of the Android platform: fragmentation.  An Android user experience innovation company, Apkudo is pioneering analysis technologies that deeply and holistically test pre-release Android devices against millions of different possible use-cases and activities to discover bugs and refine the user interface and experience, taking devices from bad to good, and good to great. Apkudo works with many of the world’s largest device manufacturers, including Samsung, Sony, HTC, and LG, and carriers such as MetroPCS, Cricket and Cincinnati Bell. Apkudo is headquartered in Baltimore, MD. The Apkudo team includes deep research expertise with the Android operating system including optimization, usability and performance testing, and is focused on helping the ecosystem deliver the best possible user experience to Android device owners. Learn more at http://www.apkudo.com and email hello@apkudo.com for additional information."
AppBrick,https://www.crunchbase.com/organization/listenvoice,"EdTech, Education, Logistics, Mobile, Publishing",AppBrick offers a platform that enables individuals and organizations to launch any form of content using mobile and web applications.,"AppBrick is a Boston based mobile solutions company. Our mission is to build an easy to use and non-programming, application development platform for organizations to create market ready, feature rich applications. We address head-on issues that the organizations face today while creating applications: High cost, increasing development time and lack of technology capabilities."
Apeiron Data Systems,https://www.crunchbase.com/organization/apeiron-data-systems,Flash Storage,Committed to be the leader in the exponential growth of scale-out storage.,"Industry’s highest performance scale-out NVMe™ platform capable of networking to 1,000's of standard NVMe SSDs and 100's of millions of IOPS"
"Apps that Pay, LLC",https://www.crunchbase.com/organization/apps-that-pay-llc,"Apps, Mobile","Apps that Pay, LLC specializes in developing reward platforms that provide users real money and gift cards.",
AptAmigo,https://www.crunchbase.com/organization/aptamigo,Real Estate,AptAmigo is your resource for the most trustworthy apartment reviews in Chicago,"We go direct to the individual landlords and buildings to get the most accurate listings, we marry that with 4,500+ detailed reviews of our own that include details like WiFi, shower pressure, management responsiveness, etc, and powerful search tools that we have built from scratch. We deliver qualified intent in the form of leases to buildings, and add value to both renters and buildings alike. "
Apptad Inc,https://www.crunchbase.com/organization/apptad-inc,"Consulting, Information Technology, Software","Specialized in providing your organization with Operational system, DW - BI, MDM, Cloud Computing","AppTad is building brand as true leader in Technology and Management Consulting. Our highly experienced principals with prospective industry experience help our global client achieve their business goal. We help our client do their business comparatively better than their competitors. Our team are specialized in small to large enterprise in setting up their new IT infrastructure and utilize their existing data to revel facts around their business model. It could be operational system to data analytics AppTad is one point solution for our clients. We are partnered with leading technology companies and our principals and consultants are up to date with technological change and industry atmosphere which helps our client to keep them ahead of their competitors. We are specialized and experience in providing your organization with Operational system, Data warehouse - Business Intelligence, Master Data Management, Industry trend – Cloud computing, Big data infrastructure setup to Big Data Analytics. We invest in AppTad research team who are working round the clock to understand industry trend, new Challenges and preparing solution with high end technology and innovative approach to data analytics. AppTad has a separate focused group for Big Data and Analytics, our focused group is working on variety of Big Data products from Hortonworks, Cloudera, MapR, Teradata Aster. We help our client with small IT budget to set up their IT infrastructure with cost effective solution. Our highly specialized and experienced resource are equipped with rapid solution model created by AppTad technology research team. Read more about our RapidSolution for small organizations. AppTad work force are built with freshers for their innovative and creative ideas, experienced with business and technology expertise, business management consultants with industry knowledge and impactful relationship with stakeholders"
ApnaPaisa,https://www.crunchbase.com/organization/apnaloan,"Credit, Finance, Internet, Marketplace","ApnaLoan is an online marketplace providing home loans, personal loans and credit cards for customers in India.","ApnaLoan is an online marketplace for home loans, personal loans and credit cards in India.  The idea is that on ApnaLoan, banks compete for your loan, which in turn means you get a better rate.  The company says ApnaLoan is the ""largest online marketplace for loans and credit cards."" http://www.dialabank.com/emi-calculator.cfm"
Appfluence,https://www.crunchbase.com/organization/appfluence,"Apps, iOS, Software, Task Management",Appfluence is a productivity software company providing apps that allow users to prioritize and track their plans and activities.,"Appfluence is a productivity software company based in Palo Alto, CA. Appfluence was founded in 2010 by technology experts with extensive experience and interest in making a frictionless workplace.  They have showcased their flagship product, Priority Matrix, during multiple events at Stanford University, including the Stanford Product Showcase and the BASES product development accelerator Forge. Appfluence is a Stanford StartX incubator company, and has been repeatedly selected among the top companies coming out of Stanford. Across the various platforms, Priority Matrix has over 90,000 paid customers, and has ranked among the 5 highest downloaded productivity apps in the Apple App Store and has hit number one in several international markets. PC Magazine has ranked the iPad version of Priority Matrix among its 100 Best iPad Apps. In addition, the product has garnered a 4 out of 5-star rating or better on the Apple App Store on both the iPhone and iPad platforms, with over 1,300 reviews."
APM Holdings,https://www.crunchbase.com/organization/apm-holdings,Health Care,Operates in the healthcare industry. ,
ApexSQL,https://www.crunchbase.com/organization/apexsql,"Cyber Security, Data Visualization, Enterprise Software, Software",Tools for SQL Server DBAs and Developers,"SQL Server tools for auditing, database data recovery, change management and more"
Aptilo Networks,https://www.crunchbase.com/organization/aptilo-networks,"Internet, Mobile, SaaS, Wireless",Aptilo Networks is a provider of systems to manage mobile data services.,"Aptilo Networks is a leading provider of systems to manage mobile data services for Wi-Fi, WiMAX and 3G/LTE networks, including mobile data offloading. Aptilo’s carrier-class solutions boast pre-integrated authentication, policy control and charging functions to maximize the capabilities of the wireless network and fast-track deployments while minimizing impact on existing systems. They feature a multitude of interfaces and APIs for seamless integration to external systems of choice.  Aptilo’s solutions are delivered as software licenses, or as a hosted, cloud-based service using the Aptilo Managed Service™ from one of our many regional data centers located worldwide, or handled remotely by Aptilo’s experts from servers at the customer premises. With proven interoperability with all leading vendors in the wireless ecosystem, Aptilo’s solutions are currently in operation in more than 60 countries."
Appfolio,https://www.crunchbase.com/organization/appfolio,"Property Management, SaaS, Software, Web Hosting","AppFolio provides web-based property management software for residential property managers to market, manage and grow their businesses.","AppFolio Property Manager is a web-based property management software solution designed to help professional residential property managers focus on growing their business, not managing their software."
"Applaud Medical, Inc.",https://www.crunchbase.com/organization/applaud-medical-inc,"Health Care, Health Diagnostics, Medical, Medical Device",Developed an innovative new treatment for kidney stones.,"Applaud Medical, Inc. was established to develop and commercialize an innovative new treatment for kidney stones, a condition diagnosed in more than 2 million individuals every year in the U.S. alone. Treating large stones currently requires anesthesia in an operating room . The current least invasive surgical intervention only renders 50% of patients stone-free. Applaud’s innovative kidney stone treatment will - for the first time - allow urologists to effectively treat 5-15 millimeter stones with a simple outpatient procedure."
AppsJhola,https://www.crunchbase.com/organization/appsjhola,"Android, E-Commerce, Mobile",First and Only Apps Marketplace in Nepal,"It's been half a decade now since the Android users and developers ecosystem in Nepal has seen rapid growth. Official stats says 95% of the country's internet users are connected via mobile. Regular national news about Android apps speaks it well. Everywhere from local meetups to regular community workshops on Android the common discussion topic among participants is how to publish apps to Google Play Store. Being developers ourselves, they aren't happy to conclude that there's no easy way they can publish apps to global marketplaces because of absence of international payment gateways. In such, they'd rather utilize their existing in house payment gateways and build local apps marketplace where developers can publish, buy and sell apps with ease. Hence they're proud to present AppsJhola. The apps marketplace that aims to grow into a marketplace for digital contents originating in Nepal."
appEatIT,https://www.crunchbase.com/organization/appeatit,"Hospitality, Local, Restaurants, Search Engine","appEatIT, an online service, allows busy people to take a healthy lunch break in restaurants without wasting time for waiting and paying.","appEatIT is a service with which employees can discover the pleasure to find their lunch ready on the restaurant table and enjoy their lunchbreak as a moment of relax. We have spoken with employees and we have discovered that they would like to have lunch in the restaurant but this is often impossible because their daily routine. Because of this employees often choose fast, junk food solutions for their lunchbreak. Our market market is the lunchbreak; it is worth 12 billion euros in Italy. The service is free for customers but we will gain money from restaurateurs, who will pay a fixed fee for each person. We have been active  in Rome and we have served over 500 lunches."
Appscotch,https://www.crunchbase.com/organization/appscotch,"Advertising, Mobile, Mobile Advertising",AppScotch is a product suite that brings transparency to mobile paid advertising. It is designed for mobile in-app environment.,"AppScotch is a Competitive Analysis and Market Intelligence product suite that brings transparency to mobile paid advertising. It is designed for mobile in-app environment, so you can discover, analyze and measure pretty much everything."
Apparel Group International,https://www.crunchbase.com/organization/apparel-group-international,"Fashion, Lifestyle, Retail",Apparel Group is a fashion and lifestyle retail conglomerate.,
ApplicantPro,https://www.crunchbase.com/organization/applicantpro,Human Resources,ApplicantPro helps you create and manage a custom careers website to manage your business’s unique process.,"ApplicantPro began as an idea in 2007 and was driven by users that thought there has to be a better way to hire. With their continual feedback and loyalty they have become a leading provider of hiring software for nearly 4,000 organizations including small businesses on up to enterprise sized organizations. Their offering has grown to include an integrated applicant tracking system, background checks, pre-employment assessment testing, paperless onboarding, tax credits, skills testing, and video interviewing. Their focus is on providing easy-to-use solutions that inspire efficiency and optimized hiring practices. Most of their customers pay around $200 per month for their services with no upfront fees and are never bound by a contract."
Approva,https://www.crunchbase.com/organization/approva,"Compliance, Enterprise Software, Risk Management","Approva provides continuous monitoring software that enables companies to meet their governance, risk and compliance requirements.","Approva is the leading provider of continuous controls monitoring software and is the industry standard for three of the five largest audit and advisory firms. They automate both IT and financial controls for all of the major applications companies rely on to run their business, including Oracle, PeopleSoft and SAP. By using their software companies can reduce risk, prevent fraud, lower their compliance costs and identify areas of operational improvement."
API Talent,https://www.crunchbase.com/organization/api-talent,"Cloud Computing, Consulting, Information Technology, Web Browsers",Helping customers thrive and succeed by removing complexity and cost from systems.,API Talent is an Amazon Web Services Consulting partner lead by two experienced IT professionals. - Wyn Ackroyd - Chief Executive - Sebastian Krueger - Director of Cloud Engineering They are confident they can deliver what your business needs.
Apliant,https://www.crunchbase.com/organization/apliant,"Information Technology, Insurance, InsurTech, Shopping",Apliant improves the way insurance works with a core focus on building smarter technology to empower the traditional insurance agent.,"Apliant was founded by insurance, technology, and marketing professionals to improve local insurance agency distribution. We work to build smarter technology that empowers the traditional insurance agent, helping them find and retain more clients through a simplified workflow. Designed for the sales-driven insurance agent, Apliant is a user-friendly, on-demand platform that serves as every insurance agent's dream toolkit including everything they need to easily and quickly connect with insurance-shopping customers in their existing market and beyond."
Apple Pay,https://www.crunchbase.com/organization/apple-pay,"Apps, Payments",Apple Pay is a mobile payment and digital wallet service by Apple Inc.,"Apple Pay is a mobile payment and digital wallet service by Apple Inc. that allows users to make payments in person, in iOS apps, and on the web. It is supported on the iPhone, Apple Watch, iPad and Mac.Apple Pay is easy and works with the Apple devices you use every day. You can make secure purchases in stores, in apps, and on the web. And you can send and receive money from friends and family right in Messages. Apple Pay is even simpler than using your physical card, and safer too."
Apogee Corp,https://www.crunchbase.com/organization/apogee-corp,"Information Services, Information Technology, Manufacturing","Apogee Corp is supplier of digital document solutions, independent managed print services and cutting edge digital equipment.","Apogee is a market-leading independent Managed Services provider of print, document and process technology across the UK and Europe.  Our reputation as the first choice provider for multi-vendor print technology and service is built on the unique approach we have taken to Managed Services, pro-actively monitoring our clients to maximise their uptime, and the innovation we employ to maintain a portfolio of services which differentiate us. The fastest growing solution provider in the industry, Apogee provides tailored office and production print systems which combine the best hardware and software technology from market-leading manufacturers with our uniquely pro-active Managed Services. We supply, copy, print, fax and scan systems including multifunctional devices and printers; digital production systems and mail and print room management; voice, data and cloud systems; and document management and workflow software solutions for office and production environments.  Being independent means we can provide fully customised, scalable solutions by combining best-of-breed hardware and software from market-leading manufacturers. We optimise your performance through our unique Managed Service solution.  We monitor your devices on a real-time basis, resolving potential faults before they occur, and dispatching engineers before you call to request one. Apogee is certified to the ISO 9001:2008 and ISO 14001:2004 standards for our quality management and environmental management systems.  These awards recognise that our management systems and the processes through which we care for our clients are to the very highest international standards."
Applied MicroStructures,https://www.crunchbase.com/organization/applied-microstructures,"Electronics, Manufacturing, Nanotechnology",Applied MicroStructures designs and manufactures molecular vapor deposition tools.,Applied MicroStructures Inc. (AMST) designs and manufactures Molecular Vapor Deposition (MVDÂ) tools: a breakthrough proprietary nanotechnology that enables the growth of ultra-thin films with a wide range of functionalities. These films are deposited in a vacuum chamber at low temperatures on a broad spectrum of substrates.
ApartmentSmart.com,https://www.crunchbase.com/organization/apartmentsmart-com,"Property Management, Search Engine",ApartmentSmart.com helps low income renters to find affordable housing.,ApartmentSmart.com is an Internet Listing Service (ILS) for affordable apartment communities advertising their properties for rent to lower income renters.  It has positioned itself as the primary provider of online marketing services for the affordable rental housing community since 2001.
apiOmat,https://www.crunchbase.com/organization/apiomat,"Android, Apps, Cloud Computing, Enterprise Software, iOS, Web Hosting",ApiOmat is a software platform that enables organizations to implement digital business processes faster.,"apiOmat offers an enterprise solution for connecting mobile business processes with IT. The combination of API-Gateway, mobile middleware, and mobile app platform enables companies to implement mobile enterprise strategies efficiently."
Apical,https://www.crunchbase.com/organization/apical,"E-Commerce Platforms, Social Impact, Travel",Self-service booking platform for experience creators,"Apical is the digital platform enabling travel companies, brands and individuals to easily create, manage and sell Experiences online + to engage their crowd into responsible actions while traveling"
Aparna Group,https://www.crunchbase.com/organization/aparna-group,"Commercial Real Estate, Real Estate, Residential",We can be the company that builds houses,"We show our commitment to be first in the market to bring innovative product offerings and have established our leadership in providing the best of gated communities and are geared to lead the market with many more path breaking and innovative moves. Aparna Constructions and Estates Pvt Ltd is among the leading construction companies in Hyderabad. It was founded in 1996 and undertakes the Development of Residential Gated Communities (Premium Villas and Apartments) and Commercial Projects.  The company has so far completed and handed over 22 large projects. We have built over 7 Million Sft Area and over 7.5 Million Sft is under construction! These Developments cover an area of over 7-Million Sft comprising of Gated Community Villas, Premium Apartments and Commercial Buildings. 'Aparna' has set high standards in the area of Customer Care and acts with Honesty, Integrity and Transparency in everything it does."
Applus,https://www.crunchbase.com/organization/applus,"Software, Test and Measurement","Applus Services is a leading global certification company specializing in testing, inspection, certification and technological services. ","Applus+ is one of the world's leading testing, inspection and certification companies. They are recognized as a global reference for quality and integrity. With 18,000 employees, they operate a network of more than 350 offices and laboratories in more than 60 countries across all continents. They provide solutions for clients in all types of sectors, to ensure that their assets and products comply with environmental, quality, health and safety standards and regulations."
APrivacy,https://www.crunchbase.com/organization/i-think-security,"Cloud Computing, Cloud Security, Cyber Security, FinTech, Security",APrivacy is a FinTech company that provides the banking industry with information security and tracking services.,"APrivacy provides the banking and finance industry with an information security and tracking service anywhere, any time and on any device. APrivacy’s enabling technology allows banks to drive new revenues, reduce risk and support compliance efforts.  APrivacy’s patented solution empowers bankers to communicate and share information with their clients using the devices they prefer (iPhone, Android, etc.) via the channels they prefer (Gmail, Outlook, Dropbox, etc. ) and the medium they prefer (Email, PDF, PPT, Word, Excel, etc. ).  With APrivacy financial institutions achieve a level of control on their information they previously did not have, such as retrieving emails or documents even after they have been sent and/or downloaded onto a client’s device.  Additional controls include blocking a recipient from forwarding, printing, saving information and geo-fencing protection . Everything is supported by strong data analytics and audit trails.  APrivacy’s patented solution satisfies the banking industry’s most strict security and compliance requirements whilst enabling seamless and enjoyable client communications."
Apideck,https://www.crunchbase.com/organization/apideck,"Information Technology, Internet, SaaS",Helping SaaS companies build better platforms,
Apokalyyis,https://www.crunchbase.com/organization/apokalyyis,"Health Care, Information Technology",Apokalyyis is a science and technology company developing technologies that offer efficient data analysis solutions.,"Apokalyyis, Inc. operates as a science and technology company which develops and consults on innovative, disruptive, and leading edge technologies that offer fast and efficient data analysis solutions. The company was incorporated in 2009 and is based in Denver, Colorado."
Apptuse,https://www.crunchbase.com/organization/apptuse,"Advertising, E-Commerce, E-Commerce Platforms, Internet, Mobile, Mobile Apps, SaaS, Software",OmniChannel commerce solution,"Apptuse.com is an omnichannel commerce platform which enables 14000+ businesses to sell their products across multiple channels from a single platform. As brands look to mobile for new ways to connect with their customers, Apptuse helps these brands increase their engagement, conversions, and sales across multiple sales channels. With clients in over 35 countries, Apptuse enables merchants to set up, manage and grow their business online, on mobile and in retail, all from a single app on their phone."
appfire,https://www.crunchbase.com/organization/appfire,Information Technology,The world's largest ensemble of Atlassian Add-ons and Services.,
AppYourself,https://www.crunchbase.com/organization/appyourself,"Apps, E-Commerce, Mobile, Small and Medium Businesses",AppYourself is a flexible app platform for the smart development of custom mobile apps,"AppYourself offers small and medium-sized businesses a simple and inexpensive entry into ""mobile marketing"". With a modular App-Kit system, AppYourself enables you to create an app independently, support its marketing, and evaluate and optimize its use. This makes AppYourself the platform for mobile marketing."
Apogee Surgery Center,https://www.crunchbase.com/organization/apogee-surgery-center,"Cosmetic Surgery, Education, Health Care, Medical","Apogee Surgery Center, operates a surgical center that specializes in providing outpatient surgical procedures.","Apogee Surgery Center management team is focused on providing the highest level of care and communication to their patient, physician specialists and their staff. They greatly value our patients and their families’ confidence in entrusting us with their safety, comfort, and convenience while they provide optimal clinical care. Their physicians enjoy a partnership that provides an efficient extension to their offices for cost effective alternatives, and time saving features to augment today’s medical practice. A foundation for our team – they respectfully pledge our commitment to provide training, education and the advancement of the work environment though dedicated corporate support.  "
