Organization Name,Organization Name URL,Categories,Description,Full Description
Wipro Technologies,https://www.crunchbase.com/organization/wipro,"Cloud Data Services, Consulting, Enterprise Software, Health Care, Information Services, Information Technology, Mobile, Outsourcing, Software","Wipro Limited is a leading global information technology, consulting and business process services company.","Wipro Ltd. (NYSE:WIT) is a global information technology, consulting and outsourcing company with 160,000+ workforce serving clients in 175+ cities across 6 continents. The company posted revenues of $7.6 billion for the financial year ended Mar 31, 2015.  Wipro helps customers do business better by leveraging Wipro industry-wide experience, deep technology expertise, comprehensive portfolio of services and vertically aligned business model. Wipro's 55+ dedicated emerging technologies ‘Centers of Excellence’ enable them to harness the latest technology for delivering business capability to our clients.  Wipro is globally recognized for its innovative approach towards delivering business value and its commitment to sustainability. Wipro champions optimized utilization of natural resources, capital and talent. Today Wipro is a trusted partner of choice for global businesses looking to ‘differentiate at the front’ and ‘standardize at the core’ through technology interventions. In today’s world, organizations will have to rapidly reengineer themselves and be more responsive to changing customer needs. Wipro is well positioned to be a partner and co-innovator to businesses in their transformation journey, identify new growth opportunities and facilitate their foray into new sectors and markets.  Wipro Technologies, a division of Wipro Limited (NYSE:WIT) is is an Indian multinational provider of Information Technology services, Consulting and Business Process Outsourcing. It is the first PCMM Level 5 and SEI CMM Level 5 certified global IT services organization and has a worldwide presence with global centers across 54 countries. Wipro Technologies was recently assessed at Level 5 for CMMI V 1.2 across offshore and onsite development centers."
Wirecard,https://www.crunchbase.com/organization/wirecard,"Outsourcing, Payments, Software",Wirecard is fastest-growing digital platforms in the area of financial commerce.,Wirecard is a software and IT specialist for outsourcing and white label solutions for payment processing and issuing products. Since its foundation Wirecard has proved to be one of the leading international providers of outsourcing and white label solutions for electronic payment transactions.
Winc,https://www.crunchbase.com/organization/clubw-com,"E-Commerce, Hospitality, Wine And Spirits","Winc is a modern winery with a direct connection to the consumer, building a portfolio of brands for the next generation of wine drinkers.","After launching in 2011 with the goal of making discovering great wine easy, Winc continues to disrupt the $220BN wine industry. Driven by the vision of a great bottle on every table and a great story in every bottle, Winc seeks to create more custom experiences for its members and bring ease and exploration to the process of buying and enjoying wine. The company's unrivaled access to consumer insights has helped shape the development of iconic brands like Summer Water, the viral hit embodying the rosé state of mind, and Folly of the Beast, the supremely accessible Pinot Noir of uncompromising quality. In addition to its online subscription service, Winc’s sought-after brands are available in progressive restaurants and premium retailers nationwide. Winc recently announced its first public investment opportunity, Winc Shares, a Regulation A+ campaign on the SeedInvest platform. In its mission to further democratize the wine category, the licensed winery will be raising money through Reg A+ financing, a section under the JOBS Act voted in by the SEC that allows anyone to invest in a private company, not just the wealthiest 2%. Tapping into the company's robust community of members and brand advocates, this campaign will enable Winc’s supporters to invest alongside prominent players like Bessemer Venture Partners, CrossCut Ventures and Shining Capital The best bottles of wine are shared. Now the best wineries can be, too. Learn more at seedinvest.com/winc."
WinZO,https://www.crunchbase.com/organization/winzo-games,"Digital Entertainment, Gaming, Internet, Mobile, Video Games",WinZO is India's First & Largest Vernacular Real Money E-Sports Platform!,
Wix,https://www.crunchbase.com/organization/wix,"B2B, Developer Tools, E-Commerce, Enterprise Software, Information Technology, Internet, Small and Medium Businesses, Web Design","Wix empowers businesses, organizations, professionals, and individuals to take their businesses, brands, and workflow online.","Wix is a software platform for small businesses to operate online with millions of registered users in 190 countries. Wix was founded on the belief that the Internet should be accessible to everyone to develop, create and contribute. Through free and premium subscriptions, Wix's powerful technology empowers millions of businesses, organizations, professionals and individuals to take their businesses, brands and workflow online. Wix ADI, the Wix Editor and a highly curated App Market enable users to build and manage a fully integrated and dynamic digital presence."
Windfall Data,https://www.crunchbase.com/organization/windfall-data,"Analytics, Computer, Financial Services, Software",Windfall Data is on a mission to help organizations make better informed data-driven decisions.,"Founded in 2016, Windfall Data is on a mission to determine the net worth of everyone on the planet. The company serves nonprofit and for-profit organizations by providing actionable consumer financial data that is refreshed on a weekly basis. More than 400 organizations use Windfall Data to identify and engage their most promising constituents. Windfall Data is based in San Francisco and backed by Bullpen Capital, Bonfire Ventures, Industry Ventures, TenOneTen Ventures, ValueStream Ventures, and Auren Hoffman."
Wild Earth,https://www.crunchbase.com/organization/wild-earth-104d,"Biotechnology, Consumer, Consumer Goods, Pet, Professional Services",Wild Earth produces pet food.,"Wild Earth produces pet food. It offers food for dogs and cats of various age groups.  Abril Estrada, Kristin Wuhrman, Ron Shigeta, and Ryan Bethencourt founded Wild Earth in 2017. It has its headquarters in Berkeley in California."
Withings,https://www.crunchbase.com/organization/withings,"Artificial Intelligence, Consumer Electronics, Hardware, Health Care, Software",Withings creates smart products and apps to take care of yourself and your loved ones in a new and easy way.,"Withings is a Paris-based company that specializes in the development of connected objects. The company's first product was the connected body scale, which officially launched in June 2009. Withings was acquired by Nokia in 2016 before being bought back by its founder, Eric Carreel, in 2018."
Wind Mobility,https://www.crunchbase.com/organization/wind-mobility,"Automotive, Last Mile Transportation, Mobile Apps, Transportation",Wind Mobility is a micro-mobility company that offers convenient last mile transportation services.,"Wind Mobility is a micro-mobility company that offers convenient, safe, and fun last mile transportation services. The company attaches great importance to the availability, quality, and safety of bikes and scooters and the usability of its app. With its eco-friendly and healthy product, it aims to make cities a better place, by reducing traffic, carbon dioxide emission, and noise. Wind Mobility was founded in 2017 with locations in Berlin and Barcelona."
Wirex,https://www.crunchbase.com/organization/wirex-limited,"Bitcoin, Blockchain, Financial Services, FinTech, Personal Finance","Wirex is an FCA Licenced, global leader in digital money solutions for both personal and commercial use.","Wirex is an FCA Licenced, global leader in digital money solutions for both personal and commercial use. They seamlessly integrate traditional and cryptocurrencies to support multi-currency accounts, transfer and exchange services. The platform combines the speed and security of a blockchain payments infrastructure, with the convenience of a mobile device.   Wirex is playing a vital role in bringing cryptocurrencies into the mainstream by creating a trusted environment within which to buy, sell, exchange and make payments.   They are the originators of the world’s first contactless Visa debit card for cryptocurrencies and reinvented the concept of loyalty points with the introduction of the innovative Cryptoback™ rewards programme. The programme pays card users 0.5% back in Bitcoin on point of sale retail purchases, transport and entertainment.   The platform supports Bitcoin, Litecoin and Ripple, Ethereum, Waves, Wollo, Dai, GBP, EUR and USD. This means that users can instantly exchange these currencies with bank beating rates. Money transfers are free between Wirex users, and accounts can be funded via bank transfer, debit or credit card.   Since 2014, over 2 million clients in over 130 countries have made over $2bn in transactions. Wirex is not an ICO company - they are backed by large reputable financial institutions such as SBI Group and Softbank. Their aim is to further entrench the adoption of digital currencies and to provide an efficient and secure environment for their users.   They are trusted partners for people who are navigating the new and exciting world of digital money."
Williams-Sonoma,https://www.crunchbase.com/organization/williams-sonoma,"Cooking, Furniture, Interior Design, Retail",Williams-Sonoma is a retailer of home furnishings and gourmet cookware that offers products for every room in the house.,"Williams-Sonoma is a retailer of home furnishings and gourmet cookware that offers products for every room in the house from the kitchen to the living room, bedroom, home office, and even the hall closet. The company’s product portfolio includes kitchenware, furniture, and linens, as well as other houseware and home furnishings, along with a variety of specialty foods, and soaps and lotions. The first Williams-Sonoma store opened in 1956, selling a small array of cookware imported from France. Since then, the brand has expanded to hundreds of products from around the world, more than 250 stores nationwide, a direct-mail business that distributes millions of catalogs a year, and an e-commerce platform. Williams-Sonoma was founded in 1956 and is based in San Francisco, C.A."
Windward,https://www.crunchbase.com/organization/windward-naval,"Analytics, Artificial Intelligence, Big Data, Information Technology, Insurance, Shipping",Windward is in the business of analysis to help people understand maritime risk and therefore take actions to reduce it.,"Windward is in the business of analysis to help people understand maritime risk and therefore take actions to reduce it. Combining the traditional world of shipping with the new world of data, it helps marine insurers boost profitability by quantifying dynamic risk; and enables intelligence agencies, coastguards and law enforcement to protect their national interests by revealing potential threats. "
Winnie,https://www.crunchbase.com/organization/winnie,"Children, Mobile Apps, Parenting",Winnie is bringing transformative technology to parenting.,"Winnie is bringing transformative technology for people who care for children.  Winnie’s mission is to make parents' lives easier through technology. Their app gives parents the information they need to travel, explore, or even just run errands with their kids."
Willing,https://www.crunchbase.com/organization/willing,"Elder Care, Funerals, Legal, SaaS",Willing is the best way to make your legal will.,Willing makes quality end of life planning easy and affordable for everyone.
Wizeline,https://www.crunchbase.com/organization/wizeline,"B2B, Business Intelligence, Consulting, Information Technology, Mobile, Product Design, Software, UX Design, Web Development",Wizeline is a technology company that provides innovative software solutions with distributed teams.,"Wizeline is a global product development company that helps its clients solve their biggest challenges with design and technology. Wizeline helps technology leaders build innovative end-to-end products that capture new markets, disrupt business models, and leverage data. Over 100M people use products designed and developed by Wizeline every day. With Silicon Valley DNA and exceptional global talent, Wizeline has built a practice uniquely equipped to this task."
Wikia,https://www.crunchbase.com/organization/wikia,"Creative Agency, Online Portals, Social Media",Wikia is a collaborative media platform.,"Wikia is a trusted collaborative media platform. It is the definitive place for people to contribute to the assembly of original bodies of multi-media content around subjects they know and love. Using Wikia, anyone can form new communities around any subject or participate in over 250,000 existing communities by reading or contributing new content. With over 20 million pages of rich content, Wikia's communities are the most authoritative information about any topic on the Internet. Wikia's video game vertical is a leading video-game focused network on the Web. Its entertainment vertical is the fastest growing US entertainment destination around the world."
Wishfin.com,https://www.crunchbase.com/organization/wishfin-com,"Finance, Financial Services, FinTech","Wishfin enables wishes through investment, credit and smart financial management.","Wishfin enables wishes through investment, credit, and smart financial management. The company uses cutting edge technology and financial expertise to empower customers make responsible financial decisions, helping them fulfill their cherished wishes and aspirations."
Willo,https://www.crunchbase.com/organization/prodontis-3,"Consumer Electronics, Hardware, Robotics",Willo develops technology in oral health that automatically empowers everyone to achieve the best at-home clean possible.,Willo develops technology in oral health that automatically empowers everyone to achieve the best at-home clean possible.
WithYouWithMe,https://www.crunchbase.com/organization/withyouwithme,"E-Learning, Education, Human Resources, Software",WithYouWithMe is an online talent incubation program to develop and transition military members to the top of industry.,"WithYouWithMe is an Online Talent Incubation Program that develops and upskills talented military professionals to transition successfully into the industry by overcoming the ‘skills gap’ through our Pathway and Mentoring Model. Their software allows mentees to conduct a military profile and personality assessment which ensures WithYouWithMe’s tested job fit algorithm allocates them to the right job pathway and translates their military position and experience into industry skills. They also study the labor market, identify skills gaps in the economy, test and match people to these skills courses, and train them and place them in employment.   The company also provides online training, events, job opportunities, resumes, networking, Linkedin profiles, and career mentorship. WithYouWithMe is the winner of The Prime Minister’s Veterans Employment Award 2018 for 'Outstanding Contribution by an Organisation to Veterans Employment and The Prime Minister’s Veteran’ Employment Award 2018 for Excellence in Supporting Veterans Employment. WithYouWithMe was founded in 2015 and is headquartered in North Sydney, New South Wales, Australia."
Wistia,https://www.crunchbase.com/organization/wistia,"Analytics, Video, Video Streaming",Wistia is the video platform of choice for business.,"Wistia is the video platform of choice for businesses both small and large. Through simple, intuitive and powerful products spanning from free and premium video hosting solutions, to video creation and editing tools like Soapbox, Wistia reduces the barriers to better business communications for teams including marketing, sales, support, HR, and more. With Wistia, everyone, regardless of their experience-level, can create, host, manage, distribute, and analyze great-looking video that fuels stronger, more human connections. Founded in 2006 in Cambridge, Massachusetts, more than 300,000 businesses across 50 countries depend on Wistia to power more creative and authentic communications, including: HubSpot, MailChimp, Sephora, Starbucks, and Tiffany & Co. Learn more at wistia.com and follow us on Facebook and Twitter @wistia."
Withlocals,https://www.crunchbase.com/organization/withlocals,"Leisure, Marketplace, Tourism, Travel",Withlocals is the peer-to-peer marketplace where local people offer experiences and their skills to travelers. ,"Withlocals is a fast-growing global marketplace for personalized travel experiences. Founded in 2013, Withlocals offers over 1,200 fully-customizable, 100% private tours and activities led by 900 local hosts in dozens of international cities. Withlocals’ mission is to connect people and cultures through travel. Our hosts take travelers off the beaten path to experience destinations like the locals do. Withlocals’ scalable marketplace puts hosts directly in contact with tourists, bringing personalized travel to the mass market at an affordable cost."
WITHIN (VR/AR),https://www.crunchbase.com/organization/vrse,"Apps, Augmented Reality, Software, Virtual Reality",WITHIN is a virtual reality and augmented reality media and technology company.,"WITHIN is the premier destination for innovative, entertaining, and informative story-based virtual reality and augmented reality. We bring together the best immersive experiences from the world's finest VR/AR creators—from gripping tales set in worlds of pure imagination to documentaries taking you further inside the news than ever before.  WITHIN supports all major headsets, including Oculus Rift, Samsung Gear VR, HTC Vive, Sony PlayStation VR, and Google Daydream.  To get started experiencing our ever-growing roster of content, just download our app for iPhone or Android today."
Wiliot,https://www.crunchbase.com/organization/wiliot,"Semiconductor, Wireless",WIliot is a fabless semiconductor company developing passive SoC platforms for the IoT market.,WIliot is a fabless semiconductor company developing passive SoC platforms for the IoT market. No battery and seamless connectivity operation will be the baseline enabler of IoT future growth.
Wingtra,https://www.crunchbase.com/organization/wingtra,"Aerospace, Drone Management, Drones, Robotics",Wingtra provides professional VTOL drone for mapping and surveying.,"Wingtra is a professional drone manufacturer based in Zurich, Switzerland. The company produces the VTOL WingtraOne drone, which collects high-precision aerial data for surveying and mapping applications. Since its market entry in 2017, Wingtra has partnered with more than 50 of the biggest surveying equipment dealers across the globe, such as RDO Inc. and SITECH."
"Wibbitz, Inc.",https://www.crunchbase.com/organization/wibbitz,"Marketing, Publishing, Social Media, Video",Wibbitz is an automated video creation company that empowers any team to produce professional short form video.,"Wibbitz is an automated video creation company that empowers any team to produce professional short form video. The Wibbitz online platform makes it quick and easy to create video for social media, news & entertainment coverage, marketing, communications, recruitment, events and more. Creators have access to customizable video templates, drag-and-drop editing tools, a team of in-house experts, and millions of licensed photos, videos, and soundtracks. The Wibbitz Lightbox API solution enables video creation capabilities within any website or application to engage and retain users with video. Wibbitz powers video for leading brands including Bloomberg, Reuters, Bertelsmann, NBC Universal, HubSpot, and Birchbox. Wibbitz was founded in 2011 and has offices in New York City, Tel Aviv, Paris, and London."
Winnow,https://www.crunchbase.com/organization/winnow-solutions,Software,"Winnow develops digital tools to help chefs run more profitable, sustainable kitchen.",Winnow builds artificial intelligence tools to help chefs run more profitable and sustainable kitchens by cutting food waste in half.
Wimdu,https://www.crunchbase.com/organization/wimdu,"Internet, Social Media, Travel",Wimdu is a central platform connecting travelers with private accommodation hosts around the world.,"Wimdu is the central platform for all types of private accommodation and unites travelers with hosts around the world. Whether it is a private trip or a business trip— Wimdu allows anyone who likes individual living and does not like to stay overnight in hotels to find a diverse selection of unique accommodation all over the world. At Wimdu, anybody can offer their flat, house or even a room in a shared flat to travelers. The host benefits from additional income and provides travelers with a completely new perspective on the holiday destination. Rooms furnished with a personal touch and helpful insider tips let holidaymakers explore cities and countries like a local—hence the slogan ""Travel like a local."" Depending on the budget and your own needs, you can find diverse categories from rooms in shared flats in Tokyo to two-room flats in Berlin and even penthouses in New York.  Transparency and security are top priorities for Wimdu. A provider can require a deposit, for example, but must also create a complete profile to ensure that the potential renter has important information such as pictures or contact information. Guests, as well as hosts, can give ratings and comment on their experiences with each other and these flow into the Wimdu rating system. This ensures that trips are a reliable and trusting experience for both sides.  Wimdu has launched in 11 languages and in addition to Europe is active in Asia as well as North and South America. Along with the opportunity to submit and search for accommodations, the platform also offers background information ranging from travel tips to virtual guided tours. The comprehensive social media strategy allows users all over the world to exchange experiences and inform themselves via video channels, Facebook, Twitter, and blogs. Serial entrepreneurs Arne Bleckwenn and Hinrich Dreiling, who successfully launched gratispay.de in 2009, founded Wimdu. Rocket Internet finances the Berlin-based start-up."
Wikimedia Foundation,https://www.crunchbase.com/organization/wikimedia-foundation,"Developer Tools, Education, Non Profit, Open Source, Semantic Search",Wikimedia Foundation encourages the development and distribution of free educational content with projects such as Wikipedia.,"The Wikimedia Foundation is a non-profit company focused on empowering and engaging people around the world to collect and develop educational content under a free content license or in the public domain, and to disseminate it effectively and globally. The Wikimedia Foundation's most prestigious project is Wikipedia, however, they are involved in others such as Wikimedia Commons, Wiktionary, Wikisource, Wikiquote, Wikibooks, Wikinews, Wikiversity."
WireWheel.io,https://www.crunchbase.com/organization/wirewheel-io,"Compliance, Cyber Security, Privacy",WireWheel.io is a software company that revolutionizes data privacy and protection as-a-service for companies.,WireWheel.io is a software company that revolutionizes data privacy and protection as-a-service for companies. WireWheel delivers a cloud-based solution to to help global organizations become GDPR-ready and operationalize privacy in the enterprise.
Wistron InfoComm,https://www.crunchbase.com/organization/wistron-infocomm-zhongshan-corporation,"Hardware, Manufacturing, Software","Wistron InfoComm manufactures mainboards, graphic cards, desktop computers, servers, DVD players and more for technology companies.","Wistron InfoComm (Zhongshan) Corporation engages in the production of mainboards, graphic cards, desktop computers, servers, set-top boxes, DVD players, and CD-ROM players for international technology companies. The company provides manufacturing services for future-generation video game console, such as parts, and final packaged product, including parts procurement, assembly and integration, testing, and final box build. It also engages in assembly of semi-finished computers and computer components, such as mainboard. The company is based in Zhongshan City, China. Wistron InfoComm (Zhongshan) Corporation operates as a subsidiary of Wistron Corp."
Wildflower Health,https://www.crunchbase.com/organization/wildflower-health,"Health Care, Mobile",Focus on our clients needs: we will integrate our services into existing sustainability programmes.,"Wildflower Health is building a mobile health engagement platform to improve healthcare quality and lower medical costs. Our team is passionate about harnessing user-centered design and technology to deliver products that drive smarter healthcare decisions. Over time, we aspire to leverage a unique set of analytics to deliver novel insights that improve treatment and cost-management in the clinical areas we support. We believe that innovative digital health solutions have the power to truly change healthcare."
