Organization Name,Organization Name URL,Categories,Description,Full Description
Agility CMS,https://www.crunchbase.com/organization/agility,"Cloud Computing, Content, Publishing, SaaS, Software, Web Development",Agility CMS is a cloud-based SAAS platform that makes building and managing websites fast and easy.,"Breakthrough the limitations of your current CMS with the Fastest CMS on the market.  Agility CMS is a Headless CMS, allowing you to choose any programming language while also getting the flexibility, speed and power that comes from lightweight APIs. From there, add features like Page Management, Ecommerce and E-ticketing and Agility CMS becomes a full Digital Experience Platform–saving time, removing limitations and allowing seamless digital experiences across all digital channels.  Come try Agility for FREE or reach out to us directly if you want to learn more. True Cloud - Built securely as a true cloud platform, performing in a multi-tenant cloud, Agility seamlessly integrates with existing platforms. We offer you high up-time, great performance, security, and globally availability. As a SaaS, we offer a subscription-based payment model, continuous improvements, excellent customer service with support from a dedicated customer success manager, and ongoing support. Hybrid CMS - Cloud first and API-based, Agility's Hybrid CMS solution combines a traditional presentation layer with headless architecture. By delivering page-driven content and offering modern integrations, a Hybrid system empowers both editors and developers. The key benefit of a Hybrid solution is that it can integrate seamlessly into existing web channels, as well as with other CMS systems. Our Customers - Agility CMS currently works with customers in a wide range of industries including media & entertainment, retail, education, and more, but with a special focus on ""experience destination""​ businesses that provide events or location-based experiences, and who need online solutions to attract new customers or make online ticket sales. Current customers include Visit Orlando, Hockey Canada, Cineplex Entertainment Inc., Soul Pepper, Canadian Opera Company, Scotiabank."
Aggreko,https://www.crunchbase.com/organization/aggreko,"Electrical Distribution, Renewable Energy, Service Industry",Aggreko provides power generation and temperature control solutions to customers.,"Aggreko plc is the global leader in the rental of power generation and temperature control equipment.  With its unique network of locations, equipment and technical services, Aggreko supports companies in generating profits by reducing risk, solving problems and creating new opportunities.  Aggreko serves companies across a wide range of industries, with over 133 locations offering 24/7 services in more than 100 countries."
AGT International,https://www.crunchbase.com/organization/agt-international,"Analytics, Big Data, Internet of Things, Public Safety, Software",Advanced technology solutions and integrated logistics support for public safety and security.,"Founded in 2007, by CEO Mati Kochavi, AGT International is a privately held technology company with over $1B in annual revenue. The company is headquartered in Zurich, Switzerland and employs more than 2,400 people globally.  AGT International has a global focus on revolutionizing public safety and security through its proprietary software and services used to aid complex problem solving. The company leverages innovative technologies including the Internet of Things, IoT advanced analytics, integrated logistics support, and cloud computing.  AGT International is best known for delivering some of the world’s largest and most sophisticated public safety and security projects and connecting a greater variety of sensors than any other company in the industry. Additionally, the company is known for utilizing deep domain expertise to collect, analyze and identify relevant data, connect previously unlinked devices and data and make relevant information accessible and actionable.  AGT International’s services and solutions empower governments, businesses, political leaders, influencers and the urban public."
Agility Recovery,https://www.crunchbase.com/organization/agility-recovery,"Information Services, Information Technology, Software","A Charlotte, N.C.-based provider of disaster recovery and business continuity solutions",
Agrisave International,https://www.crunchbase.com/organization/agrisave-international,"Agriculture, Farming, Financial Services",Agrisave is a platform to save farmers time and money.,"Our goal at Agrisave is a hunger free Zambia, and a Hunger free Africa, that is why we make it our goal to provide farmers with the necessary resources that they need in order to grow, maintain and scale their yeilds."
AgileQuant Sp. z o.o.,https://www.crunchbase.com/organization/agilequant-sp--z-o-o-,"Finance, Stock Exchanges","AgileQuant Sp. z o.o. operates trendsinvesting.com, an online platform created to expand the simple idea of investing based on trends.","AgileQuant Sp. z o.o. operates trendsinvesting.com, an online platform created to expand the simple idea of investing based on trends. It was founded in 2014 and is based in Warszawa, Mazowieckie."
AGCS,https://www.crunchbase.com/organization/adgibbon,"Advertising, Internet, Mobile, Social Media",AGSC is a Creative Operations company focusing on building display advertising in HTML5 for agencies and publishers.,AGSC is a Creative Operations company focusing on building display advertising in HTML5 for agencies and publishers. They are a HTML5 Production Agency supporting a range of companies with their digital advertising projects and campaigns.  Their company started in 2011 focussing on mobile rich media creatives and the development of an ad-serving system. Since the major browsers started blocking Flash in 2015 they change into a creative production agency focussing on coding display banners for all kinds of campaigns.
AGM Industries Inc,https://www.crunchbase.com/organization/agm-industries-inc,"Cloud Management, Software, Solar, Trading Platform",AGM Industries main focus is international trade.,"AGM Industries is currently working with private and government institutions for digital transformation and infrastructure projects. We are looking for project financing up to ONE BILLION USD, to support our aggressive growth in U.S, India, and Vietnam, also planning for an IPO by 2020. AGM Industries Inc. has been in business since 2009, our main focus is international trade in the areas of technology innovation, research and development, defense systems, supply chain, industrial equipment, construction, information technology development (hardware and software) and consulting services."
AGORANOV,https://www.crunchbase.com/organization/agoranov,"Business Development, Consulting, Finance, Incubators",Agoranov is a public Science & Tech incubator based in Paris.,"Agoranov is a public Science & Tech incubator that provides mentorship, office space, funding, and consultancy services to startups. The company is based in Paris. Agoranov has supported more than 380 startups that have already created more than 7,000 direct jobs and raised €700 million from private funds. Among them Criteo (NASDAQ: CRTO), Anevia, Biophytis, Gensight and Pixium listed on Alternext, or Aldebaran, Dataiku, Doctolib, Point Vision and Ynsect. Agoranov, founded by the Universities Pierre and Marie Curie and Paris-Dauphine, Ecole Normale Supérieure, ParisTech, and INRIA, is supported by the Ministry of Research and Higher Education, the Ile de France Region, the City of Paris and the European Social Fund. Agoranov provides its 60 incubated with personalized support, a state-of-the-art acceleration program, quality accommodation in the center of Paris and a rich community of several hundred entrepreneurs."
AgroPestAlert,https://www.crunchbase.com/organization/agropestalert,"Agriculture, AgTech, Farming",AgroPestAlert aims at building a trustworthy community between farmers and pest warning systems.,"AgroPestAlert aims at building a trustworthy community between farmers and pest warning systems, which through the deployment of an interconnected network of electronic and intelligent trap devices, assisted by cloud data analytics applications, is able to identify the pests at the species level and to transmit the warning of their presence at the moment they appear, so that their infestation can be contained in a timely manner before their populations get out of control and cause irreparable damage to the harvests."
Agenda,https://www.crunchbase.com/organization/agenda,"Internet, Travel",Agenda is an online organizer that enables users to plan and note down their travel plans.,"Agenda is an online organizer that enables users to plan and note down their travel plans. Users can also find and book hotels, airlines, and transport options. Agenda was launched in 2012 and is based in London, England."
Agricolum,https://www.crunchbase.com/organization/agricolum,Agriculture,Agricolum is a multi-device application that facilitates the management and absolute control of agricultural holdings.,Agricolum is a multi-device application that facilitates the management and absolute control of agricultural holdings.
AGS Health,https://www.crunchbase.com/organization/ags-health,"Analytics, Health Care, Hospital, Information Technology, Robotics","An analytics driven,technology enabled revenue cycle solution.","AGS Health is an analytics driven, technology enabled Revenue Cycle Management (""RCM"") Company providing medical billing, medical coding and business analytics services to leading healthcare providers across the US."
Agilis,https://www.crunchbase.com/organization/agilis,"Financial Services, FinTech, Lending",Agilis is the first online asset-backed lending platform in Argentina.,"Agilis is a financial services company that intends to disrupt the asset-backed secured lending in Argentina by becoming the leading online lending platform. By putting a property as a backup of the loan, lenders can finance at a lower rate and a much longer term than with a personal loan."
Agroils,https://www.crunchbase.com/organization/agroils,"Energy, Fuel, Renewable Energy",Creating thousands of jobs in rural West Africa by producing a cheaper substitute for diesel fuel derived from jatropha plantations.,Agroils is creating thousands of jobs in rural West Africa by producing a cheaper substitute for diesel fuel derived from jatropha plantations.
Agorastore,https://www.crunchbase.com/organization/agorastore,"E-Commerce, Retail",Agorastore is a Retail & eCommerce company.,"Since 2015 Agorastore has developed the auction sale  with more than forty properties constantly on sale on the site. Their site allows departments, towns and regions to sell townhouses or even old gendarmeries that will find a second life through auctions in the same way that the state sales . However, all sales are online and have high visibility. Sales are organized by electronic or auction-based auction brokerage transactions, which are sales by auctioneer online: public auction sales ."
AGILE customer insight,https://www.crunchbase.com/organization/agile-customer-insight,"Analytics, Banking, Big Data, Retail, SaaS, Software",AGILE customer insight offers enterprise data analytics and insight SaaS for sales and marketing users.,AGILEci levels the playing field for independent retailers to compete with big retailers. AGILEci automates payments data analytics to put affordable actionable insight into the hands of retailers. Drive sales and profits through better business and customer understanding. AGILEci is a product of Anthemis Group (www.anthemis.com)
AGS,https://www.crunchbase.com/organization/ags,Gambling,AGS is a full-service designer and manufacturer of gaming products for the casino floor.,"AGS is a full-service designer and manufacturer of gaming products for the casino floor. The Company’s roots are in the Class II, Native American market, and it has recently expanded its product lines to include top performing slot games for the Class III commercial marketplace as well as live felt table games. There’s nothing magical about the cost-saving convenience of a single source for both gaming machines and table games. It requires dedication, acquisition, and a willingness to invest in your future. Their recent acquisition of Cadillac Jack® and entry into the table games market denote a dramatic expansion of AGS products. Increased slot titles and jurisdictional licenses have made AGS the second largest supplier of Class II games in the world, and our presence in Class III casinos continues to keep the pace. Our diverse line of table products can help casino operators find exactly what they need for any part of the pit, and most are available to play for fun online."
Agile Group,https://www.crunchbase.com/organization/agile-group,"Business Development, Information Technology, Software, Telecommunications",Agile Group is a collection of businesses that are designed to assist and support your business to function.,"Agile Group is a collection of businesses that are designed to assist and support your business to function. Our markets include outsourcing and logistic, ICT and telecoms systems, network infrastructure and business software. Our businesses fit together to provide a comprehensive and cohesive solution, tailored to your requirements.Agile Group, a Stockton, UK-based IT and communications service provider, received a six figure investment.Set up in 2009 and led by CEO Simon Scotchbrook, Agile Group provides ICT services to North-Eeast SMEs and is expanding its offering to offer broadband and telecoms to mobile platforms, such as ships. Markets include outsourcing and logistic, ICT and telecoms systems, network infrastructure and business software."
AgileAssets Inc.,https://www.crunchbase.com/organization/agileassets-inc,"Asset Management, Finance, Information Technology, Software",AgileAssets is a computer software company that provides infrastructure asset management software solutions.,"AgileAssets was founded in 1994 in response to the demand from public agencies seeking better software solutions for their infrastructure asset management needs. Since then, the company has grown to become a leading global provider of integrated infrastructure asset management software solutions."
Agar Scientific,https://www.crunchbase.com/organization/agar-scientific,"Electronics, Manufacturing, Retail","Agar is a leading manufacturer and distributor of scientific laboratory equipment, with a focus on electron microscopy consumables.","Agar is a leading manufacturer and distributor of scientific laboratory equipment, with a focus on electron microscopy consumables. Founded in 1981 by Alan Agar, the Company enjoys global recognition as a provider of high-quality components and excellent customer service."
AgileMesh,https://www.crunchbase.com/organization/agilemesh,"Computer, Professional Networking, Security","AgileMesh develops mesh-networked wireless video surveillance systems for event surveillance, security, law-enforcement, and more.","AgileMesh, Inc. develops mesh-networked, wireless video surveillance systems for event surveillance, security, homeland security, law-enforcement, and other first-responder applications. The company offers wireless network nodes, camera deployment units, and networking units, as well as accessories, including storage cases, additional antennas, antenna-mounting hardware, and cable and dual camera heads. Its products are also used in tactical video surveillance, VIP protection, asset protection, special events, covert surveillance, campus security, hazmat incidents, and training applications by federal, state, and local agencies. The company distributes its products through technology vendors, integrators, and contractors.  AgileMesh was founded in 2005 and is based in Richardson, Texas."
Agri 2000,https://www.crunchbase.com/organization/agri-2000,Agriculture,Agri 2000 is a service and research company.,"Agri 2000 was founded in 1985 by a group of 7 Agricultural Science graduates. Right from the start 3 distinct departments were set up: Agronomic field trials, Economic Studies and Urban Green Studies. Over the many years of its history Agri 2000 developed intuition regarding the beginning of experimental field trials and it continues to conduct these trials together with “regulatory” consultancy for clients producing technical solutions for agriculture, economic studies for the agricultural supply chain and agrichemical companies, studies on the stability of trees and tree statics, censuses and enhancement of the management of green areas."
Agrisera,https://www.crunchbase.com/organization/agrisera,"Commercial, Food and Beverage, Nanotechnology, Small and Medium Businesses",Agrisera is a Swedish company specializing in polyclonal and monoclonal antibody production.,"Agrisera is a Swedish company specializing in polyclonal and monoclonal antibody production, offering 1000 primary antibodies and over 2000 secondary antibodies for various applications and in various quantities, all available online.  Agrisera is still a small company, easy to contact and as a client you get direct access to Agrisera staff scientists who will answer all your queries promptly."
Ag Growth International,https://www.crunchbase.com/organization/ag-growth-international,Manufacturing,"A global leader of innovative solutions for portable and stationary grain handling, storage.","A global leader of innovative solutions for portable and stationary grain handling, storage."
AgenTec,https://www.crunchbase.com/organization/agentec,"Consulting, Information Technology, Software, Web Development","AgenTec offers ABook, a web browser-based content management system.","AgenTech was founded in January, 2004 providing web browser based contents management system, ABook and others. ABook consists of an app, a management server, and an authoring tool. Anyone can easily create and distribute rich contents with images, music, and videos to smart devices."
Agentek,https://www.crunchbase.com/organization/agentek,"Enterprise Applications, Mobile, Real Time","Agentek develops real-time mobile solutions for immediate field access to backend systems, data and resources.","Agentek designs, deploys, and supports real-time mobile solutions with importance on field service and delivery. These solutions provide immediate field access to backend systems, data and resources."
AG-Grid,https://www.crunchbase.com/organization/ag-grid,"Apps, Information Technology, Software",AG-Grid is a JavaScript data grid designed for Enterprise Applications.,
Agylstor,https://www.crunchbase.com/organization/agylstor-inc,"Computer, Data Storage, Network Hardware",Peta-scale computational storage systems designed for some of the world's harshest environments,"Agylstor’s high-performance computing platform includes software and in-system hardware acceleration for compression, parity RAID, encryption and other services, while Agylstor’s distributed software architecture provides maximum performance by distributing workloads across the processing and storage fabric. The company’s technology provides secure data storage and transfer for video and film production, geoscience, infrastructure mapping, and aerospace applications, including more capable piloted and autonomous systems."
AgroInsider,https://www.crunchbase.com/organization/agroinsider,"Agriculture, Farming, Information Technology, Software, Virtual Reality",AgroInsider provides technology tools for tracking farm data.,AgroInsider turns information into knowledge with agronomic value for business. AgroInsider supports farmers in developing intelligent and innovative solutions as part of its activity.
AGS MedTech,https://www.crunchbase.com/organization/ags-medtech,Health Care,AGS MedTech is a minimally invasive diagnosis and treatment equipment supplier.,
Agrariya,https://www.crunchbase.com/organization/agrariya,"Agriculture, Classifieds, E-Commerce, Farmers Market, Farming, Lead Generation, Marketplace, Organic Food",Farmers marketplace for the CIS region (ex-USSR),"CIS (ex-USSR) region has the largest farmland in the world (560 mln. ha) and 30 mln. people (10% of the population) involved in agriculture with total annual output of USD 200 bln.  Agrariya (Агрария) is a B2B2C vertical providing digital tools and e-commerce solutions for food buyers, farmers and agri brands in the CIS region."
Agilys,https://www.crunchbase.com/organization/agilys,"Enterprise Software, Mobile, Software",Shopping list App for Mobile phones,"Founded in 2010 by Renaud Gryspreerdt and Philippe Van Ophem Agilys creates smart applications for smartphones. They develop intelligent software applications for mobile devices aiming at making life easier for the consumer. The Company's best know product is Myshopi, an iPhone, Android and Windows Mobile Shopping List App that offers electronic discount coupons to consumers and allows them to request cashbacks from their mobile phone."
Agile Robots,https://www.crunchbase.com/organization/agile-robots,"Artificial Intelligence, Industrial Automation, Robotics",Agile Robots is an artificial intelligence robot maker.,"Agile Robots is an intelligent robot system development and application service provider, dedicated to the development and application of intelligent robot systems. The core products include 7-degree-of-freedom lightweight arm and general-purpose robot controller. , robot vision system, etc."
AgriLedger,https://www.crunchbase.com/organization/agriledger,"Agriculture, Farmers Market, Farming, FinTech, Supply Chain Management",AgriLedger is a social enterprise project using distributed ledger technology and mobile apps for agricultural producers.,"AgriLedger is a mobile app that records and transacts incorruptible truth. It is a complete framework of integrated services for delivering an even playing field to farmers and co-ops. This solid framework of trust allows everyone to know they are working, buying, selling, and sharing things according to a cryptographic “Book of Truth” that is utterly incorruptible."
Agfa HealthCare,https://www.crunchbase.com/organization/agfa-healthcare,Health Care,"Agfa-Gevaert N.V. is a Belgian multinational corporation that develops, manufactures, and distributes analogue","Agfa HealthCare offers the healthcare industry with e-health and digital imaging solutions. Its enterprise imaging solutions include radiology PACS, cardiology, business intelligence, dose monitoring, and other solutions. The company also offers a health management platform that enables health care providers and referring physicians to access their patients’ health information. Agfa HealthCare provides the healthcare industry with equipment, managed and cloud, financial, GRIP, and security services. Agfa HealthCare was founded in 1867."
Agrian,https://www.crunchbase.com/organization/agrian,"Agriculture, E-Commerce, Food and Beverage, Retail","Agrian is a single source, easy-to-use solution for ag retailers, crop advisors, agronomists, growers, food handlers and food processors.",
Agrobot,https://www.crunchbase.com/organization/agrobot,"Agriculture, AgTech, Farming, Machinery Manufacturing",Agrobot is engaged in the business of agricultural robots. ,
Agiliti,https://www.crunchbase.com/organization/universal-hospital-services-inc,Health Care,Agiliti is a provider of health care technology management and service solutions to the health care industry.,"Agiliti is a leading nationwide provider of health care technology management and service solutions to the health care industry. UHS owns or manages over 700,000 units of medical equipment for over 7,000 national, regional and local acute care hospitals and alternate site providers in all 50 states."
AgroFresh,https://www.crunchbase.com/organization/agrofresh,"Agriculture, Farming",AgroFresh is a food production company that offers the horticultural technology.,"AgroFresh is a fast-moving, dynamic company dedicated to delivering integrated solutions for more freshness and quality, every step of the way from field to market. Collaborating closely with our customers, we continually research and develop unparalleled solutions that benefit the entire supply chain, and improve the quality of life for all. "
Agave Underground,https://www.crunchbase.com/organization/agave-underground,"Brewing, Craft Beer, Wine And Spirits",Agave Underground is a multi-award winning tequila brand.,"Agave Underground is a multi-award winning tequila brand. They currently have distribution in 26 states, 2 provinces of Canada and are preparing to launch Europe. The company owns multiple design patents and trademarks. The executive team is comprised of: Michael Ivey, Founder and CEO, Chris Ivey, Legal Counsel and Partner at Stradling, Yocca, Carlson, Rauth. Fran Vivenzo, Global VP of Sales & Distribution, and Nicole Gaes, Operations. Their Board of Directors is: Steele Platt, founder of The Yardhouse Restaurant and Bob Smith, past President and CEO of Alliance Beverage. They bring over 50 years of combined experience in the adult beverage industry. They have an aggressive market plan that consists of individual state marketing and film crews. They also currently sponsor the Danny Rowe Race Team which includes 3 Pro Mod, NHRA race cars along with a 53', fully branded Semi. They also have over 100k in their current inventory of bottles."
