Organization Name,Organization Name URL,Categories,Description,Full Description
Ubiqutek,https://www.crunchbase.com/organization/ubiqutek,"Developer Platform, Electronics, Manufacturing",Ubiqutek is pioneering the development and use of electricity to treat weeds.,Ubiqutek is pioneering the use of electricides using RootWave technology.  RootWave is the leading solution for killing weeds without using any chemicals.  Our award winning products can economically solve any weeding problem. Its vision is to improve the environment by offering a sustainable and scalable alternative to chemical herbicides. 
UbaPesa,https://www.crunchbase.com/organization/ubapesa,"Bitcoin, Blockchain, Cryptocurrency, Financial Services, Lending, Mobile Apps, Peer to Peer",UbaPesa is the best peer to peer lending app in Kenya which allows you to lend and borrow money in real time,UbaPesa is the best peer to peer lending app in Kenya which allows you to lend and borrow money in real time.
Ubideo,https://www.crunchbase.com/organization/ubideo,"Events, Journalism, Video Streaming",The World. Live. A tap away. It empowers anyone with a smartphone to be a realtime reporter,"Ubideo is a platform for direct media sharing. It empowers anyone with a smartphone to be a real-time reporter by capturing and streaming any event as it unfolds. Ubideo connects streamers with millions of viewers around the world. Viewers can easily explore streams, interact with the streamers, even request for live streams anywhere."
Ubcoin Market,https://www.crunchbase.com/organization/ubcoin-market,"Blockchain, Cryptocurrency, Mobile Apps, Mobile Payments",Ubcoin market is a global peer-to-peer marketplace.,"Ubcoin Marketplace is the next leap forward for Ubank, leading mobile payments app in Eastern Europe. Now with Ethereum blockchain, exchange-traded UBC cryptocurrency, and peer-to-peer smart contracts for buying goods for cryptocurrency. Ubcoin Market will become part of Ubank app as a new feature."
Ubuntu Education Fund,https://www.crunchbase.com/organization/ubuntu-education-fund,"Association, Education, Humanitarian, Non Profit",Ubuntu Education Fund helps raise Port Elizabeth’s orphaned and vulnerable children by giving them what all children deserve—everything.,"Ubuntu Education Fund is a non-profit organization that provides health, educational, and social support to over 2,000 orphaned and vulnerable children in Port Elizabeth, South Africa. Ubuntu's mission is simple, all-encompassing, yet radical: to help raise township children by providing what all children deserve—everything. Ubuntu was founded in year 1999 after its current CEO, Jacob Leif, visited Africa to observe the country’s transition to democracy."
Ubilite,https://www.crunchbase.com/organization/ubilite,"Internet, Manufacturing, Semiconductor, Telecommunications, Wireless",A San Diego-based fabless semiconductor company .,"UBILITE Inc. is a San Diego-based fabless semiconductor company that designs and markets Ultra Low Power (ULP) 802.11 based wireless connectivity products for the Internet of Everything (IoE). The company is a pioneer in designing Ultra Low Power (ULP), disposable and wearable Wireless Local Area Networks (WLANs), which will be used extensively in sensing, and control of consumer and enterprise applications."
Ubiquilux,https://www.crunchbase.com/organization/ubiquilux,"Lighting, Manufacturing, Product Design",Ubiquilux is a designer and manufacturer of motion gesture control lighting solutions.,
Ubersnap,https://www.crunchbase.com/organization/ubersnap,"E-Commerce, Photo Sharing, Photography","Ubersnap is a photo booth in Singapore that provides instant GIF prints at weddings, corporate events and private parties.","At Ubersnap, we believe in challenging conventional wisdom. When we create a product, we reimagine the user experience from the ground up - listening to what photographers want. We are proud to introduce a new photo sharing platform for photographers to discover and discuss photography. Since June 2013, we’ve talked to over 100 photographers about their problems and how we can help them. Photographers, from amateurs to professionals, want their work to be seen and want to connect with a community. So, we built a platform that can help photographers achieve that - with an incredibly simple and intuitive user experience. Ubersnap is the result of everything we’ve learnt, supported by our own experience as photographers. We’re confident you will like it."
UBS Zurich,https://www.crunchbase.com/organization/ifinity,"Analytics, Big Data, Indoor Positioning, Location Based Services, Mobile, Navigation, Software, Wireless",We bring you Geos - an operating system for businesses and governments to create indoor navigation and to manage smart sensors.,"We're reconnecting mobile people to the real world with Geos - an operating system for businesses and governments to create indoor navigation and to manage smart sensors. Geos features: - Out of the Box solution, - Sensors agnostic management platform, - Multi-floor indoor navigation, - Personalized notifications to mobile users,  - Behavioral analytics, - No programming skills required, Geos is particularly used by city authorities who wants to give access to urban services for their residents. The City of Warsaw has commissioned Ifinity to carry out a Virtual Warsaw project based on Geos with three implementations:  - Indoor navigation system in the Warsaw Center for the Disabled  - Public buses real-time schedules available on mobile  - Educational context-aware paths in one of city districts As an outcome of implementation City of Warsaw was awarded with prestigious Mayors Challenge Prize winning $1M Euro and plans to run $15M worth implementations."
UbiVac,https://www.crunchbase.com/organization/ubivac,Biotechnology,UbiVac is a clinical stage biotechnology company engaged in the research and development of therapeutic vaccines to combat cancer,
Ubiq,https://www.crunchbase.com/organization/ubiq-toolbox,"Apps, Local Advertising, Multi-level Marketing, SaaS, Social Media",Ubiq is a company that produces software to help companies connect their brands to users through social media.,"We Operate social networks for enabling brands to make local Performance ! Ubiq Plarform:registered: is the first multi level marketing platform that allows brands to manage local based marketing campaigns on social networks, mobile and web. Country manager, marketing manager and each shop manager can work together on Ubiq  platform:registered: and manage easily and effectively marketing campaigns to drive business locally.  The 5 Ubiq platform:registered: key features :  - Workflow managing - Web apps building - Content scheduling  - Campaign analytics - Data base aggregation Local based marketing is the main marketing manager priority on 2015 and the coming years. In 2017, local based marketing budget will exceed national marketing budget Thanks to Ubiq Platform:registered:, our customers daily: - Increase local communities - drive traffic in shops - build geolocated data bases - emerge and valorize high added value local content  Get local success with Ubiq Platform !"
UbiPark,https://www.crunchbase.com/organization/ubipark,"Information Technology, Parking, Transportation",UbiPark is one parking solution from start to finish.,"UbiPark is creating the best mobility solutions, empowering the world to travel smarter.  Our parking solutions for the mobility industry, provide motorists with a seamless & enhanced parking experience, one that saves time & money, and reduces traffic congestion. The mobility revolution has begun, and now parking has joined the movement with UbiPark."
Ubiix Inc.,https://www.crunchbase.com/organization/ubiix-inc,"Enterprise Software, SaaS",Ubiix is a leading SaaS and enterprise communication solution provider with a vision to revolutionize how businesses connect in Asia.,
UBM Plc,https://www.crunchbase.com/organization/ubm,"B2B, Digital Marketing, Events, Information Services, Market Research, Marketing, Marketing Automation",UBM is a global events-led marketing and communications services business.,"UBM helps organisations make connections, communicate their proposition and do business effectively. They help professional people in more than 20 countries around the world succeed by enabling them to connect with each other and with the markets they serve.  And they do this by whatever means works best – at live events, through digital media or in publications. Their 5,000 expert staff are deeply embedded in the many specialist communities they serve, bringing both an unusual depth of understanding and real know-how. They organise hundreds of live events each year and provide a range of related market-leading digital and print marketing and media products, and they support professional marketers and communicators through their targeting, distribution and monitoring services. Their culture of innovation and collaboration brings their people together around common interests to create value, enhancing their ability to do exactly the same for UBM customers and the communities UBM serves. So, whatever their business and wherever they operate, their customers do better business through us."
UberConference,https://www.crunchbase.com/organization/uberconference,"Mobile, Telecommunications","With its clean, elegant UX, UberConference is audio conferencing designed to be both powerful and simple to use.","UberConference fixes all the [broken and outdated aspects] (http://www.youtube.com/watch?v=DdqnU5liPBA)  of traditional conference calling, making it a more productive business tool, and transforming an industry that hasn't seen real innovation in decades.  UberConference gives a visual interface to every conference call so callers can know who's on a call and who's speaking at any time, in addition to making many other features, such as Hangouts integration and screen sharing, easy-to-use with the click of a button.  Built by the teams that brought Google Voice and Yahoo! Voice to tens of millions of users, UberConference launched in 2012 and is funded by Andreessen Horowitz and Google Ventures. The company was named one of the San Francisco Business Times' ""Best Places to Work"" in 2014.  UberConference is also available for iPhone and Android devices that integrate with your phone’s address book and dial out to your contacts directly to create instant conference calls."
UbiCast,https://www.crunchbase.com/organization/ubicast,"Internet, News, Semantic Web, Video, Video Streaming",UbiCast develops autonomous plug and webcast systems that enable non-specialist users to capture and stream their videos and webinars.,"UbiCast is a company specialised in autonomous ""plug & webcast"" systems that enable non specialist users to capture and stream their videos and webinars with a great ease of use.  EasyCast records your conferences, training and communications events It publishes them live and on-demand to ForuMedia - your interactive WebTV EasyCast creates your : - webinars, that synchronize and chapterize audio, video and slide presentations. Webinars are only viewable on Web browsers (Internet Explorer, Firefox, Safari, Chrome...) - video podcasts, that combine audio, video and slides into a single video file (.mp4 format) that is viewable on any device (computers, hand-helds, etc.)"
Ubiquiti Networks,https://www.crunchbase.com/organization/ubiquiti-networks,"Broadcasting, Electronics, Hardware, Manufacturing, Web Hosting",Ubiquiti Networks manufactures a variety of high-end wireless products to cater to underserved and emerging markets.,"Ubiquiti Networks, Inc. (Ubiquiti) designs, manufactures and sells broadband wireless solutions worldwide. The Company offers a portfolio of wireless networking products and solutions, including systems, high performance radios, antennas and management tools, designed for wireless networking and other applications in the unlicensed radio frequency (RF) spectrum. The Company offers solutions that incorporate its RF technology, antenna design and firmware technologies, which it refers to as AirTechnologies. During the fiscal year ended June 30, 2010 (fiscal 2010), Ubiquiti introduced a number of products based on its AirTechnologies, including its AirMax systems. In fiscal 2010, 802.11 standard systems and AirMax systems together accounted for 82% of the Company’s revenue."
Uberdreams,https://www.crunchbase.com/organization/uberdreams,"Digital Entertainment, Internet",Uberdreams.com offers experiences of meeting celebrities and fulfilling other wishes,"Uberdreams, true to its name, aims to do just that! They are the new-age Genie in the lamp: all you have to do is make a wish! Whether you are a bunch of friends, a family of four, or simply looking to treat yourself, we are the ones who get the good-stuff rolling in. You imagine, they make it happen."
Ubiquigent,https://www.crunchbase.com/organization/ubiquigent,"Biotechnology, Life Science","Ubiquigent provides the research community with reagents, kits, and drug discovery, assay development and compound profiling services.","Ubiquigent Limited is a specialist developer and supplier of high quality reagents, kits and drug discovery assay development and compound profiling services to the life science research community worldwide. Ubiquigent's scientific and business interests have a clear focus; namely the ubiquitin, ubiquitin-like and integrated signalling systems. The company has established its scientific and business credentials with both academic researchers undertaking fundamental scientific discovery as well as with pharmaceutical and biotechnology company scientists exploring the potential of ubiquitin cascade-focused drug discovery."
UBICUO,https://www.crunchbase.com/organization/ubicuo,"Apps, Mapping Services, Security",UBICUO is a software to detect risks and prevent accidents.,"Ubicuo was born as a platform to detect risks on the streets, with an NGO, whose founder lost her child because a trash bin in the streets was electrified. So, citizens use the application to register risks and the NGO to deliver it to the people in charge of the solution. After that we asked ourselves ""What happens in organizations?"" And we saw a huge opportunity because there are many accidents in the work environment.  Here in Chile, there were more than 170,000 (one hundred seventy thousand) accidents in organizations last year. Moreover, we saw that the risk detection processes are manual (using paper), which results in decentralized information, useless for decision making. That is why we opened our platform for the organizations. so they can use our mobile application to search and register risks in their buildings using images and georeferentiation. Then, at the office, they can complete those registries, create reports and send them to the people in charge of the solution. But that is not enough, we are continually innovating; adding new features every month like guidelines to avoid the human errors or automatically risk detection through video cameras. So, why Ubicuo? Because we reduce four times the time needed to detect and solve risks and that, is translated as less workIng accIdents;… and also we centralize the information and provide statistics. How to acquire Ubicuo? It’s easy, by subscribing to one of our packages or asking for a quotation. Currently we have four paying clients, three hundred users, one hundred inspectors and more than five thousand risks detected.  We have to say thanks to StartUp Chile, because since the beginning of the program we have been duplicated our billing, we got a pilot in Santiago and we are closing a deal to get private investment.  Finally, the team. We have complementary profiles, specialists in different software areas and project management. but we have one thing in common: we love challenges. Also, we count on institutions and mentors that are expert in prevention to guarantee that our product satisfies market requirements. So, if you need to keep your organization safe: don’t waste your time, Ubicuo is the answer."
uberlife,https://www.crunchbase.com/organization/uberlife,"Apps, iOS, Local, Location Based Services, Mobile, Social Media",uberlife is a real-world location-based socializing app that helps people spend more time with friends and like-minded people around them.,"uberlife is a real-world location-based socializing app to help people hang out more with their friends, network and new likeminded people around them, wherever they go. Users join the community by signing up with Facebook or Twitter and can also connect their Last.fm account. Users create real world ""hangouts"" showing where they are going to be and when and broadcast these directly from the app through Facebook and Twitter to invite whoever is free to ""come join"". Anyone who joins can also invite their friends by broadcasting the hangout through their own networks. Adding tags to hangouts matches these to local uberlife users' interests too, as well as their Facebook Likes and Last.fm bands, to notify them that a hangout is taking place that they're interested in and to invite them to join. Users can check in to hangouts, post comments and upload photos creating a digital memory capture of the hangout and group photo display. These actions are also (soon to be) broadcast-able directly from the app through Facebook and Twitter that enables a live activity stream before, during and after the hangout. Users can follow other uberlife users that they'd like to hang out with to be notified when that person creates a nearby hangout. Users only become Friends in uberlife IF they are following each other AND they have attended the same hangout i.e. hung out in real life.   All users earn a Connector Score when they create hangouts and connect people in real life. When two people join a hangout and then follow each other in uberlife, the ""creator"" boosts their Connector Score by one."
UBmatrix,https://www.crunchbase.com/organization/ubmatrix,"Business Development, Enterprise Software, Software","UBmatrix provides XBRL-based software solutions enabling businesses to address FMIS, GRC and external reporting problems.","UBmatrix, Inc. is a provider of XBRL-based information exchange solutions. UBmatrix serves the regulatory compliance and the financial reporting markets. Their platform and products help organizations freely move information accurately and efficiently among applications within an enterprise, between business partners, and to regulators. Benefits include increased operational and financial transparency, cost savings in sharing information both inside and outside the organization, and greater confidence in reporting accuracy and regulatory compliance."
uBirds,https://www.crunchbase.com/organization/ubirds,"Fashion, Lifestyle, Wearables","uBirds offers Unique, a smart watch strap that enables its users to turn classic watches into smartwatches.","uBirds introducing to you Unique. New device that will revolutionize smart watch market. Unique is the world's first handmade and smart watch strap. It is a combination of good taste, classic style and modern technology. Our client does not have to choose. Without any effort you can turn your own elegant watch into smart watch. With dedicated application on your smartphone you can control a device, monitor your activity and set up Unique to keep up with your needs."
Ubuy Inc,https://www.crunchbase.com/organization/ubuy,"E-Commerce, Payments, Shipping",Ubuy facilitates cross border eCommerce internationally via its payments and shipping infrastructure.,Ubuy facilitates cross border eCommerce internationally via its payments and shipping infrastructure.   www.ubuy.com
Ubeeqo,https://www.crunchbase.com/organization/ubeeqo,"Fleet Management, Mobile, Transportation",Ubeeqo is a French startup specialising in enterprise car sharing and fleet management solutions based on new mobility technologies.,"Ubeeqo (ex-Carbox) is a French start-up founded in 2008 by Alexandre Crosby and Benoit Chatelier. In 2015, it operated a strategic shift as Europcar group acquired this leading mobility player.  Ubeeqo addresses several markets that are fleet management, carsharing and everyday transport by providing innovating mobility solutions for fleet managers, employees, communities and the general public.  Ubeeqo has one ambition: to imagine a world where ""mobility"" doesn't necessarily rhyme with ""car"", a world where alternative mobility becomes possible!"
Ubits,https://www.crunchbase.com/organization/ubits,"E-Learning, EdTech, Education, Internet, Language Learning",Ubits provides online learning and certification opportunities for Spanish speakers.,Ubits is the biggest corporate micro-learning platform that trains employees in Latin America by enabling them to solve their daily professional problems.
Ubicall,https://www.crunchbase.com/organization/ubicall,"Computer, Customer Service, Enterprise Software",Ubicall provides a vendor-agnostic platform that integrates with these multiple support channels.,"Ubicall empowers businesses through a code-free platform to visually route customers to their different support channels, transforming end-user experience while offering a cost-efficient solution to enterprises"
Ubiq Mobile,https://www.crunchbase.com/organization/ubiq-mobile,"Enterprise Software, Information Technology, Mobile",Enterprise solution for easy cross-platform development of distributed mobile apps,"UbiqMobile is a framework for mobile development that streamlines how companies mobilize their business operations. By enabling mobile access, companies expand their reach to customers and employees – increasing revenues, fostering loyalty and improving productivity. UbiqMobile technology is a result of development by New Mobile Technologies, the company which was founded to develop innovative new technologies for creation of mobile business apps.  UbiqMobile removes the barriers companies face when it comes to mobilizing their business applications  • No need in accommodation of multiple devices and platforms  • No need in reliable access and broadband Internet connectivity, ability to work in slow and unstable mobile data connections  • No need in complicated integration with existing enterprise systems"
UBIK Solutions,https://www.crunchbase.com/organization/ubik-solutions,"Consumer Electronics, Electronics, Information Technology, Renewable Energy",UBIK Solutions is an agile technology company dedicated to innovative & smart solutions for sustainable energy industry.,"UBIK Solutions is a young and agile technology company dedicated to innovative & smart solutions for sustainable energy industry. Founded in 2011, our headquarters are located in Tallinn, Estonia.   Their goal is to reach a sustainable energy economy to stop the global warming and save the planet. To reach there, they want to empower people on the usage of renewable energy by offering smart, simple and affordable technologies."
Ubzerv,https://www.crunchbase.com/organization/ubzerv,Education,"Training meets Entertaining! It's motto, and one that they think is going to finally shake up the $100+ billion global eLearning.","Training meets Entertaining! It's their motto, and one that they think is going to finally shake up the $100+ billion global eLearning market. eLearning, Online Training, Distance Learning, Self-Paced Training...whatever your name preference, it's what they've dedicated the last 15 years of their lives to - experiences and connections that are carried into this new venture. Having developed content for one of the original wave-making startups in the eLearning world over a decade ago (KnowledgeNet, ultimately acquired by Skillsoft), it's time again for another shake-up.     Soon will be gone the days of computerized voices and monotonous slide presentations. Utilizing proprietary processes and procedures, they've developed a lightning fast and cost-effective methodology in building the most entertaining training imaginable. The average employee who spends 7 minutes a day on formalized training, compared to upwards of 2 hours on NetFlix, will begin seeing the convergence of the two mediums...where learners """"Ubzerv"""" eLearning as an enjoyable, engaging experience. One in which you find yourself thirsting for the next module to begin, tapping at the microwave to finally finish heating your popcorn, entirely forgetting that your new favorite """"original series"""" is actually corporate or regulatory-mandated continuing education."
Ubicquia,https://www.crunchbase.com/organization/ubicquia,Telecommunications,"Ubicquia oﬀers municipalities, utilities and broadband service providers a cost effective and expandable platform.","Ubicquia oﬀers municipalities, utilities, broadband service providers and lighting manufacturers a cost-effective and expandable platform for deploying simply connected, simply smart broadband, small cell and smart city services.  Our plug and play network has the ability to turn any street light into a multi-function router that supports a growing list of services that include advanced lighting controls, public WiFi, and the connection to 3rd party sensors including air quality monitors and surveillance cameras. "
