Organization Name,Organization Name URL,Categories,Description,Full Description
Noramco,https://www.crunchbase.com/organization/noramco,"Health Care, Information Technology, Pharmaceutical","Noramco was formed in 1979 to design, construct and manage a bulk active pharmaceutical ingredient plant in Wilmington.","Noramco was formed in 1979 to design, construct and manage a bulk active pharmaceutical ingredient plant in Wilmington, Delaware to support Ortho-McNeil Pharmaceutical's Tylenol® with codeine business. With the acquisition of Tasmanian Alkaloids and addition of the Athens, Georgia site in 1982, and continuous expansions over the past three decades at both US facilities, Noramco now contributes to billion dollar affiliate franchises, as well as to significant 3rd party generic and branded pharmaceutical products worldwide."
Novacoast,https://www.crunchbase.com/organization/novacoast,"Cyber Security, Identity Management, Information Technology",A uniquely positioned IT services and solutions company.,"A uniquely positioned IT services and solutions company, Novacoast is less defined by our broad range of expertise and services than by a perspective rooted in our cooperative environment of adaptable problem solving. Beyond security specialists, software developers or network engineers, we are guides, allies, and problem solvers. From implementation services, license fulfillment and technical training to software development, staffing services and custom or emerging solutions, Novacoast is an experienced and comprehensive IT business resource empowered on every level by our flexible and fearless perspective."
Novasol,https://www.crunchbase.com/organization/novasol,"Leisure, Rental",North Europe's largest company for holiday rentals,
Noah Holdings,https://www.crunchbase.com/organization/noah-holdings,"Career Planning, Finance, Wealth Management",Noah Is the leading wealth management service provider focusing on distributing wealth management products to the China.,"Noah is a wealth management service provider focusing on distributing wealth management products to the high net worth population in China. We are also equipped with asset management services capability, managing our own fund of funds and real estate fund products. We believe our asset management business complements our wealth management business and enables us to provide customized solutions to our clients."
Novioponics,https://www.crunchbase.com/organization/novioponics,"Banking, Financial Services, Health Care, Sustainability","Novioponics B.V. is a spin-off company of NovioTech B.V., which develops a sustainable pesticide carrier: the NovioHelix® hydrogel.","Novioponics bridge the gap between promising high-tech ideas/products and the financing required for production/marketing/sales. Together with scientists They bring early stage technologies to proof of concept, file IP, and make them ready for further and larger investments.   They act as a kind of “incubator” where not only They create new businesses and companies but also educate scientists to become more entrepreneurial and to understand the business environment. In this way They are developing a portfolio of new high-tech companies."
NOS,https://www.crunchbase.com/organization/nos-pt,"Media and Entertainment, Telecommunications",NOS are the best communications and entertainment group in Portugal.,"They are the best communications and entertainment group in Portugal. They generate wealth and grow every day, since the day they were born. They are leaders in the sectors in which they operate in. With their products and services, they have revolutionised the telecommunications market in Portugal. And they will not stop here."
Northside Hospital,https://www.crunchbase.com/organization/northside-hospital,"Communities, Fitness, Health Care, Leisure","State-of-the-art facilities with skilled, caring professionals dedicated to the health and wellness of the communities they serve.",
Northern Equity Holdings,https://www.crunchbase.com/organization/northern-equity-holdings,"Financial Services, Photography, Real Estate, Video Editing",Northern Equity Holdings LLC is a privately held company providing affordable housing throughout Maine and New Hampshire.,"Northern Equity Holdings LLC is a privately held company providing affordable housing throughout Maine and New Hampshire through development, acquisition, and preservation. They work within the local community to both strengthen and expand neighborhoods. Their team of experienced and knowledgeable professionals is devoted to creating an outstanding living environment for all of their tenants and a lasting, mutually beneficial relationship with their partners."
Noble Brewer,https://www.crunchbase.com/organization/noble-brewer,"Craft Beer, Subscription Service, Wine And Spirits","Noble Brewer is a unique beer club, shipping members exclusive beers inspired by award winning amateur brewers.","Noble Brewer is a unique beer club, shipping members exclusive beers inspired by award winning amateur brewers. Craft beer lovers have access to exclusive limited release beers not available anywhere else. Our members receive education on beer styles, proper serving temperature and glassware and learn about the amateur brewers whose beers they are drinking. With Noble Brewer, there's a story in every beer. We are based out of Oakland, California."
NOVAMEAT,https://www.crunchbase.com/organization/novameat,"Food and Beverage, Food Processing",NOVAMEAT develops advanced technologies for the production of plant-based meat substitutes.,"NOVAMEAT is a startup aiming to provide new solutions to feed the planet’s growing population with plant-based meat substitutes, overcoming the current unsustainable and inefficient livestock system by creating a healthy, efficient, humane and sustainable food supply. To achieve this vision, NOVAMEAT’s main mission is to develop technologies to produce and commercialize plant-based meat products that are accessible, safe, scalable, and of high quality, thanks to its proprietary technology. NOVAMEAT's patented technologies allow producing plant-based meat substitutes with the same texture, appearance, taste and nutritional properties as a variety of animal meat products, including beef steaks."
Nonin Medical,https://www.crunchbase.com/organization/nonin-medical,"Medical, Medical Device, Sensor",Nonin Medical invented finger pulse oximetry and is a global leader in developing highly accurate noninvasive medical monitoring solutions.,
Nortridge Software,https://www.crunchbase.com/organization/nortridge-software,"Financial Services, Software",Creator of Loan Management Software.,
NOIZ.gg,https://www.crunchbase.com/organization/noiz-gg,"Advertising Platforms, E-Commerce, Information Technology, Internet, Social Media, Social Media Marketing",Flipping the script on influencer marketing in video games,"The premier micro-influencer platform and network for video games. Noiz was founded in 2018 by game and esports industry veterans who have worked with companies like Major League Gaming, Blizzard, IGN, Riot Games, Fnatic, and more. We aim to help both aspiring game streamers and game companies alike reach a wider audience, diversify marketing spend and income streams, and build their own brands easily and professionally."
Noteninja,https://www.crunchbase.com/organization/noteninja,"B2B, Computer, Software","Noteninja, a meeting intelligence platform which has become a popular solution for helping organizations surface and leverage insights.","Noteninja is a conversation intelligence platform for B2B sales and service teams. Noteninja provides game-film of conversations had in your organization that allows for easier training, coaching, feedback, and knowledge transfer to different teams.  "
NOC2 Healthcare,https://www.crunchbase.com/organization/noc2-healthcare,"Hardware, Software",NOC2 Healthcare is a physician-driven network of orthopedic surgeons and neurosurgeons that provides spine care for patients.,"NOC2, LLC, a physician-driven network of orthopedic and neurosurgeons, provides spine care to patients in the United States. It offers EMR, data management, billing, practice management, ICD9 coding, medical marketing consulting, care development, hospital coordination, patient advisory boards, and patient portals. The company was incorporated in 2009 and is based in Nashville, Tennessee."
Novagenit Srl,https://www.crunchbase.com/organization/novagenit-srl,"Health Care, Hospital, Medical, Medical Device","Novagenit Srl researches, develops, manufactures and markets within orthopaedics bioabsorbable implantable medical devices and technology.","NOVAGENIT® researches, develops, manufactures and markets within orthopaedics bioabsorbable implantable medical devices and technology for the preparation of cell and platelet concentrates focusing on innovative therapeutic concepts."
Nozani,https://www.crunchbase.com/organization/nozani,"Consulting, E-Commerce, Internet, Marketing, Software",We help retail companies promote products on Amazon and e-Commerce platforms using our proprietary systems and optimization strategies.,"At Nozani we are your Amazon business navigators; providing around-the-clock innovation. We are an all-inclusive, E-commerce management agency that allows you to focus on running your business.  We believe in doing things better. We are built on integrity and transparency. We’ve created an all-encompassing Amazon development program to take your business to new levels of growth. Nozani sees you as a partner and knows that together we can succeed. We believe in honest relationships. We are investing in you. In order to make your team better we have assembled an elite team to help both businesses and individuals find success on Amazon. With years of experience we offer service including, listing optimization, PPC and keyword research, web design, and video and photo work. We are willing to work with almost any budget, please contact us today to start dominating your online market. With over 300 million active worldwide users, Amazon is the future of e-business. Taking Amazon serious will propel your business to the next level.   "
North American Title Company,https://www.crunchbase.com/organization/north-american-title-company,Real Estate,North American Title Company (NATC) is one of the largest real estate settlement organizations in the United States.,"North American Title Company (NATC) is one of the largest real estate settlement organizations in the United States, handling both residential and commercial transactions. Their network of more than 1,000 associates provides settlement services spanning across all 50 states.   With annual revenues (net of underwriting expense) in fiscal 2015 (November 30, 2015) of approximately $194 million, NATC is among the leading independent title agencies in the United States. Since NATC is not a direct operation of any one national title insurance underwriter, NATC has the unique ability to be an agent for all of the major national title insurance underwriters, including North American's affiliate underwriter, North American Title Insurance Company (NATIC). This ensures that their customers receive the best title insurance products available throughout the entire industry at the best possible rates. Other companies can only offer the insurance products available from their own affiliate underwriters and this grants NATC a truly competitive advantage."
Novotalk,https://www.crunchbase.com/organization/novotalk-ltd,"Health Care, Home Health Care, Medical, mHealth, Therapeutics","Novotalk provides on-demand, self-directed tele-therapy, which allows speech impaired to learn, practice and maintain comprehensible speech.","Novotalk is an online and on-demand, self-directed tele-therapy solution, which allows stutterers to learn, practice, gain, and maintain fluent speech remotely, independently and discretely, throughout their lives."
Nova IVI Fertility,https://www.crunchbase.com/organization/nova-ivi-fertility,Health Care,Nova IVI Fertility is India’s leading chain of fertility centers.,"Nova Pulse IVF Clinic Pvt Ltd [Company] is a subsidiary of Nova Medical Centers Pvt Ltd and runs the IVF business under the brand Nova IVI Fertility (NIF). In 2011, Nova Medical Centers started the IVF Business through a partnership with Pulse Women’s Hospital in Ahmedabad. A year later in 2012, the company entered into a technical collaboration agreement with IVI, Spain to bring world class IVF treatment to India. IVI is a leader in Reproductive Medicine and is one of the largest IVF group in the world. IVI operates 28 centers across 8 countries in Europe, South America and Asia. NIF aims to bring advanced Assisted Reproductive Technology (ART) to India in partnership with IVI. The partnership has resulted in a substantial addition to Nova's IVF services and technology, including proprietary software, training and quality management. While India has seen a significant rise in the number of patients opting for infertility treatments, the numbers are still abysmally low compared to the couples actually requiring medical treatment. One of the major reasons for this is the lack of awareness amongst the public about the basic concept that ‘infertility is a disease that needs to be addressed medically. Nova IVI Fertility was launched with this commitment to offer standardised and ethical infertility treatment, as well as addressing the urgent need for an organized institutional provider for fertility treatment."
"Northern Light Group, LLC",https://www.crunchbase.com/organization/northern-light-group-llc,"Analytics, Apps, Consulting, Information Technology, Internet",Northern Light Group is an internet company offering analytics and market intelligence solutions.,"Northern Light has been providing knowledge management solutions for competitive intelligence and market research insights to global enterprises since 1996. The cornerstone of their business strategy is to be the easiest company to work with that their clients have ever experienced. Headquartered in Boston, Massachusetts, the company is employee-owned and operated, and self-funded through profitable operations. All of Northern Light’s employees share one common characteristic –- a compulsive drive to provide the very best client support possible. They are quite proud of their perfect on-time delivery record on new client portal projects; they have never once been late or over budget on a client project."
Novocall,https://www.crunchbase.com/organization/novocall,"Human Resources, Information Technology, SaaS, Small and Medium Businesses, Software",Novocall is a callback automation platform that helps busines converts web traffic into qualified sales calls.,"Novocall is a callback automation platform that helps busines converts web traffic into qualified sales calls, providing data-driven insights to phone calls and automate the call scheduling processes for sales teams."
Notaroo,https://www.crunchbase.com/organization/notaroo,Information Technology,Notaroo makes loan closings easy with on-demand notary technology.,Notaroo makes loan closings easy with on-demand notary technology.
Nomad Credit,https://www.crunchbase.com/organization/nomad-credit,"Financial Services, InsurTech, Marketplace",Nomad Credit is a financial marketplace for those under-served by other marketplaces.,"Nomad Credit is a financial marketplace for those underserved by other marketplaces. They aim to find the right product for international students and/or visa holders currently or planning to live in the U.S. The main visa holders they serve are F1, J1, L1 and H-1B visas. Nomad Credit allows international students and visa holders to search for education loans, education loan refinancing, personal loans, auto loans, auto insurance, student medical insurance, renters insurance and credit cards. Based upon the information provided in a search, Nomad Credit will provide the potential options for that international student or visa holder to compare."
Nonni's Foods LLC,https://www.crunchbase.com/organization/nonni-s-foods-llc,"Consumer Goods, Food and Beverage, Manufacturing, Retail, Snack Food",Nonni's Foods is a food & beverages company that offers cookies and snacks.,"Nonni’s Food Group is the leading producer, marketer, and distributor of branded premium specialty cookies and baked goods in North America. The company sells products under the Nonni’s, THINaddictives, and La Dolce Vita brands. Headquartered in Oakbrook Terrace, Ill., Nonni’s operates four facilities in Ferndale, N.Y.; Glendale, Ariz.; Tulsa, Okla.; and Montreal, Canada. It produces its traditional biscotti using the original family recipe including real eggs, butter, and gourmet bittersweet chocolate that gives the biscotti a light, crunchy texture that is delicately sweet. The devotion to real quality ingredients is the foundation for the continued success of the company. Nonni’s Biscotti is the number one-selling biscotti in the U.S. and the only national brand sold coast to coast. "
Nongjiang Qianqian,https://www.crunchbase.com/organization/nongjiang-qianqian,"Agriculture, Internet",Nongjiang Qianqian is an agricultural product supply chain service provider based on internet.,
NoxInfluencer,https://www.crunchbase.com/organization/noxinfluencer,"Advertising, Information Technology, Internet, Social Media, Software",Informative Youtuber Stats and Influencer Marketing tools.,NoxInfluencer a totally free statistics tool website.you can find everyting about influencer!
Note,https://www.crunchbase.com/organization/note,"Apps, Mobile, Music",Note is an app that allows users to share music and pictures to their friends through a cell phone app.,Note is an app that allows users to share music and pictures to their friends through a cell phone app.
NootBot,https://www.crunchbase.com/organization/nootbot,"Apps, Software",Messenger chatbot for nootropics (congitive enhancers). Talk and suggest right cognitive enhancers. ,
Nortek Air Solutions,https://www.crunchbase.com/organization/nortek-air-solutions,"Computer, Electronics, Logistics, Manufacturing",Nortek Air Solutions is the largest group of custom air conditioning manufacturers in North America.,
"Novuson Surgical, Inc.",https://www.crunchbase.com/organization/novuson,"Biotechnology, Medical Device",Novuson's DTU technology represents the first substantial innovation in over 25 years for sealing vessels & dividing tissue in surgeries.,"Novuson, a spinout from the University of Washington’s highly regarded Applied Physics Laboratory’s Center for Industrial and Medical Ultrasound, is developing its Direct Therapeutic Ultrasound (DTU) technology platform for coagulation and hemostatic control in surgical and trauma procedures. DTU technology should enable clinicians to perform surgeries more quickly and to rapidly control bleeding associated with traumatic injuries. The company founders are Stuart B. Mitchell, PhD. and Francesco P. Curra, PhD. Novuson creates tools that reduce operational cost and operating time, eliminating bleeding complications and enhancing patient outcomes. These automatic devices use direct therapeutic ultrasound energy for fast and robust hemostasis, cauterization and division. The devices cauterize tissue from the inside out, creating a well-defined, controlled plane of cauterization.   Products will be available for both laparoscopic and open surgical procedures and range from 3mm to 10mm in diameter. This will enables clinicians to seal vessels  up to 7 mm and cauterize solid organ tissue up to 5cm thick. Not Commercially Available For Sale."
Nodus Technologies,https://www.crunchbase.com/organization/nodus-technologies,"Computer, E-Commerce, Marketplace, Online Portals, Software","Nodus Technologies, Inc. is a leading provider of e-payment, e-commerce and business process automation software for Microsoft Dynamics.","Nodus Technologies, Inc. is a leading provider of electronic payment, e-commerce and business process automation software for small and mid-size companies for Microsoft Dynamics GP. Known for superior integration and flexibility of solutions, Nodus enables businesses to integrate Electronic Payment Processing, E-Commerce, Online Bill Pay, Point-of-Sale, CRM and Web-Based Sale Order Entry with multiple banks, processors and back office environments."
nourissh,https://www.crunchbase.com/organization/nourissh,"Food and Beverage, Food Processing","Nourissh is a stealth startup working towards being a leader in the burgeoning food as medicine space,","Home delivered, healthy, ready-made meals. Because when you eat better, you feel better. Gluten, wheat, dairy and preservative free!At Nourissh when you eat better, you feel better."
Novitas,https://www.crunchbase.com/organization/novitas,Security,Novitas was created by a small group of people who are committed to the premise that thinking differently about challenges,"Novitas was created by a small group of people who are committed to the premise that thinking differently about challenges yields transformational results.  We believe that whatever we do, empowering people and organizations to make the best choices for themselves is essential. We have come to learn that the great accomplishments throughout history emerged from the tireless efforts of those who were convinced they could change the world, even when nobody else believed them.  Freeing their minds to all possibilities led to unimaginable advancements in human empowerment, economic prosperity, security, and technology."
North American Substation Services,https://www.crunchbase.com/organization/north-american-substation-services,"Electrical Distribution, Professional Services","North American Substation Services is an independent repair, maintenance and installation provider for electric utility substations.","North American Substation Services (NASS) is an independent repair, maintenance and installation provider for electric utility substations throughout the United States. The company offers transformer, circuit breaker and engineering services to electric utilities, original equipment manufacturers (OEM) and industrial customers. With eight locations throughout the country, NASS is the only independent company of its kind with a nationwide footprint."
NowSourcing,https://www.crunchbase.com/organization/nowsourcing,"Consulting, Data Visualization, Graphic Design, Social Media",Telling great stories - NowSourcing is a nationwide leading infographic design agency.,"NowSourcing is an award winning infographic design agency, specializing in design, video infographics, promotion and interactive infographics. Headquartered in Louisville, KY, NowSourcing's founders originate from New York and bring that New York hustle to the masses."
NorthBay Solutions,https://www.crunchbase.com/organization/northbay-solutions,"Analytics, Big Data, Mobile, Web Development",NorthBay Solutions are a cloud big data and enterprise mobile professional services firm.,"NorthBay Solutions in Boston is a full-service mobile application development, web development, big data and analytics services agency.   NorthBay Solutions provides user experience architecture, visual design, software application development, and quality assurance services to industries including Education, Healthcare, Financial Services, High Tech, Mobile Gaming, Retail, Publishing, Insurance and Non Profit organizations. NorthBay Mobile architects, designs and develops premier mobile applications and mobile games with application analytics.  NorthBay develops mobile applications for enterprise customers, consumer brands, and non profit organizations. NorthBay Web architects, designs and develops corporate websites, secure web portals, and custom web applications. NorthBay Big Data architects, designs and develops big data solutions that leverage Amazon's Data Warehouse product.  NorthBay Solutions also incorporates analytics, business intelligence, and reporting."
Novi Agency,https://www.crunchbase.com/organization/novi-agency,"Advertising, Consulting, E-Commerce, Information Technology, Internet","Full Service Digital Marketing Agency headquartered in Pune, India, focused on delivering results that impact your bottom line.","Novi is a full service Digital Marketing agency focused on delivering results that impact your bottom line. Although our agency was founded in 2017, our team of specialists have been doing marketing since 2008. At Novi we are a team of Strategists, Developers, Marketing Experts, Data Analysts and Conversion Specialists focused on working collectively to help your business grow. We strive to be an indispensable partner to customers we serve. Our goal is to provide you with solutions and guidance you need to meet Rising Demands, Drive Revenue (ROI) and Create meaningful, Long-lasting Relationships with your Customers. As a full-service digital agency, we offer services including: - Business Analysis & Consulting - Digital Marketing Strategy - SEO Management - Email Marketing - Pay Per Click Advertising (PPC) - Content Strategy - Website & Mobile App Development - Conversion Rate Optimization - Web & Marketing Analytics Management "
