Organization Name,Organization Name URL,Categories,Description,Full Description
wiseri,https://www.crunchbase.com/organization/wiseri,"Artificial Intelligence, Crowdsourcing, Employment, Gamification, Recruiting, Search Engine","Wiseri is an online recruitment platform that captivates, guides, and motivates human capital as a resource for enterprises.","""We're brewing something new in wiseri and we're about to break the bubble of traditional job portals, candidate selection and everything else in between, by launching a completely different solution for the digital/IT vertical. wiseri promotes a tangible model, an intelligent selection process through an online platform and crowdsourcing, set out to actually provide an invaluable service both to candidates and companies. We'll bring you together and make sure you meet the right job or the right candidate. It's about time someone set out to do something different."" Wiseri is a job search platform which has a simple and sincere goal: to help as many people as possible find a job and to help businesses find the best candidates. The wiseri selection process ensures that candidates are only presented to companies where they have a good chance of being offered a job, and conversely, that companies are only presented with candidates with the skills and experience they are looking for. In November 2011, wiseri.com secured a round of investment worth 120,000 euros which was provided by 17 investors, all of whom are involved in the digital industries. Crucially for wiseri, this meant they brought to the company not only their money, but also their expertise and experience in the industry. In similar style to the way businesses in Silicon Valley secure seed capital, this investment round did not involve any outside investors or investment funds; but rather, the funds were provided by people who know and believe in what wiseri does. Furthermore, the round of investment was carried out from start to finish in a record time of 37 days and all communication between wiseri and its investors was conducted through email with complete transparency. On 14th January 2012, wiseri revealed a new side of its online platform, a system that sources talent from the crowd to form an expert selection team. In doing so, wiseri became the first company in the job search industry to incorporate gamification and crowdsourcing into its system. Members of the selection team are called Wisors and any job application made through wiseri.com first has to pass through the hands of a Wisor, who selects only those applications best matched to the job position and presents them to the company, taking care to give genuine and useful feedback to each candidate who didn't quite make it to ensure they have a better chance the next time round. And to make sure that the applications are checked by someone who knows what they're doing, only people who have already passed through the wiseri application system can go on to become Wisors; and once you are a Wisor, well, then you can enjoy a whole range of perks along the way, saving up wirees (wiseri's currency) as you go that you can cash in for a whole load of prizes.?"
WIZEE,https://www.crunchbase.com/organization/wizee-2,"Brand Marketing, Celebrity",Connecting A-list Celebrities and Brands,"We connect Brands and primetime Celebreties in order to enhance advertising & pr campaigns.  Some of our clients : L'Oreal, Visa, Longchamp, BMW, Casio, Nokia, Playstation, Orange, RedBull, André, Blackberry, GQ, Clarins, Vogue, Lacoste, Havas, Publicis Group, WPP, Omnicom."
WISK Solutions,https://www.crunchbase.com/organization/wisk-solutions,"Restaurants, Software, Wine And Spirits",WISK is the most accurate and precise inventory solution! ,WISK is the most accurate and precise inventory solution! Cut the time spent counting inventory and compiling data. 
WindPole Ventures,https://www.crunchbase.com/organization/windpole-ventures,"Analytics, Big Data, Information Services","WindPole Ventures, a tall tower data source, provides real-time, hub height standardized wind speed data from a portfolio of tall towers.","WindPole sells actual hub height wind resource data that solves two problems: 1) historical wind data that de-risks and improves finance terms for wind power development projects, and  2) real-time data based wind forecasting that improves operational effectiveness for utilities, grid operators, wind farm operators, and power traders.      WindPole installs weather monitoring sensors and systems on existing narrow faced, 80+ meters (hub height), broadcast towers.  Each tower is polled every five minutes to compile real-time wind resource data.  WindPoleâ€™s clients include five of the top ten wind developers, grid operators, and industry analysts."
WineTracker.co,https://www.crunchbase.com/organization/winetracker-co,"Internet, Lifestyle, Wine And Spirits",Winetracker.co enables wine drinkers to snap photos of the wine they drink to create a full-screen catalogue of their wine drinking history.,"Winetracker.co is a visual wine tracking app that enables wine drinkers to snap photos of the wine they drink to create a full-screen catalogue of their wine drinking history. It can be accessed via mobile devices and desktops. Winetracker.co was launched in 2015 by Tony Jacobson and is operated from Woodinville, Washington."
Wirtgen Group,https://www.crunchbase.com/organization/wirtgen-group,Construction,Wirtgen Group is an internationally operating group of companies in the construction machinery sector.,
Wifi Dabba,https://www.crunchbase.com/organization/wifi-dabba,"Internet, ISP",Wifi Dabba provide wifi network that keeps you connected.,"We're a new kind of network. The high speed kind of network. We're going to provide insanely cheap wifi across Bangalore city. The government's not gonna do it, the big companies shouldn't be allowed to do it. It's up to you and we to just do it."
Wimao,https://www.crunchbase.com/organization/wimao,Industrial,Wimao works to promote a circular economy and to find new ways of utilizing recycled raw materials.,"Wimao is passionate about ecological composites. Their operations are based on patented technology. They work to promote a circular economy and to find new ways of utilizing recycled raw materials and industrial side streams. Their company was established in 2016 to commercialize the patented production technology. In 2018, after careful product and process development, their first production plant became operational in the Kukkuroinmäki area in Lappeenranta, where they also work in close collaboration with (waste management company) Etelä-Karjalan Jätehuolto Oy."
Wishfie,https://www.crunchbase.com/organization/wishfie,"Apps, Content, Internet, Video Editing",A platform for people to express their opinions in form of short videos around any topic.,"Who we are Launched in 2017 in Bangalore, India by Durgesh Kaushik and Akshay Pruthi, Wishfie aims to solve the problem statement - There’s no seamless, collaborative solution for collecting public reactions on various topics including interests, questions, events or news or in video format. Wishfie is a mobile app where you collaborate with friends and like-minded people to create interesting videos in an easy-to-consume, exportable format. We see an emergence of new social graph with Wishfie at the forefront of video collaboration space.  Vision Wishfie's goal is to be the go-to-platform for people to express their opinion or share their knowledge on any topic, resulting in a valuable knowledge-base and a repository of interesting video content created by people around the world."
Wiktik,https://www.crunchbase.com/organization/wiktik,"Internet, Software","Wiktik is a 100% free professional advertisement site (training, employment, service, financing, real estate pro). ","Wiktik is a 100% free professional advertisement site (training, employment, service, financing, real estate pro).  Launched in August 2011, Wiktik already has more than 10,000 ads viewed by 200,000 professionals among which, 30,000 became active members and 10,000 companies have referenced. The linking between users is done through a matching algorithm."
Wipro Digital,https://www.crunchbase.com/organization/wipro-digital,"Cyber Security, Digital Media, Internet of Things","Wipro Digital, the digital business unit of Wipro","Wipro Digital is a mix of strategists, creative directors, designers, writers, media strategists, digital marketers, developers and relationship builders. They’re committed to creating vibrant and relevant brand experiences on every level."
Wilshire Associates,https://www.crunchbase.com/organization/wilshire-associates,"Advice, Analytics, Finance","Wilshire Associates is an investment advisory firm that specializes in investment products, consulting services, and technology solutions.",
WineDirect,https://www.crunchbase.com/organization/winedirect,"E-Commerce, Internet, Marketing, Software",WineDirect helps wineries and wine retailers sell more wine direct-to-consumer.,"WineDirect is the leader in winery direct-to-consumer (DTC) services including ecommerce, point-of-sale, wine club, fulfillment and marketplace distribution solutions. In an era of rapidly increasing consumer expectations, our unique end-to-end platform enables wineries to provide next-level service and create customer relationships that last.  Serving more than 1,600 wineries worldwide, WineDirect is headquartered in Napa Valley with offices in Paso Robles, CA; Santa Maria, CA; Glenwillow, OH; Vancouver, BC; and McLaren Vale, Australia. Learn more about how we are helping wineries succeed with DTC at www.winedirect.com"
WizEvo,https://www.crunchbase.com/organization/wizevo,Smart Home,Home smart,
Wing Ma'am,https://www.crunchbase.com/organization/wing-ma-am,"Internet, LGBT, Mobile",Wing Ma'am is a mobile application for LGBT women.,"Wing Ma’am is a mobile application that uses location-based technology to safely connect its users with other LGBT women in their area. Through the application, its users have the ability to chat, message, and connect with the othes. Wing Ma’am also allows its users to create their own events to find like-minded people. It was launched in 2012 by Ariella Furman. The application is operated from Pittsburgh, Pennsylvania."
Wisconsin Veterans Chamber of Commerce,https://www.crunchbase.com/organization/wisconsin-veterans-chamber-of-commerce,"CivicTech, Social",Serves veterans and military families by supporting veteran owned and veteran friendly businesses across Wisconsin.,"The Wisconsin Veterans Chamber of commerce is a nonprofit organization dedicated to supporting military veterans, veteran-owned and veteran-friendly businesses. On behalf of our members we serve as an advocate for Wisconsin’s veteran business community, and promote economic opportunity for military veterans, military families, and veteran-friendly businesses."
Wilbur-Ellis,https://www.crunchbase.com/organization/wilbur-ellis,Chemical,"Wilbur-Ellis is a marketer and distributor of agricultural products, animal feed, and specialty chemicals.","Founded in 1921, Wilbur-Ellis is a leading international marketer and distributor of agricultural products, animal feed and specialty chemicals and ingredients. By developing strong relationships, making strategic market investments and capitalizing on new opportunities, Wilbur-Ellis has continued to grow its business with sales over $3 billion."
Winnett Perico,https://www.crunchbase.com/organization/winnett-perico,"Hospitality, Logistics, Organic, Organic Food, Supply Chain Management, Wholesale",WinnettOrganics operates in the $9.7 billion fresh foods segment of the rapidly growing organic foods specialty market.,"WinnettOrganics operates in the $9.7 billion fresh foods segment of the rapidly growing organic foods specialty market. Organic sales are up from $1 billion in 1990 to $36.5 billion in 2013. Industry growth has been slowed to 9.5% (about $3 billion) annually by chronic product shortages. The Company will grow from $5.6MM to over $600MM in five years by capturing 10% of the organic fresh foods market growth, becoming a dominant supplier in the process. We took $11 million in orders in one week and then stopped taking orders due to our lack of capital. We have taken $16 million in orders to date.    http://www.thestreet.com/story/13200414/1/united-natural-foods-is-in-the-market-for-acquisitions.html?puc=yahoo&cm_ven=YAHOO This link tells the story of organic fresh foods companies purchased for nine times revenue."
Wicked Loot,https://www.crunchbase.com/organization/wicked-loot,"Content, Gaming, Web Development",Wicked Loot is a game development studio that focuses on making games with user-generated content.,"Wicked Loot is a game development studio unlike any other. It’s in their DNA to interact with their fans. First, they focus on making games that feature user generated content. Their mod platform makes it wicked easy for gamers to create their own content and share it with others. Second, they capture what it’s like working in an indie dev studio and share it with you. That’s where this site comes in. It’s not just game dev stuff. It’s everything that inspires us. It could be other games they play. It could be movies they watch. It could be you. Game development is some hard stuff and they need constant inspiration."
WindPipe,https://www.crunchbase.com/organization/windpipe,"Hardware, Software",WindPipe Corporation develops and delivers wind energy conversion systems for the renewable energy sector to produce electric power.,"WindPipe Corporation develops and delivers wind energy conversion systems for the renewable energy sector to produce electric power. WindPipe Corporation was incorporated in 2010 and is based in Longmont, Colorado."
Wide Open Agriculture,https://www.crunchbase.com/organization/wide-open-agriculture,"Agriculture, Financial Services, FinTech, Food and Beverage",Wide Open Agriculture is a vertically integrated food and agriculture business. ,"Wide Open Agriculture is a vertically integrated food and agriculture business. Wide Open Agriculture are seeking strong, sustainable financial returns and are committed to making a positive impact on the communities and ecosystems in which we operate."
Windmill Engineering,https://www.crunchbase.com/organization/windmill-engineering,Software,Tilting at Cloud-Based Development,"Developer of a software development platform created facilitate cloud-based developer tools. The company's platform provides continuous feedback to make developers more productive, enabling developers to get simple and easy way to make developer tools."
Wisr,https://www.crunchbase.com/organization/directmoney,"Finance, Financial Services, Lending, Marketing",DirectMoney launched a major company rebrand to Wisr offers a unified service platform that provides retail investment and lending services.,DirectMoney combines retail investment and lending services in a unified service platform. It enables investors to directly invest in personal loans via a regulated investment product.  Investors buy units in the DirectMoney Personal Loan Income Fund. Successful borrowers enter into loan contracts managed by DirectMoney. Borrower interest is paid to investors after deducting of loan losses and management fees.  Borrowers with good credit and employment history will be offered rates that are priced according to their credit rating. This is an innovation in the Australian market where lenders usually offer only one rate based on a single credit grade. DirectMoney is positioned at the at the regulated mainstream end of the peer-to-peer (P2P) lending industry.
Wishpot,https://www.crunchbase.com/organization/wishpot,"E-Commerce, Internet, Shopping, Social Media",Wishpot is a free shop-all-over wish list and registry service!,"Wishpot was founded in 2006 in Seattle by veterans of Microsoft and is backed by angel investors including Adrian Hanauer of Curious Office Partners, an innovative Seattle investment company and incubator. Hanauer was a seed investor in aQuantive (NASDAQ: AQNT) which Microsoft recently agreed to purchase for $6 billion, an early investor in Amazon.com (NASDAQ:AMZN) and most recently co-founder of ImageKind. Wishpot is a free social shopping service that makes it easy to save and share interesting things you find in stores and online. Items are easily collected online or from stores and organized using simple online lists. Lists and items can be kept private or shared with others. You can collect and discover products you like, recommend your favorite stuff, share and explore gift suggestions or ask for opinions and advice."
Wildcat Discovery Technologies,https://www.crunchbase.com/organization/wildcat-discovery-technologies,Clean Energy,Wildcat Discovery Technologies is a developer of materials for the use in batteries.,
WIN Advanced Systems,https://www.crunchbase.com/organization/win-advanced-systems,"Hardware, Software",WIN Advanced Systems Ltd develops casino management software and hardware systems and lottery terminals.,"WIN Advanced Systems Ltd develops casino management software and hardware systems and lottery terminals. It also develops server based platforms. The company is based in Valletta, Malta."
Winni,https://www.crunchbase.com/organization/winni,"E-Commerce, Gift, Internet",Express gift delivery at the chosen time for long distance relations and busy individuals.,"Ever felt in a need to send cake or flowers or any gift to a special person in your life but not able to find a suitable website on whom you can trust. Well here is an answer, Winni.in establishes itself into the online gifting market by providing customers cakes from best bakeries of town and flowers from best florists and similarly gifts like soft toys, greeting cards, photo frames etc. from one of best brand, so that customers can stay relaxed trusting the quality of products that Winni is going to deliver. Winni offers some distinctive services in online gifting space like branded gift items, reasonable prices, facility to choose both delivery date and time, capture the moment, variety of gift wrap options as well as midnight delivery to excite things little more. Founded with an objective of providing a reliable and credible gifting solution, Winni has established itself as a promising online gifting solution within a short span of time.  ""The motto of this gifting portal with a unique human touch is to celebrate beautiful human relations and emotions,"" says Sonali Gour, founder of the website. Winni currently delivers in Bangalore, Hyderabad, Pune etc but plans to expand to other cities soon."
Windak,https://www.crunchbase.com/organization/windak,"Industrial Automation, Packaging Services",Windak is a specialist in cable packaging machinery originating in Sweden 1994.,"Windak is a specialist in cable packaging machinery originating in Sweden 1994. Their first order was to Volvo for a complete pallet handling packaging system. From 1994 tо the present day their innovative technologies include high speed rewind lines for fiber optic cable, fully automatic spooling lines, versatile coiling lines, a multitude of palletizers and breakthrough coiling solutions for packaging cable products into boxes or bags. Today Windak is the largest supplier of automatic packaging equipment for the cable industry in North America. They have delivered their products to 30 countries worldwide and their customers are the leading companies in the industry."
WiGo Trips,https://www.crunchbase.com/organization/wigo-trips,"Adventure Travel, Internet of Things, Marketplace, Peer to Peer, Sharing Economy, Social Network, Travel",P2P trip sharing marketplace and travel community. Earn money sharing your upcoming trips with new friends.,"At it's core WiGo is a trip sharing platform. An app by travelers for travelers, with the end goal making travel accessible, connecting people, & crossing items off the bucket list. WiGo allows people to plan a trip, post it, & open it up for ANYONE to go on (friends, family, or complete strangers). All you have to do is request to join, get approved, and pay. Like that, you're about to take your next adventure instead of dreaming about it."
wiseGEEK,https://www.crunchbase.com/organization/wisegeek,Internet,wiseGEEK is an online archive of common questions and answers that covers diverse categories.,"wiseGEEK is an online archive of common questions and answers that covers diverse categories. These include technology and gadgets, business and economy, internet and computers, adult education and training, food and cooking, language and the humanities, manufacturing and industry, beauty and personal care, anatomy and physiology, health and wellness, transportation, finance and investing, fashion, fitness and health, art and music, medicine, science and engineering, people, history and the government, sports and hobbies, and more. wiseGEEK was launched in 2003 by Denis Grosz and is operated from Sparks, Nevada."
Wildlife Conservation Society,https://www.crunchbase.com/organization/wildlife-conservation-society,Non Profit,The Wildlife Conservation Society saves wildlife and wild places worldwide.,"The Wildlife Conservation Society, founded in 1895, has the clear mission to save wildlife and wild places across the globe. During our 115 years, they have forged the power of global conservation work and the management of the five parks in New York City to create the worldâ€™s most comprehensive conservation organization."
"Windyty, SE",https://www.crunchbase.com/organization/windyty-se,"Apps, Machine Learning, Mobile, Software","Windyty shows wind and weather visualisation in a completly new way. It is an essential app for kiters, pilots, sailors, skydivers, etc.",
Wize,https://www.crunchbase.com/organization/wize-834b,EdTech,Online Education Platform for Gen Z,"Wize is an online education platform that offers University students across Canada instant access to the highest quality exam prep courses on the market. This cutting-edge platform offers students the tools and resources they need to prepare for their exams in less time, with less stress, at a lower cost than traditional resources. By supercharging the learning experience, Wize helps students to take their understanding of their course material to new heights. Taught by expert instructors and tailored to a specific class at a specific university, Wize provides students with the flexibility to learn at their own pace at any time and from anywhere. Whether a student falls behind, wants to get ahead or just needs more time with difficult concepts, with Wize - it’s just one click away."
Win-Win Group,https://www.crunchbase.com/organization/win-win-group,"Finance, Financial Services, Mobile Payments",Financial technology company based in Beijing.,"Financial technology company based in Beijing,providing mobile payment solutions for new retail software and hardware manufacturers."
Wildberries,https://www.crunchbase.com/organization/wildberries,"Consumer Goods, E-Commerce, Fashion, Retail","Wildberries is an e-commerce company working with famous brands to offer apparel, fashion goods, and electronic items.","Wildberries is an e-commerce company working with famous brands to offer apparel, fashion goods, and electronic items. The company offers a catalog is more than 10,500 brands to more than 3,000,000 people visiting its site  on a daily basis.  Headquartered in Moscow, the company employs more than 25,000 employees throughout Russia, Belarus, Kyrgyzstan, Kazakhstan and Armenia."
Wichita Geri Psych Services,https://www.crunchbase.com/organization/wichita-geri-psych-services,"Consulting, Health Care, Information Technology",Wichita Geri Psych Services,
Wiland,https://www.crunchbase.com/organization/wiland,"Advertising, Marketing, Retail",Wiland is a leading provider of marketing intelligence and data-driven marketing solutions.,"Wiland is a leading marketing intelligence company serving many of the nation's top companies and organizations. They provide solutions to thousands of clients in a wide variety of markets and industries. Leveraging Their vast transactional database, innovative analytical methodologies, and advanced technology, Wiland delivers a comprehensive set of services that drive client success."
Wiperts.com,https://www.crunchbase.com/organization/wiperts-com,"Consumer, Privacy, Security, Service Industry",PREVENTING IDENTITY THEFT BY REMOVING YOUR PERSONAL DATA FROM UNAUTHORIZED SITES AND DATA BROKERS.,"With the large increase in internet usage and the advent of social media, our privacy is being compromised like never before. Our personal information is bought, sold, and used by a variety of third party companies, advertisers, and scam websites. Information that we want kept private is being shared in ways that can endanger our privacy, safety, well-being, and security. Many of us are shocked and upset when we find our data being freely shared online without our knowledge or consent. There is a way to fight back. At Wiperts, we are committed to protecting your personal information. We are expert at what we do and we are determined to remove your private data from all websites. Initializing a complete search to find out exactly where your info is showing up. Then carefully remove each instance we find. We have a 99% success rate of finding and removing personal data. We are reliable, and we provide the highest level of quality service to our customers. Our goal is to always exceed industry standards."
