Organization Name,Organization Name URL,Categories,Description,Full Description
Ubity,https://www.crunchbase.com/organization/ubity,"SaaS, Software, Telecommunications, Video Conferencing, VoIP",Business cloud-based VoIP & Unified Communications Solutions,"Ubity provide cloud-based VoIP & Unified Communications Business Solutions as an alternative to traditional phone system. VoIP has many assets over a ""traditional"" telephone system : it's economical, scalable, secure, robust, perfect in a business continuity plan and perfect for mobility with great manageability. UB-VoIP is a fully hosted system, requiring no equipment or maintenance, that offers a variety of functions unavailable to typical telecom providers and facilitate communication between your employees, partners and customers. Thanks to UC (Unified Communications), VoIP can for example integrate with your CRM / ERP.  * Toll free numbers 8xx in all North America * More than 700 canadian cities : Montréal, Toronto, Ottawa, Québec, Laval, Longueuil, Sherbrooke, Trois Rivières, Gatineau, Hull, Saguenay, Saint Jean sur Richelieu, Drummondville, Saint Jerome, Sainte Hyacinthe, , Calgary, Edmonton, Vancouver, Mississauga, Halifax, Winnipeg, Saskatoon, Moncton, Vancouver, Calgary, Edmonton, Victoria, Mississauga....  * More than 1 850 american cities : Boston, Chicago, Miami, New York, Los Angeles, Houston, Philadelphia, San Diego, Dallas, Phoenix, Detroit, San Antonio, San Jose, Indianapolis, San Francisco, Baltimore, Jacksonville, Columbus, Milwaukee, Memphis, Washington, Seattle... * More than 43 countries :  Argentina, Australia, Austria, Belgium, Brazil, Denmark, Finland, France, Germany, Ireland, Israël, Italy, Japan, Luxembourg, Mexico, Neitherlands, Norway, New-Zealand, Spain, Switzerland, United Kingdom....."
Ubiant,https://www.crunchbase.com/organization/ubiant,"Energy Efficiency, Internet of Things, Power Grid, Smart Building",Ubiant created technology solutions to make buildings and smart objects.,"Ubiant can especially draw on its unique expertise in managing complexity and contingencies based on the multi-agent system technology (MAS) and artificial intelligence. Just like a colony of ants, a multi-agent system is conducive to producing a collective form of intelligence due to the interaction between a sufficiently large number of non-intelligent elementary entities acting within a close radius of each other. Ubiant’s intelligent building block is the end result of 10 years of research and development by a team of eight researchers, most of whom hold doctorates in distributed artificial intelligence reactive or cognitive MAS systems."
Ubiq,https://www.crunchbase.com/organization/ubiq-c156,"Apps, Blockchain, Ethereum",Ubiq is a decentralized platform which allows the creation and implementation of smart contracts and decentralized applications. ,"Ubiq is a decentralized platform which allows the creation and implementation of smart contracts and decentralized applications. Built upon an improved Ethereum codebase, the Ubiq blockchain acts as a large globally distributed ledger and supercomputer, allowing developers to create decentralized and automated solutions to thousands of tasks which today are carried out by third party intermediaries. "
Uberpass,https://www.crunchbase.com/organization/uberpass,"Mobile, Mobile Payments, Payments",Uber of Passbook,
UberPrints,https://www.crunchbase.com/organization/uberprints,"E-Commerce, Fashion, Internet",UberPrints allows customers to design their own custom t-shirts on the web.,
Ubiquity.ai,https://www.crunchbase.com/organization/ubiquity-ai,"Artificial Intelligence, Information Services, Information Technology",Ubiquity.ai is a Real Time Prescriptive Modeling Platform.,
"UBMobile, Inc.",https://www.crunchbase.com/organization/ubmobile,"Communities, Information Technology, Market Research, Mobile",UBMobile is an engagement and insights technology company for marketing decision- making.,"UBMobile is an engagement and insights technology company that powers marketing decision- making. Using modern technologies, we capture stated and observed consumer data to improve marketing decision making. It’s our mission to unleash brands from desktop-only research to deliver more representative audiences, reliable insights, and brand growth. For more information, please visit www.ubmobile.com or contact us contact@ubmobile.com."
ubivent,https://www.crunchbase.com/organization/ubivent,Public Relations,"ubivent provides solutions and offers services for online events, virtual conferences, and online fairs.","ubivent develops and provides solutions for virtual events and offers services for online events, virtual conferences, and online fairs. This allows companies (a) to reduce event costs dramatically, (b) to contribute to a sustainable economy, and (c) to extend the reach of events! Typical examples are virtual corporate events (e.g. online conferences and virtual kick-offs) and virtual public events (e.g. online career fairs and virtual trade shows). With customers like BASF, Microsoft, Roche, and SAP, ubivent is Europe’s leading virtual event provider. Also numerous small and midsize companies are among the clients of the award winning IT company."
Ubot,https://www.crunchbase.com/organization/ubot,Software,UBot Studio enables users to make software bots to automate browser operations.,"UBot Studio enables users to make software bots to automate browser operations. With built-in support for proxy flipping, CAPTCHA outsourcing, and bot compiling, users without any programming skills can create bots to run on autopilot 24 hours a day, 7 days a week.  UBot Studio offers Visual Scripting Language (VSL), a “Drag & Drop” interface, and an extensive function library to enable users to develop personalized bots. UBot Studio was launched in 2009."
UbiTech,https://www.crunchbase.com/organization/ubitech,"Information Technology, Internet, iOS, Mobile, Telecommunications, Wireless",UbiTech has developed UBiNET to enable mobile devices to communicate directly with each other through a cooperative wireless network.,"UbiTech has developed an innovative software solution UBiNET(TM) to enable mobile phones and other devices to communicate directly with each other through the creation of a cooperative wireless network using voice, video and data. In the absence of a wireless network infrastructure, UBiNET equipped phones can form their own network to provide local or on site personal communications. UBiNET software offers the convenience and cost saving of using smart phones for both on-site and cellular communications. Ubility is the first application developed by UbiTech that utilises the UBiNET platform in order to implement a new generation of ubiquitous push-to-talk (PTT) communication system."
Ubex AI,https://www.crunchbase.com/organization/ubex-ai,"Advertising, Blockchain, Cryptocurrency, Internet","UBEX is a global decentralized advertising exchange, operating fully on the basis of neural networks with the use of blockchain.","UBEX is a global decentralized advertising exchange, operating fully on the basis of neural networks with the use of blockchain and smart contracts. "
UB-04 Software,https://www.crunchbase.com/organization/ub-04-software,Software,"UB-04 is software that allows you to fill in forms on your computer, then print the data or even submit the claim form electronically.","UB-04 is a medical form filler software company.  They specialize in software for HCFA-1500 EDI Clearinghouse forms, UB-04 EDI Clearinghouse forms, HCFA-1500/CMS 1500 Fill & Print NPI forms, UB-04/CMS 1450 Fill & Print NPI forms, Dental Association Fill & Print EDI forms, and more.  UB-04 Software is comprised of experts in the field of medical form processing so they can help your company with any medical billing questions.  Visit UB-04software.com to start saving time and money today."
Ubims,https://www.crunchbase.com/organization/ubims-inc-,"E-Commerce, FinTech, Logistics, Mobile, Supply Chain Management",A Complete 3D Reinvention of the Global Supply Chain Process,"UbiMS operates a cloud-based meta-platform that serves the worldwide physical supply chain process by connecting multiple providers of goods with multiple clients. It uses blockchain technology to reshape the method of handling business data, adapting to shifting consumer demands, and coordinating the flow of goods around the world. UbiMS is built with voluntary participation and conducts transactions between global providers and local customers. It has also streamlined supply chain networks for all sorts of products with different sizes and prices. Unlike traditional 2D systems, UbiMS spends 30% less time in transit."
UBA Biologix,https://www.crunchbase.com/organization/uba-biologix,"Biotechnology, Mining, Water Purification","UBA Biologix cleans industrial wastewater from coal, gold, and platinum mines with an organic bioremediation system.","UBA Biologix specializes in the development of water treatment systems that rely on the biological breakdown and removal of contaminants in mining and industrial waste waters.  UBA Biologix is contracted by mining companies, such as the global mining giant Anglo American, to remove toxic chemicals, such as sulfate and selenium species, from effluent, recycling them into valuable re-sellable commodities. UBA Biologix was initially created to reduce the levels of sulfate in mine wastewater in South Africa. Today, UBA Biologix offers its customers a customised solution for a breadth of water contaminants around the world."
Ubiquity s.r.l.,https://www.crunchbase.com/organization/ubiquity-s-r-l,Internet,"Ubiquity s.r.l. is an other licensed operator telephone operator, provides mobile messaging services to large enterprises in Italy.","Ubiquity s.r.l. is an other licensed operator telephone operator, provides mobile messaging services to large enterprises in Italy."
UBIMET,https://www.crunchbase.com/organization/ubimet,"Environmental Consulting, Mobile",UBIMET is a worldwide weather service provider. They continually refine their weather model,UBIMET is a worldwide weather service provider. They continually refine their weather model
Uberblic Labs,https://www.crunchbase.com/organization/uberblic-labs,"Data Integration, Software","Uberblic labs is a company that design data-driven applications, and build them for bussinesses.","Data integration services for web and enterprise data, providing developers with API solutions for thus far untapped information sources."
UBsports Inc.,https://www.crunchbase.com/organization/ubsports-inc,"Sports, Wellness","Olympians & pros in all 100 sports blog & curate the only social video wellness & equipment site for Athletes, Coaches & Trainers in the US ","UBsports is the most inclusive, exciting community of amateur, Olympic and pro sports on the Web, where all athletes, coaches, their fans and their families meet and share their sports lives, no matter how young or old, what sport they play, how well they play it, or where they live.  All the best resources on the Web can be accessed directly through the UBsports SportPortal system, usually with 2 clicks.  With the best pro and Olympic players curating, blogging and leading our members to the resources they use themselves, our members can be sure that they are getting the best information, insights and skills to reach their athletic goals.  Our SportPortals, each curated and hosted by an Olympic, nationally ranked or pro athlete, teach novices how to play, with all the rules, info, insights and videos they need.  They then support the athletes' further growth with intermediate and advanced training tools, skills and drills videos, competition videos, connections to new teams and leagues, mentors and coaches, notices of tournaments and connections to the organizers, and set them up to be recruited to higher levels, teams and schools.   UBsports also has the best free tools to support Groups, Leagues, Teams and Schools, allowing them to highlight their members, communicate with fans, post and revise schedules, and constantly communicate, real-time, with their members and fans.  Each team or club lives among its peers, under the umbrella of its league, school or district, which then lives within its organizing body, all within their sport, all sharing their resources, ultimately so that all their athletes grow to be the best athletes they can be.  UBsports is the first true egalitarian sports ecosystem, where all sports, no matter how large or small, have equal footing and resources, and any athlete can cross train or move seasonally from one of their sports to the other, seamlessly and in the company of other athletes, competitors, coaches, friends and fans.     Because of our reach across over 100 sports played around the world, UBsports' tools and services enable athletes to pick up and play new sports, providing all the info, videos, insights, rules, connections and equipment they need to reach their sports goals in all sports, and maximize their enjoyment of their sports lives.   Our Personal Portals ROCK!  Each member's own Home Page offers them infinite opportunities to personalize their experience and to access all the resources, videos and sites they want to use .. not just sports-related, but all over the Web!  So you don't have to hunt around for the bookmarks on your Browser:  Just come to UBsports, join, and build your own UBsports experience.   Bring Your Sports Life - okay, your whole online life - to UBsports! Please contact Greg Burton, CEO with any questions, suggestions or ideas 631-702-5115 (talk/text) greg@ubsports.com "
Ubeeqo GmbH,https://www.crunchbase.com/organization/ubeeqo-gmbh,"Information Technology, Mobile",We specialize in innovative and multimodal mobility solutions for enterprises and public authorities,
UBELONG,https://www.crunchbase.com/organization/ubelong,Non Profit,They empower people like you to volunteer and learn abroad.,"UBELONG offers safe and affordable short-term volunteering opportunities in Asia, Latin America and Africa.   UBELONG is based in Washington, DC and led by volunteers and university professors."
uboot.com,https://www.crunchbase.com/organization/uboot-com,Web Hosting,social network,uboot.com started in 2000 as Europe's first online community.
Ubikey,https://www.crunchbase.com/organization/ubikey,Software,Ubikey offers its customers a complete and innovative solution to foster creativity and decision-making during collaborative work meetings.,Ubikey offers its customers a complete and innovative solution to foster creativity and decision-making during collaborative work meetings.
UBIVIS,https://www.crunchbase.com/organization/ubivis,"Information Technology, Internet of Things, Machine Learning, Software",UBIVIS offers a complete solution to optimize its industrial operation via IoT System for data collection exchange and cognitive analysis.,"Ubivis offers a complete solution to optimize its industrial operation via an IoT System for data collection and exchange and cognitive analysis for Machine Learning. It also modernizes its manufacturing process thru upgrading its machinery by adding a device, providing a technological leap for the new ""Industry 4.0""."
Ubuntu Med,https://www.crunchbase.com/organization/ubuntu-med,"Education, Health Care, Information Technology, Personal Health, Wellness",A collaborative educational platform creating shared educational resources to improve provider and patient education.,
Ubiz Accelerator,https://www.crunchbase.com/organization/ubiz-acceleration,"Business Development, Consulting, Financial Services","Driven by advisors, Ubiz is the Business Development & Funding (up to investment) accelerator to early stage startups.","Ubiz is the accelerator for early stage tech startups. We currently focus on 2 main areas : business development & funding. Concerning the business development part, we have a focused acceleration program driven by mentors with a successful entrepreneurship experience. This relationship includes as well capital raising in case you need it to support your growth. In the case you are only looking for funding (& not looking for business development contacts), we provide as well corporate financial advisor services for amounts between 500k & 2m €. We are currently based in Brussels, with operations in Europe & Africa."
Uber Duka,https://www.crunchbase.com/organization/uber-duka,"E-Commerce, Marketing, Marketplace","Uber Duka is a community marketplace for Art, Crafts and Designs from Africa.","Uber Duka is a community marketplace for Art, Crafts and Designs from Africa.  It connects African artists, designers and craftsmen with handmade enthusiasts from around the world in a way that mirrors an actual, social and vibrant African marketplace. People can build networks based on shared interests, get updates from the creatives in their networks and receive a real-time feed of what trends, brands and products the community is talking most about."
UbiStor,https://www.crunchbase.com/organization/ubistor,"Consulting, Enterprise, Information Technology, Infrastructure, Software","UbiStor, Inc. is a privately held, vendor-independent information technology services company.","UbiStor, Inc., is a privately held managed services company founded in 2001 by a group of seasoned Fortune 500 executives having decades of experience in the disaster-recovery and business-continuity arena. UbiStor possesses core competencies that include: - Data Protection and Disaster Recovery-as-a-Service (DRaaS) - Enterprise-Wide Data Management - Infrastructure-as-a-Service (IaaS) Solutions They know that nearly every action in business is affected by good data management. They provide high-quality, cost-effective managed services with a consultative approach, making sure you understand how technology can galvanize new opportunities. At the highest level of execution, They are focused on helping you Protect, Manage, and Access data and information, emphasizing proactive response in the evolving business discipline of enterprise-wide data management."
Ubitel Insurance,https://www.crunchbase.com/organization/ubitel-insurance,"Financial Services, Insurance",Risk-adjusted car insurance for safe drivers,Ubitel - car insurance provider in Baltics.  At Ubitel we price drivers based on their actual driving parameters. Unlike our competitors we make sure good drivers pay less and bad drivers are motivated to drive more safely.
ubykuo,https://www.crunchbase.com/organization/ubykuo,"Artificial Intelligence, Big Data, Machine Learning, Product Design, Software Engineering, UX Design","Custom Digital Product and Services Design, Development and Optimize","We love to solve your problems designing and developing digital products with amazing look and feel, great performance and scalability and the perfect fit price for value for our customers. Our motto ""The coolest software company"" comes from our vision to create a fresh, open, collaborative and innovative environment for great people coming together and enjoying designing and building amazing products and services that help our customers achieve value for their businesses"
Ubrain Inc,https://www.crunchbase.com/organization/ubrain-inc,"SEO, Web Development","Ubrain Inc is a graphic design company that develops mobile application UI, webpage UI, and also provides quality assurance.",
UbiqPay,https://www.crunchbase.com/organization/ubiqpay,"E-Commerce, Electronics, FinTech, iOS, Mobile, Mobile Payments","UbiqPay Pte Ltd operates an electronic payment service that allows consumers to pay for purchases, pay their bills and transfer money.",
UberSignal,https://www.crunchbase.com/organization/ubersignal,"Customer Service, E-Commerce, Mobile, Wireless",UberSignal is used to eliminate dropped calls and increase data speeds with a signal booster.,"Ubersignal provides cell phone signal booster solutions for situations where you have bad cell phone reception in your home, office or vehicle."
Uber Bazaar,https://www.crunchbase.com/organization/uber-bazaar,"Art, E-Commerce, Internet, Printing",Online Poster Store India,"OyeBazaar.com is an online store for posters and prints in India. They primarily import posters and prints from the US and across Europe for customers in India who don't have direct access to them. The database is large and gives everyone plenty of options to choose from. Along with that, this site is trying to break the hold of large physical retail chains that sell posters that are procured locally. Imported posters are delivered within 2-3 weeks and posters available locally or that are in stock are delivered within 2-3 days. Based in Bangalore, it was founded by a team of entrepreneurs who have varied experience in the e-commerce and manufacturing fields."
UBC Media Group,https://www.crunchbase.com/organization/ubc-media-group,"Advertising, Broadcasting, Media and Entertainment","UBC Media Group is a family of companies, working in related areas of production, content creation and software design.","UBC Media Group began as the Unique Broadcasting Company founded in 1989. In June 2014 the company merged with 7digital to form a global digital music and radio platform. The new company is called 7digital Group Plc. UBC Media Group is a family of companies, working in related areas of production, content creation and software design."
Uber Retail,https://www.crunchbase.com/organization/uber-retail,"Landscaping, Machine Learning","Uber Retail is an assess the competitive landscape using machine learning,","Analyzes specific locations in regards to traffic/visiting patterns, etc."
UBS Delta,https://www.crunchbase.com/organization/ubs-delta,Financial Services,UBS Delta is a portfolio analysis and risk management system that enables clients to measure risk.,"UBS Delta is a portfolio analysis and risk management system that enables clients to measure risk and performance across fixed income, commodities, equities and FX. UBS Delta is one of very few multi-asset risk and performance vendors with origins as a front-office fixed income analytics tool."
UbiNET Inc.,https://www.crunchbase.com/organization/ubinet,"Blockchain, Cryptocurrency, FinTech, Identity Management, Internet of Things",UbiNET IoT3 a true ubiquitous system for Smart Living using ThingCoin & AI-Blockchain formerly R&D at Paradigm Interactions Inc.,The UbiNET Platform is built up from several propositions that each hold a key relationship ecosystem. UbiNET is designated a planet wide system as its architecture is designed for any planet and an in-transit mode for between planets. While the system has been defined using the constructs of blockchain and cryptocurrency they are just the enablers of a complex data system with millions of products and services from full lifecycle recycling to personal security and most importantly personal privacy.
Ubiqu,https://www.crunchbase.com/organization/ubiqu,"Information Technology, Security, Software",Ubiqu is specialized in developing highly secure mobile authentication tokens.,"At Ubiqu, they are specialized in developing highly secure mobile authentication tokens. They started as young couple of adventurers who aimed for the moon! … and they succeed to develop a disruptive mobile technology that makes all other token and login methods obsolete. They offer their mobile cloud technology software to companies around the globe who care about your personal data and want to protect it. They are on the forefront of cryptography, industry standards and best practices. By focusing solely on the development of cryptographic authentication software they have and will maintain their position as technology leaders."
"UBUBU, Inc.",https://www.crunchbase.com/organization/ububu-inc,"Art, Electronics, Software","UBUBU, Inc. has developed a way that enables the personalization of desktop management.","UBUBU is a venture-backed new media company located in San Francisco. The UBUBU team is a fusion of creative, technical and business expertise with backgrounds that include Electronic Arts, Disney, Sega, Silicon Graphics, Apple, AutoDesk, Sony, Hewlett Packard, Oracle, Bain, Boston Consulting Group, and Charles Schwab. We have kites, paper lanterns, and a mosquito puppet hanging from our ceiling."
Uber Flavour,https://www.crunchbase.com/organization/uber-flavour,Food and Beverage,"Uber Flavour Rooisbos Ice Tea Brews are 100 % Natural. That means NO added sugar, NO preservatives, NO flavourants. Just real brewed tea","Long ago, alchemists tinkered with substances to develop gold, but they also laboured to create the ‘elixir of life’. For centuries tea has been a life-giving drink, steaming with refreshing goodness. In a sun-drenched land, this piping hot drink asks to be brewed, cooled down, filled with ice… and refreshing Uber Flavour Brew is born."
Ubiqua,https://www.crunchbase.com/organization/ubiqua,"Advertising, Marketing, Mobile Apps",Agència digital especialitzada en mobile marketing,Agència digital especialitzada en mobile marketing
Ubiflow,https://www.crunchbase.com/organization/ubiflow,"Internet, Real Estate",Ubiflow offers Internet multicast solutions of announcements and information.,Ubiflow offers Internet multicast solutions of announcements and information. Their ambition is to increase the Internet visibility of their customers. Ubiflow is compatible with all software solutions.
UBM Electronics,https://www.crunchbase.com/organization/ubm-electronics,"Advertising, Electronics, Embedded Systems",Powers the Global Electronics Market,"UBM Electronics is the source of market and technical information, decision tools, peer communities and professional education for the executives and engineers who design, develop and commercialize technology.  Brands include: EE Times EBNOnline.com EDN Embedded Systems Design Embedded.com Embedded Systems Conference Design News Datasheets.com Test & Measurement World"
