Organization Name,Organization Name URL,Categories,Description,Full Description
Eagle Kingdom Technologies,https://www.crunchbase.com/organization/eagle-kingdom-technologies,Information Technology,"Eagle Kingdom Technologies LTD (EKT) has specialised in creating innovative, customer focused solutions in the field of Set Top Boxes.","A global team of passionate professionals believe that nothing is sacred in our business and by challenging itself and its customers with new concepts and ideas the company keeps creating new opportunities for the entire industry. Since 2007, Eagle Kingdom Technologies LTD (EKT) has specialised in creating innovative, customer focused solutions in the field of Set Top Boxes, Smart TVs and Modems. By combining Asian Know How and Western Management, EKT successfully blends DNA from both business practices exceeding customer expectation in design, technology, quality, communication and cost. Delivering a wide range of products, from Zappers to Advanced Hybrid Set Top Boxes, Operator TVs and Modems, EKT is one of the few business partners to offer a true one-stop solution for Operators. Certified and integrated with many CA, DRM and licenses, EKT is a partner of choice for many tier 1 operators around the world."
Easyvest,https://www.crunchbase.com/organization/easyvest,"Education, Financial Services","Easyvest is leading a crusade to help all Belgians to make their money grow in a personalized, simple, low-cost and educational way.",
Easy Pay Direct,https://www.crunchbase.com/organization/easy-pay-direct,"Financial Services, Payments, Small and Medium Businesses","Easy Pay Direct making online payments easy, safe and pretty much awesome.","The Easy Pay Direct company was designed to make your life easier.  From their staff to the solution itself, They’re here to help.  They have the name Easy Pay Direct for a reason: small business owners need products that are easy to use.  They’ve created a product and an environment that is just that.  Simple.  With a simple site, simple forms and simple support, they help businesses thrive.  In the era of entrepreneurialism, they all need tools they can depend on."
Eaten,https://www.crunchbase.com/organization/eaten,"Analytics, Big Data, Consumer Reviews, Food and Beverage, Product Research, Restaurants, Travel",The world's dish-based restaurant review platform,"Eaten is a revolutionary dish-based restaurant review platform and menu guide that enables you to search for the best places to eat any dish or see what is best to order at a particular restaurant.  Powered by the world’s most advanced review engine, Eaten crowdsources data that has never been collected before. By understanding how good each dish is at a restaurant compared to its peers, Eaten can dramatically improve the accuracy of recommendations compared to incumbent platforms such as TripAdvisor."
EagleDream Technologies,https://www.crunchbase.com/organization/eagledream-technologies,"Information Services, Information Technology",EagleDream Technologies mission is to deliver exceptional services tailored to the specific needs of every client.,"EagleDream Technologies is a veteran-owned organization comprised of individuals with long-tenured relationships in information technology. Formed in 2013, the team has broad experience in conquering business challenges with innovative solutions and deep expertise.  EagleDream believes the most disruptive technology is world-class customer service, and although they offer many services, they believe in serving people first, and through that they produce quality work."
Easymeeting Inc.,https://www.crunchbase.com/organization/easymeeting-inc,"Meeting Software, Mobile, Public Relations, Video, Video Conferencing",Easymeeting is a developer of video meeting software for a variety of platforms.,"Easymeeting.net is a global videoconferencing as a service provider that makes it possible for traditional videoconferencing systems, PC’s, Mac’s, Tablets and smartphones to collaborate in multi participant video meetings together. Our scalable services, designed with the user in mind, can be personalized to best meet the needs of your company, and are neatly bundled into an affordable monthly fee, the same way you pay internet and phone bills. We assist our customers in finding the right video systems for their company, or apply our services to the systems they already have. Easymeeting.net was founded in 2006 by Avikom AS, a leading Scandinavian Distributor of Audio and Video Conferencing Services. Easymeeting.net´s Global Headquarters are located in Tromsø,Norway, and it´s North American Headquarters in Mystic, Connecticut. Easymeeting.net also has offices Stockholm, Sweden, and strategic partners throughout the Americas, EMEA and APAC regions. Why we believe in The Easymeeting.net way of life... Here at Easymeeting we believe that time is one of our most important values. We strive to provide a technology that will save our customers both time and money and still give them the experience of successful, face to face, travel free meetings. Never has international business been so simple, affordable, and made so much sense as it does now with Easymeeting´s High Definition videoconferencing services at your fingertips. We have developed our services and products with the ultimate user experience in mind, and if you do run into questions, our Easymeeting Experts are always available to help with your video meeting needs. We want to provide our customers with the tools necessary to have a meeting with a customer in Beijing in the morning, show a sales presentation to a potential client in London after lunch, and still make it home in time to enjoy dinner with their families. No more traffic, no more airport lines, and no more of your valuable time going to waste. We like to call it TIME WELL SPENT."
EasyDate,https://www.crunchbase.com/organization/easydate,"B2B, Developer Platform, Social Network","EasyDate, a dating solutions provider based in United Kingdom, offers a network of B2B and B2C services.","EasyDate is a successful online dating solutions provider. It consists of a diverse, multilingual and experienced team with the ability to create the most exciting and cost-effective dating platforms thanks to outstanding in-house technical resources. Having developed several B2B and B2C projects and turned them into successful and profitable business solutions, EasyDate is now the top dating group in the UK (Comscore, June 2008) Easy Date Ltd was launched commercially in October 2002 with www.datetheuk.com, an innovative UK dating site. Our niche marketing strategy led to the development of an additional three UK Dating Sites enabling Easy Date Ltd to grow a customer base of nearly 3 million registered members in the last 3 years."
EagleClaw Midstream,https://www.crunchbase.com/organization/eagleclaw-midstream,"Infrastructure, Oil and Gas",EagleClaw Midstream is a midstream company focused on developing infrastructure opportunities in the Permian Basin.,EagleClaw Midstream Services is led by a senior management team with deep roots in West Texas and decades of collective experience in the Permian. Our goal is to provide producers with rapid response time and flexible solutions that meet their infrastructure requirements on time and on budget so they can focus on their core business. EagleClaw Midstream Services is currently focused on growing its existing assets in the Delaware Basin as well as pursuing greenfield and acquisition opportunities in the region. EagleClaw is backed by a $350 million in growth capital from EnCap Flatrock Midstream of San Antonio.
EasySec Solutions,https://www.crunchbase.com/organization/easysec-solutions,"Information Technology, Internet of Things, Security",EasySec protect your IoT Devices and let you share your devices with an innovative access management,
Easy Mortgage Apps,https://www.crunchbase.com/organization/easy-mortgage-apps,"Consumer Lending, Enterprise Applications, Finance",Easy Mortgage Apps offers mortgage customers a unique way of communicating and interfacing with their realtor and loan officer.,"EasyMortgageApps offers mortgage customers a Lending Eco System. The Lending Eco System is unique way of communicating and interfacing with clients. Pairing a sharp platform with a mobile app specifically engineered for the mortgage industry. This app, while improving day to day productivity, offers a relevant approach to the current CRM model. EasyMortgageApps represents the future of the lending environment."
Easy Canvas Prints,https://www.crunchbase.com/organization/easy-canvas-prints,E-Commerce,"Easy Canvas Prints provides consumers with blankets, wall art and canvases printed with the customer's own photographs.",Easy Canvas Prints lets you turn your personal photos to gallery wrapped canvas prints. Upload photos directly from your computer or directly from your Facebook or Instagram albums. Easy Canvas Prints transform your everyday photos to works of art.
EasyPoS,https://www.crunchbase.com/organization/easypos,"Advertising, E-Commerce, Marketing, Robotics, Software","EasyPOS offers e-commerce, sales, marketing, inventory management, and loyalty program services to its clients.",
Eat Safe,https://www.crunchbase.com/organization/eat-safe,Apps,EatSafe is a restaurant directory app that makes eating out with dietary requirements effortless.,
Easybrain,https://www.crunchbase.com/organization/easybrain,Mobile,"Mobile game developer and publisher. Owner of Sudoku.com, Pixel Art games and others",
EasyProve,https://www.crunchbase.com/organization/easyprove,"Document Management, Enterprise Software",EasyProve is engaged in the development of document approval management software.,"Simple and Traceable Purchase Process Management Do you find it challenging to control and manage all the expenses in a number of departments within an enterprise? EasyProve was built to make it easy! Easyprove takes care of purchase management process in most effective, efficient and easy way. We enable quick, traceable and accountable purchase process management in the middle size companies with multidivisional structures.  Let your employees care about business only, leave procurement issues to us."
Eastern Mountain Sports (EMS),https://www.crunchbase.com/organization/ems-com,Retail,"Eastern Mountain Sports, Inc. sells outerwear and outdoor gear. It sells jackets, clothing, and accessories for men.","Eastern Mountain Sports, Inc. sells outerwear and outdoor gear. It sells jackets, clothing, and accessories for men, women, and kids; shoes, boots, sandals, socks, and shoe accessories; and camp and hike equipment, including backpacks, tents, sleeping bags and pads, camp kitchen products, water bottles, camp furniture, trekking poles, lighting, electronics, knives and tools, compasses, binoculars, first aid kits and supplies, bug and sun protection products, dog gear, and hiking boots and clothing, as well as guide books, games, and maps. "
Easyshop Easycook,https://www.crunchbase.com/organization/easyshop-easycook,"Agriculture, Food Delivery, Logistics, Supply Chain Management",An online fresh food processor and grocer targeting working professionals and SMEs based in Nigeria.,Easyshop Easycook Services Limited Is A Proudly Nigerian Domestic Outsource Company That Specializes In Shopping Services. They Provide Customized Domestic Solutions To The Working Professional Who Otherwise Cannot Meet Up Due To Work And Timing Challenges.
EastEssence,https://www.crunchbase.com/organization/eastessence,"E-Commerce, Education, Fashion, Lifestyle",EastEssence is the leading online retailer of Modest Islamic clothing based in US.,"EastEssence- The Online Islamic Store was established in 2007 from the Silicon Valley of California, USA and is providing its services in most of the countries. We provide clothes keeping in mind the religious values at unbeatable prices. Our huge collection includes Hoodies, Abayas, Burqa, Hajj and Umrah wear, Jilbabs, Thobes, Hijabs, Namaz and Prayer wear, Jackets, Tunics, Skirts, Pants, Dishdashas, Kurtis, Jewelery, Shoes, Accessories and Uniforms for Kids. All products are created by trained professionals in factories that are sweat-free certified. The profits gained by us are used to support 'Scholarship Programs' and 'Giving Back Program' which help in spreading education."
Earth Ocean Farms,https://www.crunchbase.com/organization/earth-ocean-farms,"AgTech, Farming", Earth Ocean Farms is the necessary infrastructure for the reproduction of totoaba and huachinango as a sustainable and prosperous resource.,"Earth Ocean Farms operates a laboratory with the necessary infrastructure for the reproduction of totoaba and huachinango as a sustainable and prosperous resource.The nursery of these marine species consists of the management of broodstock, spawning and larval culture, culminating with the production of juveniles. For this process, it takes control of the feeding, temperature, light, filtration, disinfection and recirculation of water, maintaining optimum conditions for its upbringing.  Using aquaculture technology in the open sea, we cultivate the totoaba and the red snapper in their natural environment through cages that are introduced in deep, crystalline waters and with ideal conditions for their growth."
Earthwise Bag Company,https://www.crunchbase.com/organization/earthwise-bag-company,Packaging Services,Earthwise Bag Company is a supplier of reusable bags in the United States,"Earthwise Bag Company is a supplier of an eco-friendly reusable bags that help save the planet while meeting the needs of businesses, non-profits and consumers. Our stylish bags are made from the highest quality materials and are backed by the best customer service in the industry."
EazyO,https://www.crunchbase.com/organization/eazyo,"Food and Beverage, Food Delivery, Information Technology","EazyO is an on-demand ordering app for beaches, pools, hotels & resorts. ",
Easynet Group,https://www.crunchbase.com/organization/easynet-group,"Internet, Language Learning, Telecommunications, Web Hosting",A managed service provider,"A managed service provider, Easynet has over 20 years’ experience delivering managed services to national, multinational and global businesses. With customers, employees and offices across the world, it combines global reach with local expertise.  Easynet offers customers a portfolio of network, hosting and unified communications solutions enhanced by a range of ‘over the top’ solutions including security, voice, videoconferencing and application performance management.  Customers include EDF, Sage, Yakult, Transport for London, Bernard Matthews, Anglian Water, Bridgestone, Q Park and Campofrio Food Group.  For more information visit www.easynet.com In October 2015, Easynet was acquired by Interoute. Interoute is the owner-operator of one of Europe's largest networks and a global cloud services platform which encompasses 12 data centres, 14 virtual data centres and 31 colocation centres, with connections to 195 additional third-party data centres across Europe. Its full-service Unified ICT platform serves international enterprises and many of the world’s leading service providers, as well as governments and universities. Interoute’s Unified ICT strategy provides solutions for enterprises seeking connectivity and a scalable, secure advanced platform on which they can build their voice, video, computing and data services, as well as service providers in need of high capacity international data transit and infrastructure. With established operations throughout Europe and USA, Interoute also owns and operates 24 connected city networks within Europe's major business centres. www.interoute.com"
Eastman Hand Tools,https://www.crunchbase.com/organization/eastman-shop,Industrial,"Eastman is the leading brand in manufacturing hand tools, power drills, batteries, and gardening tools.","EastmanShop.com is a Venture of Eastman Group of Companies, Now; you can buy Eastman Hand tools online with same quality at best price with doorstep delivery option. Eastman is the leading brand in manufacturing hand tools, farm parts, power tools, electric drills, batteries, and gardening tools."
Easy Agile,https://www.crunchbase.com/organization/easy-agile,"Apps, Information Technology, Software",Easy Agile products help software development teams effectively deliver quality solutions to their customers.,Easy Agile products help software development teams effectively deliver quality solutions to their customers.They are a team that wants to see their customers achieve their desired outcomes (not merely output). And for their part they recognise that perfection is unattainable and are striving to continuously improve.
Earthwave Technologies,https://www.crunchbase.com/organization/earthwave-technologies,"Fleet Management, Information Technology, Wireless",Earthwave Technologies is a Wireless Fleet Management for the Construction Industry.,"Earthwave Technologies, based in Indianapolis, Indiana, is a leading provider of cutting-edge telematics solutions exclusively for the heavy equipment contractor. Since developing their prototype wireless hour meter in 2000, Earthwave’s sole purpose and function has been to learn the construction industry and develop the best wireless tracking solution to help heavy equipment contractors manage their equipment, projects, costs and bottom line."
Easel Corporation,https://www.crunchbase.com/organization/easel-corporation,Software,Easel Corporation was a popular software development firm which was acquired by VMARK in the mid-1990s.,Easel Corporation was a popular software development firm which was acquired by VMARK in the mid-1990s.
EarthPulse PEMF Therapy,https://www.crunchbase.com/organization/earthpulse-technologies,"Alternative Medicine, Fitness, Health Care, Home Health Care, Wellness",EarthPulse Pulsed Electromagnetic Field PEMF/rTMS Therapeutic Devices,"EarthPulse™  is a life sciences company specializing in PEMF therapy and Electrical Stimulation. Our clients are top-ranked Junior Tennis players, world record holders, UFC Champions, military Special Forces, U.S. Swim Team members (one FINA Champion with 21 Gold  Medals in 21 races), weekend warriors, moms and pops, grandmothers and grandfathers, great-grandmothers and great-grandfathers. The inventor calls his EarthPulse™ the lazy man's way to fitness."
EatAds.com,https://www.crunchbase.com/organization/eatads,"Advertising, GPS, Mapping Services","EatAds.com is an online marketplace offering outdoor advertising, billboard, taxi, underground media and more.","EatAds.com is an online marketplace for buying and selling Outdoor & Out-of-Home advertising space. They create a more efficient process to discover, plan, research, buy and sell Outdoor, OOH and other media types. Each listing by a media owner is supported by factual details about that advertising space. This includes price, images, location and supporting audience information. Buyers and planners can make an offer to buy at the listed price or make a counter-offer."
EasyHaul.com LLC,https://www.crunchbase.com/organization/easyhaul-com-llc-2,Shipping,"EasyHaul specializes in door-to-door vehicle shipping, transportation services, worldwide cargo and logistics solutions.","EasyHaul.com specializes in door-to-door vehicle shipping, transportation services, worldwide cargo export, shipment coordination and logistics solutions. Whether you need to ship cars, trucks, SUVs, motorcycles, boats, we have got you covered. We specialize in domestic and international shipping service. Based near the port of Vancouver in Washington state, we provide reliable services around the country and world. EasyHaul.com assures timely pickup and delivery of your vehicle so that you have a stress-free experience. We have insured and safe drivers who ship your vehicles through reliable shipping lines."
East Balt Bakeries,https://www.crunchbase.com/organization/east-balt-bakeries,Food Processing,"East Balt Bakeries produces buns, bagels, English muffins, tortillas, breads, and specialty bakery products.","East Balt produces buns, bagels, English muffins, tortillas, breads, and specialty bakery products. It offers round, oval, oblong, square, rectangle, stick, and bundle buns. The company serves food service organizations and restaurants worldwide. East Balt believe in creating and maintaining a comprehensive commitment to the customers on every level. This allows us to be a global industry leader in delivering the highest quality, service and innovation in everything it do."
Easy Information Solutions,https://www.crunchbase.com/organization/easy-information-solutions,"Accounting, Point of Sale","Easy Information Solutions is the distributor and reseller of point of sale, accounting and administrative systems.","Easy Information Solutions is the distributor and reseller of point of sale, accounting and administrative systems to hotel and restaurant brands."
Easel Learn,https://www.crunchbase.com/organization/easel-learn,"Analytics, Content, Education",Easel allows students to predict their academic future and access educational content.,Easel allows students to predict their academic future and access educational content. Their platform collects analytics that help school administrators measure student expectations.
Earth Science Tech,https://www.crunchbase.com/organization/earth-science-tech,"Health Care, Nutraceutical",Earth Science Tech is a unique Science based Biotechnology company that brings Nature’s Pharmacy to the public.,"Earth Science Tech (ETST) is a unique Science based Biotechnology company that brings Nature’s Pharmacy to the public. Earth Science Tech is an innovative biotech company that operates in the fields of hemp cannabinoid (CBD), nutraceutical, pharmaceutical, medical device, research and development. Earth Science Tech, Inc. (ETST) has among the highest quality, purity, and Full Spectrum Industrial Hemp Oil naturally containing CBD (Cannabidiol) on the market. Formulated using superior supercritical CO2 cold liquid extraction, our cannabinoids are kept at the rawest state maintaining all therapeutic properties. Our research, performed alongside the University of Central Oklahoma, DV Biologics laboratory, and other organizations, as well as being suggested in The Institute for Natural Healing’s (INH) Delta 8 Article has demonstrate that we are the top nutritional and dietary supplement brand in the Industrial Hemp space. ETST’s High Grade Full Spectrum Cannabinoids are derived from  Industrial Hemp plants with a high cannabinoid content. The Hemp used is extracted using Super-critical (cold) CO2 fluid extraction to ensure highest quality of cannabinoids and having all the naturally occurring therapeutic properties intact. ETST’s High Grade Hemp Cannabinoids is a full spectrum extract, not synthetic nor an isolate. It contains a variety of valuable phyto-nutrients, synergistic cannabinoids, essential oils and other compounds found in the original plant. What are ETST Products ETST products include CBD (Cannabidiol), a natural constituent of Hemp Oil. Cannabinoids (Cannabidiol/CBD) are natural constituents of the Hemp plant and CBD is derived from Hemp stalk and seed. Hemp oil is a well-known dietary supplement and the naturally occurring CBD and presents a continuing stream of overwhelming evidence of significant Health and Wellness benefits including; a digestive aid that regulates appetite and eases symptoms of nausea and vomiting, analgesic pain relief, relief from anxiety, anti-tumour and anti-cancer benefits, and antipsychotic. CBD (cannabidiol) promotes and supports the nutritional health of aging bodies in particular. Source: US Government Patent #6,630,507 “Cannabinoids as antioxidants and neuroprotectants.” ETST offers CBD in the form of vitamins, minerals, herbs, botanicals, personal care products, homeopathies, functional foods and other products. They come in various formulations and delivery systems such as capsules, tablets, soft gels, chewables, liquids, creams, sprays, powders, and whole herbs."
eApeiron Solutions,https://www.crunchbase.com/organization/eapeiron-solutions,"Information Services, Information Technology",eApeiron Solutions is a pioneering company dedicated to revolutionizing e-commerce solutions.,eApeiron Solutions is a pioneering company dedicated to revolutionizing e-commerce solutions.
Earthsoft,https://www.crunchbase.com/organization/earthsoft,"Computer, Software",EarthSoft is the recognized leader in providing environmental data management systems and support worldwide.,"EarthSoft is the recognized leader in providing environmental data management systems and support worldwide. They provide more than two decades of focused experience on automated workflow solutions for public and private entities in the areas of chemistry, biology, geology, limnology, water, air quality, soil, sediment, waste, and associated compliance monitoring data."
EasySolar,https://www.crunchbase.com/organization/easysolar,"Apps, Internet, Software",EasySolar offers an application that enables its users to design photovoltaic systems.,
EASi,https://www.crunchbase.com/organization/easi-2,"Consulting, Information Technology, Product Design, Software",EASi is an Outsourcing/Offshoring company providng design and engineering support services.,
EasyWebinar,https://www.crunchbase.com/organization/easy-webinar,"Advertising, Marketing, Software",EasyWebinar is an all in one webinar platform with  a no-latency high definition streaming tool coupled with advanced marketing automation.,
Easy Insight,https://www.crunchbase.com/organization/easy-insight,"Analytics, Business Intelligence, Enterprise Software, Web Development",Easy Insight is a software licensing and delivery model for instant connections to a wide variety applications.,
