Organization Name,Organization Name URL,Categories,Description,Full Description
"VOIS, Inc.",https://www.crunchbase.com/organization/vois,"Consulting, Social Media",VOIS creates an on-demand community platform for people to buy and sell products and services.,"VOIS, Inc. is creating an on-demand community for people to buy and sell products and services without great cost or difficulty. VOIS, Inc. offers yet another social networking site but with one distinct difference: it's traded on the OTC:BB. VOIS is big in Egypt, Palestine and Jordan, tracking in the top 1000 sites in each country."
Volcano Veggies,https://www.crunchbase.com/organization/volcano-veggies,"Agriculture, Food and Beverage",Volcano Veggies is an aquaponic farming operation that raises mercury-free fish and grows organic vegetables and fruits year-round.,"Volcano Veggies is an aquaponic farming operation that raises mercury-free fish and grows organic vegetables and fruits year-round. It is able to provide a consistent supply of greens, fish, and strawberries throughout all of the long cold winter months. Co-founded by Shannon and Jimmy Sbarra, Volcano Veggies is based in Bend, Oregon."
Vocapia Research,https://www.crunchbase.com/organization/vocapia-research,Software,Vocapia Research is a developer of speech recognition software.,"Vocapia Research is an R&D company and a software publisher developing and providing speech technologies and solutions for many languages, including most major European languages as well as Arabic, Mandarin, and Russian. The VoxSigma:registered: [speech to text software](http://www.vocapia.com) suite uses advanced language technologies such as language identification, speech recognition, and speaker identification to transform raw audio and audiovisual data into structured and searchable XML documents. The VoxSigma sofware suite is also offered as a Web service via a REST API over HTTPS, allowing customers to quickly reap the benefits of regular improvements to the technology and take advantage of additional features offered by the online environment. The services are available 24/7/365 with failover servers and geographic redundancy. The main applications of VoxSigma are: Broadcast monitoring & audio visual archive indexing; Debate and lecture transcription and indexing; Telephone Speech Analytics; Transcription of business conference calls; Video Subtitling. Vocapia Research is located in the scientific pole of the Saclay Plateau, France."
Vosaic,https://www.crunchbase.com/organization/vosaic,Biotechnology,"Vosaic helps researchers, educators, and learners gain insight to improve performance.",
Vocantas,https://www.crunchbase.com/organization/vocantas,"Information Technology, Software",Vocantas is a leading developer of hosted and premise-based interactive voice response solutions.,
volatiles lighting,https://www.crunchbase.com/organization/volatiles-2,"Internet of Things, Lighting, Residential",volatiles designs and develops LED lighting surfaces that enable its customers to decorate their houses and offices.,"volatiles develops LED lighting modules that let you turn any surface of your home into a personal, dynamic and interactive lighting surface."
Voypost,https://www.crunchbase.com/organization/voypost,"Internet, Sharing Economy, Shopping, Travel",Voypost,"Voypost is an international community of shoppers and travellers. Together we build a platform that allows delivering purchases anywhere in the world quickly by travellers. Voypost allows delivering with the help of people who are going to the delivery point anyway. No need to wait a long time and overpay. The purchase will be bought and delivered by a traveler interested in the order. Voypost is beneficial for travellers. It’s so easy to save on the trip just by buying and taking a purchase with you in the luggage. After delivery, travellers and senders leave feedback to each other. Thanks to the reviews, other members of the Voypost community will be able to select users whom they can trust."
VoIPITS INC.,https://www.crunchbase.com/organization/voipits,"E-Commerce, Telecommunications",Next generation VoIP solutions. Global Hosted PBX infrastucture with unlimited custom applications.,Virtual phone numbers with included PBXww phone system.
Vodworks,https://www.crunchbase.com/organization/vodworks,"Information Technology, Video, Web Apps",Vodworks is a specialist in providing web and app development for media companies.,
Volya Software Corporation,https://www.crunchbase.com/organization/volya-software-corporation,"3D Technology, CAD, Computer Vision, CRM, Embedded Software, Image Recognition, Information Technology, Software, Web Development","Volya is a software development company which specializes in creating custom-made CAD, 3D, Computer Vision Solutions, and Web Projects.","Volya is a software development company which provides offshore programming service. The main specialization is - CAD/CAM Solutions; - 3D-Visualisation and AR/VR Solutions; - Computer Vision and Visual Recognition Application; - Equipment Control Systems; - complicated Web Projects (including CRM, Cryptocurrency Platforms, Transportation/Logistical Applications, Healthcare Solutions, etc.). We are a technical and project management team that is focused on the final quality product as well as on the customer’s bottom line. The skill set that we possess is a crucial major factor that guarantees the success of the projects. We provide high-quality work at very competitive pricing. There are well-known European and US-based companies among our clients as well as small start-ups."
Voco,https://www.crunchbase.com/organization/voco,Health Care,VOCO began life as a small family concern supplying a handful of products to dental practices and laboratories.,
VoIP Office,https://www.crunchbase.com/organization/voip-office,"Consumer Electronics, Information Technology, Robotics, Software, Telecommunications",VoIP Office is a leading Provider of a Cloud-based communication system for every business Small or Enterprise in USA and India.,"VoIP Office is a leading Provider of a Cloud-based communication system for every business Small & Enterprise in USA and India. It is easy to connect to anyone, anywhere at any time and Businesses prefer VoIP for its best quality and affordability. VoIP Office offers all the features of your traditional PBX along with the latest functionality enabled by the use of VoIP technology. VoIP Office integrates easily with your business applications, seamlessly integrating your desktop and your office into one interconnected system."
Vound,https://www.crunchbase.com/organization/vound,Social Media,Vound is a mobile application that creates software for the changing world of computer forensics and e-discovery.,"Vound is a mobile application that creates software for the changing world of computer forensics and e-discovery. Through the new field of forensic search, Vound delivers innovative software products that guide all levels of computer users and investigators to search and review a wide range of documents and data types. Vound was launched in 2014."
Vofox Solutions,https://www.crunchbase.com/organization/vofox-solutions-offshore-software-development-company-in-india,"E-Commerce, Information Technology, Software",Vofox Solution provides offshore software development solutions to its clients.,"Vofox Solutions is one of the most popular offshore software development company in India with years of experience in offshore software development services. Major services of vofox are : offshore Development Services,Hire dedicated Developers,QA/Testing Services,ITConsulting,Angular JS Development,Backbone JS Development,Node JS Development,Bootstrap Development,Asp.Net / MVC Development,C# / WPF Development,Windows Azure Development,Java/J2ee Development,PHP Web Development,MOBILE APP DEVELOPMENT,Android Development,iOS Development,Hybrid App Development,Custom ecommerce development,Magento Development,Open cart Development,Custom CMS Solutions,WordPress Development,Drupal Development,Joomla Development."
VoteBox,https://www.crunchbase.com/organization/votebox,"Government, Internet",VoteBox is an online tool that facilitates voting on election days.,"VoteBox is an online tool that facilitates voting on election days. It enables citizens to vote for federal, state, and local elections. VoteBox was launched in 2012 by [Henry Lippincott](https://www.crunchbase.com/person/henry-lippincott) at [Stanford University](https://www.crunchbase.com/organization/stanford-university#/entity)"
VoyageOne,https://www.crunchbase.com/organization/voyageone,"E-Commerce, Fashion, Internet, Web Design",VoyageOne enables prominent foreign brands and merchants to enter the Chinese ecommerce market.,"VoyageOne is an ecommerce technology company focused on enabling prominent foreign brands and merchants to enter the Chinese ecommerce market. Through its Liking store (available at www.liking.com and liking.tmall.com,) VoyageOne is also a bona fide online retailer, offering some of the hottest fashion brands directly to Chinese consumers. The company is headquartered in Los Angeles, CA, and has offices in Shanghai, Hangzhou, and Harbin."
Voyager Internet,https://www.crunchbase.com/organization/voyager-internet,Internet,Voyager is a Broadband and telecommunications provider.,"Voyager Internet operates as a telecommunication provider. The company offers Internet, voice, hosting, and domain name services. It serves residential and business customers in New Zealand"
Volos Group,https://www.crunchbase.com/organization/volos-group,"Blockchain, Cryptocurrency, Financial Services, Information Technology, Venture Capital",Volos Group LLC funds startups and participates in the ICO's of top-tier blockchain technology companies.,
Voice Apps,https://www.crunchbase.com/organization/voice-apps,"Information Technology, Internet, Software",Voice Apps allows anyone to create Alexa Skills and Google Actions without writing code.,Voice Apps allows anyone to create Alexa Skills and Google Actions without writing code.
VotesLiberty,https://www.crunchbase.com/organization/votesliberty,Web Development,"VotesLiberty provides a centralized web platform for Voting, Rating and Q&A","VotesLiberty is a website provides a centralized platform for voting, Q&A, rating or reviewing anything."
Voit Real Estate Services,https://www.crunchbase.com/organization/voit-real-estate-services,Real Estate,Voit Real Estate Services is a firm that provides commercial real estate services and property solutions for clients.,"Voit Real Estate Services is a, debt–free and privately owned operator of commercial real estate services throughout the Western United States. In existence since 1971 through multiple market cycles, we have evolved into a full-service real estate company with expertise as a real estate owner, operator, broker, property manager, contractor and developer. With all of these capabilities, we are still able to retain the culture of a small boutique firm. This allows us to quickly react to the demands of a changing marketplace while offering individualized and integrated real estate solutions across multiple sectors."
Volt,https://www.crunchbase.com/organization/volt-625b,"Consulting, Energy, Information Technology, Software",Volt offers portfolio management and risk processes in addition to software products and services.,"Volt Energy and Informatics was established in May 2010. By expert engineers of Turkey Energy Sector participating software offers the right solution for their needs Bilateral Agreements and Free Consumers. Their company; energy companies of all operations, portfolio management and risk processes in addition to ENXP software products and services they can manage well the market over the first domestic looms in Turkey OTC platform with bilateral agreements trade also provides professional infrastructure and R & D and consulting services with a strong team. "
Voxofon,https://www.crunchbase.com/organization/voxofon,"Audio, Information Technology, iOS, Messaging, Mobile, Public Relations, Software, Telecommunications, VoIP",Voxofon provides mobile apps and communication services utilizing over-the-top voice and messaging technologies.,"Voxofon LLC is a Houston-based company offering innovative and advanced VoIP communication services with an emphasis on mobile technology. Voxofon, which has been cash-flow positive ever since its founding in April of 2008, quickly distinguished itself as the company providing the widest range of VoIP services, including seamless smartphone VoIP applications. Currently Voxofon provides dedicated applications for iPhone, Android, Windows Phone 7, BlackBerry and HP webOS. In addition, Voxofon users can use any other mobile phones or landlines for their international calling."
Vocala,https://www.crunchbase.com/organization/vocala,"Casual Games, Software",Vocala develops voice-based tech for Amazon Alexa and Google Assistant.,Voice development for Alexa Echo and Google Assistant We create voice-driven applications and interactions to capture your customers imaginations. During 2018/19 voice assistants will become part of everyday life. We can develop Alexa Skills and Google Assistant apps for your brand.
Vocam,https://www.crunchbase.com/organization/vocam,"Content, Education, Public Safety",Vocam is a safety training and occupational health content provider.,"Vocam create high impact, dramatic training products to serve many businesses, training organisations and educational institutions across an array of industries. A myriad of solutions exist from small business packages of DVD's to enterprise solutions licensing our state of the art e-learning platform. Need to induct employees into the workplace? Vocam have the solution for you whether you need to train 1 employee or thousands. "
Voyage Media,https://www.crunchbase.com/organization/voyage-media,"Advertising, Broadcasting, Internet, Music, News","Voyage Media is an entertainment studio that creates, shares, and earns from the art of film and television storytelling.",
VoloMedia,https://www.crunchbase.com/organization/volomedia,"Advertising, Social Media, Video",VoloMedia is a provider of advertising and reporting solutions for downloadable media.,"VoloMedia is the leading provider of advertising and reporting solutions for downloadable media, extending the reach of video and audio from the PC to the portable device. Their patented products and technologies enable dynamic advertising insertion and rotation, targeting, measurement, reporting and campaign management within downloadable video and audio, such as podcasts. VoloMedia's products and services are utilized by some of the largest media companies to unlock the value of their downloadable media by enabling advertisers to accurately reach and measure high-value audiences."
Volangua,https://www.crunchbase.com/organization/volangua,"Education, Language Learning, Marketplace, Travel",Volangua is a language school comparison site that aims to make learning a new language available to anyone in the world.,"Volangua is a language school comparison site that aims to make learning a new language available to anyone in the world. Using its comprehensive refine options and search capabilities, students can find language schools all over the world, read real reviews and testimonials and make a truly educated decision.  The site takes the pain out of planning and researching a language course by combining price comparison technology with straightforward user experience. Volangua is a comparison site at its core, built by professionals from the foreign language industry. It uses advanced refine options and reviews to present objective information on its schools and the ability to book directly from its site.  Volangua launched in Beta on [11th March] followed by a full launch to the public on [July 2019]. For language schools looking to sign up, full details and launch offers can be found at [www.volangua.com]."
voiceTech,https://www.crunchbase.com/organization/voicetech,"Computer, Software",voiceTech is a technology provider to the pharmacy industry.,"voiceTech is dedicated to the development of robust communication and adherence solutions that provide pharmacies with the edge they need to compete in today’s competitive marketplace.  Large and small chains, independent, specialty and health-system pharmacies in the United States, Canada, Bermuda, and Puerto Rico, all enjoy new levels of efficiency and customer satisfaction as a result of voiceTech star rated customer service, comprehensive support and implementation."
Vor Security,https://www.crunchbase.com/organization/vor-security,Software,Vör Security provides both interactive and API access to our full database.,"Vor Security created the OSS Index, an innovative and free online index of known open source software vulnerabilities. Vör Security provides both interactive and API access to our full database."
VotHot,https://www.crunchbase.com/organization/vothot,"E-Commerce, Retail",VotHot is a social market where people sell products and find recommendations to find good deals.,"In a world of copycat daily-deal shopping sites, VotHot takes a diametric approach of enabling the consumers to initiate the deal process. Finding a deal one actually wants is difficult. To solve this important problem, VotHot lets the consumers specify what they wish to purchase and get steep discount via group purchases. This way the consumers can get deals they want and do not have to sort through long lists of uninteresting daily deals."
Vogue China,https://www.crunchbase.com/organization/vogue-china,"Beauty, Fashion, Lifestyle",Vogue china is the chinese edition of vogue magazine that carries a mixture of local and foreign content.,
Voodoo Video Marketing,https://www.crunchbase.com/organization/voodoo-video-marketing,"Broadcasting, Internet, Marketing, Telecommunications, Video",Voodoo is Automated Video Communications made easy.,
Vokes-Air Group,https://www.crunchbase.com/organization/vokes-air-group,"Consumer Goods, Industrial Manufacturing, Manufacturing, Product Design, Retail",Vokes-Air Group manufactures and distributes air filters.  ,Vokes-Air Group manufactures and distributes air filters designed for a variety of commercial and industrial applications.
Voxme Software Inc,https://www.crunchbase.com/organization/voxme-software-inc,"Enterprise Resource Planning (ERP), Enterprise Software, Mobile Apps",Mobile apps and ERP systems for removals and fine arts logistics,"Voxme Software Inc. provides mobile and office applications for household goods removals companies, fine arts and interior design logistics, galleries and auction houses. We have been serving OMNI, FIDI, LACMA, BAR and IAM members around the world for the past 14 years. We take pride in providing high quality support and implementation services to our global client base from Toronto, Vancouver, Israel, Antwerp and Geneva."
Voice Glance,https://www.crunchbase.com/organization/voice-glance,"Collaborative Consumption, Employment",Voice Glance is an organization who's goal is to provide companies a fair and merit-based hiring solution.,
Volify,https://www.crunchbase.com/organization/volify,Apps,"Volify helps you to easily search for your favorite songs, artists, DJ's, play them with single tap.","Volify helps you to easily search for your favorite songs, artists, DJ's, play them with single tap. You can easily create playlists and put unlimited songs for your modes. Play in background and continue to read books, surf on internet etc.. Listen your favourite songs wherever your are, also completly for FREE!"
Volt480,https://www.crunchbase.com/organization/volt480,"Education, Information Technology, Software","Volt480 is a cloud-based, end-to-end field service management platform that’s built just for you.","Volt480 believe in Industrial Superheroes. Their mission to enable manufacturers to be more profitable and productive by bringing to market innovative tools and technology.  They also believe that in order to sustain long-term innovation and competitiveness, they must continue to support STEM education. THey pledge to donate a portion of their time and profit in support of STEM education in the communities they serve."
VoIPstudio,https://www.crunchbase.com/organization/voipstudio,"Public Relations, VoIP",VoIPstudio is a cloud-based business phone system created especially for organizations that require professional communication features.,"Hosted business telephone service for companies of all sizes. Virtual PBX including virtual numbers, voicemail, ring groups, IVR and much more."
Volunteering Solutions,https://www.crunchbase.com/organization/volunteering-travel-solutions-private-limited,Travel,"Volunteering Solutions, an international volunteer travel organization which offer affordable volunteer abroad programs from 1 to 24 weeks","Volunteering Solutions provides affordable International Volunteer Abroad Programs in 25 countries across Asia, Africa, Europe, and Latin/South America. Since 2006 Volunteering Solutions has provided great volunteering experience to over 15000 volunteers from around the world. With a vast variety of volunteer programs starting at only $200, you will always find a program that matches your needs. You can choose from the following programs - Volunteer Abroad, Summer Volunteer Abroad, , Two Week Special Programs and Group Volunteering Programs. Our volunteers work in orphanage, teaching, medical, construction, day care centers, wildlife and street children programs around the world from 1 week to 24 weeks in duration. We are committed to providing you with an affordable and truly amazing volunteer abroad experience. Come join our meaningful international volunteer abroad programs and change the way you see the world!"
Vokord Telekom Zao,https://www.crunchbase.com/organization/vokord-telekom-zao,"Communications Infrastructure, Hardware, Manufacturing, Telecommunications",Vokord Telekom Zao manufactures radio and television broadcasting and communications equipment.,Vokord Telekom Zao manufactures radio and television broadcasting and communications equipment. Vokord Telekom Zao was founded on 1999 and is headquartered in Russia. The company was acquired by Huawei Technologies on June 2019.
Volteneo,https://www.crunchbase.com/organization/volteneo,"Cloud Computing, Finance, FinTech, SaaS, Software",Volteneo specializes in financial messaging.,"Volteneo is headquartered in Ireland and delivers great efficiencies in payments management and data  collection between companies and their banking partners. Employing cloud technology with a SaaS model, Volteneo  offers a multichannel payment gateway catering for SEPA Credit Transfer, SEPA Direct Debit and high-value global Treasury payments. Solutions are designed to meet the needs of SMEs and Corporates with a highly scalable core platform."
Voiplid Network,https://www.crunchbase.com/organization/voiplid-network,"Internet, Mobile, Software, Telecommunications",Voiplid Network is a VoIP service provider that enables its users to make VoIP and ISP calls with others.,"Free International Calls-VoIP phone system for any type of business,residents,Call Center,mobile VoIP,SIP Trunking & FREE International Calls"
Voycee,https://www.crunchbase.com/organization/voycee,Social Media,"Voycee is a social network that enables its users to share and follow status updates, photos, videos, audio files with their friends.","Voycee is a fun and easy way to keep your friends up-to-date with your latest status updates that disappear.  Share your status updates via text, photo, video or audio for your friends to see, like and comment. Your friends will immediately see it on their lock screen and your ephemeral timeline.  When you share something new, your old updates and its replies disappear forever! You can also send direct messages that can only be seen once + much more!"
Voxterr,https://www.crunchbase.com/organization/voxterr,"Event Management, Internet, Local, Mobile Payments, Search Engine, Social Media, Social News","Voxterr changes the way you share, explore, buy and sell","Voxterr makes it easy for you to get involved in your local community, and become influential in your region. Create, explore and share awesome content, find the hottest events to attend with your friends, get the best deals in your region, and more."
