Organization Name,Organization Name URL,Categories,Description,Full Description
Voyage Mobile,https://www.crunchbase.com/organization/voyage-mobile,"E-Commerce, Mobile, Software","Voyage's automated text messaging platform enables brands to engage customers more effectively than email, offering up to 16x+ ROAS.",Voyage is an automated text messaging platform that enables brands to grow a large SMS subscriber list and engage customers more effectively than email. Voyage's proprietary platform has helped clients achieve 16x+ ROAS and 10x higher revenue per message than emails. The company builds innovative product features & leverages custom integrations to enable enterprises to trigger automated campaigns & customer updates for a variety of eCommerce use cases.
Vayana Network,https://www.crunchbase.com/organization/vayana-network,"Finance, Financial Services, FinTech","Vayana serves with flexible, scalable and customizable solutions for delivery channels and specialized financial transactions.","Vayana Network is a financing network that enables Businesses and their Trade Partners to capture their entire receivable and payable trades electronically and finance through Banks and Financial Institutions. Businesses can finance their payables, or factor their receivables or make financing available to their counterparties. Vayana Network, in partnership with MasterCard and Banks, also offers its award winning Commercial Card solution for Payable financing."
VouchedFor,https://www.crunchbase.com/organization/vouchedfor,"Accounting, Finance, Legal","Helping millions of people find the best financial advisers, solicitors and accountants for help with life's biggest decisions","VouchedFor helps people find the best financial advisers, solicitors and accountants for help with life's biggest decisions, harnessing stories and data from over 30,000 satisfied clients. At life's big turning points - be it landing your dream home, gaining access to your children, or ensuring a comfortable retirement - you deserve the very best advice The Financial, Legal and Accounting sectors have until now evaded the global technological tidal wave. But it's time that changed - it's just too big and too important to people's lives. We are an innovative start-up backed by great VCs and Angel Investors. We've grown the team 4-fold (to 30 people) in the last year…and are set to do so again. We're based in Teddington, South West London…which means you can get a seat during rush hour on the train, drive to work (and park)….or best still, cycle here through Richmond Park."
Village Roadshow Entertainment Group,https://www.crunchbase.com/organization/village-roadshow-entertainment-group,"Digital Media, Media and Entertainment, Video",Village Roadshow Entertainment Group is a leading global entertainment company,"Village Roadshow Entertainment Group is a leading global entertainment company building premier, content-rich businesses in the entertainment industry. VREG employs innovative strategies to produce, acquire and deliver intellectual properties with timeless appeal, while maximizing group-wide strategic and operational efficiencies. VREG is the holding company of Village Roadshow Pictures and Village Roadshow Pictures Asia."
Vertical Communications,https://www.crunchbase.com/organization/vertical-communications-2,"Manufacturing, Software, Telecommunications, Wireless",Vertical Communications is a provider of unified communications and voice applications solutions for its clients.,"Vertical Communications is a provider of unified communications and voice applications solutions that transform business operations and processes for business customers. It offers an extensive array of advanced communications technologies, including UC, collaboration, and true mobility."
Vogo Sport,https://www.crunchbase.com/organization/vogo-sport,"Events, Mobile Devices, Sports","VOGO specializes in the development, marketing and distribution of a live audience solution for the audiovisual industry.","VOGO specializes in the development, marketing and distribution of a live audience solution for the audiovisual industry. .The VOGO SPORT solution allows spectators, within a sport, or to an outside event, to access instantly and in real time, via their terminals (smartphones, tablets, etc.) to the flowing of the cameras filming the event. The application offers many features such as live multicam, replay, zoom and slow motion. A version dedicated to professionals (doctors, referees, coaches or journalists) gives access to a mobile and autonomous decision-making tool, used for medical monitoring, arbitration or analysis of athletes' performance."
VIRTUS Data Centres,https://www.crunchbase.com/organization/virtus-data-centres,"Data Center, Information Technology, Software","VIRTUS owns, designs, builds and operates a new generation of agile, connected.","VIRTUS owns, designs, builds and operates a new generation of agile, connected, efficient data centres around the heart of London’s cloud and digital content economy. Located within London’s metro, VIRTUS offers the best of traditional retail colocation including limitless connectivity, dedicated support and complementary ecosystems, combined with the low cost, scalability and custom solutions of the wholesale model, in uniquely flexible and customer friendly packages."
Vox Mobile,https://www.crunchbase.com/organization/vox-mobile,"Messaging, Mobile, Mobile Devices","Vox Mobile offers complete enterprise mobility including mobile technology consulting, management and support to companies.","Since 2004, enterprises in North America and around the globe have come to rely every day on Vox Mobile's Managed Mobility Services (MMS) solutions to ensure their mobile connected workforces are productive, their mobile data is secure and their business models are benefiting from business anywhere capabilities.  Recognized by Gartner, Forrester, IDC, and many others as a leading pure-play mobile specialist, Vox Mobile provides Complete Enterprise Mobility to support Connected Lives. Vox Mobile has been a leader in defining mobile IT services since becoming the very first RIM-certified systems integrator.  As founding members of the Global Enterprise Mobility Alliance (GEMA): a joint venture of top mobile services companies on each continent, Vox Mobile is able to provide companies with both local account management and global, multi-lingual services."
VIVE Style,https://www.crunchbase.com/organization/vive-3,"Fashion, Lifestyle, Women's","Blowout subscriptions for last-minute appointments at the best salons in New York & Chicago, starting at $65 per month.","Vive is the modern beauty concierge for the modern woman. Vive gets you a convenient, top salon appointment in just two taps. Gone are the days of searching, Yelping and calling for an appointment. Vive members can enjoy unlimited blowouts to use at salons in the Vive network."
Verses,https://www.crunchbase.com/organization/verses,,VERSES is a non-profit foundation creating the universal protocols and standards for the next generation of the Web.,"VERSES is building the tools for every creator, designer, developer and imagineer to link their worlds to each other and make them shareable, interoperable, and transactable. "
VRstudios,https://www.crunchbase.com/organization/vrstudios,"Computer, Gaming, Virtual Reality",VRstudios provides a platform for growth and development for our client’s Virtual Reality programs.,"VRstudios offers the only commercially viable wireless, full motion, fully immersive experience in the VR industry. A lightweight wireless headset paired with our DesignWand™ and a system of positional tracking cameras delivers a fully customizable full-body virtual reality environment that avoids the motion sickness that many VR experiences suffer from. Much more than a system of hardware, though, VRstudios is a complete platform for designing and implementing virtual reality experiences. Our expertise combined with your vision will yield a unique set of solutions for your commercial needs."
VHX,https://www.crunchbase.com/organization/vhx,"File Sharing, Internet, Video, Video Streaming",VHX is a video distribution platform built for everyone. We empower creators to sell their work from their own websites.,"VHX is a video distribution platform built for everyone. We empower creators to sell their work from their own websites, directly to their fans. Everything that used to be sold on DVD can be sold on VHX. We have helped publishers sell films, TV shows, comedy specials, live concert footage, lectures, web series, fitness, education, and more. Our publishers have grossed over $6.5 million and served over 1.2 million happy customers to date."
Vorbeck Materials,https://www.crunchbase.com/organization/vorbeck-materials,"Artificial Intelligence, Biotechnology, Enterprise Software, Hardware, Manufacturing, Nanotechnology","Vorbeck Materials develops and manufactures applications using Vor-x, which is a graphene technology.","Vorbeck develops Vor-x® products to meet real-world industrial challenges. Vor-ink™ formulations harness the exceptional conductivity of graphene: ultra-flexible and robust inks and coatings for the printed electronics market. In energy applications, Vor-x® delivers demonstrable performance gains by breaking traditional technology trade-offs between battery capacity and power output. Plastic and rubber composites with low Vor-x® loadings attain extreme levels of strength, dimensional stability, conductivity, and environmental resistance, opening new application and design possibilities. Vor-x®, Vorbeck's proprietary graphene material, was developed in the Chemical Engineering Laboratories of Princeton University by Dr. Ilhan A. Aksay, Dr. Robert K. Prud'homme, and their coworkers. The Princeton team's pioneering work enables large-scale production of graphene. Vorbeck owns an exclusive license on the patented Princeton University graphene technology. Dr. Aksay serves an advisor to Vorbeck and on the Vorbeck Board of Directors. More information on graphene-related work at Princeton University. Since its founding in 2006, Vorbeck has led the way in developing commercial applications for graphene. In 2007, Vorbeck commissioned a ton-scale production facility in Jessup, Maryland. In 2009, Vorbeck launched the world's first commercial graphene-based product, Vor-ink™ and obtained EPA approval for the manufacture of graphene. Vorbeck's experienced staff works with industry partners in the communications, energy, materials, and transportation industries to develop new products using Vorbeck's unique technologies. We welcome innovative development partners with targeted application needs. Email us today and let’s realize the possibilities."
Vidme,https://www.crunchbase.com/organization/bit-kitchen,"Video, Video Advertising, Video Editing, Video on Demand, Video Streaming",Vidme is a startup video lab that makes videos for online viewing.,Vidme is a Los Angeles-based online video sharing platform.
Vesta Property,https://www.crunchbase.com/organization/vesta-global-limited,"Marketplace, Property Management, Real Estate, Real Estate Investment, Rental Property, Residential",Vesta is creating the online marketplace for buying and selling residential rental property.,"Vesta is the new digital property marketplace for the private rented sector (PRS) where people can buy and sell residential rented property designed to make purchasing a property simpler, while reducing the chances of gazumping.  Vesta introduces innovative features – examine rental records, surveys and valuations before making an offer; and buy the property fully tenanted so you don’t need to find a tenant after completion."
Volterion,https://www.crunchbase.com/organization/volterion,"Battery, Clean Energy, CleanTech, Energy Efficiency, Energy Storage, Manufacturing, Renewable Energy, Solar",Volterion develops and manufactures Redox-Flow-Batteries for residential and commercial storage applications.,"Volterion was founded in 2015 as a spin-off of the Fraunhofer Institute UMSICHT. Right from the start, they put their energy into the development of the stack – the energy converter of a redox flow battery and thus the basis for an efficient system. After extensive development work, they now produce their stacks using a unique manufacturing process that they are constantly improving. On this basis, they also develop innovative energy systems such as the powerRFB. A scalable battery in a compact housing that meets the highest industrial demands and is used in many different applications. Sascha Berthold, Thomas Gebauer and Thorsten Seipp are the founders of the company and have been involved in the development of Volterion technology. Together with Kees van de Kerk they form the management today. Volterion has received many awards for its technology and business model, including the ACHEMA Energy Founders Award, the TU Startup Award, the KUER Growing Business Award and the Best Pitches Award."
VST Enterprises,https://www.crunchbase.com/organization/vst-enterprises,"Analytics, Consumer, Cyber Security, E-Commerce, Mobile Payments",VST Enterprises has been widely recognize for its development of VCode.,"Founded in 2012, VST Enterprises has been lauded for its development of VCode, which, among other applications, has the potential to revolutionize financial transactions on the internet. The versatile VCode technology allows genuine users to authenticate themselves across a variety of online transactions and interactions. It is currently being utilized to protect against fraud in many sectors, from document veriﬁcation, to unattended car park payment systems, end-to-end supply chain management and interactive charitable giving transactions."
Viralytics,https://www.crunchbase.com/organization/viralytics,"Biotechnology, Health Care, Therapeutics","Viralytics is an Australian biotechnology company, listed on the Australian Stock Exchange (ASX:VLA) and is quoted on the OTC market","Viralytics is an Australian biotechnology company, listed on the Australian Stock Exchange (ASX:VLA) and is quoted on the OTC market (VRACY). Focused on developing oncolytic virotherapy for the treatment of a wide range of cancers Viralytics' headquarters are in Sydney, Australia and research and operations are in Newcastle, Australia. Oncolytic virotherapy makes use of the cancer destroying capabilities of a range of benign viruses. The potential of oncolytic virotherapy is the ability to treat cancers more effectively and with minimum side-effects."
Visual Vocal,https://www.crunchbase.com/organization/visual-vocal,"Computer, Software, Virtual Reality",Visual Vocal develops and offers a cloud-based platform that converts 3D models of architectural designs into virtual reality.,Visual Vocal develops and offers a cloud-based platform that converts 3D models of architectural designs into virtual reality. The company's platform uses a smart phone as a computer and screen to view 3D models of architectural designs using an application.
Vivoryon Therapeutics,https://www.crunchbase.com/organization/probiodrug,"Biopharma, Biotechnology, Therapeutics",Vivoryon is a clinical stage company focused on bringing first-in-class therapies to patients suffering from age-related diseases.,"Vivoryon Therapeutics has two decades of successful history in bringing pharmaceutical innovation to patients in need. Their programs are based on dedicated research, top-level discovery and determined development. They develop first-in-class medicines that target post-translational modifying enzymes.Their pipeline contains several product candidates across various stages of development, focused on Alzheimer’s Disease and oncology."
VeriSolutions,https://www.crunchbase.com/organization/verisolutions,Software,Early stage Food Tech company providing solutions to the food service industry.,"Founded in 2015, VeriSolutions is an early stage Internet of Things (IoT) technology business that has designed and developed a hardware enabled software platform for restaurants. The platform includes a restaurant operations software suite and a cold-chain solution which consists of a hardware component (sensors to monitor food temperature) and a cold chain management software component."
Verrica Pharmaceuticals,https://www.crunchbase.com/organization/verrica-pharmaceuticals,"Health Care, Medical, Pharmaceutical",Verrica Pharmaceuticals is an innovative clinical-stage medical dermatology company.,"Verrica Pharmaceuticals is a pharmaceutical company developing proprietary topical therapies for the treatment of lesional skin diseases such as Verruca vulgaris (common warts and plantar warts) and Molluscum contagiosum.  Current treatment for these and similar conditions have only limited efficacy, are painful or require daily compliance for an extended treatment period to see results."
Verzeo,https://www.crunchbase.com/organization/verzeo,E-Learning,Verzeo is anAI-focussed edtech startup.,"ducation is often either too expensive or too theoretical. Students may find themselves graduating with absolutely no idea about what awaits them at the workplace. Verzeo is here to help bridge the gap between a students’ classroom environment and their workplace atmosphere. They make this happen for each of their students by using their specially designed Artificial Intelligence based software. They not only help students towards a more holistic education, but also one that prepares you for your career and boosts your opportunities. Verzeo serves as your invisible mentor, taking you through your strengths and weaknesses, and building on them. Training courses, conducting hackathons, participating in start-up events, internships, placement opportunities- they’re all just one click away. Rooted in the wide expanse of the cyberspace, Verzeo is accessible from anywhere, and by anyone."
Volpara Solutions,https://www.crunchbase.com/organization/volpara-solutions,"Health Care, Test and Measurement",Volpara Solutions provides measurement solutions for breast composition in order to improve the health outcomes of women around the world.,"Volpara Solutions is dedicated to providing measurement solutions for breast composition (breast density) in order to improve the health outcomes of women around the world. The company offers a software program to convert any digital mammogram into quantitative data which can be used by radiologists to determine breast density. Its mission is to enable radiologists to provide accurate information and optimal screening protocols for women. Volpara Solutions was founded in 2009 and is based in Rochester, New York, United States."
Vutiliti,https://www.crunchbase.com/organization/vutiliti,"Energy Efficiency, Finance, Natural Resources, Renewable Energy, Smart Cities","Real-time smart building, smart grid, smart city intelligence.","Vutiliti is a real-time utility tracking platform, gathering and providing information on utility usage so that consumers and businesses can monitor and budget utility usage."
Vaultoro,https://www.crunchbase.com/organization/vaultoro-com-the-real-time-bitcoin-gold-trading-platform-and-api,"Bitcoin, Blockchain, Ethereum, Financial Services, Real Time",Vaultoro is a financial technology company specialized in digital assets and commodities trading.,"Vaultoro is a financial technology company specialized in digital assets and commodities trading, founded in 2014 by Joshua and Philip Scigala. They have created a better way to store and invest the value you build. In turn, their solution has opened up the gold market, making it accessible to everyone, regardless of financial background. Vaultoro is part of a profound change in the world of finance led by the blockchain technology, cryptocurrencies and new banking solutions that are transforming the way they save, transfer, spend and invest their money."
Vserv,https://www.crunchbase.com/organization/vserv,"E-Commerce, Emerging Markets, Mobile, Mobile Advertising","Vserv provides a platform that offers mobile advertising solutions for advertisers, developers, and publishers.","Vserv provides a platform that offers mobile advertising solutions for advertisers, developers, and publishers. The company offers advertising formats and targeting capabilities for mobile applications and games, videos, and 3G video voice portals as well as media mobile campaigns. Its application analytics provide real-time data to developers based on how consumers use their mobile applications. Vserv was incorporated in 2010 and is based in Mumbai, India."
VIPThink,https://www.crunchbase.com/organization/vipthink,"Children, E-Learning, Education",VIPThink is a based preschool STEM learning platform.,"VIPThink is an online children's mathematics thinking education brand.  It is a technology-enhancing education, professionally leads the future, based on professional research in cognitive psychology, brain science and subject education, introducing American NCTM evaluation criteria, and developing AIDS thinking (VIPThink) online teaching The system uses multimedia interactive games to create new learning experiences. It uses front-end teaching toys to inspire multiple intelligences, introduces advanced thinking tools at home and abroad, and combines PBL teaching methods to stimulate interest and continuous innovation in the process of self-exploration and active expression. It is previously known as “Happy Seeds” and was founded in 20. It is based on mathematics for thinking training for children aged 3-9."
Vomaris Innovations,https://www.crunchbase.com/organization/vomaris-innovations,"Health Care, Health Diagnostics, Medical Device","Vomaris Innovations, a regenerative medical device company, develops microcurrent field generating technologies for the wound care market.","Vomaris Innovations, Inc., a regenerative medical device company specializing in microcurrent field generating technologies for the wound care market, announced that eight scientific and clinical abstracts on its flagship product Procellera® will be presented at the 26th Annual Symposium on Advanced Wound Care (SAWC) May 2 - 5, 2013 at the Denver Convention Center."
Vagabond Vending,https://www.crunchbase.com/organization/vagabond,"Business Intelligence, Mobile, Real Time, Software","Vagabond delivers real-time business intelligence to the palm of an operator’s hand to make a leaner, smarter and more profitable business.","Vagabond is a real-time and mobile-focused vending management software service. Their Insight telemetry hardware enables vending operators to have live views of all their machines. No more purchasing bulky vending-only handhelds; customers use their own Apple, Android and Kindle devices to manage the vending operation using Vagabond's OS-native mobile app. Their simple and intuitive mobile app and web interface are designed so self-described ""non tech savvy"" vending operators and drivers can immediately start using Vagabond"
Valley Health System,https://www.crunchbase.com/organization/valley-health-system,"Health Care, Hospital",Valley Health System  is a healthcare system,
Visly,https://www.crunchbase.com/organization/visly,"Apps, Developer Tools",Visly  is a the design tool for front-end engineers.,Visly  is a the design tool for front-end engineers.
Vital Insights Inc.,https://www.crunchbase.com/organization/vital-insight,"Automotive, Enterprise Software, Professional Services, Software","Vital Insights is the leading designer, developer & distributor of customer experience management solutions for the automotive industry.","Vital Insights, a Mississauga, Ontario, Canada-based provider of enterprise customer experience management (CEM) software solutions. Led by Jason Tryfon, President & CEO, Vital Insights designs, develops and distributes enterprise-class daily tracking and Customer Experience Management (CEM) solutions. Its product lineup is Foresight™, a platform that distributes, gathers, and manages customer feedback. The company’s newest product Foresight Mobile™ – a mobile application for CEM – gives users a tool to respond to time-sensitive issues, preventing possible customer defections directly from their wireless smartphones."
Vizzario,https://www.crunchbase.com/organization/vizzario,"Analytics, Artificial Intelligence, Big Data, Business Intelligence, Human Resources, Information Technology, Predictive Analytics, Robotics","Through a combination of Neuroscience and AI, Vizzario enables technology to better understand human behavior","Deeper understanding of consumer engagement, productivity, performance, and device optimization across multiple industries"
