Organization Name,Organization Name URL,Categories,Description,Full Description
EarthNow,https://www.crunchbase.com/organization/earthnow,"Big Data, Computer Vision, Geospatial, GreenTech, Machine Learning, Photo Sharing, Video Streaming",EarthNow provides pictures of the planet on demand and real-time video anywhere a client desires.,"EarthNow provides pictures of the planet on demand and real-time video anywhere a client desires. EarthNow is creating the means for anyone to instantly see almost anywhere on Earth in “true real-time,” giving anyone a live and unfiltered view of your planet. The company's aim is for you to experience Earth’s beauty and its fragility, and to recognize the importance of being good stewards of our world. Via a constellation of advanced imaging satellites, EarthNow will deliver an unprecedented and highly valuable user experience: continuous real-time video of the Earth enhanced by machine intelligence."
Earth Class Mail,https://www.crunchbase.com/organization/earthclassmail,"Document Management, Email, Internet, Messaging, SaaS, Software","All your postal mail and paper documents accessible in the cloud. Secure, fully searchable, and always actionable.","Earth Class Mail, the leader in office mail automation for over a decade, provides businesses with the most efficient and secure way to deal with physical office mail. As our world inches closer and closer to becoming completely digital, we solve a problem faced by most businesses today, especially those receiving important, time sensitive mail, or mail received on behalf, or in service, of their clients.  For small firms to larger enterprises, Earth Class Mail provides the largest network of virtual addresses, receives and scans postal mail, deposits checks, and provides expert handling of virtually anything else that comes with the management of physical office mail and parcels from USPS, FedEx, UPS and others (sorting, storing, forwarding). Earth Class Mail eliminates pain, inefficiency, and mitigates the risks associated with physical mail by securely handling, digitizing and making office mail both searchable and actionable for tens of thousands of users, spanning a variety of industries, all with unique use cases. "
Earnieland,https://www.crunchbase.com/organization/earnieland,"Communities, E-Commerce, Marketplace, Shopping",Earnieland is an online shopping community where users buy cheaper & partner shops enjoy loyal shoppers. ,Earnieland is an online shopping community where users buy cheaper & partner shops enjoy loyal shoppers. 
EasyLinkin,https://www.crunchbase.com/organization/easylinkin,"Enterprise, Service Industry",A high-tech enterprise specializing in R&D and application of low-power wide area internet of things (LPWAN) core technology. ,"A high-tech enterprise specializing in R&D and application of low-power wide area internet of things (LPWAN) core technology. The company was jointly founded by the world's top 500 corporate executives, the University of California, Tsinghua University, Huazhong University of Science and Technology and other famous university professors in the innovative highland ""Wuhan Optics Valley"" in Central China. The company is committed to the construction, operation, maintenance and service of city-level and industry-level LPWAN networks. The company's LPWAN network and solutions have been widely used in many areas of smart city construction.       The company is a member of the LoRa Alliance, an international LPWAN standards organization, a member of the National IoT Foundation Standards Working Group, the first batch of growth camp selection companies in the ARM Greater China Central, and the 3,051 enterprise in Wuhan Donghu Development Zone. Their company has passed the ISO9001 quality certification system; and the products have passed the European Union (CE) quality certification and the National Radio Management Committee (SRSA) certification. Dozens of patents and software copyrights have been accumulated.            The company is committed to the construction, operation, maintenance and service of city-level and industry-level LPWAN networks. The core networking products include: LPWAN communication base stations, transceiver nodes, ad hoc network protocol stacks, network management systems, and cloud platforms, with high sensitivity, low power consumption, wireless ad hoc networks, security and reliability. The company's LPWAN network and solutions have been widely used in many areas of smart city construction. "
Eachbaby,https://www.crunchbase.com/organization/eachbaby,"Baby, Education, Information Services, Information Technology, Internet",Eachbaby is a Chinese information service provider focused on baby interaction education services.,"Eachbaby (网趣宝贝/梓洋网络) is a Chinese information service provider focused on baby interaction education services.  Eachbaby provides digital early childhood education services for babies between 0 to 6 years old. The company aims to build a comprehensive development platform that helps parents find content suitable for their baby, while satisfying the multiple aspects of parenting. Its customer base is over 60 million netizen parents in China."
EarnAway,https://www.crunchbase.com/organization/earnaway,"Internet, Travel",EarnAway is a hotel discovery and rewards platform with the mission to make hotel booking easier and more rewarding for our members,"EarnAway is a web-based travel company. It offers a platform that enables its users to compare hotel deals on other sites in the web. Their platform allows users to search destinations, explore hotels that are ranked and reviewed by other travelers beforehand, or search hotels by their names; and view the rooms available for booking purposes. The company offers a loyalty system called away points for the travelers that book travels using their platform. These points can be converted as cash into user’s bank or PayPal accounts, Amazon gift cards or a range of other shopping gift cards, and air miles. EarnAway was founded by Robert Berrisford and Joshua James in 2015; and is headquartered in London."
Earthmill,https://www.crunchbase.com/organization/earthmill,"Energy, Environmental Engineering, Renewable Energy",Earthmill is a wind turbine supplier and installer in UK.,"Earthmill is the largest 50-250kW wind turbine supplier and installer in the UK.  Specialising in the agricultural industry, we handle every stage of wind turbine projects in-house from planning right through to installation and maintenance.  A wind turbine is an ideal way to generate your own free electricity, earn regular extra income and drive down your carbon footprint.  As the windiest country in Europe, onshore wind power generation is the most cost effective way of producing renewable energy in the UK.  A wind turbine only usually takes up around 6m2 of space and the surrounding land remains completely suitable for normal agricultural use.  When you take all of these factors into consideration, a wind turbine is an ideal route to becoming a more sustainable supplier."
Easy Nirman,https://www.crunchbase.com/organization/easy-nirman,"Building Maintenance, Construction, E-Commerce, Marketplace","Easy Nirman is a market place for all the construction products ,services and solutions.","Easy Nirman India's first leading online building material providing e-commerce company to provide all your construction's solution where you buy or sell anything related to building improvement, bathroom, electrical, lighting etc at high discount prices."
Easy Khaana,https://www.crunchbase.com/organization/easy-khaana,"Delivery, E-Commerce, Food Processing, Logistics, Supply Chain Management",Easy Khaana is a caters meal boxes to corporates and individuals in Gurgao,"EasyKhaana offers you homely meals so that you never miss your Ghar ka Khaana! We provide Daily Changing, Deliciously Cooked & Timely Served meals at your office or home - wherever you like."
EasyPreOrders,https://www.crunchbase.com/organization/easypreorders,"Event Management, Hospitality",EasyPreOrders operates as a pre-order and pre-payment booking platform.,"EasyPreOrders is an online PreOrder, PrePayment, and events management platform for restaurants to manage groups and individuals dining needs. Partnered with Bookatable, we are revolutionising the way your business collects information in order to help reduce costs, optimise operations and increase revenue."
EarWays Medical,https://www.crunchbase.com/organization/earways-medical,Medical Device,EarWays Medical is an innovator of ear-care solutions.,"EARWAYS MEDICAL Ltd. is a leading innovator of ear-care solutions. Founded to enhance the well-being of millions of children and adults worldwide, EARWAYS MEDICAL provides easy-to use ear care products designed for clinicians and use at home.  Boosted by an inherent medical demand and backed by clinical evidence, the Company benefits from a team of world-class experts in bioengineering, medical devices, ear surgery, hearing loss and rehabilitation. Together with our experienced entrepreneurs, with vast business and marketing knowhow, EARWAYS MEDICAL is positioned to transform accessible ear care."
EagleNinja,https://www.crunchbase.com/organization/eagleninja,"Direct Marketing, E-Commerce, Gamification, Location Based Services, Mobile, Mobile Advertising",EagleNinja is a mobile technology company provides Mobile Marketing & Advertising Gamification Platform.,"MOBILE QUEST MARKETING Services The Eagle Ninja platform leverages location based services (""Ability"") and contextual data (""Motivation"") to invite prospects on Quests using monetary and point rewards (""Trigger""). A variety of interactions can be designed as part of a Quest, froServicesm digital micro-games, to taking pictures, viewing videos, answering questions designed to reinforce branding & messaging, and shopping and discovery actions. Quest can be used to foster conversion (""one-off behaviour"") or adoption (""long term behaviour change"") through consecutive ""re-targeting"" Quests, as well as branding and social sharing. Link to a brief commercial deck: https://docs.google.com/a/eagleninja.com/file/d/0B7wfqLi-9JuWYWczX0h1TWluc28/edit?pli=1"
EasyG,https://www.crunchbase.com/organization/easyg,"Automotive, Health Care, Logistics, Medical Device, Robotics, Sensor",EasyG LLC is a startup that is in the developmental stages of a novel sensor solution for the medical and automotive markets.,"EasyG LLC is a startup that is in the developmental stages of a novel sensor solution for the medical and automotive markets. The sensor design enables users to wirelessly pick up the electrical signals of the heart without direct contact with the human body. The vision of the company is to transform wearables into invisibles. In a world where knowledge is power, EasyG’s sensors and intuitive software will make the unknown, known; the reactive, proactive. Our world-class sensor design enables fast, easy and lifesaving solutions that have not yet been realized in today's markets. These sensors will empower and aid all stakeholders in the health information chain, driving efficiencies and cost savings through innovative monitoring and alert systems."
EAB - Education business,https://www.crunchbase.com/organization/eab-education-business,Higher Education,"EAB is the leading provider of best practices research, student success management software, and data-enabled enrollment solutions.","EAB is the leading provider of best practices research, student success management software, and data-enabled enrollment solutions to the not-for-profit higher education and K-12 markets. The Company’s solutions help institutions increase enrollment yield, balance financial aid with revenue generation, drive higher student retention and success, and implement industry best practices derived from benchmarking and research. EAB’s solutions are used by more than 1,100 higher education institutions, including 91 of the 100 U.S. News & World Report’s top universities, and nearly 100 K-12 institutions and districts. "
Easytobook.com,https://www.crunchbase.com/organization/easytobook-com,"E-Commerce, Travel",EasyToBook.com offers information on rates and availability of hotels in many destinations worldwide.,"EasyToBook.com offers over 170,000 hotels in more than 10,000 destinations worldwide. A site for all who need to make a hotel reservation with the best rates and availability (with best rate guarantee). Our goal is to provide our customers the most attractive accommodation deals with the best user experience. We find it very important to be flexible for travelers. Therefore we offer our customers the flexibility to choose  reservations that can be changed up to 24 hours before arrival with payment at the hotel upon departure or pre-paid bookings that secure rooms and provide peace of mind. In our 10 years, we have reserved more than 10 million room nights for our customers, while operating in 12 languages and more than 100 currencies. We have global reach and operations with offices in Europe, Middle East, Asia and US. Our staff hails from more than 30 different countries and is passionate about the intersection of travel and technology in support of our customers.  Easytobook excels at sourcing accommodations from multiple suppliers and hotels directly using industry leading technology to ensure the best rates and room availability.  We are on the constant lookout for new talent and opportunities. Please check out our website for career opportunities, contact information or simply to make a hotel reservation. In February, 2014, Make My Trip, (NASDAQ: MMYT) acquired Easytobook Holdings from Travix International B.V. in order to deepen the strength of it hotel reservations capabilities and provide an expansion footprint to new geographies."
EasyWay Ordering,https://www.crunchbase.com/organization/easyway-ordering,"E-Commerce, Information Services, Information Technology, Software",The mission of EasyWay Ordering is to arm independent restaurant operators with powerful and easy to use online ordering technology.,"The mission of EasyWay Ordering is to arm independent restaurant operators with powerful and easy to use online ordering technology, enabling them to compete better and better serve their customer.   Our goal is to become the industry standard platform by aggressively marketing our product and partnering with companies who are in a position to influence and educate restaurant owners. Our management team has extensive experience and relationships in closely related verticals and our current partners include Point Of Sale manufacturers, web designers, merchant service providers and food distributors.   Our immediate objective is to acquire and retain 1000 new restaurant subscribers, each netting us $50 p/m on average, in the next 6 months at a Cost Per Acquisition of $250 or less.   We need $1,000,000 over the next 12 months during which time we will reach $100,000 in net recurring monthly revenue.  We are interested in debt and / or equity investments."
Eaglet Eye,https://www.crunchbase.com/organization/eaglet-eye,"Eyewear, Medical Device",Eaglet Eye develops innovative medical devices for ophthalmology and developed its first device aimed at the application of contact lenses. ,"Eaglet Eye is a technology company developing innovative medical devices for ophthalmology. Our objective is to apply breakthrough technology to improve lives for both eye care professionals as well as their patients. Our technology is at the forefront of the industry, raising standards and enabling eye-care professionals to make ever more accurate diagnoses. We are driven by the desire to improve visual acuity through enhancing contact lens fitting procedures. Our latest technology, the Eye Surface Profiler (ESP) allows for a more precise eye measurement than ever before, improving the fit and comfort of contact lenses for everyone."
Earwig Academic Reporting,https://www.crunchbase.com/organization/earwig-academic-reporting,"Education, Mobile Apps, Video","Earwig Academic Reporting is an application that provides students with academic timelines of photos, videos, and documents.","Earwig Academic Reporting is an application that provides students with academic timelines of photos, videos, and documents. It was launched in Ripley, North Yorkshire, United Kingdom."
Eagle Investment Systems,https://www.crunchbase.com/organization/eagle-investment-systems,"Asset Management, Data Visualization, Financial Services","Eagle Investment Systems provides data management, investment accounting and performance measurement technology solutions.","Eagle Investment Systems provides data management, investment accounting and performance measurement technology solutions to global asset managers. Eagle's advanced technologies can help you transform your business, so you can do more, more efficiently. Some of the world’s most successful companies rely on their innovative data management, investment accounting and performance measurement solutions to make smarter decisions. Contact us now to find out how they can help your business grow assets more efficiently."
Early Autumn,https://www.crunchbase.com/organization/early-autumn,"Manufacturing, Textiles","Early Autumn has manufacturing Clothing, footwear and headgear.","Early Autumn has manufacturing Clothing, footwear and headgear."
Easyworks Universe,https://www.crunchbase.com/organization/easyworks-universe,"Mobile Apps, Recruiting, Social Media, Software, Web Design","Easyworks Universe is a Korean-based startup company engaged in the development of Planet Jack, a web portal for designers.","Easyworks Universe is a Korean-based startup company engaged in the development of Planet Jack, a place where creative professionals can share their visual resume and network with other creative artists The company released Planet Jack as an iOS app to enable graphic designers and artists to share their portfolio and contact information with other users. Planet Jack was released as an open beta at the end of May 2013. The full version of Planet Jack is going to be released under the name Visumé in early September, 2013."
Easynvest,https://www.crunchbase.com/organization/easynvest,"Financial Services, Real Estate Investment",An online platform with no complications.,"Founded in 1968, Easynvest was one of the first companies to offer online access to the stock exchange in 1999 and the first to offer mobile access to the fixed-income market in 2016. With more than 150,000 active users, over R$10 billion in assets under custody, and leadership in the distribution of Tesouro Direto (government bonds), it is the fastest-growing company in its segment and has a leading position in the development of technology and innovations in financial services in Brazil. On Easynvest’s platform, self-directed individuals can evaluate, compare and invest in a wide range of financial instruments, including public securities, private securities and mutual funds, as well as trade in equities, options and futures."
Easiread,https://www.crunchbase.com/organization/easiread,"Reading Apps, Software",Easiread is a typography system to help with improving reading fluency and accuracy for people with specific kinds of reading difficulties.,Easiread is a typography system to help with improving reading fluency and accuracy for people with specific kinds of reading difficulties.
Easyhome,https://www.crunchbase.com/organization/easyhome,"Consumer Electronics, Consumer Goods, Electronics, Real Estate",Easyhome is a merchandise leasing company that offers home appliances and electronic products for lease.,
EasyGlic,https://www.crunchbase.com/organization/easyglic,"Electronics, Health Care, Mobile Apps",EasyGlic is a non-invasive hypoglycemia detection technology.,EasyGlic is a non-invasive hypoglycemia detection technology. Their solution is aimed at people who suffer from sudden reductions in glucose levels in their blood system and alerts users about possible signs of this state of health. 
EAP Technology Systems,https://www.crunchbase.com/organization/eap-technology-systems,"Consulting, Enterprise Software, Information Technology, Software, Training","EAP Technology Systems offers software systems, consulting and strategic planning services, and training programs on employee assistance.","EAP Technology Systems Inc. (EAP Tech) was formed in May of 1999 by Dr. Tom Amaral, Ph.D. The company’s first hosted software system, EAPISoft, was released soon after that, and versions of the product have been used by companies nationwide ever since. EAP Tech has also offered advanced trainings on EAP-related topics as well as business consulting and strategic planning services. In 2011, Dr. Amaral began building a team of prominent business leaders and respected EAP professionals to design EAP Connect™, a leading-edge software technology platform for the next generation of employee assistance programs."
Early Bird IELTS,https://www.crunchbase.com/organization/early-bird-ielts,Education,Early Bird IELTS is an Education platform.,
Easpeed Technology,https://www.crunchbase.com/organization/easpeed-technology,Media and Entertainment,Easpeed Technology is a Chinese new media solution provider.,
East Street Arts,https://www.crunchbase.com/organization/east-street-arts,"Art, Professional Services, Space Travel",East Street Arts is a contemporary arts organisation in Leeds. ,"East Street Arts is a contemporary arts organisation working across the UK and EU. Their mission is to support artists to create work that brings lasting change to their everyday lives. Through their activities programme, professional development and being a leading provider of temporary and permanent space to the creative community."
East End Manufacturing,https://www.crunchbase.com/organization/east-end-manufacturing,"Fashion, Lifestyle, Men's, Shopping","East End Manufacturing is a UK-based clothing factory focused on jersey clothing, menswear, T-shirts, and womenswear.","East End Manufacturing focuses on jersey clothing and also cotton, with options for sampling and smaller runs (no less than 50 pieces per style), including menswear, T-shirts and womenswear.  They aim to turn around orders quickly with a high level of quality control.  You will receive a detailed quote for the manufacturing service (CMT - cut, make and trim) and their machinists, cutters and pressers each have many years experience to do the job well with a fast turnaround time. They also believe in ethical working conditions and hope to set a benchmark for others to follow in the industry."
Easy Pairings,https://www.crunchbase.com/organization/easypairings-com,"Employment, Hospitality, Human Resources, Recruiting, Restaurants",Employment marketplace that allows restaurants and job seekers to experience low friction job matching and interview scheduling.,"Easy Pairings empowers restaurants to find staff — faster and cheaper. They make searching and hiring for front-of-house positions (servers, bartenders and hosts) a snap. From fine dining restaurateurs to fast-casual operators, employers get instant, free access to active job seekers — bringing efficiency to the hiring process and drastically reducing time-to-hire. Job seekers receive customized employment opportunities that match their experience, which they can apply to with a single click."
East of Eden,https://www.crunchbase.com/organization/east-of-eden,"Fitness, Sports, Wellness","East of Eden is a yoga, Pilates and lifestyle brand, currently with 1 studio in Walthamstow, N.E. London.",
Easy Law,https://www.crunchbase.com/organization/easy-law,Legal,Easy Law provides a platform which offers legal services such as compiling of legal documents.,Easy Law - Free legal support to individuals in the preparation of standard legal documents.
Easyponic,https://www.crunchbase.com/organization/easyponic,"Agriculture, Artificial Intelligence, Sensor","Easyponic is the developer of Nanny, an agricultural intelligence device that takes care of hydroponic cultures. ","Easyponic is the developer of Nanny, an agricultural intelligence device that takes care of hydroponic cultures. "
EasyCare,https://www.crunchbase.com/organization/easycare,"Apps, Health Care, Home Services, Medical, Nursing and Residential Care",EasyCare is a health-care platform which matches care service demand with reliable workforce supply.,"Easycare is a one-stop platform for family and institution to book qualified caregivers with standard pricing, transparent information, and flexibility. Instead of tedious process to confirm with traditional agencies, now it only takes one minute from selection, scheduling, to payment with Easycare.  Home Care Assistants and Personal Care Workers categories are now live on Easycare.  They also provide Human Resource Solutions for health institutions."
Eanovation,https://www.crunchbase.com/organization/eanovation,"Construction, E-Commerce, Home Improvement, Software","Your automated project manager for home renovation. We provide standardized packages for design, construction and materials.","Eanovation provides an easy and affordable renovation solution for everyone.  We are a construction/tech company that provides end-to-end services, which includes: permit, design, material selection, and construction services. We partner to experts in each pillar to provide the full experience that traditional company provides, adding technology to make the experience better and more efficient. Given the housing shortage in the bay area, we have already received +300 inquiries and finished 25 projects in the first 4 months of bootstrapping."
