Organization Name,Organization Name URL,Categories,Description,Full Description
Apple,https://www.crunchbase.com/organization/apple,"Consumer Electronics, Electronics, Hardware, Mobile Devices, Retail, Software","Apple is a multinational corporation that designs, manufactures, and markets consumer electronics, personal computers, and software.","Apple is a multinational corporation that designs, manufactures, and markets mobile communication and media devices, personal computers, portable digital music players, and sells a variety of related software, services, peripherals, networking solutions, and third-party digital content and applications. Apple provides many products and services, including iPhone; iPad; iPod; Mac; Apple TV; a portfolio of consumer and professional software applications; the iOS and OS X operating systems; iCloud; and accessories, service, and support offerings.  It sells its products worldwide through its retail stores, online stores, direct sales force and third-party cellular network carriers, wholesalers, retailers, and value-added resellers to the consumer and also sells third-party iPhone, iPad, Mac and iPod compatible products, including application software and accessories through its online and retail stores. Introduced in 1984, the Macintosh was the first widely sold personal computer with a graphical user interface (GUI). That feature and others such as an improved floppy drive design and a low-cost hard drive that made data retrieval faster helped Apple cultivate a reputation for innovation. Apple was named as the most admired company in the United States in 2008 and in the world from 2008 to 2012 by the Fortune magazine. The company was founded by Steven Paul Jobs, Steve Wozniak, and Ronald Gerald Wayne on April 1, 1976, and is headquartered in Cupertino, California."
AppyParking,https://www.crunchbase.com/organization/appyparking,"Apps, Automotive, Autonomous Vehicles, Internet of Things, Parking, SaaS, Smart Cities, Ticketing",AppyParking is a kerbside management & technology firm enabling intelligent mobility for cities,"AppyParking is on a mission to make parking a truly forgettable experience. We understand how fragmented infrastructures and stand-alone solutions cause stress and hassle for the most mundane of daily tasks, like finding and paying for a parking space. We know there’s a better way of doing things and so we’re building innovative and future-ready solutions from the bottom up, to improve the way parking is accessed and managed.   Our holistic kerbside management platform provides a ‘future of mobility’ conduit between the private and public sector, ensuring standardised kerbside data can flow between local authorities and mobility operators, unlocking the barriers that hinder the adoption of intelligent mobility solutions. Armed with best-in-class data, mobility APIs and our Govtech platform, we're now on a global mission to make the kerb work for everyone, physically, socially and commercially.  AppyParking was named 2018 Best Parking App by Auto Express and 2017 Best UK Start-Up by Credit Suisse and received the 2019 Smarter Travel Innovation Award from Smarter Travel. AppyParking was founded in 2013 and is headquartered in England, UK."
AppsFlyer,https://www.crunchbase.com/organization/appsflyer,"Advertising, Analytics, Android, Apps, iOS, Marketing, Mobile, SaaS, Software",AppsFlyer is the global leading platform for Mobile Attribution & Marketing Analytics.,"AppsFlyer is the global leader in mobile attribution and marketing analytics. Data-driven marketers trust AppsFlyer for independent measurement solutions and innovative tools to grow and protect their mobile business. AppsFlyer's platform processes billions of mobile actions every day, empowering marketers and developers to maximize the return on their marketing investments. AppsFlyer's People-based Attribution, NativeTrack™ Attribution, Marketing Analytics Data, OneLink's Deep linking capabilities and Protect360 enterprise-grade fraud solutions have made AppsFlyer's platform the go-to resource for the most successful mobile apps in the world. With Facebook, Google, Twitter, Pinterest, Snap Inc., Tencent and 4,600+ other integrated partners, and clients including HBO, Waze, Alibaba, Skyscanner, Activision and 12,000+ leading brands worldwide, AppsFlyer has 15 global offices to support marketers everywhere. To learn more, visit www.appsflyer.com."
App Annie,https://www.crunchbase.com/organization/app-annie,"Analytics, Big Data, Mobile, SaaS",App Annie delivers data and insights to succeed in the app economy.,"App Annie is a decision­-making platform for the mobile app economy. App Annie combines the analytics of one’s own apps with a granular understanding of the competition and market to provide a unique 360­-degree view of one’s mobile business. The App Annie platform is relied upon by over 90 percent of the top 100 publishers and more than 700,000 apps. Customers of App Annie's Intelligence product include the likes of Electronic Arts, Google, LinkedIn, Line, Microsoft, Nexon, Nestle, Samsung, Tencent, Bandai Namco, and Universal Studios. The company has tracked over 83 billion downloads and more than US $25 billion in gross revenues to date, the industry leader by far. App Annie is a privately held global company of more than 300+ employees headquartered in San Francisco with offices in Amsterdam, Beijing, Hong Kong, London, Moscow, New York, Seoul, Shanghai, and Tokyo. The company is backed by leading venture investors including eVentures, Greycroft Partners, IDG Capital Partners, Infinity Venture Partners, Institutional Venture Partners and Sequoia Capital with $94 million raised to-date. The App Annie product suite consists of three main products: Store Stats, App Store Analytics, and Intelligence. It has also released products to track the eBooks and mobile ad industries."
Aphria,https://www.crunchbase.com/organization/aphria,"Alternative Medicine, Cannabis, Medical, Pharmaceutical",Aphria is a Canada-based company committed to providing accessible medical cannabis.,"Founded in 2013, Aphria is integrating their growing expertise with Health Canada’s new Marijuana for Medical Purposes Regulations (MMPR) for medicinal marijuana industry. Possessing greenhouse related growing experience in plant and produce related expertise since 1943, Aphria is positioned to be an industry leader in providing patients with the highest quality medical marijuana. Aphria has developed integrated greenhouse growing solutions specifically focused on quality production of cannabis. With the authorization of quantity scale marijuana growing, Aphria greenhouse operations are a natural fit."
Apptio,https://www.crunchbase.com/organization/apptio,"Enterprise Software, Information Technology, SaaS",Apptio is a provider of SaaS-based Technology Business Management (TBM) solutions for managing businesses in the IT field.,"Apptio is the leading provider of cloud-based Technology Business Management (TBM) software that helps CIOs manage the business of IT. Apptio’s suite of applications use business analytics to provide facts and insights about technology cost, value, and quality, so IT leaders can make faster, data-driven decisions. The purpose-built applications help companies align technology spend to business outcomes and automate IT processes like cost transparency, benchmarking, showback/chargeback, operational efficiency, and planning. Powering Apptio’s applications is a next generation, in-memory cost analytics platform that takes data directly from all financial, operational, and billing systems, and powers applications that give customers deep insight. This insight spans infrastructure, applications, and business services, both on-premises and in the cloud. Hundreds of customers, including more than a third of the Fortune 100, choose Apptio as their business system of record for IT.  For more information, visit the Apptio website or the Apptio blog at www.apptio.com."
AppLovin,https://www.crunchbase.com/organization/applovin,"Advertising, Mobile, Mobile Apps","AppLovin helps mobile game developers acquire new users, access insights, monetize and publish their games - all in one place.","AppLovin helps indie and established mobile game developers connect with billions of global users each month so they can get discovered. Founded in 2012, the company provides a set of solutions developers need to monetize, publish, understand, and grow their businesses—all in one place. Developers use the AppLovin marketing platform and powerful analytics tools to acquire new users and monetize their games. Lion Studios, AppLovin’s independent media division, gives developers access to proven resources for publishing and promoting their apps. AppLovin is headquartered in Palo Alto with offices in San Francisco, New York, Dublin, Beijing, Tokyo, Seoul, and Berlin."
Apervita,https://www.crunchbase.com/organization/pervasive-health,"Analytics, Content Delivery Network, Developer Platform, Health Care, Information Technology, Marketplace",Apervita is a platform that enables the digitalization of massive amounts of health analytics at once.,"Apervita, Inc., formerly known as Pervasive Health, is a platform that enables the digitalization of massive amounts of health analytics at once. Health enterprises use Apervita technologies to turn their medical intellectual property to computable content which in turn can be commercialized globally through the company’s market.  Professionals can browse through a broad selection of curated medical content, subscribe to it, connect their own data sets, and publish results into their workflow. The available content covers clinical, operational, and financial use cases, including readmission prevention, chronic disease management, protocol compliance, rapid detection of patient health deterioration, infection early warnings, health complication risks, missing diagnosis detection, problem list improvement, triage prediction, and personal medical device assessment. The HIPAA secure platform supports open standards and can be connected through modern web services to EMRs, portals, and point-of-care systems. Apervita, Inc. was founded in January 2011 and is based in Chicago, Illinois."
Appnovation,https://www.crunchbase.com/organization/appnovation-technologies,"Big Data, Business Intelligence, Consulting, Content, E-Commerce, Mobile, Open Source, Software, Web Development","Appnovation is a global Digital Solutions and Managed Services provider, delivering strategy, app development and enterprise integrations.","Appnovation is a global Digital Solutions and Managed Services provider delivering strategy, application development and enterprise integration on leading open technologies. Appnovation’s in-house experts build high-performing, secure digital experiences while providing a full range of creative capabilities, coupled with 24/7 support and maintenance."
AppDynamics,https://www.crunchbase.com/organization/appdynamics,"Business Intelligence, Information Services, Information Technology",AppDynamics develops application performance management (APM) solutions that deliver problem resolution for highly distributed applications.,"The AppDynamics platform gives today’s software-defined businesses the ability to analyze and optimize digital business performance in real time. AppDynamics is led by a senior team of innovators with deep experience in application performance management, systems management and distributed systems. With a pedigree that includes companies such as CA Wily, HP Mercury, BMC, Oracle, Sun, and McAfee, the team has created enterprise-grade solutions deployed at thousands of organizations.  At AppDynamics, their Application Intelligence Platform empowers today’s software-defined businesses with the ability to proactively monitor, manage and optimize the most complex software environments. Because they start with user interactions, their platform is able to dynamically collect millions of performance data points across your applications and infrastructure. They then apply intelligence to instantly identify performance anomalies, enable automatic fixes and continuously measure business impact.  All this happens in real time, in production, with cloud or on-premise deployment flexibility. So even in the most dynamic production environments, you can know more and know it faster. It’s more than monitoring—it’s true Application Intelligence."
AppViewX,https://www.crunchbase.com/organization/appviewx,"Cyber Security, Enterprise Software, Network Security, Security",AppViewX is a Cyber Security Company automating security for digital certificates and keys management,"AppViewX is revolutionizing the manner in which NetOps and SecOps teams deliver services to the rest of Enterprise IT. The AppViewX Platform is a modular, low-code software application that enables the automation and orchestration of network infrastructure using an intuitive, context-aware, visual workflow. Leveraging a vast library of pre-built tasks and workflows, the platform enables Ops teams to quickly and easily translate business requirements into automation workflows that improve agility, enforce compliance, eliminate errors, and reduce cost. AppViewX customers include a significant number of Fortune 500 companies which use the AppViewX Platform at scale. AppViewX is headquartered in Seattle with additional offices in the U.S., U.K., and India."
Appian,https://www.crunchbase.com/organization/appian,"Cloud Computing, Developer Tools, Enterprise Software, Industrial, Mobile, Software",Appian provides a leading low-code software development platform that enables organizations to rapidly develop powerful applications.,"Appian provides a leading low-code software development platform that enables organizations to rapidly develop powerful and unique applications. The applications created on Appian’s platform help companies drive digital transformation and competitive differentiation. For more information, visit www.appian.com."
Applied Intuition,https://www.crunchbase.com/organization/applied-intuition,"Autonomous Vehicles, Enterprise Software, Infrastructure, Software","Applied Intuition provides software infrastructure to safely develop, test, and deploy autonomous vehicles  at scale.","As the foremost enabler of autonomous vehicle development, Applied Intuition equips engineering and product development teams with software that makes it faster, safer, and easier to bring autonomy to market.  Applied’s suite of products, focused on simulation and analytics, delivers sophisticated infrastructure built for scale. Industry leading companies of all sizes use Applied to comprehensively test and rapidly accelerate their autonomous vehicle development. Headquartered in Silicon Valley with offices in Detroit, Tokyo, and Munich, Applied is composed of software and automotive experts from the top companies in their respective fields (such as Google, Amazon, Apple, Waymo, Tesla, Delphi, GM, and Bosch)."
AppFollow,https://www.crunchbase.com/organization/appfollow,"Analytics, Android, iOS, Mobile, Mobile Apps, SaaS","AppFollow delivers you critical analytics around app reviews and search result positions straight to email, Slack, Zendesk & more.","If you have a mobile app, you need AppFollow.  AppFollow delivers you critical analytics around app reviews and search result positions straight to email, Slack, Zendesk, Helpshift, Intercom and 30 more integrations. AppFollow helps mobile app owners to track keywords performance,  increase your organic installs with ASO (App Store Optimization) Tools, track competitors and market leaders.  AppFollow supports 5 stores (App Store, Google Play, Microsoft Store and Mac App Store, Amazon), has 30+ integrations with the most popular services, translation from 31 language, covering all countries. Over 30 000 companies from all over the world trust AppFollow with their app growth including HBO, Merc, Sky, Wrike, Airbnb, Hubspot, Uber, Swisscom, Robinhood, Gett, Jam City, Pixonic, Wargaming,  and more."
AppDirect,https://www.crunchbase.com/organization/appdirect,"Apps, Enterprise Software, IaaS, Internet, PaaS, SaaS",AppDirect provides the only end-to-end cloud commerce platform for succeeding in the digital economy. ,"AppDirect is the cloud service commerce leader making software and products accessible globally. The AppDirect cloud service commerce platform unites providers, developers and consumers of cloud services into a single ecosystem. This makes it easy for businesses to find, buy, manage and monitor cloud services from a central location and delivers new opportunities to distribute, sell, and market cloud services. AppDirect-powered marketplaces, billing and distribution, and reselling services help providers – including Telstra, ADP, Samsung, Deutsche Telekom and others – connect millions of businesses to solutions from Microsoft, Google, Box and more. AppDirect is headquartered in San Francisco with global offices."
AppZen,https://www.crunchbase.com/organization/appzen,"Accounting, Artificial Intelligence, Big Data, Enterprise Software, FinTech, SaaS",AppZen is an artificial intelligence platform for finance team.,"AppZen delivers the world’s leading AI platform for modern finance teams. Starting with business spend, we automate manual process, uncover problems, and optimize decision making for enterprises around the globe, including one-fourth of the Fortune 500.  Our platform combines patented deep learning, computer vision, and semantic analysis with intelligence from thousands of online data sources to understand financial transactions in business context and make decisions before those transactions happen.  AppZen is a must-have for CFOs and their teams to reduce spend, comply with policy, and streamline process."
Applied Materials,https://www.crunchbase.com/organization/applied-materials,"Electronics, Manufacturing, Semiconductor","Applied Materials provides manufacturing solutions for the semiconductor, flat panel display and solar photovoltaic industries.","Applied Materials is the leader in materials engineering solutions used to produce virtually every new chip and advanced display in the world. Their expertise in modifying materials at atomic levels and on an industrial scale enables customers to transform possibilities into reality. At Applied Materials, their innovations make possible the technology shaping the future."
Appier,https://www.crunchbase.com/organization/appier,"Analytics, Artificial Intelligence, Information Technology",Appier is a technology company which aims to provide artificial intelligence platform to help enterprises solve their business problems.,"Appier is a technology company which aims to provide artificial intelligence (AI) platform to help enterprises solve their most challenging business problems, spanning across Marketing and Data intelligence. Appier was established in 2012 by a passionate team of renown computer scientists and engineers with expertise in AI, data analysis and distributed systems. Appier has been selected as one of the top 50 companies leading AI innovation by Fortune magazine."
Apollo Endosurgery,https://www.crunchbase.com/organization/apollo-endosurgery,"Biotechnology, Health Care, Medical Device",Apollo Endosurgery develops medical devices for the diagnosis and treatment of gastrointestinal diseases.,"Apollo Endosurgery was founded upon the initial work of the Apollo Group, an international think tank of world-renowned gastroenterologists and surgeons from five leading universities (Mayo Clinic, Johns Hopkins, Medical University of South Carolina, University of Texas Medical Branch-Galveston and Chinese University-Hong Kong.)  Disappointed with the pace of innovation in therapeutic flexible endoscopy, the Group assembled in 1998 (Timeline) with the goal to advance the new discipline; their specific focus was the use of long, flexible instruments deployed through a natural orifice in order to diagnose and potentially treat gastrointestinal disorders."
Apollo,https://www.crunchbase.com/organization/apollo-global-management-llc,"Credit, Financial Services, Real Estate","Apollo Global Management specializes in credit-oriented capital, real estate markets, and is a global asset management firm.","Apollo is a leading global alternative asset manager specializing in private equity, credit-oriented capital markets and real estate. We focus our investments in areas where we can capitalize upon our integrated platform and library of industry knowledge."
Apollo,https://www.crunchbase.com/organization/meteor,"Developer APIs, Developer Platform, Developer Tools, Enterprise Software, Open Source, Software, Web Apps","Apollo is the GraphQL company. Its Data Graph Platform helps developers, startups, and enterprises get the most out of GraphQL.","Driving the momentum behind GraphQL, its Data Graph Platform helps developers, startups, and enterprises get the most out of GraphQL. Apollo builds open source tools and commercial services used by thousands of developers in production and has cultivated a strong community around GraphQL. With the Apollo Data Graph Platform, customers like Expedia, Airbnb, Audi, SurveyMonkey, and others rapidly implement GraphQL, consistent with industry best practices, providing their customers with the high-quality, personalized digital experiences they expect—on all of their devices. Based in San Francisco, Apollo is backed by Andreessen Horowitz, Matrix Partners, Webb Investment Network, and Trinity Ventures."
Aperiomics,https://www.crunchbase.com/organization/aperiomics,"Bioinformatics, Biotechnology, Genetics, Health Diagnostics",Advancing healthcare and revolutionizing infection testing for improved global health,"Aperiomics is the only company of its kind and scope in the world. We are revolutionizing the way that medical professionals around the world identify infections. Supported by the National Science Foundation, Aperiomics identifies every known bacteria, virus, fungus, and parasite through Deep Shotgun Metagenomic Sequencing, using our world renown database containing over 37,000 microbes. We help doctors and their patients identify the causes of infections that other tests cannot identify, thus streamlining the path to a positive clinical outcome. Many patients that we have helped were sick for years with no understanding of why. Patients and their physicians often contact Aperiomics after hearing about our life-changing success stories. Aperiomics was named Life Science Innovator of the Year in 2016 and International Start Up of the Year in 2018."
Apttus,https://www.crunchbase.com/organization/apttus,"CRM, Enterprise Software, Finance, Information Technology, SaaS, Software","Apttus, a SaaS application provider, renders enterprise class applications for end to end management of business functions.","Apttus enterprise-class software drives the vital business process between the buyer’s interest in a purchase and the realization of revenue.  Delivered on the world’s most trusted and comprehensive cloud platform, the Salesforce Platform, Apttus’ Quote-to-Cash solutions increase sales and maximize visibility and control.  Applications include Configure-Price-Quote (CPQ), Contract Management, Renewals and Revenue Management. Additionally, Apttus’ patent pending X-Author technology enables Microsoft Office to be a user-interface with full interaction and control between Salesforce and Microsoft Office.  Apttus is based in San Mateo, California, with additional offices in London, UK and Ahmedabad, India."
Apixio,https://www.crunchbase.com/organization/apixio,"Analytics, Big Data, Health Care, Information Technology",The data science company for healthcare,"Apixio's HCC Profiler enables health systems and insurers to more accurately and efficiently review their medical coding, to correct gaps and inaccuracies, improve financial reporting and deliver better quality care. HCC Profiler is built on an artificial intelligence platform that extracts knowledge from unstructured clinical data (text)."
Appcues,https://www.crunchbase.com/organization/appcues,"Predictive Analytics, Product Management, SaaS, Software, UX Design",The Product-Led Growth Platform,"Appcues makes it easy to deliver experiences that create happier customers and accelerate business growth. Thousands of businesses trust Appcues’ Product-Led Growth Platform to publish beautiful and personalized in-product experiences in minutes, measure the impact on key business results, and know when and how to intervene with a human touchpoint."
Apester,https://www.crunchbase.com/organization/qmerce,"Advertising, Publishing, Social Media Marketing",Apester believes that the evolution of digital storytelling revolves around integrating the reader's voice into the content.,"The Apester Interactive Content Platform allows anyone to easily and freely create, embed and share interactive, and related content items (polls, trivia, etc.) into posts and articles, in a matter of seconds. If you wish for better engagement, virality, circulation, native advertisement campaigns and monetization results, you came to the right place! Serving the biggest names in the industry - Telegraph, TimeOut, AOL and many more"
