Organization Name,Organization Name URL,Categories,Description,Full Description
Vaultive,https://www.crunchbase.com/organization/vaultive,"Cloud Data Services, Enterprise Software, Security","Vaultive, a network-layer proxy, provides a cloud data encryption platform to support cloud-based applications.","For businesses moving to the cloud, Vaultive’s encryption in use technology mitigates risk by empowering companies with control and ownership of their data wherever it resides. Vaultive’s customers hold the encryption keys, letting them retain the freedom to use cloud applications professionals rely on, while ensuring the governance and security that business demands."
Virgin Galactic,https://www.crunchbase.com/organization/virgin-galactic,"Aerospace, Developer Platform, Space Travel","Virgin Galactic plans to offer suborbital spaceflights to the public and the research community, and is involved in other space projects.","Virgin Galactic is a company within Richard Branson's Virgin Group which plans to provide spaceflights to the paying public as well as space science missions.  It successfully flew to space with its Unity spaceship in 2018 with its first revenue-producing flight for NASA, and in 2019 to space with the first female crew member on a commercial space vehicle.  Further in the future, Virgin Galactic hopes to offer point-to-point high speed transportation and orbital human spaceflights as well."
Victory Square,https://www.crunchbase.com/organization/victory-square-labs-2,"Business Development, Digital Entertainment, Fantasy Sports, Finance, Financial Services, Sports","Victory Square creates, funds, and executes on ideas in sports, health, and entertainment.",We believe the single most powerful force in the universe is the conviction of an entrepreneur. And that very conviction allows entrepreneurs to experiment with bold ideas and endure the journey.
Vesper Medical,https://www.crunchbase.com/organization/vesper-medical,"Health Care, Medical, Medical Device","Vesper Medical is committed to developing safe, efficacious and easy-to-use products for patients.","Vesper Medical operates in the healthcare industry. The company was incorporated in 2016 and is based in Wayne, Pennsylvania."
Volta Networks,https://www.crunchbase.com/organization/volta-networks,"Cloud Computing, Computer, Social Network",On demand networks for elastic clouds,
Verge Health,https://www.crunchbase.com/organization/verge-health,"Health Care, Hospital, Information Technology, Risk Management, SaaS, Software",Verge Health offers software and services that empower healthcare organizations to proactively protect and defend patients,"Founded in 2001, Verge Health offers software and services that empower healthcare organizations to proactively protect and defend patients, caregivers, and facilities against errors, adverse events, and policy violations for optimal quality and safety. Rooted in industry expertise and client experience at over 900 facilities nationwide, the Converge Platform delivers robust analytics, providing a comprehensive operational solution and support for proactive risk management. To help clients maximize potential and achieve high reliability, Verge offers Strategic Advisory Services. They help clients leverage technology, best practice, and industry knowledge to protect patients and protect margins. As a Charleston, SC based company, we love our city as well as our employees. Their collaborative team environment helps us drive continuous improvement. They’re focused on delivering the best technology and services to improve healthcare safety and to continually deliver innovative features and functionality. They take their jobs and their mission very seriously, but have fun along the way. It’s the best of both worlds, in the top-rated city in the country."
VanGo,https://www.crunchbase.com/organization/vango,"Public Safety, Ride Sharing, Transportation, Travel","VanGo provides safe rides for teens, driven by local moms.","VanGo provides safe rides for teens, driven by local moms"
ValueClick,https://www.crunchbase.com/organization/valueclick,"Advertising, Affiliate Marketing, Brand Marketing, Digital Media, Marketing, Web Hosting",ValueClick is an online marketing company providing internet advertising solutions for web site publishers and advertisers.,ValueClick is an integrated online marketing companies. They deliver scalable solutions for advertisers to cost-effectively acquire customers and for publishers to maximize their revenue.
Versium,https://www.crunchbase.com/organization/versium-analytics-inc,"Analytics, CRM, Information Technology","Versium Analytics is a data technology company that provides data verification, data enhancement, and predictive analytics for CRM.","Versium is a data technology company that operates a LifeData™ predictive analytics scoring solution. These technologies enable organizations to be more data-driven by powering solutions that help optimize consumer engagement, improve marketing efficiencies and better understand, retain and find new customers.  Versium brings together disparate sets of observational data, comprised of over 300 billion real-life behavioral attributes. These insights are combined with an organization’s existing enterprise data to provide more actionable consumer intelligence and delivery of predictive scores that address ROI driven specific business cases."
viisights,https://www.crunchbase.com/organization/viisights,"Analytics, Artificial Intelligence, Automotive, Autonomous Vehicles, Big Data, Computer Vision, Homeland Security, Machine Learning, Public Safety, Video, Video Streaming",viisights is a leading provider of behavioral understanding systems by artificial intelligence ,"viisights is a leading provider of behavioral understanding systems for real-time video intelligence that leverage unique artificial intelligence technology. The company provides behavioral understanding systems for safe and smart cities, smart enterprises, critical infrastructures, transportation hubs and shared mobility initiatives. viisights was founded by a group of serial entrepreneurs with proven track records in building and developing businesses that rely on innovative, state-of-the-art technologies. The company’s founders recognized the growing global need for intelligence promoting safer physical and virtual public areas – and realized that smart video understanding technology can become a true game changer. viisights is committed to developing artificial intelligence technologies that facilitate human-like video understanding, which in turn serves as basis for fully autonomous video intelligence systems powered by pattern prediction technology. To achieve success, the company relies on a seasoned management, a knowledgeable tech team, cutting-edge technological expertise and a far-reaching vision."
VAAK,https://www.crunchbase.com/organization/vaak,"Automotive, Retail Technology, Security, Smart Cities",VAAK operates human analysis platform with behavior recognition for retail and security: crime prevention and checkout-less systems.,"Vaak provides predictive security support through detailed behavior characteristics detection. It works in conjunction with notifications and external systems to prevent crimes and accidents. It also provides marketing support that analyzes customer's purchasing behavior. This is being done by acquiring the reaction and behavior that age, sex, taken and returned goods are returned. Vaak is based in Tokyo, Japan."
Vectorious Medical Technologies,https://www.crunchbase.com/organization/vectorious-medical-technologies,"Information Technology, Medical, Medical Device, Wireless",Vectorious Medical Technologies enables closed-loop therapy for congestive heart failure.,"Vectorious Medical Technologies has developed a novel approach to implantable long term hemodynamic monitoring that leverages state-of-the-art technologies in two areas: direct measurement of left atrial pressure and wireless communications. Vectorious technology helps physicians to help patients help themselves. Via a simple, minimally-invasive implanted device, easy-to-access data and user-friendly external home-unit; the VectoriousTM system increases CHF patient quality of life and reduces readmission rates. Daily 'push button' readings of patient hemodynamic pressure provide early, accurate physiological indication of cardiac decompensation. Patients enjoy ongoing, personalized care, physicians save lives and cut healthcare costs."
Vango,https://www.crunchbase.com/organization/vangoart,"Art, Data Visualization, E-Commerce, Internet",Changing the way we buy original art,"Their story started with a group of young professionals who struggled with how hard it was to find art for their home. They were tired of the generic, cookie-cutter posters, and desired something more meaningful. But, they didn’t know how where to start - galleries were intimidating, online sites overwhelming, and the pricing of it all was a confusing black box. Why did it have to be so hard to Be Original? At the same time, they thought of their friends and family who were artists - making beautiful art, but they had to abandon their creative talents so they could pay the bills. Something just didn’t make sense. After continuing to ask questions, they realized they were not alone, so they started to build, test, and tinker until…they launched ARTtwo50 in July 2013. Nine months later, May 1, 2014, ARTtwo50 was reborn as Vango along with the launch of a smaller version of their iPad app on the iPhone. The reason they changed from 'ARTtwo50' was that they wanted a name that was catchy and did not box us in on price. Given that they are a marketplace, they mashed up things that take two people (Tango) and key components of their app (Visualization). ‘Vango’ just came out and they loved the sound and energy."
ViaHero,https://www.crunchbase.com/organization/viahero,"Apps, Tourism, Travel",ViaHero allows travelers to choose locals to plan their personalized trip.,"ViaHero is an online marketplace for travelers to choose locals to plan their personalized trip. It's a brand new way to travel, perfect for those who want to travel independently and see a place through a local's eyes. After getting to know the traveler’s personality and specific tastes, the local Hero creates a fully customized guidebook and map, with everything available in an offline app—like a Lonely Planet guide written just for you."
Vintage Wine Estates,https://www.crunchbase.com/organization/vintage-wine-estates,"Food and Beverage, Wine And Spirits",Vintage Wine Estates is a wine & spirits company specializing in wines and services.,"Vintage Wine Estates is a privately held wine company owned by a group of vintner families with deep roots in the wine business.  The families own a collection of winery estates and brands including Clos Pegase Winery, Cosentino Winery, Girard Winery, B.R. Cohn Winery, Swanson Vineyards, Viansa Sonoma, Windsor Vineyards, Cameron Hughes, Firesteed, Cartlidge & Browne, Sonoma Coast Vineyards, Middle Sister, Tall Dark Stranger, Pro-mis-Q-ous, Monogamy, Girl & Dragon, Purple Cowboy and a number of exclusive wine brands."
Valore,https://www.crunchbase.com/organization/valore-3,"Digital Media, Education, Finance, Innovation Management, Internet, Marketplace",Valore offers innovative solutions that eliminate the inefficiencies throughout the textbook industry.,"Valore offers innovative solutions that eliminate the inefficiencies throughout the textbook industry, and bring more affordable textbooks and higher quality courseware to students, bookstores, professors, and schools."
Voiro,https://www.crunchbase.com/organization/voiro,"Advertising, Cyber Security, Information Technology, Management Information Systems, Publishing, Social Media",Voiro is the first all-in-one revenue management suite exclusively for ad-led digital publishers across media.,"Voiro is India’s first all-in-one revenue management suite exclusively for ad-led digital publishers across media. Our cloud-based solution is built to tackle the complex world of multiple revenue channels and provides the best data security and protection, critical for a data driven, content centric industry."
Virtway Events,https://www.crunchbase.com/organization/virtway-events,"3D Technology, Event Management, Events, Information Technology, Virtual Reality, Virtual World",3D Technology for Virtual Events Platform,"Virtway Events is focused on the development of enterprise solutions using 3D technologies. We want to help companies better connect with their clients and employees while simultaneously saving money, eliminating travels costs and reducing CO2 emissions.  Virtway, formed in 1999, has developed a technology that creates 3D virtual worlds accessible from all devices: mobile phones, tablets or computer. The product is revolutionizing communication with innovative ways to connect companies with its public. Any type of event is possible, from small corporate meetings to massive career fairs, all at a reduced cost.  Our motto is simple, “Be present, from a distance.” Businesses can organize events online in one of our many virtual scenarios. No event is too big or too small: anything is possible in Virtway Events. Small corporate meetings, Presentations, Webinar events with live streaming, Networking events, Conferences, Career fairs, Trade show exhibitions, Product showrooms, Internal activities for training or onboarding purposes, Team Building activities SPECIAL FEATURES OF OUR VIRTUAL 3D EVENTS: Customized business stands, Brand advertising & promotional services, Personalized avatars designed by each attendee, Personal profiles/business cards, Integrated VoIP and 3D Audio, Live chat, Scalable from any device, International collaboration, Presentations with document sharing, powerpoints, pdfs, videos, etc, Simple, clean navigation"
Voyajoy,https://www.crunchbase.com/organization/voyajoy,"Hospitality, Real Estate, Rental",AI Powered Marketplace for Rentals,
Vesta Mexico,https://www.crunchbase.com/organization/vesta-mexico,"Industrial, Real Estate",Vesta Mexico is an Industrial Real Estate company.,
Vivid Vision,https://www.crunchbase.com/organization/diplopia,"3D Technology, Health Care, Information Technology, Software, Video Games, Virtual Reality",Vivid Vision uses cutting edge technology to create unique vision tests and treatments.,"Vivid Vision uses the virtual reality to help people with lazy eye (amblyopia and strabismus) improve their vision. James Blaha, the creator of Diplopia, gained 3D vision and use of his lazy eye with the alpha version of the software."
Vestly,https://www.crunchbase.com/organization/vestly,"E-Commerce, Gaming, Mobile, Online Games, Video Games",Vestly is a mobile stock trading game.,"Vestly brings you monthly stock trading contests for real CASH prizes! Stocks are purchased with virtual money, but the winnings are real!  Buy and sell as many stocks as you want, invite and compete against friends, and track your ranking on the leaderboard. The better your stocks perform, the more points you'll gain. Think you're a better trader than your friends? Prove it by playing Vestly!"
Virtuoso,https://www.crunchbase.com/organization/virtuoso-ebca,"Apps, Fitness, Health Care, Health Insurance, Insurance, InsurTech, Mobile Apps, Personal Health, Wellness",Virtuoso rewards and remunerates people for their healthy lifestyle.,"The aim of Virtuoso is to become the first mass-market White Box for Health in the insurance market Virtuoso allows companies to collect data and target users based on their VIRTUOUS behavior while incentivizing people to live a healthy lifestyle (moving more, eating better, sleep enough) and prevent the main chronic and risky pathologies following scheduled screening programs on selected healthcare structures with a strong social impact on the market."
Virgo Surgical Video Solutions,https://www.crunchbase.com/organization/virgo-marketing,"Artificial Intelligence, Cloud Computing, Computer Vision, Medical, Medical Device, Video",Virgo Surgical Video Solutions is a startup working on cloud video and AI for colonoscopies and other GI endoscopy.,"Virgo provides a user friendly, low cost, HIPAA compliant cloud video platform for GI endoscopy. Prior to Virgo, gastroenterologists had to use DVD's and thumb drives to capture video from procedures such as colonoscopies and upper endoscopies. Virgo simplifies video capture and consumption for GI's, enabling them to use video for patient care, quality improvement, research, training, and more."
Verastar,https://www.crunchbase.com/organization/verastar,"Delivery, Service Industry, Small and Medium Businesses",Verastar is a services company for small business market delivering spectrum of essential business services for customers.,"Verastar is a next-generation services company for the small business market. By delivering a spectrum of essential business services, they create great savings, efficiencies and value for their customers. Why next-generation? They challenge the traditional and disrupt the market. Why leading? Their unique and dynamic approach achieves unbeaten growth and ROI. Why small businesses? By specialising, they get to know their customers and their specific needs."
VidAngel,https://www.crunchbase.com/organization/vidangel,"Crowdsourcing, Digital Entertainment, Parenting, Video Streaming",VidAngel offers content filtering and viewing customization software solution for online videos.,"Think Wikipedia for family-friendly video filters. VidAngel is powered by a volunteer community of avid fans of family-friendly video. Members of the community tag potentially offensive swearing, sex and violence in movies, TV shows and YouTube videos. These tags allow viewers to filter what they see and hear based on their personal values and content preferences.  VidAngel is founded by the Harmon brothers, who are well known for creating the award winning YouTube sensation Girl’s Don’t Poop for Poo~Pourri (more than 27 million YouTube views) and co-founding Orabrush and Orapup, another award winning YouTube breakthrough.  VidAngel will likely be interesting to Hollywood because it is expanding their market base here in the United States. “Hollywood is always trying to reach more viewers by cutting their films for different audiences,” explains Neal Harmon, CEO of VidAngel. “There is the Studio’s Final Cut for theaters. The Director’s Cut for the artists. The Airline and Broadcast Cut for the FCC. The Middle Eastern cut for Islam. The unrated cut for perverts. And fan cuts like people uploading just the sex scenes from Game of Thrones to YouTube.  It seems like there is a cut for everyone. But one major group was missing, a Family Cut for streaming. That is why we created VidAngel.”"
VBI Vaccines,https://www.crunchbase.com/organization/vbi-vaccines,"Biotechnology, Clinical Trials, Health Care","VBI Vaccines, is a biopharmaceutical company developing novel technologies that seek to expand vaccine.","VBI Vaccines, Inc. (Nasdaq: VBIV) is a biopharmaceutical company developing novel technologies that seek to expand vaccine protection in large underserved markets. VBI’s eVLP vaccine platform allows for the design of enveloped virus-like particle  vaccines that closely mimic the target virus. The company’s lead eVLP asset is a prophylactic Cytomegalovirus  vaccine; VBI has initiated work for GMP manufacturing of its CMV candidate for use in formal preclinical and Phase I trials. The company’s second platform is a thermostable technology that enables the development of vaccines and biologics that can withstand storage or shipment at constantly fluctuating temperatures. VBI has completed proof of concept thermostability studies on a number of vaccine and biologic targets. VBI is headquartered in Cambridge, MA with research facilities in Ottawa, Canada."
Vasayo,https://www.crunchbase.com/organization/vasayo,"Direct Sales, Nutrition",Vasayo is a direct sales company offering supplements with Advanced (Liposome) Delivery Technology for superior nutrient absorption.,"Vasayo's mission is to transform lives physically, financially, and socially through Superior Delivery of products, opportunity, and community."
Vet-AI,https://www.crunchbase.com/organization/vet-ai,"Artificial Intelligence, Machine Learning, Medical, Mobile Apps, Veterinary",Vet-AI is developing ground-breaking technologies that aim to prevent and predict conditions developing in animals.,"Using groundbreaking technologies, they are developing innovative products and services that will reshape the animal health industries. They are the first company in the world that will use AI to support the good health of their animals. They are currently raising investment to help bring their products to market. Their evolving team consists of leading experts in a range of different sectors, and their partners include some of the biggest in the pet care industry."
Vaultbank,https://www.crunchbase.com/organization/vaultbank,"Banking, Finance, Financial Services","Vaultbank is a global investment firm, committed to sound financial investment and technological advancement.","Vaultbank is a global investment firm, committed to sound financial investment and technological advancement. Vaultbank Tokens intend to offer quarterly dividends and are backed by secured credit assets created by an experienced investment and portfolio management team. Vaultbank offers a debit MasterCard that can be linked to select leading cryptocurrencies at highly competitive industry exchange rates on major global currencies. Account holders are empowered to select from multiple cryptocurrencies for use as tender. Vaultbank cards are accepted at all point of sale terminals – for the first time an asset backed security will be able to be used as tender for purchases. Furthermore, Vaultbank also provides transaction services for cryptocurrencies as well as 120 fiat currencies, of which 17 of the leading global currencies will have highly competitive exchange rates - thus enabling investors who desire exposure to those markets to use their assets as tender virtually anywhere in the world."
Vibe Tickets,https://www.crunchbase.com/organization/vibe-tickets,"Concerts, Events, Media and Entertainment, Sports, Theatre, Ticketing",Vibe Tickets believes in real fans exchanging tickets at real prices.,"Vibe Tickets believes in real fans exchanging tickets at real prices. Vibe Tickets is an open ticket marketplace where fans can buy and sell tickets transparently at fair value. A finalist in the the Virgin Media Business “VOOM 2016” competition, Vibe Tickets has recently launched an app. Vibe is on a mission to disrupt the multi-billion pound secondary ticket market."
Vivoo,https://www.crunchbase.com/organization/vivooapp,"Nutrition, Test and Measurement, Wellness",Vivoo is a wellness assistant that provides custom nutrition advice to the users based on their urine sample analysis.,Vivoo is a wellness assistant that provides custom nutrition advice to the users based on their urine sample analysis.
Verengo Solar,https://www.crunchbase.com/organization/verengo-solar-plus,"Energy, Renewable Energy, Solar","Verengo Solar, the largest Southern California-based solar provider. Verengo is out to build the most trusted solar company in California.","As the largest Southern California-based solar provider, Verengo Solar provides a smart and cleaner alternative to soaring energy rates by offering energy-efficient solar solutions. Verengo has simplified solar with dedicated project managers to guide customers through its seamless process– from signing to install. In as little as five minutes, Verengo Solar will run a FREE assessment and estimate a new monthly electric bill."
Virgil Security,https://www.crunchbase.com/organization/virgil-security,"Cloud Security, Cyber Security, Developer APIs, Developer Platform, Developer Tools, Internet of Things, Network Security",Virgil Security provides easy-to-deploy and easy-to-use cryptographic software and services for use by developers and end-users.,"Virgil Security provides easy-to-deploy and easy-to-use cryptographic software and services for use by developers and end-users. Virgil Security’s encryption libraries and services, along with an accompanying public key management infrastructure, ease the pain of developing, deploying, and using strong cryptography. Virgil Security enables a new generation of enhanced privacy and security for applications, cloud services, and the Internet of Things."
Viadeo,https://www.crunchbase.com/organization/viadeo,"Communities, E-Commerce, Professional Networking, Social Media, Social Network","Viadeo is a professional social network designed to improve career prospects, discover business opportunities and create online identities.","The Viadeo Group owns and operates professional social networks around the world with a total membership base of over 50 million professionals.  It includes the brands Viadeo, ApnaCircle, and Tianji. The Viadeo platform is available globally and is branded as ApnaCircle on the Indian sub-continent. In China, the Tianji platform is the largest professional network with over 14 million members and rapid growth.  Professionals use the networks to enhance their career prospects, discover business opportunities, and create effective online identities. The Group currently has a staff of over 400 with offices in the U.S., the UK, the Netherlands, France, Spain, Italy, Russia, China, India, Mexico, Morocco, and Senegal."
