Organization Name,Organization Name URL,Categories,Full Description
Floravere,https://www.crunchbase.com/organization/floravere,"Consumer, Marketing","Floravere is an integrated, direct-to-consumer wedding dress brand. The company takes the hassle out of the wedding dress buying experience. Instead of inefficient, lengthy bridal appointments, Floravere brings the the bridal dress buying experience in home. After a virtual consultation, the bride-to-be chooses 3 dresses (out of 14 options) she would like shipped to her home. The bride box arrives a few days later to the customer’s doorstep. "
FarmLink,https://www.crunchbase.com/organization/farmlink,"Advice, Agriculture, Analytics, Communities, Consulting, Farming","FarmLink is the first company to present farmers with objective data that allows them to understand the full range of performance potential for their entire portfolio, down to the field, zone and micro-field level. We are data analytics people who have found a unique way to analyze the harvest and turn it into useful data for farmers everywhere."
FlexyBeauty,https://www.crunchbase.com/organization/flexybeauty,"Beauty, Software, Wellness","After travel and catering, the beauty & wellness sector is experiencing a boom in online booking. This highlights the emergence of a new connected clientele. FlexyBeauty is the easiest solution for beauty professionals to manage their business, attract and retain more connected customers. Available on smartphone, tablet or computer, FlexyBeauty is the first all-in-one solution that combines: cash software, online booking, and online store. In short, FlexyBeauty allows beauty professionals to: - spend less time in day-to-day management and more with their customers - reach new customers through the Internet - stay in control of their distribution on the internet while remaining independent."
Firsthand,https://www.crunchbase.com/organization/evisors,"Advice, Alumni, Career Planning, EdTech, Education, Employment, Higher Education, Human Resources, SaaS","Firsthand builds SaaS platforms that connect students and alumni for career advice at over 100 universities, including Harvard, Oxford, and Cambridge. We also run evisors.com as our consumer facing platform.  The problem is that jobs don’t go to the best candidates, they go to the most connected candidates. Referred candidates are ten times more likely to land the job. Our mission at Firsthand is to democratize great careers. We want to give every applicant the best possible career network and odds for success.  Our platforms connect students and alumni on-on-one for on-demand career conversations, resume critiques, and mock interviews. Alumni give back on their own terms by specifying their areas of expertise and availability. Students get help they want, when they need it. 80% of students report that the help they got directly contributed to their job offers.  As we grow to connect millions of students and alumni for career success, our vision is to become the world’s greatest job referral platform."
Flatlooker,https://www.crunchbase.com/organization/flatlooker,Rental,"They accompany the tenants in their search for housing and the owners in their search for a tenant. They then take care of all the administrative, financial and technical part in accordance with the regulations in force."
Fabric,https://www.crunchbase.com/organization/fabric,"Apps, Media and Entertainment, Software","Fabric is a smart new app that allows its community to build want-to lists for entertainment and lifestyle activities by browsing through hundreds of fun, curated packs. The current product already covers movies, TV, music and travel and is rapidly expanding its coverage to additional categories."
FlexWage Solutions,https://www.crunchbase.com/organization/flexwage-solutions,"Banking, Financial Services, FinTech, Payments","Based in New Jersey, FlexWage Solutions is a financial services company dedicated to improving financial access and well-being for the unbanked and underbanked populations, benefiting workers, employers, and their surrounding communities. The company offers WageBank, a disruptive financial empowerment solution that connects with employer HR and payroll systems to provide employees with access to accrued wages, eliminating financial and psychological hardships. It drives cost savings for employees and employers, along with increased productivity, job satisfaction, and employee retention. FlexWage Solutions was established in 2009."
Foody,https://www.crunchbase.com/organization/foody-df60,"E-Commerce, Food and Beverage, Mobile Apps",Foody provides healthy food to the vast majority of Latin Americans with affordable prices.
FireVisor,https://www.crunchbase.com/organization/firevisor-systems-pte-ltd,"Artificial Intelligence, Industrial Automation, Machine Learning, Manufacturing","FireVisor Is Creating Self-Aware Factories. Manufacturing is a 17.2 trillion dollar industry, creates 21% of all jobs in the world, and is the central engine of global economic growth. But today’s factories are dumb. An army of human inspectors is needed to make sure no fault escapes the production line and an army of process control engineers constantly tweak and monitor machines. This is ridiculous, because the machines, on the other hand, produce an abundance of valuable data. However, the data is unused and simply gets discarded. It’s so much data that humans are not able to analyze it. We want to make use of the mass of data to make factories self-aware."
Finteca,https://www.crunchbase.com/organization/finteca,"Financial Services, FinTech, Software","Finteca can save you more than € 8,000 * compared to traditional advisors. Without commissions, without risk, our professional team improves conditions of interest and other parameters."
Facemoji,https://www.crunchbase.com/organization/facemoji,"3D Technology, Computer Vision, Digital Entertainment, eSports","We're committed to making the internet more expressive, and to build a digital identity layer that is accessible to all."
Fortella,https://www.crunchbase.com/organization/datalaab,"Artificial Intelligence, B2B, Big Data, Enterprise Software, Machine Learning, Marketing",Fortella is Revenue Driven Marketing platform. It aligns marketing planning & execution with company's revenue plan and measures Marketing's contribution to the business.
FinLocker,https://www.crunchbase.com/organization/finlocker,"Banking, Financial Services, Lending","FinLocker is a financial services technology innovator, founded by a team of seasoned veterans and leading executives across the financial services and technology industries.  In a time where the consumer financial services industry faces heightened regulatory scrutiny, innovative solutions are needed more than ever. FinLocker offers a solution capable of improving the loan process, from origination to servicing, and even beyond."
Fractal Labs,https://www.crunchbase.com/organization/fractal-labs,"Analytics, Artificial Intelligence, Blockchain, Credit, FinTech, Machine Learning, Software",Fractal powers smart SME banking.
Fluent.ai,https://www.crunchbase.com/organization/fluent-ai,"Artificial Intelligence, Industrial Automation, Internet of Things, Machine Learning, Smart Home, Software Engineering, Speech Recognition","Fluent.ai adopts a fundamentally different machine learning approach to speech recognition.  Our models learns from context, behavior, and speech, in any language. Its speech recognition engine expresses the flexibility to understand natural phrases reliably across languages, accents, and noise environments such as a smart home, connected car, wearable, or virtual reality headset. Special features of Fluent.ai include multilingual, van be personalized, reliability, and ability to use both offline and online. It was launched in 2015 by Vikrant Tomar.."
Fleksy Keyboard by Thingthing Ltd.,https://www.crunchbase.com/organization/thingthing-keyboard,"3D Technology, Apps, Artificial Intelligence, B2C, Information Technology, Machine Learning, Mobile, Natural Language Processing, Productivity Tools, Software","The team believes in a future where you type and the keyboard does the rest. A fast typing experience that feels connected, unified, and private."
Forward Health Group,https://www.crunchbase.com/organization/forward-health-group,"Health Care, Hospital, Wellness","Forward Health Group helps healthcare providers successfully transition to the new world of value-based care. The Madison, Wis.-based software and services company provides value-based population management solutions to health systems, hospitals and multi-specialty clinics. Since 2009 FHG has been an industry innovator, providing the accurate data and clinical measures— from internal and external sources—needed to improve patient health in a timely, cost-effective, physician-supported way."
Fotokite,https://www.crunchbase.com/organization/fotokite,"Broadcasting, Drones, Industrial, News, Photography, Public Safety, Robotics, Sports","Fotokite’s mission is to make aerial sensing simple and safe. Fotokite systems fly 100% autonomously for 24+ hours and provide real-time video and sensor data streams from above to customers in News & Sports Broadcast, Public Safety, and Industrial Inspection markets. The Fotokite was born at ETH Zurich’s Flying Machine Arena, one of the world’s most advanced research lab in aerial robotics. Sales and deliveries of Fotokite's 1st Generation products began in 2016 and include customers such as CNN, BBC, Tribune Media, and AFP."
Funding University,https://www.crunchbase.com/organization/fundinguniversity,"Education, Lending","About Funding University: Funding University is a private student lender serving hardworking, career driven undergraduates and their parents. Where most lenders depend on FICO scores and cosigners, Funding University assesses each student’s credit worthiness based on their career track &amp; post-college earnings potential. Funding U is now taking applications to its waitlist for next school year when its funds will be expanded and available to lend to students nationwide. To learn more, visit www.funding-university.com, visit: funding-university.com"
Fossil,https://www.crunchbase.com/organization/fossil,"E-Commerce, Fashion, Lifestyle, Retail","Fossil is an American watch and lifestyle company that is creatively rooted in authentic vintage and classic design. Founded in 1984, the Fossil brand was the springboard for everything the company has become for more than a quarter of a century. Fossil prides itself on its commitment to American vintage inspiration. This commitment has allowed for a strong retail presence globally, with more than 400 retail locations, 4,000 wholesale locations and 13,000 employees worldwide. Alongside the Fossil Brand, the company is constantly developing its multi-brand portfolio. Our diverse portfolio of world-class brands gives us a unique position in the global marketplace. And we’re only getting bigger. This global foundation has allowed for sustained growth which propelled Fossil into the S&P 500, marking its place among the 500 leading publicly traded companies in the United States."
FreightWise LLC,https://www.crunchbase.com/organization/freightwise-llc,SaaS,
Flick,https://www.crunchbase.com/organization/flick,"Apps, Gaming, Mobile Apps, Sports",Flick is building a new live mobile engagement platform organized around your passions. With Flick you can join or create a group around any topic and share your favorite media with them in real time.
Flexion Therapeutics,https://www.crunchbase.com/organization/flexion-therapeutics,"Biotechnology, Health Care, Therapeutics","Flexion Therapeutics advances drug candidates through clinical proof of concept and beyond, in partnership with pharmaceutical and biotechnology companies. By providing expertise and sharing risk, Flexion effectively expands the portfolios of its partners."
Futurestay,https://www.crunchbase.com/organization/futurestay,"Service Industry, Tourism, Travel","Futurestay is the smartest way for vacation rentals to connect to everything that matters: channels, guests, payments, and their own website and brand. With over 110,000 vacation rentals in 120 countries, Futurestay is the leading independent vacation rental business solution. Use Smart Connections™ to list your property on Airbnb, HomeAway, and Booking.com."
flipClass,https://www.crunchbase.com/organization/flipclass,"Education, Marketplace, Tutoring","FlipClass is India's leading marketplace for Home/Online Tutoring with over 200,000 tutoring hours delivered on the platform. It has over 8000 tutors for home and online tuitions all over India. All the tutors are screened for their knowledge and delivery capabilities and the learning is benchmarked with its state of the art learning and assessment platform called flipLearn. FlipClass is looking to cater to 250 Million K-12 students in India through home/online/mobile channels. Its mobile problem solving platform flipTutor has over 40,000 installs and gets more than 2000 questions per day."
Finhaven,https://www.crunchbase.com/organization/finhaven,"Blockchain, Financial Services, FinTech, Information Technology","Finhaven is building a full-stack capital markets infrastructure for the issuance, trading and recording of regulatory-compliant digital securities.  Finhaven uses a powerful agent-based cryptographic ledger to mirror and improve upon the operational intricacies of securities exchanges, focusing on liquidity and security. This hybrid-blockchain technology provides solutions for identified blockchain limitations and can be applied to revolutionize capital market functions, for both global issuers and investors.  By reducing transaction costs, converging intermediaries and providing custodianship and real-time clearance and settlement, Finhaven’s technology promotes time and cost efficiency in raising capital and trading."" Ultimately, Finhaven envisions driving innovation in global capital markets."
FreshRealm,https://www.crunchbase.com/organization/freshrealm,"B2B, B2C, Food and Beverage, Food Processing","FreshRealm is a vision for the future of food made possible by a temperature-controlled, reusable shipping vessel and a B2B2C cloud-based technology platform. The result is faster distribution, fewer preservatives, reduced food waste, and nation-wide eradication of fresh food deserts. At the core of FreshRealm’s efforts is a desire to elevate the presence of Gratitude, Gifting and Connection between people, organizations, our environment, and ourselves."
Forever Labs,https://www.crunchbase.com/organization/forever-labs,"Biotechnology, Medical, Personal Health","Forever Labs collects and stores adult stem cells, and develops therapies based upon stem cell rejuvenation."
Float,https://www.crunchbase.com/organization/float-4,"Credit, Financial Services, Machine Learning","Float is a mobile-first financial service that helps young consumers access, manage, and proactively build credit. We offer thin-file consumers instant access to an affordable line of credit, direct from any smartphone, no FICO required."
Fagron SA,https://www.crunchbase.com/organization/fagron-inc,"Biotechnology, Health Care, Medical, Pharmaceutical","Fagron is the global pharmaceutical compounding company, bringing customized pharmaceutical care to hospitals, pharmacies, clinics and patients in 34 countries worldwide. "
Futureplay Games,https://www.crunchbase.com/organization/futureplay-games,"Gaming, Media and Entertainment, Video Games","Futureplay, founded in 2015 by a group of professionals with 60+ years of total experience from the gaming industry and from companies such as EA, Rovio, Remedy, Boomlagoon and Reaktor are set to build the new future foundation and standard for mobile games.2015 A new era of mobile gaming is upon us and we passionately believe we can create the future of games for new and old players alike. We are set to build the next big delightful and engaging experiences for the new generation of gamers on both phones and tablets. Our focus is on creating a new category of “view-to-play” games – broadly accessible gameplay with a natural integration and rewarding ad-based monetization. We believe in F2P and ads – both done right can be great, you will see. We want to develop fast and have fun launching multiple games per year and not work multiple years per game."
Fathom AI,https://www.crunchbase.com/organization/Fathom-ai,"Fitness, mHealth, Wellness","BioMetrix is an insight driven training and rehabilitation solution which utilizes a patented skin-adhered wearable device to quantify rehabilitation progress, assess injury risk, and provide real-time feedback to reduce player injury on the field. In other words, BioMetrix is an easy-to-use solution which keeps teams healthier longer."
Flash,https://www.crunchbase.com/organization/flash,"Freight Service, Logistics, Public Transportation, Transportation",Flash is the european group in premium logistics at your service. Flash provides time-critical services to the automotive sector and has a number of OEM and tier one customers. It also provides services for the aerospace and healthcare sectors.
Fubei Pet,https://www.crunchbase.com/organization/fubei-pet,Consumer,"Fubei Pet Food is a pet food provider dedicated to providing healthy, safe and high-end pet food and system feeding solutions for pets around the world."
Fundnel,https://www.crunchbase.com/organization/fundnel,"Information Technology, Infrastructure, Internet, Venture Capital","Fundnel is a private investment platform that offers unlisted securities in growth and pre-IPO stage companies across industries to a qualified network of investors, comprising of both professional – corporate venture, private equity, venture capital funds, family offices, angel investor networks – and individually accredited investors actively looking to diversify their current portfolio. Fundnel screens all investment opportunities to ensure businesses meet the minimum requirements defined by the Fundnel Factor – a proprietary data-driven due-diligence process analysing over 600 quantitative data points per company* – before reaching its investor network. Fundnel’s network of investors perform further due-diligence before making an “Anchor Investment” in a particular deal they see value in. Only deals with a lead anchor investor will be listed on its platform, whereupon other investors are invited to join the investment round. Our network of investors have invested in a total of 15 deals worth over US$49million in the past year.   Fundnel is headquartered in Singapore and has a growing team of over twenty people spread across regional offices in Indonesia, Malaysia, Australia, Brunei and India.   * Historically, only c.10% of companies will be offered to Fundnel’s investors, whilst just c.3% eventually receive an investment – Fundnel’s technology enabled solution means that its investors do not have to spend unnecessary time and resources hiring large teams of analysts."
Fuhu,https://www.crunchbase.com/organization/fuhu,"Apps, Consumer Electronics, Enterprise Software","Fuhu, Inc., creators of the Nabi Pad, Fooz Kids, and urDrive, is a leading provider of cloud-served software, applications, and services that are dedicated to creating deep and engaging user experiences on a range of consumer devices. Products include urDrive, a preloaded software solution on select Kingston USB Flash Drives that provides ""follow me"" content; Spinlets Plus, a global PC and Android cloud-served music solution; and Fooz Kids, a downloadable application that kiddifies your computer with apps, controlled by parents. Fuhu's most recent unveiling is the Nabi tablet -- a full-featured Android tablet and platform, made especially for kids. For more information, visit www.fuhu.com, www.nabitablet.com, and www.foozkids.com."
FloLive,https://www.crunchbase.com/organization/flo-live,"Internet of Things, Telecommunications","floLIVE offers a complete, cloud-based IoT eco-system that includes a core network with integrated device management, Inventory and Billing services – enabling our customers to manage their devices via our Live Mobile Device Platform. Our solution provides the flexibility of choosing between various mobile network profiles via our MNO partnerships"
Filestack,https://www.crunchbase.com/organization/ink-mobility,"Cloud Computing, Cloud Data Services, Content, Content Delivery Network, Mobile, Publishing, Software","Filestack is a Content Ingestion Network - seamlessly integrating edge content within an applications cloud - reliably, scalably and securely. It is the #1 file uploading tool in the world. Developers love Filestack because of its third party integrations, easy to use API, and ability to upload, transform and deliver documents, images, videos and more."
FiberLight,https://www.crunchbase.com/organization/fiberlight,"Internet, Telecommunications, Wireless","FiberLight transforms the way businesses communicate today by constructing and delivering purpose built fiber optic network services that flex and scale with your communication needs. Offering best in breed Carrier Ethernet technology on a $1 billion diversely constructed optical ring topology network, FiberLight provides significant economies of scale, enabling customers to consolidate leased lines and multiple services onto one private, high-speed, secure platform. Contact the FiberLight sales team for a custom network solution specific to your business needs."
Floreo,https://www.crunchbase.com/organization/floreo,"Developer Platform, Developer Tools, Education, Health Care, Software, Virtual Reality","Floreo, a venture and NIH backed startup, leverages the power of virtual reality to provide safe, immersive, repeatable, and affordable social and communication therapy that is fun and engaging for the user, while allowing a supervising adult to monitor and track the user’s progress. The company is currently piloting Floreo at a special education school for children on the autism spectrum, a large ABA therapy company, and through a partnership with the Center for Autism Research at Children’s Hospital of Philadelphia. Floreo believes in building a premium science-backed and tested product. To that end, the company has established partnerships with leading research, academic, therapy, and civic partners."
FindMeCure,https://www.crunchbase.com/organization/findmecure,"Clinical Trials, Health Care, Medical","FindMeCure is the Google of clinical trials. The company helps anyone to easily find future treatments and apply for participation in studies within few clicks. FindMeCure is the missing link between the clinical research industry and the countless people looking for an alternative. The company is dedicated to building a bridge between you and the world of medical innovations, so anyone can search, find and join a trial within few clicks."
FIGUR8,https://www.crunchbase.com/organization/figur8,"Apps, iOS, Software","FIGUR8 is formed by a group of engineers, researchers and designers with expertise in wearable computing, digital health and sports science. We share the same passion in creating the most intuitive and effective way to understanding human movement and to bring what’s only available to the elite few today to the hands of the everyday user."
FlipTix,https://www.crunchbase.com/organization/fliptix,"Events, Marketing, Ticketing","FlipTix is the creator of a ticketing marketplace, where event attendees can 'Flip' the remaining time on their ticket to a waiting fan. Fliptix was founded in 2016 by Seth Siegel.  Shortly after, his brothers - Brian and Jaime -  came on as co-founders, retooled the concept and executed successful launch of the business in 2018.   Since then, the FlipTix team has grown to supporting some of the biggest musical festivals on Earth.  We are proud to be partnered with some of the biggest and most influential event promoters in the industry.  With employees in the US and Europe, FlipTix continues its focus on rapid expansion by providing promoters and event attendees more value!"
FPT Software,https://www.crunchbase.com/organization/fpt-software,"Analytics, Outsourcing, Software","FPT Software – the Software Powerhouse  - Vietnam’s largest and one of the fastest growing software outsourcing companies.  - Over 6,000 software outsourcing projects and a total volume of 2.5 million man-days in the last 10 years.  - A broad presence in diverse global markets.  - Specialist in shaping world-class networks of global delivery centers."
