Organization Name,Organization Name URL,Categories,Full Description
Epic Sciences,https://www.crunchbase.com/organization/epic-sciences,"Biotechnology, Health Care, Health Diagnostics","Epic Sciences is a privately held diagnostics company committed to improving cancer management by providing easily accessible and real-time biopsy material to guide personalized medicine.   Epic is founded on a powerful platform to identify and characterize rare cells including circulating tumor cells (""CTCs"").  Epic is working with a number of partners including numerous pharmaceutical companies, major cancer centers, the National Cancer Institute, and the National Institutes of Health."
Elder,https://www.crunchbase.com/organization/elder,"Elderly, Health Care, Internet","Elder was founded on the basic idea that you shouldn’t have to go to a care home unless you want to. You should be able to keep the life you know and love, all while getting the care you need.  Elder offers an online platform that focuses on connecting elders with homecare service providers. It offers its services in the United Kingdom. They enables its customers to find homecare service providers according to their needs and preferences."
Enevo,https://www.crunchbase.com/organization/enevo,"Fleet Management, Hardware, Internet of Things, Logistics, Recycling, Waste Management","Enevo works with its customers to transform the financial, environmental and social impact of waste. Founded in 2010, Enevo began providing waste data from dumpster sensors using its proprietary analytics software. Enevo now provides full management of waste and recycling services for restaurant, retail and commercial property customers throughout North America. It provides the first predictive end-to-end solution that automates the whole planning and operations of waste and recycling logistics. Enevo has raised more than $34M in private equity funding to date and continues to invest in technology and new processes to deliver the peace of mind its customers need."
Elevate Security,https://www.crunchbase.com/organization/elevate-security,"Computer, Network Security, Security","Founded in 2017, Elevate Security creates secure behaviors in employees that help prevent breaches. They’re building a platform that can measure, motivate and educate employees on behaviors such as phishing click-through to password hygiene using behavioral and data science."
Enigma,https://www.crunchbase.com/organization/enigma-2,"Big Data, Cloud Data Services, Security","Enigma is using groundbreaking privacy technologies to build the first platform for scalable, end-to-end decentralized applications. Enigma introduces secret contracts - smart contracts that let you use private and sensitive data in decentralized applications and services."
Everplans,https://www.crunchbase.com/organization/everplans,"Financial Services, FinTech, Information Services, Personal Health, Wellness","Everplans is a service that helps anyone gather, securely store and share all of the information, documentation and wishes that your family might need if something were to ever happen to you. The company provides step by step guidance, thousands of original articles and resources, and a secure vault that helps you share the right info with the right people. Everplans was founded in 2012 by repeat entrepreneurs Abby Schneiderman and Adam Seifer. Both have a track record of building and growing ground-breaking technology businesses, and were included in Fast Company's 2016 list of the 100 most creative people in business."
Exterro,https://www.crunchbase.com/organization/exterro,"Ediscovery, Legal, Risk Management, Software","Exterro, Inc. is the recognized leader for legal governance, risk management, and compliance software solutions. Its solutions enable legal teams to control risks, reduce costs, enforce compliance and streamline processes by tightening collaboration between outside counsel, in-house legal teams, cross-platform business units, service providers, and resources. Exterro pioneered e-discovery workflow management technology, and continues to expand its innovative Fusion suite of applications Genome, Legal Hold, Discovery Workflow Management, and FusionGo. The complete Fusion platform provides an end-to-end risk assessment and information management solution. Regardless of industry or system environment, Fusion integrates seamlessly with existing business processes and enterprise systems. Exterro solutions assure regulatory compliance and create sustainable ROI. Headquartered in Portland, Oregon, Exterro has operations across the United States and abroad."
Enerkem,https://www.crunchbase.com/organization/enerkem,"Biofuel, CleanTech, Recycling, Waste Management","Enerkem is a cleantech company transforming waste into transportation biofuels, renewable chemicals, and everyday products. Through the combination of a proprietary thermochemical technology platform and community-based advanced facilities, Enerkem addresses the challenges of oil dependence and waste disposal.   Enerkem has validated its proprietary technology over a period of 10 years using the solid waste from numerous municipalities and other types of feedstock.  The company’s process and business model are designed to profitably produce cellulosic ethanol from a large municipal solid waste supply.  Enerkem is a private company founded in 2000 by its current senior management. It is majority-owned by institutional, clean-technology and industrial investors, including Rho Ventures, Waste Management, Braemar Energy Ventures, Investissement Québec, Valero, Cycle Capital, The Westly Group, Fonds de solidarité FTQ, and Fondaction CSN.   Headquartered in Montreal, Canada, Enerkem has 170 employees in Canada and the United States."
"Elevate Services, Inc.",https://www.crunchbase.com/organization/elevate-services-inc,"Consulting, Information Technology, Legal"," Elevate is the law company. We provide consulting, technology and services to law departments and law firms, offering practical ways to improve efficiency, quality, and outcomes."
Eco Wave Power,https://www.crunchbase.com/organization/eco-wave-power,"Manufacturing, Product Design, Wind Energy","Eco Wave Power is the sole global inventor, owner and developer of the unique EWP wave energy devices. Their wave energy company designs, manufactures and operates the EWP wave energy convertors. They believe that their patented technology is clearly on target to become a world leader in the wave energy field.  Eco Wave Power is the only wave energy company to ever win the Frost & Sullivan Product Innovation Award. According to Frost & Sullivan, ""Eco Wave Power efficiently handles the prominent challenges prevailing in the field and offers an all-round solution for effective energy harvesting. Based on the aforementioned performance drivers as measured through Frost & Sullivan independent analysis, Eco Wave Power is the recipient of the 2012 Frost & Sullivan New Product Innovation Award"""
Earnix,https://www.crunchbase.com/organization/earnix,"Analytics, Banking, Finance, Financial Services, Insurance, Price Comparison","Earnix Integrated Pricing and Customer Analytics software empowers financial services companies to predict customer risk and demand and their impact on business performance, enabling the alignment of product offerings with changing market dynamics. Earnix combines predictive modeling and optimization with real-time connectivity to core operational systems, bringing the power of analytic-driven decisions to every customer interaction. Banks and insurers rely on Earnix solutions to improve deposit, loan, and insurance policy offerings."
ELSE Corp,https://www.crunchbase.com/organization/else-corp,"3D Printing, 3D Technology, Artificial Intelligence, Cloud Computing, E-Commerce, Fashion, Internet of Things, Retail Technology, SaaS","ELSE Corp is an Italian startup that offers technological solutions for 3D based Mass Customization such as Virtual Retail and Cloud Manufacturing to fashion brands, retailers, manufacturers and designers; using E.L.S.E., a Cloud API Platform, powered with AI, machine learning and deep learning, puts together the front-end retail processes such as 3D product personalization and virtual commerce, with a cloud-based back-end processes like virtual fitting and order generation for smart hybrid manufacturing. The startup is committed to creating value not only for the market but also for society by redefining the Value Chain for the fashion industry through Applied Research. ELSE CORP relies in open innovation and collaboration with industry leaders to develop innovative sustainable, transparent and traceable business processes and Distribution Models through market trials.  Their services, named “Virtual Retail”, aims to accelerate the transformation of the industry towards a personalized, direct to consumer, customer-pull approach, enhancing the customer’s virtual shopping experience and optimizing the Virtual Retail value and service delivery chain."
Electronic Arts,https://www.crunchbase.com/organization/electronicarts,"Computer, Mobile, Publishing, Video Games, Web Development","Electronic Arts (EA) is a global interactive entertainment software company that delivers games, content, and online services for internet-connected consoles, personal computers, mobile phones, and tablets. The company develops and publishes video games for various platforms, including PC, Xbox One, PlayStation 4, Xbox 360, PlayStation 3, Wii, iPhone, iPad, Android, and Windows Phone. Some of its popular games include The Sims, Madden NFL, EA SPORTS FIFA, Battlefield, Dragon Age, Plants vs. Zombies, Need for Speed, Battlefield, and Mass Effect. Electronic Arts was founded in 1982 and is based in Redwood City, California."
EduKart,https://www.crunchbase.com/organization/edukart,"EdTech, Education, Marketplace","EduKart is India's largest online platform for enrollment into online and distance degree, diploma and certificate courses.  Students can apply to  online, distance and correspondence degree and diploma courses like MBA, Executive MBA, PGDM, MCA, M.Sc. IT, MA, MCom, BBA, BCA, BA, BCom and B.Sc. IT.  They can also choose from multiple short certificate courses in areas of retail, marketing, finance, IT, accounting, project management, telecom and more.  In order to provide an engaging and a real college like experience to a student, EduKart additionally offers academic office hours support, placement assistance and peer to peer networking opportunities."
Exari Systems,https://www.crunchbase.com/organization/exari-systems,"Cloud Computing, Document Management, Enterprise Software","Exari is an automated document assembly and contract automation software company. Exari software uses a web-browser interface to enable  business people to create their own contracts using the templates created by their legal department.  This approach accelerates the contracts process and reduces the burden on busy legal departments.   The Exari system is designed to reduce costs, cycle time and risk, and is used worldwide by legal, procurement, sales, insurance, banking and government professionals.  Exari has offices in Boston, London, Munich and Melbourne."
Extend,https://www.crunchbase.com/organization/extend-enterprises-inc,"Credit Cards, FinTech, Mobile Payments, Payments","Extend is an innovative digital credit card distribution platform for banks, fintechs, businesses, and their customers, that redefines how credit cards are issued. A certified Visa and MasterCard partner, Extend seamlessly integrates with legacy bank issuing systems to enable modern virtual credit card features and distribution capabilities.  Extend is live with both a peer-to-peer credit card sharing app (paywithextend.com) for business customers that want to instantly equip anyone with a secure mean of payments, and a suite of APIs for fintechs to leverage virtual credit cards to enhance their products, enable commerce at POS, and streamline payment operations."
ElevateBio,https://www.crunchbase.com/organization/elevatebio,Biotechnology,"ElevateBio is A New Model To Accelerate Innovation. ElevateBio is creating and operating a portfolio of cell and gene therapy companies through partnerships with the world’s most innovative scientists and inventors.  Together, they leverage their internal bench-to-bedside expertise and to accelerate the development and delivery of therapies – supported by their broad access to capital."
Etagen,https://www.crunchbase.com/organization/etagen,"Clean Energy, Energy, Oil and Gas",
eGenesis,https://www.crunchbase.com/organization/egenesis,"Biotechnology, Genetics","eGenesis is a life sciences company focused on development and commercialization of engineered organisms for the benefit of human health. The company's technology is based on the next-generation genome engineering tool set, CRISPR. eGenesis' team of scientists and advisers include world recognized leaders in the field of genome engineering and regenerative medicine."
Esperanto Technologies,https://www.crunchbase.com/organization/esperanto-technologies,"Computer, Energy Efficiency","Esperanto delivers high-performance, energy-efficient computing solutions, the compelling choice for the most demanding AI / ML / DL applications. Their founding team, with many decades of processor design and architecture experience, is dedicated to delivering solutions to help drive future computing innovation. The changing, computationally intensive, workloads of the machine learning era mandate a new clean-sheet solution, without the baggage of existing legacy architectures. Esperanto leverages the simple, elegant, open standard RISC-V instruction set architecture (ISA) to deliver flexibility, scalability, performance and energy-efficiency advantages."
Earlens Corporation,https://www.crunchbase.com/organization/earlens,"Manufacturing, Medical, Medical Device","EarLens Corporation is a privately held medical device company committed to providing hearing impaired patients a hearing solution that is designed to change the current standard of care for sound performance.  The EarLens System's unique mechanism of direct sound delivery potentially opens the door to a level of sound performance achieved by no hearing aid on the market today.  Unlike traditional hearing aids, which are in effect tiny speakers that simply turn up the volume on air conducted sound, the EarLens Contact Hearing Device™ is the world’s first to use light to transmit sound."
ExteNet Systems,https://www.crunchbase.com/organization/extenet-systems,"Communications Infrastructure, Telecommunications, Wireless","ExteNet Systems designs, builds and operates network infrastructure - primarily using distributed antenna systems. DAS networks by ExteNet Systems are implemented by wireless service providers in a variety of locations and environments.  ExteNet is technologically adaptable â€“ which means they can operate CDMA, GSM, UMTS, 3G and 4G within each fiber network that we deploy. They are adept at designing, implementing and operating fiber networks to extend their networkâ€™s traditional sites into hard-to-zone areas, or to places where you do not have coverage. Their fiber networks could also be a reasonable backhaul solution for wireless service providers."
Electroneum,https://www.crunchbase.com/organization/electroneum,"Cryptocurrency, Financial Services, Mobile Payments","Electroneum is a digital payments ecosystem that allows anyone to store, send and receive digital funds via their smartphone. A new era of digital payments is needed to unlock the global economy for more than 1.7 billion unbanked people worldwide. They are using the power of blockchain to unlock the global digital economy for millions of people in the developing world. Helping everyone to live life on their own terms, their solution is enabling people to embrace their entrepreneurial spirit and find new ways to enhance their lives. Their mobile-based payments solution is powered by ETN - the world’s fastest and first KYC/AML compliant cryptocurrency. ETN is a store of value that can be used to purchase everyday items, from bread and milk, to mobile phone top ups. When used in conjunction with the Electroneum mobile application, users can transfer ETN to anyone in an instant, either in person or remotely."
Enmacc,https://www.crunchbase.com/organization/enmacc,"Energy, Information Services, Information Technology, SaaS, Trading Platform","Enmacc is an independent OTC energy trading platform that provides sales trading and makes energy trading. It also digitises the energy procurement process from start to finish - market participants gain speed, efficiency, and security. More than 200 companies and over 700 active traders already use the continuously growing Enmacc network of energy suppliers, distributors, industrial companies and municipal utilities.  Enmacc customers benefit from attractive, competitive prices and new business potential in addition to more market opportunities. The platform allows users to buy gas and electricity directly from energy suppliers. Enmacc was founded in 2016 and is headquartered in Munich, Bayern, Germany."
Emissary,https://www.crunchbase.com/organization/emissary,"CRM, Enterprise Software, SaaS","Emissary's platform pairs sales professionals with former executives at the companies they are targeting. Emissary is a hybrid SaaS marketplace which connects sales teams on one side with people (called emissaries, naturally) who can guide them through the sales process at companies they are familiar with. The best emissaries are generally ex-executives and employees who have recently left the target company, and therefore understand the decision-making processes and the politics of the organization. These Emissaries provide unprecedented insight into the people, the culture, and the politics of the target organization, allowing our clients to close key opportunities faster."
Ember Technologies,https://www.crunchbase.com/organization/ember-technologies,"Consumer Electronics, Consumer Goods, Food and Beverage","In 2010, entrepreneur and inventor, Clay Alexander, embarked on a journey to revolutionize the tabletop industry by incorporating thermal technology into dishware to keep food, drinks and other temperature sensitive items at consistent temperatures. After years of research and development and numerous innovations, Alexander created and patented the technology to keep food and drinks at a precise temperature, forming the basis for Ember.  Combining a foundation of patented technology and cutting-edge design, Ember launched its first product – the Ember Travel Mug – in 2016. The Ember Travel Mug launched in Starbucks and sold out in days, creating a new category of temperature control drinkware and establishing Ember as the category-defining brand. Ember’s second product – the Ceramic Mug – launched in over 4,500 Starbucks stores in 2017 and was received with enormous success. It was also named one of TIME Magazine’s 25 Best Inventions of 2017. Ember’s success has enabled the company to attract a world-class group of engineers and leaders who bring experience from brands such as Apple, Amazon Labs, Beats by Dre, Under Armour, Google, Microsoft, Nokia, and Skechers. Ember also has a prominent celebrity investor list including Demi Lovato, Nick Jonas, Joe Jonas and several others who promote the brand. Ember is executing a focused strategy to disrupt several multi-billion dollar categories, penetrate international markets, and become the next household brand name. "
Exosome Diagnostics,https://www.crunchbase.com/organization/exosome-diagnostics,"Biotechnology, Genetics, Health Care, Health Diagnostics","Exosome Diagnostics is developing biofluid-based molecular diagnostic tests for use in personalized medicine. Exosomes and other microvesicles are shed into all biofluids, including blood, urine and cerebrospinal fluid, forming a highly enriched source of intact, disease-specific nucleic acids. The Company's proprietary exosome technology makes use of this natural enrichment to achieve high sensitivity and specificity for rare gene transcripts and the expression of genes responsible for cancers and other diseases."
Ellevation,https://www.crunchbase.com/organization/ellevation,"E-Learning, Education, Language Learning, Software","For the growing population of students whose first language is not English, learning to speak and write English fluently is essential to succeed in college and career. Ellevation is the first and most powerful suite of tools designed specifically for professionals serving English Language Learners."
Erasca,https://www.crunchbase.com/organization/erasca,"Emergency Medicine, Health Care, Life Science","Erasca is embedded in their name: To erase cancer in patients by creating a new generation of oncology drugs that they hope will not just treat, but actually cure. Energized by recent scientific discoveries and advances in drugging various biological drivers of cancer, they are committed to solving oncology’s hardest problems. They have assembled a proven team and joined forces with world-class collaborators who embrace their ambitious goals. In addition to their initial programs for undisclosed cancer targets, they seek to expand their pipeline through partnerships with academic scientists and biopharmaceutical companies who have revealed potential new mechanisms for precision oncology. Importantly, Erasca isn’t tied to one form of drug or any singular approach to treating cancer."
eShakti.com,https://www.crunchbase.com/organization/eshakti-com,"E-Commerce, Fashion, Shopping",We are an international fashion design company making custom clothing. Offering both style and fit customization for women size 0 through 36 is the heart of our business. eShakti believes that all women have the right to wear affordable fashion that is made for them and makes them look their absolute best.
Edgewise Networks,https://www.crunchbase.com/organization/edgewise-networks,Network Security,"Edgewise Networks is revolutionizing network security by proactively preventing application compromise and attack progression by network-borne threats. Edgewise provides Trusted Application Networking for the cloud and data center to protect where firewalls fail. They prevent progression of network-borne threats by allowing only trusted applications to communicate over approved network paths. Using machine learning, Edgewise recommends and prioritizes optimal policies to eliminate 98% of the network attack surface and protect the rest."
Elixxir,https://www.crunchbase.com/organization/elixxir-io,"Blockchain, Developer Platform, Messaging, Payments","Elixxir is a fullstack blockchain platform led by David Chaum, a pioneer in blockchain and digital payments. Chuam leads the Elixxir team to unite his early work on the first digital currency (DigiCash), mix networks, & cryptographic precomputation into one blockchain protocol. Elixxir is built to deliver the high transaction rates, short processing times, with private transactions and secure transactions to bring blockchain technology to mainstream adoption."
Envoy Global,https://www.crunchbase.com/organization/visanow,"Computer, Human Resources, Information Services, Legal, Software","Envoy (formerly VISANOW) makes it easy for employees to be ready and able to work, wherever opportunity calls. We provide the only immigration management platform that makes it seamless for companies to hire and manage a global workforce by combining expert legal representation — for both inbound and outbound immigration — and proprietary technology."
Eureka Therapeutics,https://www.crunchbase.com/organization/eureka-therapeutics,"Biotechnology, Life Science, Therapeutics","Eureka Therapeutics pursues innovations that will change the world. We develop technologies that advance the field of antibody therapeutics by increasing the efficacy and specificity of antibody drugs, and the expression level of antibody cell lines. Eureka also provides a wide array of contract research services available to other companies. These services center around cell line development and antibody production or purification."
Evolv,https://www.crunchbase.com/organization/evolv-on-demand,"Analytics, Artificial Intelligence, Big Data, Career Planning, Enterprise Software, Human Resources, Information Technology, Software","Evolv is a big data company that helps solve workforce performance issues for the C-suite by utilizing a configurable cloud services platform. Evolv's patent-pending technology platform unifies and supplements existing data from current systems, then utilizes that dataset to identify fact-based workforce insights that drive measurable ROI. By using objective, data-driven methodology, Evolv helps companies uncover the core reasons behind workforce performance, enabling executives to make better operational business decisions that generally result in tens of millions of dollars in measureable value per year."
Ephesoft,https://www.crunchbase.com/organization/ephesoft,"Finance, Financial Services, Software","Ephesoft is the only Intelligent Document Capture that can run on-premise or in the cloud for OCR for Mortgage, Invoices, Insurance correspondence."
