Organization Name,Organization Name URL,Categories,Full Description
JETSET CHARTER,https://www.crunchbase.com/organization/jetset-charter,"In-Flight Entertainment, Transportation, Travel","Jetset Charter was founded in May 2007 and has completed thousands of successful missions since its inception. There is simply no substitute for premium service in the private aircraft charter industry. That's why Jetset Charter strives to deliver the highest level of service in On-Demand charter and with our Jetset Card Program - with thousands of satisfied clients all over the world. Unlike many of our competitors, our airplane charters are completely flexible and customized for every situation and budget, and we can have a private flight ready for you with as little as two hours notice. The staff at Jetset Charter is committed to making your Jet Charter experience as enjoyable as possible, and we will do all we can to accommodate any special requests we receive. Schedule changes, emergencies, and last minute reservations are never a problem. Our representatives are standing by 24 hours a day/7 days a week and are can have you up in the air in as little as two hours. assisting you in the planning of each and every phase of your journey. Whether you are flying for business or pleasure, Jetset Charter will make sure that you get the premium level of service that you deserve. With our On-Demand Charter service, when we say ""pay as you fly"", we mean it. There are no membership fees, fractional ownership costs or long-term commitments required. We simply want our clients to be able to relax and enjoy their flights without ever having to worry about the arrangements. Just tell us where you need to go and when you need to be there, and we can handle the rest. Our network of over 5,000 private aircrafts guarantees that we can choose the aircraft most appropriate to your unique travel situation. Jetset Charter will customize your flight with special touches such as in-flight catering, on-board entertainment, ground transportation, and hotel reservations. Once you have experienced our service, you will see that we are truly the one-stop solution for all your Private Aviation needs. When you request a quote from Jetset Charter, you are taking advantage of our combined 30 years experience in the industry, together with the knowledge and industry relationships we have formed, which will get you the best deals on Part 135 aircrafts. Call or go online today! Jetset Charter has been a member of the National Business Aviation Association (NBAA) since 2007."
JEB Plastics,https://www.crunchbase.com/organization/jeb-plastics,"Manufacturing, Plastics and Rubber Manufacturing",
JET Group,https://www.crunchbase.com/organization/jet-group,Air Transportation,"JET Group, Inc. is a leading business aviation services company in the United States. JET aims to become the undeniable solution for todayʼs outsourced maintenance needs in the aviation industry. We offer cost effective maintenance solutions at major airports throughout the United States with the ability to respond quickly to our customers needs at any location. Our commitment to quality, reliability, and safety are our top priority when providing a level of service that is unprecedented. "
Jefferson Center for Mental Health,https://www.crunchbase.com/organization/jefferson-center-for-mental-health,"Communities, Health Care, Non Profit","Jefferson Center is a nonprofit, community-focused mental health care and substance use services provider. They offer hope and support to individuals and families who are struggling with mental health issues and substance use disorders."
Jemtec,https://www.crunchbase.com/organization/jemtec,Education,
Jesse Lynn Chuan,https://www.crunchbase.com/organization/jesse-lynn-chuan,"Communities, Education","Jesse Lynn Chuan is a global organization that prides itself in helping children in every corner of the world. Together, lets build a better future for our children."
Jeff's Mercedes Auto Service,https://www.crunchbase.com/organization/jeffs-mercedes-auto-service,Automotive,"Jeff's Mercedes Auto Service center specially made for specially for Mercedes cars, they have service center in Los Angeles & Santa Monica. They provide better service for Mercedes cars for all type of repair. They have experience mechanics and service people for provide services."
Jeeves,https://www.crunchbase.com/organization/jeeves-b358,Laundry and Dry-cleaning,"Jeeves of Belgravia offers a professional dry cleaning and laundry service focused on high quality clothing, meticulous fabric care, and discreet and attentive service.They have proudly held a Royal Warrant for our Dry Cleaning services to HRH the Prince of Wales and his family for over 40 years."
Jennings Group,https://www.crunchbase.com/organization/jennings-group,Real Estate,
Jerry Brothers Industries,https://www.crunchbase.com/organization/jerry-brothers-industries,"Industrial, Tobacco","Jerry Brothers Industries was founded in the early 1900s by members of the Jerry family. The business remained in the Jerry family until the 1970s, and its primary focus was conveyor belting for the tobacco industry. Since the 1980s, JBI has diversified its customer base while continuing to foster its tobacco industry relationships, and in 1996, opened a branch in Charlotte, North Carolina. Today, JBI is a leader in lightweight conveyor belt distribution, providing solutions to its bakery, cookie and cracker, meat, salad, tobacco, printing and paper, box and distribution center customers."
Jell,https://www.crunchbase.com/organization/socionics-io,"Collaboration, Enterprise Software, Human Resources","Jell helps detect the team chemistry by identifying personality traits of individuals to understand how they will ""Jell"" with a team. Jell identifies how well members can work together with minimal distraction or deviation. Jell also empowers leaders to proactively determine which individuals will be most productive and who will have conflicts. Jell is essential for : Sales Team Development, Allocating Project Teams, Managing Existing Conflict, Identifying Potential Conflict, Persuading Your Client, and Team Motivation. The social aspect of Jell can be used to determine how well roommates can Jell, how compatible couples can be, and how well sports team players will Jell."
Jeremy Thomas Designs,https://www.crunchbase.com/organization/jeremy-thomas-designs,"Blogging Platforms, Brand Marketing, Consulting","Over 10 years of high level web design experience with a high proficiency in front-end web development (HTML/CSS), UI/UX design, brand identity development, internet marketing, social media marketing, SEO concepts and traditional print design, and more!"
Jet Athletics,https://www.crunchbase.com/organization/jet-athletics,"Fitness, Sports",
"Jet Logistics, Inc.",https://www.crunchbase.com/organization/jet-logistics-inc,Air Transportation,"Jet Logistics offers worldwide general aviation services thru its AeroMedOPS™, GovOPS™, Maintenance, Charter, Management and Aircraft ."
JetHead,https://www.crunchbase.com/organization/jethead,"Information Technology, Robotics, Software",
"Jeff V Solutions, LLC.",https://www.crunchbase.com/organization/jeff-v-solutions-llc,"Analytics, Content Marketing, Digital Marketing, SEO, Social Media Management, Social Media Marketing, Web Design, Web Development",
Jetson Creative,https://www.crunchbase.com/organization/jetson-creative,Health Care,Jetson Creative LLC is an independent application developing fir
Jevendsmaparcelle.com,https://www.crunchbase.com/organization/hugues,Real Estate,La plateforme qui met en relation les promoteurs immobiliers et les propriétaires offre un service immobilier novateur. Les particuliers qui souhaitent se tourner vers une vente à un promoteur peuvent ainsi bénéficier d'une expertise de professionnels de l'immobilier qui vont lui permettre de vendre son terrain au meilleur prix.
JeetLe,https://www.crunchbase.com/organization/jeetle,"Auctions, E-Commerce","JeetLe.in is a unique platform providing Web-based Contesting and Home Shopping opportunities each! The Web-based Contest comprises of the Reverse-Auctioning System which is the entire crux of JeetLe.in, where as JeetLe Deals will offer our customers discounted online-buying prospects for a better deal! The Reverse-Auctioning System is a unique and time-based bidding process that will allow you to buy/win a consumer product at the lowest price possible albeit the lowest and the unique price comes from you! It’s a strategic game plan that can be foolproof for your winning. Rest assured the JeetLe Deals will always be at your disposal for a discounted price of the same product! So it’s a win-win situation in both the cases!"
Jervis B. Webb Company,https://www.crunchbase.com/organization/jervis-b-webb-company,Industrial Automation,"A worldwide leader in providing material handling solutions through conveyor systems and conveyor services Their company was founded in 1919 by Jervis Bennett Webb, an engineer who developed the forged rivetless chain conveyor. This invention revolutionized the automotive industry - and was the first in a long, continuous line of Webb Company innovations. Their mission is to engineer, manufacture, and install material handling systems - such as modular conveyors -- that increase productivity, improve product quality, and provide production flexibility - all while decreasing lead time and inventory requirements."
"Jeffrey Eglow, Guardian Wealth Advisory",https://www.crunchbase.com/organization/jeffrey-eglow-guardian-wealth-advisory,"Consulting, Financial Services","Jeffrey Eglow, Guardian Wealth Advisory is a pure monetary planning and money management firm located in Boca Raton, that assists customers throughout the United States. With a combined knowledge of over sixty years, our staff is well-versed in all fields of wealth management."
Jewelry Packaging Box,https://www.crunchbase.com/organization/jewelry-packaging-box,E-Commerce,
Jealousme - Online shopping store,https://www.crunchbase.com/organization/jealousme-online-shopping-store,"E-Commerce, Online Portals, Shopping","We provide discount on each item and deliver more than 7000+ cities and towns in India.  The aim of Jealousme is to offer the great quality of products at the lowest price to each customer. User satisfaction is main motto for Jealousme. Visitors find our products very interesting and place an order at discounted price. The evolution of business to consumer online shopping gave the best money saving option to visitors. The user can shop online using different types of devices such as phones, iPhone, laptop and other electronic devices by which they can access [Jealousme.com](https://www.jealousme.com/) using the internet. Jealousme typically enables shoppers to use search features to find all brands with the easiest way. You can pay using debit and credit cards; you can even use your net banking or mobile banking service and we also have option of UPI payment method.  For more information contact 24/7 hours on our customer care number 9867637833 or email on our official email address which is available on jealousme portal."
"Jesup & Lamont Capital Markets, Inc.",https://www.crunchbase.com/organization/jesup-lamont-capital-markets-inc,Financial Services,"Jesup & Lamont is a financial brokerage services firm serving institutional, retail and wholesale customers. Their services are delivered through the Internet and traditional means. Their business model emphasizes the following operating elements: full-service and discount retail securities brokerage via both telephone and the Internet"
Jetchill,https://www.crunchbase.com/organization/jetchill,"Food and Beverage, Hospitality",
JETZ Aviation LTd.,https://www.crunchbase.com/organization/jetz-aviation-ltd,Information Technology,
Jewish Federation of Cleveland,https://www.crunchbase.com/organization/jewish-federation-of-cleveland,Communities,
Jet Air Spain,https://www.crunchbase.com/organization/jet-air-spain,E-Commerce,
Jeyjoo Web Design,https://www.crunchbase.com/organization/jeyjoo-web-design-monte-carlo,"Advertising, E-Commerce, Internet, Photography, SEO, Web Design, Web Development","The leading Anglo-Italian web design, SEO and marketing agency offering web design and marketing in Monte Carlo, Monaco. We work in Monte Carlo, Monaco and across the French riviera"
Jentafon,https://www.crunchbase.com/organization/jentafon,"Electronics, Wholesale","They give their products a 12-month warranty. For warranty, please contact us by email. After the expiry of the warranty period, they will be responsible for the products we sell in accordance with the defect liability specified in Finnish law (Consumer Protection Act)."
Jess-Link Products Company,https://www.crunchbase.com/organization/jess-link-products-company,Manufacturing,"Jess-Link Products Company is specializing in the designing, developing, consolidating and marketing of connectors and components."
Jeff Krigel Law Firm,https://www.crunchbase.com/organization/jeff-krigel-law-firm,"Consulting, Legal",Jeff Krigel is a Tulsa Criminal Defense Attorney handling all felony and misdemeanor criminal cases in Tulsa and surrounding areas. This lawyer offers free consultations.
Jenkins Insurance Services,https://www.crunchbase.com/organization/jenkins-insurance-services,"Employee Benefits, Insurance, Risk Management",Jenkins Insurance Services is provides employee benefit insurance services.
jeniusLogic,https://www.crunchbase.com/organization/jeniuslogic-llc,"Apps, Mobile","On July 12, 2013 Joshua “ jL “ Mitchell founded jeniusLogic LLC. out of his love and passion for technology and entrepreneurship. During his tenure at Apple Inc., a company known for excellent customer relations, Joshua traveled the nation working on iOS and Native App development projects, led and educated a team of certified technicians and trainers as a Lead Genius, facilitated global iOS & OS X certification courses, all while using his spare time to learn more about the mobile platform and its future in business. He then built an extremely effective team of former Apple Geniuses to move forward as their own entity. The combined technological and business acumen of jeniusLogic empowers us to effectively navigate the App Development landscape to provide a customer focused service to businesses who are searching for ways to increase their creative expression through technological innovation.  Since our inception we have acquired a management team, a board of advisors and have partnered with some exceptional businesses on official and promotional brand Apps. The nature of App Development provides us with an ubiquitous platform which spans our services across industries and allows us to partner with private companies, government entities and public figures. Our current body of work consists of the inaugural Verizon INDY 500 Grand Prix of Lousiana App entitled GPofNOLA, the first ever comic book and album App entitled PRIZMS and a competitive music-game App entitled Diamond Man. Our unique perspective on App Development has led us into  negotiations for our first government contract, the creation of an Artist App platform, a first-responder mechanics App and a celebrity brand App just to name a few. This Series A round of funding will exponentially increase our current momentum and propel us into becoming the premier App Development company dedicated to revitalizing how brands and businesses monetize and engage with their brand audience on a global digital scale."
Jennings Social Media Marketing,https://www.crunchbase.com/organization/jennings-social-media-marketing,Public Relations,Jennings Social Media Marketing was founded in June 2003 and is a full service company that utilizes the art of online storytelling with the science of measurin
Jersey Electricity,https://www.crunchbase.com/organization/jersey-electricity,"Energy, Renewable Energy","Jersey Electricity plc is a vertically integrated power utility dealing in the importation, generation, transmission and distribution of electricity. They are the sole supplier of electricity in Jersey, serving around 50,000 domestic and commercial customers. Providing affordable, secure and sustainable energy is their core objective.  Their non-Energy businesses include Retail, Building Services, IT, Environmental Engineering and Properly. Their vision is to responsibly and sustainably deliver value to their customers and they strive to meet or exceed their customers' expectations throughout their various operations.  Through this website they aim to give you an in-depth insight into their activities and the services they provide to help you."
JET Concrete Services,https://www.crunchbase.com/organization/jet-concrete-services,"Construction, Home Improvement, Home Services","JET Concrete Services provides a “turn-key” solution for commercial, civil, and residential projects. The company offers quality customer service and maintaining a high level of quality control.The company has a stringent safety policy to ensure our employees’ safe return home following each workday. JET Concrete Services hold their superintendents personally accountable for maintaining a positive working relationship with all parties on site. This eliminates wasted time and resources, and guarantees that our customer's needs are our first and ultimate priority."
Jeil Pharmaceutical,https://www.crunchbase.com/organization/jeil-pharmaceutical,Biotechnology,"The Central R&D Center established in 1980 forms the core of the R&D activities of Jeil. Currently, as of 2018, the new drug development laboratory, the pharmacology & toxicology laboratory, the organic synthesis laboratory, the formulation laboratory, and the analysis laboratory are actively engaged in conducting research into the complete manufacture and ingredients of innovative new drugs, incrementally modified drugs, and generic drugs."
JerkStudio,https://www.crunchbase.com/organization/jerkstudio,Mobile,"Specialized in virtual gaming experience, www.jerkstudio.com is on the verge of innovation and enrichment to the traditional ways of Mobile Gaming. All our game developers are personally very passionate gamers, and this gives us the extra edge over the other companies. With our exprience presence in the market, we have been able to closely monitor customers’ entertainment needs and desires. This accounts for all our games, which are closely aligned to the changing moods and requirements of our global customers. At www.jerkstudio.com, we value customer ideas and innovative thoughts. Most of our games comprises of a cluster of our expertise, customers’ ideas and a touch of innovation. It is impossible for us to mimic your brain thinking pattern, and that is why we always encourage our valued customers to give us their helpful feedbacks and opinions. Jerkstudio has always given preference to customer core needs, and this the prime reason of our strong niche in the gaming industry. If you are also the kind of person with thousands of ideas running in your mind then Jerkstudio welcomes you to our gaming discussion forum where you can contribute to our games improvement and be a part of our clan."
Jefferson Regional Health Alliance,https://www.crunchbase.com/organization/jefferson-regional-health-alliance,"Communities, Fitness, Health Care, Medical",
Jemtech Solutions,https://www.crunchbase.com/organization/jemtech-solutions,"Information Technology, Software","Founded in August 1994 and located in New York City, JEMTECH Solutions, Inc. achieved its initial success as a custom software developer for document and content management solutions. Our development efforts found us serving clients needing assistance with applications in banking, education, lease management and utilities. In 1996, responding to our clients' requests for a low cost solution providing simultaneous access by multiple users and accommodating multiple information formats, we built our core web-based information management solution utilizing JEMCAPTURE and JEMNET™."
Jemms (UK) Ltd,https://www.crunchbase.com/organization/jemms--uk--ltd,"E-Commerce, Software",
Jersey Village Professional Networking Group,https://www.crunchbase.com/organization/jersey-village-professional-networking-group,Association,
Jewish Funders Network,https://www.crunchbase.com/organization/jewish-funders-network,Non Profit,
Jeevanrahi Matrimonial Services,https://www.crunchbase.com/organization/jeevanrahi-matrimonial-services,Information Technology,"Jeevanrahi is the leading Malayalam Matrimony Sites and all our updations are kept up by our master group prepared to serve you in the most ideal route by making the site basic, effective and user-friendly."
Jelt,https://www.crunchbase.com/organization/jelt,"E-Commerce, Education, Internet",
jetForward Aviation,https://www.crunchbase.com/organization/jetforward-aviation,Travel,
Jerusalem Great Synagogue,https://www.crunchbase.com/organization/jerusalem-great-synagogue,"Association, Social Media",
Jewelry Depot,https://www.crunchbase.com/organization/the-jewelry-depot,Fashion,
Jerry- Gustoso- Real- Estate- Advisor,https://www.crunchbase.com/organization/jerry-gustoso-real-estate-advisor,Real Estate,"Jerry Gustoso has effectuated as a real estate advisor with Engel & Volkers, having observation & track to accomplish dreams of his clients with his expertise. With plenty of experience, he has become a highly talented professional who has created a strong group of agents.Jerry has many interests outside real estate including traveling abroad, interior design, cars, motorcycles, sports and going to the beach where he resides since 2012."
Jewelers International Showcase,https://www.crunchbase.com/organization/jewelers-international-showcase,"Event Management, Events","Jewelers International Showcase organizes jewelry tradeshow events. Its events allow jewelry manufacturers, wholesalers, designers, and other jewelry to sell and deliver their products and services directly to jewelry trade buyers in the Caribbean, Latin America, and the United States."
Jeffrey Thomas Hayden Foundation,https://www.crunchbase.com/organization/jeffrey-thomas-hayden-foundation,"Health Care, Medical, Non Profit",
Jenscare Biotech,https://www.crunchbase.com/organization/jenscare-biotech,"Biotechnology, Health Care",
Jefto,https://www.crunchbase.com/organization/jefto,"Advertising, Analytics, Brand Marketing, Events",Jefto is an analytical marketing tool which analyze the data of an event and makes it easy for a marketing manager to make a decision of sponsorship to events. They are basically an event listing startup focusing on analyzing the marketing data. Today there are so many events to market any product or service that an advertiser or a marketing manager is confused about taking the decision of his marketing budget. They are solving this problem for both the event organizers and the advertiser.
Jemmrere,https://www.crunchbase.com/organization/jomsupport,"Crowdfunding, Internet",
JEDIGITALISE,https://www.crunchbase.com/organization/jedigitalise,"Advertising, Internet, Marketing",
Jeevan Blood Bank,https://www.crunchbase.com/organization/jeevan-blood-bank,"Association, Communities",Jeevan Blood Bank is creating Indias first inventory of donated stem cells.
JellyJames Publishing,https://www.crunchbase.com/organization/jellyjames-publishing,Education,
Jet'Web,https://www.crunchbase.com/organization/jet-web,Information Technology,The objective of Jet'Web is to develop and invest in an extensive network of business services.
