Organization Name,Organization Name URL,Categories,Full Description
Jeeeni,https://www.crunchbase.com/organization/jeeeni,"Advertising Platforms, Apps, Marketing","Jeeeni is a multidimensional lifestyle service that connects users with businesses, services, and communities within one single app. It’s a service that gives smartphone users the power to do whatever they want within one user-friendly application."
Jetstream of Houston,https://www.crunchbase.com/organization/jetstream-of-houston,"E-Commerce, Manufacturing, Retail",
jetAVIVA,https://www.crunchbase.com/organization/jetaviva,Aerospace,"jetAVIVA was founded in 2006 as a dream by two childhood best friends, Cyrus Sigari and Ben Marcus, to create the Greatest Aircraft Sales Organization in the World. Having met at the age of 11 years old at the Santa Monica Airport as cadets in the Civil Air Patrol, the two subsequently grew jetAVIVA into the #1 light jet sales company in the world. As a pioneer in the owner/flown light jet business, jetAVIVA has helped thousands of people enter the world of jet ownership. In 2016, jetAVIVA acquired Kansas Aircraft Corporation, a sales leader in high-performance general aviation aircraft. In 2017, jetAVIVA acquired Jet Quest Inc, an aircraft sales and acquisition firm specializing in the Cessna Citation family. "
Jeelis,https://www.crunchbase.com/organization/jeelis,"Apps, Information Technology, Mobile, Payments","Jeelis is a Luxembourg FinTech company that creates digital platforms and ecosystems, provides a full mobile payment technology stack, ID|KYC and PSD2 platforms. jeelis was born out of an entrepreneurial passion for process simplification by digitisation. They create digital products and they activate ecosystems."
Jet Stream Online,https://www.crunchbase.com/organization/jet-stream-online,"E-Commerce, Internet","JetStream is a hybrid technology operator with services company pioneering online sales on marketplaces in emerging and distant markets such as China, South East Asia, India, Middle East, Africa and South America. We help global brands sell through the JetStream platform to large online retailers and marketplaces in the fastest growing online markets."
Jensen,https://www.crunchbase.com/organization/jensen,Laundry and Dry-cleaning,Jensen is a suppliers to the heavy-duty laundry industry. The product range varies from transportation and handling systems.
Jetware,https://www.crunchbase.com/organization/jetware,"Cloud Computing, Data Center Automation, Developer Tools, Operating Systems, PaaS, Software, Software Engineering, Web Hosting",
Jewelry Galore,https://www.crunchbase.com/organization/jewelry-galore,"E-Commerce, Internet, Jewelry, Shopping, Wholesale","JewelryGalore.com is a New York City based Jewelry company that was founded with a rebellious objective to provide unique accessories online, so shopping for accessories is made easy. JewelryGalore.com brings the 100,000+ jewelry boutiques online by selecting the best of the best and pricing everything fairly while topping everything off with excellent service. A one-of-kind online destination for discovering and exploring new designs across the country, JewelryGalore.com has unbelievable designs that will keep you coming back for more. Offering an expertly curated selection of top accessories with one-of-a-kind pieces, JewelryGalore.com helps women discover, celebrate and even reinvent their personal style with ease by eliminating the hassle of searching through hundreds of sites for the perfect jewels. Jewelry Galore also caters to businesses in markets such as New York, Texas, and California via it's wholesale operations and it's website."
JellyCloud,https://www.crunchbase.com/organization/jellycloud,"Ad Network, Advertising, Analytics","[JellyCloud](http://www.jellycloud.com/) is a behavioral advertising network which leverages patented behavioral targeting technology on behalf of Advertisers, Publishers, Software providers and ISPs.  The company aims to drive high consumer engagement rates for their advertising and publisher platforms."
Jekkle Textbooks,https://www.crunchbase.com/organization/jekkle-textbooks,"Education, Online Portals, Rental","Jekkle is all about providing an easy, fast and professional textbook service for students that focuses on a core element – saving students money."
JeniVision,https://www.crunchbase.com/organization/jenivision,"Biotechnology, Health Care","JeniVision, are an innovative biopharmaceutical company that strives to discover advanced therapies for eye and skin diseases."
Jericho Capital Asset Management L.P,https://www.crunchbase.com/organization/jericho-capital-asset-management-l-p,,
Jeffery Steven Stone,https://www.crunchbase.com/organization/jeffery-steven-stone,Education,"Jeffery Steven Stone has received a degree in B.A. in Economics from the University of Texas at Austin. Being a student of business School - University of Chicago, Jeffery Steven Stone has a successful career which spans over 30 years. Initially Jeffery Steven Stone had worked on the sell-side as First V.P. at Lehman Bros."
Jet King,https://www.crunchbase.com/organization/jet-king,"Consumer Electronics, Education, Electronics",Jetking - India’s leading computer hardware and networking training center. Founded in 1947 as an electronics manufacturing and training company Jetking have gained very good name as the number one quality IT education and hardware practical training coaching Institute in India.             Jetking was started by Late Shri. G. P. Bharwani with  a motive of providing economic independence to more than 10 million people based across India and overseas. Our mission and values at Jetking are aligned to our customers. At Jetking we strive to strain more than 10 million people in India creating quality and  learning opportunities maintaining a balance state of mind.
Jessops,https://www.crunchbase.com/organization/jessops,Photography,"Jessops offers a range of digital photography products, including compact cameras, mirrorless cameras, SLR cameras, lenses, camcorders, optics, memory cards, and camera accessories. Its collection includes products from brands such as Canon, Nikon, Sony, Panasonic, Fujifilm, Samsung, Olympus, Leica, Pentax, and more. Jessops is headquartered in Marlow, Buckinghamshire."
Jet Set Sports,https://www.crunchbase.com/organization/jet-set-sports,"Sports, Travel",
JES Restaurant Equipment,https://www.crunchbase.com/organization/jes-restaurant,"Consumer, Retail","JES Restaurant Equipment sells equipment, supplies, furniture and smallwares to the foodservice industry. JES Restaurant Equipment is a comprehensive marketplace for restaurateurs across the planet looking to grow their business. It is our mission to serve our customers from “the front of the house to the back of the house”, whether it is in our showroom filled with many kitchen must-haves, on the telephone with one of our highly-trained staff members or on our online store."
Jeskell Systems,https://www.crunchbase.com/organization/jeskell-systems,"Computer, Information Technology, Software",
"Jerky Subscription, Inc",https://www.crunchbase.com/organization/jerky-subscription-inc,"E-Commerce, Food and Beverage","Jerky Subscription sends you craft beef jerky that's hard to find anywhere else. Every month, to your home or office. We scout the country for the top craft jerky makers. Searching high and low for the best-tasting jerky. Our expert jerky curators review your preferences and select the perfect jerky brands and flavors just for you. We pack your jerky and ship it to your door, so you get to try new craft jerky every month!"
JE Pistons,https://www.crunchbase.com/organization/je-pistons,Automotive,"With over 60 years of experience, JE Pistons is the leader in high performance forged pistons. They've built a reputation that the competition can only follow. JE has a history of manufacturing the highest quality pistons and components that professional engine builders, race teams, and high performance enthusiasts trust and rely on. The top engine builders in NASCAR, ALMS, NHRA, AMA Supercross and others choose JE Pistons over any other brand. For over 60 years, JE's position at the forefront of performance piston manufacturing has been a result of continuous research and development of unique materials, piston designs and technologies. Utilizing State-Of-The-Art CNC machines for manufacturing along with purpose-designed forgings, JE is able to maintain exacting specifications on each and every piston and hold tolerances to millionths of an inch. Also available from JE is industry-leading processes like Ultra Crown, a Digital Three Dimensional piston crown machining process and Finite Element Analysis (FEA). FEA is a computer process whereby stress and fatigue are tested on a computer model before it goes into production. JE is the only performance piston manufacturer to earn the ISO 9001:2008 quality standard which confirms that JE provides customers the highest standards in quality control. In addition, they also have State-Of-The-Art inspection equipment and testing equipment which enables us to constantly bring you, the customer, the very latest in piston design configurations."
Jerini,https://www.crunchbase.com/organization/jerini,"Biotechnology, Clinical Trials, Pharmaceutical","- Jerini was founded in 1994 as a spin-off from the Medical Faculty (Charité) Humboldt University Berlin to commercialize the SPOT™ technology. The evolving SPOT™ platform was marketed as fee for service projects to pharmaceutical and biotech companies (1995 to 1999). The revenues generated supported the expansion of the company and its technology development. At this stage no venture capital was raised. Due to the expanding applications of its technology platform in drug discovery and proteomics Jerini began its transformation into a drug discovery company.  - To support and accelerate the drug discovery transition Jerini raised Euro 4.6 million in January 2000 in a first financing round that included local investors IBB-Bet. GmbH, bmp AG and tbg. In 2001 the company converted to an AG (joint-stock company) and closed its second, private financing round raising Euro 20 million in November 2001. The investors in this round included an international group represented by TVM, 3i, Polytechnos and Sanders Morris and Harris.  - In 2000 Jerini started creating the medicinal chemistry platform PepMed™ focusing on the identification of peptide lead structures addressing difficult protein targets and their subsequent systematic transformation into drug-like molecules.  - In December 2001 Jerini started its first clinical trials with Icatibant, a peptidomimetic bradykinin receptor antagonist for the indication defined as end-stage liver cirrhosis."
jewelkreator,https://www.crunchbase.com/organization/jewelkreator,"3D Printing, Consumer Electronics, Electronics, Hardware, Manufacturing",
Jebsen & Jessen,https://www.crunchbase.com/organization/jebsen-jessen,"Chemical, Textiles, Trading Platform","Jebsen & Jessen is a trading company is part of a worldwide operating group. A management with a clear strategy and concrete aims for the 21st century as well as a clearly defined company policy, together with a highly motivated staff, are the basis for the efficiency and the success of JEBSEN & JESSEN, Hamburg.   In order to meet the always growing demands of a global market, the company has - apart from providing and distributing goods - to guarantee a reliable service for customers and suppliers. Experienced specialists in our product and country orientated departments help to solve problems of our business partners with modern equipment, flexibility and creativity.   It is our aim to be a reliable and competent partner for our customers.   Our bases in all 5 continents secure direct access to all important purchase and sale markets."
JETWISE,https://www.crunchbase.com/organization/jet-wise,"Aerospace, Banking, Mobile",
Jennings Motor Group,https://www.crunchbase.com/organization/jennings-motor-group,Automotive,"Jennings Motor Group are a collection of car dealerships in the north east of the United Kingdom. It represents the motor brands Ford, Kia, Mazda, Mitsubishi and SEAT, and has recently added Harley-Davidson."
Jetsmart,https://www.crunchbase.com/organization/jetsmart,"Tourism, Travel",
Jeweliq,https://www.crunchbase.com/organization/jeweliq,"E-Commerce, Fashion, Lifestyle","Jeweliq.com is a curated shopping destination for fashion-forward, quality jewelry at guilt-free prices."
Jewson Kitchens,https://www.crunchbase.com/organization/jewson-kitchens,Manufacturing,"We are a kitchen supplier and distributor based in the UK, Coventry. We supply on trend and classic kitchen designs our customer base is mainly trade customers. Our kitchens are designed for high sustainability and to be hard wearing."
JED Pool Tools,https://www.crunchbase.com/organization/jed-pool-tools,"Consumer, Swimming","JED Pool Tools, Inc comes to the rescue for all your pool supply and accessory needs! They have got it all! Check out their JED catalog, which includes pool maintenance equipment--skimmers, leaf rakes, thermometers, pool vacuums, leaf sweeps, chlorinators, pool maintenance kits, through the wall skimmers, backwash hose and filter accessories, pool safety equipment, pool signs, repair kits, floating candles, pool fountains and even water toys!"
JET BI,https://www.crunchbase.com/organization/jet-bi,"Information Technology, Web Design","Professional services in the field of Product Development, Custom Development and Product Implementation with a focus on BI and CRM solutions based on SAP and Salesforce.com technology and frameworks. Turn-key product development services for AppExchange: Lightning components and apps development, Visualforce\APEX development, UX\Front-end development, Canvas apps. Security review, marketing and promo materials preparations. SAP BI\BO implementation and support services. ABAP Development. UI5\Fiory and HANA Cloud Platform custom development"
Jerónimo Martins,https://www.crunchbase.com/organization/jerónimo-martins,"Consumer Goods, Retail","Jerónimo Martins is a Portuguese corporate group that operates in food distribution and specialised retail. We meet the needs of millions of consumers, offering a value proposition based on quality at competitive prices. Our core business is Food Distribution which accounts for more than 95% of the Group’s consolidated sales. In Poland, our main business is the Biedronka chain of food stores while in Portugal, Pingo Doce and Recheio are leaders in their own segments: retail and wholesale, respectively. In Colombia, we run the Ara chain of neighbourhood stores."
Jet Capital,https://www.crunchbase.com/organization/jet-capital,"B2B, Consulting, Financial Services, Venture Capital",Jet Capital provide short-term working capital advances to any size business quickly. They understand business needs don’t always align with cash flow and are here to help their clients' businesses take off. Their unique assessment process allows businesses to qualify for funding even if turned down by traditional lenders.
JESS3,https://www.crunchbase.com/organization/jess3,"Advertising, Data Visualization, Music, Social Media","JESS3 is a creative interactive agency that specializes in the art of data visualization, adding context and meaning to the exponentially growing world of data around us. Their services range from UI / UX, animation, content creation and digital PR to developing large-scale installations, social strategies, data visualizations and infographics. Their client roster is a cross between Fortune 500 giants, media empires and start-up power-houses, including Samsung, Nike, Washington Post, Facebook, NASA, National Geographic, foursquare, Microsoft, C-SPAN, Turner Broadcasting and Google.  But it doesn’t stop there. They also have a dedicated labs division, which funds and launches our own products for the social web. What’s more, they regularly take on pro bono work for causes and issues in which they strongly believe."
Jelly Data,https://www.crunchbase.com/organization/jellydata,"Analytics, Big Data, Information Technology, Internet, Machine Learning, Software",
JENLOR Integrations,https://www.crunchbase.com/organization/jenlor-integrations,"Computer, Consulting, Network Security","Provider of customized information technology (IT) management services. The company offers customized information technology (IT) managed services, cloud services, and infrastructure options to small and mid-sized businesses, taking on the IT hurdles standing in the way of their business goals."
Jetro Platforms,https://www.crunchbase.com/organization/jetro-platforms,"CRM, Information Technology, Robotics",
Jelf,https://www.crunchbase.com/organization/jelf,Financial Services,"Jelf is an independent insurance broker and financial consultancy. It provides expert advice to both businesses and individuals on matters relating to insurance, healthcare, employee benefits and financial planning."
Jetpak,https://www.crunchbase.com/organization/jetpak,"Delivery Service, Logistics","The Jetpak Group is a company that offers express deliveries in the 0-12-hour time span, door-to-door, with a focus on transports."
Jemm Ventures,https://www.crunchbase.com/organization/jemm-ventures,"Consulting, Financial Services, FinTech",
Jeff Cook Real Estate,https://www.crunchbase.com/organization/jeff-cook-real-estate,Real Estate,
Jeet & Jeet Glass and Chemicals Pvt. Ltd,https://www.crunchbase.com/organization/jeet-jeet-glass-and-chemicals-pvt-ltd,"Automotive, Manufacturing, Security","Set up in1972 as a specialized manufacturer of insulated and bulletproof glass, Jeet & Jeet Glass Private Ltd. was the first to introduce anti ballistic products in India. Today, it is a premier manufacturer MultipactTM bulletproof glass made according stringent Euro Norm EN 1063, STANAG 4579 standards to meet different threat levels. It also manufactures a wide range of up armored civilian vehicles, armored personnel carriers, cash in transit vehicles, military shelters, bulletproof podiums and lecterns in two state of the art ISO 9001:2008, ISO 14001, ISO 18001 and CE certified units. 	 +91 141 4121111  email : ask@jeetglass.in Official Website: http://www.jeetglassindia.com/"
Jedcart,https://www.crunchbase.com/organization/jedcart,E-Commerce,"Web based Freight Management System Jedcart's target markets are website developers, online retailers and e-commerce businesses. The problem we are solving for business like eBay merchants is to deliver what people buy online in the easiest and most cost effective way. Giving them more control and certainty of service. Jedcart does this by providing a turnkey software program that instantly selects the best transport method and calculates the most cost effective service to deliver their parcels, especially larger products. Merchants can now manage their freight requirements with more efficiency and certainty of cost, allowing them to focus on growing their business and create new and bigger opportunities nationally and internationally to expand our services and their products globally. Jedcart's Freight Management System can potentially manage thousands of business to deliver millions of parcels across the globe."
JetStrm,https://www.crunchbase.com/organization/jetstrm-llc,"Business Development, Small and Medium Businesses",JetStrm provides space between your business and the last place you will have to look for all of your Cloud Services and Web Development needs.
JEWELL Engineering Consultants,https://www.crunchbase.com/organization/jewell-engineering-consultants,Civil Engineering,JEWELL Engineering Consultants is a firm whose primary practice is the field of Water Resources Engineering.
Jetzt,https://www.crunchbase.com/organization/jetzt,Publishing,
Jetset Magazine,https://www.crunchbase.com/organization/jetset-magazine,"Hospitality, Leisure, Lifestyle, News, Publishing, Travel",
Jevin,https://www.crunchbase.com/organization/jevin,Software,"Jevin is a sports management company that offers you a back office solution to help run and organize your league. They offer a one-stop web-based software system that can do online registrations, rosters, schedules, emails, results, standing, reports and more. Their system is completely integrated so you don't need 2 or more programs to do the job anymore! "
Jet Stream,https://www.crunchbase.com/organization/jet-stream,"Enterprise Software, Security","Jet Stream's light weight and open platforms bring your organization the latest software and the most reliable hardware.  Jet Stream's data storage solutions are as large as 144TB in one server appliance and capable of multi-petabytes by combining add-on devices through various connecting fabrics such as FCoE, SAS and Ethernet. Our FreeBSD platform offers various RAID levels or ZFS configurations and enable advanced caching techniques and hybrid storage pools with flash.  Jet Stream's video management solutions allow for the management (both local and remote) of unlimited IP and analog surveillance cameras. Manage multiple security sites and scale up at anytime."
Jeanuine,https://www.crunchbase.com/organization/jeanuine,"E-Commerce, Fashion, Internet","Jeanuine finds its roots in the combination of the words ""jeans""  and ""genuine"", which in English means: authentic, true, sincere.  A superior quality of jeans to express the singularity of  each individual.  Illustration of their vision, the fingerprint symbolizes the  unique and personalized appearance of Jeanuine creations."
Jeffer Mangels Butler & Mitchell LLP,https://www.crunchbase.com/organization/jeffer-mangels-butler-mitchell-llp,Consulting,
Jersey Urology Group,https://www.crunchbase.com/organization/jersey-urology-group,Medical,Welcome to Jersey Urology Group & finds the best urologist near Philadelphia! We have experienced & dedicated Doctors providing the urology services to the affected patient in (NJ) New Jersey. Schedule your appointment and meet our Doctors!
Jetway Computer,https://www.crunchbase.com/organization/jetway-computer,Computer,"Jetway Computer Corp., established in 1998, specializing in the development and marketing of industrial motherboards and computer peripherals in USA. Among their products are embedded motherboards, industrial barebone systems, rackmount servers, and panel PC. They sell through a distributor and an OEM/ODM/EMS to the worldwide market. As a leading provider of IPC, Jetway offers comprehensive and innovative range of solutions and services. They also set up localized distribution and service centers around the world, such as in USA, South America and Canada, to ensure fast and convenient logistic support globally. All products are designed to meet international standards and manufactured under ISO 9001:2008 quality system. Their research and development team is well versed in a broad range of the latest technology and able to deliver short turn-around time products and applications to meet current market requirements. They emphasize value, quality and service. Starting from the design stage, they focus on the value that can be integrated into the products. You will always find Jetway products delivering high performance, rich features, and good cost structure. Quality cannot be over-emphasized more in Jetway. It begins from the design phase. All the processes are consistence and form a closed plan-do-see-check loop. In Jetway, they do the right thing and do it right repeatedly. Service is the number one priority in Jetway. It is a package of various supports that they offer to their partners. It includes in-time market information, product update, revision control, prompt delivery, flexible production, quick time-to-market cycle, fast RMA and warranty, local warehouse, convenient on-site service, and around the clock technical support."
Jefferson Capital,https://www.crunchbase.com/organization/jefferson-capital-880b,"Cyber Security, Financial Services, Information Technology","efferson Capital Systems, LLC will respond to email requests via US mail only. They cannot respond unless you provide your full first and last name along with your complete mailing address and your 10 digit JCS reference number. Please do NOT include a credit card number, social security number, or other sensitive information in your email. They also cannot respond if you have previously asked Jefferson Capital Systems"
Jetts Fitness,https://www.crunchbase.com/organization/jetts-fitness,"Fitness, Health Care",Jetts Fitness is a low-cost gym operator founded in 2007 by husband and wife Brendon and Cristy Levenson.
JetApps,https://www.crunchbase.com/organization/jetapps,Software,"JetApps is a Software Development WHM & cPanel Experts for Backup, Restore, Migrate and Replicate Data."
Jennifer Lawrence Foundation,https://www.crunchbase.com/organization/jennifer-lawrence-foundation,"Association, Education, Non Profit",
jemboo,https://www.crunchbase.com/organization/jemboo,"E-Commerce, Fashion, Information and Communications Technology (ICT), Semantic Search","You ask, it finds your perfect pair of shoes. The most natural way to find your next pair of shoes."
JEL Capital,https://www.crunchbase.com/organization/jel-capital,Financial Services,
JetEight,https://www.crunchbase.com/organization/jeteight,"Air Transportation, Marketplace",JetEight makes chartering business jets as simple as booking an airline ticket. JetEight is an exclusive travel club that comprises an impressive network of inspiring members and elite companies that share one main belief: time is money. JetEight membership offers a unique opportunity to have access to private aviation for business class prices. 
