Organization Name,Organization Name URL,Categories,Full Description
FedEx,https://www.crunchbase.com/organization/fedex,"Commercial Real Estate, Logistics, Printing, Shipping, Supply Chain Management, Transportation","FedEx provides customers and businesses worldwide with a broad portfolio of transportation, e-commerce and business services. They offer integrated business applications through operating companies competing collectively and managed collaboratively, under the respected FedEx brand. Consistently ranked among the world's most admired and trusted employers, FedEx inspires its more than 290,000 employees to remain absolutely, positively focused on safety, the highest ethical and professional standards and the needs of their customers and communities."
Food.ee,https://www.crunchbase.com/organization/food-ee,"Apps, E-Commerce","Food.ee is a fun and simple service which delivers meals, snacks, cakes and alcohol to your office! All you need to do it 1. Pick a price point 2. Choose your food type 3. Build a menu. Its that easy."
Fastned,https://www.crunchbase.com/organization/fastned,"Automotive, Battery, Electric Vehicle, Travel",Fastned offers a network of charging stations for electric cars. It enables electric drivers to travel throughout the Netherlands via its services. Fastned was established in 2012 by Michiel Langezaal.
Free2Move,https://www.crunchbase.com/organization/carjump,"Apps, Automotive, Car Sharing, Mobile","Free2Move allows people to find and compare vehicles from a wide variety of carsharing providers in one app. Users can see cars from major carsharing providers in their area, find the closest one, compare offers and book the best fit. Their mission is to provide people with easy access to a variety of vehicles and enable them to book directly from the app. The Free2Move App is available for Android, iOS and Windows devices."
Forensic Logic,https://www.crunchbase.com/organization/forensic-logic,"Information Services, Law Enforcement, Legal",Forensic Logic is a company founded on a simple idea: there is too much crime on our streets because critical information is inaccessible or unusable to our nation’s law enforcement. That’s why we have assembled the largest database of local law enforcement data in the country and matched it with some of the most robust and intuitive crime search and analysis tools ever built. The result is an inexpensive and powerful platform that unleashes the power of law enforcement data in ways that have never been done before.
Fairy,https://www.crunchbase.com/organization/fairy,"Home Improvement, Home Services, Housekeeping Service","Fairy offers 30 minute daily “hotel like” cleanings and is a great service for busy professionals and families -- their mission is to deliver happiness to every home in the world. Their team has started and sold venture-backed startups and have helped scale companies like Instacart, NextDoor, Box, and LinkedIn through their IPOs."
Fuyou Kache,https://www.crunchbase.com/organization/fuyoukache,"Logistics, Transportation","Fuyoukache provides long distance truck logistics services to enterprises, individuals and large third-party logistics companies, connecting truck drivers with those in need of logistic services via its online platform."
fitmob,https://www.crunchbase.com/organization/fitmob,"Communities, Fitness, Health Care","ClassPass, founded in New York City in 2014, is a monthly fitness membership that connects members to thousands of fitness studios and gyms in 36 cities around the world. We believe that leading an active lifestyle strengthens both the mind and body - and that living that lifestyle should be easier. We want to help people find experiences that matter to them, that challenge them and that move them As a series B startup with top-tier venture capital support, we've experienced tremendous growth over the past year, and we’re continuing to grow our team, expand our company and evolve our membership to enhance how our members live their every day."
Fresche Solutions,https://www.crunchbase.com/organization/fresche-legacy,"Analytics, Consulting, Enterprise Applications, Professional Services","We future-proof your IT. We work with you through the full lifecycle of your modernization project, we provide project predictability, and we modernize your business while reducing your IT operating costs. We guarantee that IT will make you smile.  We believe I.T can make you smile. This conviction is absolute and without exception. It’s what we call 100% referenceability. Look it up, it's not in the dictionary. We invented it. It means you can pick up the phone and call every single one of our clients and get an exceptional reference. We accomplish this by delivering great legacy solutions that harness complexity, come in all sizes, and stem from amazing partnerships. And by understanding that legacy management is far less about the past than it is about the future.  Never standing still Fresche Legacy, formerly Speedware, has been innovating since 1976. The year Rocky won best picture of the year and the summer Olympics rocked Montreal.  Today we’re an internationally recognized full-lifecycle modernization company that partners with many global leaders such as HP, Microsoft, and IBM. We are experts in modernization, offering solutions that transform the technologies, infrastructure, and methodologies that support IT organization. Most importantly, we provide a single point of responsibility from concept to maintenance. Specialties Legacy Management & Optimization, IT Legacy Migration, Legacy Modernization, IBM Mainframe Modernization, IT Roadmaps, AS/400 Modernization, IBM Mainframe Migration, IT Project Audits, AS/400 Migration, Business Intelligence, HP e3000 Migration, IT Modernization"
feedly,https://www.crunchbase.com/organization/devhd,"Content, EBooks, Reading Apps","Our mission is to connect professionals to the content they need to get ahead and become better at what they do. We believe that reading opens doors, whether that’s performing better at work, mastering a craft or learning something new.  Feedly is the app that connects curious minds with the blogs, websites and sources of content they are most passionate about.  Feedly Cloud is the infrastructure that powers feedly, and an ecosystem of 200+ reading apps (http://feedly.com/apps.html). feedly Cloud is two-sided market place which connects publishers to intent readers."
Fasetto,https://www.crunchbase.com/organization/fasetto,"Consumer, Consumer Electronics, Mobile, Software","Fasetto is a Wisconsin-based startup dedicated to closing connectivity gaps through its powerful hardware and software solutions. Fasetto fuses the mobile computing landscape together to give users easy access to their content, empowering them to view and share with others regardless of platform, device or connection type.Founded in 2013, Fasetto's main mission is to make life simpler through seamless technology. In 2017, LINK by Fasetto, the living storage and communications device powered by the most powerful Samsung technologies, will become available to consumers. LINK combines the capabilities of an LTE hotspot with the large storage of a NAS in a pocket-sized, weatherproof device."
Final,https://www.crunchbase.com/organization/final,"Billing, Credit Cards, FinTech, Fraud Detection, Mobile Payments, Payments, Personal Finance, Security","Final is an Oakland-based startup focused on combating fraud online and offline, while giving consumers more control over their spending. The credit card startup provides its users with a physical card and a mobile application that protects the user’s account from fraud, theft, breaches, and card cancellation. Through its application, the company allows its users to give a credit card number to each merchant or a disposable one-time use number for one-off purchases, and provides view of transactions and buying habits. Founded in 2014, Final is a venture-backed company that went through Y Combinator in Winter 2015."
Flagstone,https://www.crunchbase.com/organization/flagstone-capital,"Banking, Financial Services, Real Estate","Flagstone's simple, secure online platform gives you access to hundreds of deposit accounts from 37 banks through a single application, empowering you to earn more interest income and reduce risk."
Freightera,https://www.crunchbase.com/organization/freightera,"Automotive, E-Commerce, Logistics, Railroad, Shipping, Transportation","Freightera marketplace connects shippers with carrier prices. Over 3,000 businesses across North America use Freightera to save time and lower their shipping costs. Trucking companies use Freightera to fill their trucks and run profitable businesses. It's a win-win solution for both: a more efficient, reliable and cost-effective way to ship freight using Full Truckload (FTL/TL) and Less Than Truckload (LTL) freight carriers serving Canada, US and US-Canada cross-border transportation markets."
Foresight Autonomous Holdings,https://www.crunchbase.com/organization/foresight-3,"3D Technology, Automotive, Web Design, Web Development","Foresight revolutionizes the ADAS  industry by enabling highly accurate and reliable object recognition while ensuring the lowest rates of false alerts.Proven core military technology has been developed, tested and deployed over the past 12 yearsUnique platform that offers ADAS for the Automotive and the Railway industries.Highly experienced management team in the stereo vision technology industry Strong IP and know-how Strategic relationships to solidify position in the market.Focused on the growing semi and fully-automated driving industry."
finleap,https://www.crunchbase.com/organization/finleap,"Finance, FinTech, Insurance","finleap is a company builder for Fintech companies based in Berlin with an office in Milan. Founded in 2014 by HitFox Group and Ramin Niroumand, finleap has already developed 16 ventures with its infrastructure and made market entry possible. These include companies such as solarisBank, the first banking platform with a full banking license, ELEMENT, a fully digital insurer, PAIR Finance, a provider of data-based receivables management, and the B2B2X platforms Finreach Solutions and Infinitec Solutions for contextual finance. finleap provides access to seed capital, a network of investors and experienced entrepreneurs as well as customers and top talents. The finleap Group employs around 700 people from over 60 countries."
Floship,https://www.crunchbase.com/organization/floship,"Logistics, Shipping, Software, Supply Chain Management","Floship is a leading provider of international fulfillment, recognized for fast and cost-effective worldwide shipping services. They offer the total solution for your eCommerce business to reach new markets. By ensuring your logistics are handled by the best in the business, they provide you with the peace of mind to focus on other important things – taking your eCommerce to the next level."
FM Global,https://www.crunchbase.com/organization/fm-global,"Finance, Insurance, Risk Management",The FM Global Group is structured to make that happen. Their affiliates and business units help us deliver the full range of products and services your business needs to be resilient.
Famoco,https://www.crunchbase.com/organization/famoco,"Android, FinTech, Hardware, Loyalty Programs, NFC, Payments, Point of Sale, SaaS, Software","FAMOCO connects contactless card and NFC phones to accelerate the mass-market deployment of any kind of B2C and B2B services. It offers a professional B2B-oriented device as a smartphone to deploy business applications, which bring multiple benefits to its individual customers, banks, and retailers. In addition, FAMOCO provides an Android operating system and a management suite that offers centralized over-the-air device management services for its clients. The company is based in Paris, France with additional offices in Schaerbeek, Belgium and Hong Kong, China. Founded in 2010, FAMOCO is backed by venture capital from Aurinvest and FastForward."
FUEL CYCLE,https://www.crunchbase.com/organization/think-passenger,"Consumer Research, Enterprise Software, Market Research","Fuel Cycle is an all-in-one customer intelligence platform that combines both qualitative and quantitative data to power real-time business decisions. Through online communities, rewards, panels and emerging market research solutions, Fuel Cycle offers an easily customizable and robust platform for brands and businesses to connect with their customers. With Fuel Cycle, organizations are able to put the customer first by capturing, analyzing, and quickly acting upon instant and reliable data to help predict the future of their industry and increase consumer loyalty. We provide customer intelligence solutions for organizations across various industries, including media & entertainment, consumer goods, financial services, healthcare, automotive and technology. Brands powered by Fuel Cycle include Google, ELLE, The UPS Store, AIG and more.perates an online community platform that gives insights and intelligence about customers."
Faira,https://www.crunchbase.com/organization/faira,"E-Commerce, Internet, Real Estate, Residential, Service Industry","Faira is a real estate technology platform that is revolutionizing the way people buy and sell homes – saving money, time and stress for both buyers and sellers. Faira has created a modern, efficient process with unprecedented accountability and transparency built into the system.  Faira makes small changes to the process of selling and buying a home, which make a big impact on the efficiency, transparency and cost-effectiveness. It uses software to automate what can be automated, but it keeps a human touch where necessary to make it easy for sellers and buyers. Faira is free for sellers and provides photography, MLS listing, marketing tools and collateral, and much more. We also have a team of agents that can help our sellers for just 1%. Either way, you get Faira's online offer platform which is designed to deliver the maximum price to the seller."
FloydHub,https://www.crunchbase.com/organization/floydhub,"Artificial Intelligence, Enterprise Software, GPU, Machine Learning",FloydHub is a Platform-as-a-Service for training and deploying your Deep Learning models in the cloud. Start running your first machine learning project in less than 30 seconds! FloydHub takes care of the infrastructure grunt work so you can focus on the core of your problem.
Fruit Street,https://www.crunchbase.com/organization/fruit-street-health,"Health Care, mHealth, Personal Health","Fruit Street offers HIPAA compliant telemedicine, telehealth software that features wearable device integration."
Fordeal,https://www.crunchbase.com/organization/fordeal,E-Commerce,Fordeal is an online cross-border lifestyle products shopping platform.
Fy,https://www.crunchbase.com/organization/fy,"Internet, Mobile, Shopping","Fy is your new best friend. An edit of gorgeous accessories to take with you on life’s adventures. It’s inspired by you. It’s the stuff you want, the way you want to shop for it. It’s how you want to feel when you get dressed in the morning."
FIA Formula E,https://www.crunchbase.com/organization/fia-formula-e,"Automotive, Electric Vehicle, Logistics, Racing, Sports","Formula E is a new FIA motor racing championship featuring single-seater cars powered exclusively by electricity. Beginning in September 2014, the series will compete in the heart of 10 of the world's leading cities with 10 teams, each with two drivers, going head-to-head to create a unique and exciting racing series for a new generation of motorsport fan."
FintechOS,https://www.crunchbase.com/organization/fintechos,"Artificial Intelligence, Financial Services, Information Technology, Venture Capital","FintechOS is an innovation acceleration technology that enables fast, plug & play, comprehensive digital transformation with highly competitive operating costs. The company combines cutting-edge digital technologies, AI and a powerful financial core to reshape customer experience of banking and insurance companies worldwide."
FreightVerify,https://www.crunchbase.com/organization/freightverify,"Information Technology, Logistics, Software, Transportation","FreightVerify provides predictive, real-time transportation visibility at every step of the supply chain. Our shipper-centric platform addresses challenges for large and complex enterprises through industry-defining intelligence. FreightVerify is trusted by the world’s top automotive manufacturers."
Filippo Loreti,https://www.crunchbase.com/organization/filippo-loreti,"Crowdfunding, E-Commerce, Jewelry, Lifestyle, Retail, Wearables","In December 2016 Filippo Loreti's second Kickstarter campaign raised $5,115,675 in 30 days, broke the world record becoming the most funded timepiece project in crowdfunding history."
Foghorn Therapeutics,https://www.crunchbase.com/organization/foghorn-therapeutics,"Biopharma, Biotechnology, Life Science, Therapeutics"," Foghorn Therapeutics is developing therapies based on a system that directs which genes our cells express, and when, where, and in what order.By manipulating this system with our unique Gene Traffic ControlTM platform, Foghorn will change how genes turn “on” and “off.” Unlike approaches that edit genes, this novel way of thinking will alter what our DNA has in store for us—and rewrite destiny for millions of people living with disease.With Gene Traffic ControlTM Foghorn is pioneering a new, major class of drug targets to develop unprecedented therapies for cancer and other serious diseases. We have already validated multiple targets, are in the process of developing drug candidates in multiple types of cancer and are beginning to explore other diseases. "
Flamingo AI,https://www.crunchbase.com/organization/flamingo-ventures,"Artificial Intelligence, Customer Service, Information Services, Information Technology, Machine Learning, SaaS",Flamingo AI is an enterprise SaaS company in the field of Conversational Commerce providing Cognitive Virtual Assistants and Knowledge Engines that analyse unstructured data that automate online customer sales and service experiences.
Fonality,https://www.crunchbase.com/organization/fonality,"Cloud Computing, Telecommunications, VoIP","Fonality is a business communications company that provides business phone systems as well as cloud-based VoIP and Unified Communications solutions. It serves small- and medium-sized businesses in industries such as insurance, legal, service and technology, non-profit and education, and manufacturing. The company’s solutions include Business Phone System: a system for integrated call management and collaboration; Hosted PBX System: a cloud-based phone system; Hybrid PBX System: a hybrid-hosted environment for communication; and Unified Communications: an application to manage phone calls, voicemail, instant messaging (IM), conference calls, email, screen sharing, video conferences, and more. Fonality was founded in 2004 and is based in Plano, Texas."
Feidee,https://www.crunchbase.com/organization/feidee,"Enterprise, Finance, FinTech, Management Information Systems","Feidee owns and operates online platforms for personal finance management while also enabling users to record their daily expenses online. The company also operates Kaniu, a mobile application used to manage credit card expenditure. Feidee was founded in 2010 and is based in Beijing, China."
FANCHEST,https://www.crunchbase.com/organization/fanchest,"B2B, E-Commerce, Internet, Sporting Goods, Sports","FANCHEST is a Brooklyn-based company that curates and sends team-themed gift boxes as gift. FANCHEST is a company built by sports fans for sports fans - They believe in FANS FIRST. They love what it means to be a fan; the bonds it creates with friends, family and other fans; the sense of community and purpose; and the ability to come together and celebrate a common goal. They want to help people access, create, and enjoy these experiences. FANCHEST has a B2B component as well, with the end goal of improving fan experience and engagement through increased ticket sales, exclusive merchandise promotions, and strategic partnership opportunities.  FANCHEST works directly with teams, schools, vendors, and sponsors to build consistent touch points outside the game day experience."
Future Motion,https://www.crunchbase.com/organization/onewheel,"Hardware, Software","Future Motion is a pioneering new entrant to the boardsports world. Future Motion is committed to designing and developing inspiring vehicles that include both elegant form and unprecedented function. Future Motion's products Onewheel and Onewheel+, exemplify its dedication to crafting products that bridge recreation and transportation. Future Motion is based in Santa Cruz, California."
Fanli,https://www.crunchbase.com/organization/fanli-website,"E-Commerce, Retail, Shopping","Fanli operates an e-commerce shopping website in China. The website includes various home appliance business websites, including e-commerce company’s websites.  Fanli lets users click on the rebate link to go to the corresponding merchant website to place an order and the merchant will pay a rebate for the user's order for a marketing fee. Gary Ge and Geng Yongchang founded Fanli in November 2006, with its headquarters in Shanghai in China."
Fiat Chrysler Automobiles,https://www.crunchbase.com/organization/chrysler-group-llc,"Automotive, Industrial Manufacturing, Transportation","Fiat Chrysler Automobiles (FCA) designs, engineers, manufactures and sells vehicles and related parts, services and production systems worldwide. The Group operates 102 manufacturing facilities and 46 R&D centers, and it sells through dealers and distributors in more than 135 countries. FCA’s automotive brands include Abarth, Alfa Romeo, Chrysler, Dodge, Fiat, Fiat Professional, Jeep, Lancia, Ram, Maserati. The Group’s businesses also include Mopar (automotive parts and service), Comau (production systems) and Teksid (iron and castings). In addition, retail and dealer financing, leasing and rental services in support of the Group’s car business are provided through subsidiaries, joint ventures and commercial arrangements with third-party financial institutions."
Flexible Pass,https://www.crunchbase.com/organization/flexible-pass,Health Care,"Flexible Pass is the No.1 Health and Fitness App in Myanmar that gives users access to over 70 gyms,fitness centers and hotels offering a wide variety of fitness activities. The vision of Flexible Pass is to help people in Myanmar live a healthier lifestyle by providing them with flexible and affordable fitness options."
Fulgent Therapeutics,https://www.crunchbase.com/organization/fulgent-therapeutics,"Biotechnology, Genetics, Pharmaceutical, Therapeutics","Fulgent Therapeutics was issued its CLIA license (CLIA 05D2043189/CLF 00342581).  Apart from traditional single gene tests, Fulgent Therapeutics has been investing heavily in the future.  Using Next Generation Sequencing (NGS) technology we are developing a new series of panel based tests for our clients."
FibroGen,https://www.crunchbase.com/organization/fibrogen,"Biopharma, Biotechnology, Therapeutics","FibroGen is a research-based biotechnology company using its expertise in connective tissue growth factor (CTGF) and hypoxia-inducible factor (HIF) biology to discover, develop, and commercialize novel therapeutics for serious unmet medical needs."
felyx,https://www.crunchbase.com/organization/felyx,"Last Mile Transportation, Transportation","felyx offers shared electric scooters (mopeds) as a new and disrupting urban mobility concept. Currently 108 e-scooters are operational in Amsterdam, 324 in Rotterdam and 200 in The Hague. The company will expand to Brussels in the summer of 2019, adding more than 600 e-scooters to its fleet. Traffic congestion and relentless pressure on public transit are a fact of life for urban citizens. felyx believes e-scooter sharing to be the best urban transportation method, as it is the fastest, most convenient and sustainable ride around town. Through an app, customers can “rent” e-scooters per minute and get around urban areas quickly. felyx’ e-scooters are available for one-way trips and can be parked anywhere within the designated area (so called “free-floating”). User benefits: - Fast: door-to-door and easy to park - Affordable: prices comparable to public transport - Sustainable: zero emission"
Fanxchange,https://www.crunchbase.com/organization/fanxchange,"Concerts, E-Commerce, Sports, Theatre","Fanxchange is the B2B industry leader in powering white labeled live event ticketing solutions for major loyalty programs, financial institutions, travel & hotel providers, concierge services, e-commerce marketplaces and distribution partners; providing their users access to tickets for every live event in North America. Fanxchange employs a distributed commerce model - streamlining the way consumers access live events by surfacing tickets across multiple distribution verticals where consumers are already engaging in content and commerce. "
