Organization Name,Organization Name URL,Categories,Full Description
Facebook,https://www.crunchbase.com/organization/facebook,"Messaging, Mobile, Mobile Apps, Social, Social Media, Social Network","Facebook is an online social networking service that allows its users to connect with friends and family as well as make new connections. It provides its users with the ability to create a profile, update information, add images, send friend requests, and accept requests from other users. Its features include status update, photo tagging and sharing, and more. Facebook’s profile structure includes a timeline, information related to the user, images of the user, images added by friends of the user, notes, pages, groups, and more. It enables its users to create pages related to entertainment, sports, business, finance, preferences, hobbies, culture, religion, causes, organizations, and a number of other categories. It also enables its users to join or create groups related to a vast number of categories. With millions of more users, [Friendster](http://www.crunchbase.com/organization/friendster) attempted to acquire the company for $10 million in mid-2004. Facebook turned down the offer and subsequently received $12.7 million in funding from [Accel Partners](http://www.crunchbase.com/organization/accel-partners) at a valuation of around $100 million. Facebook continued to grow opening up to high school students in September 2005 and adding a photo sharing feature the next month. The next spring, Facebook received $25 million in funding from [Greylock Partners](http://www.crunchbase.com/organization/greylock) and [Meritech Capital](http://www.crunchbase.com/organization/meritech-capital-partners) as well as previous investors [Accel Partners](http://www.crunchbase.com/organization/accel-partners) and [Peter Thiel](http://www.crunchbase.com/person/peter-thiel). The pre-money valuation for this deal was about $525 million. Facebook subsequently opened up to work networks eventually amassing over 20,000 work networks. Finally in September 2006, Facebook was opened to anyone with an email address. Facebook continued to receive funding most notably in January 2011 receiving $1.5 billion and valuing the company at $50 billion. A year later in February 2012, Facebook announced that it was filing for its long-anticipated initial public offering. The company went public on May 18, 2012 opening in [NASDAQ](http://www.crunchbase.com/organization/nasdaq-private-market) with shares trading at $42.05. Facebook announced positive numbers in February 2012 upon filing for its IPO. As of July 2013 over 1.15 billion users have logged into Facebook every month and 669 million users daily. Mobile users now make up half of Facebook’s user base with 819 million monthly actives. Facebook is one of the most trafficked sites in the United States. Additionally, Facebook is the top photo sharing site with 250 million photos uploaded per day. The company has strategic partnership with AXA Group to develop marketing and commercial collaboration in the digital, social, and mobile sphere. Facebook is currently the owner of many applications and services such as Pagemodo Pagebuilder, [RSS Graffiti](http://www.crunchbase.com/organization/rss-graffiti), Huddle, and more. It is the world’s largest social network with over 1.32 billion monthly active users. Facebook was founded by Mark Zuckerberg on February 4, 2004 in Menlo Park, California."
FreightWaves,https://www.crunchbase.com/organization/freightwaves,"Analytics, Artificial Intelligence, Financial Services, Freight Service, Logistics, Marketplace, Predictive Analytics, Railroad, SaaS, Transportation","FreightWaves is a SaaS provider of data for the  North American freight market. FreightWaves was founded to provide transparency and risk-management products to the freight markets. As the leading provider of aggregated data-sets across the North American freight markets, FreightWaves' SaaS platform helps companies take action based on the signals in the market. FreightWaves.com is the highest rank news and commentary site in the industry and the firm is introducing a freight futures product which will help participants derisk their exposure to trucking spot rates. "
Farfetch,https://www.crunchbase.com/organization/farfetch,"E-Commerce, Fashion, Internet, Retail","Farfetch operates an e-commerce website that unites various independent fashion boutiques. It offers bags, coats, dresses, jackets, jewellery, swimwear, trouser, shoes, knitwear, suits, shorts, and accessories.  They operate a modular end-to-end technology platform purpose built to connect the luxury fashion ecosystem worldwide. Their vision was to create a single operating system that could address the complex demands of consumers and luxury sellers alike. Their platform is built on an API-enabled proprietary technology stack, which provides the foundation for the three main components: applications, services and data.  Farfetch serves women, men, and kids. Jose Neves founded the company in 2008, with its headquarters in London, United Kingdom."
Flipkart,https://www.crunchbase.com/organization/flipkart,"E-Commerce, Grocery, Internet, Retail, Shopping","Flipkart owns and operates an online shopping website in India. It provides books, movies, music, games, consoles, gaming accessories, mobiles, mobile accessories, cameras, camera accessories, computers, computer accessories, network components, software, peripherals, home and kitchen appliances, TV and video products, and personal and health care products.  Binny and Sachin Bansal founded Flipkart in 2007, with headquarters in Bengaluru in India. In 2018 the company was acquired by giant retail corporation, [Walmart](/organization/walmart)."
Fitbit,https://www.crunchbase.com/organization/fitbit,"Cloud Computing, Fitness, Health Care, Personal Health, Wearables","Fitbit inspires people to exercise more, eat better and live healthier lifestyles.  The company is developing an ultra-compact wireless wearable sensor, called the Fitbit Tracker, that automatically tracks data about a person's activities, such as calories burned, sleep quality, steps and distance. The Fitbit Tracker collects activity data automatically while it is worn by the user all day. The collected data is wirelessly uploaded to a website where the wearer can see their data and track their progress toward personal goals. The website provides a motivational interface where users can share their progress, compare themselves against similar people and work toward virtual goals with their friends, family and co-workers. At the website, users can also manually log nutrition, weight and other health information in order to gain a complete picture of their health. Fitbit makes it easy to achieve a healthy lifestyle by automating the collection of health data and providing a motivating and entertaining user interface."
FreshBooks,https://www.crunchbase.com/organization/freshbooks,"Accounting, Billing, FinTech, Payments, Small and Medium Businesses","FreshBooks is the #1 accounting software in the cloud designed exclusively for service-based small business owners and independent professionals. The company has helped more than 10 million people worldwide process billions of dollars with its ridiculously easy-to-use invoicing, time tracking, expense management features. Recognized with eight Stevie awards for best customer service in the world, the company’s mantra is to “execute extraordinary experiences everyday.” Based in Toronto, Canada, FreshBooks serves paying customers in 160 countries."
Flytrex,https://www.crunchbase.com/organization/flytrex,"Delivery, Delivery Service, Drones, Food Delivery, Robotics, Same Day Delivery, Software","The Drone Delivery Pioneers. Offering a delivery solution simpler, faster, cheaper and greener than ever before.  Whether you're a drone operator seeking to expand, logistic service, or, setting up a new business, Flytrex provides everything you need to start delivering with drones easily and affordably!   Currently operating in Iceland and the U.S. (as part of the FAA drone pilot program). Amit Regev and Yariv Bash founded it on November 1, 2013, with its headquarters in Tel Aviv in Israel."
FireEye,https://www.crunchbase.com/organization/fireeye,"Cloud Security, Cyber Security, Network Security","FireEye is the only cyber security company that combines the automation of technology with unparalleled frontline human expertise, including industry-recognized services and nation-state grade threat intelligence. On the front lines of cyber attacks every day, FireEye has unrivaled real-time knowledge of the global threat landscape spanning more than two decades, gathered by hundreds of highly experienced threat researchers, platform engineers, malware analysts, intelligence analysts, and investigators, as well as a global network of best-in-class business partners. This unique understanding of how organizations combat cyber attacks guides the products FireEye builds. Working as a seamless, scalable extension of customer security operations, FireEye offers a unified platform called Helix that integrates and analyzes the data from security assets to offer real answers about the threats that matter. With innovative security technologies, nation-state grade threat intelligence, and world-renowned Mandiant consultants, FireEye eliminates the complexity and burden of cyber security for organizations struggling to prepare for, respond to, and remediate cyber attacks."
Flatfair,https://www.crunchbase.com/organization/flatfair,"FinTech, Real Estate, Rental Property, Software","Flatfair is the fastest growing deposit alternative in the UK, already available in hundreds of letting branches across the country (e.g. through the Spicerhaart network). With Flatfair, landlords can offer tenants the option to pay an affordable membership fee instead of an expensive tenancy deposit. In exchange, Flatfair landlords get up to double the protection compared to a deposit (up to 12 weeks worth of rent) and benefit from fewer voids. Flatfair's technology takes away the hassle of managing deposits - from registration, change of sharer to checkout - and pays its partnered letting agents a commission for bringing on new tenants."
Fever,https://www.crunchbase.com/organization/fever-3,"Android, Internet, iOS, Mobile, Social Media, Ticketing","Fever is a mobile app and social discovery tool that provides a curated and personalized list of local events based on user preferences. Backed by a team of Rockstar Investors and Advisors, the app gives you the ability to RSVP and purchase same-day tickets to events or buy tickets in advance. The company is headquartered in New York, New York, United States."
Fetch Robotics,https://www.crunchbase.com/organization/fetch-robotics,"Industrial Automation, Life Science, Mobile, Robotics, Supply Chain Management, Warehousing","Fetch Robotics is a San Jose, Calif.-based industrial robotics startup that develops and manufactures collaborative, autonomous mobile robot solutions for the warehousing and logistical markets. It takes takes advantage of its deep robotics expertise to provide reliable and safe collaborative AMR (Autonomous Mobile Robot) solutions for two commercial applications: material handling and data collection. Fetch Robotics is a venture-backed Silicon Valley startup founded in 2014."
Funding Circle,https://www.crunchbase.com/organization/funding-circle,"Finance, Financial Services, FinTech","When Funding Circle was founded, they could see that businesses weren’t being given the finance to grow, while investors were making poor returns. They had a simple idea — let them support each other. By lending directly to businesses through Funding Circle, investors can now earn attractive returns to better provide for their future. Businesses get fast, easy access to funding to grow, create jobs, support local communities and drive the economy forward. They believe it’s better for everyone."
Forecast,https://www.crunchbase.com/organization/forecasthq,"Artificial Intelligence, Developer Tools, Human Resources, Machine Learning, Natural Language Processing, Professional Services, Project Management, Scheduling, Software, Task Management","Forecast is a business management platform that helps project-based companies automate operations, empower people and leverage insights to drive business performance and client success. At Forecast, we believe your every day should be filled with less ad-hoc and administrative work. That freedom creates more room to focus on evolving, improving and empowering your people to think innovatively. Whether it is designing, structuring, acting or simply steering the company in the right direction, Forecast has your back. Increase agility with a platform that embraces a radically new approach of continuous improvement and learning by leveraging Artificial Intelligence (AI). Instead of spending time collecting data, we think you should be spending time acting from data. That will enable you to move from the old world projects first to a new world of clients first, which in turn will help you deliver better results."
Ford Motor Company,https://www.crunchbase.com/organization/ford,"Apps, Automotive, Manufacturing, Transportation","Ford Motor Company manufactures or distributes automobiles in addition to offering financial services. The company sells to dealerships for retail sale, and for sale to fleet customers, including commercial fleet customers, daily rental car companies, and governments. Ford’s vehicle portfolio includes automobiles, buses, tractors, and trucks. As a result of these financing activities, Ford Motor Credit Company LLC has a portfolio of finance receivables and operating leases which it classifies into two portfolios— ‘consumer’ and ‘non-consumer’. Finance receivables and operating leases in the consumer portfolio include products offered to individuals and businesses that finance the acquisition of its vehicles from dealers for personal and commercial use. Retail financing includes retail installment sale contracts for new and used vehicles, and direct financing leases for new vehicles to retail customers, government entities, daily rental car companies, and fleet customers. Finance receivables in the non-consumer portfolio include products offered to automotive dealers. Ford’s environmental initiatives include compressed natural gas, flexible fuel vehicles, electric drive vehicles, Hydrogen, and PC power management, and so on. Ford Motor Company was founded by Henry Ford in 1903 and is headquartered in Dearborn, Michigan."
FanDuel,https://www.crunchbase.com/organization/fanduel,"Fantasy Sports, Gaming, Sports","FanDuel, launched in July 2009, is the undisputed leader in the one-week fantasy sports industry. Offering fantasy sports for NFL, MLB, NBA and NHL FanDuel targets the 30+ million adult fantasy sports players in North America.  Players draft fantasy sports teams at any time of the season in head-to-head or multi-player contests, paying an entry fee for each contest and vie for cash prizes. In 2013 the company awarded over $150m in prizes and is on course to award over $400m in 2014. The company currently has over 100 employees and is headquartered in New York."
Foodpanda,https://www.crunchbase.com/organization/foodpanda,"Delivery, E-Commerce, Food Delivery","Foodpanda is a global online food delivery marketplace that enables users to place orders at local restaurants via its website or mobile application. Customers enter their postcodes on the site, browse for food from a list of restaurants, and place the order; foodpanda processes the order details, sends out an SMS to customers to confirm orders and their estimated delivery time, and passes the details to partner restaurants; and the restaurants deliver the food to customers. It is called foodpanda in Asia and Europe and hellofood in Africa, Latin America, and the Middle East. Foodpanda has partnered with more than 60, 000 restaurants globally, including Pizza Hut, Subway, KFC, McDonalds, and Jollibee. Foodpanda was launched by Ralf Wenzel and Benjamin Bauer in 2012 and is operated from Berlin, Germany with presence in over 40 countries and 500 cities across 5 continents."
Flybits,https://www.crunchbase.com/organization/flybits,"Analytics, Artificial Intelligence, Developer Tools, Enterprise Software, Machine Learning, Mobile, Predictive Analytics, SaaS","Flybits is positioned to lead the market in delivering the next-generation digital experience platform. Our patented approach encompasses sophisticated data aggregation, contextual intelligence, advanced AI capabilities and unique data security paradigms, enabling Fortune 500 teams to quickly, easily and securely deliver micro-personalized experiences that materially advance customer engagement. For more information, visit www.flybits.com and follow us at @flybitsinc."
Factual,https://www.crunchbase.com/organization/factual,"Analytics, Digital Marketing, Geospatial, Internet, Location Based Services, Mobile, Mobile Advertising","Factual is the location data company the world’s most valuable brands and tech companies trust to understand and intelligently grow their businesses. Factual provides product and engineering teams, marketers and data analysts access to the world’s most trusted, accurate and comprehensive data on places and people worldwide, transforming products, advertising and businesses with data that puts everything in context."
Firefly,https://www.crunchbase.com/organization/firefly-3919,"Advertising Platforms, Information Technology, Smart Cities","Firefly is building the first mobility based Smart Screens - Smart Cities advertising and data platform that utilizes the ride share and gig economy for distribution and scale. Firefly's unique location-based, “situationally aware” software and 1st party data enable the most granular, audience-based targeting of any away from home medium on any screen type. Through the digital signages installed atop hundreds of taxis, Firefly is sending targeted ads via 4G and 4G LTE cellular transmission. Firefly was founded in 2017 and is based in San Francisco, California."
Freightos,https://www.crunchbase.com/organization/freightos,"B2B, Logistics, Shipping, Supply Chain Management, Transportation","Freightos® makes global trade frictionless with the world’s online marketplace for the trillion-dollar international shipping industry. The Freightos Marketplace helps importers and exporters reduce logistics spend and save time with an instant comparison, booking, and management of air, ocean, and land shipments from top logistics providers. The result is international shipping that’s as smooth as booking a flight online. Freightos also provides patent-pending technology that empowers carriers and logistics providers around the world to automate freight sales. Freightos AcceleRate™ and Freightos WebCargo™ power rate management, automated pricing, and online freight sales for over 1,000 logistics service providers and carriers, including multi-billion dollar companies like Panalpina and Nippon Express. Freightos has accumulated the world’s largest global database of multimodal freight rates, providing industry transparency with the Freightos International Freight Index. Founded by serial entrepreneur Zvi Schreiber, Freightos is a logistics technology pioneer with a worldwide presence and has raised $50 million from leading venture funds, including GE Ventures."
FourKites,https://www.crunchbase.com/organization/fourkites,"Enterprise Software, Logistics, Supply Chain Management","FourKites is the real-time supply chain visibility platform that Fortune 500 companies and 3PLs trust to track shipment location and temperature and proactively manage exceptions. Using a proprietary predictive algorithm to calculate shipment arrival times, FourKites enables customers to lower their operating costs, improve on-time performance, and strengthen their end-customer relationships. Using FourKites, blue-chip shippers and 3PLs share the same, real-time shipping location and status information from more than four million GPS/ELD devices.  FourKites tracks and consolidates data across modes – including ocean, rail, parcel, and over-the-road, with both truckload and less-than-truckload – into a unified platform built for global enterprise companies. The platform is optimized for mobile and equipped with market-leading end-to-end security. To learn more, visit www.fourkites.com. FourKites was founded by Mathew Elenjickal in 2014."
Freenome,https://www.crunchbase.com/organization/freenome,"Biotechnology, Health Care, Health Diagnostics, Personal Health","Freenome is a health technology company developing accurate, accessible and non-invasive disease screening products for proactively treating cancer and other diseases at their most manageable stages. Freenome aims to reinvent disease management through systematized early detection and intervention. Since launching in 2014, the company has raised more than $70 million from leading technology and healthcare investors."
Fair,https://www.crunchbase.com/organization/fair,"Automotive, Financial Services, FinTech","Fair is a car leasing company that aims to grant access to mobility to everyone by pioneering the car-as-a-service (CaaS) concept. It gives customers the freedom to drive the car they want for as long as they want, and the flexibility to walk away at any time. Fair is headquartered in Santa Monica, California."
Faircent,https://www.crunchbase.com/organization/faircent,"Banking, Financial Services, Lending","Faircent helps in eliminating the high margins which intermediaries like banks and financial institutions make on our transactions. Banks have massive overheads, with thousands of employees to pay and hundreds of branches to maintain. Banks must take large margins on the money that passes through them. Whereas at Faircent.com people who have spare money lend it directly to people who want to borrow. There are no banks in the middle, no huge overheads"
ForgeRock,https://www.crunchbase.com/organization/forgerock,"Cyber Security, Enterprise Software, Identity Management, Information Technology, Internet of Things, Privacy","ForgeRock® is the digital identity management company transforming the way organizations interact securely with customers, employees, devices, and things. Organizations adopt the ForgeRock Identity Platform™ as their digital identity system of record to monetize customer relationships, address stringent regulations for privacy and consent (GDPR, HIPAA, FCC privacy, etc.), and leverage the internet of things. ForgeRock serves hundreds of brands, including Morningstar, Vodafone, GEICO, Toyota, TomTom, and Pearson, as well as governments like Norway, Canada, and Belgium, securing billions of identities worldwide. ForgeRock has offices across Europe, the USA, and Asia. Visit www.forgerock.com for free downloads and follow us on Twitter @forgerock."
Forty Seven,https://www.crunchbase.com/organization/forty-seven,"Biotechnology, Clinical Trials, Health Care","Forty Seven, Inc. is a clinical-stage immuno-oncology company that is developing therapies targeting cancer immune evasion pathways based on technology licensed from Stanford University. Forty Seven's lead program, 5F9, is a monoclonal antibody against the CD47 receptor, a ""don't eat me"" signal that cancer cells commandeer to avoid being ingested by macrophages. This antibody is currently being evaluated in six clinical studies in patients with solid tumors, acute myeloid leukemia, non-Hodgkin's lymphoma and colorectal carcinoma."
fuboTV,https://www.crunchbase.com/organization/fubotv,"Digital Entertainment, Sports, Subscription Service","fuboTV is a linear OTT subscription service dedicated to premium live sports that bundles cable networks, club channels, TV series, documentaries & news creating a single platform for sports fans. Founded in 2014, the company is headquartered in New York, New York, United States."
Fungible,https://www.crunchbase.com/organization/fungible-inc,"Computer, Data Center, Hardware","Fungible creates hardware and software platforms for data centers. The company's mission is a chip responsible for data movement. This chip is low latency, high throughput, and highly programmable. Its founders have a track record leading and impacting the networking, silicon and software industries. The company is based in Santa Clara, California and was founded on 2015."
Fiverr.com,https://www.crunchbase.com/organization/fiverr,"Collaborative Consumption, Outsourcing, Task Management","Fiverr is a freelance services platform. It is a marketplace for creative and professional services, currently listing over 3 million gigs in more than 100 different categories across 196 countries.  Fiverr is one of the top 400 websites in the world according to Alexa.com. It was founded in 2010."
Fulcrum Therapeutics,https://www.crunchbase.com/organization/fulcrum-therapeutics,"Biotechnology, Genetics, Health Care, Therapeutics","Fulcrum Therapectics to develop new medicines to deliver a new future for patients and their families by transforming gene regulation in disease. Above all we are champions for our patients.  Trust, Respect, Compassion and Integrity define who we are."
