Organization Name,Organization Name URL,Categories,Full Description
EyeLights,https://www.crunchbase.com/organization/eyelights,"Electronics, Information Services, Information Technology","EyeLights is a Head Up Display GPS. It allows motobikers to truly experience the ride by keeping their eyes on the road. Eyelights is the first universal motorcycle accessory that projects guidance, danger zones and traffic directly into your field of vision. A dangerous bend, a nearby stopper or speed over limitations, EyeLights warns you. Simple, uncluttered, they adapted the display for motorcycle riding. The EyeLights product installs in less than 5 minutes on your full-face, convertible or jet helmet. Their compact optical technology allows you to view your GPS more than 2 meters away while enjoying audio functions for more than 8 hours. The product is compatible with sun visors, insensitive to rain or fog and weighs less than 100g."
ENYO Pharma,https://www.crunchbase.com/organization/enyo-pharma,"Biopharma, Biotechnology, Medical","ENYO Pharma is a biopharmaceutical company incorporated in Jan, 2014, by four scientists of the Infectiology Research Center in Lyon, France, and three seeding partners (2 privates and 1 public). The company is based in the Infectiology Center of Lyonbiopôle in Lyon, France and maintains tight collaborations with the seminal Inserm team and the BSL4 laboratory Inserm-Jean Mérieux. ENYO Pharma has licensed several Inserm patents issued from the discoveries of the founding scientists and developed a unique platform for the identification of intracellular therapeutic targets and molecules. The company is developing treatments against the most important viruses and is thriving to become a global leader in anti-virals. Research and Development is currently focused on human infecting viruses, with the first two programs being dedicated to the treatment of severe and seasonal flu and chronic hepatitis B. The company plans to conduct its molecules to Phase II clinical trials."
Edge Therapeutics,https://www.crunchbase.com/organization/edge-therapeutics,"Biotechnology, Health Care, Medical","Edge Therapeutics, Inc. is a clinical-stage biotechnology company that discovers, develops and seeks to commercialize novel, hospital-based therapies capable of transforming treatment paradigms in the management of acute, life-threatening neurological conditions. EG-1962, our lead product candidate, has the potential to fundamentally improve patient outcomes and transform the management of aneurysmal subarachnoid hemorrhage, or aSAH, which is bleeding around the brain due to a ruptured brain aneurysm. EG-1964, our second product candidate, is being evaluated as a potential prophylactic treatment in the management of chronic subdural hematoma, to prevent recurrent bleeding on the surface of the brain. EG-1962 and EG-1964 both utilize Edge’s proprietary, programmable, biodegradable polymer-based development platform, known as Precisa™. The Precisa platform allows Edge to create therapeutics capable of delivering medicines directly to the site of injury, providing a novel delivery mechanism that enables targeted and sustained drug exposure while potentially avoiding the systemic, dose-limiting side effects often associated with current standards of care."
Epignosis eLearning solutions,https://www.crunchbase.com/organization/epignosis,"E-Learning, Education, Enterprise Software, Information Technology, SaaS, Software","Epignosis is a learning technologies vendor. Our mission is to democratize learning by making premium eLearning technology accessible and affordable. The company develops a suite of products that support learning and talent development for organizations and enterprises. Our products include eFront, a robust LMS platform for enterprises, TalentLMS, a zero-overhead cloud LMS and TalentCards, a mobile-app for microlearning and micro-certifications within modern organizations. At Epignosis, we iterate on ideas that produce tools which people actively use. We strive to balance usability, simplicity and fit-to-purpose solutions, paired with robustness and strong potential. We believe that great companies are built on empathy, integrity, diversity & simplicity."
Everex One,https://www.crunchbase.com/organization/everex-one,"Blockchain, Financial Services, Information Technology","Everex is a microfinance platform based on fiat pegged stable coin on Ethereum blockchain with decentralized federated network of cash custodians. They offer cross-border microlending, remittances, merchant payments, and currency exchange services to 2B of underserved global population. Their services will help building credit histories for individuals using blockchain technology and smart data."
Enterprise Therapeutics,https://www.crunchbase.com/organization/enterprise-therapeutics,"Health Care, Health Diagnostics, Therapeutics","Enterprise Therapeutics is a drug discovery company dedicated to the research and development of novel therapies for the treatment of respiratory diseases. In diseases such as cystic fibrosis, asthma and COPD the lungs become congested with mucus leading to difficulty in breathing. New disease modifying therapies that target the underlying mechanisms of mucus congestion will reduce the frequency of lung infections and improve patient quality of life."
Emmersion Learning,https://www.crunchbase.com/organization/emmersion-learning,"E-Learning, Education",Emmersion Learning is dedicated to elevating the productivity and success of individuals and businesses by enhancing their ability to communicate with the world.  They believe immersion is key to language acquisition and current language learning models fail to solve this problem at scale.  They leverage cutting-edge technology to give their customers access to certified native language coaches and top of the line learning products at a competitive price. They are obsessed with creating a company culture that brings out the very best of their team. They care about and invest in their employees’ total well-being. They believe finding balance is key to happiness and success. 
EventsCase,https://www.crunchbase.com/organization/pickevent,"Event Management, Event Promotion, Events","EventsCase is an all-in-one event management software. Every bit of kit an event organiser needs under a single platform including event websites, registration, ticketing, payment, event apps, networking tools, 1-2-1, awards solution, communities, emailing, advanced analytics, logistics and much more. EventsCase unique selling point is not only our product uniqueness, but also how the software can be delivered and how easy-to-use is. The software's major selling points are its Content Management System (CMS) and data integration capabilities. It is an all-inclusive event management platform that lets event managers and professionals take charge of the different stages of the event lifecycle through one single solution. Main products:  - Event websites  - Corporate website for Event Organisers fully sync with event websites - Event apps for attendees and for organisers (onsite check-in) - Event registration software  - Event community software  - 1-2-1 Meeting scheduler & agenda builder - Onsite registration - Gamification"
Energy Curb,https://www.crunchbase.com/organization/energy-curb,"Energy, Energy Efficiency, Energy Management, Internet of Things, Smart Home","Power your home, smarter. Isn't it time to power your life smarter? Curb makes it possible to take control of your home's electricity use. With a single product, find out what appliances and devices are driving your energy bills up. Get recommendations to help you be more efficient and use Curb's smart controls to ensure your home is safe, secure, and comfortable. Save Money: Curb help you track down the major energy hogs and identify ways to reduce your electricity bill. Home Insights: See everything that is happening in your home at any time, all from the palm of your hand. Worry Free: Curb constantly monitors your home’s energy use and will alert you if anything unexpected happens. Curb’s vision is to fundamentally re-shape how individuals interact with energy. Curb has already built a partnership with Samsung and is currently solidifying channel partnerships in both the commercial and residential markets."
ePaisa - enabling commerce,https://www.crunchbase.com/organization/epaisa,"Android, Developer Tools, FinTech, iOS, Mobile, Mobile Payments, Point of Sale","ePaisa is an AI based Point of Sale (POS) which provides tools to businesses of all sizes to help run and grow from Entrepreneur to Enterprise.  Our tools help solve pain points of our merchants and help organize their day to day business effectively and efficiently. ePaisa iOS and Android app enable businesses to take care of their billing, manage inventory, accept all forms of payments (cards, wallets, cash, Bitcoins), reach out to customers and earn more to grow their business.  Thousands of retailers, QSRs, exhibitors, high street stores and home delivery companies across India are currently advancing their business using ePaisa. Founded in 2012, with offices across India, ePaisa is driven by commerce enablement and is working to liberate commerce – levelling the playing field for merchants of all sizes."
Ecoppia,https://www.crunchbase.com/organization/ecoppia,"Environmental Engineering, Renewable Energy, Robotics, Solar","Founded in 2013, Ecoppia is a world leader and the only bankable provider of an autonomous, water-free PV-panel cleaning technology for utility-scale solar installations.Working with the largest energy companies worldwide, such as NTPC, Adani Power, SunEdison/TerraForm, EDF, ENGIE Group and others, the highly-effective Ecoppia robotic system is deployed over more than 300MW in solar sites both in India and the Middle East. Ecoppia’s pragmatic, cost effective and efficient end-to-end cleaning solution is enabled by a unique water-free robotic cleaning process, offering an attractive alternative to the traditional water and labor intensive techniques –  manual or vehicle-based cleaning. By dramatically lowering operational overhead, and while enabling a marked rise in the energy output, Ecoppia demonstrates an excellent return on investment (ROI) rates in as little as 18 months’ time span, offering a significant value creation through the solar project life cycle."
Edison Pharmaceuticals,https://www.crunchbase.com/organization/edison-pharmaceuticals,"Biotechnology, Health Care, Medical","Edison is a world leader in the discovery and development of redox drugs. The company has obtained orphan designation in both the United States and Europe for its first drug candidate, EPI-743 . Vincerinone is now in phase 2 clinical development. It is being evaluated in multiple clinical indications where defects in the mitochondrial proteins and redox control have been well characterized."
Equinox,https://www.crunchbase.com/organization/equinox,"Medical, Medical Device",
Ellevate Network,https://www.crunchbase.com/organization/ellevate-network,"Association, Business Development, Communities, Education, Training, Women's","Ellevate Network is a global network of professional women who are committed to elevating each other through education, inspiration, and opportunity. Our mission is to close the gender achievement gap in business by providing women with a community to lean on and learn from. Together we #InvestInWomen. "
ETFLogic,https://www.crunchbase.com/organization/etf-logic,"Analytics, Artificial Intelligence, Data Visualization, Information Technology, Software","ETFLogic is a FinTech platform that delivers data analytics, signals and insights focused on ETFs and their underlying assets. Participants are empowered with cutting edge tools to make better trading, pricing and hedging decisions."
EMPEQ,https://www.crunchbase.com/organization/empeq,"Energy, Renewable Energy, Software",Empower Visibilitysm is the engine that drives the UnFinancingsm program. Their first-in-class energy efficiency and CHP financial evaluation and finance platform was developed by the EMPEQ management team as software to bring clarity to the economic feasibility of commercial and industrial energy efficiency projects in a fraction of the time offered by other solutions.
Eton Pharmaceuticals,https://www.crunchbase.com/organization/eton-pharmaceuticals,"Biopharma, Biotechnology, Health Care, Pharmaceutical","Eton Pharmaceuticals, Inc. is focused on the development and commercialization of innovative sterile injectable product candidates utilizing the FDA 505(b)(2) regulatory pathway.  The company's current portfolio consists of two proprietary product candidates: (1) a patent-pending gelatin-free and preservative free 39 amino acid peptide synthetic corticotropin, an adrenocorticotropic hormone (ACTH) analogue, as a potential competitor to H.P. Acthar® gel; and (2) a patent-pending injectable pentoxifylline formulation, as a potential treatment for Peyronie's disease and an alternative or supplementary therapy to Xiaflex®.  Eton has signed agreements to acquire two additional sterile injectable product candidates that it plans to qualify under the Drug Efficacy Study Implementation (DESI) program, and commercialize through the 505(b)(2) regulatory pathway."
Emergent BioSolutions,https://www.crunchbase.com/organization/emergent-biosolutions,"Biotechnology, Health Care, Pharmaceutical","As a global specialty pharmaceutical company, Emergent offers specialized products to healthcare providers and governments to address medical needs and emerging health threats."
Elefant,https://www.crunchbase.com/organization/elefant,"Financial Services, Information Technology, Venture Capital",Provider of a electronic liquidity to serve fixed income investors. The company focuses on trading odd lots in bonds.
evonetix,https://www.crunchbase.com/organization/evonetix,"Biopharma, Biotechnology, Life Science",We are a new spin-out company that is currently incubating in the centre of the world-renowned Cambridge cluster of high-tech and life science organisations. We are seeking to develop and commercialise a new approach to the synthesis of DNA to facilitate the fast-emerging and exciting field of synthetic biology.  By employing novel techniques we are able to advance DNA synthesis to levels never before seen. Our engineering team has decades of experience developing high integrity automated systems. Our high calibre team brings together expertise from across the scientific and engineering disciplines.
E-LeatherGroup,https://www.crunchbase.com/organization/e-leathergroup,"Automotive, Public Transportation, Textiles","E-Leather is a revolutionary product that is designed and manufactured to provide an advanced upholstery and cladding material, superior to any other alternative. Using a patented, eco-friendly process, we combine leather fibre and a high performance core to produce a composition leather that is reliable, consistent and can be customised to your requirements. E-Leather is engineered to provide unique materials that can meet specific performance criteria, suitable for a range of industries including aviation, bus, coach, rail, marine, domestic upholstery and contract upholstery."
edly,https://www.crunchbase.com/organization/edly,"Education, Internet, Messaging","edly is an online marketplace connecting schools and accredited investors to fund Income Share Agreements (""ISAs""). ISAs are an innovative solution to the student debt problem. Instead of borrowing to pay tuition, students pledge a fixed share of their future earnings but only if they have the ability to pay."
Ethereal Machines,https://www.crunchbase.com/organization/ethereal-machines,Manufacturing,"Ethereal Machines breathes by the mission of churning out entrepreneurs in the engineering world. Their machines are built to invigorate, nurture and embolden an engineer while unbridling the designer’s freedom to create. Ethereal Machines brings about a conjunction between additive and subtractive manufacturing techniques."
Embodied Labs,https://www.crunchbase.com/organization/embodied-labs,"Corporate Training, Elder Care, Health Care, Home Health Care, Nursing and Residential Care, Training, Virtual Reality, Wellness","Embodied Labs is an immersive training platform that improves outcomes in training, awareness, and family and caregiver support. The company's goal is to activate transformational cultural change in long term care, home health, government, non-profit, and academic organizations by changing the way professional and family caregivers view and care for older adults. Embodied Labs, winner of the 2018 Bill and Melinda Gates Foundation Global XR in Education Prize Challenge, delivers cutting-edge senior care training solutions. Practical and user-friendly, the Embodied Labs platform immerses healthcare professionals in curriculum that simultaneously builds skills and empathy to help care workers excel and be confident in working. With a robust data analytics backend, the Embodied Labs platform tracks each care-giver's training to provide feedback on performance and a pathway to improvement. Embodied Labs was founded on 2016 and is headquartered in Los Angeles, California."
Emagispace,https://www.crunchbase.com/organization/emagispace,"Building Material, Construction, Interior Design","Emagispace® Inc. is an interior construction and design innovator that has developed a sustainable building block technology to reimagine what’s possible for the construction of interior space. The EmagiBlock® platform was conceptualized around the idea that building elegant, versatile interior space doesn’t have to come with a hefty price tag, long lead times, difficult storage, or materials that end up in a landfill. Emagispace® is disrupting an industry that hasn’t seen change in hundreds of years, turning the conversation about building and construction upside down. Simple, elegant, and why-didn’t-I-think-of-that?, Emagispace® transforms the way the world thinks about interior spaces: office, retail, convention, performance, display, and residential."
Emotient,https://www.crunchbase.com/organization/emotient,"Artificial Intelligence, Machine Learning, Software, Video","Emotient is the leading authority on automated facial expression recognition and analysis, designed to enable emotionally aware technologies that are redefining the future of personal computing. Our technology began in the academic world as the Machine Perception Lab at University of California, San Diego. Our founders are widely regarded as spearheading the use of machine learning for facial expression analysis, a new category of natural user interface that is rapidly expanding as more companies seek to improve technology responsiveness and increase customer engagement. Our proprietary methodology sets the industry standard for accuracy and real-time delivery of facial expression data and analysis."
Exabel,https://www.crunchbase.com/organization/exabel,"Analytics, Artificial Intelligence, Cloud Computing, Finance, FinTech, Machine Learning, SaaS","Exabel's mission is to make state-of-the-art AI technology accessible to investors worldwide. From our offices in Oslo, we are developing Exabel Intelligent Monitoring, a fully automatic monitoring tool for finance professionals. We combine sophisticated mathematical models and machine learning to extract insights by cross-analyzing both traditional and alternative data sources. We are an experienced team of engineers and successful entrepreneurs. Our people bring with them the best of various disciplines, including mathematics, data science and business development."
English Helper,https://www.crunchbase.com/organization/english-helper,"Education, Higher Education, Information Technology, Software, Training","EnglishHelper Technologies Pvt. Ltd was established in 2009 and is a wholly owned subsidiary of the Boston-based EnglishHelper Inc. We offer unique technology solutions to improve English language proficiency.  English is increasingly the language of choice in todayâ€™s social and business environments. English speaking and comprehension skills can help fulfill the aspirations of millions of people.  EHâ€™s new age technology solutions aim to make the English language comprehensible and easy. They take the pain out of learning English.  EnglishHelperâ„¢ is seeking to make a difference by helping people become English literate as relevant to their context. We are committed to promoting technology enabled learning, in an affordable way, to large numbers of people across a range of user groups.  EnglishHelperâ„¢ solutions are today used by schools, higher education students, skill building organisations, companies, and individuals from all walks of life."
eTherapeutics,https://www.crunchbase.com/organization/etherapeutics,"Biotechnology, Health Care, Medical",e-Therapeutics plc is a drug discovery and development company. It has developed proprietary computational systems to swiftly and accurately analyse and predict how medicines interact with cells in the body in hopes of optimizing the probability of identifying drug candidates with desirable efficacy and minimal side effects.
Eyenovia,https://www.crunchbase.com/organization/eyenovia,"Biotechnology, Manufacturing, Pharmaceutical","Eyenovia is a clinical stage, ophthalmic biopharmaceutical company transforming the delivery of therapeutics for the treatment of prominent eye diseases, such as glaucoma, dry eyes, allergic eye disease and many others. Eyenovia’s breakthrough piezo-dispersion and microdosing technology enable a portfolio of first-in-class, next-generation, micro-therapeutics for the eye designed to reduce ocular and systemic toxicity and improve the risk-benefit profile of both new and existing therapeutics."
Elemental Path,https://www.crunchbase.com/organization/elemental-path,"Artificial Intelligence, Consumer Electronics, Education","Elemental Path is driven to improve the way kids learn by improving the way they play. We are enabling them to have more interactive and engaging play experiences that are rooted in educational content. Elemental Path are the creators of CogniToys, the worlds first internet connected smartoys, that are actually smart. We are creating a new gateway for kids to fun, interactive learning that brings playful personalities to their toys. Elemental Path / CogniToys collapsed in 2018."
eLichens,https://www.crunchbase.com/organization/elichens,"Electronics, Information Services, Information Technology, Sensor","eLichens is a technology startup that provides services and sensing solutions for the hyper-local air quality industry. The company helps its customers detect, monitor, coach, and predict air quality for indoor and outdoor applications and services. eLichens was incorporated in 2014 and is based in Grenoble, France."
Energyworx,https://www.crunchbase.com/organization/energyworx,"Energy, Information Technology, SaaS","Energyworx is a software company. It designs and develops software solutions. The Company offers a SaaS-based platform for energy data management and intelligence cloud service disrupting the global energy and utilities market. They help uncover the hidden the value of data by correlating and analyzing the data with a diversity of other data sources. This helps its users to balance and optimize the grid; and reduce losses during transmission and distribution. The company enables organizations to make business decisions with real time data insights. They fuel best of breed products and services in the energy industry. The platform offers other services such as meter data management, social energy app, energy balancing for smart grids, and data hub. Energyworx was founded by Edwin Poot in 2012 and is headquartered in Houten, Utrecht."
Elcelyx Therapeutics,https://www.crunchbase.com/organization/elcelyx-therapeutics,"Biotechnology, Health Care, Health Diagnostics","Elcelyx was founded in 2010 with venture capital backing based on Gut Sensory Modulation (GSM) technology. Elcelyx’s proprietary, first-in-class Gut Sensory Modulators are delivered directly to the lower gut where they act on molecular targets to elicit physiological and pharmacological effects.  The Elcelyx proprietary product candidate, NewMet for Type 2 diabetes is entering Phase 2b development and is a blockbuster opportunity designed to address the unmet needs in the oral anti-diabetic market. Elcelyx is led by an experienced management team and Board of Directors with track records of success in drug development and commercialization. Premier investors along with seasoned scientists and clinicians support the team.  In September 2013, Elcelyx announced the formation of NaZura BioHealth Inc, a separate company established to focus on the development on non-NewMet assets. Elcelyx is headquartered in San Diego, California."
effect.ai,https://www.crunchbase.com/organization/effect-ai,"Artificial Intelligence, Blockchain, Information Technology","Effect.AI is an Amsterdam-based project that is working on a decentralized network for Artificial Intelligence and AI related services on the NEO blockchain. Effect.AI's main objective is to build a platform that will stimulate AI development and the creation of various AI services. The platform will be more democratic, accessible and easy to use than what is currently available.  "
EO Charging,https://www.crunchbase.com/organization/eo-charging,"Electrical Distribution, Manufacturing, Product Design",
