Organization Name,Organization Name URL,Categories,Full Description
Ericsson,https://www.crunchbase.com/organization/ericsson,"Information Technology, Internet, Mobile, Telecommunications","Ericsson is the world's leading provider of technology and services to telecom operators. Ericsson is the leader in 2G, 3G and 4G mobile technologies, and provides support for networks with over 2 billion subscribers and has the leading position in managed services.  The company's portfolio comprises mobile and fixed network infrastructure, telecom services, software, broadband and multimedia solutions for operators, enterprises and the media industry.  The Sony Ericsson and ST-Ericsson joint ventures provide consumers with feature-rich personal mobile devices.  Ericsson is advancing its vision of being the ""prime driver in an all-communicating world"" through innovation, technology, and sustainable business solutions.  Working in 175 countries, more than 80,000 employees generated revenue of SEK 206.5 billion (USD 27.1 billion) in 2009.  Founded in 1876 with the headquarters in Stockholm, Sweden, Ericsson is listed on OMX NASDAQ, Stockholm and NASDAQ New York."
Etsy,https://www.crunchbase.com/organization/etsy,"E-Commerce, Marketplace, Sales","Etsy is an e-commerce site and a smartphone application for buying and selling handmade and vintage items. Users can find products in the categories of clothing and accessories, jewelry, craft supplies and tools, weddings, entertainment, home and living, kids and babies, vintage, and more.  Etsy was launched by Robert Kalin, Haim Schoppik, Jared Tarbell, and Chris Maguire in June 2005 and is based in Brooklyn, New York."
Envoy,https://www.crunchbase.com/organization/envoy,"Facility Management, Human Resources, Office Administration, SaaS, Security, Software","Envoy focuses on details, crafts beautiful and modern software that elevates the workplace experience. Companies like Slack, Pinterest, Spotify, Nike, and American Express have worked with Envoy to welcome over 30 million visitors to more than 10,000 locations around the world. We are proudly backed by Andreessen Horowitz, Menlo Ventures, Initialized Capital, and many others. The company's mission is to challenge the status quo of workplace technology. This idea started at the front desk, where we set a new standard for visitor sign-in."
Edge,https://www.crunchbase.com/organization/edgesecure,"Apps, Cloud Security, Mobile, Mobile Apps, Security","Edge is an SDK platform that enables its users to develop security applications for its clients. Their product range includes client-side encryption, data backup, password recovery, blockchain technology, private key authentication, IoT, financial applications, bitcoin, and private messaging. Edge (formerly Airbitz) was founded in 2014 and is based in California."
eToro,https://www.crunchbase.com/organization/etoro,"Finance, Financial Services, FinTech, Trading Platform","eToro is a social trading investment network that enables users to watch the financial trading activities of other users, copy them, and make their own trades. The company’s product, OpenBook and WebTrader, allows traders to learn from each other, share live trading information, and capitalize on their collective power. Launched in 2007, the company has registered offices in Cyprus, Israel, and the United Kingdom."
European Commission,https://www.crunchbase.com/organization/european-commission,Government,"European Regional Development Fund encourages innovation, enhances regeneration, and provides support to businesses in the European Union. "
eXo Imaging,https://www.crunchbase.com/organization/exo-systems,"Health Care, Medical","Exo is pioneering a high-performance handheld ultrasound platform and AI for imaging and therapeutic applications. Exo is committed to delivering affordable and easy-to-use medical imaging to healthcare professionals around the world. By delivering easy-to-use, high quality medical imaging, Exo will empower healthcare professionals to make critical, real-time decisions that improve patient outcomes."
eMarketer,https://www.crunchbase.com/organization/emarketer,"Advertising, Business Intelligence, E-Commerce, Market Research, Mobile, Social Media"," eMarketer is the first place to look for research about marketing in a digital world.  eMarketer enables thousands of companies worldwide to understand marketing trends, consumer behavior and get the data needed to succeed in the competitive and fast-changing digital economy.  eMarketer’s flagship product, eMarketer PRO, is home to all of eMarketer’s research, including forecasts, analyst reports, aggregated data from 3,000+ sources, interviews with industry leaders, articles, charts and comparative market data. eMarketer’s free daily newsletters span the US, EMEA and APAC and are read by more than 200,000 readers globally.  In 2016 eMarketer, Inc. was acquired by European media giant Axel Springer S.E."
Endgame,https://www.crunchbase.com/organization/endgame-inc,"Analytics, Computer, Enterprise Software, Network Security, Security","Endgame is a leading endpoint security platform that transforms security operations teams and incident responders from crime scene investigators into hunters that prevent damage and loss, and dramatically reduces the time and cost associated with incident response and compromise assessment. Endgame’s platform uses machine learning and data science to prevent and detect unique attacks at the earliest and every stage of the attack lifecycle. Endgame’s integrated response stops attacks without disrupting normal business operations. For more information, visit www.endgame.com and follow us on Twitter @EndgameInc."
Eventbrite,https://www.crunchbase.com/organization/eventbrite,"Association, Event Management, Events, Internet, SaaS, Ticketing","Eventbrite develops an online platform that lets users find and create events. Its platform helps them plan events, such as event academy, classes and workshops, conferences, endurance, food and drink, music, nonprofits and fundraisers, performing and visual arts, politics, and reunions.  Eventbrite's platform also lets users sell tickets, register online, post events, manage events online, event management, register event for free online, and search San Francisco events. Moreover, the company offers mobile application opportunity.  Eventbrite serves customers worldwide. Renaud Visage and Julia and Kevin Hartz founded Eventbrite in 2006, with its headquarters in San Francisco in California."
Exiger,https://www.crunchbase.com/organization/exiger,"Consulting, Government, Information Technology, Legal, Management Consulting, Risk Management","Exiger is a global regulatory and financial crime, risk and compliance company.  Exiger arms financial institutions, multinational corporations and governmental agencies with the practical advice and technology solutions they need to prevent compliance breaches, respond to risk, remediate major issues and monitor ongoing business activities.  Exiger works with clients worldwide to assist them in effectively managing their critical challenges while developing and implementing the policies, procedures and programs needed to create a sustainable compliance environment.  A global authority on regulatory compliance, the company also oversees some of the world's most complex court-appointed and voluntary monitorships in the private and public sectors, including the monitorship of HSBC.  Exiger has four principal business units being:  Exiger Advisory; Exiger Analytics; Exiger Diligence and Exiger Insight 3PM.  Exiger operates through offices in New York City, Silver Spring (DC Metro), London, Hong Kong, Toronto and Singapore."
ezCater,https://www.crunchbase.com/organization/ezcater,"Hospitality, Marketplace, Restaurants","ezCater is a nationwide marketplace for business catering. ezCater’s online ordering, on-time ratings and reviews, and 5-star customer service connect businesspeople to reliable catering for any meeting, anywhere in the United States. "
EARTH AI,https://www.crunchbase.com/organization/earth-ai,"Analytics, Artificial Intelligence, Information Technology, Software","EARTH AI is the world’s most efficient mineral explorer, finding new deposits of metals worth $10-100M, 12X faster and 35X cheaper than the competition, through AI mineral targeting system (field-proven to be 50x more successful at finding mineralized prospects), and 5X cheaper field operations achieved through hardware automation and streamlined in house operations."
Epic Games,https://www.crunchbase.com/organization/epic-games-2,"Developer Platform, Gaming, Video Games","Epic Games is an American video game development company that offers Unreal, Gears of War, and Infinity Blade series of games. At present, the company is working on its next games, Fortnite and Paragon. The company was founded in 1991 and is based in Cary, North Carolina."
Energy Vault,https://www.crunchbase.com/organization/energy-vault-sa,"Energy, Energy Management, Energy Storage, Renewable Energy",Energy Vault SA offers an energy storage technology utilizing fundamental principles of science to deliver a storage solution that's as compassionate to the planet as it is efficient to build and operate.  The Energy Vault solution utilizes the same fundamentals of physics and kinetic energy as pumped hydro but replaces the water with custom made cylindrical blocks utilizing an extremely innovative use of low-cost materials. The system is modular and can be designed with a capacity of between 10 and 35MWh and a power output of up to 5MW. The system has been designed for a 30+ year life with no degradation in storage capacity.
Exabeam,https://www.crunchbase.com/organization/exabeam,"Analytics, Big Data, Cyber Security, Enterprise Software, Information Technology, Real Time, Security","Exabeam is a big data security analytics company that provides enterprises with advanced user behavior intelligence to unlock the potential of existing security information and event management and log management data repositories, enabling IT security teams to more quickly detect and respond to cyberattacks and insider threats in real time. The company’s user behavior intelligence technology fundamentally changes the way cyberattacks are detected and simplifies security operations by focusing on attacker behavior rather than ever-changing malware and tools, shining a spotlight on suspicious network activity, and reducing the noise of false positive security alerts. Through extraction and enrichment of log feeds, user session tracking, behavior analysis, and event risk scoring, Exabeam gives IT security teams the ability to detect and track credential use in all parts of the attack chain and prioritize responses. The company was built by seasoned security and enterprise IT veterans from Splunk, Imperva, and Sumo Logic, and believes in working together as a team to achieve customer success. Exabeam was founded on 2013 and is headquartered in San Mateo, California."
Expa,https://www.crunchbase.com/organization/expa,"Finance, Internet, Mobile","Expa is a startup studio designed for entrepreneurs to create and launch new companies. Started in 2013 by Uber co-founder Garrett Camp, Expa is a team of experienced founders and entrepreneurs dedicated to identifying the next big idea and partnering with the future generation of leaders to build great companies. Our partners have founded or led some of the most valuable and well-known companies including Uber, Twitter, LinkedIn, FourSquare, StumbleUpon, AddThis, MetroLyrics, and Envoy.  Expa has raised $150 million from a number of investors including Expa Founder/CEO Garrett Camp and other LPs."
Elastifile,https://www.crunchbase.com/organization/elastifile,"Analytics, Big Data, Computer, Data Center","Elastifile is redefining the way data is stored and managed in the cloud and spanning hybrid clouds. Powered by an elastically scalable, enterprise-grade, distributed file system with integrated object tiering, Elastifile’s cross-cloud data fabric delivers high performance, unified access to global data. By freeing data from traditional storage silos, Elastifile enables frictionless movement of applications to the cloud, between clouds, and across hybrid environments. This allows enterprises to seamlessly leverage cloud infrastructure and services to enhance and accelerate a broad range of data-driven workflows, including: analytics, DevOps, high-performance computing, and many more."
Episerver,https://www.crunchbase.com/organization/episerver,"Computer, E-Commerce, Software","Episerver is the world’s fastest growing provider of Web Content Management (WCM), online social community and e-commerce platforms. Episerver is the platform of choice for more than 3,500 customers doing business online through engaging websites, communities and e-commerce solutions. It has become the foundation of more than 20,000 websites and is used on a daily basis by over 130,000 web editors.  The Episerver platform is delivered through an extensive network of over 500 partner companies in 30 countries. Episerver combines the stability and support of a commercial product with Episerver World, a thriving developer community of more than 14,000 developers  The company was founded in 1994 and has offices in the United States, Sweden, Denmark, Norway, Finland, The Netherlands, the Ukraine, the United Kingdom, Australia and South Africa."
Echo,https://www.crunchbase.com/organization/echo-8,"Medical, Personal Health, Pharmaceutical","At Echo, we believe health is about people not pills. That’s why we’ve created a new kind of pharmacy. One that comes to you, not the other way around.  We start with being brilliant at fulfilling prescriptions, because getting people taking the right medicine is the first step in staying well. But there’s more we can do.  It’s not just patients we support, its partners. Together with other like-minded pharmacies, GPs and prescribing services we deliver even more positive experiences.  Ultimately, we want to help patients understand and do more for themselves, so together they can make the right decisions with their GPs. And when it comes time to improve our health, we all know more Technology should make the future of health care more human. So ours comes packed with care."
Ezoic,https://www.crunchbase.com/organization/ezoic,"Artificial Intelligence, Information Services, Information Technology, SaaS, Test and Measurement, Web Development","The Ezoic system uses Machine Learning to help publishers make better decisions.  By effectively 'predicting' how a website visitor will respond to an automated & individualized change, Ezoic can boost user experience metrics and increase ad earnings. Ezoic optimizes over 400m visitor experiences each month (May 2017) and the system is offered as a Self-Serve ad-funded or subscription-based service, or as an Enterprise (SaaS) solution. Ezoic was Google's first North American Certified Partner for AdSense and is a Google Certified Publishing Partner; winning their Business Innovation Award in 2016."
eBrands.vc,https://www.crunchbase.com/organization/ebrands-vc,"Productivity Tools, Software, Venture Capital",
Equinix,https://www.crunchbase.com/organization/equinix,"Cloud Data Services, Data Center, Information Technology, Infrastructure, Internet","Equinix provides global data center services that ensure the vitality of the information-driven world. Global enterprises, content and financial companies, and nearly 600 network service providers rely upon Equinix's insight and expertise to protect and connect their most valued information assets.  At Equinix, they believe in the power of interconnection. The rise of digital business is inspiring innovative commerce and collaboration models and whole new ways of competing. Interconnection makes it all happen. It puts everything within reach. Equinix connects the world's leading businesses to their customers, employees and partners inside the world's most connected data centers in 52 markets across five continents. In the United States, Equinix operates data centers in Atlanta, Boston, Chicago, Dallas, Denver, Los Angeles, Miami, New York, Philadelphia, Seattle, Silicon Valley and Washington D.C."
Expanse,https://www.crunchbase.com/organization/expanse-inc,"Cyber Security, Information Technology, Security, Software","Expanse provides IT and security teams with visibility into their global internet attack surface, helping them discover unknown assets and reduce and manage their exposure to online threats. Expanse is trusted by some of the world’s largest enterprises and government agencies to monitor and track more than 400 million Internet- and cloud-connected assets comprising more than 10% of the global Internet. Using leading-edge collection and analysis technology, Expanse will improve any organization’s awareness and visibility to help prevent successful attacks.  Founded in 2012, Expanse is headquartered in San Francisco and is backed by more than $65M in funding from NEA, Founders Fund, IVP, TPG, and SUSA Ventures."
Evidation Health,https://www.crunchbase.com/organization/evidation-health,"Analytics, Big Data, Health Care","Evidation Health is a new kind of health and measurement company that provides the world’s most innovative life sciences and health care companies the technology and expertise they need to understand how everyday behavior and health interact. The volume of behavior data generated from smartphones and connected sensors — including wearables and medical devices — has opened up new ways to analyze individuals’ behavior and health in real time, unlocking insights into what medicines and treatments work best and spotting significant changes in health earlier. The scale and utility of everyday behavior data has the potential to be one of the most transformative forces in medicine, and Evidation Health is leading the way. Over the years, Evidation has built the largest, most diverse virtual pool of research participants through its proprietary and popular app, Achievement. With a direct and trusted relationship with more than 2 million individuals, its deep research expertise, and its data platform, Evidation Health can undertake real world research for life sciences and health care companies — and, ultimately, transform how health is measured and how diseases are identified, treated, and monitored. Founded in 2012, Evidation Health is headquartered in San Mateo, Calif., with additional offices in San Francisco and Santa Barbara, Calif. To learn more, visit evidation.com, or follow us on Twitter @evidation."
E2open,https://www.crunchbase.com/organization/e2open,"Enterprise Software, Real Time, SaaS","E2open is a leading provider of cloud-based, on-demand software solutions enabling enterprises to procure, manufacture, sell, and distribute products more efficiently through collaborative execution across global trading networks. Brand owners use E2open solutions to gain visibility into and control over their trading networks through the real-time information, integrated business processes, and advanced analytics that E2open provides. E2open customers include Celestica, Cisco, Dell, Hitachi, IBM, LSI, Motorola, RIM, Seagate, and Vodafone. E2open is headquartered in Foster City, California with operations worldwide."
Evernote,https://www.crunchbase.com/organization/evernote,"Information Services, Information Technology, iOS, Mobile, SaaS","Evernote builds apps and products that are defining the way individuals and teams work today. As one workspace that lives across people's phone, tablet and computer, Evernote is the place people write free from distraction, collect information, find what they need and present their ideas to the world. Whatever peole are working toward, Evernote’s job is to make sure they get there.  Evernote is an independent, privately held company headquartered in Redwood City, California. Founded in 2007, Evernote products reach more than 100 million users worldwide. With nearly 400 employees and growing, they are always looking for talented individuals to join their global team."
Equiem,https://www.crunchbase.com/organization/equiem,"Building Material, Commercial Real Estate, Property Management, Real Estate, Retail Technology","Equiem is one of Australia’s proptech success stories. Since launching in 2011, Equiem’s platform has been adopted by 10 of the 11 largest Australian property owners (REIT's). It has over 100,000 users, across Equiem’s portfolio of more than 100 Premium and A grade assets, comprising of approximately 4.1 million square metres (44.1 million square feet) of premium and A-grade office. Equiem's technology and staffing solutions help property owners/managers better connect with occupants, enhance customer service/experience and ultimately, make tenants “stickier” or less likely to exit when their lease expires."
ecobee,https://www.crunchbase.com/organization/ecobee,"Consumer Electronics, Energy Management, Internet of Things","Ecobee is a provider of Wi-Fi enabled smart thermostats for residential and commercial applications, delivering energy conservation solutions. The company offers ecobee Smart Thermostat, a digital programmable thermostat that helps in customizing temperature settings. The thermostat connects the clients to their WiFi, and gives them remote access to the thermostat settings from any computer and helps in energy conservation. Its products are used in single family homes, multi-family dwellings, and offices. The company accepts orders online.  The company was founded in 2007 and is based in Toronto, Canada."
EASME - EU Executive Agency for SMEs,https://www.crunchbase.com/organization/easme,"Financial Services, Government, Small and Medium Businesses","The Executive Agency for Small and Medium-sized Enterprises (EASME) has been set up by the European Commission to manage on its behalf several EU programs.   EASME is in charge of managing SME, environment, energy and maritime projects funded under COSME, Horizon 2020, LIFE, and EMFF.    EASME also organizes the European Sustainable Energy Week (EUSEW)."
enSilo,https://www.crunchbase.com/organization/ensilo,Cyber Security,"enSilo protects businesses around the world from data breaches and disruption caused by cyber attacks. The enSilo Endpoint Security Platform comprehensively secures endpoints in real-time pre- and post-infection without alert fatigue, excessive dwell time or breach anxiety while also containing incident response costs by orchestrating automated detection, prevention and incident response actions against advanced malware."
Euclid,https://www.crunchbase.com/organization/euclid,"Analytics, B2B, Big Data, Marketing, Retail, Smart Building, Software","Euclid connects the physical world by understanding how people relate to spaces and how spaces relate to each other. Using Wi-Fi signals in a privacy-safe way, Euclid’s proprietary technology delivers insights that inform more efficient, convenient and relevant experiences. Backed by leading venture capital firms Benchmark Capital and NEA, as well as Cox Enterprises and Groupe Arnault, Euclid was founded by Will Smith and is led by CEO Brent Franson."
ePaylater,https://www.crunchbase.com/organization/epaylater-in,"Customer Service, E-Commerce, Financial Services, FinTech, Internet, Online Portals, Payments, Software","ePaylater was founded in December 2015 by Aurko Bhattacharya, Prasannaa Murlidharan, Uday Somayajula, Shanmunathan Thiagaraja and Saxena. The company gives customers the option to ‘buy now and pay later’ on online portals with just one click. The customers get 14 days to make the payment and within that period they can make many more transactions via single-click checkouts and can bunch them all together to make a single payment at the end of the period."
E8 Storage,https://www.crunchbase.com/organization/e8-storage,"Cloud Computing, Enterprise Software, Flash Storage","E8 Storage provides the next generation of flash storage with a rack-scale architecture for the enterprise and software-defined cloud, delivering 10 times the performance for half the cost of existing storage products. E8 Storage’s appliance E8-D24 is the first array that provides an uncompromised trifecta by combining the high performance of NVMe drives, the high availability and reliability of centralized storage, and the high scalability of scale-out solutions. The company was founded in 2014 by storage industry veterans from IBM-XIV, Zivan Ori and Alex Friedman, who serve as CEO and VP R&D respectively. The company is venture-funded by Accel Partners, Magma Venture Capital and Vertex Israel, with R&D operations in Tel Aviv, Israel, and sales and marketing in Santa Clara, Calif."
EnjoyHQ,https://www.crunchbase.com/organization/nomnom-insights,"Product Management, Product Research, Software","EnjoyHQ helps product, design, and user research teams centralize customer feedback and research data in one place. Teams at companies like Adobe, Booking.com, and GrubHub use EnjoyHQ to get insights about their customers and improve their products and customer experiences. The platform allows teams to quantify qualitative data, build research projects, build reports and dashboards, and share insights easily across the entire organization."
