Organization Name,Organization Name URL,Categories,Full Description
Everseen,https://www.crunchbase.com/organization/everseen-2,"Analytics, Information Technology, Video","Everseen Limited provides point of sale video analytics solutions, for various point of sale machines,  including conveyor, express, and self service. It offers point of sale non-scanning detection solutions, including non-scanning, overcharging, irregular voiding and refund, and basket based loss. In addition, it offers a client portal that allows customers to access data, view identified incidents, and create bespoke reports. The company serves grocery, fashion, D.I.Y. retail stores, and department stores in Europe and Latin America. Everseen Limited was incorporated in 2007 and is headquartered in Cork, Ireland."
Eloquent Labs,https://www.crunchbase.com/organization/eloquent-labs,"Artificial Intelligence, Customer Service, E-Commerce","Eloquent Labs supplies artificial intelligence to augment and replace live chat customer support agents, specifically targeted at eCommerce companies. Based off of the founders' experience in the Stanford Natural Language Processing group, Eloquent Labs’ AI agent is able to hold natural and conversational dialogs with customers fully autonomously, while also knowing when to back off to experienced agents for complex tickets."
Eureeca,https://www.crunchbase.com/organization/eureeca,"Crowdfunding, Finance, Financial Services","Eureeca is the first and most regulated global online crowdinvesting (or Equity Crowdfunding) platform where businesses can source funding from the crowd in exchange for equity in their business.  Harnessing the power of the internet and social media, Eureeca’s platform connects Angel and Institutional investors to small & medium enterprises (SMEs) online to pool their funds and resources  - creating a game-changing alternative to traditional funding.  We operate across 3 continents and over 100 countries. We have pioneered cross border investing; building a digital solution to enable investors to build a portfolio of early growth stage investments from around the globe. From our offices in Dubai, London, Kuala Lumpur, and Amsterdam, Eureeca offers high-yield potential investment opportunities from the Middle East, Europe, and Southeast Asia to its investor network who range from casual and angel investors to institutional firms. Businesses raising funds can leverage this network for capital, strategic connections, and expansion into new markets. Eureeca was recently highly ranked in the MENA Forbes “Top 100 Startups 2017” and won “Innovator of the Year” by Forbes in 2017. Other accolades include “Innovator of the Year” at the 2014 Gulf Business Awards and “Most Innovative Online Platform” by Frost and Sullivan in 2015."
Enfuce Financial Services,https://www.crunchbase.com/organization/enfuce,Financial Services,"Enfuce is a new kind of financial service provider focusing on the future possibilities within payments – from a world without legacy. They are a service provider to both incumbent actors as well as newcomers within the payment and consumer finance industry. In short, they are a hub, both infrastructure and knowledge wise.  Their products and services are delivered “as a service”, that’s why they allow you as a company to focus on your core business instead of having to take on the burden of a heavy regulation and constant change. Their strength lies in Their vast knowledge of regulatory requirements, how to be fully compliant as well as being innovative, fast and agile. They want to become the company to partner with when you want to succeed within the payment landscape"
eStruxture Data Centers,https://www.crunchbase.com/organization/estruxture-data-centers,"Cloud Data Services, Cloud Management, Data Center","eStruxture provides network and cloud neutral data center solutions designed with the capacity, performance and flexibility to run modern, demanding enterprise applications, and the control to rapidly scale in response to unpredictable changes in business  processes.  eStruxture offers colocation, private cloud, managed services, interconnections, security and support services to customers."
Elevance Renewable Sciences,https://www.crunchbase.com/organization/elevance-renewable-sciences,"Chemical, CleanTech, Natural Resources","Elevance Renewable Sciences is a transforming natural, renewable oils into high-performing specialty products and materials, Elevance is uniquely positioned to meet consumer demand in a market exceeding $100 billion annually in these segments: Performance waxes, NatureWax products, Personal care products, Antimicrobials, Detergents, cleaners and solvents."
Engaging Care,https://www.crunchbase.com/organization/engaging-care,"Health Care, Lifestyle, Medical, Wellness","Engaging Care is focused on the development of treatment programs for chronic and lifestyle related diseases. Engaging Care offers an application that enables its users to find information about diseases and change their lifestyles according to new habits. Caregivers are able to access and keep track of their patients’ progress. Engaging Care was co-founded by Annica Belfrage and Charlotta Tönsgård in 2015. It is based in Malmo, Sweden."
Eonite Perception,https://www.crunchbase.com/organization/eonite-perception-inc,"3D Technology, Augmented Reality, Robotics, Virtual Reality","Eonite is on a mission to enable machines to understand the real world – to give computers the advanced perception necessary for the future of VR, AR, robots and drones. They are looking for people who will help us build, refine, and deliver the tech that achieves their goals. They offer competitive salaries, great equity packages, and full benefits. They are always looking for smart, talented people who are nice adults motivated to make a difference. They’re based in Palo Alto, but their team is global. So reach out, even if the openings aren’t a perfect fit.."
E-scape Bio,https://www.crunchbase.com/organization/e-scape-bio,"Biotechnology, Health Care, Medical","E-scape Bio is a Californian company involved in the healthcare industry. The company was founded in 2015 and is headquartered in San Francisco, California."
Elicio Therapeutics,https://www.crunchbase.com/organization/elicio-therapeutics,"Biotechnology, Therapeutics","Elicio, based in Cambridge MA, is committed to transforming the lives of patients and their families by re-engineering the body’s immune response to defeat cancer. By combining expertise in materials science and immunology, Elicio is engineering potent vaccines and immuno-therapies for an array of aggressive cancers. Elicio was founded to expand and apply the ground-breaking Amphiphile technology invented and developed by Darrell Irvine Ph.D., Professor of Biological Engineering and Materials Sciences and Howard Hughes Investigator, in the Koch Institute of Cancer Research at the Massachusetts Institute of Technology. Elicio’s lead Amphiphile vaccines targeting pancreatic, colorectal and head and neck cancers will begin initial patient studies in 2020. Elicio, based in Cambridge MA, is committed to transforming the lives of patients and their families by re-engineering the body’s immune response to defeat cancer. By combining expertise in materials science and immunology, Elicio is engineering potent vaccines and immuno-therapies for an array of aggressive cancers. Elicio was founded to expand and apply the ground-breaking Amphiphile technology invented and developed by Darrell Irvine Ph.D., Professor of Biological Engineering and Materials Sciences and Howard Hughes Investigator, in the Koch Institute of Cancer Research at the Massachusetts Institute of Technology. Elicio’s lead Amphiphile vaccines targeting pancreatic, colorectal and head and neck cancers will begin initial patient studies in 2020."
Ebb Therapeutics,https://www.crunchbase.com/organization/ebb-therapeutics,"Genetics, Health Care, Life Science, Medical, Medical Device, Therapeutics","Ebb Therapeutics develops regional cerebral thermal therapy (RCTT) device for use in insomnia and sleep disorders. It offers Ebb Insomnia Therapy, a drug-free insomnia therapy.  Eric Nofzinger founded Cereve in 2008 that later became Ebb Therapeutics. aIts headquarters in Pittsburgh in Pennsylvania."
Extend Fertility,https://www.crunchbase.com/organization/extend-fertility,"Health Care, Lifestyle",Extend Fertility offers premier egg freezing services in New York City. We’re the first service in the country to focus exclusively on women who want to proactively preserve their fertility options—and we believe these women deserve clinical excellence and a price that makes sense at this point in their lives.
Endel,https://www.crunchbase.com/organization/endel,"Mobile, Music, Personal Health, Productivity Tools, Smart Cities, Smart Home, Software Engineering","Endel is a cross-platform audio ecosystem. It creates personalized, sound-based, adaptive environments that help people focus and relax. They’re a small team of artists, developers, and scientists who have worked together on lots of digital projects, including the award-winning kids’ app series, BUBL. Endel is a 2018 Techstars Music Accelerator company."
EdgeTier,https://www.crunchbase.com/organization/edgetier,"Artificial Intelligence, Information Technology, Machine Learning, Software","EdgeTier deliver high-quality analytics products and services to our clients in the areas of customer service, customer simulation, and analytics services.  Customer service is changing. Customer expectations are rising. Faster response times, better service, faster time to resolution are basic expectations bundled with inbound requests. EdgeTier combine domain knowledge with specialist technical skills to deliver high-impact statistical insights, predictive models and data-driven business advice. Arthur is EdgeTier's automated agent assistant which works seamlessly with customer service agents to answer customer queries more efficiently and accurately, yet retaining a personal touch for every customer. Arthur uses cutting edge analytics, machine learning, automation, and artificial intelligence technology to generate personalised and accurate responses to every customer query. Customer contact centres using Arthur are seeing reductions in average handling times of up to 80% for inbound customer queries - get in touch with us now to see how Arthur can revolutionise your contact centre."
"Energetic Insurance, Inc.",https://www.crunchbase.com/organization/energetic-insurance-inc,"Analytics, Big Data, FinTech, Insurance, InsurTech, Renewable Energy, Risk Management, Solar","Energetic Insurance is a Managing General Underwriter (MGU) with a novel, data-driven approach to develop new risk management products to unlock exponential growth in the renewable energy industry. For solar industry participants who want to do more projects and deploy more capital, EneRate Credit Cover™ unlocks solar project financing for unrated and below investment grade counterparties by covering payment default risk.  EneRate Credit Cover™ and other insurance policies are issued by RE3 Energetic Insurance Solutions, LLC, a wholly owned subsidiary of Energetic Insurance, Inc.  Energetic Insurance complies with all state-mandated regulations for surplus line insurance brokers, and is licensed as a surplus lines broker in Massachusetts with License #: 2053916."
Eloxx,https://www.crunchbase.com/organization/eloxx,"Biotechnology, Genetics","Eloxx Pharmaceuticals, Ltd., based in Israel is a Pontifax portfolio company established in 2013 by Dr. Silvia Noiman, that serves as its Executive Chairman and Dr. Shmuel Tuvia. The company, is a biopharmaceutical company focused on discovery, development and commercialization of compounds for the treatment of genetic diseases caused by nonsense mutations including: Cystic fibrosis, Duchene Muscular Dystrophy, Usher syndrome, Ataxia-telangiectasia, Beta thalassemia, Tay-Sachs Hurler syndrome and many others. Eloxx Pharmaceuticals approach and knowhow allows moving rapidly from target drugs discovery program to clinical drug candidates. Building a robust pipeline of molecules designed for an array of nonsense genetic diseases. Translation of mRNA to a protein is the event where the cellular machinery, i.e. ribosome, ultimately dictates the quantity and timing for each protein to be produced. Thus, molecules that induce ribosomal readthrough overcome the nonsense mutations and allow production of a full-length functional protein. These molecules hold great therapeutic potential for the treatment of many genetic diseases."
Exclusive Group,https://www.crunchbase.com/organization/exclusive-group,"Computer, Information Technology, Network Security, Security","Exclusive Group ( www.exclusive-group.com) is the value-added services and technologies (VAST) group. As a distributor we help accelerate the global growth of innovative technologies. Our people are committed to the aggressive growth targets set by our vendors, there is a culture of ambition, entrepreneurship and a clear focus on sustainable growth. With more than 60 offices on five continents and presence in 100 countries, Exclusive Group brings together all the elements needed for sustainable growth. New markets and possibilities ""Disruptive Distribution"" is the core of the proposition. This through the Cybersecurity brand, Exclusive Networks, and the data center division, Bigtec. This can be complemented by comprehensive worldwide services available in the area of ​​implementation and support (ITEC), but also with financial services partners in leasing by Exclusive Capital."
EchoPixel,https://www.crunchbase.com/organization/echopixel,"Biotechnology, Health Care, Medical","EchoPixel, Inc. develops medical imaging devices. The company develops a non-invasive colon cancer screening solution that enables doctors and radiologists to use computed tomography (CT) images of a patient’s abdomen and display a 3D model of a patient’s colon. With this tool, any medical professional can examine the entire colon by using a navigate and detect approach to identify most polyps or other abnormalities, the cause of cancer. The company was incorporated in 2012 and is based in San Jose, California."
Ecube Labs,https://www.crunchbase.com/organization/ecube-labs,"Internet of Things, Real Time, Solar, Waste Management","Ecube Labs is a provider of smart waste management and logistics solutions that utilize IoT technologies. Our integrated line of products include solar-powered waste compacting bins (Clean CUBE), ultrasonic fill-level sensors (Clean CAP) that can be fitted to any type of container, and a data and predictive analytic SaaS platform (Clean City Networks, CCN). Ecube Labs helps cities and waste collection organizations reduce operational costs by eliminating unnecessary pick-ups, providing dynamic collection routes and schedules for a complete optimization of the collection operations. Our solutions also improve public cleanliness by reducing the impact of overflowing bins."
ENISA,https://www.crunchbase.com/organization/enisa-2,"Angel Investment, Energy, Finance, Health Care, Medical, Venture Capital","ENISA is a public company under the Ministry of Industry, Energy and Tourism, through the Directorate General of Industry and Small and medium-sized enterprises which, since 1982, actively participates in the financing of viable and innovative business projects."
Enview,https://www.crunchbase.com/organization/enview,"Analytics, Big Data, Computer Vision, Energy, Machine Learning","Enview is the world’s leading Automated Geospatial Analytics company. We exist to protect people, critical infrastructure, and enhance national security by transforming nation-scale 3D geospatial data sets into insights and actions. The Enview platform reveals what was previously invisible by fusing human and machine intelligence. We combine expertise in remote sensing, computer vision and geospatial big data to allow energy and government customers to see the invisible and use today’s data to predict future threats. Enview’s proprietary technology automatically calculates exact clearances between vegetation and power lines to prevent outages and wildfires, identifies potential human or environmental threats to pipelines, and assists government missions with fast and accurate 3D analytics."
EkAnek Networks,https://www.crunchbase.com/organization/ekanek-networks,"Financial Services, FinTech, Internet, Lifestyle","Ek Anek Networks is a new startup that is focused on building the ecosystem for new age brands in lifestyle categories. They will be creating influencer networks, commerce platforms and other support infrastructure. We are well funded by three top-tier Venture Capital firms and have runway for the next 2-3 years. The venture is led by Kartik Sheth and Chandranshu Sinha."
Exonar,https://www.crunchbase.com/organization/exonar-ltd,"Cyber Security, Information Services, Machine Learning, Software","Exonar is a software company that enables enterprise data to be better organised, de-risked & more productive. They enable organisations to better organise their information, removing risk and making it more productive and secure. To accomplish this they have assembled a leadership team who understand the regulatory and data challenges organisations face as a result they are able to rapidly innovate; adapting to and exceeding their client’s requirements. It is why FTSE 100, Big four consulting firms and household brand names choose to work with the small, fast-growing team at Exonar to deliver their critical projects. Exonar identifies documents containing passwords, customer and confidential information enabling successful governance, risk management, document retention, cyber security and compliance with forthcoming regulations such as GDPR - with ease."
Equinox Fitness,https://www.crunchbase.com/organization/equinox-fitness,"Fitness, Health Care, Lifestyle","Equinox operates 89 upscale, full-service clubs in New York, Los Angeles, San Francisco, Miami, Chicago, Boston, Dallas, Houston and Washington, DC, as well as international locations in London, Toronto and Vancouver. The company offers an integrated selection of Equinox-branded programs, services and products, including strength and cardio training, studio classes, personal training, spa services and products, apparel and food/juice bars."
Exeger Sweden AB,https://www.crunchbase.com/organization/exeger-sweden-ab,"Developer Tools, Energy, Solar","Exeger Sweden AB (formelry NLAB Solar) is singularly focused on the development and commercialization of new materials enhancing efficiency in solar cells. The company operates from Stockholm and Uppsala in Sweden in close contact with Uppsala University, the Royal Institute of Technology in Stockholm and the Solar Energy cluster of the Uppsala-Stockholm region."
Ecomdash,https://www.crunchbase.com/organization/ecomdash,"E-Commerce, Retail, Shipping, Supply Chain Management","Ecomdash is a software-as-a-service that automates backend operations for ecommerce sellers. Ecomdash streamlines and integrates omni-channel retailers’ inventory, sales orders, product listings and shipping processes across marketplaces like Amazon and eBay as well as ecommerce-ready website platforms like Shopify. Ecomdash gives merchants the ability to grow sales, save time, and increase customer satisfaction."
Expansion Therapeutics,https://www.crunchbase.com/organization/expansion-therapeutics,"Biotechnology, Health Care, Therapeutics",Expansion Therapeutics is a drug discovery and development company pursuing the vast potential of small molecule medicines for RNA-mediated diseases. 
Empiric Health,https://www.crunchbase.com/organization/empiric-health,"Health Care, Hospital, Medical","Empiric Health is a technology-enabled service platform that lowers cost and improves outcomes for health system customers through data-driven physician practice change. Empiric differentiates with a proprietary comparative analytics methodology and proven ability to change physician behavior, so that care providers can understand and optimize for high value, episodic care."
Exostar,https://www.crunchbase.com/organization/exostar,"Collaboration, Identity Management, Information Technology, Risk Management","Exostar is a leader in secure cloud-based solutions that improve collaboration, information sharing, and supply chain management for over 100,000 companies worldwide, including some of the largest players in aerospace and defense, life sciences, pharmaceuticals, and financial services.  Our secure, cloud-based, single-sign-on identity and access management platform and our multi-enterprise collaboration solutions allow users to connect once and access all their critical applications and information across the spectrum of partners and vendors they work with.  Exostar helps our customers utilize and protect their intellectual property, streamline the partner lifecycle, implement new engagements, and expedite all phases of their supply chain."
Everee,https://www.crunchbase.com/organization/everee,"FinTech, Information Technology, SaaS, Software","Everee, a fintech company, is humanizing and modernizing the Human Resources and Payroll experience for small businesses through a unique and innovative software platform.  Allow employees to pick their pay dates and don't worry, we do the rest.  No need for additional accounting and no need to change your cash flow cycle.  Empower your employees and drive efficiencies for your company now."
Experfy,https://www.crunchbase.com/organization/experfy,"Analytics, Artificial Intelligence, Big Data, Consulting, Crowdsourcing, EdTech, Machine Learning, Marketplace, Training","Incubated in Harvard Innovation Launch Lab and backed by Peter Diamandis, Experfy is a consulting and training platform for AI, big data and IoT with 30,000 data scientists.  To address an extreme scarcity of talent in this space, Experfy provides an on-demand marketplace, where some of the world’s most prestigious data science talent bids on consulting projects.  In addition, the same experts are engaged in developing training content focused on specific verticals and use-cases."
Edovo,https://www.crunchbase.com/organization/jail-education-solutions,"Analytics, Education, Knowledge Management","Jail Education Solutions provides intuitive educational courses where inmates are rewarded for learning. With their unique tablet technology, we help unlock the potential of millions of incarcerated people.  Edovo increases access to invaluable resources for individuals involved in the criminal justice system."
Ephemeral Tattoos,https://www.crunchbase.com/organization/ephemeral-solutions,"Biotechnology, Consumer, Fashion, Lifestyle, Retail",
EnergyHub,https://www.crunchbase.com/organization/energyhub-inc,"CleanTech, Cloud Computing, Energy, Energy Management","EnergyHub is the consumer face of the Smart Grid, helping home owners reduce energy consumption and save money. EnergyHub produces smart, simple, and cost-effective energy management tools that strengthen the relationship between consumers and utilities and solve the energy problems of today and tomorrow."
Electriq Power,https://www.crunchbase.com/organization/electriq-power,"Electronics, Energy Management, Energy Storage, Internet of Things, Renewable Energy, Solar","Electriq Power, a US-based company, has developed a premier smart home battery storage solution for homes and small businesses. Electriq helps homeowners harness the power of smart batteries to achieve a more renewable energy solution. You can currently find systems deployed across the United States, Puerto Rico, Canada and Mexico. Visit www.Electriqpower.com for more information or contact them directly at info@Electriqpower.com."
Eleven James,https://www.crunchbase.com/organization/eleven-james,"E-Commerce, Lifestyle, Retail Technology, Sharing Economy, Subscription Service","Eleven James is a membership brand that is introducing a modern luxury experience.  Through a subscription model, the company lets members select and wear the world’s most beautiful timepieces for a few months at a time, allowing them to discover, explore, and play in a world of luxury that has been restricted by the burdens of commitment and ownership. The company has pioneered a first-of-its-kind consignment channel for this asset class, creating a unique supply that reflects a diversity and depth of luxury timepieces unmatched and untapped by traditional wholesalers and retailers. "
Exotel,https://www.crunchbase.com/organization/exotel,"Cloud Data Services, Messaging, Mobile Apps","Exotel was started to solve a pain point – how do you manage calls and texts from customers on a single number without getting into the hassles of a full fledged call centre or having to be bound to a given phone? They started working on solving it for themselves. And as they started figuring out more, they saw a need for helping small businesses manage their inbound calls and messages over multiple phones. Soon, they had a virtual business phone system with features like voicemail, dialer, SMS keyword responder etc. It is secure, fault tolerant & performant. With Exotel, you can create highly interactive & intelligent voice and SMS flows within minutes. Exotel currently has over 500 small businesses using the product. If you'd like to find out more, you can click here http://bit.ly/1cymkV8"
