Organization Name,Organization Name URL,Categories,Full Description
FINCAD,https://www.crunchbase.com/organization/fincad,"Analytics, Information Technology, Internet, Risk Management, Software","FINCAD offers risk analytics and management software for valuations and pricing of derivatives, including swaps and options. It provides a wide range of news about financial technology and global financial markets and products such as F3s, analytic suites, and insights. The company offers solutions such as pricing and valuation, risk measurement, and hedge accounting for enterprises and the offices are located in Canada, U.S., U.K., and Ireland. FINCAD is a Canada-based company which was founded in 1990 by Bob Park."
Flaschenpost,https://www.crunchbase.com/organization/flaschenpost,"E-Commerce, Food and Beverage, Food Delivery, Food Processing","flaschenpost is a German company offering on-demand beverage delivery. The unique business model has been extremely successful; currently flaschenpost SE operates 10 hubs serving 9 major cities, and delivers more than 40,000 crates per day (as of Mach 2019). Thanks to an efficient routing algorithm and optimized logistics, flaschenpost delivers within 120 minutes of the order, right to the customer’s door."
Flourish Software,https://www.crunchbase.com/organization/flourish-software,"Cannabis, Management Information Systems, Supply Chain Management","Software platform for cannabis cultivators, manufacturers, and processors to track product from seed to sale, manage operations, and leverage advanced analytics."
FreeWire Technologies,https://www.crunchbase.com/organization/freewire-technologies,"B2B, Clean Energy, CleanTech, Energy Management, Energy Storage, Industrial, Renewable Energy","FreeWire Technologies provides smart battery systems for EV charging and mobile distributed power. It provides clean, quiet mobile power, and fast charging that’s available and easy to deploy. The company's products deliver power wherever and whenever users need it, without the added costs of construction or infrastructure upgrades. The company merges designs with convenient services to electrify industries formerly dependent on fossil fuels. FreeWire customers can tackle new applications and execute new business models without the complexity of upgrading traditional energy infrastructure. The company is backed by venture capital firms and global fortune 500 companies. FreeWire Technologies was founded on 2014 and is headquartered in San Leandro, California."
Firework,https://www.crunchbase.com/organization/firework-2461,"Computer, Software",
Finiata,https://www.crunchbase.com/organization/bezahlt,"Finance, Financial Services, FinTech, Payments, Social Entrepreneurship, Software","Finiata provides flexible financing to small companies and freelancers through a line of financing and factoring. They believe strongly in the scientific method, listening to customers, solving real problems, and doing the unscalable to find the scalable."
Folloze,https://www.crunchbase.com/organization/folloze,"Analytics, Content, Social Media","Folloze is a provider of an innovative Account Based Management (ABM) Sales Platform, which enables B2B sales teams to use marketing techniques to engage, develop and win their top target accounts. Built for scale, the platform allows Marketing to empower Sales to deliver account-specific content campaigns, content automation, actionable account analytics and more, all from within their familiar sales tools. These capabilities enable salespeople to act as consultants through the selling process, delivering significantly more value to customers and drastically increasing their sales pipelines.   Folloze is headquartered in Palo Alto, CA with a development center in Tel Aviv, Israel. Folloze was founded by a group of marketing, sales and technology veterans and is backed by world-class investors. The company has dozens of customers including fortune 500 companies. To learn more, and sign up for a trial, visit http://folloze.com."
Frichti,https://www.crunchbase.com/organization/frichti,"E-Commerce, Food and Beverage, Food Delivery","Frichti is for those who sometimes (or everyday) get tired of having nothing in the fridge when coming back from work, ordering the same sushi forever or even cooking when you did not feel like it. So imagine that together we hire a chef who makes us as soon as we want a good homemade dish or even finds us a good bottle of wine. This is Frichti's bet, allowing you to no longer break your head and make your meals not only the simplest thing in the world but also real moments of gluttony. It is an ""everyday caterer"" whose mission is to allow all those who want to eat well but do not have time to cook to do so. We have the taste of good products, the love of cooking well made and the desire to simplify the lives of our customers. Our distribution is 100% web (order on our site or on mobile)."
Funnel,https://www.crunchbase.com/organization/funnel-operations,"Advertising, Analytics, Big Data, Marketing, SaaS, Social Media Marketing, Software","All your marketing and advertising data where you want it. Funnel is here to put an end to manual data collection. Funnel integrates with all marketing and advertising platforms and allows you to feed your data anywhere you want it. Out-of-the-box integrations with 400+ data sources. With Funnel you will have the freedom to feed your data into any tool you like. Automatically feed data into your Business Intelligence tool, your Data Warehouse, Google Sheets, Google Data Studio, Google Analytics or any other visualization tool.  Funnel caters to e-commerce companies, media agencies, brands, b2b businesses, mobile apps, and gaming companies. Fredrik Skantze and Per Made founded it in 2014. Offices in Stockholm (HQ) and Boston."
Farmdrop,https://www.crunchbase.com/organization/farmdrop,"Food Delivery, GreenTech, Internet, Marketplace, Organic Food, Wine And Spirits","Farmdrop is the online ethical supermarket delivering locally procuded, organic groceries and ethical home essentials directly to your door. It brings tastier, healthier and more convenient food, all while supporting a more sustainable food system for everyone. By cutting out the middleman, Farmdrop pays a fairer price to producers, while customers get access to food which is up to five times fresher than what is sold by conventional supermarkets. Because your shop shouldn't cost the Earth."
Farasis Energy,https://www.crunchbase.com/organization/farasis-energy,"Battery, Manufacturing, Marketing","Farasis Energy develops and manufactures advanced lithium ion battery energy storage systems for the emerging transportation, grid, and commercial markets. Its products can be applied in a range of markets, including transportation, electric grid, and commercial and industrial vehicles. Farasis' mission is to commercialize world leading battery systems to enable a revolution in energy efficiency addressing the rapidly changing transportation, consumer electronics and power distribution markets."
figo,https://www.crunchbase.com/organization/figo,"Banking, Finance, FinTech, Personal Finance","figo aggregates financial sources from over 3,100 banks and financial institutions to enable innovative services. As Europe’s first “Banking­ Service ­Provider” figo is PSD2 ready! figo’s sophisticated platform ‘Banking­ as­ a­ Service’ connects modern services with more than 55 million online banking accounts in Germany and Austria. The company is targeting the Single Euro Payments Area (SEPA) in total. Furthermore figo has set up a new connectivity standard to financial data and reduces complexity of banking implementation to a minimum figo makes banking usable wherever it adds value and creates new touch points between consumers and their partners ­ startups and banks! figo realized the opportunities arising from PSD2 accompanied by changing customer expectations. figo does not only provide an established banking API, but also an entire banking service platform supporting a vast number of innovative banking solutions (incl. access to bank account)."
Finn AI,https://www.crunchbase.com/organization/finn-ai,"Artificial Intelligence, Banking, Financial Services, FinTech, SaaS, Software","Finn AI is an award-winning, AI-powered virtual assistant built for personal banking and finance. We put a personal banker in every bank customer’s pocket, helping them to manage their money wherever they are, whatever they need – via a simple, natural conversation. The Finn AI team of data scientists, engineers, and financial industry experts helps banks and credit unions transform customer engagement and increase financial literacy, while delivering the convenience and savings of a digital-first experience. Today we have successful public deployments in three languages with a growing global customer base that includes ATB Financial, Bank of Montreal (BMO), Banpro Grupo Promerica, and Commonwealth Bank."
FutureFuel.io,https://www.crunchbase.com/organization/futurefuel,"Financial Services, FinTech, Personal Finance","Crush your debt. Fuel your Future. Founded by ex-Googler, FutureFuel empowers employers to turn on benefits designed to crush student debt."
FILLD,https://www.crunchbase.com/organization/filld,"Apps, Oil and Gas, Service Industry, Transportation","Filld is a mobile refueling service, building a highly flexible, scalable, and fully mobile last mile infrastructure for vehicle refueling. Their nation’s current infrastructure for retail gas refueling is deteriorating, and there is no national infrastructure for EV charging or alternative energy refueling. Filld was founded in 2015 to build an end-to-end delivery platform and service that delivers the gas or alternative energy needed, directly to individual, commercial, fleet and enterprise vehicles — eliminating the need to ever stop for refueling again. Filld is the new last mile infrastructure for refueling vehicles. Today, Filld’s mission is to liberate drivers from the retail gas station. With roots in Silicon Valley and customers nationwide, Filld is bringing refueling into the future by safely delivering top-quality, double-filtered fuel directly to users’ vehicles at anytime, day or night. Filld’s safety-certified and commercial rated drivers currently serve motorists in multiple cities across the U.S. and Canada, and is expanding rapidly to meet demand."
First Circle,https://www.crunchbase.com/organization/first-circle,"Business Development, FinTech, Small and Medium Businesses","First Circle exists to radically improve the course of opportunity for SMEs across South East Asia; to help business owners achieve growth beyond their wildest dreams; to expand their First Circle past their family and friends. They are creating great technology which allows us to bring together the best businesses. We provide them with the funding and support they need to grow for many years to come. They do this with a simple online account, advanced data analytics, dedicated customer success representatives, and a community of business owners complete with a host of useful resources."
Finhay,https://www.crunchbase.com/organization/finhay,"Financial Services, FinTech, Wealth Management",
Frontier Medicines,https://www.crunchbase.com/organization/frontier-medicines,"Biotechnology, Pharmaceutical",Frontier Medicines’ integrated approach leverages chemoproteomics and machine learning to accelerate the development of medicines that drug the “undruggable” protein targets that drive human disease.
FutureLearn,https://www.crunchbase.com/organization/future-learn,Education,"Enjoy learning for life with free, online courses from top UK and international universities. Sign up now for one of our first courses on www.futurelearn.com"
Filtered,https://www.crunchbase.com/organization/filtered,"Artificial Intelligence, E-Learning, Education, Enterprise Software, Human Resources, Internet, Machine Learning, Software, Test and Measurement, Training","The best content to the right people. There is so much content. You've bought some, you've created some and there's much more online. The world doesn't need more content. It needs the best content to get to the right people. Filtered does that."
Funderbeam,https://www.crunchbase.com/organization/funderbeam,"Analytics, Big Data, Business Intelligence, Crowdfunding, Market Research, Trading Platform","Funderbeam is the world's first primary and secondary marketplace for early-stage investments, secured by the blockchain. The company was founded in 2013 as a global data platform for startup companies."
Fabric Technologies,https://www.crunchbase.com/organization/fabric-insurance-agency,"Financial Services, Insurance, Life Insurance","We believe every family deserves a secure financial future. That’s why we’re building Fabric – a smarter way for new parents to get insured. Life insurance has become too complicated and expensive, and we’re here to change that."
Fetcher,https://www.crunchbase.com/organization/scout-technologies,"Artificial Intelligence, Employment, Recruiting","Fetcher's mission is to make it fast, easy and fun for organizations to find the right person, for the right job, at the right time. Fetcher helps companies find the candidates whose talents, interests, and experience best match the needs of the job and the culture of the team. Fetcher believes when the right person is in the right role, real magic happens. Fetcher was built to reduce the pain and expense of hiring so that organizations can focus their time on attracting talent and nurturing the growth and development of their people.  Fetcher is committed to investing in long-term partnerships with organizations who see talent as their greatest asset, and Fetcher creates the tools that empower their growth."
Fetchr,https://www.crunchbase.com/organization/fetchr,"Delivery Service, Information Technology, Logistics, Supply Chain Management","Fetchr helps local merchants and global brands build, launch and grow profitable eCommerce businesses with an easy to use proprietary shipping and logistics solution. With our app and a simple tap, we can locate your exact location allowing us to deliver packages to your phone faster and more efficiently. Fetchr solves the problem of no physical addresses in emerging markets."
Future,https://www.crunchbase.com/organization/future-fit,"Apps, Fitness","Future pairs you with one of the best coaches on Earth. They have trained pro athletes, Hollywood celebs, and thousands of working professionals."
Fitternity,https://www.crunchbase.com/organization/fitternity,"Fitness, Health Care, Wellness","Fitternity is India's largest online preventive healthcare platform that provides an integrated eco-system to help users start & sustain their fitness journey. It not only enables users to discover, experience and buy professional services (linked to exercise, health eating & overall lifestyle) but actually supports them to use these services effectively and meet their goals.  Currently integrated with a vast network of 12,000+ verified service partners including gyms, studios, personal trainers, dieticians, healthy food kitchens etc through technology we have powered over 3,00,000 customer transactions and aim to radicalise the way 65 Million urban Indians consume fitness."
Finexio,https://www.crunchbase.com/organization/finexio,"B2B, Information Services, Information Technology, Payments","Finexio is the smart B2B payment network.  The Finexio network eliminates commercial paper check spend by identifying and routing payments through a unique “network of closed loop networks”.  Payments on the Finexio rails are seamlessly pushed into a supplier’s bank accounts at fees substantially lower than prevailing commercial payment costs.   Finexio integrates into large payment aggregators, accounts payable automation, and procurement software platforms to enable them with a more efficient payment modality"
FabAlley,https://www.crunchbase.com/organization/faballey,"E-Commerce, Fashion, Lifestyle","FabAlley is the ultimate Indian fashion destination for fashion-forward, indie-chic girls. Founded in 2012, Tanvi Malik and Shivani Poddar started FabAlley as a highly curated accessories only store. In a few short months, FabAlley has grown to become the mecca of globally trendy apparel and accessories both, and all of them designed in-house!"
Fotolia,https://www.crunchbase.com/organization/fotolia,"Advertising, Mobile Apps, Photo Editing, Photography","Fotolia is an image bank that offers a crowdsourced library, which includes royalty-free images, vectors, illustrations and video footage clips.    It is a community of artists, graphic designers, and a list of well-known agencies that provide content for this image bank. It maintains an international team of moderators who validates the submitted content and ensures the quality of the images, vectors, illustrations, and video clips. The contributing artists receive a commission when the images, vectors, illustrations, and videos are purchased. All images offered on Fotolia are royalty-free and can be used for any design project or document with no time limits.    Fotolia provides its services across the span of the globe with websites in 15 languages and in 23 regions.    It was founded in 2005, based in New York City, U.S."
Front Range Biosciences,https://www.crunchbase.com/organization/front-range-biosciences,"Biotechnology, Cannabis, Life Science, Medical","CEO: Jon Vaught, PhD, Organic Chemistry, CU Boulder, 10 years biotech startup experience with 4 companies CSO: Chris Zalewski, PhD, Plant Biology, UC Davis, 20 years plant biotechnology experience COO: Nick Hofmeister, MBA, MIT, raised $250 million, co-founder 4 biotech companies Problem: Due to 60 years of prohibition, cannabis and hemp cultivators don’t have access to the bioscience tools that are used in modern agriculture. Cannabis and hemp growers are losing money due to disease, reduced yields, and un-differntiated product. Solution: Use known agricultural biotechnology (e.g., tissue culture, cryopreservation, analytical chemistry, genomics and marker assisted breeding) to improve yields, reduce disease, and create novel strains."
Freshtohome,https://www.crunchbase.com/organization/freshtohome,"Food and Beverage, Food Delivery, Online Portals","Freshtohome is an online retailer that sells a range of seafood and meat to its users. The website’s range of products include fish, poultry, mutton, steaks, and fillet. Fish consists of shell, freshwater, and marine. Furthermore, it enables suppliers to supply their seafood and meat to the website. Freshtohome was launched in 2015 by Shan Kadavil and is based in Bangalore."
Freebird,https://www.crunchbase.com/organization/freebird,"Leisure, Tourism, Transportation, Travel","Freebird is a first-of-its-kind mobile rebooking tool that empowers travelers to skip the line and instantly book a new ticket – on any airline at no additional cost – in the event of a flight cancellation, four-hour delay, or missed connection. Freebird provides travelers with instant notifications in the event of a flight disruption, and offers the ability to rebook in less than 30 seconds with only three taps on their mobile device."
Franklin Templeton Investments,https://www.crunchbase.com/organization/franklin-templeton-investments,"Hedge Funds, Professional Services, Wealth Management","Franklin Resources, Inc. is a global investment management organization known as Franklin Templeton Investments. They have an extensive global presence, including offices in 35 countries and clients in more than 150. Their common stock is listed on the New York Stock Exchange under the ticker symbol BEN and is included in the Standard & Poor’s 500:registered: Index. Franklin Resources Inc. NYSE: BEN is an investment firm originally founded in New York in 1947 as Franklin Distributors, Inc. It is listed on the NYSE under the ticker BEN as in Benjamin Franklin, whom founder Rupert Johnson, Sr. admired. In 1973 the headquarters moved from New York to San Mateo, California. The firm specializes in conservatively managed mutual funds. It offers products under the Franklin, Templeton, Mutual Series and Fiduciary brand names. Like other large investment companies, the firm offers a wide variety of funds but is traditionally best known for bond funds under the Franklin brand, international funds under the Templeton brand, and value funds under the Mutual Series brand."
Flirtey,https://www.crunchbase.com/organization/flirtey,"Delivery Service, Logistics, Robotics, Transportation","Flirtey’s mission is to save lives and improve lifestyles by making delivery instant for everyone.   Flirtey was the first company to conduct an FAA-approved drone delivery in the U.S., the first to perform a fully autonomous drone delivery to a home and the first to launch a commercial drone delivery service. The startup has worked with NASA, Johns Hopkins University of Medicine, Remote Area Medical, New Zealand Land Search & Rescue, Regional Emergency Medical Services Authority, Domino's, 7-Eleven and FedEx to conduct deliveries of medicine to rural healthcare clinics, ship-to-shore deliveries of medical samples, and deliveries of retail and ecommerce items to consumer homes. Flirtey also launched the first automated external defibrillator (AED) drone delivery service in the United States. Flirtey’s landmark achievements have been recognized by the Smithsonian National Air and Space Museum, which accepted a Flirtey delivery drone to join other iconic American aircraft, including the Space Shuttle Discovery and the Wright Flyer.  Notable Company Milestones: September 2018 – Conducted the first FAA-approved multi-drone delivery operation in the U.S.; a single Flirtey pilot simultaneously operated multiple Flirtey drones for the delivery of automated external defibrillators (AEDs) May 2018 – Accepted into the FAA and Department of Transportation’s highly-competitive UAS Integration Pilot Program to accelerate the safe integration of drones into the national airspace.  October 2017 – Announced a partnership to launch the first automated external defibrillator (AED) drone delivery service in the U.S. January 2017 – Raised $16 million in Series A funding from top Silicon Valley investors, including Menlo Ventures and Qualcomm Ventures. August 2016 – Launched the world’s first commercial pizza-by-drone delivery model in partnership with Domino’s in New Zealand. July 2016 – Conducted the first fully autonomous, FAA-approved drone delivery from a store to a home in partnership with 7-Eleven in the United States. June 2016 – Completed the first fully autonomous, FAA-approved ship-to-shore drone delivery in collaboration with Johns Hopkins. April 2016 – The Flirtey drone used to make the first FAA-approved delivery in the U.S. accepted into the Smithsonian’s National Air and Space Museum, alongside the Space Shuttle Discovery and the Wright Flyer. March 2016 – Conducted the first fully autonomous, FAA-approved urban drone delivery in the U.S. July 2015 – Completed the first FAA-approved drone delivery on U.S. soil in collaboration with NASA Langley Research Center. Summer 2015 – Graduated Y Combinator. 2013 – Founded as the first drone delivery service in the world."
Fiit,https://www.crunchbase.com/organization/fiit,"Fitness, Mobile, Mobile Apps, Wellness",Fiit offers a real-time performance feedback and live leader boards that allows users to challenge their friends from around the world.
FNA,https://www.crunchbase.com/organization/financial-network-analytics,"Analytics, Artificial Intelligence, Data Visualization, Enterprise Software, Fraud Detection, Payments, Risk Management, Simulation","FNA is a deep technology analytics company that offers financial system services. Its platform allows financial institutions to map and monitor complex financial networks and to simulate operational and financial risks. FNA’s clients include the world’s largest central banks, financial market infrastructures, and leading financial institutions.  The company is driven by a mission to make the financial system safer and more efficient and to play a pivotal role in the growing Artificial Intelligence and Machine Learning ecosystem, where FNA's engine powers use cases across a growing number of business domains. FNA was founded in 2013 and is based in London, England."
Fineway,https://www.crunchbase.com/organization/fineway,"Artificial Intelligence, Consumer, Travel",Fineway believes the future of travel is not search & compare but a delightful conversation to deliver trips that match your unique style & intents.That’s why they’re building an Artificial Intelligence powered by advanced statistics & deep learning methods to decode your travel DNA better than anyone else.
Faction,https://www.crunchbase.com/organization/faction,"IaaS, Information Services, Information Technology","Faction (formerly Peak), started in 2006 as an inspired, Cloud IAAS collective, populated by some of the most award-winning IT engineers and thought leaders in the cloud computing industry.  Determined to revolutionize a smarter, uncompromised way for IT pros to reliably work in the cloud, Faction is gaining rapid momentum and attracting impressive numbers of progressive, forward-thinking customers and channel partners nationwide – all undeterred in their shared pursuit of extreme performance, deep control and broad customization."
